Titolo,URL,Timestamp,User,(Testo Citato),TESTO,Costruttore,Modello,Brand,Interni,Esterni,Meccanica,Prestazioni,Consumi/Autonomia,Motore,Elettrico,Fuoristrada,Elettronica di Bordo,Manutenzione,Assistenza/Concessionari
Mercato europeo maggio 2006 - Fiat +551%!!!,https://www.bmwpassion.com/forum/threads/mercato-europeo-maggio-2006-fiat-55-1.26051/,2004-12-12 00:00:00,Twin Spark,"RossoCorsa ha scritto: Proprio ora ho letto su Auto addirittura che esce già in autunno in 500 esemplari?... rosso ritira l'ordine e aspetta la 8c!!!!!!!!!!!!!!!!!!!!!!!!!!!!!!!!!!!!! .....t pagherei la benza a vita.... ... La prendo sul serio sta cosa eh! "" RossoCorsa ha scritto: Proprio ora ho letto su Auto addirittura che esce già in autunno in 500 esemplari?... rosso ritira l'ordine e aspetta la 8c!!!!!!!!!!!!!!!!!!!!!!!!!!!!!!!!!!!!! .....t pagherei la benza a vita.... 'Proprio ora ho letto su Auto addirittura che esce già in autunno in 500 esemplari?'","L'Acea ha diffuso i dati provvisori sulle immatricolazioni di auto nel maggio 2006 che sono cresciute del 9 6% rispetto a maggio 2005. Ovviamente il dato è viziato dal ""pazzesco"" incremento del mercato Italiano ( +49 5% ) un effetto dello sciopero delle bisarche dell'anno scorso. Salito molto anche il mercato tedesco ( +8 7% in parte a causa di due giorni lavorativi in più ) . Ovviamente la crescita del mercato italiano si riflette sui numeri del Gruppo Fiat ( +55 1% ) con il marchio Fiat che cresce del 59 9% con una quota di mercato che passa dal 5 5 al 7 8%. Alfa Romeo sale del 41 2% e Lancia del 41 2%. Continua la discesa degli ""altri marchi"" del gruppo Fiat ( Ferrari e Maserati ) : -30%. Molto forte la crescita del Gruppo VW ( +12 7% ) sempre in testa alle vendite con una quota di mercato del 20 5%. Cresce in particolare il marchio Volkswagen ( +21 2% ) . In ordine di vendite PSA mostra una piccola discesa ( -0 3% ) salgono Ford ( +4 7% ) e GM ( +6 5% ) e scende Renault. Grossa crescita per il gruppo Toyota ( +22 3% ) con il marchio Lexus che raddoppia le vendite rispetto all'anno passato. La triade del lusso tedesca mostra la solita alternanza nelle posizioni: a maggio è in testa Mercedes ( +18 8% ) seguono BMW ( +10 8% ) e Audi ( +5 4% ) .http://www.autoblog.it/post/4168/mercato-europeo-maggio-2006-fiat-551#more ",,,,,,,,,,,,,,
Alzacristalli B T5,http://www.porschemania.it/discus/messages/10550/433499.html?1232893085,2009-01-25 12:54:00,gor1946,,Vedi su questo sito : http://www.356registry.com/techinfo/repair/window_regulator_repair.html,,,,,,,,,,,,,,
Ma la mazda 5?,https://forum.quattroruote.it/threads/ma-la-mazda-5.85727/,2014-01-29 00:00:00,melego73,,era talmente bella che non hanno avuto nemmeno il coraggio di prenderle aziendali A parte gli scherzi non so niente. ,,,,,,,,,,,,,,
SCROCIATEVI...DISINCROCIATEVI....,http://www.porschemania.it/discus/messages/634/110443.html?1114329338,2005-04-11 08:06:00,mac,,Complimenti Nino ! Mac,,,,,,,,,,,,,,
la batcaverna 635csi &co,https://www.bmwpassion.com/forum/threads/la-batcaverna-635csi-co.85405/page-88,2008-01-07 00:00:00,1998K,"'Secondo me invece fa molto ""understatement ammesso che per questo genere d'auto sia ammesso un tale termine... :wink:'",colpa di bat.... è solo colpa sua ,,,,,,,,,,,,,,
Navigatore tiguan,https://forum.quattroruote.it/threads/navigatore-tiguan.114633/page-2,2018-02-16 00:00:00,bergat,,TomTom. Il garmin ce l'ho sulla UP e sbaglia le strade è schizofrenico ,,,,,,,,,,,,,,
v40 d2 geartronic momentum : intellisafe ??sensus??,https://forum.quattroruote.it/threads/v40-d2-geartronic-momentum-intellisafe-sensus.106719/,2016-10-25 00:00:00,thooth,,"sarei prossimo all'acquisto di una v40 d2 momentum geartronic e sarei interessato al pacchetto intellisafe solo che sono indeciso se il pro o il sorround vista la spesa non esigua. mi chiedevo se prendendo il più completo ( che oltre al cruise adattivo ha la funzione ripartenza nel traffico o queue assist ) questo faceva esattamente quanto promesso se era fruibile per l'uso di tutti i giorni sulle nostre strade ( io percorro 80% autostrada e tangenziale per 100 km al giorno per percorso casa lavoro il resto statali e città ) non era troppo invasivo durante la guida quindi mi chiedevo per chi ce l'ha lo ha provato o mi vuole dare solo in suo parere cosa ne pensava. per quel che riguarda il sensus ero interessato ad avere il bluetooth e la possibilta della connessione internet ( senza modem interno ) utilizzando il wi fi del cellulare dei tre pacchetti qual'è il piuù indicato per le mie sesigenze. chiedo il vostro aiuto in quanto sul configuratore a parte le varie sigle non specifica nel dettaglio per ogni pacchetto cos a contiene p.s. impressioni sui consumi cambio automatico e affidabilita ? ? non vedo l'ora di ""dissipare"" tutti i miei dubbi per poter procedere con l'ordine grazie mille <img alt=""[​IMG]"" class=""bbCodeImage LbImage"" data-url=""http://www.volvoclub.it/forum/Smileys/smile/6_18_3[1].gif"" src=""http://www.volvoclub.it/forum/Smileys/smile/6_18_3[1].gif""/> <img alt=""[​IMG]"" class=""bbCodeImage LbImage"" data-url=""http://www.volvoclub.it/forum/Smileys/smile/6_18_3[1].gif"" src=""http://www.volvoclub.it/forum/Smileys/smile/6_18_3[1].gif""/>",,,,,,,,,,,,,,
Fiat Tipo 2016,https://www.autopareri.com/forums/topic/58449-fiat-tipo-2016?&page=90#comments,2015-10-08 19:56:47,RiRino,,Nuove foto ,,,,,,,,,,,,,,
Avvistata la prima 159 in autostrada,https://www.autopareri.com/forums/topic/16301-avvistata-la-prima-159-in-autostrada,2005-10-19 17:55:42,elsombrero,,Anch'io l'ho avistata. Ma dal benzinaio. C'era un venditore che mi ha fatto fare pure un giretto : ) Beh non ero cosi convinto quando ho visto le foto e le prime alfa 159 dal vivo. Specie quel cruscotto grigio chiaro non mi piace per niente ... Pero quella era di un marone scuro con interni neri. Rende molto molto meglio. Dentro è molto compatta. Fatta per la guida. se cerchi un' auto da famiglia non è questa. ( ma cè la croma ) Un passo molto in avanti per Alfa. Complimenti ,,,,,,,,,,,,,,
Info honda civic,https://forum.quattroruote.it/threads/info-honda-civic.115475/page-2,2018-03-27 00:00:00,Babilrob,,Igor elegance senza Navi con 36.000 non credo la venderesti a più di 14.000 a privato e forse sono stato anche largo... ,,,,,,,,,,,,,,
frizione saltellante,https://forum.quattroruote.it/threads/frizione-saltellante.116716/,2018-06-04 00:00:00,Suby01,'in quei casi mi accadde anche con altre aut proprio perl un uso intensivo in colonna o in salit andando adagio e con il motore molto caldo... ma come scrivi sono saltellamenti maggiormente pronunciati... quelli a cui mi riferisco sono tartagliamenti minimi a freddo e con tempo umido... la frizione mia ha quasi 160Mm... e mi soddisferebbe se potessi usare la mia legacy',Ancora ferma per i vetri ? certo che sei stato piuttosto sfigato con l'elettronica della tua che non credo differisca sensibilmente dalla mia... ,,,,,,,,,,,,,,
Preventivo Classe A che ne pensate???,https://forum.quattroruote.it/threads/preventivo-classe-a-che-ne-pensate.122277/page-3,2019-04-23 00:00:00,Divergent,,Ciumbia che prezzo... costa quasi meno una Classe C in rapporto. Però ci stà il rapporto sull'ML mi avevano scontato 11.000 perchè fine serie... Ma non ti conviene fare il finanziamento in banca e evitare di lasciare i tuoi soldi alla finanziaria MB ? ,,,,,,,,,,,,,,
Museo Alfa Romeo: finalmente il TAR ha respinto il vergognoso ricorso contro il vincolo.,https://forum.quattroruote.it/threads/museo-alfa-romeo-finalmente-il-tar-ha-respinto-il-vergognoso-ricorso-contro-il-vincolo.49441/page-2,2011-04-15 00:00:00,reu.c.cio,,Possano un giorno gli Agnelli pagare per tutto il male che hanno fatto a questo Paese razza di finti imprenditori sottospecie di affaristi senza scrupoli distruggono la Storia dell'Alfa in nome dei quattrini delle speculazioni edilizie...e soprattutto per l'invidia per la bile che hanno accumulato nel corso dei decenni paragonando la loro incapacità al genio dei grandi uomini che hanno lavorato ad Arese e al Portello ! ,,,,,,,,,,,,,,
STRANO RALLENTAMENTO IN SALITA: C3 1.1 BENZINA 2007,https://forum.quattroruote.it/threads/strano-rallentamento-in-salita-c3-1-1-benzina-2007.94202/,2015-02-17 00:00:00,quartas,,"Fai questa prova porta la macchina su strada piana e possibilmente poco trafficata e in quarta marcia raggiungi i 2000 giri. A questo punto schiaccia a fondo l'acceleratore come se dovessi sorpassare qualcuno davanti a te e vedi se succede la stessa cosa che hai descritto per l'autostrada. Il salire di giri del motore con poca progressione in velocità è indice di slittamento della frizione. Se le cose stanno così bisogna farla sostituire al più presto e nel frattempo ti consiglio la massima cautela nell'impego del motore sotto sforzo perché se si brucia il materiale d'attrito del disco frizione devi portare la C3 seduta stante da un meccanico. Il modo migliore di utilizzare un motore con una frizione che slitta sotto sforzo è di ""aiutarlo"" con il cambio scalando dolcemente le marce quando si rallenta ed evitando di premere a fondo l'acceleratore con le marce alte. Tienimi informato ! ",,,,,,,,,,,,,,
RECORD KM PERCORSI CON LE MERCEDES,https://forum.quattroruote.it/threads/record-km-percorsi-con-le-mercedes.88365/,2014-07-02 00:00:00,deinos,,Classe E 270 CDI anno 2003 km 400.000. Nessun guasto serio se non il BAS ( un sistema di testing dei freni ) a 125000 km sostituito in garanzia. Ancora la batteria originale. Molto soddisfatto. Non conosco bene l'assistenza Mercedes perché non ne ho avuto bisogno. ,,,,,,,,,,,,,,
Ford Ecosport 2018 1.0 EcoBooost. Sedile che si muove e rumori vari.,https://forum.quattroruote.it/threads/ford-ecosport-2018-1-0-ecobooost-sedile-che-si-muove-e-rumori-vari.117359/,2018-07-15 00:00:00,alfalele,,"Beh il sedile spero sia ""solo"" una guida del sedile non tirata perfettmente. Sul portellone devi vedere da dove arriva se ilpistoncino o le cerniere. Sui rumori immagino Schermo del Sync3 ? ",,,,,,,,,,,,,,
Chevrolet Corvette Stingray 2013,https://www.autopareri.com/forums/topic/50238-chevrolet-corvette-stingray-2013?&page=10#comments,2013-01-18 21:45:09,Regazzoni,,Sicuri che quello del kit z51 sia il nolder visto sulla vettura a Detroit ? Non sarà piuttosto quest'altro alettone più grande del nolder visto in un immagine leak di un paio di mesi fa ? Ciò detto il nolder può migliorare l'aerodinamica quanto vuole ( e ci mancherebbe che non servisse neppure a quello ) ma bastava poco per farlo molto ma molto meglio anche dal punto di vista estetico. A meno che come ho il sospetto non sia davvero un ripiego dell'ultimo minuto dovuto a problemi di portanza del posteriore. ,,,,,,,,,,,,,,
"Accertamento sintetico ""auto di lusso""",http://www.porschemania.it/discus/messages/22971/461261.html?1322474667,2011-06-02 14:48:00,gerri,,"Io non lavoro pi\xf9 per problemi di salute che ho avuto ma ho lavorato parecchio fino ad una decina di anni fa. Nel 2005 ho acquistato un GC 2 7 CRD e nel 2010 puntuale la verifica. Sono andato a parlare con il funzionario gli ho spiegato come avevo comprato l'auto e come vivo ( fattura ed estatti conto in mano ) e poi ci siamo cordialmente salutati. Ero tranquillo perch\xe8 non ho niente da nascondere e avevo scritto anche sul forum che sono controlli che fanno bene a fare. Qualche mese dopo mi \xe8 arrivato l'accertamento. Secondo il redditometro io avrei evaso imposte per 7.000 euro che con gli interessi erano arrivati a 9.500 pi\xf9 altri 9.000 di sanzioni il tutto ridotto a 11.000 se pagati subito. ( questo solo per il 2005 ) Essendo ""innocente"" ho chiesto un accertamento con adesione per poter dimostrare meglio che NON sono un evasore. C'\xe8 l'obbligo a questo punto di farsi assistere da un professionista che deve essere pagato. In Italia al contrario di tanti altri paesi democratici non esiste la presunzione d'innocenza e l'onere della difesa \xe8 a nostro carico. Ho portato tutti i documenti che potevo anche se non richiesti ma per loro non \xe8 possibile vivere come faccio io. Secondo loro io avrei altre entrate non dichiarate...ma non le ho e non posso dimostrare di non averle ma siccome non sono loro a dover dimostrare l'accusa non posso fare niente. IL REDDITOMETRO dice che per avere un auto del genere io dovrei anche avere una vita del genere. Perch\xe8 non \xe8 possibile rinunciare a cose per altre ? Come \xe8 finita: Dopo tre mesi di contrattazioni devo pagare in totale circa 6.000 euro in otto ""comode"" rate trimestrali. Su consiglio della dottoressa che mi ha assistito di un commercialista da me interpellato e di un commercialista che frequenta il forum jeep non ho fatto ricorso perch\xe8 come ha detto bene alfi c'\xe8 il rischio di pagare molto ma molto di pi\xf9. Quindi pur non essendo un evasore sto pagando per avere di nuovo la mia tranquillit\xe0... Questa non \xe8 lotta all'evasione...ci vorrebbero controlli pi\xf9 giusti e pene pi\xf9 severe ma \xe8 pi\xf9 comodo cos\xec...un bel redditometro che rende presunti evasori il 90% dei contribuenti. Come ho detto non lavoro pi\xf9 da parecchio ma se lavorassi ancora cercherei adesso di evadere il pi\xf9 possibile...almeno se devo pagare pago per qualcosa che ho commesso e non soltanto per non stare anni in ansia aspettando i vari gradi di ricorso.",,,,,,,,,,,,,,
1° Tagliando I10 1.1 gpl,https://forum.quattroruote.it/threads/1%C2%B0-tagliando-i10-1-1-gpl.35265/,2011-02-19 00:00:00,www.snowglobemania.com,'Ciao a tutt il primo a 15.000 Km ? 149.00 cosa ne pensate?????',dipende da cosa hanno cambiato.. Non sembra altissimo.. ,,,,,,,,,,,,,,
Pneumatici estivi XL o normali ?,https://forum.quattroruote.it/threads/pneumatici-estivi-xl-o-normali.108968/,2017-02-24 00:00:00,mil555,'Se posso avanzare un parere (teorico ti chiedo: di che vettura parliamo?',Parliamo di una Serie 1 ( f20 ) 118D X-drive ,,,,,,,,,,,,,,
Porsche Taycan arriva a settembre ma è già un successo - HDmotori.it,http://www.hdmotori.it/2019/03/08/porsche-taycan-elettrica-prenotazioni-data-uscita/,2019-03-08 06:43:00,Carlo Pissu,,C'è anche da dire che non ne producano quanto le 500 .,,,,,,,,,,,,,,
Fiat Punto EVO (Topic Ufficiale - 2009),https://www.autopareri.com/forums/topic/34839-fiat-punto-evo-topic-ufficiale-2009?&page=180#comments,2010-02-10 00:15:17,ciaolei,,Io l'ho ordinata il 23 dicembre...ancora nulla... ,,,,,,,,,,,,,,
pareri su toyota celica ts VS Seat Leon fr tdi,https://www.bmwpassion.com/forum/threads/pareri-su-toyota-celica-ts-vs-seat-leon-fr-tdi.43211/,2005-07-07 00:00:00,Amante-Audi,,Il celica esteticamente mi piace aggressiva e compatta come piace a me..Ho una mezza idea di comprarla usata e tenerla come seconda macchina da affiancare al bm.Un'altra macchina che non mi dispiace affatto è la seat leon fr tdi..sono due tipi di auto completamente differenti.. volevo avere un parere da chi conosce già queste macchine..gracias ,,,,,,,,,,,,,,
regalo 164 2.0 T.Spark,https://www.autopareri.com/forums/topic/17916-regalo-164-20-tspark?&page=3#comments,2006-01-10 15:05:40,Roby,,ma è ovvio ed è un tuo diritto sia che tu venda o non venda la macchina. Che si possa anzi si debba mantenere la classe dimerito conseguita negli anni è proprio l'abc delle assicurazioni. Mi domando come è possibile che ci siano assicuratori con una faccia tale da sostenere il contrario.... ,,,,,,,,,,,,,,
Seat D-Segment,https://www.bmwpassion.com/forum/threads/seat-d-segment.42183/,2005-01-31 00:00:00,TORRE,,Bozzetti ufficiali Seat. La presentano il prossimo anno. ,,,,,,,,,,,,,,
Il tuo sogno è possibile,http://www.porschemania.it/discus/messages/815/632291.html?1353936876,2012-11-26 08:51:00,alessmacc,,Soprattutto poi con i prezzi che sparano..vista in CP nuova 991 Carrera 4 a 138 mila Euro di listino con un po' di optional...bella per carit\xe0 ma sinceramente troppi vista poi la tenuta di valore nel tempo di queste nuove Porsche...i materiali impiegati soprattutto per gli interni non mi sono sembrati inoltre cos\xec pregiati ed esclusivi...,,,,,,,,,,,,,,
Nuovo motore benzina a iniezione diretta,https://forum.quattroruote.it/threads/nuovo-motore-benzina-a-iniezione-diretta.52919/page-2,2011-08-03 00:00:00,batisgrulla,,Oggi il concessionario mi ha detto che la mazda 2 con motore sky dovrebbe uscire da noi a settembre .... Voci di corridoio .... Mah voi ne sapete qualcosa ? ,,,,,,,,,,,,,,
Lancia Ypsilon 2011,https://www.autopareri.com/forums/topic/41885-lancia-ypsilon-2011?&page=19#comments,2011-02-15 15:10:28,T a u r u s,,infatti il twinair aspirato non e' previsto su seg.B per questioni di coppia... ci sara' successivamente nella variante con 140cv. ,,,,,,,,,,,,,,
Colonnina Fast Distributore TAP Ravenna RA Viale Europa 89,https://www.forumelettrico.it/forum/colonnina-fast-viale-europa-89-t5502-10.html?sid=c94f2e4747e4e9c3ecfd93b855c41e84&sid=c94f2e4747e4e9c3ecfd93b855c41e84,2019-05-02 13:30:00,gianni.ga,,perfetta anche al Lidl di Bologna.,,,,,,,,,,,,,,
[Mai Nate] Alfa Romeo,https://www.autopareri.com/forums/topic/30865-mai-nate-alfa-romeo?&page=132#comments,2018-09-24 11:54:31,lukka1982,,Chissà come sarebbe stata la 156 a tp come design e proporzioni intendo ! 🤔 Qualcuno ci prova ? P.S.: molto belli quei cerchi in lega ! ! ! Sbaglio nel credere che non siamo mai arrivati in commercio ? Comunque hanno un design molto in linea con le realizzazioni attuali... imho starebbero bene diamantati con fondo nero o brunito. ,,,,,,,,,,,,,,
Museo Alfa Romeo: finalmente il TAR ha respinto il vergognoso ricorso contro il vincolo.,https://forum.quattroruote.it/threads/museo-alfa-romeo-finalmente-il-tar-ha-respinto-il-vergognoso-ricorso-contro-il-vincolo.49441/page-279,2014-11-10 00:00:00,pilota54,"Il sotterraneo io l'ho visitato 2 volt quindi era aperto al pubblico. Le vetture poi al momento non sono dentro il muse quindi nel sotterraneo si può lavorare.... Non metto in dubbio ne la tua notizia ne la font sia chiaro. Ma proprio per questo non capisco. 1) anche per iniziare dei lavori in interrato serve una domanda d'inizio lavori e in questo caso più di una autorizzazione. Inoltre se i lavori hanno l'obiettivo della ristrutturazione total partendo dagli interrat non vedo perché iniziare senza darne pubblicità. Pilota5 dimm sbaglio ? 2) s come sostien le vetture sono state tutte spostat mi chiedo perché nessuno ha visto uscire bisarche su bisarche (o comunque tir) da quei luoghi. Penso sia un luogo abbastanza monitorat anche dagli Alfist e spostare 250 vetture non è cosa che si fa in un giorno. Inoltr gli interrati contenevano tante altre ricchezze : documentazioni preziosissim attrezzatur cimel la mega scritta Alfa Romeo del silo ricambi introvabil insomma un tesoro enorme. Ora tutta questa roba dove è ? 3) perché FCA non ritira il ricorso al vincolo ? ""Il sotterraneo io l'ho visitato 2 volt quindi era aperto al pubblico. Le vetture poi al momento non sono dentro il muse quindi nel sotterraneo si può lavorare.""",Non ho una risposta a questi dubbi. Che dire ? Il tempo ci dirà se le informazioni ricevute sono veritiere. Edit. sulla domanda 2 ho trovato ciò ( fonte datata 13/9/14 quindi coerente con quanto riferitomi ) . Le vetture ora dovrebbero trovarsi a Torino: http://www.autoingros.it/blog/Collezione-Storica-Alfa-fa-pit-stop-a-Torino ,,,,,,,,,,,,,,
[Mai Nate] Alfa Romeo,https://www.autopareri.com/forums/topic/30865-mai-nate-alfa-romeo?&page=146#comments,2019-04-09 07:37:47,lukka1982,,Già stato fatto qualche pagina indietro 😅 ,,,,,,,,,,,,,,
Affidabilità mazda,https://forum.quattroruote.it/threads/affidabilit%C3%A0-mazda.3566/page-11,2012-12-11 00:00:00,melego73,,guarda oggi o domani devo passare in officina per sistemare una cazzatina durante l'ultimo intervento degli iniettori. Mi infilo dentro ad una CX5 e controllo. Comunque ripeto il principio di funzionamento e' uguale. ,,,,,,,,,,,,,,
Museo Alfa Romeo: finalmente il TAR ha respinto il vergognoso ricorso contro il vincolo.,https://forum.quattroruote.it/threads/museo-alfa-romeo-finalmente-il-tar-ha-respinto-il-vergognoso-ricorso-contro-il-vincolo.49441/page-214,2013-09-30 00:00:00,automoto3,"'Ecco... Quando voglio rilassarmi con qualcosa di estremamente piacevole e inebriant vengo qui in ALFA e leggo (mentre la mente frenetica cerca di trasporre la lettura in realtà) questi bei momenti di grande passione ""egregiamente"" descritt sino ad essere quasi percettibili nella loro fisicit da GIAMPI.... :!: :!: :!: Bello... Davvero... :thumbup: :thumbup: :thumbup:'",Quotone a te e al mitico ( oramai ) Giampi ! ! E' proprio così :thumbup: :thumbup: ,,,,,,,,,,,,,,
Nuovo Jimny !?!?,https://forum.quattroruote.it/threads/nuovo-jimny.11585/,2009-09-06 00:00:00,ginxi,"'Ciao! Purtroppo niente di nuovo sotto il sole. Gli ultimi ""esempi"" del nuovo Jimny sono ancora questi: http://www.fotolog.com/teamsuzukisport/44780820 http://www.jimny.se/Future%20Jimny%203.jpg che sono di un concept che risale a svariati mesi (anni?) fa. A questo punto dubito che ci sara' un ""2010 model year dato che non ci sono foto o info di prototipi circolanti .... '",Il modello sarebbe molto bello. Se avesse le dimensioni del terios ed il prezzo del Jimny potrebbe avere successo. ,,,,,,,,,,,,,,
Alfa Romeo MiTo (Topic Ufficiale - 2008),https://www.autopareri.com/forums/topic/27704-alfa-romeo-mito-topic-ufficiale-2008?&page=105#comments,2008-03-19 17:26:13,Zyx,,Ma perchè non riesco a vedere il video del resp marketing sul blog ? ? ? ! ! ! UFFA ! ! ! ,,,,,,,,,,,,,,
Panda & gatto...,https://www.autopareri.com/forums/topic/21363-panda-gatto,2007-01-04 09:57:58,ISO-8707,,Mah dopo la dakar vogliono anche i poli ? ,,,,,,,,,,,,,,
Alfa Romeo 4C,https://forum.quattroruote.it/threads/alfa-romeo-4c.74909/page-112,2014-01-18 00:00:00,keyone,"Bel video molto interessante . Si vede chiaramente come a parità di velocità in curva e quindi tempo sul giro la 4C richieda un impegno di guida molto inferiore alle altre due . Infatti l'Alfa Romeo mantiene quasi sempre traiettorie lineari mentre la Cayman ma soprattutto la Toyota/Subaru è sempre di traverso e quindi in controsterzo . Può essere divertente per 5 minuti per chi lo sa far ma alla lunga avere sempre il retrotreno che tende a superare l'avantreno... La sportiva del biscione invece sembra seguire traiettorie ideali su binario e solo se provocata con modi spicci innesca un equilibrato derapage . Segno evidente che la messa a punto Alfa e il suo da alcuni criticato sottosterzo iniziale danno poi alla prova dei fatti ampie soddisfazioni anche il pilota sembra ridere molto divertito ed esprimere giudizi di apprezzamento... Pare quindi un'auto modernissima che può dare filo da torcere alle più blasonate sportive nelle competizioni. Visto il Dna di famiglia c'era forse da dubitarne :?: :lol: Saluti... bel vide che mostra il potenziale della 4c PS - che rombo! Solo faccio notare come il video mostri qualcosa di diverso dalle impressioni di guida pubblicate su Quattroruote di gennai (invito a riprendere la rivist in mano od a correre in edicola) ove da un confronto fra 4 Chaiman e Luto la tedesca - nonostante il peso - risulti la più piacevole e lineare da guidar con la 4c indicata dai collaudatori come ""affetta"" da un marcato sottosterzo... :? ""Bel video molto interessante . Si vede chiaramente come a parità di velocità in curva e quindi tempo sul giro la 4C richieda un impegno di guida molto inferiore alle altre due . Infatti l'Alfa Romeo mantiene quasi sempre traiettorie lineari mentre la Cayman ma soprattutto la Toyota/Subaru è sempre di traverso e quindi in controsterzo . Può essere divertente per 5 minuti per chi lo sa far ma alla lunga avere sempre il retrotreno che tende a superare l'avantreno... La sportiva del biscione invece sembra seguire traiettorie ideali su binario e solo se provocata con modi spicci innesca un equilibrato derapage . Segno evidente che la messa a punto Alfa e il suo da alcuni criticato sottosterzo iniziale danno poi alla prova dei fatti ampie soddisfazioni anche il pilota sembra ridere molto divertito ed esprimere giudizi di apprezzamento... Pare quindi un'auto modernissima che può dare filo da torcere alle più blasonate sportive nelle competizioni. Visto il Dna di famiglia c'era forse da dubitarne :?: :lol: Saluti""","Le due cose -voglio dire ""il marcato sottosterzo "" e il potenziale pistaiolo della 4C- sono solo apparentemente in contraddizione . L'auto infatti ha stabilità eccezionale lo notavano anche tutti e tre i piloti di 4R che le consente traiettorie pulite senza eccessive perdite di aderenza che alla fine sono le più utili in pista . Quindi può essere che chi sa contrastare il sottosterzo in entrata - secondo la rivista che ci ospita è sufficiente impostare la curva in rilascio - e non esagerare con l'acceleratore in uscita - e non è facile - come fa il collaudatore di Auto riesca ad essere più lineare ed efficace con la 4C che con Cayman e Subaru. D'altra parte le altre due forse nella guida normale appaiono più maneggevoli ad un guidatore ""normale"" su strada non aperta al traffico e lontano dai limiti fisici di tenuta come vengono raggiunti invece su circuito. Qui però ""il retrotreno granitico"" come scrive Quattroruote"" della 4C dovrebbe infondere una sicurezza superiore .Comunque l'ho scritto subito in ogni caso sarebbe una bella esperienza avere sotto il fondo schiena l'ultima sportiva del Biscione ! ",,,,,,,,,,,,,,
Audi Q2 2016,https://www.autopareri.com/forums/topic/60643-audi-q2-2016?&page=49#comments,2016-05-19 16:15:17,francomilano,,io non ci girerei molto attorno nera o grigia o blu o fucsia e' disarmatamene banale. Manco sembra un modello inedito. Prevedo parecchio lavoro x il Mkt ,,,,,,,,,,,,,,
Z4 Coupé VS Cayman S,http://www.porschemania.it/discus/messages/502416/155061.html?1161350817,2006-05-31 13:09:00,gio75,343 c ma al Nür si xe8 beccata quasi 3 secondi dal Caymano...,dove l'hai letto ? grazie.,,,,,,,,,,,,,,
