Titolo,URL,Timestamp,User,(Testo Citato),TESTO,Costruttore,Modello,Brand,Interni,Esterni,Meccanica,Prestazioni,Consumi/Autonomia,Motore,Elettrico,Fuoristrada,Elettronica di Bordo,Manutenzione,Assistenza/Concessionari
Scénic XMod - Topic Ufficiale,https://forum.quattroruote.it/threads/sc%C3%A9nic-xmod-topic-ufficiale.14456/page-11,2009-12-06 00:00:00,alino71,"""Buongiorno a tutti ...e innanzitutto complimenti per la precisione delle informazioni e la competenza dei giudizi. Mi sono appena iscritto al forum e vi faccio un po' di storia (sarò breve.. ) Dunqu dopo ampio studio ho deciso di cambiare la mia Focus SW TD del 200 che tuttora esibisce dignitosissimamente i suoi 208.000 k per una XMOD 1.5 dci 110 CV. Ieri mattina sono stato dal concessionari ho fatto il mio bel gir ho visto l'auto (bellissima :lol: ho aspettato un bel po' (sabato mattina - 1 sola persona disponibile :cry: ) e ho avuto il mio preventivo: Versione dynamiqu listino : ? 22.75 00 Bluetooth + PLug & Music: ? 21 00 Ruota normale: ? 9 00 Vernice metallizzata: ? 49 00 IPT: ? 18 00 TOTALE ? 23.72 00 SCONTO 14 % ? 3.18 55 EFFETTIVO ? 20.53 44 Considerazioni: 1. Ho chiesto il City Pack Plu ma il tipo mi ha detto che era disponibile solo sulla versione Luxe (poi per conto mio ho verificato che non è così ) 2. Lo sconto del 14 % è stato fatto perché mia mogli a cui sarà intestata l'aut è libero professionista (poi per conto mio ho trovato che lo sconto della convenzione Renault in questo caso è del 15 % ) 3. Non mi ha fatto alcuna offerta per la mia vecchia aut semplicemente ha detto che essendo del 2000 non rientra negli incentivi (Ma Renault non accettava la rottamazione di QUALSIASI auto ? ) In sostanza la sensazione è che il venditore non si sia sforzato più di tant e ch anche in base a quello che ho letto in questo foru potrei cercare di ottenere tra i 1.000 e i 1.500 euro di sconto ulteriore... Che ne pensate ? Qualche consiglio nella dialettica col prossimo venditore: lo sconto della convenzione toglie la possibilità di qualunque altro sconto o c'è comunque da argomentare ? Se non trov girando un po molto di megli mi potrebbe convenire aspettare il 2010 e il probabile rinnovo della rottamazione ( ma nel frattempo scade anche la convenzione)? :? :? Grazie a tutti in anticipo per l'aiuto """,a me x una x mode come quella che vuoi te senza metallizzato hanno offerto di una clio del 2001 circa 5000 ? compreso sconti ,,,,,,,,,,,,,,
Addebiti su conto corrente,https://forum.quattroruote.it/threads/addebiti-su-conto-corrente.111137/,2017-09-01 00:00:00,danielemelan,,Ciao anche a me hanno iniziato il mese scorso ad addebitare 9 euro al mese e hanno aumentato di qualche euro la rata mensile del finanziamento. Ho chiesto con una mail informazioni e sono in attesa. Alessio tu hai avuto qualche spiegazione ? Grazie ,,,,,,,,,,,,,,
luci nei fanali anteriori ACTYON,https://forum.quattroruote.it/threads/luci-nei-fanali-anteriori-actyon.20705/,2010-03-01 00:00:00,MARINA370,,Si purtroppo è già la seconda colta che faccio il cambio la prima volta il meccanico mi ha spennata... stavolata ho fatto da sola... Ancora grazie. ,,,,,,,,,,,,,,
Kia Sportage (Topic Ufficiale - 2010),https://www.autopareri.com/forums/topic/36943-kia-sportage-topic-ufficiale-2010?&page=371#comments,2011-03-24 11:54:22,tony6666,,vai nella discussione aftermarket x queste domande.... e chiedi all'esperto tipografo1971 ,,,,,,,,,,,,,,
Motore Cayman 2.9 PDK 987 VS Cayman 2.7  981 PDK,http://www.porschemania.it/discus/messages/502416/762791.html?1450461045,2015-12-18 17:15:00,replica,,Ciao Andrea io cerco un ottimo compromesso tra ( sound/ emozioni e Coppia ) = coinvolgimento piacere di guida: Utilizzando la vettura principalmente per il tragitto casa-ufficio e qualche giro tra i colli bolognesi per me le prestazioni del 2.9 sono gi\xe0 elevatissime tra tutor ed autovelox quindi \xe8 anche per questo motivo che sto dando cos\xec tanta importanza al sound non vorrei avere rimpianti a comperare una 987 2.9 anzich\xe9 una 981 2.7 ! ! L'estetica gli interni la linea aggiornata.. la metto in secondo piano :- ) ,,,,,,,,,,,,,,
Audi A6 2010 (Topic Ufficiale),https://www.autopareri.com/forums/topic/40881-audi-a6-2010-topic-ufficiale?&page=8#comments,2010-12-01 15:04:12,LucioFire,,a me non piace il posteriore ,,,,,,,,,,,,,,
BMW e90 320d vs AR 159 2.4Mj,https://www.bmwpassion.com/forum/threads/bmw-e90-320d-vs-ar-159-2-4mj.11301/page-2,2003-06-02 00:00:00,Gabri343,,Ma ke centra il prezzo si sà ke le BMW costano di + ! ! ! Allora nn le confrontate x niente e fate un confronto con le Honda x esempio ke nn costa un cavolo o la nuova Croma ! ! ! Ripeto ti stai arrampicando sugli specchi scivolosi ! ! ! Il fatto è ke siccome le prestazioni della 159 nn sono x niente eccellenti il 1.9Multijet sarebbe surclassato dalla 320d e allora mettete avanti addirittura il 2.4 ! ! ! ! Mma.....state messi male eh ! ! ! :exclaim: ,,,,,,,,,,,,,,
356 nuovo modello porsche,http://www.porschemania.it/discus/messages/815/568837.html?1309345048,2011-06-28 19:30:00,francof,,"So di essere molto tradizionalista ma detesto il ""vezzo"" di chiamare una macchina con lo stesso nome o sigla di un modello passato. La 356 \xe8 la 356 punto e basta ! . Franco.",,,,,,,,,,,,,,
Ricarica batteria Smart EQ dura 12 ore con Box station,https://www.forumelettrico.it/forum/ricarica-batteria-smart-eq-t5557-10.html?sid=0ab76676df0dbb5d6e40aa15363976e4&sid=0ab76676df0dbb5d6e40aa15363976e4,2019-05-07 11:56:00,selidori,'https://www.e-station.it/scheda-auto-elettrica/smart-fortwo-e-d-22-kwSe carica a 20/22 una batteria da 17 non capisco perché indipendentemente da eventuali cali dovrebbe metterci più di 1 ora...tra L altro il caricatore è raffreddato a liquido...',Ma dai i dati di 22 sappiamo sono di targa.Le stesse colonnine spesso non erogano a 22 ma a valori tipo 18 ( ecco perchè alla fine ( ovviamente solo per zoe ) conviene comunque usare le fast da 43 per caricare effettivamente a 22 rispetto alle normali pole che appunto si mangiano qualcosa ) ) .Ecco questo è un aspetto interessante. Sappiamo che le zoe caricano effettivamente a 22 ( almeno le vecchie 43 AC ) mentre le altre ( DC ) che paventano quei numeri solitamente non arrivano neppure a toccarli ( quindi non si vede 50 su Leaf non si vede 75 su Kona ecc ) . Mi piacerebbe sapere se il mitico caricabatterie delle Smart riesce effettivamente a prelevare 22 ( come detto probabilmente solo sulle fast ) .,,,,,,,,,,,,,,
Alfa Romeo Giulia Quadrifoglio 2016,https://www.autopareri.com/forums/topic/58587-alfa-romeo-giulia-quadrifoglio-2016?&page=52#comments,2015-06-25 10:02:43,geo,,Ti assicuro che ci sono Alfisti che all'epoca della 75 erano ben lontani dall'avere la patente e ora stanno sparando a zero sul nuovo prodotto. Ripeto pur non convincendomi appieno esteticamente ( ma voglio vederla dal vivo ) e pur non standomi molto simpatico Marchionne approvo la sua volontà di guadare verso i mercati esteri. ,,,,,,,,,,,,,,
Renault clio 3 primo tagliando,https://www.autopareri.com/forums/topic/38866-renault-clio-3-primo-tagliando,2010-07-30 16:29:51,TonyH,,Occhio che ha anche una scandenza temporale va fatto ogni tot. km oppure ogni 12 mesi indipendentemente dai km ,,,,,,,,,,,,,,
Honda Jazz: vale la pena comprarla?,https://forum.quattroruote.it/threads/honda-jazz-vale-la-pena-comprarla.116503/,2018-05-12 00:00:00,KTMBat21,,L'Honda Jazz era una delle mie papabili alla sostituzione ver vecchiaia della fida Hyundai Accent 1.3 HS ( del 1996 ) ma stanti gli innumerevoli sali/scendi del mio entroterra e salite di oltre 30° che a volte si presentano ...mi è stata sconsigliata in quanto mezzo ( per distribuzione della potenza e coppia ) più indicato in zone pianeggianti Per il resto da abitabilità/consumi/rifiniture & Co. ne avevo SOLO sentito parlar bene ! ,,,,,,,,,,,,,,
Mercato piloti 2019,https://forum.quattroruote.it/threads/mercato-piloti-2019.117799/page-25,2018-11-28 00:00:00,ubaldo94,'Contentissimo anche io per Kubic che mi è sempre piaciuto tecnicamente e umanamente. Speriamo possa avere qualche occasione di mettersi in mostr alla guida della Williams attuale purtroppo non sarà facile.',non è che uno come Kubica potesse ambire chissà a che cosa...non giovane un bel pezzo fuori dal giro vero una menomazione importante solo un TP molto avventato potrebbe prenderlo in un top team ,,,,,,,,,,,,,,
Lamborghini Reventon,https://www.bmwpassion.com/forum/threads/lamborghini-reventon.49027/page-2,2007-03-10 00:00:00,Manuel333,,"sto meglio grazie... se vai nel ""mio"" thread leggi le ultime novità ! ",,,,,,,,,,,,,,
Porsche: il servizio di ricarica per auto ibride ed elettriche presto anche in Italia - HDmotori.it,http://www.hdmotori.it/2019/02/05/porsche-charging-service-ricarica-auto-ibride-ev/,2019-02-05 04:50:00,Maurizio Mugelli,,posso capire fra Case in competizione ma perche' Porsche e VW usano reti di stazioni di ricarica diverse ? ,,,,,,,,,,,,,,
Mazda MX-5 2015,https://www.autopareri.com/forums/topic/56165-mazda-mx-5-2015?&page=115#comments,2015-04-02 20:24:19,alederme,,Posteresti qui il listino ufficiale se riesci ? Io ho una Brera se entro su mx5italia mi si spegne il PC ,,,,,,,,,,,,,,
Ordinata Ypsilon!,https://www.autopareri.com/forums/topic/4355-ordinata-ypsilon,2004-01-27 20:09:06,Betha23,,Si mio padre è un Dirigente Fiat-Lancia in pensione........... ,,,,,,,,,,,,,,
Ecco la Alfa Romeo 169!,https://www.bmwpassion.com/forum/threads/ecco-la-alfa-romeo-169.35814/,2003-05-23 00:00:00,El Nino,,http://www.autoblog.nl/archive/2007/02/14/lekkerrr-spyshots-van-de-alfa-romeo-169 ,,,,,,,,,,,,,,
Nissan Micra (Topic Ufficiale - 2010),https://www.autopareri.com/forums/topic/37351-nissan-micra-topic-ufficiale-2010?&page=4#comments,2010-03-03 21:27:52,Davideg87,,mah la trovo banale e scontata...è finita l'originalità della prima serie... ,,,,,,,,,,,,,,
Renault Clio III Facelift (Topic Ufficiale - 2008),https://www.autopareri.com/forums/topic/32353-renault-clio-iii-facelift-topic-ufficiale-2008?&page=22#comments,2009-09-21 06:34:45,spadino29,,Qualcuno sa qual è il colore della Clio delle prime due foto in prima pagina ? ,,,,,,,,,,,,,,
Domanda dimensione filtro olio,https://forum.quattroruote.it/threads/domanda-dimensione-filtro-olio.118786/,2018-10-08 00:00:00,renatom,"""Nonostante le parole del ricambista ero dubbioso.. e leggendo le vostre risposte direi che avete confermato le mie preoccupazioni motivo per cui credo sia meglio non avere problemi e procurarmene uno della dimensione solita. Nonostante l'intasamento forse sarebbe potuto non essere un problema (cambio olio ogni 10-12 mila km meglio non andarsela a cercare. Vi ringrazio per le vostre risposte!""",Bisognerebbe andare a vedere se la superficie filtrante è la stessa ma chi te lo dice. Altrimenti probabilmente non succede niente lo stesds ma ti rimane il dubbio. ,,,,,,,,,,,,,,
Lancia Lybra Intensa,https://www.autopareri.com/forums/topic/15146-lancia-lybra-intensa,2005-09-03 04:57:35,Prestige,,molto bella si trovano usati a prezzi interessanti. Peccato per i cerchi ,,,,,,,,,,,,,,
CICALINO CINTURE PROBABILE ROTTURA SENSORE!! sportback 1800,https://forum.quattroruote.it/threads/cicalino-cinture-probabile-rottura-sensore-sportback-1800.14941/,2009-10-20 00:00:00,roby712,,come detto nel titolo gia ieri me lo faceva quando sterzavo o facevo una curva veloce da stamattina ogni tanto suona anche sul dritto ovviamente a cintura ben allacciata vediamo se in settimana riesco a passare in mitsubishi x risolvere questo problemino vi terrò aggiornati ,,,,,,,,,,,,,,
Strutture Antincastro - Compatibilità con altri mezzi,https://www.autopareri.com/forums/topic/42451-strutture-antincastro-compatibilit%C3%A0-con-altri-mezzi?&page=4#comments,2013-11-02 14:41:51,EC2277,,Rinforzando anche le estremità ed estendendo tali barre anti-intrusione anche ai lati del rimorchio. ,,,,,,,,,,,,,,
Mondiale F.1 2019 - GP del Bahrain,https://forum.quattroruote.it/threads/mondiale-f-1-2019-gp-del-bahrain.121875/page-19,2019-04-02 00:00:00,pilota54,,I team radio Leclerc-Box.......... https://www.circusf1.com/2019/04/gp-bahrain-f1-leclerc-ha-ignorato-il-team-order-ferrari.php ,,,,,,,,,,,,,,
Porsche Taycan: negli USA 3 anni di ricariche rapide incluse fino a 350 kW - HDmotori.it,http://www.hdmotori.it/2019/01/29/porsche-taycan-3-anni-ricariche-incluse-usa-350-kw/,2019-01-29 01:00:00,MatitaNera,,la ricarica da 4 minuti inizia a cambiare le cose...,,,,,,,,,,,,,,
A3 cabrio: eccola,https://www.bmwpassion.com/forum/threads/a3-cabrio-eccola.55497/,2004-05-18 00:00:00,dragone 320d,,,,,,,,,,,,,,,,
Mondiale F.1 - GP della Russia,https://forum.quattroruote.it/threads/mondiale-f-1-gp-della-russia.118571/page-9,2018-10-02 00:00:00,perdegola,"""E' esattamente cosi'. Non hanno le 4 ruote sterzant che sono vietate dal regolament ma sembrerebbe che abbiano implementato un sistema che in qualche modo le simula. Penso che siamo sempre al limite del regolamento in quanto mi pare di aver capito che hanno introdotto degli elementi idraulici che in qualche modo hanno degli effetti sull'assetto dell'auto (e quindi sull'altezz cosa che mi pare sia vietata)e in piu' c'e' un controllo (immagino elettronico) su differenzial brake by wire e funzioni motore per dare una certa direzionalita' al posteriore. Se confermato mi pare che si vada oltre il consentito.""",si però pare siano tutte chiacchiere niente di certo ,,,,,,,,,,,,,,
356 e Assicurazioni,http://www.porschemania.it/discus/messages/10550/5523.html?1034923014,2002-10-18 08:36:00,ker,,"Caro Paolo e Forum la 356 \xe8 l'unica auto che possiedo e anni addietro quando l'ho acquistata era stabilito negli accordi di famiglia che l'avrei utilizzata per le necessit\xe0 quotiudiane. Fortuna vuole che queste necessit\xe0 siano modeste mentre \xe8 forte il picere e l'emozione nel guidarLa . Sopattutto trovo terapeutico d'estate verso sera scaricare i nervi sulle strade dell'altipiano dietro la citt\xe0: poco traffico aria frasca ed un bel percorso misto di collina. Mi sono accorto che non sopporto di parcheggiare la Signora ( a quarant'anni essere ""Bimba"" o signorina \xe8 offensivo ) fuori dalla portata visiva. Assieme ad una cura costante a base di shampoo e cremine mi sono fatto preparare un vasetto di colore per piccoli ritocchi e comunque periodicamente passa visita dal meccanico ( ogni primavera ) e dal carrozziere ( con un po' meno frequenza ) . Un lampeggio rispettoso gianfranco",,,,,,,,,,,,,,
0-1000 mt. GT3,http://www.porschemania.it/discus/messages/492693/498010.html?1269778507,2010-03-02 11:38:00,salvatore,,pur' io ..,,,,,,,,,,,,,,
Nuova berlina 'ammiraglia' Alfa,https://forum.quattroruote.it/threads/nuova-berlina-ammiraglia-alfa.112352/page-4,2017-09-22 00:00:00,?angelo0,"""Be così sarebbe un'altra macchina. Vedrem il restyling della 4C secondo Automotive News è previsto per il 2021 (v. topic novità Fca in ZF).""",Fino allora saremo a vendite zero non lo capirannp mai... ,,,,,,,,,,,,,,
Nuova berlina 'ammiraglia' Alfa,https://forum.quattroruote.it/threads/nuova-berlina-ammiraglia-alfa.112352/page-4,2017-09-22 00:00:00,mani in alto,"'N per piacere n non devono snaturarla. So che molti (che probabilmente non ci sono mai saliti) chiedono un motore di cilindrata superior ma è solo per questione di volerlo ""più lungo"". Come puoi leggere nel mio post ""Resoconto di un'abbuffata Alfista qualche giorno fa l'ho guidata un bel po' la 4C. Posso dire che tutti quelli che ne erano al corso ne erano entusiasti. La descrizione migliore l'ho sentita da un signore di Merano (con forte accento tedesco): ha detto che ha notato che tutti quelli che scendevano dalla 4C avevano un grande sorriso... L'avevo già detto in altri post e lo ripeto: chi la prova ed è un minimo appassionato d'aut ti assicuro che potrebbe trovare anche degli interni fatti in cioccolato al latte e non se ne accorgerebb talmente l'esperienza di guida è coinvolgente. Poi si può discutere dell'opportunità di migliorare un po' la qualità percepita degli intern ma appesantirla sarebbe un delitto.'",Piuttosto che mettere un motore più grande o stravolgere la filosofia della vettura si potrebbe in occasione del restyling spremere 10/20 cv in più dal 1750 magari rendendo un pò più affilata l' erogazione. E se proprio si vuole cambiare qualcosa si faccia come Lotus dove ogni volta che presentano un nuova versione tolgono un pò di peso qua e un pò di cicca là arivando a far sparire una ventina di kg. ,,,,,,,,,,,,,,
Interessato alla nuova XE,https://forum.quattroruote.it/threads/interessato-alla-nuova-xe.98823/page-3,2016-03-09 00:00:00,Danilo Botti,,"Negativo ! ! ! Ho letto molti forum su audi e bmw e l'insoddisfazione in percentuale è bassissima esattamente come jaguar ma se pensi che hanno venduto milioni di macchine in più di jaguar fai due conti. Poi comunque l'idea di tenere un auto in cui la casa madre se ne frega altamente....beh mi rattristisce. Tutti bravi a vendere tutti fenomeni quando le cose vanno bene ma l'azienda seria esce quando nascono dei problemi...e te lo dice un titolare di un'azienda. 15 anni in Volvo alcuni problemi tutti risolti alla velocità della luce. Accetto mille problemi non accetto l'indifferenza di jaguar italia e l'incompetenza dell'officina della concessionaria. Il responsabile dell'officina che mi dice di non aver notato le vibrazioni sul retro dell'auto e poi scrive a jaguar italia di aver risolto togliendo un bullone vagante...mi dà fastidio. Scrivere per 4 giorni che la macchina sostitutiva non funziona e non avere risposte fa pena. Sentirsi rispondere: non sappiamo come.risolvere i problemi elettronici è deprimente. Vergognosi tanto loro quanto la casa madre quindi jaguar....fuori dai cogl..... ci.rimetto 15000 ? ma chissenefrega. L'alternativa è bmw serie 5 una vale l'altra. Mercedes no perché è da ""signori"" e io ""signore"" non sono ma di certo jaguar basta e avanza come esperienza... ",,,,,,,,,,,,,,
Alfa Romeo Giulietta (Topic Ufficiale - 2009),https://www.autopareri.com/forums/topic/36127-alfa-romeo-giulietta-topic-ufficiale-2009?&page=685#comments,2010-04-30 15:33:07,piedone71,,Scusate sono impedito volevo allegare direttamente l'immagine ma non mi riesce... :confused: ,,,,,,,,,,,,,,
Fiat 500X MY 2017,https://www.autopareri.com/forums/topic/62380-fiat-500x-my-2017?&page=288#comments,2017-04-13 09:09:14,gpat,,Sul sito FIAT risulta in promo la versione 1.4 Turbo GPL 120CV a 17950€ in allestimento base.. era ora. Per i prezzi ufficiali a listino ancora niente. ,,,,,,,,,,,,,,
MINI Countryman John Cooper Works M.Y. 2014,https://www.autopareri.com/forums/topic/46541-mini-countryman-john-cooper-works-my-2014,2012-02-29 20:27:58,J-Gian,,L'altro giorno ho avuto occasione di sedermi in una Countryman: sicuramente originale in molti particolari in abitacolo dettagli differenti rispetto a quelli delle altre auto ( vedi alzavetro ) . Mi è pure sembrato che vi sia abbastanza spazio per i posti dietro. Però con quello che costa potrebbe essere fatta decisamente meglio tanta originalità ma tanto plasticume che non mi restituiva ne idea di qualità ne tanto meno di robustezza. ,,,,,,,,,,,,,,
Fiat 500X MY 2017,https://www.autopareri.com/forums/topic/62380-fiat-500x-my-2017?&page=18#comments,2014-10-02 12:44:46,1happydream,,Certo che se avesse TCT e Metano/Gpl ,,,,,,,,,,,,,,
Mondiale F.1 - GP d'Austria 2018,https://forum.quattroruote.it/threads/mondiale-f-1-gp-daustria-2018.117190/page-8,2018-07-02 00:00:00,ALGEPA,"""concord è stata giusta la penalità.. quello che vorrei capire è perchè non sempre viene data? in Canada c'era gente che andava a 50 all'ora in rettilineo mentre arrivava Vettel e non è successo nulla.. l'anno scorso Hamilton a Silverstone con Grosjea ma anche lì di penalità non ce ne sono state.. si vede che qualcuno gode di immunità.. e a me la manovra di Vettel di domenica scorsa in partenza non era sembrata peggio di Bottas a Baku o Barcellona l'anno scorso... qualcuno mi aiuta a ricordare i provvedimenti presi contro il finlandese?""",Aggiungo che in Canada c'è stato anche l'episodio in Q1 con Ericsson e Ricciardo e secondo me li l'australiano ha fatto lo stesso errore che ha fatto Vettel sabato e non è stato sanzionato. Io bene bene non so come e se vengono formati i 3 giudici di gara che ad ogni gran premio giudicano i fatti a me sembra che non abbiano una grande preparazione e soprattutto cambiando ogni volta non hanno un metro di giudizio simile tra loro per me sarebbe giusto che siano gli stessi ad ogni GP anche aumentandoli di numero. ,,,,,,,,,,,,,,
Sua Maestà Aston Martin,https://www.bmwpassion.com/forum/threads/sua-maest%C3%A0-aston-martin.49061/,2007-02-09 00:00:00,KILLER QUEEN,,La Regina è ovviamente a Francoforte.Ecco qualche foto...http://www.autoblog.it/post/10135/francoforte-2007-aston-martin-v8-vantage-n400--http://www.autoblog.it/post/10138/francoforte-2007-aston-martin-db9-le-mans--http://www.autoblog.it/galleria/francoforte-2007-aston-martin-dbs/ ,,,,,,,,,,,,,,
Cambio dsg 7 a secco. Hanno risolto i problemi?,https://forum.quattroruote.it/threads/cambio-dsg-7-a-secco-hanno-risolto-i-problemi.112429/page-10,2018-09-22 00:00:00,fcava,,"Eccomi. Possessore di Altea XL 1.8T 160cv ( 250nm ) con DSG7 ( a secco quindi lavora al limite delle specifiche ) . A 35.000 km le frizioni hanno iniziato a slittare . Mio padre l'ha tirata fino a 60.000 km quando l'ha passata a me ( richiamo del cambio olio fatto a 50k ) . Subito cambiate le frizioni perchè mi giravano le scatole. Nonostante tutti gli interventi ( tranne cambio gomme ) fossero sempre stati fatti in seat ( anche il cambio di lampadine ) la casa non ci è venuta in contro con la correntezza. L'unica cosa visto che ho fatto parecchio casino mi hanno dato un buono di 100 euro. 50 erano già state spese per la diagnosi. Totale pagato 850 euro. Dopo un paio di mesi l'inserimento della 4a ha iniziato ad essere strano nel senso che i giri motore scendono di 1000 anzichè 600 e si sente un contraccolpo ( non sempre ) . Logicamente la concessionaria ha fatto finta di niente non rilevava niente. Ogni tanto anche su altre marce sembra un pelino più brusco. Per questi ed altri motivi ( consumo d'olio esagerato ma rientrante nei ""parametri"" vw ) a 90k km ho deciso di cambiare auto ( passerò alla 308 sw 1.2 EAT8 che mi porta altri vantaggi a livello economico ) . Il DQ200 aveva problemi di progettazione come le frizioni troppo sottoli ( quelle nuove sono cambiate e sono più spesse ) i sensori di giri delle marce posizionati su un supporto ed il sensore dell'albero di uscita su un'altro ( sul dsg6 sono tutti sullo stesso ed eventuali vibrazioni si compenano a quanto ne so ) sw stupido che aumenta le cambiate e fa lavorare troppo la seconda. Quello che mi ha indispettito di più però è stato che il gruppo VW in europa non ha intrapreso alcun azione per il DQ200 a differenza di america ed asia. Anzi... Sia Seat Italia che il concessionario seat mi hanno detto cche il dq200 non ha assolutamente alcun problema soprattutto quello seat perchè è ""diverso da tutti gli altri del gruppo volkswagen"" Comunque io non ho trovato informazioni a cambi diversi dal classico dq200 se sono a secco... Ed il dq200 ha ancora problemi http://www.vwgolfcommunity.com/vbul...72-Golf-7-Rumori-Problemi-DSG-7-Marce/page140 ",,,,,,,,,,,,,,
Alfa Romeo Giulietta Quadrifoglio Verde 2014,https://www.autopareri.com/forums/topic/54494-alfa-romeo-giulietta-quadrifoglio-verde-2014?&page=35#comments,2014-06-11 22:44:11,LucioFire,,scusate ma....se già la qv era un ottima vettura....come fa questa con motore migliore e vari affinamenti sia tecnici che non ad essere una merda ? ,,,,,,,,,,,,,,
Osservazioni sul Power Cruise Control per allargarne il bacino di utenza,https://www.forumelettrico.it/forum/osservazioni-sul-power-cruise-control-per-allargarne-il-bacino-di-utenza-t5095-50.html?sid=d0ecedc0b92cbd06a1d0bccba03c4c03&sid=d0ecedc0b92cbd06a1d0bccba03c4c03,2019-04-18 18:12:00,andbad,,Sono d'accordo. Questa incongruenza deriva dalla scelta di togliere la percentuale da tutte le parti ma lì evidentemente si sono scordati By ( t ) e,,,,,,,,,,,,,,
Kia Rio 2011,https://www.autopareri.com/forums/topic/41845-kia-rio-2011?&page=42#comments,2013-12-12 10:42:12,Andrea1983,,Ciao a tutti stò per acquistare una KIA rio 1.2 benzina cool trovo l'auto molto carina e per mia moglie credo sia l'ideale qualcuno sà dirmi se quest'auto dà dei problemi ? o se sono emersi difetti specifici del modello ? Grazie a tutti per il tempo che mi dedicherete. Andrea ,,,,,,,,,,,,,,
Buona settimana 19/2  25/2,https://forum.quattroruote.it/threads/buona-settimana-19-2-25-2.114997/page-2,2018-02-25 00:00:00,miranda453,,"Buona domenica piovosa e nevicosa e un saluto dalla bestia e da suo fratello. <img alt=""20180225_091033.jpg"" class=""bbCodeImage LbImage"" src=""https://forum.quattroruote.it/attachments/20180225_091033-jpg.6456/""/>",,,,,,,,,,,,,,
Primissima foto nuova GT3,http://www.porschemania.it/discus/messages/815/594267.html?1327221097,2012-01-22 09:31:00,tax72,Chissxe0 dove l'hai trovat ma GRAZIE! ,http://supercarteam.blogspot.com/2012/01/porsche-991-gt3-prime-foto-spia.html ,,,,,,,,,,,,,,
