Titolo,URL,Timestamp,User,(Testo Citato),TESTO,Costruttore,Modello,Brand,Interni,Esterni,Meccanica,Prestazioni,Consumi/Autonomia,Motore,Elettrico,Fuoristrada,Elettronica di Bordo,Manutenzione,Assistenza/Concessionari
Corsa D: tubicino QF e illuminazione strumentazione,https://forum.quattroruote.it/threads/corsa-d-tubicino-qf-e-illuminazione-strumentazione.118883/,2018-10-14 00:00:00,eighteenandlifenow@gmail.com,,Salve Ho una Corsa D del 2008 1.2 benzina Z12XEP 156.000 km. Ho trovato che un tubicino con etichetta QF di cui allego foto è spaccato. Di cosa si tratta ? Devo preoccuparmi ? Prima che ceda vorrei cambiarlo potrei fare da me ? Altro problema: l'illuminazione della strumentazione diventa molto fioca all'accensione dei fari anche solo le luci di posizione al punto che al buio si fa fatica a leggere. A fari spenti invece tutto normale ( per chi non lo sapesse la strumentazione dell'auto è sempre illuminata ) . A cosa può essere dovuto ? Grazie a tutti. ,,,,,,,,,,,,,,
Mazda MX-5 2015,https://www.autopareri.com/forums/topic/56165-mazda-mx-5-2015?&page=23#comments,2014-09-04 17:31:53,ILM4rcio,,Per quel che ne so io siamo dai 2 ai 6 miliardi di € ,,,,,,,,,,,,,,
Colonnina EVAD Fast Municipio Sant'Ilario d'Enza RE Piazzale Eugenio Curiel,https://www.forumelettrico.it/forum/topic1540.html?sid=9b3d6660a00250109c0902db2fb0b90b,"27/09/2017, 7:38",valca,,queste fast enel sono accessibili solo con tessera o anche applicazione enel e-go ? ? ? ,,,,,,,,,,,,,,
AFFIDABILITA' E SERVIZI KIA VENGA,https://forum.quattroruote.it/threads/affidabilita-e-servizi-kia-venga.67500/,2012-07-19 00:00:00,oolliivviioo,,Terza giornata dal ricovero dell'auto per rottura della pompa iniezione a 17000km della Kia Venga 1400 crdi ex... Per essere più breve accade che dopo le istruzioni di ieri e le odierne diverse ore di richeste e telefonate dal mattino al pomeriggio Europ Assistance mi darebbe l'auto ma a queste condizioni: 1 ) _per un solo giorno perchè sebbene il preventivo faxato del meccanico autorizzato Kia sia di 10 giorni E.A. deve chiedere prima il responso alla Kia... 2 ) _presentando una cauzione potrei ritirare un'auto ma solo all'aeroporto perchè ormai è tardi... ( come ieri ) . Lasciando perdere quanto sia disagievole arrivare all'areoporto e considerando che dovrò riportare l'auto dopo un solo giorno essendo convinto della lentezza Kia anche solo che a rispondere alla E.A. come sinora hanno fatto preferisco aspettare che almeno si convincano che l'auto è in panne da 3 giorni e ne sono previsti altri 10 ma chi scommetterebbe che basteranno grazie all'efficenza Kia ? Riguardo al servizio di garanzia ricambi si consideri che la pompa non si trova in Italia ma devono farsela arrivare dall'estero... Come si evolverà ? ,,,,,,,,,,,,,,
Museo Alfa Romeo: finalmente il TAR ha respinto il vergognoso ricorso contro il vincolo.,https://forum.quattroruote.it/threads/museo-alfa-romeo-finalmente-il-tar-ha-respinto-il-vergognoso-ricorso-contro-il-vincolo.49441/page-240,2014-02-19 00:00:00,fpaol68,"Riporto qui quanto segnalato dall'Alfa Club Milan uno dei più attivi nella difesa del Museo di Ares nella sua pagina Facebook: ""IMPORTANTE! La settimana scorsa Fiat ha chiesto la cancellazione del vincolo al Tar e chiesto l'esame d'urgenza. Le vetture a rischio non sono più nemmeno e nemmeno ma molte di più. I doppioni veri sono solo 2. Tutti gli Alfisti in massa dovrebbero chiedere a gran voce alla Regione Lombardia di NON modificare il Vincol preferiamo il Museo chiuso ma almeno completo. Solo una cosa non riusciamo a capire: come fa il Corriere della Sera sapere di questa nuova richiesta di cancellazione del Vincolo al Tar di Fiat quando il Ministero non era ancora a conoscenza? Ah è vero dimenticavamo: è il Corriere della Sera. Chiediamo a tutti gli Alfisti di rimanere uniti in questa battaglia che dura da quasi 5 anni:i gioielli della Collezione Alfa Romeo devono rimanere all'interno del Museo."" Dopo tre anni in cui fiat ha lasciato ""dormire"" il suo ricorso al Ta ricorso peraltro risibile nelle motivazion pare che ora invece abbia una gran fretta di farlo discutere nella speranza di ottenerne l'eliminazione.... In effetti qualcosa si è mosso http://www.giustizia-amministrativa.it/WEBY2K/DettaglioRicorso.asp?val=201101144 Adesso non ho tempo di verificare... a dopo 'Riporto qui quanto segnalato dall'Alfa Club Milan uno dei più attivi nella difesa del Museo di Ares nella sua pagina Facebook: ""IMPORTANTE! La settimana scorsa Fiat ha chiesto la cancellazione del vincolo al Tar e chiesto l'esame d'urgenza. Le vetture a rischio non sono più nemmeno e nemmeno ma molte di più. I doppioni veri sono solo 2. Tutti gli Alfisti in massa dovrebbero chiedere a gran voce alla Regione Lombardia di NON modificare il Vincol preferiamo il Museo chiuso ma almeno completo. Solo una cosa non riusciamo a capire: come fa il Corriere della Sera sapere di questa nuova richiesta di cancellazione del Vincolo al Tar di Fiat quando il Ministero non era ancora a conoscenza? Ah è vero dimenticavamo: è il Corriere della Sera. Chiediamo a tutti gli Alfisti di rimanere uniti in questa battaglia che dura da quasi 5 anni:i gioielli della Collezione Alfa Romeo devono rimanere all'interno del Museo."" Dopo tre anni in cui fiat ha lasciato ""dormire"" il suo ricorso al Ta ricorso peraltro risibile nelle motivazion pare che ora invece abbia una gran fretta di farlo discutere nella speranza di ottenerne l'eliminazione.'",Ho controllato. E' tutto vero fiat ha chiesto la procedura d'urgenza e la fissazione dell'udienza il 12/02/2014 che guarda caso è lo stesso giorno nel quale Il Corriere della Sera cartaceo come riportato anche giorni fa proprio in questo topic da Matteomatte annunciava la notizia. Sono dotati di doti divinatorie al Corriere evidentemente dal momento che conoscevano in anticipo le mosse di fiat ,,,,,,,,,,,,,,
[ALFA ROMEO] 159 Q-Tronic,https://www.autopareri.com/forums/topic/19447-alfa-romeo-159-q-tronic,2006-09-02 18:24:55,Arcy79,,"concordo.............l'unica cosa che non mi gusta è lo ""scalino"" in corrispondenza del cambio bisognava farlo a filo-tunnel ",,,,,,,,,,,,,,
Gallery  986 & 987,http://www.porschemania.it/discus/messages/502415/267399.html?1318244445,2008-06-03 00:34:00,sasaben,"SAS il caffe che ti devo ormai con gli interessi e' diventata una cena.va bene ""AL CUOCO DI BORDO"" ?",Ciao Beppe azz conosci il cuoco di bordo ? ci vado spesso. La tua proposta si sta bene ma sei mio ospite oppure si fa alla romana davvero non devi preoccuparti ci mancherebbe altro.,,,,,,,,,,,,,,
Fiat 500: nuovi modelli in arrivo?,https://forum.quattroruote.it/threads/fiat-500-nuovi-modelli-in-arrivo.117567/,2018-07-24 00:00:00,fake_plastic,"""Ciao nuovo utente e benvenuto tra noi. In questo schema c'è il Piano Industriale Fiat presentato il 1° giugno 2018 dall'ormai ex AD Sergio Marchionne (come saprai è grave in 'sicuramente qualche novità in termini di motorizzazione potrebbe arrivar ma in termini di styling e versioni mainstream non credo ci saranno grosse novità a breve ""La 500 oramai ha piu' di 10 anni e per un'auto sono tanti. Il nuovo modello dovrebbe arrivare tra un paio di ann mentre a breve potrebbero esserci novita' sulle motorizzazion con l'introduzione dei nuovi Fire-fly che gradualmente sostituiranno il Fire e il Twin-air (quest'ultimo e' gia' fuori produzione). Potrebbe sparire anche il 1.3mjt a causa delle sempre piu' restringenti norme antinquinament che rendono troppo costoso l'adeguamento di questa motorizzazione in rapporto al listino dei modello che lo montano. ""io la prenderei senza troppi pensieri. Resta un modello attuale e un riferimento nel suo segmento. Va bene con tutti i motori. Il 1.2 fire x il massimo risparmio. Del nuovo modello si sa ancora troppo poco. E con l'addio di MArchionne potrebbe succedere di tutto.""",Grazie mille per il benvenuto e per le tante informazioni ! Interessante la 500 BEV ma io in questo momento punto alla 3 porte benzina perché immagino che elettrica e ibrida saranno posizionate in fasce di prezzo leggermente più alte / di nicchia. Eventuali nuove motorizzazioni non sono un problema per me il 1.2 fire nella sua semplicità va benissimo per le mie esigenze. Diversamente mi dispiacerebbe un po' un cambio radicale di design della 3 porte a poco tempo dal mio eventuale acquisto sia per il deprezzamento che perché sarei certo che vorrei il modello nuovo... Come nuovo modello ti riferisci alla 500 BEV / ibrida o ti aspetti anche una revisione estetica totale della piccola a benzina attuale ? Infatti per il momento sono più orientato verso l'acquisto che l'attesa per un periodo indefinito. La ricerca continua... ,,,,,,,,,,,,,,
Mitsubishi Pajero Facelift 2014,https://www.autopareri.com/forums/topic/55760-mitsubishi-pajero-facelift-2014,2014-07-14 10:10:38,Touareg 2.5,,Anche se le precedenti espressioni del concetto ( vedi parte superiore bordeaux ed inferiore grigia ) imho erano ben più riuscite. ,,,,,,,,,,,,,,
CX-5 Benzina,https://forum.quattroruote.it/threads/cx-5-benzina.67674/page-2,2012-12-01 00:00:00,AVO75,,Ho letto ora del problema di qualche lettore di Mazda Club Italia se fosse vorrebbe dire che il DPF rimane e resterà per sempre una merda e questo non solo per mazda ma per tutti.......:- ( ,,,,,,,,,,,,,,
Jeep Renegade 2014,https://www.autopareri.com/forums/topic/56342-jeep-renegade-2014?&page=13#comments,2014-03-02 23:45:11,Regazzoni,,Ma quale ricostruzione ? E' semplicemente un'altra versione probabilmente la Limited. Sono tutte foto reali e ufficiali solo fatte uscire prima di quando dovevano da qualche testata o giornalista che magari passerà una pessima settimana. Sul sistema per il tetto apribile ci sono rumor da 2 o 3 giorni. In sostanza ci sarebbe un tetto apribile con pannelli rimovibili a mano dall'utente e riponibili nel bagagliaio. Quello che si vede nella foto della vettura rossa sembra essere proprio questo sistema. ,,,,,,,,,,,,,,
Fiat Freemont - Problemi  riscontrati e soluzioni,https://www.autopareri.com/forums/topic/44615-fiat-freemont-problemi-riscontrati-e-soluzioni?&page=45#comments,2012-01-30 11:38:03,MAX61,,OK. proverò a chiedere in officina grazie. ,,,,,,,,,,,,,,
Presentazione alla stampa Lexus IS,https://www.bmwpassion.com/forum/threads/presentazione-alla-stampa-lexus-is.9104/page-13,2004-11-14 00:00:00,mikharley,,ma come fun non so da dove cazzo è saltato fuori ,,,,,,,,,,,,,,
Mercedes-Benz GLE 2019,https://www.autopareri.com/forums/topic/65807-mercedes-benz-gle-2019?&page=5#comments,2018-12-19 20:48:28,Beckervdo,,Arriva la GLE 300d e GLE 400d. La prima è spinta dal 4 cilindri 2.0 litri biturbo diesel da 180 kW / 245 CV e 500 Nm. La seconda è spinta dal 6 cilindri in linea 3.0 litri BiTurbo Diesel da 243 kW / 330 CV e 700 Nm di coppia. La GLE 300d è Euro6d-TEMP ( 169-161 g/km ) mentre la GLE 400d è Euro 6d ( 199 - 184 g/km ) . I consumi della 300d sono di 6.4/6.1 litri / 100 km mentre la GLE 400d registra 7.5/7.0 litri / 100 km. ,,,,,,,,,,,,,,
I futuri benzina Alfa Romeo: TBi & V6 (Riassunto a Pag.1),https://www.autopareri.com/forums/topic/23873-i-futuri-benzina-alfa-romeo-tbi-v6-riassunto-a-pag1?&page=112#comments,2008-03-16 09:24:11,Danyxx82,,Arriveranno verso metà 2009 questi motore... per cui li monteranno sulla 169 restiling ? ? ? ,,,,,,,,,,,,,,
vibrazione strana qualcuno ha idee?,https://forum.quattroruote.it/threads/vibrazione-strana-qualcuno-ha-idee.79353/page-3,2018-02-13 00:00:00,ghighen64,,Salve a tutti pensavo che le cause automobilistiche in occasione dei vari restyling mettessero a posto anche certi difettucci che le prime versioni di solito manifestano. Invece sono qui a raccontare che la mia Skoda Fabia 1.2 TSI del 2014 dopo 4 anni e ben 20.000 km percorsi presenta lo stesso problema raccontato in questo Forum dai possessori di Fabia nell'ormai lontano 2009 ! ! Comunque circa 1 mese fa ho iniziato a notare un ticchettio metallico proveniente dalla parte destra del cruscotto zona airbag per intenderci e non sono riuscito a capire cosa poteva essere. Ovviamente ho tolto tutto quanto c'era nel cassettino e nei vari porta oggetti ma niente. In compenso da due giorni è iniziato un altro forte ticchettio dal montante destro dell'abitacolo. E non sono le cinture di sicurezza non è il sedile boh ! ! Qualcuno ha rumori analoghi e ha scoperto la causa ? ,,,,,,,,,,,,,,
OPEL KARL GPL,https://forum.quattroruote.it/threads/opel-karl-gpl.108532/,2017-02-01 00:00:00,MANGIO TANTO,,Salve mi rivolgo a chi ha comprato la versione a GPL come si trova con i consumi e con che sconto gli è stato riservato ..... pregi e difetti Grazie mille ,,,,,,,,,,,,,,
Ford Fiesta Facelift 2013,https://www.autopareri.com/forums/topic/48567-ford-fiesta-facelift-2013?&page=2#comments,2012-09-05 07:41:02,Walker,,Definizione perfetta. Non saprei classificarla meglio. Hanno stravolto esattamente la zona meglio riuscita della nuova Fiesta ossia un frontale sorridente e per nulla invasivo... ,,,,,,,,,,,,,,
Jeep Renegade 2014,https://www.autopareri.com/forums/topic/56342-jeep-renegade-2014?&page=219#comments,2014-11-29 22:04:50,PEC,,Non credo siano sufficienti 4 gomme da neve per non piantarsi. ,,,,,,,,,,,,,,
Regali di Natale per Porschisti,http://www.porschemania.it/discus/messages/815/799451.html?1483204903,2016-12-29 01:04:00,alessmacc,,Bella la 997 GT3 ben fatto...mi sembra fosse l'approdo desiderato da Luca sin da quando aveva venduto la 993TT...con parentesi intermedia per la 996 4S rossa spagnola di cui ricordo il bel racconto del viaggio con prole per andare a prenderla in Spagna e guidarla fino all'Italia...,,,,,,,,,,,,,,
Legge di stabilità..ecco perché Renzi si definisce rottamatore,https://www.bmwpassion.com/forum/threads/legge-di-stabilit%C3%A0-ecco-perch%C3%A9-renzi-si-definisce-rottamatore.243850/page-9,2008-01-16 00:00:00,giannimpower,,Tanto per l'Umbria ha già approvato l'aumento bollo per le ventennali. Che schifo ! Rimango dell'idea di andarme da questo paese. ,,,,,,,,,,,,,,
Albero a camme,https://www.bmwpassion.com/forum/threads/albero-a-camme.339450/,2005-01-31 00:00:00,Mauretto,,Ciao a tutti ... sono lauro qualcuno sa dove si trova il sensore albero a camme su una bmw e46cabrio 318 ci ? Grazie di cuore ,,,,,,,,,,,,,,
prossima audi tt rs,https://www.bmwpassion.com/forum/threads/prossima-audi-tt-rs.45586/,2007-02-20 00:00:00,*Niccolò*,"'mi permetto di dire che secondo me sei ""pazzo"" a lasciare il 335i per prendere la TT ovvio che devi fare quello che vuoi t ho solo detto come la vedo io :wink:'",ragazzi non si sa che sigla avra' ma e' una macchina da seguire e che fa molto golaper tanti motivial telaio superbo e leggero della nuova audi tt viene associato il mototre dell's3 con 5 cv in piu ( 270cv ) che gia sull's3 ha fatto si di porla sopra tutte le berlinette medie compresa 130i sotto tutti i punti di vista tranne che quello emozionale ( non derapa ) ma come tiene la strada lei.....in piu' sulla nuova tt andra' meglio ma non per i5 cv in piu' ma gia la tt pesera' almeno 70 kg in meno ( ho fatto un po di calcoli tra i pesi di quelle gia in listino e le a3 in listino ) grazie al telaio spaceframe....in piu' ragazzi per chi non l'ho ha notato la nuova tt e' largha 184cm..........quanto una carrera 4s o turbo piu di un sl di 350z nonche del mio 335 e con dei bei cerchi da 19 ( di serie avra' i 18 e la trazione integrale........beh sara' un arma micidiale..........considerando poi che e' pu bassa dell s3 avra' un cx migliore e poi ragazzi ha veramente dei begli internipoi i costi di gestione.....si consumera' sicuramente pero' paghi per un 2.0 ....e non coem nel mio caso per un 3.0 biturbopoi cmq avra' un buon valore di sicuro di piu' dell'ormai stanco 3.2e poi guarda caso ha gia' la rimappa bella pronta con 35 cv in piu' che gia c''e per la s3 che si e' fatto un amico mia e va una scheggiarullati su bancoo frenato 303cvmorale della favola.........ti porti a casa un 2.0 turbo con 300cv tenuta da carrera 4s ( anche se i pneumatici non saranno cosi generosi ) e macchina che non perdera' molto chiunque potra' mantenersi un 2.0........tranne il bollo....chissa se la faranno anche cabrio visto che finalmente la trasformazione da coupe' a carbio penalizza la vettura di 30 chili soltanto.... ( ho provato con una e 93 ed i due chili in piu' con partenza da fermo si sentono tutti ) allora si che uno non pensera' piu a 350z e z4 cuope sempre che all'0audi mantengano la stessa filosofia dei prezzi che hanno avuto con l's3.........ossia costare meno di mille euro in piu' del 3.2 se non sbagliosicuramente verra' non piu' di 45.000 euro che poi al solito vuoi i cerchi' da 19 il navy un pacchetto pelle lievita ma se uno aspetta e la prende aziendale o non ha permuta puo' portarla a casa al giusto prezzose poi metteranno anche il dsg che sulla s3 non e' disponibile salvati cielo diventa veramente una arma ammazza m3 e46 .....p.s.il 135 nemmeno lo considero per quanto e' brutto ,,,,,,,,,,,,,,
Quale potenza di ricarica domestica per Renault Zoe R90,https://www.forumelettrico.it/forum/ricarica-domestica-zoe-t5509-10.html?sid=14a8c09b991f194205898d1498c90738&sid=14a8c09b991f194205898d1498c90738,2019-05-07 16:16:00,marcober,,Io penso che proprio chi intende restare con i classici 3 3 kw di base avrebbe il massimo beneficio dall'usare una ZAPPY o altro prodotto che MODULA la potenza di carica in automatico.In questo modo si puo attaccare subito ( appena si rientra ) l'auto e si inizia gia a ripristinare autonomia magari a potenze ridotte nelle ore in cui si usa energia in casa..poi dopo le 22 i consumi calano e in automatico il carico aumenta.In tal caso EVR 1 che non modula non è ideale.C'è anche da dire che se si rcaricano tanti km al giorno..il consumo mensile eccede 220 kwh e dunque il piccolo vantaggio sulle accise che si ha nel tenere il conratto da 3 kw svanisce..e dunque il costo di saliere di potenza è di 25 euro/anno per ogni kw aggiunto..con possibilita di frazionare i mezzi kw..dunque magari val la pena lo stesso aumentare 0 5 o 1..la spesa è minima..,,,,,,,,,,,,,,
Nuovo Macanista... (forse!),http://www.porschemania.it/discus/messages/771175/724914.html?1430945290,2015-01-29 15:36:00,nothingbutgt3,,Nasdy guarda che non sto dicendo non sia un prodotto molto valido e non sto nemmeno dicendo che per qualche fortunato acquirente non possa essere amore a prima vista. La mia personale idea \xe8 quella sopra: con 75 pippi comprerei Range Sport a occhi chiusi e ti guardo ogni volta dall'alto in basso immerso in un salotto spazioso sontuosamente rifinito senza dover scegliere tra una miriade di optional all'atto dell'acquisto...e chi se ne frega se fai le curve pi\xf9 forte di mezzo secondo. Cio\xe8 in Porsche fanno i pulciosi con tutti quegli gli optional su ordini di auto da 100000 e passa euro...che classe ! Se il buon di si vede dal mattino...oggi solo Ferrari Lambo o GT3 usate. Ah gi\xe0 ma sapendo scegliere con gli optional giusti si riesce a risparmiare e fare comunque bella figura...vogliamo pensare sia questo l'approccio dell'acquirente standard di Porsche AG ? ,,,,,,,,,,,,,,
Lunghezza civic Honda ha toppato?,https://forum.quattroruote.it/threads/lunghezza-civic-honda-ha-toppato.111495/,2017-07-21 00:00:00,albelilly,,qui in Svizzera i posteggi sulle strade sono delimitati da strisce quindi che tu abbia una Smart o una Chevrolet Impala sempre all'interno dei limiti segnati ci devi stare altrimenti prendi la multa perciò in questo ambito la lunghezza poco conta. Anche i garage/box sono sempre molto ampi quindi anche qui nulla frenerebbe a portarsi a casa una Civic X però guarda caso anche qui le vendite latitano. Sarà mica che anche qui ( dove non mancano i concessionari e nemmeno le promozioni ) piaccia poco come in Italia ? Conta piuttosto l'idea ( giusta o sbagliata che sia ) che una segmento C 4 52 è troppo lunga. Punto. ,,,,,,,,,,,,,,
PROBLEMA STERZO SU DACIA SANDERO STEPWAY BRAVE TURBO GPL,https://forum.quattroruote.it/threads/problema-sterzo-su-dacia-sandero-stepway-brave-turbo-gpl.114596/,2018-10-13 00:00:00,Giovanni stepway 2017,,Mauro la recessione dell auto e i soldi indietro credo dico credo che non li potrai avere perché hai tempo fino ai 14 giorni per denunciare il recesso del auto... spero che mi sbaglio ,,,,,,,,,,,,,,
I futuri benzina Alfa Romeo: TBi & V6 (Riassunto a Pag.1),https://www.autopareri.com/forums/topic/23873-i-futuri-benzina-alfa-romeo-tbi-v6-riassunto-a-pag1?&page=161#comments,2009-01-16 16:12:54,TonyH,,Come amabile argomento di dissertazione tra un Gin-Tonic e un Mojito in luoghi di aggregazione sociale.... ,,,,,,,,,,,,,,
Consigli per gli acquisti ,http://www.porschemania.it/discus/messages/502416/838948.html?1547493686,2018-07-02 12:54:00,calimerus,,"Ciao a tutti Devo concludere in giornata l'ordine per una 718 la configurazione \xe8 questa: http://www.porsche-code.com/PJ6EQMR2 Volevo sapere dall'alto della vostra esperienza se sto grossolanamente dimenticando qualcosa e se si cosa ""sostituireste"" in questa configurazione. Il prezzo finale deve rimanere pressoch\xe8 quello. Le cose che non ho messo e per le quali ho i dubbi sono: Light design--> Serve a qualcosa ? Scarico sportivo--> Penso che oltre 2000 euro per fare rumore siano tantini per\xf2 ho messo i terminalini doppi per estetica. Mi sbaglio ? ( Messaggio modificato da calimerus il 02 luglio 2018 ) ",,,,,,,,,,,,,,
I difetti delle vostre Alfa Romeo,https://www.autopareri.com/forums/topic/25420-i-difetti-delle-vostre-alfa-romeo?&page=6#comments,2007-10-13 05:55:54,Touareg 2.5,,La GTA proveniva anche da pomigliano no ? ,,,,,,,,,,,,,,
Volkswagen T-ROC 2017,https://www.autopareri.com/forums/topic/63553-volkswagen-t-roc-2017?&page=3#comments,2017-08-23 10:11:13,Vadocomeundiavolo,,Presentazione in diretta streaming alle 20 dal lago di como. ,,,,,,,,,,,,,,
Comprare Dacia: realmente vantaggioso?,https://forum.quattroruote.it/threads/comprare-dacia-realmente-vantaggioso.75286/page-2,2013-03-01 00:00:00,fabiorosignoli,,"sisisi lo dico anche io la stessa tua identica cosa ! forse mi sono espresso.... in maniera poco trasparente ! ! ! ahahah ! Io ero interventuo perchè in qualche post si diceva che DI LISTINO fra la Dacia e una sua concorrente ""ballavano"" quasi 5.000 euro... ma la concorrente ha all'atto pratico uno sconto che la dacia non ha quindi i soldi di differenza sono molti meno tutto qui... volevo che emergesse questa cosa come che se la Dacia valuta un usato 3.000 euro e non fa sconti mentre Citroen valuta il tuo usato 6.500 che ti toglie dal SUO prezzo di listino non è che Citroen ti fa una valutazione doppia del tuo usato semplicemente ingloba nella quotazione lo sconto che ti farebbe anche se tu l'usato non lo avessi. Non so se mi sono spiegato... ",,,,,,,,,,,,,,
Mondiale F.1 - GP di Germania,https://forum.quattroruote.it/threads/mondiale-f-1-gp-di-germania.117475/page-7,2018-07-21 00:00:00,mani in alto,,Intanto notizia anche per l'Alfa Sauber che il prossimo WE terminerá lo sviluppo della vettura 2018 e partirá con lo sviluppo della 2019. Evidentemente in casa Sauber vogliono fare bene per la prossima stagione anche visti i risultati attuali e perché il prossimo anno potrebbero avere sotto contratto kimi. In ogni caso tutti i team dovranno riprogettare i telai perché nel 2019 ci saranno 5 kg in più di serbatoi da far entrare nel telaio. ,,,,,,,,,,,,,,
991.2 GT3 RS 4.2 ,http://www.porschemania.it/discus/messages/492693/776056.html?1485420097,2016-12-14 17:33:00,bulldog,,Sicuramente prezzi al rialzo Anche se dovranno prestare attenzione alla concorrenza in prima McLaren,,,,,,,,,,,,,,
Basta mi sono stancato: passo in Alfa,https://www.bmwpassion.com/forum/threads/basta-mi-sono-stancato-passo-in-alfa.26339/page-4,2004-11-22 00:00:00,Roger84,"""Mi orinterei per la più economic sia come bollo che costo d'acquist 9 JTD da 120cv che cmq come vettura non sarebbe affatto male per mia mamma venendo da una Uno 0l.""",Capito anche in quadrupla copia ! ! ,,,,,,,,,,,,,,
Nissan GT-R (Topic OT),https://www.autopareri.com/forums/topic/20978-nissan-gt-r-topic-ot?&page=42#comments,2007-10-29 10:14:01,Matteo B.,,2008 estate..o addirittura autunno..... ,,,,,,,,,,,,,,
Proposte (concrete) per salvare Lancia,https://forum.quattroruote.it/threads/proposte-concrete-per-salvare-lancia.110908/page-3,2017-07-27 00:00:00,Ex Batri,'S ma poi per gli altri modelli? Non si può fare tutta una gamma con le linee anche modernizzate della prima Delta. Diciamo che al fianco di una moderna Delta evergreen si dovrebbero trovare nuovi stilemi per le Lancia del futuro.',Si per l'effetto 500 mi riferisco solo a un'ipotetica nuova Delta e non certo al fenomeno delle 500 ingrassate e declinate nelle varie taglie... ,,,,,,,,,,,,,,
Fiat 500 M.Y. 2014,https://www.autopareri.com/forums/topic/26165-fiat-500-my-2014?&page=285#comments,2009-01-13 09:45:35,AndreaB,,"Problema: è un paio di settimane che sulla 5oo di mia sorella saltuariamente quando accende il quadro appare il msg ""Anomalia al servosterzo"" o qualcosa del genere e dura fino a quando non spegne e riaccende ( Windows docet ) : poi ritorna ad essere tutto ok... a detta sua x tutto il periodo in cui viene segnalato l'errore il servosterzo si comporta come se ci fosse il ""City"" attivato...... in questi gg dovrebbe andare in assistenza ma che può essere ? Un sensore ""ciucco"" causa freddo... ( la 5oo viene lasciata fuori ed è stata coperta di neve x diversi giorni ) .... ",,,,,,,,,,,,,,
