Titolo,URL,Timestamp,User,(Testo Citato),TESTO,Costruttore,Modello,Brand,Interni,Esterni,Meccanica,Prestazioni,Consumi/Autonomia,Motore,Elettrico,Fuoristrada,Elettronica di Bordo,Manutenzione,Assistenza/Concessionari
La Panda di Bravino... ah no la Bravo di Pandino,https://www.autopareri.com/forums/topic/58510-la-panda-di-bravino-ah-no-la-bravo-di-pandino?&page=3#comments,2015-06-01 11:47:26,Fabione90,,O sennò per qualcosa di più compatto e giovanile c'è la mito 1.4 120cv del 2008/09.. si è abbastanza svalutata ,,,,,,,,,,,,,,
Fusione bronzine,https://forum.quattroruote.it/threads/fusione-bronzine.111013/page-2,2017-06-24 00:00:00,arizona77,"'Conferm officine ""autorizzate BMW"" sono quelle annesse alle concessionarie Ed occorre stare attenti che non ci sia una revoca del mandato da parte della casa madre. A me è capitato con l'officina di una concessionaria FC quando ho portato la 500 c'erano i cartelli FIA al momento di pagare la fattura.. carta intestata senza dicitura FIAT Peraltr trovo sbagliato far conto sulla ""correntezza"" commerciale: mi sta bene pagare la manutenzione più del prezzo di mercato in cambio del ""diritto"" a veder riparati i guasti senza spese. A fronte dei soldi sborsati in più per i tagliand non mi va di dipendere dalla ""benevolenza"" dell'ispettor che decide arbitrariamente se e quanto devo pagare per i guasti (i prezzi di listino li decide la Cas quindi lo ""sconto"" 50 80 99% non ha riferimenti obiettivi)'",I soldi sborsati ( eventualmente ) in piu' sono dovuti a quel conce che applica costi maggiori di altri colleghi di marchio. Quelli di BMW non sono particolarmente costosi in assoluto. Basta comprarli prima almeno i primi 2. Poi una volta l' auto sia piu' stagionata stabilire in accettazione che lavori fare magari approfittando degli sconti fatti sui pezzi di piu' frequente sostituzione ,,,,,,,,,,,,,,
Fiat Freemont 2011,https://www.autopareri.com/forums/topic/41568-fiat-freemont-2011?&page=89#comments,2011-06-20 10:43:06,J-Gian,,Se volevi prendere un'auto di quella tipologia è una delle più convenienti sai che è tutt'altro guidare rispetto alla Bravo: sicuramente più confortevole ma anche molto più turistica decisamente meno agile e grossa da parcheggiare ,,,,,,,,,,,,,,
Mondiale F.1 - GP dell'Azerbaijan,https://forum.quattroruote.it/threads/mondiale-f-1-gp-dellazerbaijan.116225/page-22,2018-05-04 00:00:00,automoto3,,Spero che nessuno si offenda se torno magari in Topic dicendo che Ferrari è indagata ( da sabato scorso ) per diversi punti ( non si sa chi li abbia indicati ... ) che riguardano: eventuale iper consumo olio ( rif. alle fumate bianche ) terzo paddle sul volante uso del turbocompressore + mgu-H in fase di taglio dei clindri per ottenere aria compressa ( anche dagli stessi cilindri ) da inviare all'ala e altre direzioni sotto e direttamente collegato a questo una probabile extra produzione di energia elettrica sia come stoccaggio fisico che come utilizzo sul giro. Tutti questi punti fin'ora sono stati trovati regolari. ,,,,,,,,,,,,,,
Kia Sportage (Topic Ufficiale - 2010),https://www.autopareri.com/forums/topic/36943-kia-sportage-topic-ufficiale-2010?&page=194#comments,2011-02-13 21:57:59,diablo700,,no Tony : anche quello è manuale nel senso che prima di scendere devi chiuderlo te ! ,,,,,,,,,,,,,,
Dipositivi di Illuminazione,https://www.autopareri.com/forums/topic/25082-dipositivi-di-illuminazione?&page=24#comments,2013-06-13 07:53:23,accul,,Su y non sono disattivabili neanche dal menu non esiste la possibilità ,,,,,,,,,,,,,,
Lamborghini Aventador LP 700-4 Roadster 2013,https://www.autopareri.com/forums/topic/49501-lamborghini-aventador-lp-700-4-roadster-2013?&page=6#comments,2012-11-14 11:37:55,Merak,,Ma voi ve li vedete i rampolli degli sceicchi che nel bel mezzo dello sboroneggiamento londinese sull'Aventador Roadster by Mansory devono mettersi a combattere sotto la pioggia con 12 kg di hardtop ? ,,,,,,,,,,,,,,
300C stationwagon,https://www.bmwpassion.com/forum/threads/300c-stationwagon.39136/,2005-09-22 00:00:00,Cristiano120dRm,,Al mio papi piace questa macchinina per sostituire la E39 swpiace molto anche a me Come prezzo sul nuovo a che livello siamo per il 3.0d ? Che sconti fanno ? Com'è sta macchina ? ,,,,,,,,,,,,,,
Garanzia 7 anni specchietto per le allodole,https://forum.quattroruote.it/threads/garanzia-7-anni-specchietto-per-le-allodole.108436/,2017-01-30 00:00:00,marual,,Mi dispiace leggere questo... Tra le auto in lizza per il prossimo acquisto ci sarebbe la Rio. Sarebbe interessante conoscere ulteriori esperienze di chi ha una Kia già da diversi anni. ,,,,,,,,,,,,,,
Mi presento,https://www.bmwpassion.com/forum/threads/mi-presento.337540/,2018-11-12 00:00:00,Rinaldo 21,,Buongiorno Grazie di avermi accettato nel forumHo una x1 X drive 20d del 2010 . È la prima volta che possiedo una BMWMi sta piacendo molto ..la sto sistemando e quando ho fatto posto le fotoCiao a tutti ,,,,,,,,,,,,,,
Mazda MX-5 2015,https://www.autopareri.com/forums/topic/56165-mazda-mx-5-2015?&page=49#comments,2014-09-18 13:59:10,TurboGimmo,,Cancellato ,,,,,,,,,,,,,,
Gravità del problema range anxiety fra Teslari e restanti utenti,https://www.forumelettrico.it/forum/topic5247.html?sid=9b3d6660a00250109c0902db2fb0b90b,2019-04-08 18:42:00,selidori,'- le colonnine in DC sono poche e dunque le auto che ricaricano a potenza bassa in AC sono penalizzate sui lunghi viaggi',"Come sempre i post di marcober sarebbero da stampare nella pietra.Volevo solo aggiungere un chiarimento non chiaro per chi non è dentro: Cioè... TUTTE ! Solo la ZOE carica a velocità accettabile in AC tutte le altre sono una lagna.Diciamo che un pochino se la cavano le tesla ma comunque siamo messi maluccio.Con i numeri si capisce meglio...Le zoe caricano a ""22"".Le tesla caricano a ""16"".Le altre caricano a meno di solito a 6 ma sono ancora tante che caricano a ""3"".Oddio anche se questi sono valori reali forse è per l'utente medio più interessante usare la logica di quanti km caricano con un'ora di carica.Quindi per dare i numeri le colonnine come si dice AC che quindi per tutte le auto sono di fatto lente permettono di caricare in un'ora:ZOE: 130 kmTesla: 80 kmLe altre che caricano a 6 ( kW ) : 40 kmLe vecchie che caricano a 3 ( kW ) : 20 kmcome si vede le colonnine AC a parte ZOE per le altre auto ( per i lunghi viaggi ) sono di fatto inutili: se ti devi fermare ben 2 ore per prelevare solo 80km siamo messi male... ( mentre con le colonnine DC quelle ""poche"" per fare un paragone in un'ora carichi un bel 200km anche se ci sono auto in congiunzione con nuove colonnine che possono caricare anche 350km... ( come termine di paragone le tesla ( e vabbè ) esclusivamente sui loro supercahrger ( e vabbè ) siamo poco oltre i 400km imbarcati in un'ora ) .",,,,,,,,,,,,,,
Primo tagliando Mazda 3,https://forum.quattroruote.it/threads/primo-tagliando-mazda-3.107984/page-2,2017-01-09 00:00:00,Paoazzo,,Già tagliandato il rottame ? Gli avete dato cinque virgola uno litri di dexelia ultra dpf da bere vero ? Quindi avrai speso 85€ di olio 35€ di smaltimento 10€ di filtro olio 1€ di o-ring...e il resto trattamento freni ? Il resto dei filtri sono a 40K...con sostituzione olio freni e revisione del filtro gasolio ( che poi voglio vedere se te lo smonteranno...per me ci attaccano il pc e vedono se c'è qualche errore circa presenza acqua nel filtro e bona lé ) perché la sua sostituzione è prevista a 60.000. Ma una cosa non mi è chiara...ma c'ha la catena ? Che c'è giusto giusto un controllo a 200.000km ? No perché non è specificato da nessuna parte...vado per deduzione che è un si guardando quei 200.000 di cui sopra però... ,,,,,,,,,,,,,,
Skoda Octavia RS: difficoltà di avviamento,https://forum.quattroruote.it/threads/skoda-octavia-rs-difficolt%C3%A0-di-avviamento.91152/page-6,2014-11-19 00:00:00,chris82rs,,Se fosse quello dato che pure qualcuno con il 1.6 ha questo problema mi chiedo puure io dove finisce il gasolio che passa ? ,,,,,,,,,,,,,,
ENEL FAST SIENA COOP Strada delle Grondaie 1,https://www.forumelettrico.it/forum/topic4307.html?sid=9b3d6660a00250109c0902db2fb0b90b,2019-05-07 17:36:00,marcober,,Oggi è scomparsa da Eneldrive...e resat in manutenzione in EnelX...che gli capita ? ,,,,,,,,,,,,,,
Nissan GT-R (Topic OT),https://www.autopareri.com/forums/topic/20978-nissan-gt-r-topic-ot?&page=28#comments,2007-10-17 07:45:11,MeneS,,La mia più grande delusione sono gli interni imho veramente brutti... ,,,,,,,,,,,,,,
opel corsa  gpl,https://forum.quattroruote.it/threads/opel-corsa-gpl.108499/,2017-03-06 00:00:00,ecologista,,Ciao Marco volevo sapere quanti km hai fatto con la tua astra gpl e se riscontri qualche noia scrivimi. Sono curioso di vedere la nuova corsa che dovrebbe uscire nel 2018 ciao a presto Fulvio ,,,,,,,,,,,,,,
A6 3.0 TDI Quattro,https://www.bmwpassion.com/forum/threads/a6-3-0-tdi-quattro.11761/,2004-09-13 00:00:00,Emiliano,,Cosa ne pensate ? soprattutto paragonata con un 530d ? lasciate da parte la passione obiettivamente qual'è la migliore ? calcolando anche il prezzo ovviamente. ,,,,,,,,,,,,,,
Auto in Svizzera...,https://forum.quattroruote.it/threads/auto-in-svizzera.110005/,2017-04-18 00:00:00,lelevfr,"'bhé considera che tu hai visto un piccolissimo pezzetto di Svizzera perciò le auto che hai visto in circolazione riguardano unicamente (e ovviamente) quelle che hai avuto modo di incontrare e che presumibilmente ""bazzicano"" nella zona. In Svizzer paese composto ad tr se non quattr diverse culture (e lingue) vede la parte italofona come minoritaria per questo se qui si vendono auto del gruppo FCA esse sono acquistate soprattutto da immigrati italiani nostalgic il resto del mercato come avrai visto è in mano alle case tedesche; Honda effettivamente alcuni anni fa godeva di ottima fama e diffusione poi un po' per la mancanza di novità come pure per l'avvento delle case corean ha perso terreno fino a diventare anche qui come in Italia casa di nicchia. Io vivo qui dall'inizio degli anni '80 e in questi lunghi anni ho visto Honda fino alla fine degli anni '90 come casa a buona diffusion (mai però ai primi posti) poi - colpa anche della sua mancata vitalità - essa è via via stata trascurata in quanto praticamente soppiantata dall'accoppiata Hyundai/Kia.'",Si certo immagino che siano di zona anche se ho visto diverse targhe di Zurigo e Ginevra cmq sono rimasto per quante Classe A ho visto tantissime poi appunto la maggior parte Tedesche Audi Bmw e Mercedes e come hai detto tu le Coreane anche Subaru rispetto a qualche anno fa ne ho viste di meno e come detto Honda nulla....manco un CR-v per sbaglio.....l'unica Honda era la mia daro che sono andato con la Civic e non la BMW... ,,,,,,,,,,,,,,
nuova swift,https://forum.quattroruote.it/threads/nuova-swift.53584/page-2,2012-07-16 00:00:00,juantorena,,Ciao a tutti sono stato quasi 3 giorni in Polonia e l'autonoleggio mia ha assegnato una Swift 1200 5 porte. Si trattava di un modello base almeno credo dato che la strumentazione non aveva il contagiri. In più non non c'era il telecomando per l'apertura delle portiere e la serratura era solo sul lato guida. Ad ogni modo mi è sembrata una discreta auto con finiture accettabili il motore è potente ma i 93 cv si sentono solo se la si tiene su di giri al minimo in compenso è silenziosissima. La tenuta di strada è buona ma in velocità il servosterzo elettrico è un po' troppo diretto. I freni per fortuna non ho avuto modo di provarli. I consumi mi sembrano buoni io ho calcolato una media di 15 km/l ma bisogna considerare che l'auto aveva solo 800 km ed una buona percentuale di strada l'ho fatta in città con diverse code. ,,,,,,,,,,,,,,
[TEST STAMPA] Grande Punto 1.4 T-Jet 120cv,https://www.autopareri.com/forums/topic/25629-test-stampa-grande-punto-14-t-jet-120cv?&page=7#comments,2007-10-27 12:31:44,select,,onestamente mi sembrano rilevamenti un po deludenti...9 7sec nello 0-100 è tantissimo ! e i consumi non mi sembrano cosi eccezzionali...10 5km/l in autostrada...ok non è male...ma con una TT 2.0 s-tronic cabrio fai i 9 5... ,,,,,,,,,,,,,,
Jeep Cherokee 2014,https://www.autopareri.com/forums/topic/50752-jeep-cherokee-2014?&page=133#comments,2014-03-10 16:46:43,owluca,,ma infatti imho la loro strategia è proprio questa: o facevano un mezzo molto più stradale e facevano un mezzo molto più trendy e iniziavano una battaglia commerciale ( EDIT e facevano inkazzare tutti gli appassionati attuali ) oppure ...facevano come han fatto: con una linea meno datata e motori più ragionevoli qualche vendita in più rispetto alle attuali che sono discrete comunque probabilmente verrà. senza intento polemico ma alla fine mi pare una strategia simile a quelle di vari marchi Jappi ,,,,,,,,,,,,,,
Scenario (azzardato) sul futuro Lancia,https://forum.quattroruote.it/threads/scenario-azzardato-sul-futuro-lancia.95195/page-2,2015-03-30 00:00:00,ml14,"""Forse ce l'ha veramente: tralasciando gli scenar più o meno azzardat di notizia vera ce n'è in effetti una: Qualche settimana fa tutti i concessionari Lancia operanti in Francia hanno ricevuto una bella raccomandata contenente una lettera di revoca del mandato con preavviso di 2 anni (in base a quanto prevede la regolamentazione europea) e pare proprio che analoga operazione avverrà a brevissimo termine in tutti gli altri mercati europe con la sola eccezion almeno er or dell'Itali dove Lancia realizza più del 75%b dei volumi.""",Anche perché in Italia di concessionari esclusivi Lancia secondo me ce ne sono molti pochi e per gli altri vendere mele o vendere pere cambia poco.... ,,,,,,,,,,,,,,
Nurburg: Zonda F CS vs Carrera GT,https://www.autopareri.com/forums/topic/26238-nurburg-zonda-f-cs-vs-carrera-gt?&page=2#comments,2008-01-03 08:32:41,F40 LeMans,,Sul discorso dell'assetto estremo rigido che non paghi sono daccordo ma della GT1 e CLK-GTR stiamo parlando di poco più della metà degli anni '90. In quel periodo non era 'modaiolo' il tempo del Nurburgring come lo è oggi. Era un dato poco divulgato ed evidentemente non reso pubblicitario dalle case. La Porsche stessa in quel periodo non dava nessun riscontro cronometrico nemmeno a Weissach la pista di collaudo. Dimmi 12 anni fa nel '96-'97 quanti tempi avevamo del Nurburgring ? il 7.46 della Jaguar e altri 3 o 4 tempi tra cui il 7.52 che Saurma fece con la Gemballa LeMans. Poi ? SportAuto inizio nel '95 a fare il Supertest e poche supercars vennero testate fino alla soglia degli anni 2000. Per me questo è il motivo più significatico della mancanza di dati per la GT1 più che dal lato della capacità di raggiungimento del risultato della vettura sul vecchio anello del Nurburgring. ,,,,,,,,,,,,,,
New RIO?,https://forum.quattroruote.it/threads/new-rio.56494/,2011-10-04 00:00:00,ale20,,E' un motore che va bene sulla Kia Venga che oltre ad essere più pesante della Rio ha maggiore sezione frontale. Direi che è la motorizzazione più azzeccata. I proprietari di Kia Venga mi sembrano soddisfatti di questa motorizzazione. Credo che sulla Rio vada anche meglio dal punto di vista dei consumi. Già nella versione EX la vettura è completa ,,,,,,,,,,,,,,
Mercato piloti 2019,https://forum.quattroruote.it/threads/mercato-piloti-2019.117799/page-6,2018-08-11 00:00:00,pilota54,"'Io la vedo molto dura. Le PU Ferrari e Mercedes hanno una ""marcia"" in piu' e dubito fortemente che Renaul e Honda riescano a colmare il gap che si e' creato.'",C'è da dire che nei primi anni 2000 ( motori aspirati ) il propulsore Ferrari sembrava una spanna sopra gli altri irraggiungibile. Invece dopo il 2010 il Renault è riuscito a colmare il gap. Poi è arrivato l'ibrido e il Mercedes ha superato tutti. Ora il Ferrari sembra di nuovo il migliore ma il Renault può migliorare. ,,,,,,,,,,,,,,
Uso ZF in manovra,https://forum.quattroruote.it/threads/uso-zf-in-manovra.114523/,2018-01-25 00:00:00,A-80,,Mi associo a risposta di alosqualo. Se posso a vettura ferma ,,,,,,,,,,,,,,
M3e92 Vs RS4,https://www.autopareri.com/forums/topic/25097-m3e92-vs-rs4?&page=2#comments,2007-09-24 23:16:43,Cool Night,,Non dovete farmi vedere i video del mio amore M3... ora mi è venuta voglia di andare a intraversare il 190 :lol: ,,,,,,,,,,,,,,
Suzuki Swift sport 2018,https://forum.quattroruote.it/threads/suzuki-swift-sport-2018.111543/,2017-12-19 00:00:00,Uomo Di Ghiaccio,,"Buon salve a tutti Mi sono appena iscritto e colgo immediatamente l'occasione per riesumare questo Topic. Seguo quest'auto dalle prime foto spia mi sono letteralmente innamorato appena l'ho vista. E' dal 12 settembre ormai che cerco informazioni ed avendone raccolte abbastanza volevo condividerle con voi: Innanzitutto in giappone è nota anche come ZC33S ha lo stesso motore della Vitara S quindi il 1.4 BoosterJet ( turbo ) da 140CV e 230nm dai 2500rpm Il peso in ordine di marcia ( da quello che ho capito ) è di 970Kg Il rapporto Kg/nm è di 4.2 valore leggermente più basso della 208GTI ( la 200CV ) e leggermente più alto della scorsa Fiesta ST200 ( 3 7 ) Per quanto riguarda i Kg/CV siamo sui 6.92 contro i 5.8 della 208GTI e i 5.47 della FiestaST200 Ora dati alla mano in teoria dovrebbe essere la più ""lenta""... Sono però riuscito a trovare alcuni video che non hanno rispettato l'embargo asiatico uno cinese in cui un operatore afferma che lo 0-100 si fa tranquillamente in 6.2 secondi ed uno giapponese in cui viene fatto lo 0-100 fra i 6.9 ed i 7.2 secondi Ho scoperto fra le altre cose che questa versione Sport sarà più lunga di ben 10cm rispetto alla versione normale motera cerchi da 17"" con gommatura Continental Contisportcontact 195/45 ed avrà 4 freni a disco monopistoncino ( peccato ) Per quanto riguarda il rombo ovviamente non ho potuto sentirlo dal vivo ma anche in questo campo basandomi dai video credo facciano meglio le concorrenti In europa verrà venduta in una sola configurazione al top credo che gli optional si limiteranno a retrocamera e poco altro Spero solo che il prezzo sarà in linea con il modello precedente Se dovessi scoprire qualcos'altro vi farò sapere :3 ",,,,,,,,,,,,,,
Renault Laguna Coupé M.Y. 2013,https://www.autopareri.com/forums/topic/45374-renault-laguna-coup%C3%A9-my-2013?&page=8#comments,2012-07-25 19:22:11,alpower00,,No ti sbagli il nero nacrè è il nero metallizzato della tua il bianco nacrè è il bianco della monaco e il nero della foto è quello opaco che è il top della pacchianata questi tre colori schiavizzano colui che li possiede il nero fa notare i graffi il bianco alla lunga diventa brutto per le sporcature difficili da lavare e quella porcata del nero resina opaco nel giro di sei mesi diventa traslucido e pieno di pecche diciamo che sono quelle auto estremamente esclusive che dopo circa due o quattro anni cambi al concessionario con qualcosaltro prima che diventino brutte . E ti posso assicurare che il nero e il bianco a me piacciono parecchio il problema sta nel fatto che personalmente le auto le tengo almeno 10 anni e quindi mi girerebbero gli zebedei andarmene a spasso con l'auto imbruttita . Attualmente giro con una ASTRA COUPE' del 2001 grigia chiara metallizzata .......... ZERO GRAFFI ............... perchè non si vedono ............ EHEHEHEHEEHE:clap Appunto per questo l'auto la compro nuova per la durata . Mi intrippa la grigia chiara metallizzata con il tetto gli specchi nero nacrè e i cerchi neri della monaco l'ho vista in una foto con il kit sport non sembra male però le foto sono fatte da professionisti e ritoccate con photoshop la realtà potrebbe essere diversa dovessi non essere convinto dinanzi al venditore direi MONACO GP NERA e tanti saluti il nero non stanca mai e addio autolavaggio ,,,,,,,,,,,,,,
Nuova c max  non compratela ecco perchè...,https://forum.quattroruote.it/threads/nuova-c-max-non-compratela-ecco-perch%C3%A8.61548/page-2,2012-02-17 00:00:00,Southparks,,I consumi sono tragici certo che è ancora presto con i miei 6000km. però con mezzo pieno faccio 250km davvero pochi se penso che con la megane ne facevo 600km con mezzo pieno Mezzo pieno in una settimana con la panda a metano di mia moglie bastavano 10 ? per gli stessi km con la c max sono quasi 50 ? spaventoso direi ,,,,,,,,,,,,,,
SUV tipo Tuareg....,https://www.bmwpassion.com/forum/threads/suv-tipo-tuareg.8099/page-3,2003-11-20 00:00:00,Luca318,'PS mi preoccupa immaginare un possessore di queste auto al quale si rompe un pezzo importante e costoso del motore... dove mette le mani? (oltre che sul portafoglio )',ovviamente non prenderebbe il posto della coupé.... ma quello dell'X5... cmq si fa per parlare sono più curioso che interessato seriamente a comprarlo ,,,,,,,,,,,,,,
166 30 V6,https://www.bmwpassion.com/forum/threads/166-3-0-v6.34350/page-8,2005-06-11 00:00:00,PuccioE39,"""Spetta spetta Oma Roger e Twin o ma c'era anche Puccio e Alfista GTA e nn dimenticarli!!! C'erano 2 fazioni ke è divers anche se il tutto è andato avanti piuttosto civilmente....""",,,,,,,,,,,,,,,
Macan diesel,http://www.porschemania.it/discus/messages/771175/764979.html?1455999159,2016-01-12 22:57:00,kpnaz,,Bella Daniel ! Vai tranquillo fai il rodaggio e poi installa lo sport plus al volo ! ! Io magari avrei mollato il tetto apribile per i sedili sportivi o il PTV ma perch\xe9 in generale non amo molto i tetti,,,,,,,,,,,,,,
Come mandare in crisi un'azienda?,https://www.bmwpassion.com/forum/threads/come-mandare-in-crisi-unazienda.47537/,2006-04-26 00:00:00,Bolletta,,Basta mettere in commercio questa auto qui:I contadini faranno la fila ai concessionari Renault per acquistare una Laguna da mettere nel campo di grano.... ,,,,,,,,,,,,,,
Informazioni su Evalia,https://forum.quattroruote.it/threads/informazioni-su-evalia.110174/,2017-04-27 00:00:00,rdorsa,,Link alla concorrenza ? ? ? ? ? Grazie Icarus65 avevo visto questo e altri articoli ma sono di qualche tempo addietro e soprattutto mi farebbe piacere avere i riscontri diretti di chi l'ha o l'ha avuta. ,,,,,,,,,,,,,,
Museo Alfa Romeo: finalmente il TAR ha respinto il vergognoso ricorso contro il vincolo.,https://forum.quattroruote.it/threads/museo-alfa-romeo-finalmente-il-tar-ha-respinto-il-vergognoso-ricorso-contro-il-vincolo.49441/page-117,2012-02-27 00:00:00,giampi47,,+++ Attached files /attachments/1254227=10672-DSCF4563 - Motore V6 Turbo - pag.4 - I%c2%b0 articolo.JPG /attachments/1254227=10670-DSCF4564 - Motore V6 Turbo - pag.5 - I%c2%b0 articolo.JPG /attachments/1254227=10671-DSCF4565 - Motore V6 Turbo - pag. 6 - I%c2%b0 articolo.JPG ,,,,,,,,,,,,,,
Bugatti Veyron - i dati sul consumo !!!!!,https://www.bmwpassion.com/forum/threads/bugatti-veyron-i-dati-sul-consumo.54659/page-3,2005-06-23 00:00:00,csl,"""La veyron dati alla mano è più veloce e perfomante sia della Koenigsegg CCX che della McLaren F a livello stradale è l'auto più performante mai costruit quindi purtroppo niente da fare http://it.wikipedia.org/wiki/Veyron#Prestazioni""",ma infatti io lo so ! rispondevo solo al post ! Per me la veyron è esclusiva dato che ce ne sono pochissime e inoltre è l'auto più veloce che ci sia ! ,,,,,,,,,,,,,,
Check list pre ritiro Swift,https://forum.quattroruote.it/threads/check-list-pre-ritiro-swift.122086/,2019-04-09 00:00:00,kkkkamakkkk,'Goditi la nuova auto e bast eventuali problemucci hai tempo per segnalarli direttamente in concessionaria. Di chiavi ti daranno due copi perfettamente funzionanti. Buona swift e auguri.',Grazie ma non é per me l auto e chi la userà mi farà presente ogni magagna possibile.... ,,,,,,,,,,,,,,
Chi sono? Mi presento,https://forum.quattroruote.it/threads/chi-sono-mi-presento.13/page-59,2012-02-28 00:00:00,aielloe,,Ciao a tutti sono Enzo e possiedo un Octavia Wagon RS 2.0 TDI da luglio 2010 e con la quale al momento ho percorso 39.000 km Ho quasi 39 anni vivo a Desio e a Giugno diventerò papà ,,,,,,,,,,,,,,
400 cavalli per la Mercedes SLK 55 AMG!!!,https://www.bmwpassion.com/forum/threads/400-cavalli-per-la-mercedes-slk-55-amg.25860/,2004-11-22 00:00:00,Roger84,,"Mercedes presenta una versione potenziata alleggerita e incattivita della SLK 55 AMG. Il motore V8 guadagna 40 cavalli e 10 Newtonmetri rispetto alla normale SLK 55 ( ora la potenza massima è di 400 cv mentre la coppia massima è di 520 Nm ) . Il peso scende di 45 kg ( ora 1.485 kg ) grazie anche alla sostituzione del tetto a scomparsa in metallo con un hardtop in fibra di carbonio che permette di eliminare anche il meccanismo di ripiegamento del tetto. Il carbonio viene usato anche per altri elementi della carrozzeria ( ad esempio i passaruota anteriori allargati ) . Il risparmio di peso non è certo enorme ma almeno viene ottenuto nella parte alta dell'auto cosa che permette di abbassare il baricentro. All'esterno si nota il nuovo e più vistoso spoiler anteriore con prese d'aria più ampie che alimentano anche i radiatori dell'olio della trasmissione e dello sterzo. I passaruota diventano più larghi e alloggiano nuovi cerchioni forgiati da 19"" con pneumatici da 235/35 ZR 19 ( anteriore ) e 265/30 ZR 19 ( posteriore ) . Le prestazioni: da 0-100 km/h in 4 5 secondi ( -0 4 ) da 0-200 km/h in 15 5 secondi ( -2 secondi rispetto alla versione standard ) . Sarà disponibile da luglio ad un prezzo un po' ""problematico"": 107.300 € in Germania ( 115.000 € circa in Italia ) . Con questi soldi si comprano ben altre auto: ad esempio una Porsche 911 GT3. Oppure aggiungendo 5.000 € si prende una Corvette Z06 e una Slk 200 Kompressor. Un vero affare. ",,,,,,,,,,,,,,
