Titolo,URL,Timestamp,User,(Testo Citato),TESTO,Costruttore,Modello,Brand,Interni,Esterni,Meccanica,Prestazioni,Consumi/Autonomia,Motore,Elettrico,Fuoristrada,Elettronica di Bordo,Manutenzione,Assistenza/Concessionari
"RENAULT NEW CLIO III ""LE IENE"" vs OPEL CORSA ""SPORT""",https://www.autopareri.com/forums/topic/24404-renault-new-clio-iii-le-iene-vs-opel-corsa-sport?&page=2#comments,2007-07-29 17:38:00,Ospite,,"la corsa sembra una ""testona""... è sproporzionatissima come design l'anteriore è ""gonfio""... come stile è meglio clio.. ",,,,,,,,,,,,,,
Kia Sportage - Accessori after-market,https://www.autopareri.com/forums/topic/42308-kia-sportage-accessori-after-market?&page=28#comments,2011-04-12 09:55:26,Sporty71,,"Eh si lo so ma trovare un compromesso è un po complicato. Credo anche io che il secondo articolo sia meglio del primo io ne comprerei solamente uno lato guidatore. Soffro abbastanza il caldo. L'argento non dovrebbe proprio essere malaccio si gli interni sono neri ma l'esterno dell'auto è bianca... non so... che paranoie che mi faccio... in fondo la McLaren F1 non utilizza i colori nero/argento ! ? ! Vediamo se riesco a trovare qualche altra cosa ""navigando..."". ",,,,,,,,,,,,,,
"159: cerchi da 17"" o da 18""?",https://www.autopareri.com/forums/topic/17563-159-cerchi-da-17-o-da-18?&page=2#comments,2005-12-21 05:37:39,geo,,"Se nn sbaglio quelli da 17"" sono disponibili per 166 ! Se nn sono identici come disegno poco ci manca ! ",,,,,,,,,,,,,,
Consumi Swift,https://forum.quattroruote.it/threads/consumi-swift.50800/,2011-05-15 00:00:00,-Exige-,,Mi sono meravigliato altroieri. Con la bellezza di circa 31 litri di benzina ( 50 franchi ) ho fatto 520km e avevo ancora qualcosa in riserva. Ovvero 17 km/l. Come segnava il CDB. Cioè 17km/l per un'auto con quasi 100CV e aspirata benzina :shock: Il percorso è misto collinare ( quindi salite e discese ) e urbano con qualche coda. Certo ho guidato in maniera moooolto attenta magari preferendo fare 1 km in piu ma evitando un semaforo però secondo me è un consumo da fuori comune Non immagino se dovessi fare solo extraurbane. Consuma come un diesel ! ! ! ,,,,,,,,,,,,,,
bellissima sta pubblicità della ABARTH,https://www.bmwpassion.com/forum/threads/bellissima-sta-pubblicit%C3%A0-della-abarth.50326/page-2,2004-04-04 00:00:00,AlexMi,'Anche la mia che prenderò la paghero 28000 però si stava parlando di prezzi di listino.. cosa fa poi òla gente con gli allestimenti non conta. Non fissarti sul prezzo alt pensa che nel rivenderla i soldi li riprendi tutti IN PROPORZION cosa che molto ma molto difficilmente succederà con la punto Abarth :wink:',Ma con quale motorizzazione ? ,,,,,,,,,,,,,,
Lancia Ypsilon 2011,https://www.autopareri.com/forums/topic/41885-lancia-ypsilon-2011?&page=246#comments,2013-07-02 15:11:39,accul,,come trasportare la Momo a Taormina ? con l' Elicottero ! ,,,,,,,,,,,,,,
Bmw E90 vs New Lexus IS,https://www.bmwpassion.com/forum/threads/bmw-e90-vs-new-lexus-is.10727/page-2,2005-02-01 00:00:00,b0sh,"Vegeta330 ha scritto: davide ha scritto: non so se avete fatto caso che sulla IS siamo tutti d'accordo... quando è uscita la E90 invece? io ci penserei a questa cosa...... Io ripenso anche ai commenti sulla serie 5 e sulla serie 1....... Oltretutto mi sembra che ultimamente ci sia un pò una sorta di sindrome ""tutto ciò che è BMW è m***a e chi la sostiene è solo per fare il figo col marchio di moda"".... forse un pò troppo ingeneroso.... ... purtroppo col modo di fare del ca**o che ha BMW coi clienti già acquisiti sfortunatamente perderà gli appassionati ed acquisirà sempre più quelli che vogliono solo l'elica sul cofano senza averne un briciolo della nostra passione. Triste ma vero ... Sono appassionato di Bmw da generazion ne ho avute tant ma oggi ne ho le pal** piene di come si comporta la Bmw con i vecchi clienti. Basta che fanno i numeri e sono contenti. Basta che hanno nuovi clienti e sono contenti. Poi se il post-vendita e l'assistenza fanno veramente pena per non dire peggi chi se ne freg tanto il marchio è fort finche' si vend ma arrivera' un giorno che avranno tante bastonate dalla concorrenza che dopo strisceranno per recuperare i clienti..... Forse la lexus mi convincera' dopo anni purtroppo a cambiare marchio e mettere una pietra sopra alla PURA PASSIONE BMW. E poi la E90 è veramente ridicola....ma lasciate perdere.....Ridicoli. ' Vegeta330 ha scritto: davide ha scritto: non so se avete fatto caso che sulla IS siamo tutti d'accordo... quando è uscita la E90 invece? io ci penserei a questa cosa...... Io ripenso anche ai commenti sulla serie 5 e sulla serie 1....... Oltretutto mi sembra che ultimamente ci sia un pò una sorta di sindrome ""tutto ciò che è BMW è m***a e chi la sostiene è solo per fare il figo col marchio di moda"".... forse un pò troppo ingeneroso.... ... purtroppo col modo di fare del ca**o che ha BMW coi clienti già acquisiti sfortunatamente perderà gli appassionati ed acquisirà sempre più quelli che vogliono solo l'elica sul cofano senza averne un briciolo della nostra passione. Triste ma vero ' davide ha scritto: non so se avete fatto caso che sulla IS siamo tutti d'accordo... quando è uscita la E90 invece? io ci penserei a questa cosa...... Io ripenso anche ai commenti sulla serie 5 e sulla serie 1....... Oltretutto mi sembra che ultimamente ci sia un pò una sorta di sindrome ""tutto ciò che è BMW è m***a e chi la sostiene è solo per fare il figo col marchio di moda"".... forse un pò troppo ingeneroso.... ""non so se avete fatto caso che sulla IS siamo tutti d'accordo... quando è uscita la E90 invece? io ci penserei a questa cosa...""",non so se avete fatto caso che sulla IS siamo tutti d'accordo... quando è uscita la E90 invece ? io ci penserei a questa cosa... ,,,,,,,,,,,,,,
JMC Landwind: ecco i video del crash test,https://www.autopareri.com/forums/topic/18101-jmc-landwind-ecco-i-video-del-crash-test,2006-01-17 03:27:56,Rickyx,,http://www.youtube.com/w/Landwind-Crash-Te...dw&amp search=crash http://www.youtube.com/w/Landwind-Crash-Te...rash%20landwind http://www.youtube.com/w/Landwind-TUV-Cras...rash%20landwind Collassamento al 100% della cellula di sicurezza...il manichino contribuisce ad assorbire l'urto...l'airbag sul volante si apre... peccato che poi il piantone dello sterzo si sollevi fino al tetto quasi staccandoti la testa di netto e poi si muove un po' nell'abitacolo colpendo quel che c'è da colpire.... Discreta prestazione non c'è che dire. ,,,,,,,,,,,,,,
Nuova prova Brera 3.2 JTS,https://www.bmwpassion.com/forum/threads/nuova-prova-brera-3-2-jts.28691/,2004-07-13 00:00:00,Vegeta330,'Az e poi si permettono di parlare della TT che gli da un secondo sullo 0/100 già col 2.0.....',Provata su AlVolante rispecchia le aspettative che ci si è potuti fare in base alla già nota prova di AUTO.0-100 km/h 7 4 secondi0-1000m 27 3 secondivel. max 238 1 km/hconsumo medio 7 7 km/lconsumo autostrada 7 9 km/lconsumo extraurbano 9 9 km/lc'è da dire che il consumo massimo si attesta sui 4 3 km/l che alla fine non è male e che la frenata è ottima ( 36 9 m da 100 km/h ) così come la tenuta di strada ( ma non c'è pericolo tanto mica corre.. ) ,,,,,,,,,,,,,,
Honda Jazz 1.3 pregi e (soprattutto) difetti,https://forum.quattroruote.it/threads/honda-jazz-1-3-pregi-e-soprattutto-difetti.113775/page-15,2018-02-12 00:00:00,gipi64,"'Dal libretto... ""L'olio MOT. Honda #1.0 è stato formulato per migliorare il risparmio consumo di carburante. Se l'olio MOT. Honda #1.0 l'olio Honda Green o 0W-20 non è disponibil utilizzare olio 5W-30 o 0W-30."" Essendo un motore progettato per lo 0w20 io starei su quanto indicato dalla progettista più che farmi dei calcoli su idee mie.'",Accidenti ragazzi il motorino della Jazz è diventato assai esigente. Il 1.4 precedente leggendo il manuale accetta dallo 0W-20 al 10W-30 arrivando per alcuni paesi al 15W-40. Contento di aver acquistato quella precedente un cambio d'olio ogni 2 anni i soliti filtri e con circa un centinaio di euro risolvo il problema. In Honda non mi hanno mai visto ( a parte il richiamo per l'airbag ) complice la poca elettronica della quale è fornita ( rispetto alla serie attuale ) non intendo farmi spennare per avere un aggiornamento di una qualche centralina. ,,,,,,,,,,,,,,
Potenza fari: test autobild,https://www.bmwpassion.com/forum/threads/potenza-fari-test-autobild.33136/,2005-10-18 00:00:00,iudexmaximus,"""Grazie Migli intendevo l'E34! Dei bixeno dell'e46 sono soddisfatto!! """,Vince senza se e senza ma l'Audi TT dotata di fari allo xeno.Ultima classificata la Fiat Grande Punto con lampade alogene.Ecco la meglio e la peggio del test:Nei prossimi giorni tutte le altreP.S: guardate anche qui: http://www.bmwpassion.com/forum/showthread.php ? p=1134691#post1134691 ,,,,,,,,,,,,,,
Porsche 718 Boxster T e Cayman T: più leggerezza per le sportive compatte - HDmotori.it,http://www.hdmotori.it/2018/12/19/porsche-718-boxster-t-cayman-300-cv-potenza-foto/,2018-12-21 02:57:00,DunKel,,All'aggiunta del filtro antiparticolato per benzina.... Da qui ho smesso di leggere ! ,,,,,,,,,,,,,,
prime uscite della futura XF,https://forum.quattroruote.it/threads/prime-uscite-della-futura-xf.80925/,2014-02-28 00:00:00,belpietro,'Ciao Antonio: era da tempo che non mi facevo vivo. Come va il Jag? Il mio continua ad essere eccezionale',anche la mia sempre bene. sono davvero soddisfatto ho fatto bene a copiarti sono contento di rileggerti spero che ci sentiremo anche presto. ,,,,,,,,,,,,,,
Alfa 159 3.0 JTD V6,https://www.autopareri.com/forums/topic/21218-alfa-159-30-jtd-v6?&page=5#comments,2007-01-10 13:22:40,TonyH,,Con 163cv non con 190cv è il 20% in più mica bruscolini..... ,,,,,,,,,,,,,,
Musa primo contatto,https://www.autopareri.com/forums/topic/8218-musa-primo-contatto?&page=2#comments,2004-07-30 06:00:32,Velox,,Ci sono anch'io ma probabilmente in Belgio non è ancora arrivata nelle concessionarie :arrow: ,,,,,,,,,,,,,,
Museo Alfa Romeo: finalmente il TAR ha respinto il vergognoso ricorso contro il vincolo.,https://forum.quattroruote.it/threads/museo-alfa-romeo-finalmente-il-tar-ha-respinto-il-vergognoso-ricorso-contro-il-vincolo.49441/page-218,2013-10-27 00:00:00,giampi47,,+++ Attached files /attachments/1698212=30725-DSCF7344 - da AUTO ITALIANA - 25 OTT. 1962.JPG ,,,,,,,,,,,,,,
Possessori di 911 occhio a dire a dire che...è un furgone,http://www.porschemania.it/discus/messages/22971/516430.html?1279803310,2010-07-20 01:16:00,tacco,,Scostumati ! ! ! ! ! ! ! ! ! ! ! ! ! ! ! ! ! ! ! ! ! ! ! ! ,,,,,,,,,,,,,,
Aston Martin DBS (007),https://www.bmwpassion.com/forum/threads/aston-martin-dbs-007.24581/,2005-09-18 00:00:00,pluffi,,Source: http://www.leftlanenews.com/2006/05/04/007s-2007-aston-martin-dbs-revealed/#more-2533 ,,,,,,,,,,,,,,
Abarth 595 Competizione,https://www.autopareri.com/forums/topic/51917-abarth-595-competizione?&page=11#comments,2013-08-03 13:45:01,ricky1750,,"Tornato ieri dal giro al Ring.. la piccola teppista si e' comportata decisamente bene anche se ovviamente la pista ha fatto risaltare le ( tante ) pecche del guidatore e le ( poche ) pecche dell'auto.. Abbiamo girato con pause e giri di raffreddamento dalle 9 di mattina alle 16 si e' fatta fuori quasi due pieni per una ventina abbondante di giri ( a fine giornata in contakm parziale contava 588km ) . Direi che ha ampiamente dimostrato di reggere piu' che bene... Girare in un trackday al ring e' un altro mondo rispetto alla circolazione turistica: a parte avere i commissari ogni 800mt con annessa sicurezza bandiere salvo qualche occasione ti permette di girare di fatto da solo... del resto sono 70/80 auto su 22 km di pista. Impressioni generali della giornata: sicuramente il ring non e' la pista ideale per il cinquino.. e' veloce e conta molto avere motore: la prima si scontra con il passo corto ed il baricentro alto dell'auto che in alcuni punti pur rimanendo estremamente controllabile e gestibile e' decisamente un altro mondo rispetto ad auto meno performanti ma piu' raffinate come la Spider che senti decisamente incollate a terra al contrario della 595 che e' molto piu' agile ma anche molto piu' nervosa ( o sensibile se vogliamo ) . Nelle parti piu' guidate e' molto agile paga un po' di sottosterzo comunque gestibilissimo ed in compenso ha una marea di trazione in uscita di curva. Il motore paga un cambio rapportato molto lungo ( un 6 marce gli farebbe bene ) cosi' riesce a spingere bene l'auto tanto che si arriva ai 200 di punta alla fine del flugplatz subito dopo il dosso prima della Schwedenkreuz e 190 alla compressione del Fuschsrore ma paga moltissimo nel salitone tra la Bergwerk e Kesselken dove non si riescono a superare i 160 e ci si trova ""bloccati"" tra una 4 che arriva a fine fiato e che gira troppo alta ed una quinta che non permette di continuare ad accellerare ( mentre sia spider che gta se la fanno tutta in accellerazione un po' per il 6 marce un po' perche' comunque parliamo di 200/250 cv contro 160.. ) L'unico vero difetto riscontrato ma comunque tenibile sotto controllo raffreddando ogni 3 giri tirati e' che l'impianto frenante pur restando pienamente efficiente comincia ad avvisare che le pastiglie stanno cominciando a soffrire nonostante il cambio con pastiglie piu' performanti ( HP2000 ) . Parlando con un amico che gestisce una scuderia per la VLN e che lavora sulle auto secondo lui arriva meno aria di quanto sarebbe ottimale ai freni ( del resto davanti e' tutto chiuso visto che nella parte bassa del muso ci sono l'intercooler e altro ) e sarebbe risolvibile o usando gli alloggiamenti dei fendinebbia per fare dei condotti aria oppure modificando in maniera appropriata il sotto paraurti. Stiamo comunque parlando veramente di situazioni ben al di la di quanto puo' capitare anche portando l'auto in piste di lunghezza umana.. alla fine 3 giri vuol dire aver tirato per piu' di 60km senza mai un attimo di pausa.. Bella giornata io mi sono migliorato parecchio e aumentato di molto la confidenza con la pista arrivando a un 9.48 BTG ( da un 10.24 BTG con la Spider ) .. penso che a naso il potenziale dell'auto sia almeno una 30ina di secondi in meno.. e credo che prossimamente incominciero' a noleggiare perche' da imparare e aumentare di ritmo ho ancora parecchio ma non ho molta voglia di farlo con un'auto mia e che si sta avvicinando ai suoi limiti ( e assottigliando i margini di errore ) .. meglio andare su qualcosa di tarato piu' sulla pista anche come assetto/gomme/etc... ",,,,,,,,,,,,,,
Ritorna la Sportwagon.......,https://www.autopareri.com/forums/topic/17774-ritorna-la-sportwagon?&page=7#comments,2006-01-06 05:11:06,ACS,,sintesi estrema :b26 ,,,,,,,,,,,,,,
RECORD KM PERCORSI CON LE MERCEDES,https://forum.quattroruote.it/threads/record-km-percorsi-con-le-mercedes.88365/page-2,2015-11-19 00:00:00,alexmed,,Sarebbe carino metteste anche voi foto del conta km. ,,,,,,,,,,,,,,
Colonnine EVAD Fast IKEA Casalecchio di Reno BO Via John Lennon 6,https://www.forumelettrico.it/forum/topic5564.html?sid=9b3d6660a00250109c0902db2fb0b90b,2019-05-07 22:24:00,polianto,,Io un po li capisco...Quando ero giovane e un po pirla se nevicava al sabato sera andavamo nel parcheggio della Metro a fare i testa-coda con la Panda tirando il freno a mano o a fare casino coi bagagliai aperti e le autoradio a manetta e inevitabilmente un po di disordine ce lo lasciavamo dietro...E poi i parcheggi vuoti invogliano molto alla garetta...Poi per fortuna l'età della stupidera passa per tutti ma nel frattempo un po di fastidio ai direttori dei supermercati lo si può causare.Ciao Antonio,,,,,,,,,,,,,,
"Programma ""wheeler dealers"" made in EN: comprare e ripristinare le auto del passato",https://www.bmwpassion.com/forum/threads/programma-wheeler-dealers-made-in-en-comprare-e-ripristinare-le-auto-del-passato.151084/,2010-06-20 00:00:00,victor79,,Ciao a tutti di seguito troverete un link che fà riferimento ad una trasmissione made in England ( come molti programmi di auto ) che tempo fà trasmettevano sul satellite. Il programma si chiamava Wheeler dealers e riguardava l'acquisto la rimessa in ordine e la rivendita di auto degli anno 70 80 e 90. Penso sia interessante per molti ( a me piaceva molto ) soprattutto per la rimessa in ordine. Vi avviso che è in inglese.Ovviamenete il link di riferimento riguarda BMW:wink:Spero vi piaccia e possa essere utilehttp://www.youtube.com/results ? search_query=wheeler+dealers+bmw&aq=f ,,,,,,,,,,,,,,
Preventivi Mazda CX5,https://forum.quattroruote.it/threads/preventivi-mazda-cx5.62333/page-2,2012-02-28 00:00:00,Jolly10,"""Si proprio perchè è legato lui te ne regala uno ma ti costringe quindi a pagare l'altro. se come dici t risulta uno sconto del 3 è proprio poco...""",Ricordatevi però che lo sconto è sul prezzo di listino dell'auto. Gli accessori quindi il pacchetto IPT e il colore non entrano a far parte dello sconto ma si aggiungono al prezzo già scontato. ,,,,,,,,,,,,,,
Bmw 130i,https://www.autopareri.com/forums/topic/11331-bmw-130i?&page=7#comments,2005-09-09 01:27:46,NOKXIS,,Nelle mie zone è un discreto/buon successo visto il prezzo e la qualità non al top... A giro se ne vedono molte e nei classici discorsi da bar i giudizi iperlusinghieri si sprecano... ,,,,,,,,,,,,,,
2900 euro...,https://forum.quattroruote.it/threads/2900-euro.106787/page-2,2016-10-31 00:00:00,elancia75,"""L'errore logico che si fa infatti è sempre quello di riferirsi al valore di mercato per calcolare il risarciment non considerando che una vettur seppure non più giovan può essere stata tenuta in modo impeccabile e aver goduto di interventi di manutenzione che ne avrebbero garantito l'efficienza per molti anni a venire. Sarà quindi forse legale il computo del risarcimento così determinato ( e sottolineo il forse ) ma certamente non è etic e la vittima del sinistro si trova suo malgrado costretta a subire una ingente perdita patrimoniale. Se poi ci mettiamo l'atteggiamento disonesto delle compaglie assicurative italiane (magari in Svizzera sarà divers ma qui la sitiazione è questa) il quadro è completo.""","Purtroppo di tutto ciò che è ""Morale"" ...tipo ""Danni morali"" ecc... non glie ne frega nulla. Poi ci lamentiamo se ci sono ""maestri del colpo di frusta"". ",,,,,,,,,,,,,,
Come annunciato vi presento la Legacy,https://www.bmwpassion.com/forum/threads/come-annunciato-vi-presento-la-legacy.45666/page-3,2007-04-07 00:00:00,330xd,,Quand'è che la trasformi in STi ordinando i pezzi in jap ? ,,,,,,,,,,,,,,
MA siete proprio sicuri che si chiamerà 158?!? sarà 157!!!,https://www.autopareri.com/forums/topic/8971-ma-siete-proprio-sicuri-che-si-chiamer%C3%A0-158-sar%C3%A0-157?&page=2#comments,2004-09-23 19:35:15,Sonata_Arctica,,No ueh ! ! ! Giulia sarà figlia mia. Non freghiamo le idee prego. ,,,,,,,,,,,,,,
Scompare il marchio Lancia?Chi lo ha detto?,https://forum.quattroruote.it/threads/scompare-il-marchio-lancia-chi-lo-ha-detto.119209/,2018-11-05 00:00:00,Gerardo58,,L’ho letto qualche giorno fa sul Sole 24ore però è anche riportato sull’ultimo blog di Carlo Caviicchi “Maserati..........” verso la fine dell’articolo.Comunque ribadiva che Fca non aveva bisogno di alleanze e che bisognava aspettare il 2020 per nuovi modelli. ,,,,,,,,,,,,,,
Chi sono? Mi presento,https://forum.quattroruote.it/threads/chi-sono-mi-presento.13/page-84,2014-05-20 00:00:00,rosberg,,Un sincero Benvenuto ! Continua a scrivere mi raccomando ! Non fare il timodone ! Uno con la maglietta della Red bull non può esser timidone ! ,,,,,,,,,,,,,,
Fiat 500C M.Y. 2014,https://www.autopareri.com/forums/topic/32509-fiat-500c-my-2014?&page=7#comments,2009-02-16 13:51:57,Trucido,,"Secondo me é una soluzione bellisssima.. fare una vera cabrio con quelle misure sarebbe stato un´atto poco intelligente. La 500 non ha le ""Frameless Window"" quindi giá solo qui avrebbero dovuto spendere tanti soldi per portiere capaci di offrire ció. Sicurezza e rigiditá torsionale aparte.. no no soluzione bella intelligente ! Bravi.. ",,,,,,,,,,,,,,
Benzina o diesel,https://forum.quattroruote.it/threads/benzina-o-diesel.113189/page-7,2017-11-10 00:00:00,Frankie71iceman,,Certo ma rispetto ai diesel è arrivata con 10-15 anni di ritardo... ,,,,,,,,,,,,,,
Fiat 500 M.Y. 2014,https://www.autopareri.com/forums/topic/26165-fiat-500-my-2014?&page=338#comments,2010-12-27 11:01:21,TonyH,,Volevo cambiare le alogene della 500 della fidanzata con le Osram o le Blue-Vision ( c'è un bell'articolo su 4R di questo mese che farà gongolare Regazzoni ) . Qualcuno gentilmente mi sa dire che tipo di lampadine monta la 500 ? Sono della H4 ? ,,,,,,,,,,,,,,
Sondaggio precedenti BMW possedute,https://www.bmwpassion.com/forum/threads/sondaggio-precedenti-bmw-possedute.92467/page-4,2004-03-25 00:00:00,batmobile,,Chi tanto e chi niente ! ,,,,,,,,,,,,,,
Alfa Romeo 4C 2013,https://www.autopareri.com/forums/topic/56324-alfa-romeo-4c-2013?&page=892#comments,2014-08-19 16:39:09,dado,,Questa era invece lì parcheggiata ,,,,,,,,,,,,,,
Audi TT RS,https://www.bmwpassion.com/forum/threads/audi-tt-rs.30826/page-4,2005-11-11 00:00:00,bond291,'Poi mi dici se sono più i turbo o gli aspirati a dare noie',è un motore da circa 100cv litro.. è spinto ma non è niente di speciale considerando che è biturbo... ,,,,,,,,,,,,,,
Maserati,https://www.bmwpassion.com/forum/threads/maserati.42267/page-2,2007-01-18 00:00:00,ZX_DIO,,"Guarda quella del mio amico acquistata settembre 2006: grandsport bianco fuji perla interni pelle e tessuto ignifugo del cazz... tunnel centrale in carbonio scarichi corsa cerchi bruniti da 19"" autoradio cd bixeno. 120000 euro nuova... 4000km... a 75000 euro...del 2005. Acquistata concessionario ufficiale Ferrari Torino.Conviene comprarle usate di sicuro... ",,,,,,,,,,,,,,
Mahindra KUV100,https://forum.quattroruote.it/threads/mahindra-kuv100.116811/page-2,2018-06-05 00:00:00,Carloantonio70,,"Eccomi qua Stamattina siamo andati a vedere e provare la ""paccotiglia indiana"" Piacevole da vedere nonostante le dimensioni ridotte. Gli interni pur se non molto appaganti ome direbbero molti ma non io hanno un aspetto solido tranne alcuni particolari tipo la leva del freno a mano o qualche rotella. Ottimo il cambio sia come posizione che come manovrabilità. Posizione di guida da rivedere nel senso che sembra corretta ma il sedile forse è un po duro. Probabilmente non ho trovato la giusta posizione ma il test è stato molto veloce. Ho notato comunque una notevole elasticità del motore che ho cercato di mettere in difficoltà senza riuscirci. Ha retto alla grande la quarta a 40 km/h SD ha ripreso senza tentennamenti. Comodità percepita in questo primo approccio buona. Bocciato il bagagliaio che non ha una maniglia esterna ma si apre solo dall'abitacolo o con la chiave. Inoltre è molto scomodo con bocca stretta e battente molto alto. In pratica è un pozzetto abbastanza capiente ma scomodo. Per fortuna che nello specifico non è tra i requisiti irrinunciabili. Spicca l'assenza di uno grande schermo touch e questo è un'enorme sollievo PSR fortuna non c'è ne neanche uno piccolo. Nella k6 manca anche il tergilunotto e questo è grave. Enorme lo spazio tra i sedili anteriori e vani portaoggetti un po dovunque. Ruota di scorta NORMALE. Insomma per il prezzo richiesto è una valida offerta sempre se si riesce a digerire una impostazione e un po datata che non è un difetto a priori almeno per me. Confrontandola con la ignis possiamo dire che oltre il risparmio all'acquisto non sfigura in modo clamoroso almeno con la versione base. Le allgrip sono un altra cosa ma an ha come prezzo. Per me è promossa ",,,,,,,,,,,,,,
Scénic XMod - Topic Ufficiale,https://forum.quattroruote.it/threads/sc%C3%A9nic-xmod-topic-ufficiale.14456/page-88,2010-03-29 00:00:00,FITNESS1983,,"aggiornamento consumi 1.6 gpl. Dopo circa 4000km i consumi si mantengono gli stessi dei primi utilizzi. Indipendentemente da autostrada città e extraurbano rimangono sui 10Km/l oscillando in su o in giu di poco in relazione al tipo di percorso. Il prezzo del gpl in compenso sta scendendo. Direi ottimo. Unica pecca le dimensioni della ciambella avrei preferito una capienza maggiore x evitare di fermarmi a fare gpl ogni 400km circa dato il mio utilizzo ""importante"" della xmod. 1 mese=4000km ",,,,,,,,,,,,,,
Audi S3 su Auto,https://www.bmwpassion.com/forum/threads/audi-s3-su-auto.35898/,2003-05-23 00:00:00,El Nino,,"Una frase per riassumere tutto l'articolo:""Grazie alla massima espressione del 2 litri turbo ad iniezione diretta l'Audi S3 si mette dietro gli scarichi tutta la concorrenza in qualsiasi situazione.""251.5Km/h0-100 in 5""70-1000m in 25""29100-0Km/h in 35.7m1522KgConsumo:Urbano 7.78Km/lExtraurbano 10.54Km/lAutostrada 9.556Km/lAl limite 3.1Km/lTempo a Balocco:21° 3'01""19Rivali:25° VW Golf R32 3'02""1531° BMW 130i 3'02""8033° Renault Megane RS 3'03""8735° Opel Astra OPC 3'04""78 ",,,,,,,,,,,,,,
