Titolo,URL,Timestamp,User,(Testo Citato),TESTO,Costruttore,Modello,Brand,Interni,Esterni,Meccanica,Prestazioni,Consumi/Autonomia,Motore,Elettrico,Fuoristrada,Elettronica di Bordo,Manutenzione,Assistenza/Concessionari
Differenze jtd,https://www.autopareri.com/forums/topic/9678-differenze-jtd?&page=2#comments,2004-11-05 08:00:41,NewCar,,"Non mi vergogno a dire che non l'ho ancora guidata ( il jtd ) cosa intendi quando dici ""Non c'è granchè da paragonare"" ? ",,,,,,,,,,,,,,
Moderazione forum Fiat,https://forum.quattroruote.it/threads/moderazione-forum-fiat.2574/page-14,2010-10-12 00:00:00,ilSagittario,Perchè è stato cancellato il mio intervento? Tanto per sapere. Grazie.... ma è stato pubblicato e poi tolto oppure non è mai stato pubblicato? 'Perchè è stato cancellato il mio intervento? Tanto per sapere. Grazie.',Era pubblicato in risposta a quello di stilo-bravo-club. Comunque fa nulla da quest'area ormai sto alla larga in attesa di tempi migliori. ,,,,,,,,,,,,,,
Mercato gennaio boom di vendite,https://forum.quattroruote.it/threads/mercato-gennaio-boom-di-vendite.108580/page-2,2017-02-06 00:00:00,elancia75,,Insomma è BOOM o no ? ,,,,,,,,,,,,,,
Serie 5 X3: che mi dite?,https://forum.quattroruote.it/threads/serie-5-x3-che-mi-dite.116831/page-9,2018-07-08 00:00:00,A-80,"'Ebbene n ahimé la 530 gira che ti rigir esce assai spartana... o forse anche il venditore non aveva troppo interesse a piazzare il motore a benzin ma anche la concorrenza BMW non faceva condizioni migliori e non mi va di andare a prendere l'auto chissà dove. Fatto sta che sto per chiudere per una 520d Xdrive Luxury in pronta consegna (la conservano fino a novembre in cassaforte ) che purtroppo non ha nessuno dei due optional che mi incuriosivano: 4 ruote sterzanti e telaio adattivo. Non ha neppure i sedili comfor anche se devo dire che provando i ""base"" li ho trovati comunque assai comodi. Per il resto ha tutt anche quello che non mi interessa (tipo chiave con displa cruscotto ricoperto in pell vetri oscurat portellone automatic clima 4 zon ecc.). Ha tutti i ""pacchetti"" disponibil per cui c'è da sbizzarrirsi tra connettivit guida (quasi) autonom telecamere stere head-up displa lettore dei segnali a bordo strad LED adattiv impianto audi ecc. ecc. ecc. Per fortuna non ha il sistema per profumare l'ambient quello l'hanno dimenticato L'estetica è esattamente come la volevo io: infatt una volta finita di configurare la nuova il venditore ha verificat e ne aveva una esattamente così in casa (color finiture shadow lin intern ecc.). Da lì è partita l'offert che è stata del tipo di quelle cui non si può dire di n anche per la ripresa della mia. Domani la vedo dal vero se tutto o chiudiamo (e la chiudiamo in cassaforte). Che dir i miei sogni di Giulia e cavalli scatenati svaniscono per necessità di spazio (ho ripreso con la bici da corsa) e necessità di comodità (sono reduce da problemi di schiena importanti). Per la ""mattata"" dell'andropausa con la Type R rimando alla pension mi godo la comodità della 520 e mi sfogo in bici 'Ebbene n ahimé la 530 gira che ti rigir esce assai spartana... o forse anche il venditore non aveva troppo interesse a piazzare il motore a benzin ma anche la concorrenza BMW non faceva condizioni migliori e non mi va di andare a prendere l'auto chissà dove. Fatto sta che sto per chiudere per una 520d Xdrive Luxury in pronta consegna (la conservano fino a novembre in cassaforte ) che purtroppo non ha nessuno dei due optional che mi incuriosivano: 4 ruote sterzanti e telaio adattivo. Non ha neppure i sedili comfor anche se devo dire che provando i ""base"" li ho trovati comunque assai comodi. Per il resto ha tutt anche quello che non mi interessa (tipo chiave con displa cruscotto ricoperto in pell vetri oscurat portellone automatic clima 4 zon ecc.). Ha tutti i ""pacchetti"" disponibil per cui c'è da sbizzarrirsi tra connettivit guida (quasi) autonom telecamere stere head-up displa lettore dei segnali a bordo strad LED adattiv impianto audi ecc. ecc. ecc. Per fortuna non ha il sistema per profumare l'ambient quello l'hanno dimenticato L'estetica è esattamente come la volevo io: infatt una volta finita di configurare la nuova il venditore ha verificat e ne aveva una esattamente così in casa (color finiture shadow lin intern ecc.). Da lì è partita l'offert che è stata del tipo di quelle cui non si può dire di n anche per la ripresa della mia. Domani la vedo dal vero se tutto o chiudiamo (e la chiudiamo in cassaforte). Che dir i miei sogni di Giulia e cavalli scatenati svaniscono per necessità di spazio (ho ripreso con la bici da corsa) e necessità di comodità (sono reduce da problemi di schiena importanti). Per la ""mattata"" dell'andropausa con la Type R rimando alla pension mi godo la comodità della 520 e mi sfogo in bici '",Signor mezzo. Complimenti ,,,,,,,,,,,,,,
Hyundai ix35 1.7 CRDi 2WD,https://forum.quattroruote.it/threads/hyundai-ix35-1-7-crdi-2wd.45405/,2011-02-01 00:00:00,alcurb,"'grazie mill ho visto le tue informazioni io la vorrei prendere in settimana.. e chiedere ad un possessore può essere un'ottima idea: a quanto ho capito ti seitrovato ben giusto? puoi solo dirmi se hai il ""piede pesante""? cioè la tua velocità di crociera (in autostrada) è 11 130 o 150 km/h? io per fortuna non ho problemi di traffico: trasferito in Sardegna dopo 30 anni a Napoli.. '",Normalmente ho un andatura tranquilla sui 130. I 150 non li ho mai raggiunti anche perchè ho fatto pochi km. Io sono molto soddisfatto in generale e ritengo il rapporto qualità/prezzo più che buono.Se sei indirizzato su questo tipo di auto comprala ! ! ! Del resto il 2000 nella mia città se lo ordini adesso te lo danno nel 2012. Vorrà pur dire qualcosa e il 1700 non è per niente scarso . ,,,,,,,,,,,,,,
Fiat 124 Spider 2016,https://www.autopareri.com/forums/topic/59843-fiat-124-spider-2016?&page=8#comments,2015-11-18 10:02:49,alederme,,secondo me vanno bene anche le foto dal vivo e non quelle formato divulgazione forse già con quelle dovremmo capire... penso che a breve qualcosa dal Sema si vedrà foto fatte da fotografi locali ,,,,,,,,,,,,,,
Volvo XC Coupé Concept,https://forum.quattroruote.it/threads/volvo-xc-coup%C3%A9-concept.85120/,2014-01-09 00:00:00,fabioV50,,beh... come prototipo è interessante. Certo diventa difficile ormai essere originali: http://www.google.it/imgres ? sa=X&biw=1536&bih=770&tbm=isch&tbnid=zw7M11vewNSZ0M:&imgrefurl=http://www.automobilesreview.com/auto-news/fornasari-rr600-luxury-runs-fast/14035/&docid=-zyML6fZ6c84BM&imgurl=http://www.automobilesreview.com/uploads/2009/05/fornasari-rr600-1.jpg&w=644&h=401&ei=3ZnOUsXzAqi_ygPn-IG4DQ&zoom=1&ved=0CGMQhBwwAg e http://www.google.it/imgres ? sa=X&biw=1536&bih=770&tbm=isch&tbnid=zaJxNBmRNfuR_M%3A&imgrefurl=http%3A%2F%2Fworldcarslist.com%2Fpage%2Ffornasari-unknown%2Fdefault.html&docid=CEMWLFK1UcYcHM&imgurl=http%3A%2F%2Fworldcarslist.com%2Fimages%2Ffornasari%2Ffornasari-unknown%2Ffornasari-unknown-09.jpg&w=1024&h=768&ei=3ZnOUsXzAqi_ygPn-IG4DQ&zoom=1&ved=0CI0BEIQcMBA&iact=rc&dur=353&page=2&start=16&ndsp=22 con tanto di nervature sul cofano. Cambia solo la fanaleria ,,,,,,,,,,,,,,
Volkswagen Golf VI (Topic Ufficiale - 2008),https://www.autopareri.com/forums/topic/29826-volkswagen-golf-vi-topic-ufficiale-2008?&page=124#comments,2014-06-24 15:18:13,gpat,,La composition media è solo per veicoli MQB. In compenso hai una vagonata di radio touch 2din con qualsiasi funzione che puoi scegliere da qualsiasi marca. ,,,,,,,,,,,,,,
"159 2.2 JTS: ""demolita"" su Automobilismo",https://www.bmwpassion.com/forum/threads/159-2-2-jts-demolita-su-automobilismo.13669/,2005-06-22 00:00:00,lelesch81,'anke a me...quello della gta è ineguagliabile...',"Avete presente la prova nel 1997 della 156 su Automobilismo ? Ecco la cosa si è ripetuta. Automobilismo è andato controcorrente rispetto tutta la stampa europea ( e italiana vedi la prova di Auto ) . Ha ""demolito"" la 159 sotto le voci motore e finiture mettendo un bel 6.5/10 ad entrambe le voci. Un voto così basso sul motore non è mai stato dato se non all'epoca dei prmi 3.0 V6 TD Isuzu delle Saab 9-5 Discutibile a mio parere il voto sulla linea ( sugli altri voti non mi pronuncio prima vedo e tocco con mano poi giudico ) dato che si è beccata un 8 mentre l'Audi A4 si è beccata un 9. ",,,,,,,,,,,,,,
Cambio CMP6 e levette al volante,https://forum.quattroruote.it/threads/cambio-cmp6-e-levette-al-volante.47306/,2011-03-07 00:00:00,1929,'Ma funziona veramente così male come si legge spesso in questo forum ? Peccato perchè una DS4 con CMP6 mi piacerebbe molto.',Guarda io ho preso la nuova c4 con questo cambio l'ho anche provato quando feci il giro di prova ma giusto 10 minuti sembrava buono se non hai pretese di corse e' ovvio che rispetto ad uno manuale perde un po' di velocita' ma nel mio caso guidando quasi sempre in citta' va piu' che bene. Ti posso aggiornare quando mi arriva speriamo in questo mese. ,,,,,,,,,,,,,,
Macchine che potranno guidare i Neopatentati,https://www.bmwpassion.com/forum/threads/macchine-che-potranno-guidare-i-neopatentati.47500/page-4,2006-02-17 00:00:00,Clappy,,ma niente niente co sta legge mi si rivaluta la panda 750 4marce del 1990 ? per i neopatentati chi fosse interessato mi mandi un PM ,,,,,,,,,,,,,,
Tagliano ypsilon a gpl,https://forum.quattroruote.it/threads/tagliano-ypsilon-a-gpl.98398/,2015-09-08 00:00:00,ypsilon840,,Che io sappia montando l'impianto a GPL la garanzia la dovrei perdere solo sui pezzi interessati dall'impianto...qualcuno sa dirmi qualcosa in merito ? Grazie. ,,,,,,,,,,,,,,
Todt direttore generale di Ferrari,https://www.autopareri.com/forums/topic/6591-todt-direttore-generale-di-ferrari,2004-05-13 17:21:08,Autodelta85,,Scusa ma perche mettere un ostacolo su un semplice accordo di collaborazione tecnica..... Oggi quasi tutti i costruttori hanno accordi di collaborazioni con altri...veramente non ti capisco..... Soltanto Porsche per citare una ha accordi in diverse materie con almeno 5 case...VW Audi Subaru BMW Mercedes Benz..... Maserati per esempio si collaborava gia' dal 1998 con Fiat Auto VW-Audi e BMW per lo sviluppo dello skyhook.... ,,,,,,,,,,,,,,
Lancia Ypsilon 2011,https://www.autopareri.com/forums/topic/41885-lancia-ypsilon-2011?&page=144#comments,2011-06-21 08:54:40,MotorPassion,,Guarda a pagina 141 ci sono delle foto postate da me che ho trovato in rete. ,,,,,,,,,,,,,,
[Brasil] Fiat Palio (Foto Ufficiali),https://www.autopareri.com/forums/topic/45053-brasil-fiat-palio-foto-ufficiali?&page=11#comments,2012-05-12 09:37:19,Cosimo,,dopo questa pubblicità questa sarà il mio prossimo cadavere ,,,,,,,,,,,,,,
Trazione Alfa Romeo,https://forum.quattroruote.it/threads/trazione-alfa-romeo.84/page-9,2009-04-14 00:00:00,loopo,Senza nulla togliere al DeDio il multilink è superiore.... non so se e' superiore ma con il de dion le alfa sono state ottime tp.............dopo una lunga riflessione ho votato TP :lol: 'Senza nulla togliere al DeDio il multilink è superiore.',:lol: :lol: :lol: :lol: :lol: :lol: :lol: :lol: :lol: :lol: :lol: :lol: :lol: :lol: :lol: ,,,,,,,,,,,,,,
[Indagine] Provenienza acquisti Delta,https://www.autopareri.com/forums/topic/30652-indagine-provenienza-acquisti-delta?&page=9#comments,2010-05-09 08:33:32,andrea.ippo,,A proposito dei dati di vendita riporto questo link: CarsItaly Sales of cars Fiat Lancia Alfa Romeo Chrysler - Immatricolazioni di auto Fiat Lancia Alfa Romeo Chrysler ,,,,,,,,,,,,,,
Foto del 4 cilindri JTS,https://www.autopareri.com/forums/topic/13952-foto-del-4-cilindri-jts?&page=13#comments,2005-07-05 06:16:17,Wilhem275,,"Fusi ma intendi rimaneggiamenti rispetto ai medesimi GM ? Senza offesa ma cambiare manovellismi testate inventarsi un'iniezione diretta a carica stratificata adottare l'Uniair mi sembra decisamente più di un rimaneggiamento ! Sfido chiunque a guidare un HF-V6 Cadillac e il V6 JTS Alfa e trovare delle analogie che non sia l'origine produttiva del basamento ! E poi si parla tanto di motori australiani motori mezzosangue o cose simili ( minchiate tipo ""Alfa Romeo - Melbourne"" ) come se storicamente i basamenti V6 e 4L Fiat-GM Powertrain fossero delle ciofecacce... Secondo me con l'aria che tira oggi nell'automotive ad Alfa è andata pure bene... Ha dei motori che si distinguono bene per nome e caratteristiche poi chiaramente andranno provati nel bene e nel male... però non parliamone come se Alfa avesse i motori UAZ... NB: so bene che tu da amante del marchio vorresti l'eccellenza e la perfezione e che critichi per spronare a fare meglio... questo è giusto però quando si fa bene glielo dobbiamo pure riconoscere Se si critica così intensamente alla fine si ha l'impressione anche interna di produrre solo cessi e ti passa pure la voglia di far meglio. Almeno per me è così: se quando lavoro bene mi fanno un complimento ben assestato produco il 1000% in più dopo... senza esagerare sennò mi monto la testa ",,,,,,,,,,,,,,
Rullo di tamburi... Giulia Quadrifoglio Vs Bmw M3 Vs Mercedes C63 S,https://forum.quattroruote.it/threads/rullo-di-tamburi-giulia-quadrifoglio-vs-bmw-m3-vs-mercedes-c63-s.110620/page-22,2017-06-01 00:00:00,A-80,'Certo che lo è. Anz ad essere stitic la triade tedesca attualmente ha il vantaggio di avere dei processi consolidati ed un mercat pur nella nicchia di questo genere di aut più ampio che aiutano ad abbattere in maniera significativi i costi. Questo sempre se vediamo le cose per come sono e non per come le sognamo. Ciao.',C'è poco da sognare la prova è lì da leggere e accessibile a tutti ,,,,,,,,,,,,,,
Mitsubishi ASX (Topic Ufficiale - 2009),https://www.autopareri.com/forums/topic/36140-mitsubishi-asx-topic-ufficiale-2009?&page=222#comments,2010-12-06 12:14:37,sarge,,Autopareri - Regolamento Forum Auto Basterebbe che l'utenza invece che sproloquiare inopportunamente sull'operato di chi gestisce il forum da anni non da ieri si desse alla lettura del regolamento e lo rispettasse. Senza tutta una serie di suggerimenti o contestazioni.O continuando a farsi i fatti propri.Come se fosse a casa sua.Il che è evidente segnale di mancanza di senso civico e rispetto del prossimo se non proprio indice di maleducazione. Purtroppo abitiamo in un paese dove tutti sono esperti di tutto e sanno fare meglio il lavoro degli altri senza avere cognizione degli argomenti di cui intendono parlare...Aggiungo che manca completamente l'autocritica o una riflessione sul comportamento tenuto.La responsabilità è sempre e comunque di terzi mai propria. Mi spiace che qualcuno si sia sentito preso di mira.Assicuro che non c'è niente di personale e non sarebbe possibile pensarlo visto che non ci conosciamo. Ci teniamo al rispetto del regolamento per ovvi motivi di fruibilità del forum.Chi non è daccordo non è costretto a stare qui. Di sicuro chi intende utilizzare questo spazio lo fa secondo le regole dettate dal regolamento. E se adesso abbiamo finito con queste puntualizzazioni auspicherei un ritorno all'argomento della discussione. Grazie per la collaborazione. ,,,,,,,,,,,,,,
Kia Sportage 2016,https://www.autopareri.com/forums/topic/58896-kia-sportage-2016?&page=3#comments,2015-07-21 05:14:30,nellenjoy,,brutta...a prima vista sembra una pegiò ,,,,,,,,,,,,,,
LOVE STORY,http://www.porschemania.it/discus/messages/502415/232727.html?1173004804,2007-03-03 13:33:00,littleleon,,fantastico la boxster \xe8 parte del passato bello davvero.,,,,,,,,,,,,,,
Astra 1.8 140CV,https://www.bmwpassion.com/forum/threads/astra-1-8-140cv.26738/page-3,2004-12-26 00:00:00,resunoiz,,più che altro..nn mi rendo conto di come starebbe sto parabrezza dall'esterno dell' auto dalla foto su ovviamente l'effetto è splendido ! cmq bianca è bellina..ma su questa auto x me il nero rulezzzzzz ,,,,,,,,,,,,,,
Scénic XMod - Topic Ufficiale,https://forum.quattroruote.it/threads/sc%C3%A9nic-xmod-topic-ufficiale.14456/page-156,2010-09-28 00:00:00,barnye64,'ho aspettato 3 mesi senza problemi ma questi ultimi giorno non passano piu :lol:',*R*E*S*I*S*T*I* Sarai ripagato ampissimamenteeeeeeeee ,,,,,,,,,,,,,,
è scesa una lacrimuccia,https://forum.quattroruote.it/threads/%C3%A8-scesa-una-lacrimuccia.81904/page-3,2013-10-10 00:00:00,|pantone|,"'Bisogna anche vedere di quali cifre si parl perché per le Xc70 ""in saldo"" si parla di auto che sfondano i 40.000? scontat ovvio che sia più difficile farle fuori rispetto ad una Xc70 del 2005'","per xc70 d5 ""in saldo"" intendevo quelle del 2005/2006 non quelle nuove a km0. poi mi accorgo ora che ho scritto centinaia invece che decine ma il ragionamento resta immutato. in sostanza intendevo dire che io oggi con una macchina vecchia di 8 anni ( solo ) apparentemente invendibile in realtà l'ho piazzata a un buon 30% in più rispetto alla versione che viene comunemente ritenuta più facilmente commerciabile. ciao ",,,,,,,,,,,,,,
TPMS,https://forum.quattroruote.it/threads/tpms.113155/page-2,2018-12-16 00:00:00,Rust Never Sleeps,"""P.S. per escludere altre cause: sei sicuro che la clonazione sia stata fatta correttament copiando il codice valvola per valvola (sono tutti diversi)? Te lo chiedo perché anch'io la prima volta dopo la clonazione ebbi lo stesso problem e il gommista a cui mi ero rivolto fu costretto a chiamare il tecnico che gli fornisce le valvole programmabili che rifece l'operazione correttament evidentemente la prima volta il gommista aveva sbagliato qualcosa.""","Guarda c'ero anch'io lo scorso anno quando le valvole originali sono state clonate e programmate in quelle del set invernale una ad una rimontandole nelle posizioni originali. Infatti per tutto l'inverno nessuna spia accesa. Poi in primavera ho rimontato i cerchi originali invertendo le anteriori con le posteriori e teeech…. spia accesa.fatto spegnere in concessionaria. Quindi adesso dovrei resettare di nuovo dal gommista per fare spegnere l'insulsa spia gialla… ...sistema del menga e ripeto studiato solo per farci spendere tempo e soldi da concessionari e gommisti. E' una piaga che affligge un po' tutti i marchi e dalla quale Subaru non si è sottratta. In occasione della prova della XV my 2018 ho inoltre notato che compariva la scritta ""pressione bassa pneumatico"" e quindi noto rispetto alla my 2017 un piccolo passo in avanti… ...naturalmente un aggiornamento sulla my 2017 manco a parlarne... ",,,,,,,,,,,,,,
Info i20 1.6 CRDi VGT il filtro crea problemi? sì! FRENA da SOLA!!!,https://forum.quattroruote.it/threads/info-i20-1-6-crdi-vgt-il-filtro-crea-problemi-s%C3%AC-frena-da-sola.19483/page-2,2010-06-22 00:00:00,nico.s,,cari tutti mi sto leggendo le vostre sulla i20 CRDi ... ma vorrei capire prima di fare possibili irreparabili errori: è una macchina che vale la pena acquistare o no ? il mio ballottaggio è con una Yaris 1.400 diesel: mi date un consiglio per piacere ? nico ,,,,,,,,,,,,,,
[HONDA] Nsx - una supercar per pochi,https://www.autopareri.com/forums/topic/19426-honda-nsx-una-supercar-per-pochi,2006-08-31 20:20:35,Sonata_Arctica,,Dico soltanto che quest'auto uscita nel 90 e con un motore di ( ora ) soli 3.2 litri per 280cv dichiarati tiene dinamicamente testa alle supercar europee ( DI OGGI ) in diversi test. ,,,,,,,,,,,,,,
Auto che pesano di più 2007,https://www.bmwpassion.com/forum/threads/auto-che-pesano-di-pi%C3%B9-2007.39088/page-2,2006-09-26 00:00:00,Maiki,,Perchè ? Guarda che non parlavo di nessun caso particolare mi piace pensare che qui dentro siamo tutti veri appassionati non intendevo screditare nessuno ci mancherebbe altro mi riferivo alle classiche chiacchere da bar che senti in giro... tutto qui. Non te la prendere. ,,,,,,,,,,,,,,
Salvatela o vendetela,https://forum.quattroruote.it/threads/salvatela-o-vendetela.119957/page-38,2019-01-29 00:00:00,danilorse,"'Verissimo. Esempio: Aud produce A1 sfruttando pianal meccanich tecnologie delle cugine prodotte in Skod Seat e V senza che il top di gamma ne risent anzi. Sono tutte percepite come Aud ver il numero dopo la A non sembra faccia tanta differenza Se lo fa (farà?) Alfa Rome producendo un modello ""basso"" sfruttando tecnologie Jeep o Fiat (che poi non hanno niente da invidiare a nessuno) ecco che automaticamente anche Giulia o Stelvio corrono il rischio di risentirne in negativ quanti inizieranno a chiedersi (se non a sentenziare) quanto c'è in loro di componenti comuni FCA messi solo per risparmiar e che non sono vere Alfa. Che poi queste vere Alfa quali sarebbero? Quelle del passato? Ok erano auto eccezional sempre avanti tecnologicament era un piacere guidarle. Ma il concetto di piacere di guida è cambiato ogg come cambiamo pure no col passare degli anni. Quand a vent'ann guidavo l'Alfetta 2000 di mio zio lo facevo in modo diverso da come guido la mia Giulia ogg sono differenti le macchine ma lo sono pure io. Come fare all'amor a vent'anni lo si fa diversamente che a sessanta.'",In teoria avresti ragione. La differenza pero' sta nel fatto che il gruppo Vw sta facendo un lavoro di continuo sviluppo e investimento sul prodotto da oltre trent'anni conquistandosi la fiducia dei clienti. Purtroppo non si puo' dire lo stesso del gruppo Fca e di Alfa dove i prodotti difficilmente hanno continuita' e i clienti spesso sono costretti a passare alla concorrenza. Giulia e Stelvio sono un ottimo punto di ripartenza ma non si puo' pensare che la gente si dimentichi improvvisamente i 5 anni di buco con la 159 o l'attesa di quasi 30 anni per avere un'auto TP. Per riconquistare la clientela bisogna lavorare duro per anni e anni ! ! ,,,,,,,,,,,,,,
"Alfa Romeo ""Unica"" - allestimenti extraserie",https://www.bmwpassion.com/forum/threads/alfa-romeo-unica-allestimenti-extraserie.48343/,2003-05-23 00:00:00,El Nino,,"Alfa Romeo ritorna al Salone Internazionale di Francoforte con un nuovo stand di forte impatto scenografico che mette in risalto il design sinuoso delle sue vetture. Realizzata con materiali preziosi e innovativi l’area espositiva si contraddistingue per l’alternarsi del bianco e del nero che unito al rigore e all’essenzialità del progetto concorre a ricreare un’atmosfera sofisticata che bene rappresenta la tecnologia e l’eleganza italiana.Immerso in questa suggestiva scenografia dunque il pubblico scopre il mondo Alfa Romeo e in particolare il Programma di Personalizzazione “Alfa Unica” che è il principale focus dello stand. Infatti tutte le vetture esposte al Salone propongono alcuni elementi di questa nuova offerta del Marchio ed espressione del miglior Made in Italy che permette di rendere ancora più esclusiva la propria vettura. Commercializzata da alcuni mesi sull’intera gamma “Alfa Unica” nasce dall’esperienza di Alfa 8C Competizione e si sviluppa attraverso tre aree tematiche: ""Vintage” ""Collezione"" e “TI”. La prima linea reinterpreta con eleganza e modernità la tradizione Alfa Romeo sia nei colori di carrozzeria sia nelle sellerie confezionate con cura artigianale. Il catalogo ""Collezione"" invece propone ai clienti un’esplorazione nel mondo della moda e dell’eleganza come dimostrano materiali pregiati inserti in metallo e colori laccati multistrato della carrozzeria. Infine la linea “TI” rende omaggio alla tradizione sportiva Alfa Romeo dove lo sport e le competizioni hanno sempre avuto un ruolo fondamentale per lo sviluppo di tecnologie d’avanguardia offrendo assetto ribassato impianto frenante potenziato cerchi in lega e pneumatici ad alte prestazioni.Per rendere ancora più originale lo stand le pedane su cui sono esposte le vetture hanno colori specifici per ciascuna delle tre aree di “Alfa Unica” mentre una zona dedicata consente di approfondire in modo interattivo la conoscenza del Programma di Personalizzazione attraverso schermi e postazioni multimediali. ",,,,,,,,,,,,,,
Recensione: Mazda6 MPS,https://www.autopareri.com/forums/topic/21379-recensione-mazda6-mps,2007-01-04 18:16:30,Alex87,,Recensione interessante per un'auto assolutamente interessante... a parte che mi piace parecchio come linea ma a quanto sento non solo da te è anche piacevole e affidabile ad un prezzo onesto... ,,,,,,,,,,,,,,
SANTA FE con nuovo 2.2 CRDI da 197 CV.,https://forum.quattroruote.it/threads/santa-fe-con-nuovo-2-2-crdi-da-197-cv.35401/,2011-05-11 00:00:00,aponus,,Provata stamattina dal concessionario con cambio automatico a sei rapporti. Non male. Buon comportamento su strada. Unico neo la frenata: un pò lunghetta. ,,,,,,,,,,,,,,
Nuova Ford Fiesta,https://forum.quattroruote.it/threads/nuova-ford-fiesta.112143/,2017-12-22 00:00:00,alfalele,,No non dico che non vanno bene solo che come allestimento sportivo ci stavano bene sedili con i fianchi più pronunciati ! ! ,,,,,,,,,,,,,,
Ritorna la Sportwagon.......,https://www.autopareri.com/forums/topic/17774-ritorna-la-sportwagon?&page=17#comments,2006-02-06 17:24:10,blueyes,,si a quanto pare ,,,,,,,,,,,,,,
Maserati Ghibli 2013,https://www.autopareri.com/forums/topic/51327-maserati-ghibli-2013?&page=230#comments,2015-08-30 21:32:01,jacksparrow.82,,Esattamente.. Pensare che le vetture finiscano per caso nel circuito dei noleggi a lungo termine senza una nemmeno vaga valutazione di quello che è il cliente medio di questo settore mi pare francamente troppo. ,,,,,,,,,,,,,,
Subaru long life e hypermilers,https://forum.quattroruote.it/threads/subaru-long-life-e-hypermilers.119678/page-3,2018-12-11 00:00:00,giorgiotoffa77,"""Ogni volta che nevica.. ed io esco a posta a guidare.. non ce n'è per nessuno...""",Con la Suby in tangenziale andiamo a comandare... ,,,,,,,,,,,,,,
Consumo olio DS3 motore 1.4 VTi,https://forum.quattroruote.it/threads/consumo-olio-ds3-motore-1-4-vti.83000/,2014-11-26 00:00:00,mzanella,,All'ultimo cambio ho messo il 5w40 total synt ma non ho visto miglioramenti... Il consiglio che ho avuto è di passare a un total synt di qualità 5w30 di marca Total o meglio Motul. Proverò visto che non ho altre alternative. ,,,,,,,,,,,,,,
