Titolo,URL,Timestamp,User,(Testo Citato),TESTO,Costruttore,Modello,Brand,Interni,Esterni,Meccanica,Prestazioni,Consumi/Autonomia,Motore,Elettrico,Fuoristrada,Elettronica di Bordo,Manutenzione,Assistenza/Concessionari
"Freno di stazionamento: le varie tipologie di ""freno a mano""",https://www.autopareri.com/forums/topic/57676-freno-di-stazionamento-le-varie-tipologie-di-freno-a-mano?&page=3#comments,2015-02-24 15:31:28,Nicola_P,,Avete detto cose molto interessanti e sollevato ottime critiche nelle quali mi trovate favorevole. Ora dopo questo premessa vorrei tirar fuori un altro punto critico: se per qualche motivo il freno elettrico non si azionasse ? Ritengo questa situazione ancor più pericolosa di quella descritta in precedenza visto che se ci troviamo in pendenza innestare la marcia non da alcuna garanzia di tenuta nel tempo. In quali auto il freno elettrico si azione in movimento ? Sarò io all'antica ( haha ho 24 anni ) ma il pulsantino non mi da fiducia preferisco di gran lunga la cara leva. Che poi vuoi mettere trovare un piazzale innevato e non poter fare 2 traversi perchè la maledetta ha un bottoncino come freno a mano ? ,,,,,,,,,,,,,,
Online il sito dell'ecobonus per auto elettriche,https://www.forumelettrico.it/forum/online-il-sito-dell-ecobonus-t4943-120.html?sid=053f872f8b7b19de0856815c966834f2&sid=053f872f8b7b19de0856815c966834f2,2019-04-08 10:31:00,Anlagi,,il concessionario mi ha avvertito che il sito viene attivato alle 12.,,,,,,,,,,,,,,
Smart forTwo... motore fuso...,https://www.bmwpassion.com/forum/threads/smart-fortwo-motore-fuso.31941/page-4,2004-11-24 00:00:00,dot.miglio,,no con la 220 ? azz.ecco xkè a casa di mio zio avevo fatto saltare il generatore ci ho mica attaccato pianola e microfono ? ,,,,,,,,,,,,,,
Alfa Romeo Giulietta (Topic Ufficiale - 2009),https://www.autopareri.com/forums/topic/36127-alfa-romeo-giulietta-topic-ufficiale-2009?&page=318#comments,2010-02-19 15:29:46,francesco147,,sarebbe interessante aver anche un pack per la progression con cerchi bracciolo e fendi ......si alla fine poi i barboni comprerebbero la sbase no meglio distinctive +pack ,,,,,,,,,,,,,,
PROVOCAZIONE Duster!!! Parto con un'idea e mi ritrovo con un'altra macchina.,https://forum.quattroruote.it/threads/provocazione-duster-parto-con-unidea-e-mi-ritrovo-con-unaltra-macchina.39811/page-3,2011-01-06 00:00:00,lombalgico,,L ? ho ritirata oggi: 1.5 dCi ( turbodiesel ) 4x4 con ESP Clima StereoMp3 con comandi al volante Bracciolo trai sedili anteriori volante in pelle cerchi in lega vetri scuri e rifiniture satinate sui fascioni sottoporta sui paraurti e sulle barre del tetto in fine pure la ruota di scorta di dimensioni normali più di serie 3 anni di garanzia estendibili a 5 per il motore con 299 ? . Prezzo reale: 19500 ? Prime impressioni: Solidità di assemblaggio molto buona nessun fruscio aerodinamico fino a 120Kmh motore bello pieno sembra un 1900 da sicurezza alla guida sospensioni ben tarata. Si paga quello che da secondo me non è un ingenuo oppure un affarista chi l ? ha compera è uno che cercava quel tipo di vettura. Se si vuole qualcosa di diverso si acquista un ? altra auto. Un dato di fatto è che piace anche a chi non ci capisce niente di auto e non sa quanto costa e sta avendo molto successo anche perché è un po ? più fuoristrada delle altre escluso ovviamente il Grand Vitara. ,,,,,,,,,,,,,,
Via Giampetruzzi........,https://www.autopareri.com/forums/topic/15831-via-giampetruzzi?&page=2#comments,2005-10-02 04:17:02,T a u r u s,,ne dubito perche giocherebbe la sua affidabilita' ed era lui il responsabile di questi motori...dunque 1+1=2 ,,,,,,,,,,,,,,
Con 10.000 euro..,https://www.bmwpassion.com/forum/threads/con-10-000-euro.44688/page-3,2007-02-10 00:00:00,Biggie Smalls,"""...ahia sempre più convinto che sia un'affare... per loro """,Caltanissetta ! :wink: ,,,,,,,,,,,,,,
Chi sono? Mi presento,https://forum.quattroruote.it/threads/chi-sono-mi-presento.13/page-82,2014-02-19 00:00:00,ivanpg,,Benvenuti ai nuovi e anche chi si vuol presentare ,,,,,,,,,,,,,,
KIA VENGA 1.4 TD 90 CV COME VA?,https://forum.quattroruote.it/threads/kia-venga-1-4-td-90-cv-come-va.71119/,2012-10-30 00:00:00,matrix87869,,"Sicuramente non è paragonabile ad una classe A anche perchè non hai l'opportunità nemmeno di scegliere gli interni ( pelle colore... ) però con una cifra che alla mercedes non vedrai mai ti porti a casa una macchina con tutti gli optional considera che con 20000 ? prendi il top con navigatore sensori finestrini oscurati e altre mille cose poi io l'ho acquistata settimana scorsa e fanno uno sconto di quasi 3000 ? sul nuovo. Come motore il 90cv diesel secondo me è più silenzioso di quanto tanti altri dicano non è una scheggia in accellerazione però se devi sorpassare o chiedere una spinta in più è reattiva e sufficiente con consumi accettabili poi ha un cambio 6 marce che in autostrada a 140Km/h ti dà una guida stabile e tranquilla secondo me grazie anche hai cerchi in lega del 17"" ( di serie ) . La macchina per la cifra è più che apprezzabile naturalmente non ha la classe della mercedes però quando vai a cambiare uno specchietto non ti chiedo 350 ? e in più KIA ti dà 7anni di garanzia su tutto e non è una brutta cosa. ",,,,,,,,,,,,,,
Scandalosa  presa in giro,https://www.bmwpassion.com/forum/threads/scandalosa-presa-in-giro.113361/page-4,2007-12-07 00:00:00,ggcapp,,ti è andata bene ! ! ,,,,,,,,,,,,,,
emulatore DPF mazda 5,https://forum.quattroruote.it/threads/emulatore-dpf-mazda-5.43941/page-3,2011-06-27 00:00:00,melego73,,sono le regole per poter mantenere inalterata la garanzia altrimenti ciccia ognuno e' libero di non farlo e di prendersi i propri rischi anche se capisco che spendere 115 ? di olio dopo soli 5000km faccia incazzare e non poco. Questo e' il mondo Mazda benvenuto ,,,,,,,,,,,,,,
Climatizzatore - rumorosità relè inserimento e stacco clima ogni 8 sec.,https://forum.quattroruote.it/threads/climatizzatore-rumorosit%C3%A0-rel%C3%A8-inserimento-e-stacco-clima-ogni-8-sec.112584/,2017-10-12 00:00:00,U2511,'Ma il 50% è impossibile.',Misurato a velocità costante in statale via eobd vedi dati riportati sopra. Concordo con il calo pauroso delle prestazioni che nel mio caso ( pendenze quotidiane al 10-15% ) diventa problematico ( alla fine viaggio a finestrini aperti e il clima non lo uso quasi mai se non per disappannare i vetri nelle stagioni umide ) ,,,,,,,,,,,,,,
la batcaverna 635csi &co,https://www.bmwpassion.com/forum/threads/la-batcaverna-635csi-co.85405/page-145,2004-03-25 00:00:00,batmobile,"""L'unica Porsche su cui sono salito è stata una vecchissima (ma tenuta come nuova) 911 T degli anni '70!motore boxer 2000cc alimentato a carburatori!!scorbutico come pochi...ma come saliva quella lancetta del contagiri...""",Piacerà a puccio ! ,,,,,,,,,,,,,,
Mondiale F.1 - GP dell'Azerbaijan,https://forum.quattroruote.it/threads/mondiale-f-1-gp-dellazerbaijan.116225/page-14,2018-04-30 00:00:00,mani in alto,,L'uomo dalle mille espressioni facciali iceman conosciuto dai più come Raikkonen. ,,,,,,,,,,,,,,
Doblò maxi 1.4 T-Jet mi conviene?,https://forum.quattroruote.it/threads/dobl%C3%B2-maxi-1-4-t-jet-mi-conviene.119865/,2018-12-30 00:00:00,renatom,"""Ok speriamo ben l'olio sembra ok è di colore nero non sembra esserci acqua dentro. Però sembra esserci una piccola perdita sul lato destro del motore""",Difficilmente vedi l'acqua nell'olio dato che va a fondo. Piuttosto controlla se vedi olio nel vaso di espansione del liquido di raffreddamento. ,,,,,,,,,,,,,,
Volkswagen Touran 2015,https://www.autopareri.com/forums/topic/57682-volkswagen-touran-2015?&page=5#comments,2015-06-15 09:54:09,Touareg 2.5,,Listino anche per Touran 2015 Prezzi: 2.0 TDI DSG da 150 CV ordinabile da settembre e il 190 CV da dicembre. ,,,,,,,,,,,,,,
Alfa Romeo Stelvio,https://forum.quattroruote.it/threads/alfa-romeo-stelvio.103307/page-15,2016-11-23 00:00:00,aamyyy,"""Angel forse qui ti deludo un po io ho gli interni neri! Maxago li ha color tabacco. L'ho scritto a suo temp il tabacco che montano su Giulia tende un po' al giallognol a me piacciono quelli più scur più biscotto per intenderc oppure quelli rossi. Col blu Montecarlo i sedili rossi non erano previsti. Se avessi scelto il grigio Vesuvi come avevo fatto nella prima ipotesi di contratt i sedili sarebbero stati certamente rossi. Vedi l'allegato 997 Vedi l'allegato 998 """,Che bella ! ! ! ! ! ! ! ,,,,,,,,,,,,,,
Dipositivi di Illuminazione,https://www.autopareri.com/forums/topic/25082-dipositivi-di-illuminazione?&page=2#comments,2008-02-22 19:40:47,Popy,,Certo non so come spiegarti ma se muovi lo sguardo per esempio sullo specchietto e poi verso la strada e poi osservi un segnale quelle luci le vedi sfarfallare nell'occhio:confused: a me crea fastidio e non sono l'unico tra i miei amici:| ,,,,,,,,,,,,,,
2007 Mercedes- Benz S-Class,https://www.bmwpassion.com/forum/threads/2007-mercedes-benz-s-class.10717/,2004-05-29 00:00:00,akenzo,,,,,,,,,,,,,,,,
Nuovo sito Alfaromeo.it,https://www.bmwpassion.com/forum/threads/nuovo-sito-alfaromeo-it.56071/,2005-09-14 00:00:00,bateyes,'cmq è lo stesso problema delle macchine... troppo pesanti! almeno sono coerenti ',www.alfaromeo.itCredo che sia il sito piu' pachidermico che abbia mai visto Quasi ai livelli di quello della Bravo.Una volta caricato direi che non e' male c'e' stato sicuramente un grosso lavoro. Pero' TROPPO PESANTE ! Poi ... nella sezione GT ci sono 4 foto in croce e non e' possibile scaricare il catalogo in pdf... peccato.Analizzo le altre sezioni ... a dopo ,,,,,,,,,,,,,,
Lancia Delta Facelift (Topic Ufficiale - 2011),https://www.autopareri.com/forums/topic/27109-lancia-delta-facelift-topic-ufficiale-2011?&page=10#comments,2008-02-05 12:56:58,&lt;&lt;Scarface&gt;&gt;,,Smaltita la sbornia da foto chiedo senza molta speranza qualche chiarimento ai ben informati: - navigatore: non è il connect ( mancano i tastini ) o ne è la versione evoluta cmq parrebbe nuovo cos'è ? ? ? - cambi robotizzati e automatici li avevano promessi per gennaio anche su Bravo ma non li ho mai visti quali hanno previsto ? ,,,,,,,,,,,,,,
Preventivo Classe A che ne pensate???,https://forum.quattroruote.it/threads/preventivo-classe-a-che-ne-pensate.122277/page-5,2019-04-29 00:00:00,Ax-80,"""Ovviamente! Ho specificato subito che si trattava di una battut inoltre relativa a quello che IO avrei pensato ad un ipotetico semaforo. Di oggettiv come dici t c'è il prezzo aggiungo i il numero di esemplari venduti: in Itali nettamente superiori per la classe A. Considerato che il segmento è lo stesso e i motor in alcuni cas anch forse non sono l'unico a pensare che la linea della Megane non sia proprio il massimo...""",Molti criticano il faro unico dietro ma sembra una soluzione ripresa anche dalla vw ,,,,,,,,,,,,,,
Fiat 1.4T 110KW,https://www.bmwpassion.com/forum/threads/fiat-1-4t-110kw.26714/,2006-07-03 00:00:00,alfaGT,"'Il 1.4T è semplicemente il 1.4 Starjet 16V (nome interno alla Fiat: ""SuperFire"") con una turbina. La tecnologia uniair con questo motore non centra una fava'",,,,,,,,,,,,,,,
Nuova berlina 'ammiraglia' Alfa,https://forum.quattroruote.it/threads/nuova-berlina-ammiraglia-alfa.112352/page-4,2017-09-22 00:00:00,?angelo0,'N 8-9 volte inferiori no. Se ben ricordo se ne prevedevano 4.000/anno e ora da fonti in mio possesso siamo oltre le 2.000 (nel 2016 spider compresa. Quindi oltre la metà del previst non 8 volte men e comunque più delle Elise.........',E´arrivato il tempo che questa macchina si avvicina negli allestimenti interni alla cayman o piu... e portare la potenza a 300CV cosi anche se dovrebbe crescere di peso le prestazioni rimancono. ,,,,,,,,,,,,,,
Legame potenza-giri motore,https://www.autopareri.com/forums/topic/9746-legame-potenza-giri-motore,2004-11-10 08:43:48,TonyH,,Più che di rendimenti è un problema di misure caratteristiche e soprattutto di fasatura..... Metti l'albero a camme della moto alla macchina e magicamente ti arriva a 9000 giri.... ,,,,,,,,,,,,,,
Olio oltre il livello massimo,https://forum.quattroruote.it/threads/olio-oltre-il-livello-massimo.52794/,2011-06-29 00:00:00,manuel46,"""Nono manuel l'olio l'ho controllato questa mattina ad auto fredda e in pianura proprio per non avere nessun dubbio...""",Allora fai un salto meglio un cambio olio oggi che un motore rotto domani ! ,,,,,,,,,,,,,,
Finalmente....ho deciso 18oooooh,http://www.porschemania.it/discus/messages/502415/201260.html?1163181440,2006-10-12 10:42:00,erre,,scusa Giorgio ma avendo tu una boxster del 2001 perch\xe8 dovresti montare i '18 turbolook II che fanno parte del my 2003 ? Se proprio devi cambiarli monta i turbolook I dedicati al tuo anno modello ! E poi cifre che si aggirano intorno ai 1800-2000 per 4 cerchi con gomme ed equilibratura mi sembrano eccessivamente al ribasso non dimenticate che le ruote sono l'unico elemento che ci tiene a contatto con l'asfalto.....ergo.. meglio non risparmiare troppo specie con vetture da alte prestazioni come le Porsche. saluti,,,,,,,,,,,,,,
La lybra...,https://www.autopareri.com/forums/topic/13089-la-lybra?&page=5#comments,2005-05-19 10:57:18,bialbero,,be insomma di Alfa il motore 5 cilindri mi pare abbia ben poco anzi direi nulla se non lo stabilimento ex Arna di Pratola Serra cmq il 5L è un grande motore dalla bellissima sonorità. ,,,,,,,,,,,,,,
Motori Skoda non più gasabili,https://forum.quattroruote.it/threads/motori-skoda-non-pi%C3%B9-gasabili.115444/,2018-03-15 00:00:00,bestchicco,,"Il TCE 0.9 è a iniezione indiretta quindi è trasformabile mentre il ""fratellastro"" il TCE 1.2 no ! Comunque un meccanico Renault non me l'ha magnificato anzi lui lo sconsiglia vivamente troppo piccolo e ""delicato"" a parer suo. ",,,,,,,,,,,,,,
159 Polizia - nuova livrea,https://www.bmwpassion.com/forum/threads/159-polizia-nuova-livrea.41433/page-2,2003-11-20 00:00:00,Luca318,,"nessuna puntura volevo solo capire cosa intendevi anche xkè di tuning non ha proprio nulla e di ""tamarro"" volevo capire secondo te cosa c'era... forse il fatto che è vistosa.... ? ma ok.. è una volante della polizia... non ho mai visto nessuna autopattuglia girare inosservata francamente...se si son decisi a cambiare le grafiche degli adesivi rinnovandole un po tanto meglio... io nn ci vedo niente di sconcertante per i famigerati led blu li trovo un ottima soluzione così al buio si vedono subito anche a lampeggianti spenti diverso invece è il discorso che facevi tu sui led sulle autovetture ai quali hanno sempre fatto una lotta spietata ma qui potrei inalberarmi come una vipera se penso ai camion che vanno in giro che sembrano degli alberi di natale e nessuno dice nulla ma questo è un altro discorso ",,,,,,,,,,,,,,
Audi A1 2011,https://www.autopareri.com/forums/topic/37039-audi-a1-2011?&page=40#comments,2010-02-19 17:22:14,Pandahobby,,"magari è solo una mia impressione ma IMHO l'Ibiza SC sa molto più di ""Audi"" rispetto questa....non trovate ? soprattutto nella zona posteriore ",,,,,,,,,,,,,,
I primi 5555 della 5oo,https://www.autopareri.com/forums/topic/27001-i-primi-5555-della-5oo?&page=2#comments,2008-02-03 23:19:42,Tommitel,,Apperò ! ! ! Dai che ti è andata bene ! ! ! Ma le altre 2 volte in cui aveva provato a ridursi un rottame ? ? ? quali sono ? ? ,,,,,,,,,,,,,,
Rabbocco olio Macan turbo,http://www.porschemania.it/discus/messages/771175/784135.html?1517415539,2017-06-09 09:58:00,kpnaz,,C'\xe8 da dire per\xf2 che abito in una piccola citt\xe0 per cui non faccio code ma la differenza di consumo con la tua \xe8 veramente inspiegabile,,,,,,,,,,,,,,
159 su Autoprò,https://www.autopareri.com/forums/topic/16394-159-su-autopr%C3%B2?&page=3#comments,2005-10-24 21:22:31,simonepietro,,non lo sò dal punto di vista dell'immagine quali possono essere le conseguenze ma vedo più catastrofico per l'imagine l'adozione di una particolare famiglia di v6 dal punto di vista tecnico aspettiamo di conoscere il peso e la rigidità della futura spider alfa e poi tireremo le somme ,,,,,,,,,,,,,,
FCA - 1.0 e 1.3 MultiAir III - Motori GSE (FIREFLY) e GME,https://www.autopareri.com/forums/topic/61194-fca-10-e-13-multiair-iii-motori-gse-firefly-e-gme?&page=94#comments,2018-09-21 11:52:08,stev66,,Per la Grecia c'è la giulia fire 1.2 69 CV ,,,,,,,,,,,,,,
Auf wiedersehen Bmw,https://forum.quattroruote.it/threads/auf-wiedersehen-bmw.120502/page-3,2019-02-04 00:00:00,mg27,,Magari mi sbaglio o mi confondo ma mi eri sembrato abbastanza interessato anche allo Stelvio a benzina ma magari mi confondo con qualche altro forumer. La compass è una buona auto ovviamente su strada non sarà una BMW ma nelle motorizzazioni di punta e con la TI sa il fatto suo. Inoltre ha anche una linea piacevole e muscolosa specie al frontale secondo me. ,,,,,,,,,,,,,,
Volvo XC60 (Topic Ufficiale - 2008),https://www.autopareri.com/forums/topic/22906-volvo-xc60-topic-ufficiale-2008?&page=7#comments,2008-09-15 15:41:43,Dodicicilindri,,Molto bello il frontale peccato che di lato abbia un po' perso la dinamicità della concept. Bene anche la coda. Imho questa e la Q5 sono le migliori suv medie molto meglio della X3 ( mai piaciuta a differenza della X5 ) e della GLK. ,,,,,,,,,,,,,,
A quando 2.4 JTD su Alfa GT????,https://www.autopareri.com/forums/topic/14142-a-quando-24-jtd-su-alfa-gt?&page=2#comments,2005-07-12 02:42:18,ACS,,Ma dici quella da gara ? ? o è stradale ? ? fare una One-Off si può sempre adattare chissà cosa hanno spostato/tolto... Ho visto Duetti con il Busso ciò non significa che industrialmente sia fattible in grandi numeri ,,,,,,,,,,,,,,
Pneumatici semi slick,http://www.porschemania.it/discus/messages/502415/658527.html?1372851222,2013-07-03 10:25:00,andrea70,,ecco bravo evita di rispondermi.,,,,,,,,,,,,,,
Jaguar F-Type Convertible M.Y. 2015,https://www.autopareri.com/forums/topic/48781-jaguar-f-type-convertible-my-2015?&page=25#comments,2013-02-04 15:27:51,-jag-,,"giusto ! io ovviamente non l'ho provata ma chi ci ha messo mani ( e piedi ) su mi ha assicurato e mi fido che si tratta di una vera sportiva come non se ne vedevano in Jaguar da 30 anni e più. So per certo che in Jaguar hanno collaborato sul progetto anche quelli della Williams più altri ingegneri esterni e che rimarcano il concetto ""pure sports car"" proprio perchè fin dall'inizio la volevano così per a ) la volontà della clientela Jaguar che desiderava dai tempi della concept F-Type una sportiva b ) differenziarsi dalla futura XK che invece sarà una GT ad altissime prestazioni ma pur sempre GT c ) pochi sanno che Tata desidera ardentemente far tornare la Jaguar nelle competizioni ed in particolar modo alla 24h di Le Mans ma la XK non è la giusta base ( il fallimentare progetto JaguarRSR ne è la conferma ) per una ""racing version"" e quindi ci vuole il prodotto giusto che a sua volta partecipando diventa un importante srumento pubblicitario ed immagine per tutto il brand. ",,,,,,,,,,,,,,
La felice tristezza stilisitica della serie 6,https://www.autopareri.com/forums/topic/5883-la-felice-tristezza-stilisitica-della-serie-6,2004-04-01 08:42:50,Velox,,Innanzitutto che la 166 era già pronta nel 2006... questa mi giunge nuova un'auto che è stata pensata nel futuro... Se dovessi dare dei voti di bellezza a Bmw 6 e Alfa 166 my98 direi: Bmw serie 6: 9 Alfa 166 my98: 4 ,,,,,,,,,,,,,,
Quale Stelvio acquistare?,https://forum.quattroruote.it/threads/quale-stelvio-acquistare.117465/page-17,2018-09-25 00:00:00,?angelo0,'complimenti Angel due ottime e belle auto....meglio di così non poteva andare visto che ognuno ha avuto ciò che gradiva. Peccato per la lunga attesa della Giulia. Non pensavo che si dovesse aspettare così tanto tempo. ',Infatti non é cosi di solito entro le 8-12 settimane puoi averla. Ma come ho scritto prima il conce cé l ha voluta alla grande e siccome fino a Dicembre per lui non era previsto un colore del genere ( nel Suo contingente annuale delle KM 0 ) mi aveva offerto di averla in Gennaio a dire il vero il mese di gennaio non va a me bene proprio perché siamo nel pieno inverno con sale sulle strade e granulato di pietruzze. Cosi abbiamo pensato che fosse meglio in Primavera. ,,,,,,,,,,,,,,
Caymano in arrivo!,http://www.porschemania.it/discus/messages/502416/234182.html?1180378143,2007-04-17 20:28:00,flashback,,come ho scritto concordo con Luca ,,,,,,,,,,,,,,
Guten morgen! ,http://www.porschemania.it/discus/messages/10548/800877.html?1486723985,2017-01-23 08:37:00,crazydiamond,,Si sono dimenticati il trabattello ! ,,,,,,,,,,,,,,
impianto monofuel e risparmio del 75€ del bollo,https://forum.quattroruote.it/threads/impianto-monofuel-e-risparmio-del-75%E2%82%AC-del-bollo.119355/,2018-11-30 00:00:00,jardel84,,non so cosa vuoi dire fatto sta che questa cosa è abbastanza sconosciuta dalle mie parti ( napoli e provincia ) e nessuno la fa questo mi fa pensare che sia una cosa che vogliono tenere segreta altrimenti se si sa troppo c'è chi potrebbe usufruirne e non pagare il 75% del bollo. se si sapesse magari uscirebbero fuori anche dei prezzi piu' umani per fare il lavoro piu' c'è domanda piu' i prezzi si dovrebbero abbassare non credo che sia perchè è sconveniente certo dipende da quanti anni ha l'auto ma finora manco un preventivo sono riuscito a rimediare...sarà che su parecchie cose qui siamo terzo mondo ,,,,,,,,,,,,,,
BRACCIOLO APPOGGIABRACCIO PER LANCIA YPSILON,https://www.autopareri.com/forums/topic/8291-bracciolo-appoggiabraccio-per-lancia-ypsilon,2004-07-28 20:25:39,126/131,,che io sappia no ma non sarebbe male mi piacerebbe che ci fossero pure gli interni in radica di noce la versione vecchia poteva averceli ,,,,,,,,,,,,,,
Volkswagen Up! 2011,https://www.autopareri.com/forums/topic/44234-volkswagen-up-2011?&page=70#comments,2012-01-23 13:25:07,kla6630,,Ragazzi ma solo a me ricorda il Vaneo Mercedes nel frontale ? ,,,,,,,,,,,,,,
Scénic XMod - Topic Ufficiale,https://forum.quattroruote.it/threads/sc%C3%A9nic-xmod-topic-ufficiale.14456/page-145,2010-07-30 00:00:00,FSA,,Per il prezzo che si deve sborsare l'Arkamys è un impianto molto buono. Personalmente non trovo affatto carenti i bassi a volume alto se invece siete abituati al volume basso basta attivare dal menù la funzione loudness e magari impostare nell'equalizzatore il genere pop. Con quelle impostazioni anche se un orecchio esigente sentirà la mancanza del subwoofer io mi ritengo parecchio soddisfatto. ,,,,,,,,,,,,,,
Volkswagen Phaeton restyling,https://www.bmwpassion.com/forum/threads/volkswagen-phaeton-restyling.37180/,2004-07-13 00:00:00,Vegeta330,,autoweek.nl Modifiche praticamente impercettibili. Ottima macchina per il resto totalmente incompresa ma che alla VW è costata poco o nulla dato che hanno rigirato il progetto ricarozzandola e vendendola con il marchio Bentley ( di Continental GT ce ne sono in giro ) . I motori a benzinadovrebbero essere gli stessi ( 4.2 V8 e 6.0 W12 ) a parte il 3.2 che è stato sostituito dal 3.6 V6. Diesel idem molto probabile che il 3.0 sia passato a 235CV Nel 2009 comunque arriva la nuova. Che sarà fatta sulla base della A8 ( in tanti sbagliano a pensare che l'attuale è fatta sull'A8....sono due auto completamente differenti ) ,,,,,,,,,,,,,,
Nuova prova Brera 3.2 JTS,https://www.bmwpassion.com/forum/threads/nuova-prova-brera-3-2-jts.28691/page-2,2004-07-13 00:00:00,Vegeta330,'Insomm o levano 200 kg...o la possono già vendere a km 0',Si il posteriore è da urloMA QUANTO CAXXO E' GROSSO ? ! ,,,,,,,,,,,,,,
Grave mancanza dispositivi di sicurezza autovettura Subaru Forester,https://forum.quattroruote.it/threads/grave-mancanza-dispositivi-di-sicurezza-autovettura-subaru-forester.116384/,2018-05-04 00:00:00,pilistation,,"comunque col freno a mano tirato la macchina sta ferma basta farlo con la mano destra mentre la sinistra apre la porta... E' mai capitato a nessuno in moto di trovarsi una vespa nel casco ? Si imballa il motore e si mette il cavalletto mica ci si lancia fuori al volo. Non è che hanno un sistema che mette il cavalletto in automatico ""se uno deve uscire per un'emergenza"" ",,,,,,,,,,,,,,
logo Audi,https://www.autopareri.com/forums/topic/5879-logo-audi?&page=5#comments,2004-04-01 23:34:53,T a u r u s,,No caro il nuovo non e' la parte cromata ( non grigia... ) ma il nuovo disegno della corolla a foglie e' modernissimo il fondo azzuro/blu nuovo ( l'originale era azzuro uniforme ) che da impressione di tre e non due dimensioni e la scritta art deco FIAT tridimensionale reinterpretata...guarda che la grafica complessivamente e' molto moderna e nuova... Molte volte lo stile BauHaus viene indentificato come nazista perche adottato e di moda nel periodo nazista sia il logo di audi che di VW ( anche se successivo alla guerra proma la VW si chiamava K.D.F. dal nome di una agenzia di un ministero nazista ) seguono lo stile spartano della Bauhaus......anche Merc piano piano ha adottato questa tendenza bauhaus nel suo logo...comunque il logo ufficiale della MB non e' quello semplice Bauhaus ma questo e non mi sembra piu' nuovo come grafica di quello Fiat Alfa o Porsche: ,,,,,,,,,,,,,,
Manca una sportiva,https://www.autopareri.com/forums/topic/28695-manca-una-sportiva?&page=2#comments,2008-05-20 13:27:37,Stefano73,,Certo.......cmq ora quel genere di vetture non va più nemmeno con marchi ben più quotati di fiat. Cmq fiat a inizi anni 90 ha fatto un grosso errore a non fare la punto-coupè....ossia la tigra fiat quella si che avrebbe fatto numeri. Nel 2000 non so se costava più una hiundai coupè o una coupè fiat a KMO....eppure vendeva più la coreana. ,,,,,,,,,,,,,,
Audi A3 2.0 TDI 170CV (anche DSG e quattro),https://www.bmwpassion.com/forum/threads/audi-a3-2-0-tdi-170cv-anche-dsg-e-quattro.22057/page-2,2006-02-03 00:00:00,Audioso,,Ottima questa macchina con questo motore 170cv e DSG Come prezzi a che livello siamo ? Scompare il vecchio 140cv ? Perché non si può avere DSG + Quattro ? Ps: spero che il 170cv sia più silenzioso del 140cv ,,,,,,,,,,,,,,
