Titolo,URL,Timestamp,User,(Testo Citato),TESTO,Costruttore,Modello,Brand,Interni,Esterni,Meccanica,Prestazioni,Consumi/Autonomia,Motore,Elettrico,Fuoristrada,Elettronica di Bordo,Manutenzione,Assistenza/Concessionari
Fiat Bravo (Topic Ufficiale - 2007),https://www.autopareri.com/forums/topic/23380-fiat-bravo-topic-ufficiale-2007?&page=218#comments,2008-11-17 19:58:42,Popy,,Ciao paesà io dico che ultimamente dalle mie ( e quindi nostre ) parti le bravo stanno spuntando sempre più insistentemente e con targhe recenti tipo DS-DR. Le cose sono 2: o qui nel salento si sono accorti della bravo adesso o pensavo ad una bella promozione. Visto che il secondo punto lo escludo dalla tua esperienza propendo per la prima ipotesi. Nel mio piccolo paese sono arrivate 3 bravo nel giro di pochi mesi 2 nere e una bourdeaux...non sò cosa pensare: ? : un mio collega mia ha riferito di aver fatto un preventivo a Bari per la nuova golf e gli hanno fatto già il 9% di sconto ! ,,,,,,,,,,,,,,
Sostituzione GPunto Tjet con Panda 100 HP: com'è andata?,https://forum.quattroruote.it/threads/sostituzione-gpunto-tjet-con-panda-100-hp-com%C3%A8-andata.32018/page-3,2010-08-21 00:00:00,OneNumber,"kanarino ha scritto: autofede2009 ha scritto: ho avuto l'occasione di provare entrambe le G Punto... 1.4 starjet e t-jet... la seconda è un'altra auto... godibilissim pront divertente e con consumi accettabiii se si guida con un minimo di attenzione... ho postato i dati dei consumi della 500 abarth che sto adoperando in questi gg... con 1 6 km/l di media il t-jet dimostr anche in questa versione più potent una certa economia di esercizi certamente maggiore della 500 1.4 sport che è stata provata anche su 4ruote... senza contare il piacere di guida...... Il fatto che questo motore (il T-jet 120 cv) non avesse consumi così esasperati lo confermò anche una prova di Al Volante qualche anno fà. Ribadisco quanto detto prim non tutti abbiamo lo stesso piede e non tutti abbiamo lo stesso stile di guida.... Ho capito kanarin ma allora si puo sapere quanto fa questa panda? 30km/l? Io dico che le differenze ci possono essere tra una persona e l'altr ma affermare più volte che panda consuma la metà della punto.. almeno sapere quanto faceva la sua punto? Oppure è autopersuasione?... nn si tratta di autopersuasione e neppure sono un novellino che nn conosce minimamente le aut quello che a voi tutt o cmq a chi nn possiede una 100h sfugge è il tasto spor quessto influisce pesantemente sulle cose!!! Io che ben raramente ho fretta o neppure mi metto a fare il coglionazzo x mostrare a tutti le mie abilità di guida e quindi lo lascio disattivato mi fa risultare una 100hp come fosse la normale 1.2 da 60cv e infatti i consumi sono in linea con tale versione ma come prestazioni son ovviament di gran lunga inferiori a quelle di una tjet da 120cv....discorso ben diverso con il tasto sport attiv le prestazioni e i consumi sono più vicini al tjet.... Personalment scusate se mi dilung nn tengo in considerazione dati rilevati in pista poichè è logico che li da padrone la fanno soprattutto i cavalli...io 2 auto le confronto usandole nella vta di tutti i giorn il problema dei consumi sulla tjet è perchè l'auto era circa 1200kg e il cambio a sole 5 marce faceva segnare ad ogni partenz anche nn da gar i 4 al litro proprio perchè il motore veniva spremuto x muoverl cosa che con la panda nn si verifica affatto....diversamente il tjet 155cv più proporzionato alla mole va di più e bev in proporzion di meno Probabilmente a molti nn riesce di capire questi concetti poichè la panda è stereotipata come carretta o roba x la moglie da andare a far la spesa...grossissimo error almeno x la 100hp "" kanarino ha scritto: autofede2009 ha scritto: ho avuto l'occasione di provare entrambe le G Punto... 1.4 starjet e t-jet... la seconda è un'altra auto... godibilissim pront divertente e con consumi accettabiii se si guida con un minimo di attenzione... ho postato i dati dei consumi della 500 abarth che sto adoperando in questi gg... con 1 6 km/l di media il t-jet dimostr anche in questa versione più potent una certa economia di esercizi certamente maggiore della 500 1.4 sport che è stata provata anche su 4ruote... senza contare il piacere di guida...... Il fatto che questo motore (il T-jet 120 cv) non avesse consumi così esasperati lo confermò anche una prova di Al Volante qualche anno fà. Ribadisco quanto detto prim non tutti abbiamo lo stesso piede e non tutti abbiamo lo stesso stile di guida.... Ho capito kanarin ma allora si puo sapere quanto fa questa panda? 30km/l? Io dico che le differenze ci possono essere tra una persona e l'altr ma affermare più volte che panda consuma la metà della punto.. almeno sapere quanto faceva la sua punto? Oppure è autopersuasione? "" autofede2009 ha scritto: ho avuto l'occasione di provare entrambe le G Punto... 1.4 starjet e t-jet... la seconda è un'altra auto... godibilissim pront divertente e con consumi accettabiii se si guida con un minimo di attenzione... ho postato i dati dei consumi della 500 abarth che sto adoperando in questi gg... con 1 6 km/l di media il t-jet dimostr anche in questa versione più potent una certa economia di esercizi certamente maggiore della 500 1.4 sport che è stata provata anche su 4ruote... senza contare il piacere di guida...... Il fatto che questo motore (il T-jet 120 cv) non avesse consumi così esasperati lo confermò anche una prova di Al Volante qualche anno fà. Ribadisco quanto detto prim non tutti abbiamo lo stesso piede e non tutti abbiamo lo stesso stile di guida. ""ho avuto l'occasione di provare entrambe le G Punto... 1.4 starjet e t-jet... la seconda è un'altra auto... godibilissim pront divertente e con consumi accettabiii se si guida con un minimo di attenzione... ho postato i dati dei consumi della 500 abarth che sto adoperando in questi gg... con 1 6 km/l di media il t-jet dimostr anche in questa versione più potent una certa economia di esercizi certamente maggiore della 500 1.4 sport che è stata provata anche su 4ruote... senza contare il piacere di guida...""",Forse ora ci siamo tu in qualche post fa coniugavi prestazioni simili alla tjet con consumi pari alla metà. Anche se i tuoi 12km/l non sono eccezzionali la punto comunque non consuma 6km/l. Ti ho fatto un sunto di ben 13mila km di cui 5mila a gas tutti monitorati con pieni. La media è di oltre 13 5km/l la metà fatti in città. Ora che faccio 100km al giorno di statale per lavoro il consumo va ben oltre i 15km/l viaggiando sui 100km/h ( come vedi anche io ho smesso di fare il coglionazzo.. ) . Per me la tua tjet aveva quacosa di strano.... ,,,,,,,,,,,,,,
Intervista a Kalbfell ex Mini-Rolls Royce ora in Alfa,https://www.bmwpassion.com/forum/threads/intervista-a-kalbfell-ex-mini-rolls-royce-ora-in-alfa.15867/,2005-02-01 00:00:00,b0sh,"""la BMW fa buoni affar grazie anche alla tp ma non solo. BMW va bene anche con la min che non è tp. io ho guidato la 159 in pista da noi a torino e ne sono rimasto affascinato.comportamento di guid fren precisa...non mi è mancata neanche per un secondo la tp. questo anche grazie alla carrozzeria della 15 come nessun'altra alfa prima di lei.la prov anche con pregiudizi se vuol dopo saranno scomparsi.""",Prima era la ruggine poi problemi di elettronica questo ha rovinato l'immagine dell Alfa Romeo ! nel intervista a Spiegel Online Karl Heinz Kalbfell spiega come vuole fare rinascere il mito di questa marca e quale importanza ha la 159 ! signor kalbfell è seduto davanti un'alfista deluso lo assicuri che la sofferenza è finita. devo chiedere un pò di pazienza. i fan dell'alfa non si riusciranno a riguadagnare da un giorno all'altro. con i modelli 147 e 156 habbiamo cominciato sono piaciuti ed'ora guardi la 159 ! quest'auto segna il cammino che Alfa Romeo farà verso il futuro ! ma la 147 e 156 erano come una doccia fredda. prima molti erano entusiasti poi però si sono accorti che in tema qualità non era cambiato molto. così male come cerca di dire lei queste auto non lo sono per niente.da quando Stefan Ketter è responsabile della qualità è cambiato molto.tutti i collaboratori sanno quanto è importante la qualità e che devono sparire tutti i problemi trovati non solo una parte di questi. il bilancio nelle conce e nelle officine è migliorato visibilmente.però le statistiche dei problemi sopratutto dei problemi di elettronica vede le alfa tra i primi posti.si metta nei panni di un'alfista che si ritrova al bordo della strada aspettando un carroattrezzi. non è molto fico farsi vedere a bordo strada con una macchina così bella...`è 3 volte più brutto con un'alfa che con una ford scorpio. ogni problema è un problema di troppo ! ma lo stesso una volta l'Alfa Romeo era lassù all'altezza di Ferrari e Porsche.ora fa fatica a stare all'altezza di VW ed Audi che fanno prodotti di massa. il mito alfa è vivo ! e la sua aggressività lo dimostra. io interpreto i prodotti di massa in modo positivo visto che dobbiamo vendere per ottenere i fondi per produrre auto ancora più prestigiose e di qualità come tutti desiderano. questo vuol dire che dobbiamo acquisire clienti...non solo gli alfisti attuali.il vostro obbiettivo di 300.000 unità non si raggiunge con uno o due modelli cosa possiamo aspettarci dal futuro ? modelli di nicchia sono progetti per il futuro.ora ci concentriamo sul nostro obbiettivo.300.000 unità sono uno studio fatto: quanti clienti può acquerire la marca grazie alla sua immagine talento e bellezza.anche se è solo un risultato teoretico vogliamo raggiungere il massimo possibili. la 159 fa l'inizio cominciamo a vendere quella anche in paesi della granbretagna dove non siamo andati forti fin'ora poi pensiamo ad'altri modelli.a lei è subentrato Baravalle questo vuol dire che lei è passato in secondo piano o ha ancora abbastanza da dire per riuscire ad ottenere i cambiamenti previsti ? no al contrario.ora posso dedicarmi alle domande del futuro ed ai progetti con maggior intensità. Antonio ed il suo team lavoreranno concentrati per fare risalire le percentuali del marcato occupato da Alfalei dirige anche la maserati. come vede l'eventuale per esempio di uno scambio di motori con maserati ? maserati deve restare maserati ed alfa deve restare alfa. se vogliamo cresciere con maserati dobbiamo cercare altre vie per farlo. però non andremo oltre a qualche synergia per l'acquisto e distribuzione...la 159 viene fatta nel sud-italia. questo può risvegliare in alcuni i pensieri negativi sul alfasud che si è conosciuta per la scarsa qualità dell'assemblaggio e che ha contribuito notevolmente alla quasi morte del Alfa Romeo. la storia la conosco. le dico che sono rimasto positivamente sorpreso quando ho visto per la prima volta lo stabilimento. le persone lavorano bene e hanno capito quanto è importante la qualità. lo stabilimento non è diverso da altri in europa. ho notato che anche li gli italiani lavorano molto bene e duramente come nella centrale a torino. alcuni del nord dovrebbero venire a vedere come si lavora bene in italia.visto che i malumori del passato sembra averli cancellato perchè non ci racconta un pò di detagli tecnici o costruttivi. esiste la possibilità di rivedere un'Alfa a trazione posteriore ? c'è gia la 159....solo che c'è l'ha anche davanti.... ( si riferisce al Q4 ) no sul serio. non si può fare la tp solo per questioni di nostalgia. se una volta qualcuno dimostrerà che la tp è il concetto migliore perchè no.ma mi creda dopo le mie esperienze non credo proprio che una volta sarà il caso. quando nel '82 sono arrivate le prime tp anche in pista e le concorrenti erano tutte ta vennero appesantite per evitare che ebbero un vantaggio sulle ta....dopo due anni le ta avevano fatto talmente tanti progressi che non occorreva più appesantire le tp.la BMW fa buoni affari grazie anche alla tp ma non solo. BMW va bene anche con la mini che non è tp. io ho guidato la 159 in pista da noi a torino e ne sono rimasto affascinato.comportamento di guida freni precisa...non mi è mancata neanche per un secondo la tp. questo anche grazie alla carrozzeria della 159 come nessun'altra alfa prima di lei.la provi anche con pregiudizi se vuole dopo saranno scomparsi.con powertrain fiat e gm hanno sviluppato parecchie cose insieme.dobbiamo aver paura di ritrovarci pezzi firmati gm anche nella 159 ? oggigiorno è standard che tanti lavorino insieme per risparmiare sull'acquisto.la 159 lo posso garantire e stata sviluppata dipiù in casa nostra che le generazioni prima di lei.la maggior parte della sua carriera vincente la passata in BMW. si dice che lei ha avuto un forte contributo al successo della mini. ma le ricette che portano alla vittoria a monaco di baveria si possono utilizzare anche in italia ? si devono conoscere le differenze di cultura tra i due paesi.quello che posso portare io è l'istinto che ho grazie alla mia lunga esperienza per vedere quale sia la strada giusta da prendere e quale porta al niente. è un vantaggio se si vuole agire alla svelta. ,,,,,,,,,,,,,,
Volkswagen Golf VI GTD (Topic Ufficiale - 2009),https://www.autopareri.com/forums/topic/33117-volkswagen-golf-vi-gtd-topic-ufficiale-2009,2009-03-27 11:14:27,lord amarant,,sarà un'errore è fuori di 100Nm il 7marce ,,,,,,,,,,,,,,
Subaru marchio low cost?,https://forum.quattroruote.it/threads/subaru-marchio-low-cost.113490/page-3,2017-11-27 00:00:00,A-80,"'Ancora la TI che serve solo per la neve? Siamo messi bene per essere un forum automobilistico... io ne sento il beneficio ad ogni rotatoria libera da traffic in ogni svincolo o raccordo autostradale o nelle curve un po' da guidare... e non solo in accelerazion ma proprio come ""effetto calamita"" in scalata ed inserimento in curva...'",Però effetto calamita no dai mi sembra uno spot così ( le subaru con le calamite ai lati degli impianti sciistici ) ,,,,,,,,,,,,,,
il tonfo di novembre,https://forum.quattroruote.it/threads/il-tonfo-di-novembre.119807/page-4,2018-12-17 00:00:00,danilorse,,La 159 aveva la SW. Nei primi 2 anni le vendite in Europa erano circa 60.000 all'anno per poi scendere a 40.000 nel 2008 e crollare nei successivi. In 7 anni ne sono state prodotte circa 250.000 ,,,,,,,,,,,,,,
Mercedes CL65 AMG V12 Biturbo,https://www.bmwpassion.com/forum/threads/mercedes-cl65-amg-v12-biturbo.38747/,2003-05-23 00:00:00,El Nino,,DaimlerChrysler presents at the Amsterdam AutoRAI in The Netherlands the new Mercedes-Benz CL 65 AMG for the first time. This version is an absolute top-of-the-line model not in the least because of its power source: a six-liter AMG V12-Biturbo engine which produces an astounding 450 kW/612 hp and at least 1000 Nm torque. The new Mercedes-Benz CL 65 AMG besides the S 65 AMG and SL 65 AMG is the third model which uses the powerful V12-Biturbo. This engine pushes the coupe to great achievement: an acceleration to 100kmh in 4 4 seconds in 13 3 seconds it will hit the 200kmh mark. The top speed has been electronically limited to 250kmh. Peak performace of 450kW/612hp is available between 4800 and 5100rpm. The torque of 1000 which is also electronically limited is available between 2000 to 4000rpm. The engine is very responsive but due to its easy-going character is also very suitable for relaxed cruising in a high gear. The CL 65 AMG is a true AMG: special AMG body styling 20inch AMG rims and AMG interior styling point out the special character of the car. In regards to technology AMG has plenty to offer too. The car has a special AMG suspension which uses their Active Body Control system. PRE-SAFE is featured on the car to protect its driver and passengers as standard as well as the powerful AMG braking system especially altered to deal with the high power. Changing gears happens through a 5-speed AMG-Speedshift with pedals and Direct-Select. In the center console there will be an option to switch between Sport Comfort and Manual. Not only does this alter the gearbox but also the stiffnes of the ride and AMG-suspension. The AMG-sportexhaust with double chromed tips deliver the specific AMG-V12 sound. The CL 65 AMG is conform EU and American standards. The CL 65 AMG has a fitting interior with AMG seats with massage function an ergonomic steering wheel and a AMG-combi-instument cluster with “Racetimer” function. The analogue clock in exclusive IWC design is definitely an eye-catcher. The interior is finished with sport pedals and a wood finish. The CL 65 AMG will cost round about 300.000 Euro. ,,,,,,,,,,,,,,
