Titolo,URL,Timestamp,User,(Testo Citato),TESTO,Costruttore,Modello,Brand,Interni,Esterni,Meccanica,Prestazioni,Consumi/Autonomia,Motore,Elettrico,Fuoristrada,Elettronica di Bordo,Manutenzione,Assistenza/Concessionari
Alfa Romeo Stelvio 2017,https://www.autopareri.com/forums/topic/62477-alfa-romeo-stelvio-2017?&page=224#comments,2017-03-28 15:23:35,TheAlfaRomeo,,"Penso che questo sia impossibile o meglio sconsigliato. Poiché questi sistema funzionano in maniera tale da aprire/chiudere le portiere semplicemente sfiorando la maniglia e mettere in moto toccando il bottone se viene rilevata la presenza della chiave in prossimità del veicolo o se posta nel cassettino qualora il telecomando abbia le pile scariche. Se tu nascondessi 1 dei telecomandi fuori il Veicolo sarebbe comunque abbastanza vicino da consentire a chiunque di aprire le portiere avvicinandosi alla maniglia. Ora non so come funzioni precisamente quello delle Alfa ma ad esempio quello della Lexus che abbiamo a casa ha integrato nel telecomando la chiave tradizionale per aprire le porte in maniera ""classica"" scoprendo una serratura nascosta sotto la maniglia qualora il sistema non funzionasse per un qualsiasi motivo. Se Alfa ha 1 soluzione simile potresti pensare di nascondere solo la chiave in 1 punto strategico quanto meno per aprire le portiere. Poi Bisognerebbe capire se sia presente ancora un metodo di avviamento a pedale tramite un particolare ""codice"" come avveniva ad esempio per le prime chiavi CODE ☏ SM-G920F ☏ ",,,,,,,,,,,,,,
Alfa Romeo Giulia 2016,https://www.autopareri.com/forums/topic/60616-alfa-romeo-giulia-2016?&page=831#comments,2016-07-04 13:19:49,alederme,,non dire così @RayLaMontagna non concordo con te non è poi così ciccio vabbeh difendo la categoria... il tedesco di Autoghefuel o come si scrive è molto meglio IMHO ,,,,,,,,,,,,,,
Mazda CX-5 2011,https://www.autopareri.com/forums/topic/44087-mazda-cx-5-2011?&page=32#comments,2012-06-03 10:17:47,atomicstation2,,Vista oggi in strada per la prima volta in nero non mi è piaciuta uno stile insignificante privo di espressività... ,,,,,,,,,,,,,,
ritirata fiat idea,https://www.bmwpassion.com/forum/threads/ritirata-fiat-idea.41805/page-3,2006-04-26 00:00:00,Bolletta,'Ho appena configurato una A160 CDI Elegance (con tutto meno che cambio automatico e navi) e ho superato abbondantemente i 31000€. Ed è un BRILLANTISSIMO 1991cc turbodiesel da 82CV',Sai qual è il paradosso ? Tra un paio d'anni mia moglie vorrebbe prendersi una Boxter cabrio ,,,,,,,,,,,,,,
Audi SQ5 2017,https://www.autopareri.com/forums/topic/62500-audi-sq5-2017?&page=2#comments,2017-01-09 19:36:29,RayLaMontagna,,No è la S non la RS. Dovrebbe essere concorrente di una eventuale Stelvio 350cv. A giudicare dalle prestazioni però va poco più della Stelvio 280cv -.-' ,,,,,,,,,,,,,,
Frenate brusche entra l'ABS e la macchina non si ferma,http://www.porschemania.it/discus/messages/502415/281355.html?1187700246,2007-08-20 15:49:00,rss,,al di l\xe0 di tute le tue considerazioni paolo non credo che a weissach si possa insegnare in fatto di freni... eppoi l'inconveniente \xe8 riportato solo da 1 o 2 pi.maniaci quindi sembrano casi da esamonare particolarmente e non una regola di questi modelli di auto ti posso dire che la mia opel astra con gomme di sottomarca e non pi\xf9 nuove azionava abs per frenate banali su asfalto non ottimale molto pi\xf9 frequentemente che con le pirelli che ho montato successivamente,,,,,,,,,,,,,,
120d 2017 vs Leon fr 184cv 2018,https://forum.quattroruote.it/threads/120d-2017-vs-leon-fr-184cv-2018.118101/page-15,2018-12-16 00:00:00,U2511,,"Non vorrei fare il corvaccio ma ho il timore ( diciamo qualcosa più che timore ) che man mano si provede verso normative più severe per i diesel le criticità aumentano. Painkiller92 non è l'unico che sento lamentarsi su auto nuove ed inizio a leggere fastidi anche sugli impianti AdBlue tipo iniettori che si incrostano con conseguente recovery del motore.Tutto questo per colpa di quei grandissimi ""geni"" di Volksburg che hanno pensato con la loro tipica supponenza di cacciarla nel di dietro a tutti con il risultato che ora anche i produttori più onesti si trovano in difficoltà e con loro i clienti. ",,,,,,,,,,,,,,
Mondiale F.1 - GP Emirati Arabi (Abu Dhabi),https://forum.quattroruote.it/threads/mondiale-f-1-gp-emirati-arabi-abu-dhabi.119454/,2018-11-20 00:00:00,pilota54,,"<img alt=""[​IMG]"" class=""bbCodeImage LbImage"" data-url=""https://www.formulapassion.it/wp-content/uploads/2018/11/21-ae-selected-sets-per-driver-it_6.jpg"" src=""https://www.formulapassion.it/wp-content/uploads/2018/11/21-ae-selected-sets-per-driver-it_6.jpg""/>",,,,,,,,,,,,,,
Le prime foto dell'RS!!! RITIRATA!!!,https://www.bmwpassion.com/forum/threads/le-prime-foto-dellrs-ritirata.44665/page-6,2006-12-12 00:00:00,giofreddi85,"""se vuoi ti do il mi ma ti dico gia da ora che il diesel nel depliant non c'è...parlano solo del benza...anche se le due version chiaramente motore a part sono assolutamente identiche in tutto e per tutto:wink:""",Impossibile ! Non ce l'hanno neanche il depliant dell'RS ! Sono andato oggi nello stesso conce in cui l'ha presa Davide e non l'avevano ! In compenso prenderò anche io una Octavia RS ! ,,,,,,,,,,,,,,
Consigli appassionati,http://www.porschemania.it/discus/messages/502415/37010.html?1192439939,2003-11-14 12:46:00,porscheman,,E' vero non ci avevo pensato alle cuciture del guantone da baseball.....sembrano proprio quelle. Schifosissime ! Da far piangere ! ,,,,,,,,,,,,,,
Subaru marchio low cost?,https://forum.quattroruote.it/threads/subaru-marchio-low-cost.113490/page-5,2017-11-28 00:00:00,Matteomatte2.0,,"per tornare IT la mia intenzione era unicamente quella di elencare la scarsa ""lungimiranza"" commerciale di Subaru in Italia ed in Europa. La cosa ricorda un po' ""lo strano caso del dottor Jekyll e del signor Hyde"" non si riesce a capire come mai un marchio che nel mercato più ricco e competitivo al mondo ( quello Usa ) riesca a vendere più dell'intero gruppo VW qui faccia numeri da prefisso telefonico. Il che non è imputabile a ""la gente qui non capisce nulla di auto perchè preferisce una Octavia ad una Levorg"" così come si legge ( con marche e modelli diversi in altre sezioni del forum ) ma perchè più semplicemente manca il prodotto. Se rifai da capo a piedi il BD per farlo omologare E6 e poi lo monti solo su OB e Forester e solo in abbinata al LT ( per la OB ) se la XV Crosstrek mild hybrid non la importi e poi dici ""non credo nel futuro del diesel"" beh allora non puoi lamentarti che non vendi... ",,,,,,,,,,,,,,
166 30 V6,https://www.bmwpassion.com/forum/threads/166-3-0-v6.34350/page-4,2004-12-12 00:00:00,Twin Spark,'su auto la 166 3.0v6 ha fatto registrare 245.6 kmh d v.max 7.3 sullo 0-100 e 27.59 sul km da fermo....penso ke un 330cd 204cv nn rimappato nn riesca a fare meglio in nessun caso...',perchè prendete i dati dichiarati ? ? le prove reali bisogna guardare....e cmq roger parlo di 166 e serie 5..non di serie 3....ok ? ? ? ,,,,,,,,,,,,,,
le FERRARI di Jean Tod,https://www.bmwpassion.com/forum/threads/le-ferrari-di-jean-tod.17164/page-2,2004-12-26 00:00:00,resunoiz,,io lo odio quello è basso quanto antipatico.ma che lavor fa in ferrari ? ( scusate la mia ignoranza ) . ,,,,,,,,,,,,,,
Consiglio per acquisto auto diesel: Renault kadjar vw t roc o nissan qashqai?,https://forum.quattroruote.it/threads/consiglio-per-acquisto-auto-diesel-renault-kadjar-vw-t-roc-o-nissan-qashqai.119983/,2018-12-28 00:00:00,Aksis,,Secondo me con il Qashqai cadi in piedi sia come affidabilità che come mezzo in generale. ,,,,,,,,,,,,,,
Formazione venditori Lexus,https://forum.quattroruote.it/threads/formazione-venditori-lexus.6506/,2009-12-02 00:00:00,MerLex,".......rifiniture superiori alle tedesche e davvero maniacali almeno sui modelli top (Hi Tech e Luxury); .................assistenza e cura del cliente DAVVERO AL TOP ti telefonano addirittura per dire se la vetturè è stata consegnata con il pieno e se sei soddifatto del trattamento!....... hai sempre la macchina sostitutiva DI PARI IMPORTANZA per qualsiasi intervento; ........i tedeschi (soprtattutto Merceedes e BMW) anche se fanno macchine a mio parere stupende si sono seduti sugli allori e hanno trascurato il cliente e preso elettronica ed altro sottogamba per la frenesia di SFORNARE decine di modelli INUTILI ....solo per farsi una stupida concorrenza!! ....perdendo clienti storici!! che ne valgono dieci di quelli nuovi e avventizzi che acquistano auto solo per farsi guardare ai semafori o davanti al bar (senza guardare la sostanza) e magari cambiano marchio in continuazione.... Non posso che concordare con quanto dic soprattutto relativamente all'ultimo paragrafo. Del resto basta dare un'occhiata alla clientela tipo dei marchi premium tedeschi per capire come essa sia decisamente scaduta. Questi march anche sfornando modelli per tutte le tasch hanno ormai perso quell'aura di esclusività che detenevano e questo ha inficiato inevitabilmente il rapporto con il cliente che prima era considerato quasi facente parte ""di una famiglia"" mentre ora è visto solo come un numero. Non c'è niente da far i ""grandi numeri"" sono in aperto contrasto con la qualità e l'esclusività. Per quest egoisticamente parland sono contento che Lexus venda così poco da noi. Un saluto a tutti '.......rifiniture superiori alle tedesche e davvero maniacali almeno sui modelli top (Hi Tech e Luxury); .................assistenza e cura del cliente DAVVERO AL TOP ti telefonano addirittura per dire se la vetturè è stata consegnata con il pieno e se sei soddifatto del trattamento!....... hai sempre la macchina sostitutiva DI PARI IMPORTANZA per qualsiasi intervento; ........i tedeschi (soprtattutto Merceedes e BMW) anche se fanno macchine a mio parere stupende si sono seduti sugli allori e hanno trascurato il cliente e preso elettronica ed altro sottogamba per la frenesia di SFORNARE decine di modelli INUTILI ....solo per farsi una stupida concorrenza!! ....perdendo clienti storici!! che ne valgono dieci di quelli nuovi e avventizzi che acquistano auto solo per farsi guardare ai semafori o davanti al bar (senza guardare la sostanza) e magari cambiano marchio in continuazione.'","Scusate il messaggio riportato era di MerLex naturalmente. [/quote] ...mi trovo ovviamente daccordo ..... ....per quelli che sono nel Lazio ...avete letto su due numeri ""fa"" di Quattroruote....... l'intervista a Bufacchi ? ? ..... io l'ho sempre pensata come lui .....ma non sto nel CDA dell Mercedes-Italia e non sono Ex Concessionario ) ) ",,,,,,,,,,,,,,
HELP Cuscinetto Albero Intermedio,http://www.porschemania.it/discus/messages/502415/585596.html?1364390787,2011-12-02 10:07:00,beddamatrix,"ciao Dant ti posso solo dire che ""abbiamo"" usato un altro olio non Mobil in un altra porsch e dopo neanche 1000 km si sono spaccati i cuscinett che sono stati cambiati in garanzia. Coincidenze non credo.",Seeee te saluto...... scusa Davide ma non se mai sentito nella storia dei motori che si rompessero dei cuscinetti solo perch\xe8 l'olio non era della stessa marca ! ! ! ma che davvero credete alle cazzate che dicono le case automobilistiche perch\xe8 daccordo con alcuni produttori di lubrificanti ? ? L a regola \xe8 che se un lubrificante \xe8 dichiarato con determinate specifiche pu\xf2 sostituire qualsiasi altra marca.... Per la gradazione poi....non credere che tra un 5/50 ed un 0/40 chiss\xe0 che differenza ci sia....,,,,,,,,,,,,,,
Nuovo look !!!,http://www.porschemania.it/discus/messages/815/622560.html?1348068144,2012-09-01 07:34:00,donnola,,"Vedo che questo Leo Kinnunen e' marcato a fuoco nella mente e' proprio un chiodo fisso. Come da noi che eravamo tutti esaltati per ""Noris e Pam"" illustri sconosciuti per voi ma per noi chiodi fissi. Franco....e' Kinnunen-Merzario-Vaccarella-De Adamich.",,,,,,,,,,,,,,
Opel Corsa 2015,https://www.autopareri.com/forums/topic/55717-opel-corsa-2015?&page=7#comments,2014-07-10 10:08:18,Ospite,,Anche altre marche hanno stravenduto tra cui persino BMW. Non guardiamo l'Italia che è un caso a parte le vendite in UE sono riprese da un pezzo. /OT ,,,,,,,,,,,,,,
Prova Alfa Romeo Giulia 2.2 Turbodiesel 180 CV AT8 - Le impressioni degli utenti,https://www.autopareri.com/forums/topic/61430-prova-alfa-romeo-giulia-22-turbodiesel-180-cv-at8-le-impressioni-degli-utenti?&page=6#comments,2016-08-14 22:51:00,Wilhem275,,Il carico in più non è mai troppo Tu però l'avevi provata solo a velocità non autostradali sbaglio ? Non vorrei ricordare male ma mi pare che su Giulietta questa caratteristica si notasse parecchio di più in autostrada. ,,,,,,,,,,,,,,
Tecniche di guida per ibride toyota,https://forum.quattroruote.it/threads/tecniche-di-guida-per-ibride-toyota.113912/page-9,2018-01-13 00:00:00,mani in alto,,Peró state buoni non andate a cercare chi l'ha fatta che tanto non giova a nessuno. In particolare mi rivolgo a giottoprius: purtroppo le brutte esperienze succedono a tutti ma non per questo bisogna necessariamente vendicarsi o sputtanare gli altri. Ormai sei su questo forum e tanto vale dimenticare l'esperienza passata specie perché andando a creare polemiche si rischia che qualcuno dei tuoi ex forumers si iscriva qui per risponderti male e succeda un vespaio. Quindi lasciate perdere le vecchie esperienze e pensate a quella nuova. ,,,,,,,,,,,,,,
Tachimetro Lancia Y 2000,https://forum.quattroruote.it/threads/tachimetro-lancia-y-2000.95603/,2015-04-15 00:00:00,horn74,,Grazie mille del consiglio ! Un saluto ! ,,,,,,,,,,,,,,
Alfa Romeo MiTo (Topic Ufficiale - 2008),https://www.autopareri.com/forums/topic/27704-alfa-romeo-mito-topic-ufficiale-2008?&page=281#comments,2008-04-12 14:16:58,Sonata_Arctica,,Ci mancherebbe che a tutti piacesse sempre tutto ! ! ! ! ! Ahò ma dove ti credi di essere ? Alle riunioni del partito comunista cinese ? ? ? ,,,,,,,,,,,,,,
Come rovinare un prototipo splendido [LANCER 2008],https://www.bmwpassion.com/forum/threads/come-rovinare-un-prototipo-splendido-%1E%1E-lancer-2008.32413/,2005-07-26 00:00:00,330ci,,orrenda ! http://www.autoblog.it/post/6248/mitsubishi-lancer-2008-eccola ,,,,,,,,,,,,,,
Fiat Punto Classic (Topic Ufficiale - 2008),https://www.autopareri.com/forums/topic/28404-fiat-punto-classic-topic-ufficiale-2008?&page=8#comments,2011-04-01 12:28:30,boygrunge,,non è un fulmine ma ha costi di gestione bassissimi. se non hai velleità sportive ma cerchi un'auto economica e affidabile allora caschi bene ! ,,,,,,,,,,,,,,
Abarth 124 Spider 2016,https://www.autopareri.com/forums/topic/60649-abarth-124-spider-2016?&page=84#comments,2017-03-28 18:38:09,maelganis,,Anche la 75 Turbo è così il valore atmosferico è già 1 quindi se la turbina soffia a 1.49 il valore complessivo sale a 2.49 ( 1+1.49 ) ,,,,,,,,,,,,,,
Nuova Kia Rio 2011,https://forum.quattroruote.it/threads/nuova-kia-rio-2011.53302/page-109,2012-04-12 00:00:00,Tony8693,""":?: Un saluto a tutt vi racconto questa vicend aspetto l'auto da quasi sette mes e il concessionario adesso mi dice che se voglio l'auto subito gli devo saldare il cont nonostante avergli dato l'anticip senza veder l'auto non mi sembra una cosa giust secondo me bisogna prima vedere il modello se corrisponde alle caratteriste e dopo si da la differenz cosa ne pensate?""",Segnalerei pure io subito lo schifoso comportamento del concessionario ! ! ! ! non si può proprio permettere di dire una cosa del genere dopo 7 mesi di attesa ! ! ! ! ! ! ! ! ! io avrei già cambiato concessionaria ! ! ! ! i miei tempi di attesa sono stati 2 mesi 2 10 giorni per l'arrivo dell'auto adesso aspetto di immatricolarla ma purtroppo sto perdendo tempo causa banca per il finanziamento cosa ancora peggiore ! ! spero si risolva in settimana o al max settimana prox ! ! ! :cry: la macchina è li pronta ad aspettarmi ,,,,,,,,,,,,,,
Alfa Romeo 8C Competizione 2006,https://www.autopareri.com/forums/topic/19573-alfa-romeo-8c-competizione-2006?&page=256#comments,2008-09-18 12:19:41,J-Gian,,Comunque che sia piacevole da guidare e ben bilanciata non implica per forza prestazioni da urlo ,,,,,,,,,,,,,,
Concessionario GF Motor a Cosenza,https://www.bmwpassion.com/forum/threads/concessionario-gf-motor-a-cosenza.87486/,2008-04-29 00:00:00,Guest 002,,Ragazzi sembra ke a rende ci sia la questa nuova Concessionaria Ufficiale BMW & MINIqualkuno di voi la conosce sa che tipo sono ? ,,,,,,,,,,,,,,
Preventivo ix35,https://forum.quattroruote.it/threads/preventivo-ix35.27128/page-4,2010-09-05 00:00:00,Maxschumy,,l'ASX l'ho visto bello a vedersi ma purtroppo x la sua limitatezza nelle versioni benzina/diesel = trazioni/cilindrate non ci sono nemmeno andato. Inoltre non prevedono nemmeno l'automatico. Peccato magari + avanti si aggiornano. ,,,,,,,,,,,,,,
Modifica PSE 986 S,http://www.porschemania.it/discus/messages/502415/821204.html?1507920586,2017-10-13 17:21:00,brizio,,sbattendosi dove ? ? ,,,,,,,,,,,,,,
ACQUISTO 996 3.4 coupe' my 2001 RINGRAZIAMENTI,http://www.porschemania.it/discus/messages/10548/612083.html?1338307501,2012-05-25 11:45:00,peter,,Goditela ! ! ! ! Complimenti ! ,,,,,,,,,,,,,,
Miracolo SEat +9519% a Giugno,https://forum.quattroruote.it/threads/miracolo-seat-95-19-a-giugno.89267/,2014-07-03 00:00:00,topomillo,,Miracolo SEat +95 19% a Giugno apperò....... la Leon ingrana sempre piu ,,,,,,,,,,,,,,
Buona settimana dal 07/08 al 13/08,https://forum.quattroruote.it/threads/buona-settimana-dal-07-08-al-13-08.111740/,2017-08-09 00:00:00,Serpinik,,Ciao combriccola ! Buon mercoledì ,,,,,,,,,,,,,,
Honda Jazz 1.3 pregi e (soprattutto) difetti,https://forum.quattroruote.it/threads/honda-jazz-1-3-pregi-e-soprattutto-difetti.113775/page-47,2019-04-04 00:00:00,rosmarc,'',Apperò 15 minuti di supercazzola ma alla fine... ... e questo l'hai visto ? ,,,,,,,,,,,,,,
Fosse così (l'erede della Giulietta)........,https://forum.quattroruote.it/threads/fosse-cos%C3%AC-lerede-della-giulietta.113828/page-2,2017-12-21 00:00:00,keyone,"'A mio parere il progetto ""Giulietta"" TP derivazione Giulia è stato bloccato. Probabilmente perchè troppo ambizioso e costoso considerando anche le nuove connotazioni del mercato e il non grande successo commerciale della Giulia. Credo quindi che sia oggettivamente difficile vedere un'erede della Giulietta a trazione posteriore. Per questo motiv cioè per restare con i piedi per terr ho votato TA.'","Credo anch'io che il nostro ""gioco"" di progettare una Giulietta Tp su pianale Giorgio sia destinato a restare tale proprio come dici tu per il non sfolgorante successo nelle vendite di Giulia da cui la nuova segmento C dovrebbe derivare. Sarebbe una doppietta non ( del tutto ) vincente al contrario di serie 3/serie 1 la cui ""derivante"" vendeva bene e Bmw - si era nel 2004- si potè quindi permettere una derivata di successo . La seconda serie non sta bissando il successo della prima della quale si vedeva anche qualche bella versione cabrio in giro tant'è che sarà sostituita presto da una Mini ricarrozzata ottima sicuramente ma non ""diversa da tutte"" come la serie 1 a trazione posteriore . Già il mio titolo conteneva una parte del rammarico di non vedere mai una Giulietta su pianale Giulia accorciato ",,,,,,,,,,,,,,
L'anteprima americana segreta.....,https://www.autopareri.com/forums/topic/2697-lanteprima-americana-segreta,2003-10-27 19:03:16,Velox,,Grazie Taurus per la precisazione :wink: ,,,,,,,,,,,,,,
Alfa Romeo MiTo - Prove varie motorizzazioni,https://www.autopareri.com/forums/topic/29131-alfa-romeo-mito-prove-varie-motorizzazioni?&page=84#comments,2008-07-30 12:26:30,TonyH,,"Quindi fanno un numero all'anno massimo due in pratica dove provano tutte le auto assieme. Magari a gennaio e via ! gli altri 10 mesi a grattarsi. Le condizioni meteo vairano. A meno che non facciano tutte le prove in una sala climatizzata lunga qualche km...la vedo un pò dura Al massimo potevano appunto fare un dossier sugli effetti delle condizioni meteo sulla temperatura. Perchè non essendo Balocco di loro proprietà ( come Vairano per 4R ) credo che abbiano poca libertà di scelta su giorni e orari. Gli dicono ""potete venire il giorno X dalle alle"" e loro devono andare.....senza fiatare.... Appunto...alla fine l'han detto che le condizioni meteo hanno influito molto. E poi manco alla fine fosse risultata una Prinz senza una candela...... ",,,,,,,,,,,,,,
Colonnina EVAD Fast Falconara Marittima AN Via Umberto Terzi 22 Castelferretti,https://www.forumelettrico.it/forum/topic4179.html?sid=9b3d6660a00250109c0902db2fb0b90b,2018-11-28 10:28:00,polianto,,"Adesso anche questa è precisa al millimetro Ho trovato la delibera del Comune di Falconara: falconara0.JPG ( 133.82 KiB ) Visto 652 volte falconara 1.JPG ( 61.51 KiB ) Visto 652 volte falconara2.JPG ( 64.8 KiB ) Visto 652 volte Con tanto di allegati grafici: falconara3.JPG ( 177.59 KiB ) Visto 652 volte Ciao AntonioPS per Marco forse è meglio splittare il post in uno dedicato alla EVA+ di Falconara qui siamo andati un bel po OT<img alt=""falconara0.JPG"" class=""postimage"" onclick=""viewableArea ( this ) "" src=""./download/file.php ? id=10076&amp sid=5765fdbd0d25aec593244f988887d92f""/> <img alt=""falconara 1.JPG"" class=""postimage"" onclick=""viewableArea ( this ) "" src=""./download/file.php ? id=10077&amp sid=5765fdbd0d25aec593244f988887d92f""/> <img alt=""falconara2.JPG"" class=""postimage"" onclick=""viewableArea ( this ) "" src=""./download/file.php ? id=10078&amp sid=5765fdbd0d25aec593244f988887d92f""/> <img alt=""falconara3.JPG"" class=""postimage"" onclick=""viewableArea ( this ) "" src=""./download/file.php ? id=10079&amp sid=5765fdbd0d25aec593244f988887d92f""/>",,,,,,,,,,,,,,
Brera vs GTV,https://www.autopareri.com/forums/topic/16959-brera-vs-gtv?&page=21#comments,2005-11-20 07:29:42,Bender,,Ma allora ti riferivi proprio alla STi credevo che il confronto fosse tra la wrx e Brera ! Potresti dirci se la pista utilizzata era medio veloce o lenta ? ,,,,,,,,,,,,,,
F12 Berlinetta,https://forum.quattroruote.it/threads/f12-berlinetta.62530/page-2,2012-03-02 00:00:00,Mastertanto,Pensa farle il pieno! ... Pensa svuotarlo... . 'Pensa farle il pieno! ',:thumbup: :thumbup: ,,,,,,,,,,,,,,
SEAT IBIZA SC 1.2 TDI. IN AGGIORNAMENTO: Guasto sistema ricircolo gas 384 euro!,https://forum.quattroruote.it/threads/seat-ibiza-sc-1-2-tdi-in-aggiornamento-guasto-sistema-ricircolo-gas-384-euro.38088/page-9,2010-12-04 00:00:00,zetec851,"kanarino ha scritto: gabrielelucio ha scritto: non c'è il computer di bordo.. cmq ho fatto 230 km e ho consumato un quarto di serbatoio.. serbatoio di 45 litri..... Come non c'è il cdb?!? cioè non puoi visualizzare i consum azzerare il trip? mi sembra strano.... c'è solo il contachilometri parziale. Il cbd c'è nella versione Style. solo che fra reference e style ci ballano 1.400 euro! la style in più ha cerchi in leg autoradi cb specchi e maniglie in tint sedile posteriore sdoppiato.... S effettivamente la ""Style"" è molto più ricca (in tutti i sensi). Ha pure i fari a doppia lampada. "" kanarino ha scritto: gabrielelucio ha scritto: non c'è il computer di bordo.. cmq ho fatto 230 km e ho consumato un quarto di serbatoio.. serbatoio di 45 litri..... Come non c'è il cdb?!? cioè non puoi visualizzare i consum azzerare il trip? mi sembra strano.... c'è solo il contachilometri parziale. Il cbd c'è nella versione Style. solo che fra reference e style ci ballano 1.400 euro! la style in più ha cerchi in leg autoradi cb specchi e maniglie in tint sedile posteriore sdoppiato. "" gabrielelucio ha scritto: non c'è il computer di bordo.. cmq ho fatto 230 km e ho consumato un quarto di serbatoio.. serbatoio di 45 litri..... Come non c'è il cdb?!? cioè non puoi visualizzare i consum azzerare il trip? mi sembra strano. ""non c'è il computer di bordo.. cmq ho fatto 230 km e ho consumato un quarto di serbatoio.. serbatoio di 45 litri..""",Condivido anke io. Anke se la mia costa di listino 18500 euro ,,,,,,,,,,,,,,
la batcaverna 635csi &co,https://www.bmwpassion.com/forum/threads/la-batcaverna-635csi-co.85405/page-325,2008-08-11 00:00:00,ebbano77,,Bellissimi ricordi con mio zio che aveva una dei primissimi modelli di 323i grigio con interni scuri. La tenne per diversi anni ed arrivai a guidarla anch'io. Una SAPONETTA assoluta ! ! ! ! Divertente come non mai ma Impossibile guidarla molto forte. Non vorrei dire nà caz.... ma mi pare avesse cerchi da 13 con gomme cicciotte e mollicce che non davano nessun segnale di cosa succedeva sotto il battistrada.Però all'epoca da sboroni ! ! ! ! ! ! ,,,,,,,,,,,,,,
Troppo facile chiamarsi ferraristi...,https://www.autopareri.com/forums/topic/21143-troppo-facile-chiamarsi-ferraristi?&page=8#comments,2007-05-16 19:42:28,paolo147gta,,ok cmq io so ke ferruccio Lamborghini la Ferrari l'aveva comprata e aveva pure criticato Enzo Ferrari perche la frizione e il cambio erano troppo duri il mitico Ferrari gli rispose dicendo che non può ricevere critiche da uno che costruisce trattori questa fu la frase che spinse Lamborghini a creare le sue automobili propio per migliorare e superare le Ferrari. Cmq W la Ferrari. ,,,,,,,,,,,,,,
Lamborghini Countach (Topic Ufficiale),https://www.autopareri.com/forums/topic/18100-lamborghini-countach-topic-ufficiale?&page=2#comments,2017-10-09 08:42:41,gianmy86,,Che spettacolo di auto... ,,,,,,,,,,,,,,
Online il sito dell'ecobonus per auto elettriche,https://www.forumelettrico.it/forum/online-il-sito-dell-ecobonus-t4943-90.html?sid=053f872f8b7b19de0856815c966834f2&sid=053f872f8b7b19de0856815c966834f2,2019-04-05 14:52:00,FabioTramontana,,non canto vittoria finchè non mi mandano il libretto di circolazione per fare i preventivi delle polizze ancora il sito è bloccato,,,,,,,,,,,,,,
Ferrari 812 Superfast 2017,https://www.autopareri.com/forums/topic/62689-ferrari-812-superfast-2017?&page=7#comments,2017-02-16 16:10:19,Tony ramirez,,parej ? ,,,,,,,,,,,,,,
