Titolo,URL,Timestamp,User,(Testo Citato),TESTO,Costruttore,Modello,Brand,Interni,Esterni,Meccanica,Prestazioni,Consumi/Autonomia,Motore,Elettrico,Fuoristrada,Elettronica di Bordo,Manutenzione,Assistenza/Concessionari
Incidente pazzesco a Laguna Seca (video),https://forum.quattroruote.it/threads/incidente-pazzesco-a-laguna-seca-video.118342/,2018-09-09 00:00:00,pilota54,,Trofeo Lamborghini guidava una donna. Per la rottura dei freni è finita a tutta velocità contro le protezioni. Terribile la decelerazione. E' salva ed è stata portata all'ospedale solo per accertamenti. ,,,,,,,,,,,,,,
Bloccaggio pompa dell'olio e motore fuso,http://www.porschemania.it/discus/messages/492693/564001.html?1306516664,2011-05-25 17:20:00,vittorio1971,,E' pi\xf9 probabile che sia successo questo: Si \xe8 rotta la molla della valvola di sovrappressione sulla pompa dell'olio.Si tratta di una molla calibrata che spinge su una sfera che a sua volta chiude un passaggio dell'olio verso lo scarico. Quando la pressione supera il valore predefinito ( ad esempio a motore freddo quando l'olio \xe8 pi\xf9 denso ) la pressione in esubero riesce a comprimere la molla e a far passare un po' d'olio che ritorna nella coppa o nel serbatoio.Cos\xec facendo la pressione diminuisce e la sfera torna a chiudere il condotto. Tutte le pompe dell'olio di tutti i motori ne hanno una. Quando si \xe8 rotta la molla che chiude la valvola l'olio \xe8 andato direttamente a scarico senza andare a lubrificare bronzine pistoni alberi a cammes ecc. Non pu\xf2 essere andata tra gli ingranaggi della pompa perch\xe8 si trova sul condotto di uscita. Il fatto che si sia rotta \xe8 PURA SFIGA perch\xe8 la molla in questione \xe8 un componente standard prodotto in milioni di pezzi e montato ovunque. Mi dispiace davvero,,,,,,,,,,,,,,
Lexus UX 2018,https://www.autopareri.com/forums/topic/64609-lexus-ux-2018?&page=5#comments,2018-03-08 08:38:04,MarcoGT,,A me non convince come altre sue rivali sopratutto nella vista laterale piuttosto pesante imho data anche la proporzione vetratura/lamiera. Poi i vari volumi e bombature non aiutano così come la tinta bianca: già in grigio cambia la percezione. Nel frontale non mi piace la calandra extralarge: il raccordo ( forma e angolatura ) tra montante A e parafango mi da l’idea di fragilità e di minor integrazione con il resto del corpo vettura. Nelle foto live e nei video che ho visto e ancora più evidente imho: ,,,,,,,,,,,,,,
Mondiale F.1 - GP d'Italia 2018,https://forum.quattroruote.it/threads/mondiale-f-1-gp-ditalia-2018.118133/page-49,2018-09-06 00:00:00,pilota54,"""Mi pare che si sia parlato fin troppo dei ferrarist ma non si sia quasi toccato Verstappen e la sua penalizzazione. Non ho avuto modo di rivedere il contatt ma in gara non mi è parso di vedere un doppio cambio di traiettoria ma solo un accompagnamento lineare di Bottas verso l'esterno. A mio avviso una condotta al limit ma certo più regolare di tante messe in atto dall'olandese. E proprio in una stagione in cui sembrava stesse imparando ad essere un poco più riflessivo. Comunque la sua mi è parsa una bellissima gara. Voi che ne pensate?""","Per me è stato scorretto perchè si è spostato per dare un ""colpetto"" a Bottas. Forse sperava che il finnico facesse solo un piccolo scarto come riuscì a fare in analoga situazione Raikkonen in Austria invece Bottas è stato troppo sbilanciato e stava per urtare il guard-rail. Per fortuna ha controllato la macchina finendo nella via di fuga. Io avrei dato almeno 10 secondi. ",,,,,,,,,,,,,,
Volkswagen Crafter,https://www.bmwpassion.com/forum/threads/volkswagen-crafter.34983/,2006-02-08 00:00:00,trudy,,...visto oggi dal vivo...metto giù solo un commento estetico e basta....sembra sia passato tra due presse ! ! ! http://www.autoenge.cz/gallery-pictures/p2006-06-01-17-19-22.jpg ,,,,,,,,,,,,,,
Rimappata la mia GT3,http://www.porschemania.it/discus/messages/492693/605224.html?1357332937,2012-04-05 17:52:00,sigboris,,"Non capisco il senso di fare una mappa su gt3 senza aver messo su nulla a contorno che aiuti in aspirazione e modifichi in modo ""adeguato"" la contropressione allo scarico. Rimango e rimarro' sempre dell'idea che le modifiche migliori sono puleggia e in primis volano rs. Poi per i piu' cacciati l'8/32. Si mette su olio cambio e differenziale diversi e via di manico.",,,,,,,,,,,,,,
Alfa Romeo Stelvio,https://forum.quattroruote.it/threads/alfa-romeo-stelvio.103307/page-6,2016-11-15 00:00:00,alexmed,,"Queste sono ufficiali. ￼ <img alt=""IMG_4887.JPG.aecb13c7b63eb29991a892c43b7e148c.JPG"" class=""bbCodeImage LbImage"" src=""https://forum.quattroruote.it/attachments/img_4887-jpg-aecb13c7b63eb29991a892c43b7e148c-jpg.928/""/> <img alt=""15016190_1811239132455743_280168905318886758_o.thumb.jpg.78e5e90c4d790a2cc25f1b9890d72b92.jpg"" class=""bbCodeImage LbImage"" src=""https://forum.quattroruote.it/attachments/15016190_1811239132455743_280168905318886758_o-thumb-jpg-78e5e90c4d790a2cc25f1b9890d72b92-jpg.929/""/>",,,,,,,,,,,,,,
Mi presento,https://www.bmwpassion.com/forum/threads/mi-presento.345847/,2019-04-26 00:00:00,guzzo76,,Ciao mi chiamo Filippo Giacomo Palla abito a Grottaferrata in provincia di Roma. sono venuto a conoscenza di questo sito tramite motore di ricerca mentre ricercavo informazioni per la risoluzione di alcuni difetti che ha la mia 320d F30 del 2012 che mi accompagna da 180k km. ,,,,,,,,,,,,,,
Jaguar E-Pace 2017,https://www.autopareri.com/forums/topic/63395-jaguar-e-pace-2017?&page=27#comments,2018-01-28 14:52:13,TurboGimmo,,Lama donna ,,,,,,,,,,,,,,
Maserati Quattroporte 4x4,https://forum.quattroruote.it/threads/maserati-quattroporte-4x4.33407/,2010-07-09 00:00:00,156jtd.,,"Maserati Quattroporte 4x4. Una chimera ? Non necessariamente... grazie alla fusione tra Fiat e Chrysler nuovi ed entusiasmanti scenari si aprono per la casa del tridente. Oltre alla ""baby Maserati"" berlina di rango e prossima rivale di BMW Serie 5 Audi A6 e Mercedes Classe E potremmo assistere ad evoluzioni tecniche dell'esclusiva ammiraglia Quattroporte. In particolare per meglio contrastare un autentico esercito di rivali potrebbe convertirsi almeno in parte alla trazione integrale. Entrando nel dettaglio praticamente tutte le rivali offrono infatti una variante a trazione integrale. Audi A8 BMW Serie 7 e Mercedes Classe S possono sedurre i clienti con i noti allestimenti Quattro xDrive e 4-Matic. Passando a contender più sportive anche la Porsche Panamera di spone dal lancio di una variante integrale ""4"". Appare chiaro come le vendite della Quattroporte potrebbero beneficiare di tale inedita possibilità di scelta. Sul versante delle motorizzazioni si vocifera anche di una Maserati Quattroporte diesel: questa opzione è stata seccamente smentita dai vertici Maserati. A quanto pare il potente e moderno turbodiesel VM attualmente in sviluppo finirà sotto il cofano della ""baby Maserati"". Se la Quattroporte diesel non vedrà mai la luce ci piace continuare a sperare di vedere su strada la variante 4x4 a trazione integrale un probabile toccasana per le vendite della fascinosa ammiraglia dal sapore sportivo simbolo di eleganza tricolore http://www.infomotori.com/auto/2010/07/08/maserati-quattroporte-4x4/ ",,,,,,,,,,,,,,
 kit olio,http://www.porschemania.it/discus/messages/10550/267364.html?1254865545,2007-07-03 15:40:00,guido,,quindi alla luce delle precedenti considerazioni quale olio consiglieresti ( marca e gradazione ) per un motore 356 standard non modificato in nessuna parte ? grazie per la risposta ciao,,,,,,,,,,,,,,
Opel Corsa OPC 2015,https://www.autopareri.com/forums/topic/57457-opel-corsa-opc-2015?&page=3#comments,2015-02-04 17:28:47,TonyH,,Però è MOLTO efficace. Che è l'unica cosa che conta davvero alla fine. Tutto il resto sono corbellerie buone per sprecare un po' di Toner. ,,,,,,,,,,,,,,
F.1 - Test Abu Dhabi 27-28 novembre 2018,https://forum.quattroruote.it/threads/f-1-test-abu-dhabi-27-28-novembre-2018.119595/page-2,2018-11-28 00:00:00,pilota54,,La configurazione qualifica è tutta particolare 1.8 secondi ci stanno tra motore al massimo adrenalina benzina per 3 giri ecc.. ,,,,,,,,,,,,,,
Abarth 124 rally RGT,https://forum.quattroruote.it/threads/abarth-124-rally-rgt.106123/page-37,2019-01-19 00:00:00,pilota54,,5/1/2019 . Test Abarth 124 rally team Bernini al Castelletto Circuit ( in vista del Rally di Montecarlo ) . Pilota: Enrico Brazzoli. ,,,,,,,,,,,,,,
Montecarlo Storico 2017: Mauro Silver sempre al via!,http://www.porschemania.it/discus/messages/815/801261.html?1486454728,2017-01-30 11:36:00,sdm,,Trovato casualmente sul tubo magari a Mauro fa piacere averlo ,,,,,,,,,,,,,,
Scenic sempre più leader nel suo segmento...,https://www.autopareri.com/forums/topic/3162-scenic-sempre-pi%C3%B9-leader-nel-suo-segmento,2003-11-21 02:01:46,DESMO16,,..precedente anzi mi dà un ottima impressione insieme alla Grandtour..in generale devo ammettere che la strada seguita da Renault ( distaccandosi dal resto della concorrenza ) porterà ( ahimé ) buoni frutti.. ..anche la megane normale ( che non la reputo bella ) giorno per giorno mi convince sempre più perché si stacca decisamente soprattutto perché oggi nel segmento C ( 147 a parte ) regna la tristezza o bruttezza delle forme ed in alcuni casi condividono la stessa linea sventurata come nell'accoppiata A3/Corolla. Per rivitalizzare il segmento occorrerà aspettare la C4 148 e la Stilnovo...naturalmente :wink: Per quanto concerne Golf V^ e Peugeot 307 dò un giudizio appena al di sopra della sufficienza ( con un leggero vantaggio per Peugeot ) ma siamo comunque ben lontani da vetture che ti attraggono a prima vista sono semmai un palliativo e comunque nonostante questo VW riuscirà a vendere ugualmente grazie al proprio esercito di clienti che acquistano sulla fiducia...personalmente non mi vedranno più come cliente perché l'errore l'ho fatto una volta ( ancora mi mordo le dita per non avere acquistato la Delta seppure di fine serie nel 1991/1992... ) ..e problemucci a parte non intendo rinunciare per nessun motivo al piacere di guida e tenuta delle italiane e soprattutto al non disporre del motore Fiat. ,,,,,,,,,,,,,,
coupè JUNIOR: che ne dite?,https://www.autopareri.com/forums/topic/7770-coup%C3%A8-junior-che-ne-dite?&page=10#comments,2004-07-04 02:38:16,T a u r u s,,Ho detto sulle vetture pesanti secondo la potenza della vettura e' meglio una TA o una TI della TP con cambio accopiato....sicuramente su una vettura con peso/potenza inferiore a 6kgr/cv la scelta cade alla TI.... Per cui reputo migliore avere una vettura TA per peso/potenza fino a 6kgr/cv ed una TI seria magari con maggiore coppia nel posteriore per le versioni con peso potenza inferiore a 6kgr/cv che una TP classica.... La TP classica e' una buona soluzione per vetture molto leggere e agili dalle dimensioni compattissime come la MX5... ,,,,,,,,,,,,,,
159,https://www.bmwpassion.com/forum/threads/159.30779/page-4,2006-10-15 00:00:00,cobra11320,'scusami ma NON resisto: davanti ad un culetto del genere con un nick come il tuo che fa non lo........mordi??? ',"oltretutto anche Alfa ha il suo ""biscione"" ",,,,,,,,,,,,,,
Salve a tutti.  Rottura puleggiavalvole da sostituire???,https://forum.quattroruote.it/threads/salve-a-tutti-rottura-puleggia-valvole-da-sostituire.115916/,2018-04-08 00:00:00,Dake83Dake8311,,Ho la macchina dal meccanico perché si è guastata la puleggia però la macchina è a cambio automatico e l ho trainata in N è vero che si rompe il cambio se si traina una macchina col cambio automatico ? ? ? ? ? AIUTATEMIIIIII. HELP ME ,,,,,,,,,,,,,,
Volkswagen Arteon 2017,https://www.autopareri.com/forums/topic/62814-volkswagen-arteon-2017,2017-03-06 17:25:45,Pandino,,Motor1.com Presentata l'erede della Passat CC. Mi piace davvero un sacco TOPIC SPY: http://www.autopareri.com/forums/topic/56610-volkswagen-arteon-spy-nuova-cc/ CONCEPT: http://www.autopareri.com/forums/topic/57692-volkswagen-sport-coupé-concept-gte-2015 ,,,,,,,,,,,,,,
Per strada ho visto la Cactus!,https://forum.quattroruote.it/threads/per-strada-ho-visto-la-cactus.90502/,2015-05-30 00:00:00,arizona77,,Da ex proprietario di C5 ti faccio i migliori auguri ,,,,,,,,,,,,,,
Lancia Ypsilon M.Y. 2018,https://www.autopareri.com/forums/topic/64432-lancia-ypsilon-my-2018?&page=20#comments,2018-10-09 15:14:43,stev66,,In Polonia fonti locali FCA hanno dichiarato che la produzione di Y andrà avanti fino al 31/12/2019 . strategia plausibile visto che l'omologazione Euro6d temp c'è l'obbligo di ADAS non ancora e l'auto si vende al prezzo del ferro. ,,,,,,,,,,,,,,
GT 19jtd: test-drive Serravalle,https://www.autopareri.com/forums/topic/23709-gt-19jtd-test-drive-serravalle?&page=7#comments,2007-06-06 06:24:07,il FUSI,,Le dunlop non le conosco. Le Pzero le avevo nero sulla rossa. Sul bagnato ci vai come sull'asciutto ma sull'asciutto non è che siano chissà che........ onesta e mi è costata poco. Le F1 che ho adesso peraltro di produzione 2002 di cui ho sentito parlare sempre male fanno rumore ma mi paiono molto adatte. ,,,,,,,,,,,,,,
16 diesel,https://forum.quattroruote.it/threads/1-6-diesel.122111/,2019-04-13 00:00:00,XPrience74,,Volendo/necessitando di un ciclo diesel come valida soluzione/opzione ci vedrei la Citroen C3 ( o l'uscente Peugeot 208 ) che in quanto gruppo PSA prevede anche il sistema FAP a differenza invece della variante Ford ( collaborazione PSA/Ford ) e che infatti in tal caso pare mostrare non poche criticità proprio in termini di rigenerazioni e tutto ciò che questo comporta... ,,,,,,,,,,,,,,
Alfa Romeo 4C,https://forum.quattroruote.it/threads/alfa-romeo-4c.74909/page-29,2013-04-11 00:00:00,alexmed,,Strumentazione. Attached files /attachments/1570478=24305-alfa-romeo-4c-strumentazione.jpg ,,,,,,,,,,,,,,
Il ruggito del boxer...,https://www.autopareri.com/forums/topic/5613-il-ruggito-del-boxer?&page=3#comments,2004-03-23 15:49:13,il FUSI,,UUUHHHHMMMM gatta ci cova tu che eri antiAlfasud adesso strizzi l'occhio alla 33 1500 TI ? E che è sta roba della 145 ? ? ? ? ? ,,,,,,,,,,,,,,
"tesina maturità ""BMW e il mondo che cambia""",https://www.bmwpassion.com/forum/threads/tesina-maturit%C3%A0-bmw-e-il-mondo-che-cambia.98535/page-3,2009-03-28 00:00:00,panph,'Panp anche tu maturando? Come sei messo come studio?',eccoci qua arrivati a capolinea... dopodomani si cominciano gli esami e finalmente la tesina è completa al 100%...eccola quaper scaricarla dal link qui sotto dovete aprire un pannello o finestra nuovo e copiare l'indirizzo altrimenti provate a cliccare direttamente sul link ma non sempre funziona ( non so perchè... ) http://panph.altervista.org/alessio_bonfante_tesina.pdfhttp://panph.altervista.org/alessio_bonfante_tesina.pdfse non riusciste ad aprirla l'ho uppata anche su megaupload... qui va sicuramentehttp://www.megaupload.com/ ? d=QGC70M40da notare nell'ultima pagina della bibliografia il ringraziamento particolare a BMWPASSION ITALIA con tanto di logo = ) ,,,,,,,,,,,,,,
Favolosa KIA VENGA,https://forum.quattroruote.it/threads/favolosa-kia-venga.53439/page-4,2011-08-07 00:00:00,casper1975,,Aggiungo che in questi giorni sto mettendo a dura prova la mia VENGA con trasporto di due nipotini + figlia piccola e loro masserizie: triciclo monopattino palloni attrezzatura da mare ecc. DEVO dire che lo spazio è un requisito preminente della VENGA che davvero non mi fa propendere per aver acquistato l'AUTO GIUSTA. Per lo spazio segno un voto pari a DIECI. Buona notte a tutti. ,,,,,,,,,,,,,,
BUONA SETTIMANA AMICI!,https://forum.quattroruote.it/threads/buona-settimana-amici.115527/,2018-03-20 00:00:00,KTMBat21,,"Sembrerebbe di sì ...con un ritorno del gelido vento siberiano Burian ...ma conviene ""vivere alla giornata"" visto quanto ci azzeccano i metereologi ",,,,,,,,,,,,,,
Renault Koleos Facelift (Topic Ufficiale),https://www.autopareri.com/forums/topic/43631-renault-koleos-facelift-topic-ufficiale,2011-06-22 11:49:13,AndreaB,,...ommmisericordia sono riusciti a peggiorarlo....................... ,,,,,,,,,,,,,,
Scénic XMod - Topic Ufficiale,https://forum.quattroruote.it/threads/sc%C3%A9nic-xmod-topic-ufficiale.14456/page-168,2010-10-11 00:00:00,clory72,,:cry: Ragazzi ho bisogno del vostro aiuto non c'è la faccio più ad aspettare ho ordinato la mia x mod 1.5 beige cenere il 05/07/10 e ancora deve arrivare mi sto esaurendo con questa attesa mi hanno detto che sta a civitavecchia FORSE questa settimana dovrebbe arrivare... sul my renault risulta.. no veicoli corrispondente..qualcuno sa notizie ? avete foto del colore che ho scelto ? così mi faccio almeno gli occhi .Grazie a tutti per le risposte di consolazione che mi darete. ,,,,,,,,,,,,,,
Citroën C3 II (Topic Ufficiale - 2009),https://www.autopareri.com/forums/topic/34125-citro%C3%ABn-c3-ii-topic-ufficiale-2009?&page=22#comments,2012-03-04 20:31:39,select,,qualcuno di voi ha acquistato il modello 1.4hdi 70cv con cambio robotizzato CMP ? ? come vi trovate ? ? prestazioni e consumi ? ,,,,,,,,,,,,,,
Commenti su presentazione del 16,https://www.autopareri.com/forums/topic/19165-commenti-su-presentazione-del-16,2006-03-12 11:35:23,DESMO16,,...non so se fa parte della strategia commerciale e promozionale di Fiat ( prendetela con beneficio del dubbio ) ma mi é stato detto che i tempi di attesa saranno mediamente tra i 60 ed i 90gg.. ,,,,,,,,,,,,,,
Hyundai i30 2017,https://www.autopareri.com/forums/topic/61880-hyundai-i30-2017?&page=7#comments,2016-10-05 11:29:30,TurboGimmo,,Propongo sondaggio per testare il comfort a macchina spenta con la Galbiati ,,,,,,,,,,,,,,
Jazz: una storia triste.,https://forum.quattroruote.it/threads/jazz-una-storia-triste.117410/page-3,2019-02-15 00:00:00,Utente_4291934537,,Visto che sono un tipo più da scelte emotive che razionali ha contribuito anche un piccolo aneddoto. Mio padre quando ancora guidava aveva una 320d che aveva preso dopo una Civic però secondo me la Civic è stata l'auto migliore che abbiamo avuto peccato che non ricordi esattamente modello e motorizzazione. ,,,,,,,,,,,,,,
Alfa Romeo Giulia 2016,https://www.autopareri.com/forums/topic/60616-alfa-romeo-giulia-2016?&page=830#comments,2016-07-03 19:06:00,Husqvarna,,Certo ma prova a fare una curva in 3 di un 1.9 diesel sottocoppia e vedi dove ti spara. Io parlo in condizioni normali e su strada di montagna in discesa se schiacci la frizione ad ogni curva a valle ci arrivi rotolando. Io sono il primo che in caso di frenata di emergenza schiaccia la frizione ma per strada me ne guardò bene perché non ho inerzia e venendo dalla moto ( cosa completamente diversa ) ho questa abitudine. Il motore deve avere sempre tiro la frizione si usa per non far spegnere il motore e per cambiare. Comunque mi sa che siamo un po ot. ,,,,,,,,,,,,,,
emulatore DPF mazda 5,https://forum.quattroruote.it/threads/emulatore-dpf-mazda-5.43941/page-5,2012-03-08 00:00:00,templ_peck,,senti che mi sai dire del menu segreto ? quello che si attiva accendendo il quadro e tenendo premuto il pulsante dell'azzeramento km parziale ? Esiste un vademecum da cui decifrare i valori che appaiono ? ,,,,,,,,,,,,,,
Concorso d'eleganza Villa d'Este 2007,https://www.bmwpassion.com/forum/threads/concorso-deleganza-villa-deste-2007.68511/,2007-09-28 00:00:00,giampyzetino,,http://www.concorsodeleganzavilladeste.comQualche foto che ho scattato l'anno scorso...BMW 335 ( in concorso ) 6 cilindri 3485 cm³ Carrozzeria: Cabriolet AutenriethBMW 507BMW 3200 CS...e la piccola 700 in mezzo ad altre bellissime macchine disegnate dal grande Michelotti ( a cui era dedicata una sezione del concorso ) . ,,,,,,,,,,,,,,
"Nuovi motori ""B47""",https://forum.quattroruote.it/threads/nuovi-motori-b47.109236/page-11,2017-03-26 00:00:00,A-80,"""Ma nel rapporto qualita' prestazioni costi rispetto le nuove Alfa?""",Lo dirà il tempo...la Giulia per me molto filo tedesco tralasciando il test drive successivo perché nulla da dire anzi tantissima roba ha un suo perché in tutto e per tutto...bei sedili bella pelle bel disegno della pelle ( anche quello fa ) bella plancia bel cockpit ( moderno anche se graficamente indietro rispetto ai migliori audi in testa ) bei comandi piacevoli da azionare bella impostazione di guida bella linea ...abitabilità dietro un po' così così accessibilità al divano pessima ( paga la linea ) scendere dal divano e' un impresa e ci si fanno gli addominali ma cosa dire ? Su strada eccellente lo avevo detto chiaramente per me e la mia - modesta- guida e' uno spettacolo tanta tanta roba. Ma perché è accattivante ? Non neghiamo che hanno pantografato la mia F31 che poi ho comprato appunto perché mi piace e mi piace la Giulia...ma la BMW sappiamo cosa dara' dopo tot anni la Giulia o la Stelvio no e lo scopriremo ! Per ora da nuove nulla da dire se non un prezzo congruo alla qualità a cui il pubblico deve abituarsi dopo anni di Fiat e pure malfatte tutto imho ,,,,,,,,,,,,,,
Marzo,https://forum.quattroruote.it/threads/marzo.121503/page-2,2019-03-07 00:00:00,gbortolo,'Per me la vacanza ideale sarebbe quella in cui non ho niente da fare.',Infatti è anche la nostra. Per una settimana ci ritiriamo in montagna senza impegni se non quelli di passeggiare mangiare e prendere il fresco Se sei a casa è inutile: qualche rogna ti si appiccica sempre. Comunque risolto. Ho prenotato ,,,,,,,,,,,,,,
Filtro FAP nei benzina vw .... questa NON ci voleva !!!,https://forum.quattroruote.it/threads/filtro-fap-nei-benzina-vw-questa-non-ci-voleva.114401/,2018-01-19 00:00:00,enry1,,"ebbene si questa non ci voleva anche il maledetto FAP ( che si chiama GPF ) nei motori a benzina TSI ! Questo dal 2018 e voluto alle Norme EURO 6c Gia in produzione da giugno 2017 sui motori 1 4 TSI della TIGUAN e sui 2.0 TSI del AUDI A5. Ricordo che queste e tante altre informazioni le trovate nella mia Mega GUIDA tutto sulla ""nuova "" GOLF 7 Restyling 2017 assolutamente gratuita ! Se vi interessa sono ben 180 pagine quasi un libro da richiedere qui con un messaggio PRIVATO. Guida cmq valida per le tantissime info anche per la vecchia GOLF 7 . Capirete anche : - le varie differenze ( un vero caos ! ) tra i vari fari a LED ( pxa pxb e pxc ) - freno di manovra - chiave Keyless ( in regalo con i fari a led ! strano da VW ! ! ! ) e tantissimo altro. sono arrivato a ben 180 pagine ciaoooo <img alt=""guida-vw.jpg"" class=""bbCodeImage LbImage"" src=""https://forum.quattroruote.it/attachments/guida-vw-jpg.6059/""/>",,,,,,,,,,,,,,
COLT GPL,https://forum.quattroruote.it/threads/colt-gpl.1733/,2009-05-19 00:00:00,topomillo,"""io non ho una colt gpl (ho una 1.3 benzina ma alcune persone che l'hanno acquistata hanno segnalato (sul vecchio forum di 4r) che la bombol collocata al posto della ruota di scort impedisce al sedile posteriore di scorrere completamente indietr limitando in modo evidente l'abitabilità posteriore.""",io da possessore di colt dico che a sedile completamente indietro vi è più spazio che su una berlina lunga 5 metri magari con tal elimitazione lo spazio a dispozione è ridotto un poco ma cmq esagerato. ,,,,,,,,,,,,,,
Pneumatici con la stella: differenze reali?,https://forum.quattroruote.it/threads/pneumatici-con-la-stella-differenze-reali.97784/page-4,2015-10-27 00:00:00,davide2570,'Mi inserisco nuovamente nella discussione per chiedere un parere a voi che siete sicuramente più esperti e preparati di me. Mi hanno propost da un gommista che non conosc delle Kormora dicendomi che sono prodotte da Michelin ma non marchiate. 11 00? cad. contro i 17 00? che costerebbero quelle originali. Che ne pensate? Edit: ne ho trovati in rete a 75 non mi pare una grande offerta.',kormoran è un marchio appartenente a michelin ma non è che siano le stesse gomme. ,,,,,,,,,,,,,,
[USA] Lexus LX Facelift 2016,https://www.autopareri.com/forums/topic/59059-usa-lexus-lx-facelift-2016,2015-08-14 06:56:16,DUNO,,La veneziana sul radiatore. La prossima volta ? Tapparelle ? ,,,,,,,,,,,,,,
Mondiale F.1 - GP d'Austria 2018,https://forum.quattroruote.it/threads/mondiale-f-1-gp-daustria-2018.117190/page-3,2018-06-30 00:00:00,pilota54,,FP3 - Dominio Ferrari-Mercedes Red Bull in difficoltà. Già battuto il record della pista ( a oltre 240 allora ) . Stupisce ancora Leclerc. GP AUSTRIA F1 2018 - Sabato 30 Giugno 2018 - LIBERE III Pos. Pilota Team Tempo Gap Giri 1 Sebastian Vettel Ferrari 1m04.070s - 22 2 Lewis Hamilton Mercedes 1m04.099s 0.029s 24 3 Valtteri Bottas Mercedes 1m04.204s 0.134s 24 4 Kimi Raikkonen Ferrari 1m04.470s 0.400s 22 5 Max Verstappen Red Bull/Renault 1m04.791s 0.721s 14 6 Daniel Ricciardo Red Bull/Renault 1m04.891s 0.821s 18 7 Romain Grosjean Haas/Ferrari 1m04.916s 0.846s 17 8 Kevin Magnussen Haas/Ferrari 1m05.013s 0.943s 16 9 Carlos Sainz Renault 1m05.086s 1.016s 22 10 Charles Leclerc Sauber/Ferrari 1m05.219s 1.149s 25 ,,,,,,,,,,,,,,
[Fiat Punto 2 serie] come modificare spia gialla riserva?,https://www.autopareri.com/forums/topic/33725-fiat-punto-2-serie-come-modificare-spia-gialla-riserva,2009-05-25 16:24:39,alexxandro84,,Ciao a tutti ho una punto 2 serie 5 porte poichè ha l'impianto a metano installato successivamente faccio raramente rifornimento di benzina solo che mi da fastidio che la spia gialla della riserva benzina si accende già quando c'è un quarto di serbatorio pieno c'è un modo per modificare questo sistema ? che la spia deve accendersi quando c'è meno benzina ? grazie ,,,,,,,,,,,,,,
