Titolo,URL,Timestamp,User,(Testo Citato),TESTO,Costruttore,Modello,Brand,Interni,Esterni,Meccanica,Prestazioni,Consumi/Autonomia,Motore,Elettrico,Fuoristrada,Elettronica di Bordo,Manutenzione,Assistenza/Concessionari
[Mai Nate] Prototipi Lancia mai realizzati,https://www.autopareri.com/forums/topic/30864-mai-nate-prototipi-lancia-mai-realizzati?&page=48#comments,2017-04-20 15:57:54,Lagarith,,Si fu proprio lui il problema. Nel libro di fumia ( dove si possono vedere le lybra originali con relativi interni ) si narra che lancia y era un progetto poco importante per fiat concentrata ai tempi su punto. Ciò permise a fumia di avere assoluta libertà creativa. Lo stesso fumia si stupì quando ai tempi di lybra incontro' questo terribile ostracismo interno... che mi pare ( vado a memoria ) fosse collegato a interessi interni di cantarella su I.D.E.A. e altre aziende dell'indotto,,,,,,,,,,,,,,
Mondiale F.1 - GP del Messico  2018,https://forum.quattroruote.it/threads/mondiale-f-1-gp-del-messico-2018.119013/page-20,2018-11-01 00:00:00,pilota54,"""ma 3 anni fa e' stato battuto dal suo compagno che sicuramente non aveva il suo talento e anche negli anni precedenti la convivenza non e' stata facile e di errori ne ha commessi.""",Credo che Hamilton dopo quell'annata abbia trovato una maggiore forza mentale che lo ha portato a vincere con autorità nel 2017 e 2018. Nel 2016 commetteva ancora qualche errore aveva qualche momento di distrazione di poca concentrazione perchè era convinto che avrebbe vinto comunque. Dopo quella incredibile sconfitta ad opera di un pilota che era stato da lui quasi sempre battuto fin dai tempi del kart ha rafforzato la sua tempra diventando praticamente imbattibile e parità di competitività-vettura. Oggi è il più forte Hamilton di sempre. ,,,,,,,,,,,,,,
Thomas Fischer (auto motor und sport) sull'Alfa e sulla 159,https://www.autopareri.com/forums/topic/15013-thomas-fischer-auto-motor-und-sport-sullalfa-e-sulla-159?&page=6#comments,2005-08-28 20:58:11,ludico,,clrchngr è straniero ? ammazza però che acido ! svegliato male ? secondo me fischer ha pefettamente ragione la precedente generazione di alfa è si un'enorme passo avanti rispetto la famigerata 155 ma risente ancora di alcuni problemi che sono sicuro siano spariti dalla gt in poi ! ,,,,,,,,,,,,,,
599 AutoZeitung,https://www.autopareri.com/forums/topic/20323-599-autozeitung?&page=4#comments,2006-11-07 20:33:52,Marco Switar,,Certo ti credo neanche io ho fonti che parlano di un simile tempo. Facevo solo un raffronto tra la 599 provata da quattroruote che ha fatto 20 1 con un 10 3 sullo 0-200 e 269 di uscita. Certo il 3 4 da 0-100 aiuta ma comunque sotto 20 4 la Carrera potrebbe forse andare. Ciao ! ,,,,,,,,,,,,,,
garanzia obbligatoria per l'usato da parte del rivenditore?,https://www.bmwpassion.com/forum/threads/garanzia-obbligatoria-per-lusato-da-parte-del-rivenditore.166109/,2008-05-15 00:00:00,markulio,,Ragazzi vi porgo questa domanda.Stò acquistando una bmw E61 usata il proprietario però l'aveve promessa al concessionario uffiale bmw perchè in questo modo gli fanno 1000 euro in più di sconto sulla sua ci siamo quindi accordati sul prezzo e stabilito che io pago il prezzo stabilito alla bmw che la ritira e me la vende subito.Il venditore della bmw dice però che lui da me non viene pagato ( lui la ritira alla cifra stabilita con l'attuale proprioietario ) e quindi non mi dà la garanzia la vende come vista e piaciuta poi se voglio posso fare la garanzia ( 350 euro per 1 anno e 500 euro per 2 anni ) .Vi chiedo se secondo voi è legalmente possibile vendere un'auto senza garanzia essendo un usato bmw tutto tagliandato.Grazie mille ,,,,,,,,,,,,,,
Alfa Romeo Stelvio,https://forum.quattroruote.it/threads/alfa-romeo-stelvio.103307/page-19,2016-12-03 00:00:00,arizona77,,pardon doppio ,,,,,,,,,,,,,,
L'Alfa Romeo 4C darà filo da torcere alle Lotus?,https://forum.quattroruote.it/threads/lalfa-romeo-4c-dar%C3%A0-filo-da-torcere-alle-lotus.75823/,2013-03-12 00:00:00,pilota54,,"E' stata presentata in questi giorni l'Alfa Romeo 4C ( 4 metri - altezza 1.18 - motore turbo posteriore-centrale - 240 cv - 900 kg - telaio in carbonio e alluminio - interni abbastanza ""spartani"" ) . Insomma una vettura che si preannuncia come una seria concorrente per l'anziana Lotus Elise S ( 220 cv ) e forse persino per la Exige 3.5 V6 ( non per la Evora ) . La discussione sui forum della casa è già accesa anche se chi ama davvero il marchio fondato da Colin Chapman difficilmente cambierà bandiera. ",,,,,,,,,,,,,,
Fiat Croma Restyling (Topic Ufficiale - 2007),https://www.autopareri.com/forums/topic/23691-fiat-croma-restyling-topic-ufficiale-2007?&page=59#comments,2007-11-06 20:41:29,Grinta,,Permettetemelo... Oggi è ufficialmente diventata l'auto più brutta nel listino del Gruppo Fiat in Europa... ,,,,,,,,,,,,,,
Alfa Romeo Stelvio,https://forum.quattroruote.it/threads/alfa-romeo-stelvio.103307/page-40,2017-04-27 00:00:00,Head,,Letto anche io la prova della 210 cv diesel. Risulta addirittura più scattante ( nello 0-100 ) di un decimo della Giulia con stessa meccanica nonostante i 124 kg in più. Sempre con la stessa meccanica è risultata anche più veloce nel giro in pista di un centesimo. Lo scatto migliore forse lo attribuirei ad una rapportatura diversa del cambio. La differenza di 20 km/h in meno sulla velocità max non l'associerei infatti solo a questioni di aerodinamica. Ciò che invece è difficile da spiegarsi è che nel giro in pista è risultata addirittura più rapida della Giulia ( anche se di pochissimo ) . ,,,,,,,,,,,,,,
Brera 3.2 & sound,https://www.bmwpassion.com/forum/threads/brera-3-2-sound.33073/,2003-11-20 00:00:00,Luca318,,Lasciamo perdere tutte le cazzate su prestazioni e peso che non mi interessano e non è argomento che centra con la discussione.Ieri ho avuto l'occasione di avere davanti per molto tempo una Brera 3.2 rossa ( veramente molto bella dietro dal vivo....peccato perda tutto nel 3/4 posteriore ) .Ma che rumore ha ? Più che un V6 sembra un V8. Molto bello come sound imho grosso e cupo. Meglio del V6 di 30 anni fa imho ,,,,,,,,,,,,,,
Fuoristrada cinesi Gonow in vendita all'Iper!,https://www.bmwpassion.com/forum/threads/fuoristrada-cinesi-gonow-in-vendita-alliper.44158/page-6,2004-03-15 00:00:00,Peter,,Appunto se lo fa quell'enoteca sono persuaso che sia prassi comunissima. ,,,,,,,,,,,,,,
Ct200..dimensioni bagagliaio!!,https://forum.quattroruote.it/threads/ct200-dimensioni-bagagliaio.98778/,2015-09-19 00:00:00,derblume,'375 litri (capacità totale di 985 a sedili abbattuti) Qui ci sono delle foto del bagagliaio: https://compactlexusitalia.wordpress.com/2010/09/29/presentazione-italiana-lexus-ct200h/',tanto grande come il bagaglio di una Golf 7 ! ! ! per me la macchina è uno spettacolo linea molto filante e personale. ,,,,,,,,,,,,,,
Consiglio Acquisto:Renault Laguna 4Control 2.0 150cv,https://forum.quattroruote.it/threads/consiglio-acquisto-renault-laguna-4control-2-0-150cv.50637/page-7,2012-12-28 00:00:00,lucarts,,Caro PAolo se devo darti un parere da possessore di una Laguna 2.0 dci 4control come qualità di guida è ineccepibile parlo sempre della 4control ( le normali non saprei dirti.. ) sia come tenuta di guida ( è come se andasse sui binari ) sia come comodità ( sedili molto ergonomici ) . L'unica pecca che evidenzierei è il sistema elettronico di controllo della fluidità dell'olio che ti porta ad anticipare di molto i tagliandi soprattutto se fai un lavoro come il mio ( agente di commercio ) con ripetute accensioni il tagliando non arrivi mai a farlo a 20.000 come dicono in concessionaria anche se poi sul libretto portano ogni 30.000 e questo dilemma non l'ho ancora capito bene ! ! ! Per il rersto i suoi 30.000 euro o giù di lì li merita tutti come unico intoppo in garanzia ho avuto il volante che si è subito spellato e la guarnizione del parabrezza che si è disintegrata sui 70-80.000 km... ,,,,,,,,,,,,,,
Un saluto (amaro) a tutti,https://forum.quattroruote.it/threads/un-saluto-amaro-a-tutti.121309/page-2,2019-02-19 00:00:00,bumper morgan,"'Uno degli ""assiomi"" del bravo commerciale.'",giá.... ,,,,,,,,,,,,,,
ACQUISTO DI GRUPPO COPRIMOZZI COLORATI,http://www.porschemania.it/discus/messages/502415/217610.html?1173088083,2007-02-07 10:24:00,piazzasignoria,,la mia mail \xe8: zio.filo chiocciola gmail punto com,,,,,,,,,,,,,,
conce ESCLUSIVA Salerno zona ind.le,https://www.bmwpassion.com/forum/threads/conce-esclusiva-salerno-zona-ind-le.97942/,2008-06-26 00:00:00,gjonn,,non ho ancora acquistato da loro ma il trattamento pre acquisto è stato encomiabile venditore gentilissimo disponibile e molto paziente ! Il venditore mi ha spiegato con dovizia di particolari il tutto mi ha fatto provare il provabile e mi ha licenziato con una percentuale di sconto da agente di commercio tra l'altro la nuova sede è immensa ed hanno a disposizione molte vetture a terra ( tra usato premium e km0 ) signori la concessionaria che tutti vorremmostra consigliato ! la prenderò sicuramente da loro BRAVI ,,,,,,,,,,,,,,
Panda nuova a metano..... ma va' a OLIO ????,https://forum.quattroruote.it/threads/panda-nuova-a-metano-ma-va-a-olio.112067/,2017-09-01 00:00:00,Gerardo58,,Ciao io ho una new y metano del 2013 ad oggi quasi 80.000km in quasi quattro anni.Dalla mia esperienza posso dirti che per i primi 15/20mila km il consumo di olio è piuttosto consistente per poi assestarsi in un 300/400gr in 30.000km.Quando ho ritirato l'auto il conce mi ha avvertito di tenere d 'occhio il consumo di olio per i primi diecimila km.Comunque attualmente in 30.000km la mia y necessita circa di mezzo litro di olio.È comunque buona norma controllare il livello di olio ogni 5000km per qualsiasi tipo di motore non alzare mai il cofano per 8.000km è un po' da incoscienti. ,,,,,,,,,,,,,,
decadenza best 4 e tagliandi,https://www.bmwpassion.com/forum/threads/decadenza-best-4-e-tagliandi.167543/page-2,2010-10-22 00:00:00,chicco65,,se diesel cambio ed altre parti lubrificate 150 k km tranne turbina 100 k kmse auto a benzina la BEST4 si ferma a 100 k km per tutte le parti lubrificate ,,,,,,,,,,,,,,
Carrozziere,http://www.porschemania.it/discus/messages/634/456538.html?1328360846,2009-10-07 23:32:00,silvio914,,Scelta giusta ! ! ! ! ! ! ! ! ,,,,,,,,,,,,,,
Tecniche di guida per ibride toyota,https://forum.quattroruote.it/threads/tecniche-di-guida-per-ibride-toyota.113912/page-12,2018-05-18 00:00:00,Giottoprius,,Ciao caro Franz penso anch'io che sia molto importante per avere un auto sempre efficiente fare i tagliandi ogni 15000 km e se fosse per me potendoli fare li farei sempre in Toyota saranno un po' più cari ma almeno loro sanno dove mettere le mani purtroppo per me io i tagliandi non li posso fare per questioni economiche ( mi hanno licenziato 1 mese dopo aver acquistato l'auto ) L'ho presa usata che aveva 5 anni e 70000km ora ne ha 9 con 150000km e in questi 4 anni ho fatto solo un cambio dell'olio 2 anni fa solo perché era il primo premio di una gara automobilistica di consumo. In 4 anni non ho ancora speso un euro speriamo che vada avanti sempre così. Ciao caro Franz con stima un saluto da Giotto ,,,,,,,,,,,,,,
Mercato piloti 2019,https://forum.quattroruote.it/threads/mercato-piloti-2019.117799/page-18,2018-09-08 00:00:00,pilota54,'Scusate me invece con la mia replica che non vuole essere polemica ma Hulkenberg quando ha avuto una vettura per puntare al podio? Io personalmente le statistiche in F1 le prendo sempre con il beneficio del dubbio hanno un senso negli sport singoli ma in quelli di squadra e quelli motoristici non dicono tutta la verità. Ad esempio domenica alla Rai hanno detto che a Monza Il padre di Verstappen ha un 4 posto in carriera mentre Max fino al via del Gp aveva massimo un sesto posto ora se si ragiona e si analizzano tutti i fattori oltre i meri numeri si può dire che da quando Max corre con un top team quindi RedBull lo fa con una vettura che in Monza trova il peggior tipo di pista e dove Ferrari e Mercedes se non hanno guasti si prendono tranquillamente i primi quattro posti. Mi ricordo che il compianto De Cesaris per me un bel pilot aveva il record di più presenze in F1 senza vittori ma perché sfortuna per lui non aveva mai avuto una vettura per poter vincere. Insomma quello che vorrei sottolineare a mio modesto avviso è che i numeri possono indicare qualcosa ma non giudichiamo un pilota semplicemente da questi. Io invece se devo dire una cosa su Hulkenberg e che lo avevo ammirato perché quasi sempre le sue vetture nel corso della stagione avevano grandi migliorament mi ricordo di una stagione in Sauber in cui la prima metà era stata disastrosa ma poi nella seconda aveva ottenuto bei risultat merito del team sicuramente ma qualcosa probabilmente ci metteva anche lu invece in questa stagione la Renault non sta crescendo vero è che da quanto si dice si sta concentrando sul 2019 dal team e dal pilota qualcosa in più mi aspettavo negli ultimi 2 mesi.',"Sicuramente Hulk è un ottimo pilota ma non lo metterei ancora tra i fuoriclasse proprio perchè non ha ancora potuto dimostrare tutto il suo ( eventuale ) valore. Sul resto del discorso ovviamente concordo. L'automobilismo è uno sport in cui la macchina conta più del pilota e gli unici confronti ""indicativi"" ( non definitivi ) sono quelli tra conpagni di squadra. Per questo ho detto che Kimi al posto di Grosjean probabilmnente farebbe meglio perchè già in Lotus faceva meglio. Ci sono comunque piloti che sono fortissimi finchè non trovano uno ancora più forte. I piloti di F.1 quei 20 che corrono sono o dovrebbero essere i più forti del mondo. Grosjean con molti compagni di squadra è stato e sarebbe più che competitivo ( Maldonado e Magnussen per esempio ) ma se lo metti con un Raikkonen un Hamilton un Ricciardo un Vettel un Alonso un Verstappen chiaramente soccombe. Lo stesso Magnussen non lo vedo pilota da top team. ",,,,,,,,,,,,,,
Kadjar restyling in arrivo,https://forum.quattroruote.it/threads/kadjar-restyling-in-arrivo.118395/,2018-10-28 00:00:00,lepocattivo,,Pensate che anche sulla Clio 3 restyling tolsero dopo qualche mese dalla sua produzione la luce nei tasti. Ed è vero kadjar e Qashqai ( non certo utilitarie ) ne sono stranamente sprovviste. ,,,,,,,,,,,,,,
NUOVA PORSCHE GTE MOTORE CENTRALE A MONZA!!!!!!!!!!!!!!!!!,http://www.porschemania.it/discus/messages/492693/784116.html?1483536991,2016-11-16 22:57:00,carlospeed,,"Io per esempio non comprerei mai un auto che mi piace poco solo perche la corrispondente "" racing "" vince in questo campionato ( che poi poco ha in comune ) . Io prendo l auto che piu mi piace e soprattutto la prenderei perch\xe9 vince Le Mans con la LMP1 . Chi compra Ferrari lo fa perch\xe9 corre in F1 non perch\xe9 vince qualche gara nelle sotto sottocategorie . Sono comunque convinto che questa nuova dar\xe0 soddisfazioni pur senza turbo .",,,,,,,,,,,,,,
Imbarazzante la nuova Spacestar!,https://forum.quattroruote.it/threads/imbarazzante-la-nuova-spacestar.76801/page-3,2013-10-13 00:00:00,JigenD,'Esatto fa proprio così allora sarà nomale..',io fossi in te proverei comunque a chiedere in officina. Per il resto come si comporta in extraurbano e in autostrada ? i consumi a quanto ammontano ? ,,,,,,,,,,,,,,
Sondaggi e questionari vari sulla mobilità elettrica,https://www.forumelettrico.it/forum/voglio-capire-come-funziona-la-mobilita-elettrica-t5433-50.html?sid=8b8d4eb4641d5d32a257dae81f149e26&sid=8b8d4eb4641d5d32a257dae81f149e26,2019-03-12 18:47:00,gianni.ga,,Ben fatto ma un po' troppo sintetico.Poi vogliamo sapere i risultati.,,,,,,,,,,,,,,
Prototipi e Concepts mai entrati in produzione,https://www.autopareri.com/forums/topic/17355-prototipi-e-concepts-mai-entrati-in-produzione?&page=2#comments,2005-12-14 02:30:58,LucioFire,,la dardo benchè presentata anni fa è ancora attualissima ,,,,,,,,,,,,,,
Alfa Romeo Giulia Quadrifoglio 2016,https://www.autopareri.com/forums/topic/58587-alfa-romeo-giulia-quadrifoglio-2016?&page=304#comments,2015-08-26 09:34:36,Beckervdo,,Gentlemen's Agreementt. Mandato a puttane nel 2005 con la RS6Plus da 280 km/h. E prima di lei la RS4 2.7 era limitata a 250km/h ma alcuni giornalisti avevano raggiunto senza problemi i 280 km/h. ,,,,,,,,,,,,,,
F1: Ferrari cambia nome,https://forum.quattroruote.it/threads/f1-ferrari-cambia-nome.119667/,2018-12-04 00:00:00,miki15,,comunque sia ora ci vorrebbe il Drake credo che avrebbe cazziate per tutti oltre alle molte teste che volerebbero fuori dalle finestre... ! ! ,,,,,,,,,,,,,,
la batcaverna 635csi &co,https://www.bmwpassion.com/forum/threads/la-batcaverna-635csi-co.85405/page-16,2004-03-25 00:00:00,batmobile,'Bat tu mi vuoi veder morto... ...questa per me è la perfezione fatta auto!!',Quello della M5 e39 ! :wink: ,,,,,,,,,,,,,,
Alfa Romeo 4C 2013,https://www.autopareri.com/forums/topic/56324-alfa-romeo-4c-2013?&page=1053#comments,2015-06-08 15:37:25,Masterplayer,,Ragazzi quella che vedete non è altro che la Centurion di Pogea Racing ( elaborazione realmente esistente ) : i Cerchi sono i famigerati ( almeno per me ) OZ 18/19 e per gli amanti dei CV la centralina è stata sostituita con un clone rimappato al primo step che per ora ha 292 CV e 395 nm ( pare che questo non abbia creato problemi al cambio ) la marmitta invece è simile alla Akrapovic con valvola per rumore.. - - - - - - - - - - AGGIUNTA al messaggio già esistente - - - - - - - - - - scusa Redaelly ma non ricordo più se se sei già proprietario oppure sei in dolce attesa.... Nel primo caso non ne so nulla mentre nel secondo si tratta del test drive a Varano più la visita guidata alla Maserati... ,,,,,,,,,,,,,,
Porsche 911 Targa 4 e 4S  tetto come la BRERA,https://www.autopareri.com/forums/topic/19691-porsche-911-targa-4-e-4s-tetto-come-la-brera,2006-09-18 13:24:41,Guglielmo,,scusa l'ignoranza ..la targa ha sempre avuto il tetto così ? ,,,,,,,,,,,,,,
Alfa Romeo 4C 2013,https://www.autopareri.com/forums/topic/56324-alfa-romeo-4c-2013?&page=322#comments,2013-04-24 07:38:13,effecube,,Io attendo la Impression ,,,,,,,,,,,,,,
Motori Turbo,https://www.autopareri.com/forums/topic/15877-motori-turbo?&page=11#comments,2005-10-05 08:58:43,Betha23,,Giusto per la cronaca ho sentito su un forum americano che il 2.2 è pronto in un nuovo step da 170cv..... vero ? ,,,,,,,,,,,,,,
Subaru turbodiesel: cade il tabù,https://www.bmwpassion.com/forum/threads/subaru-turbodiesel-cade-il-tab%C3%B9.35406/page-3,2007-02-13 00:00:00,.Casper.,"'ma io sono alternativo.. la uso come carburante di ""supporto"" nelle accensioni e nei primi km di funzionamento!'","ma io sono alternativo.. la uso come carburante di ""supporto"" nelle accensioni e nei primi km di funzionamento ! ",,,,,,,,,,,,,,
Mondiale F.1 2019 - GP della Cina,https://forum.quattroruote.it/threads/mondiale-f-1-2019-gp-della-cina.122057/page-5,2019-04-12 00:00:00,pilota54,'per chi le ha seguit come mai nelle Fp2 i tempi sono stati più lenti di quelli delle Fp1?',Sono stati più veloci di oltre 1/2 secondo nelle FP2 avevamo letto male ( almeno io ) . Avevo letto 1.31.9 invece a guardar bene era 1.33.9 il miglior tempo delle FP1 ! ,,,,,,,,,,,,,,
Alfa Romeo Giulia 2016,https://www.autopareri.com/forums/topic/60616-alfa-romeo-giulia-2016?&page=907#comments,2016-08-05 16:10:27,LucioFire,,Audi non ha questo è quell'altro. Dinamicamente è carente rispetto alle altre meccanicamente è inferiore a Giulia e BMW. Se hai 100 di risorse...devi decidere come investirle... Chi sulla meccanica chi sulle finiture...chi non si sa dove ( la Mercedes che pure è nuova ha preso una tritata mica da ridere eh ) Si chiamerà Giuliae.... Così fa dittongo ,,,,,,,,,,,,,,
Percorsi brevi possibili problemi motore 1.6 tdi 110 cv euro 6,https://forum.quattroruote.it/threads/percorsi-brevi-possibili-problemi-motore-1-6-tdi-110-cv-euro-6.114203/page-3,2018-02-09 00:00:00,bergat,,I problemi tipici dei motori diesel di nuova generazione dotati di fap. ,,,,,,,,,,,,,,
Sondaggio.....i cayennisti che moto hanno?,http://www.porschemania.it/discus/messages/22971/197068.html?1358860102,2012-06-26 00:01:00,sifi,,riprendo questo post x comunicarvi il passaggio alla nuova moto:Ducati Hypermotard 1100.........gran bel giocattolo - ) ,,,,,,,,,,,,,,
Fiat Bravo,https://www.bmwpassion.com/forum/threads/fiat-bravo.30330/,2004-09-13 00:00:00,Emiliano,'ma che è? hanno scekerato la golf plus e la grande punto insieme???? poi il nome :......bravo...ma proprio nn siamo capaci di inventarci qualcosa di nuovo che piaccia e che sia decente senza imitare di continuo??? ',,,,,,,,,,,,,,,
TAGLIANDI KIA ITALIA,https://forum.quattroruote.it/threads/tagliandi-kia-italia.60936/,2012-10-19 00:00:00,oolliivviioo,,Bene cioè male ecco il mio primo bel tagliando alla Kia Autoaurelia di Genova: 265 euro ad un anno e al di sotto dei 30000. Invitato a rifarlo entro i prossimi 20000 però sulla manutenzione programmata c'è scritto 30000 ! tanto se i km non li fai comunque devi portarla e pagare entro l'anno. Un mio amico che ha una BMW spende 550-650 euro ma ogni 2 anni e mezzo se non raggiunge i km ! .. ed è una BMW con tutto il rispetto per la Kia. Dimenticavo ho la Venga diesel 1400 90cv. ,,,,,,,,,,,,,,
Cerchi  date  punzonature e varie ,http://www.porschemania.it/discus/messages/10550/680998.html?1391690192,2014-02-03 18:04:00,guido_911,,Questo sono I miei di una 356 AT2 del 1958 ,,,,,,,,,,,,,,
[CHN] Chevrolet Cruze 2015,https://www.autopareri.com/forums/topic/55009-chn-chevrolet-cruze-2015?&page=3#comments,2014-06-24 06:07:17,1happydream,,Interni validi meglio dell'esterno. Per giudicare questa auto che non dovremmo vedere da noi sara' fondamentale il Pricing ,,,,,,,,,,,,,,
Renault Clio RS Facelift (Topic Ufficiale - 2009),https://www.autopareri.com/forums/topic/32785-renault-clio-rs-facelift-topic-ufficiale-2009?&page=2#comments,2009-03-03 13:41:15,Regazzoni,,Tutto è relativo. Però ci sono anche dei limiti... ,,,,,,,,,,,,,,
Acquisto devioluci Punto Cabrio online,https://www.autopareri.com/forums/topic/62053-acquisto-devioluci-punto-cabrio-online?&page=2#comments,2016-10-12 06:14:42,skid32,,il link non puo' funzionare xè è di eper....ho fatto copia incolla di tutto comunque il numero giusto era quello che indicavo capo ,,,,,,,,,,,,,,
Due Domande sulla Swift nuova,https://forum.quattroruote.it/threads/due-domande-sulla-swift-nuova.49430/,2011-04-18 00:00:00,aponus,,Infatti su questo punto andava meglio il vecchio 1.3 della Wagon R+ COmunque quei rumori strani ci sono anche sul NGV e non gli ho mai dato grande importanza. ,,,,,,,,,,,,,,
Ho subito una rapina!,https://www.bmwpassion.com/forum/threads/ho-subito-una-rapina.141916/page-2,2010-05-02 00:00:00,paolo065,,"...forse mi è sfuggito ma qual è il conce di cui si sta parlando ? Il forum serve anche ad evitare che altri utenti possano incappare negli stessi ""imprevisti""....Saluti a tutti ",,,,,,,,,,,,,,
Miss nostalgic,https://www.bmwpassion.com/forum/threads/miss-nostalgic.109273/page-2,2009-03-19 00:00:00,Bmw E34M50,'quoto in pieno.... :wink:',Ragazzi con le vetture nostalgic....Ma voi fate dei raduni dedicati ? Mi piacerebbe venire ad uno....quando /dove il prossimo ? ,,,,,,,,,,,,,,
Jaguar XF (Topic Ufficiale - 2007),https://www.autopareri.com/forums/topic/20757-jaguar-xf-topic-ufficiale-2007?&page=41#comments,2008-09-22 17:26:01,_hainz,,ma il pianale dell'Xf è quello della S-Type modificato ? Quindi ancora Lincoln ? ,,,,,,,,,,,,,,
Ieri sono riuscito a fare la beneddetta prova con brera 2.2!,https://www.autopareri.com/forums/topic/19249-ieri-sono-riuscito-a-fare-la-beneddetta-prova-con-brera-22,2006-08-14 16:29:14,Meg85...,,quoto...è davvero molto personale come sound... ,,,,,,,,,,,,,,
Kia Sportage (Topic Ufficiale - 2010),https://www.autopareri.com/forums/topic/36943-kia-sportage-topic-ufficiale-2010?&page=518#comments,2011-04-25 21:18:48,gmonte,,Il punto e' proprio questo. Nella Passat l'olio previsto e' il long life. Nella Sporty sei sicuro di poter mettere olio standard ? Caso mai con cambio olio fai da te come proposto da altri ? ,,,,,,,,,,,,,,
Renault CAN CLIP o Renault-COM bluetooth?,https://forum.quattroruote.it/threads/renault-can-clip-o-renault-com-bluetooth.117723/,2018-07-30 00:00:00,paolocabri,,Ti rispondo subito. Tutti i modelli usciti a partire dalla Laguna III ( dal 2008 ) non sono più configurabili a piacere in quanto il can clip scarica la configurazione dai server renault e non consente nessuna modifica. Io volevo montare le valvole tpms sulla mia laguna e non è stato possibile proprio per questo motivo. Mi spiace. So che un russo ci riusci ma non saprei dirti se è vero o no. Prova qui.. http://www.planeterenault.com/forum...ssion-des-pneumatiques-t44924-18.html#p965355 ,,,,,,,,,,,,,,
info reali su consumi c4 aircross 4x4 1.8 150 cv e 1.6 115 4x4,https://forum.quattroruote.it/threads/info-reali-su-consumi-c4-aircross-4x4-1-8-150-cv-e-1-6-115-4x4.84408/,2013-12-16 00:00:00,ale2127,,Grazie maxsim...la 1800 pensi consumi molto di più ? Tu hai provato in modalità 4x2 o 4x4 attivato ? ,,,,,,,,,,,,,,
Kia Sportage (Topic Ufficiale - 2010),https://www.autopareri.com/forums/topic/36943-kia-sportage-topic-ufficiale-2010?&page=314#comments,2011-03-10 16:35:15,Cobra_59,,Ok Grazie Mille Micki... ,,,,,,,,,,,,,,
Alfa Romeo Giulietta (Topic Ufficiale - 2009),https://www.autopareri.com/forums/topic/36127-alfa-romeo-giulietta-topic-ufficiale-2009?&page=1369#comments,2015-04-06 20:21:25,Michel1980,,"La mia Giulietta fa uno rumore al livello della frizione ha appena 30000 km . Il rumore si fa sentire quando devo partire in salita . Ho trovato una video su YouTube d'una Audi uno rumore simile ma meno forte . http://youtu.be/51M93s1pApM Non ha ancora 2 anni . Domani vado alla concessione Alfa per il prendere il ""rendez vous"" per il tagliando dei 30000 km e ( soprattutto ) per sto rumore di frizione . ",,,,,,,,,,,,,,
