Titolo,URL,Timestamp,User,(Testo Citato),TESTO,Costruttore,Modello,Brand,Interni,Esterni,Meccanica,Prestazioni,Consumi/Autonomia,Motore,Elettrico,Fuoristrada,Elettronica di Bordo,Manutenzione,Assistenza/Concessionari
Leon motorizzazione 2.0 tdi euro 6 crlb,https://forum.quattroruote.it/threads/leon-motorizzazione-2-0-tdi-euro-6-crlb.96829/,2015-06-12 00:00:00,mommotti,,"Arriva o è arrivata o non arriva ? Letto su altri forum ""barbari"" che tale motore si differenzia non poco dall'attuale euro5 ma a listino non lo vedo. A parte la coppia 340 nm anzichè 320 anche la fasatura differente mi sembra. Chi sa qualcosa ? L'onnisciente Topomillo ? ? ? :lol: ",,,,,,,,,,,,,,
Ferrari SS16M  virtual tour,https://www.autopareri.com/forums/topic/32415-ferrari-ss16m-virtual-tour,2009-02-12 21:46:58,TEngine,,Semplicemente fantastica ! ! ! Che spettacolo ! ! ,,,,,,,,,,,,,,
Consumo anomalo Olio Motore - Cloro nel Gasolio,https://forum.quattroruote.it/threads/consumo-anomalo-olio-motore-cloro-nel-gasolio.116823/page-3,2018-08-04 00:00:00,a.iannattone@gmail.com,,Salve ho lo stesso problema del cloro nel gasolio e nell'olio su una mercedes classe c bluetec del 2015 km 96000 motore renault e la mercedes dopo analizzato il gasolio e l'olio ha riscontrato del cloro dopo che la macchina e stata ferma da loro in concessionaria da marzo 2018 e a giugno hanno fatto il prelievo per analisi e mi hanno detto che il motore era a mio carico la mercedes voleva metterci il motore al costo di 16000 euro fatto presente che l'anno scorso ho stipulato l'estensione di garanzia per altri 2 anni che scadeva a febbraio 2019 e a inizio luglio mi sono riportato la macchina in un officina di fiducia con il motore smontato a pezzi con il meccanico di fiducia abbiamo provato a cercare i pezzi da sostituire usurati ordinandoli in mercedes e abbiamo appurato che la mercedes vende solo il motore completo e non i pezzi di ricambio adesso mi ritrovo con una macchina che non vale niente e a pezzi con rate ancora da pagare e una rata da 20000 euro da pagare a febbraio ho provato anche a sentire qualche legale e mi hanno sconsigliato per non buttare altri soldi inutilmente vorrei sapere se ce qualche altro utente nelle mie stesse condizioni e se ce qualcuno che potrebbe darmi una mano e come uscirne da questa situazione poco piacevole grazie. ,,,,,,,,,,,,,,
Fiat 500 M.Y. 2014,https://www.autopareri.com/forums/topic/26165-fiat-500-my-2014?&page=17#comments,2007-07-04 20:44:46,Navarre75,,Ho appena visto lo spot anch'io...molto evocativo e affettuoso verso il nostro paese ed alcune figure importanti ognuna a suo modo ! A me piace... ,,,,,,,,,,,,,,
Lancia Delta Facelift (Topic Ufficiale - 2011),https://www.autopareri.com/forums/topic/27109-lancia-delta-facelift-topic-ufficiale-2011?&page=892#comments,2011-04-14 08:51:59,samu72,,"Ciao a tutti possiedo una Lancia Delta Oro 1.6JTD 120 CV euro 5 da quasi 2 anni ( ho fatto pochi Km circa 17.300 prevalentemente nel percorso cittadino casa-lavoro ) . Da qualche mese ho un piccolo problema che comincia ad essere fastidiso. Ogni tanto quando sono in seconda e in accelerazione ( attorno ai 1500-2000 giri ) avverto come un calo di potenza una specie di vuoto che dura un secondo ma che comunque si avverte come un piccolo ""strappo"" nella marcia del veicolo. A volte mi capita anche in terza marcia sempre attorno ai 2000 giri. Volevo sapere se qualcuno ha avuto lo stesso problema e da cosa può dipendere secondo voi. Qualche mese fa sono andato in assistenza segnalando il problema il meccanico che l'ha provata non ha riscontrato il problema ( ha fatto un giretto di 2 km scarsi ) . Ora prima che scada la garanzia penso di richiedere un controllo più accurato magari controllando la centralina. Potrebbe dipendere dal filtro anti-particolato ? non so se è una voce infondata ma ho sentito che sarebbe meglio fare ogni tanto un viaggio abbastanza lungo ( magari in autostrada ) per evitare problemidi questo tipo dovuti al filtro. Grazie per l'attenzione. P.S. secondo me il facelift della Delta non è poi così malaccio anche se per un giudizio più obiettivo aspetto di vederla dal vivo ",,,,,,,,,,,,,,
Finalmente e' arrivata,http://www.porschemania.it/discus/messages/10550/630116.html?1459371368,2013-05-26 12:13:00,guido_911,,Siccome sto cercando di rimontare l'impianto elettrico mi trovo con un particolare che non so cosa sia ne dove vada visto che la macchina al mio acquisto era gi\xe0 stata smontata e il tutto era accatastato in vari scatoloni chiedo un aiuto ai pi\xf9 esperti grazie ,,,,,,,,,,,,,,
Aiuto ruotino swift 1.2 hybryd,https://forum.quattroruote.it/threads/aiuto-ruotino-swift-1-2-hybryd.122263/,2019-04-27 00:00:00,Vinnie77,,"Non mi sono dimenticato nella mia non noto problemi. <img alt=""[​IMG]"" class=""bbCodeImage LbImage"" data-url=""https://i.postimg.cc/J7jPrnwV/20190427-092133.jpg"" src=""https://i.postimg.cc/J7jPrnwV/20190427-092133.jpg""/> <img alt=""[​IMG]"" class=""bbCodeImage LbImage"" data-url=""https://i.postimg.cc/YqbN0LbV/20190427-092206.jpg"" src=""https://i.postimg.cc/YqbN0LbV/20190427-092206.jpg""/>",,,,,,,,,,,,,,
Miglioramenti su GT3,http://www.porschemania.it/discus/messages/492693/634233.html?1357555647,2012-12-26 12:05:00,macho43,,bruno la foto viene da siti asiatici. occhio che provando ad entrare mi si era bolccato il pc ! ! http://pinsta.me/u/tennster,,,,,,,,,,,,,,
Lo Scorpione è tornato a mordere,https://www.bmwpassion.com/forum/threads/lo-scorpione-%C3%A8-tornato-a-mordere.22745/,2005-05-19 00:00:00,Giovanni530d,,FIAT GRANDE PUNTO VINCENTE ANCHE NEI RALLIES ANDREUCCI SI IMPONE NELLA PRIMA PROVA DEL CAMPIONATO ITALIANO Esordio con successo per la Fiat Grande Punto che nel Rally Il Ciocco prova d’apertura del Campionato Italiano ha colto il successo assoluto con Paolo Andreucci e Anna Andreussi dimostrando così di essere non solo la numerouno del mercato ma di sapersi destreggiare bene anche negli impegnativi percorsi dei rallies. La Fiat Grande Punto ha lottato contro avversari di valore precedendo in classifica la Mitsubishi Lancer di Gianfranco Cunico e le Subaru Impreza di Luca Cantamessa e Andrea Aghini. Ottimo il quinto posto assoluto dell’altra Fiat Grande Punto ufficiale affidata ad Andrea Navarra e Guido D’Amore. Il successo della Grande Punto su questo percorso tutto su asfalto è stato netto e perentorio. Andreucci è infatti balzato al comando nella terza frazione cronometrata vincendo nella prima tappa 5 prove speciali su 9 e accumulando un vantaggio rassicurante nei confronti degli inseguitori capitanati da Stefano Bizzarri su Renault. Nella seconda frazione di gara Andreucci ha badato ad amministrare il vantaggio mentre il suo compagno di squadra Navarra ha iniziato una bella rimonta che lo ha visto imporsi nella prima prova speciale della giornata e risalire dal 7° al5° posto finale. Il successo della Fiat Grande Punto assume un valore particolare se si considera che si è trattato anche dell’esordio in gara in Europa di una vettura Super 2000 nuova categoria istituita dalla Federazione Internazionale che prevede vetture preparate secondo specifiche tecniche che consentono il montaggio della trasmissione integrale priva di controlli elettronici dotate di motore aspirato di 2000 cc in grado di raggiunge una potenza di circa 270 CV. Ne derivano vetture particolarmente spettacolari e maneggevoli in grado di divertire il pubblico sempre piuttosto numeroso che si assiepa lungo il percorso. Il rientro della Fiat nei rallies ha dunque tenuto fede ad una tradizione che anche in passato ha visto vincere all’esordio alcune vetture della Casa torinese. E’ accaduto ad esempio nel 1976 quando la Fiat 131 Abarth di Markku Alen vinse nella sua prima gara il Rally dei 1000 Laghi in Finlandia. La Fiat 131 Abarth vinse poi tre titoli iridati. La Fiat Grande Punto è la prima Fiat a trazione integrale ad imporsi in un rally. Il primo a complimentarsi con Andreucci per questo storico successo è stato Luca De Meo responsabile brand Fiat che ha raggiunto telefonicamente l’equipaggio e la squadra. Grazie a questo successo Fiat guida la classifica Costruttori del Campionato Italiano e Andreucci quella riservata ai Piloti. Il prossimo appuntamento è il Rally dell’Adriatico in programma a Senigallia dall’1 al 2 aprile dove la Grande Punto esordirà su un percorso sterrato. ,,,,,,,,,,,,,,
Porsche 911 GT3 997 - 415 cv!,https://www.bmwpassion.com/forum/threads/porsche-911-gt3-997-415-cv.21589/,2002-11-14 00:00:00,RossoCorsa,'ma è aspirato??? ',http://www.autoblog.it/post/2924/porsche-911-gt3-997-415-cv Alla faccia ! ! ! ,,,,,,,,,,,,,,
Alfa Romeo 4C 2013,https://www.autopareri.com/forums/topic/56324-alfa-romeo-4c-2013?&page=876#comments,2014-07-07 15:01:53,AleMcGir,,https://www.youtube.com/watch ? v=xp1somv7ZfQ ,,,,,,,,,,,,,,
Renault Captur 2013,https://www.autopareri.com/forums/topic/53994-renault-captur-2013?&page=111#comments,2013-11-17 18:06:36,Teknos,,a te hanno tolto 3800 € tra sconto e valutazione della 206. Giobby intende 2700€ SOLO per la valutazione della Clio poi cè lo sconto... infatti 2700 + 16.600 fa 19.300€ ma la sua Captur tra optionals e tasse varie viene circa 22mila €... quindi il prezzo è ok. - - - - - - - - - - AGGIUNTA al messaggio già esistente - - - - - - - - - - Prova a tirare a 16mila € arrotondi Comunque ripeto buon prezzo... ,,,,,,,,,,,,,,
Assetti gara GT3 ...... assetti stradali ........,http://www.porschemania.it/discus/messages/492693/585199.html?1320741786,2011-11-07 10:22:00,bernieb,,"sensei hai paragonato un gr.N con le S2000 per i profani \xe8 come parlare di GT3 stradale e Cup cio\xe8 vetture che corrono insieme ma talmente opposte nei concetti da non poter essere paragonate ! Confronto per me forse pi\xf9 calzante le nuove clio R3 con le ""vecchie"" S1600 il nuovo che avanza non entusiasma come il vecchio la new \xe8 pi\xf9 grande per cui un p\xf2 pi\xf9 pesa ha suppergi\xf9 gli stessi cv ma molta pi\xf9 coppia in teoria doveva andare molto meglio ma non \xe8 cos\xec ! Complici gomme inadatte sopratutto con pirelli una facilit\xe0 di guida che oltre certi limiti diventa invece difficile e impegnativa ( per non dire pericolosa ) e tempi in gara in teoria migliori per la nuova ma in pratica no stante la grossa difficolt\xe0 a raggiungergli e certe carenze in determinate situazioni che una S1600 non presenta.Conclusione a parit\xe0 di pilota ( bravo ) il vecchio va pi\xf9 forte del nuovo. Vedete qlc similitudine fra 991 e GT3 ? Io molte ma confido molto nella 991 GT3 l'altro paragone \xe8 sbagliato e improponibile",,,,,,,,,,,,,,
Fiat Punto Easy 2012 1.4 8v - Test,https://www.autopareri.com/forums/topic/48196-fiat-punto-easy-2012-14-8v-test?&page=3#comments,2012-09-10 20:50:15,AR89,,sono due macchine diverse è impossibile paragonarli il confronto dovresti cercarlo con un'altra panda. ,,,,,,,,,,,,,,
Alfa Romeo 4C 2013,https://www.autopareri.com/forums/topic/56324-alfa-romeo-4c-2013?&page=546#comments,2013-09-19 07:25:53,Edo15,,PS: del video di autoweek solo a una cosa non credo quando dice che la macchina non riesce a fare drift di potenza ma solo sbilanciandola e che attendono con ansia la versione da 300HP...mi pare quasi esagerato non credo che aprendo in seconda in uscita di curva senza controlli la macchina rimanga piantata ! ,,,,,,,,,,,,,,
Fiat 500 Abarth,https://www.bmwpassion.com/forum/threads/fiat-500-abarth.45515/,2006-07-12 00:00:00,fasolini6,,"Rieccomi con delle news fresche frescheChi si aspettava di vedere la nuova 500 Abarth al Salone di Ginevra resterà deluso a quanto sembra la piccola potente city car elaborata sarà esposta in anteprima mondiale al Salone dell’Auto di Tokio ad ottobre. Anche se per quanto riguarda l’Italia la piccola con motore da 1.400 cc da 120 e 150 cavalli sarà esposta al Motorshow di Bologna. A riprova del largo consenso che il pubblico tributa alla Fiat 500 fin’adesso sarebbero ben 40.000 per la piccola torinese le ordinazioni giunte alla Fiat e 600.000 le persone che fin adesso hanno avuto l’opportunità di averla potuta guardare presso i 730 concessionari disposti in tutta Italia i quali han chiesto qualcosa come 28 mila preventivi ai vari venditori della vettura. Insomma mai come questa volta alla Fiat han saputo fare bene i conti con una loro vettura.Un Ringraziamento a ""Alla Guida"" ",,,,,,,,,,,,,,
Nuova OUTBACK in arrivo....,https://forum.quattroruote.it/threads/nuova-outback-in-arrivo.122115/page-4,2019-04-19 00:00:00,John_Congos,,Outback 2.4 264 cv turbo con oltre 375 nM ora piu' alta di 22 cm da terra- aggiungendo delle protezioni motore e differenziale in acciaio e un adeguata gommatura da off road ci si potra' arrampicare con grinta fino in alto all'Himalaia... ,,,,,,,,,,,,,,
La 159 Ti del fratello,https://www.autopareri.com/forums/topic/24405-la-159-ti-del-fratello?&page=2#comments,2007-07-28 18:24:47,trecca,,Bella bella in attesa di vedere le foto di quegli interni favolosi ( se sono come quelli della presentazione ) . ,,,,,,,,,,,,,,
[Introvabile] Mitsubishi LANCER EVO 9 -NUOVA-,https://www.bmwpassion.com/forum/threads/introvabile-mitsubishi-lancer-evo-9-nuova.50585/,2005-09-22 00:00:00,Cristiano120dRm,,"Ciao a tutti ! Come da oggetto porto alla luce un fatto alquanto ""triste"" appena successo.Dopo mesi e mesi di decisioni ripensamenti peripezie varie un mio carissimo amico compagno di mille avventure ha finalmente venduto la sua auto ""particolare"" e quindi liberi da impegni lo scorso sabato siamo andati presso Bepi Koelliker ( Mitsubishi Milano ) per ordinare una Lancer EVO 9 nuova.Il venditore alquanto imbarazzato ci comunica che le vetture in questione sono esaurite ( nonostante prima dell'estate durante un sopralluogo ci avesse assicurato enorme disponibilità ) in quanto ne avevano una scorta di 20pezzi che nei mesi di agosto e settembre sono stati tutti ""incredibilmente"" venduti.L'ultima era lì in vetrina già venduta.Mi sono rivolto ad altri concessionari Mitsubishi della provincia ed effettivamente dopo qualche telefonata tutti mi hanno confermato la cosa.Ora premettendo che questo mio amico non ha nessuna intenzione di acquistare la EVO 10 ( in uscita per fine anno ) per svariati motivi sareste in grado di indicarmi dove trovare una Lancer EVO 9 nuova o km. 0 ? Ci sarebbe anche il vincolo del colore ( rossa ) ma su questo forse riusciamo a sorvolare...Ho cercato su autoscout24 e in giro per internet ma tanti promettono il mondo e poi sotto richiesta specifica non hanno nulla. ( Pagamento tutto e subito quindi non abbiate timore ad indicarmi amici o conoscenti in quanto non complichiamo la vita a nessuno con pratiche di finanziamento o leasing vari ) .Grazie a chiunque sappia darmi una dritta DavideG. ",,,,,,,,,,,,,,
[Brasile]Nuova Fiat Siena,https://www.bmwpassion.com/forum/threads/brasile-nuova-fiat-siena.52845/,2006-07-12 00:00:00,fasolini6,,Pianale Punto II è la 3v economica della gamma Fiat Brasile ( la Marea sarà sostituita dalla Linea ) .Non male come design considerando che è una vettura per i mercati emergenti. ,,,,,,,,,,,,,,
per parlare di costi contenutissimi,https://forum.quattroruote.it/threads/per-parlare-di-costi-contenutissimi.25428/,2010-03-09 00:00:00,simohsm,,mi piacerebe vedere a quanto la venderanno ,,,,,,,,,,,,,,
Circa 10 anni fa nasceva l'Alfa 156,https://www.autopareri.com/forums/topic/27228-circa-10-anni-fa-nasceva-lalfa-156?&page=6#comments,2008-02-14 11:39:23,fuzz77,,Tutto esatto ! .... ma quello Spitfire è un MK IX se non un MK V il Mk XIV a motore griffon ha l'elica a 5 pale e una diversa conformazione della fousoliera.... ,,,,,,,,,,,,,,
Parlatemi della Mazda 6 175CV SW MY 2015,https://forum.quattroruote.it/threads/parlatemi-della-mazda-6-175cv-sw-my-2015.101285/page-10,2016-10-25 00:00:00,pi_greco,"""Sarebbe bene che l'OT finisse qu sempre aperto a discutere con te in sede propria.""",Mi spiace ma non credo alle tesi complottistiche nè sono manicheo da vedere il male ed il bene residenti in una parte o in una altra. Ribadisco solo che per viaggiare a velocità costante anche sostenuta anche a pieno carico anche in salita anche con portabagagli sul tetto e le gomme sgonfie bastano molto meno kW di quanti ne abbiamo tutti e che io li uso tutti ( molto più di tanti utenti più tranquilli ) in episodici sorpassi e riprese da rallentamenti per questo ritengo l'ibrido diesel che è stato proposto da altre marche che evidentemente ignori nella tua crociata contro l'industria tedesca una soluzione alle necessità simili alla mia. Punto e stop. Mi pare chiaro il tuo aprioristico discorso e non mi interessa per nulla convertirti dalla tua dogmatica religione. ,,,,,,,,,,,,,,
il boom di Stelvio,https://forum.quattroruote.it/threads/il-boom-di-stelvio.113603/page-4,2017-12-11 00:00:00,?angelo0,'Lapo è stato il promotore unico in tempi non sospetti della 500 che nel 2004 ha lanciato compe prototipo tre più 1...',Giulio scusami sappiamo tutti che Lapo a suo tempo ha dovuto almeno per la stampa insistere un po ma alla fine chi ha detto si e sempre Marchionne perché se cosi non é si deve dedurre che Marchionne non é l unico che comanda. Per questo ti rifaccio la domanda di prima: Se con la 500 la Tipo non funzionava a chi avresti dato la colpa ? ,,,,,,,,,,,,,,
Fiat e l'esterofilia,https://www.autopareri.com/forums/topic/42205-fiat-e-lesterofilia?&page=4#comments,2011-03-04 22:36:07,Nick for Speed,,Io a 8 anni convinsi babbo a rottamare la Delta 1.3 per la Brava 1.6 perchè avevo visto la pubblicità durante il giro d'Italia e poi anche quella col bimbo che giocava col mouse sulla tastiera immaginando fosse la Brava ,,,,,,,,,,,,,,
informazione sul tagliando,https://www.bmwpassion.com/forum/threads/informazione-sul-tagliando.40817/,2007-04-27 00:00:00,B@d955i,,ho appena comprato una z4 coupè al momento della consegna mi è stato detto che il tagliando devo farlo annualmente ......ma allora non devo tener conto del computer ? ? visto che mi indica che posso fare 25000 km. Casso io 25000 li faccio in tre anni . ,,,,,,,,,,,,,,
Volvo XC60 2017,https://www.autopareri.com/forums/topic/62821-volvo-xc60-2017?&page=6#comments,2017-03-09 14:15:56,markus_81,,"ma quei ""fuochi d'artificio"" che esplodono sul tetto al minuto 1:55 che roba sono...gli airbag ? ",,,,,,,,,,,,,,
Machine Warriors - il nuovo promotional Alfa,https://www.autopareri.com/forums/topic/18289-machine-warriors-il-nuovo-promotional-alfa,2006-01-25 16:31:43,fxtech,,che rendering a basso costo.. cosa ha a che fare con la brera ? tristezza assoluta ,,,,,,,,,,,,,,
Honda Jazz (Topic Ufficiale - 2008),https://www.autopareri.com/forums/topic/29749-honda-jazz-topic-ufficiale-2008?&page=40#comments,2009-04-17 07:05:20,rickycbrjazz,,Ciao ragazzi mi sono appena iscritto. come si evince dal mio nik possiedo un cbr e fra poco avrò una jazz 1.4 exclusive i-shift. premetto che sono un ragazzo abbastanza pignolo per quanto concerne la tecnica e i numeri. sono soprattutto molto attirato dal dal rapporto efficacia efficienza in qualsiasi campo e tanto più in quello auto/moto. premesso questo la jazz la reputo una macchina veramente intelligente e dal mio punto di vista può andare tranquillamente a sostituire la mia attuale macchina Ford Focus prima serie. inizialmente mi ero indirizzato verso la civic che secondo me rimane ancora la macchina migliore. però visto che in casa ho già un opel astra sw 1.6 ho deciso di contenere dimensioni e costi senza andare troppo a discapito dell'abitabilità e prestazioni. A livello consumi mi aspetto dei dati ben migliori rispetto a quelli qui riportati. non abito a roma ma a venezia quindi sicuramente le code sono altra cosa ma per farvi un paragone con la focus 1.6 benzina attuale ho una media effettiva misurata alla pompa di 16 km/l per 165 mila km percorsi ( 20% città 50% statale 30% autostrada cambio sui 2000 giri e guida scorrevole soprattutto in curva 50% della statale in montagna ) . ho preso la jazz i-shift perchè è 6 marce e la sesta è del 10% più lunga della quinta quindi a velocità maggiori minor consumo e rumore. le prestazioni rilevate sono le stesse identiche della focus la tenuta forse è lievemente inferiore. son curioso di imparare ad usare il cambio e di quello alcuni ne parlano bene altri no. considerando che io lo userò praticamente sempre in manuale credo che per me sarà ottimo perchè i tempi di cambiata comunicati da honda sono di 750 millesimi e facendo le prove su più guidatori quel tempo è possibile solo nel cambio terza quarta a basso numero di giri altrimenti si attesta sul secondo. scusate per la lunghezza... non vedo l'ora che arrivi la macchina ! ah per chi è interessato a maggiori info guardate anche il forum americano canadese con il nome fit ! ciaooo Riccardo ,,,,,,,,,,,,,,
avvistata enzo gialla...,https://www.autopareri.com/forums/topic/2115-avvistata-enzo-gialla?&page=2#comments,2003-09-24 18:15:00,geo,,"Taurus stavolta devo correggerti ! ! ! La canzone a cui ti riferisci Travelling Without Moving che ha dato il titolo a tutto l'album comincia con il sound proprio della Diablo SE ( di un ""violetto"" metallizato ! ) e non della nera F355 GTS. E' scritto sul libricino del cd ( che ho ! ) citata tra gli autori della canzone ! La Diablo SE30 Jota è quella con le due prese d'aria schiacciate sul tettuccio ? Ciao ! :wink: ",,,,,,,,,,,,,,
Prius4 finalmente arrivata e diario di bordo,https://forum.quattroruote.it/threads/prius4-finalmente-arrivata-e-diario-di-bordo.112301/,2017-09-17 00:00:00,XPrience74,,"Bene ! Immagino tanti spensierati ( ed ""economici"" ) km con questa Prius... Sicuramente molto criticata ( non necessariamente in negativo ) come un po per tutte le cose ""fuori dal coro""... così come almeno altrettanto in termini di virtuosità per tanti atri aspetti che non starei qui a ribadire... Un po come per quel compagno di classe dai più sfottuto perché ritenuto secchione ed anche piuttosto bruttarello ma che poi tomo tomo cacchio cacchio raggiunge ottimi riscontri nella vita ( carriera lavorativa amore etc ) a differenza di tanti di quei ""diversamente fenomeni"" che prima si mettevano ""in cattedra"" ( tutto ciò potrebbe anche valere per altri modelli aventi hsd ) . ",,,,,,,,,,,,,,
Citroën Berlingo Van Full Electric autocarro: ecco dove finirò,https://www.forumelettrico.it/forum/topic5526.html?sid=9b3d6660a00250109c0902db2fb0b90b,2019-05-03 20:38:00,Ser8465,"""Ser8465 ha scritto:Già il fatto che sia Mitsubishi è una garanziaLa differenza e' che la Czero e' 100% Mitsubishi e viene prodotta interamente in Giappon mentre la Berlingo e' prodotta in Francia e solamente le parti che riguardano la trazione elettrica provengono dalla Mitsubishi. 'Già il fatto che sia Mitsubishi è una garanzia'",Guastafeste....,,,,,,,,,,,,,,
Nuova Kia Rio 2011,https://forum.quattroruote.it/threads/nuova-kia-rio-2011.53302/page-121,2012-05-08 00:00:00,tudoros,,Ciao a tutti. Ragazzi volevo domandarvi se qualcuno a già trovato un ruotino di scorta per la rio della misura a libretto della LX a benza di un'altra marca di auto che è conpatibile con le misure della rio ( lx benza ) . Grazie a tutti voi. Cerco urgentemente questo ruotino perchè ad Agosto devo fare un bel pò di km e con il solo kit di gonfiaggio non mi sento sicuro. Grazie a chi gentilmente mi risponderà. Ciao ! ,,,,,,,,,,,,,,
Porsche Panamera (Topic Ufficiale - 2008),https://www.autopareri.com/forums/topic/31422-porsche-panamera-topic-ufficiale-2008?&page=3#comments,2008-11-22 17:28:05,jeby,,un accenno di coda forse le avrebbe giovato. ,,,,,,,,,,,,,,
la batcaverna 635csi &co,https://www.bmwpassion.com/forum/threads/la-batcaverna-635csi-co.85405/page-109,2004-03-25 00:00:00,batmobile,'Cena global a padova ',Periodo un po del kaizer per spostarmi. Poi comunque ci dobbiamo sentire per cell :wink: ,,,,,,,,,,,,,,
Mi ha fatto la pipì addosso - Non era lei!,https://forum.quattroruote.it/threads/mi-ha-fatto-la-pip%C3%AC-addosso-non-era-lei.94580/page-2,2015-03-06 00:00:00,rotagian,,Infatti jpizzo: il fanboy non era legato al tuo intervento ma a quello di g.fabbri che faceva ironia su di me citando il tuo intervento. Non voglio andare sempre OT comunque riguardo all'affidabilità quella di Mazda sarà anche alta ma sicuramente non per i motori diesel: dai problemi DPF che avevano i motori delle precedenti genereazioni passando per l'allentamento della catena fino agli alberi a camme montati per ben 2 ( e ripeto DUE ! ! ) anni e 3 ( si TRE ! ! ) modelli di auto differente prima che qualcuno si accorgesse che erano difettosi ! E il controllo qualità dov'è ? All'accettazione merci chi hanno Paperino ? Tornando all'argomento... Per il momento devo chiedere venia riguardo alle perdite sono stato effettivamente un po' precipitoso. Scottato come sono dai problemi avuti ho subito pensato si trattasse di un problema dell'auto anche perchè ancora oggi non mi spiego come mi possa essere bagnato con la carrozzeria ( i pantaloni erano bagnati in modo importante ) dato che piovigginava ma non tanto da giustificare così tanta acqua comunque... tant'è. Almeno per ora. Spero che non ricapiti e quindi di non dover aggiungere altro a questo 3D ! ,,,,,,,,,,,,,,
Peugeot 3008 (Topic Ufficiale - 2009),https://www.autopareri.com/forums/topic/32081-peugeot-3008-topic-ufficiale-2009?&page=8#comments,2010-08-24 11:58:39,Tommitel,,Quoto ,,,,,,,,,,,,,,
159 1.9 jts,https://www.autopareri.com/forums/topic/18222-159-19-jts?&page=7#comments,2006-02-05 22:15:39,Betha23,,Betha23@alice.it .......... mandamele ,,,,,,,,,,,,,,
Lexus IS220d o 320d E90?,https://www.bmwpassion.com/forum/threads/lexus-is220d-o-320d-e90.23215/page-2,2005-02-01 00:00:00,b0sh,,Probabilmente dipende anche dal numero di macchine che hanno messo in circolazione.. se sono tante sicuramente avranno dei meccanici che si occupano solo dell'assistenza di un marchio.. ,,,,,,,,,,,,,,
