Titolo,URL,Timestamp,User,(Testo Citato),TESTO,Costruttore,Modello,Brand,Interni,Esterni,Meccanica,Prestazioni,Consumi/Autonomia,Motore,Elettrico,Fuoristrada,Elettronica di Bordo,Manutenzione,Assistenza/Concessionari
Prestazioni dichiarate e reali Astra,https://forum.quattroruote.it/threads/prestazioni-dichiarate-e-reali-astra.103345/,2016-03-30 00:00:00,mommotti,,Sorpreso dalle prestazioni rilevate della nuova Astra perfettamente giustificate peraltro dal peso davvero ridotto e dalla potenza ho spulciato la scheda tecnica della casa e scoperto che le prestazioni dichiarate dal costruttore si riferiscono a veicolo in ordine di marcia senza guidatore ma con zavorra di 200 kg sostanzialmente un quintalozzo più delle condizioni di prova di 4ruote circa. Questo spiegherebbe i 9 0 secondi in prova ( 9 6 dichiarati ) e in tutte le prove che ho avuto modo di vedere tra 8 7 e 9 1 secondi. E presumo sia così anche per la 1.6 160 per la quale il valore 8 6 mi sembra eccessivamente prudente è verosimile che in prova lo ritocchi verso il basso anche di mezzo secondo ! ,,,,,,,,,,,,,,
batmobile ecco la gemella,https://www.bmwpassion.com/forum/threads/batmobile-ecco-la-gemella.93393/,2004-03-25 00:00:00,batmobile,"""12milioni???? piu' un tavolo antic questa e' la chicca(magari pure quello valeva un casino!) e ora si trova con un auto che varra' quanto???60k euro??""",guarda un po se conosci quest'auto bathttp://suchen.mobile.de/fahrzeuge/s...Car&categories=OtherCar&lang=it&pageNumber=21 ,,,,,,,,,,,,,,
147 e situazione del marchio,https://www.autopareri.com/forums/topic/15679-147-e-situazione-del-marchio?&page=15#comments,2005-10-02 05:12:37,bialbero,,"senza dubbio sono sottigliezze che il normale utente o apassionato potrebbe non cogliere ed anche tra gli esperti ci potrebbe essere chi predilige una classica TP con motore ant long e cambio in blocco e ci sarà chi pèredilige la soluzione Alfa bisogna vedere quali delle due soluzioni è più fruibile nella guida sportiva anche se sonoportasto a credere che dato il peso preponderante sull'avantreno della Brera sui misto stretto potrebbe essere più efficace la 350z.. ma appunto sono sottigliezze nella guida diciamo ""da comuni mortali"" sono soluzioni eccellenti entrambe o quasi personalmente preferisco lo schema della 350z sa meno di compromesso e più da sportiva ""fatta con la testa"". ",,,,,,,,,,,,,,
Fiat Panda Classic 2009,https://www.autopareri.com/forums/topic/34560-fiat-panda-classic-2009?&page=24#comments,2012-10-07 16:32:28,Genox,,Salve volevo sapere dagli autopareristi la loro opinione sulla panda classic GPL. Va bene ? E' un polmone ? Vale la pena comprarla ? Ho il distributore GPL a meno di 1 km da casa. ,,,,,,,,,,,,,,
Colonnina EVAD Fast Municipio Sant'Ilario d'Enza RE Piazzale Eugenio Curiel,https://www.forumelettrico.it/forum/colonnina-enel-fast-a-sant-ilario-d-enza-re-t1540-40.html?sid=b3fb5fad0ffc96dad262d5690582cd95&sid=b3fb5fad0ffc96dad262d5690582cd95,2017-10-13 21:34:00,Deen,,Caricato ora nessun problema,,,,,,,,,,,,,,
affidabiltà Renault,https://www.autopareri.com/forums/topic/24261-affidabilt%C3%A0-renault?&page=4#comments,2007-07-18 06:31:18,DESMO16,,..probabilmente non avrà avuto voglia di fare causa o chissà.....però a parere mio Renault se n'é un pò disinteressata parecchi anni fa un amico con la Uno 1.4 dopo aver rotto il motore in autostrada contattò periti meccanici inviati dalla Fiat ad un autofficina per vedere di quale origine fosse il danno: riscontrarono un difetto di fabbricazione e conseguentemente risarcirono totalmente il danno. ,,,,,,,,,,,,,,
156 GTA Autodelta (uk),https://www.autopareri.com/forums/topic/8542-156-gta-autodelta-uk,2004-08-17 13:52:28,Autodelta85,,bella ! ! ! ,,,,,,,,,,,,,,
Volkswagen Passat CC (Topic Ufficiale - 2008),https://www.autopareri.com/forums/topic/28239-volkswagen-passat-cc-topic-ufficiale-2008,2008-01-13 18:54:45,Touareg 2.5,,Messaggio Aggiornato al 04/11/2011 km77 Prezzi : ------- ,,,,,,,,,,,,,,
SEAT IBIZA SC 1.2 TDI. IN AGGIORNAMENTO: Guasto sistema ricircolo gas 384 euro!,https://forum.quattroruote.it/threads/seat-ibiza-sc-1-2-tdi-in-aggiornamento-guasto-sistema-ricircolo-gas-384-euro.38088/page-19,2011-04-16 00:00:00,verch88,"""Ragazz possibile avere i numeri dei consumi in extraurbano di tutte le concorrenti dell'ibiza riassunti magari da altre conversazioni di utenti che possiedono i mezzi (per essere più attinenti alla realtà) ?""",Tipo ( per quello che ho letto in giro ) : corsa 1.3 cdti 75 cv --&gt 21 Km/l corsa 1.3 cdti 90 cv --&gt ? Fiesta 1.4 Tdci --&gt 23 Km/l Ibiza 1.2 Tdi --&gt ? [/quote] allora il consumo in extraurbano nn è semplice da sapere.. di solito uno fa un consumo misto urbano/extraurbano... se nel consumo misto l'ibiza fa 19 nell'extraurbano farà sui 21 km/l.. la corsa 1.3 90 cv farà intorno ai 18 km/l.. dati reali nn quelli che ti dicono le case.. sennò potrei dirti che sia l'ibiza sia la corsa sia la fiesta fanno 30 km/l.. ! ma è inverosimile ,,,,,,,,,,,,,,
Alfa Romeo 159 2005,https://www.autopareri.com/forums/topic/13571-alfa-romeo-159-2005?&page=176#comments,2005-03-29 05:55:31,Betha23,,E quanto ci metteranno a mettere il 1.8 140cv sulla Vecrta ? Andiamo TAURUS ste cose le sai meglio di me ! Sono certo che avete fatto dei casini epocali con gli accordi.... così adesso noi per Fiat/Lancia ci ritroviamo i motori Opel più scrausi........... Non è una questione di 0-100 ma di potenze visive ( 140-130/155-147 ) ....... la Croma sui benza è drammaticamente indietro...... sono veramente preoccupato su quali motori ci potrete mettere su un ipotetica 198 o delta...... Ma dico io....... non potevate prendere il 2.2 delal 159 e depotenziarlo a 160cv ? Dovevamo proprio andare a usare quelle cagate di Opel ? ,,,,,,,,,,,,,,
provata A5 3.0tdi quattro,https://www.bmwpassion.com/forum/threads/provata-a5-3-0tdi-quattro.48749/page-2,2007-02-09 00:00:00,KILLER QUEEN,,forse come dici tu è meno gustosa vicino al limite forse più facile.................ma tremendamente efficace e a prescindere dal motore che imho spinge di più rispetto al 3.0d ( è molto più emozionale :wink: ) dà l'impressione che il limite della macchina sia superiore rispetto alla e9X ( non so la X-drive quella non l'ho mai provata ) il consiglio che vi dò è quella di provarla..........................e poi di giudicarla i vecchi pregiudizi su Audi ...................potrebbero dissolversi in pochi km :wink: ,,,,,,,,,,,,,,
"Iniziativa ""ANDIAMO DA QUATTRORUOTE""",https://www.autopareri.com/forums/topic/6129-iniziativa-andiamo-da-quattroruote?&page=10#comments,2004-04-26 16:44:41,@ci,,Se qualcuno da Lancia accettasse un confronto bisognerà organizzare un vero CASINO ! Su quel piazzale ci vogliono 100 persone e non 10. Se non sarà così vorrà proprio dire che ormai l'interesse per Lancia è troppo poco ed anche noi dovremo rassegnarci... ,,,,,,,,,,,,,,
Alfa Romeo Giulietta (Topic Ufficiale - 2009),https://www.autopareri.com/forums/topic/36127-alfa-romeo-giulietta-topic-ufficiale-2009?&page=201#comments,2010-01-22 10:31:20,stev66,,Per ora i motori sono modellati su Golf che non mi pare abbia problema di vendite... Scherzi a parte il 120 Cv ed il 135 mancano proprio. Spero che il primo manchi perche' si aspetta lo step successivo ed il secondo perche' manca un adeguato cambio a 6 marce ( e mettere un 5 marce su giulietta sarebbe un insulto considerando che Delta e' tutta a 6 marce ) ,,,,,,,,,,,,,,
Alfa Romeo Giulia Quadrifoglio 2016,https://www.autopareri.com/forums/topic/58587-alfa-romeo-giulia-quadrifoglio-2016?&page=1002#comments,2016-10-20 10:36:35,mikisnow,,Ma infatti ! I kg in meno te li devi sudare ! ,,,,,,,,,,,,,,
buongiorno a tutti,https://forum.quattroruote.it/threads/buongiorno-a-tutti.118319/,2018-09-08 00:00:00,abelarda70@gmail.com,,Oggi mi sono accorto che quando iniziano a apparire i messaggi nel cruscotto i gas di scarico fanno un odore insopportabile chiedo pareri urgenti in officina nn ne vengono a capo ,,,,,,,,,,,,,,
TAGLIANDI: il topic definitivo contro i furbetti del quartierino....,https://forum.quattroruote.it/threads/tagliandi-il-topic-definitivo-contro-i-furbetti-del-quartierino.21301/page-28,2012-07-08 00:00:00,pcassone,,4° tagliando alla fabia a 40.000 km ( 4 anni ) . 265 ? . Il prossimo essendo scaduti i 4 anni di garanzia aspetto i 60.000 km fregandomene delle minacce del maxi-dot ,,,,,,,,,,,,,,
Difetto o problema??,https://forum.quattroruote.it/threads/difetto-o-problema.117446/,2018-07-15 00:00:00,baffosax,,Giovanni da quello che scrivi i problemi ( se ci sono ) riguardano la frizione per dirti di più bisognerebbe provarla. ,,,,,,,,,,,,,,
Lancia Y il concentrato di granturismo. (1996-2003),https://www.autopareri.com/forums/topic/51531-lancia-y-il-concentrato-di-granturismo-1996-2003?&page=22#comments,2017-05-17 11:36:08,PapisHF,,Se ci sono problemi fatemi sapere e se volete fate una vostra recensione. ,,,,,,,,,,,,,,
Alla larga da BMW ROMA di via Appia Nuova,https://www.bmwpassion.com/forum/threads/alla-larga-da-bmw-roma-di-via-appia-nuova.78509/page-3,2008-03-31 00:00:00,AZ330D,""" RAGAZZI SPERO CHE NON SIA VERO QUELLO CHE PENSO MI SIA SUCCESSO MA DATEMI UN PAIO DI GIORNI E VI RACCONTERO' LA GRAVISSIMA ESPERIENZA (NE VALE IL NOME BMW) CHE MI E' CAPITATA IN VIA APPIA PER UN AZIONE DI RICHIAMO BRONZINE AD UN M3 E46!!!!!!""",sei uno dei pochi a nn aver avuto problemi con loro... ,,,,,,,,,,,,,,
Outback 2.0D my 2017 - Eyesight,https://forum.quattroruote.it/threads/outback-2-0d-my-2017-eyesight.108624/,2017-02-06 00:00:00,giorgiotoffa77,,ho un cliente ad ardesio ( cava di marmo grigio in galleria ) ,,,,,,,,,,,,,,
Omologare cerchi 17 Leon ST,https://forum.quattroruote.it/threads/omologare-cerchi-17-leon-st.115035/,2018-02-22 00:00:00,Willis86,,Niente ho sentito il magazzino SEAT il quale mi ha comunicato che i cerchi da 17 seat hanno il mozzo da 85 mentre i miei da 16 da 80 quindi almeno quelli originali da 17 non posso montarli ,,,,,,,,,,,,,,
serie 1 coupè km0,https://www.autopareri.com/forums/topic/26559-serie-1-coup%C3%A8-km0,2007-12-27 13:45:30,regulus,,quali programmini di intenditori ? ,,,,,,,,,,,,,,
Dubbio Qashqai e bronzine,https://forum.quattroruote.it/threads/dubbio-qashqai-e-bronzine.112445/,2017-09-25 00:00:00,Ribuzzu,,Baffosax infatti non era un modo di vantarsi ma tutt'altro per rendere evidente come la gestione oculata del mezzo non è una caratteristica di tutti tuttavia ci sono mezzi che puoi trascurare e ti perdonano altri che invece ti castigano alla minima distrazione. Ti assicuro che è proprio così manutenzione saltuaria e nessuna catena cambiata e va una meraviglia a quota 294 mila km. Chapeau ,,,,,,,,,,,,,,
Abarth 124 rally RGT,https://forum.quattroruote.it/threads/abarth-124-rally-rgt.106123/page-32,2018-09-20 00:00:00,pilota54,,Abarth 124 rally in gara questo WE: Rally Adriatico 20-22/9 - Modanesi-Mometti Rally Poland 21-23/9 - Tempestini-Itu. ,,,,,,,,,,,,,,
Renault Clio III Facelift (Topic Ufficiale - 2008),https://www.autopareri.com/forums/topic/32353-renault-clio-iii-facelift-topic-ufficiale-2008?&page=86#comments,2010-01-01 18:15:59,cielosereno,,Carissimi Buon Anno a tutti ! ! ! Volevo rispondere a LeleTux portando la mia esperienza di possessore di Renault Clio 1.2 75 cv con la quale ho percorso 8.000 km ( 4.000 in autostrada/statale e 4.000 in una città trafficata come Milano ) . Con una percorrenza di 20.000 km/anno mi chiedo COME MAI Tu non abbia deciso di acquistare la motorizzazione GPL o meglio ancora il diesel ! ! ! ? ? ? Purtroppo posso dirti con certezza che il tuo obiettivo di 16km/litro è praticamente irraggiungibile. Sono alla mia terza Clio ed è una vettura che posso dire di conoscere molto bene. Sono un guidatore tranquillo non tiro le marce e cerco di attuare tutte le accortezze per risparmiare carburante. Se guardi nelle pagine precedenti ho già trattato in altri topic il problema dei consumi di questo motore che sono purtroppo molto diversi da quelli dichiarati ( SOPRATTUTTO in CITTA’ ) dove la Clio 1.2 75cv dà veramente il peggio di se. In autostrada/misto sono arrivato al massimo a 6 8 litri x 100km. ( cioè 14 70 km/litro ) . In città ( Milano dove la velocità media è sotto i 20 km/h ) nonostante io guidi con il piede di velluto è impossibile scendere sotto gli 8 5 litri x 100 km. ( 11 76 km/l ) . La Clio è un’automobile pesante ed il 1.2 75 cv è un motore sottodimensionato per la sua mole. Ne consegue che il piccolo motore “si sforza” per muovere questa massa e quindi consuma ! ! ! Mi spiace essere così diretto ma penso proprio che tu abbia sbagliato motore e che rimpiangerai sia i consumi che le prestazioni della tua GPunto. Visto che percorri 20.000 km/anno il motore DCI da 86 cv sarebbe stato il motore ideale sia per il rapporto prestazioni/consumi e sia per la coppia che ti mancherà tantissimoooooooo ( visto oltretutto che arrivi dalla GPunto multijet ) . O altrimenti avresti potuto scegliere la 1.2 GPL. Le prestazioni sarebbero state quasi le medesime del benzina ma con un notevole risparmio nell’acquisto del carburante ( ad oggi la benzina costa 1 30 euro/litro mentre il GPL PER ORA costa 0 61 Euro/litro ) . Purtroppo il tuo vero problema non sarà come ponticellare il 12V per illuminare i comandi degli alzacristalli ma il NOTEVOLE AUMENTO DI DENARO che dovrai sborsare ( rispetto alla GPunto mutijet ) per percorrere i medesimi chilometri ! ! ! Marco ,,,,,,,,,,,,,,
Sondaggio Infiniti M,https://forum.quattroruote.it/threads/sondaggio-infiniti-m.25228/,2010-03-17 00:00:00,facip,,"Sarà dura convincere gli italiani ad abbandonare una serie 5 o una classe E per la M Infiniti. Io ribadisco un concetto già espresso: Infiniti deve trovare un modo per farsi conoscere. BMW sta martellando di pubblicità per l'uscita della nuova serie 5. Infiniti non può lasciare che la M sia pubblicizzata dal ""tam-tam"" degli appassionati o soltanto sui siti o rivesti specializzate. E' ora con la gamma di modelli e motori completa per l'Europa che Infiniti faccia lo sforzo di fare pubblcità almeno al livello di BMW mercedes e/o Audi. ",,,,,,,,,,,,,,
Consiglio su sostituzione parabrezza,https://forum.quattroruote.it/threads/consiglio-su-sostituzione-parabrezza.118948/,2018-10-24 00:00:00,CesaV40,'Una fiesta di 5 anni è seminuova Si merita il vetro nuovo Se parlavamo di una 127 rustica del 1980 per andare solo nelle campagne magari bastava il vetro vecchio',Si è vero l'auto è ancora nuova merita un vetro nuovo... ,,,,,,,,,,,,,,
Tesla Model S coinvolta in un incidente mortale (per l'altro),https://www.forumelettrico.it/forum/topic5524.html?sid=9b3d6660a00250109c0902db2fb0b90b,2019-05-03 21:55:00,MaurizioColombini,"""sicuramente usava il cellulare perchè basta riguardare il video piu' volte per rendersi conto di come...un attimo prima del primissimo impatto (non con la tesla ma con l'auto che la precede e che viene appena sbeccata...) il conducente aveva gia raddrizzato improvvisamente il volante come se avesse distolto lo sguardo e poi è tornato attento...evidentemente subito dopo ha continuato a usare il cell convinto di tenere dritta l'auto...ovviamente cosi non è stato...""","come fai a dire ""sicuramente"" usava il cellulare ? dal video non si vede dentro l'auto. potrebbe essere stato un malore oppure un colpo di sonno.Capisco che l'uso del cellulare in auto sia da condannare senza alcun dubbio ma basterebbe un dispositivo in ogni auto che ne impedisca l'uso se non attraverso vivavoce o sistemi di ultima generazione. Dovrebbe essere una dotazione obbligatoria come i sensori di segnalazione dei seggiolini dei bambini..",,,,,,,,,,,,,,
Seat Leon,https://forum.quattroruote.it/threads/seat-leon.107733/,2016-12-22 00:00:00,mikuni,,In extraurbano piano i 18 li fa anche il 1.2 a benzina... ,,,,,,,,,,,,,,
Fiat Bravo 2012 (Topic Ufficiale),https://www.autopareri.com/forums/topic/46423-fiat-bravo-2012-topic-ufficiale?&page=13#comments,2014-03-14 14:00:33,cortes,,IMHO bruttissima. Un mio vicino di casa l'ha comprata ed è un diesel 1.6 ...quando accende la macchina la sento al minimo con porte e finestre chiuse...sembra ci sia fuori un trattore SAME al minimo...fa un casino pazzesco...ma che razza di auto è ? ? ? ...pollice verso in tutto e per tutto. ,,,,,,,,,,,,,,
Prima Subaru!,https://www.autopareri.com/forums/topic/40186-prima-subaru,2010-10-12 13:19:13,Duncan,,Scusa mi son espresso male nella fretta intendevo lo sterzo nella guida se lo trovi preciso e comunicativo. ,,,,,,,,,,,,,,
Prezzo di listino bmw,https://www.bmwpassion.com/forum/threads/prezzo-di-listino-bmw.126764/,2010-03-25 00:00:00,mancio27,,Salve a tutti ho configurato la mia prossima Bmw attraverso il sito Bmw.it ed il prezzo finale risulta essere più basso di quasi 2.000 € rispetto al prezzo che mi propongono nelle concessionarie Bmw della mia regione la Puglia. Questo perchè il prezzo di listino chiavi in mano base ( senza optionals ) della vettura viene maggiorato dalle concessionarie di quasi 2.000 euro. E' anche vero che i prezzi di listino presenti sul sito Bmw.it sono prezzi consigliati e quindi non ufficiali però è possibile che non esista una regola ? Ogni concessionario propone un prezzo chiavi in mano differente e tutti sono molto più alti del prezzo di listino presente sul sito Bmw... Secondo voi si può trattare con il concessionario questo prezzo ? Che prezzo di listino vi hanno proposto per una Bmw Z4 2.3i Spyder New Model ? Ed in che concessionario ? Grazie a tutti ! ,,,,,,,,,,,,,,
UNO SGUARDO ALLA CONCORRENZA PER RIFLESSIONE,https://forum.quattroruote.it/threads/uno-sguardo-alla-concorrenza-per-riflessione.105309/page-3,2016-09-07 00:00:00,Matteomatte2.0,"'Perche' sono care? Secondo me hanno il prezzo giusto anzi sono economiche per quello che ""hanno"".'",per quello che offrono costano pure relativamente poco provate a configurare una Yeti 4x4 ( pure finto ) o una Octavia sempre 4x4 e poi configurate una XV o la Levorg con lo stesso equipaggiamento... ,,,,,,,,,,,,,,
Fiat Qubo 2008,https://www.autopareri.com/forums/topic/27309-fiat-qubo-2008?&page=17#comments,2008-09-19 13:13:26,nucarote,,Chi ci potrebbe perdere da Qubo è l'Idea. Se fanno una 4x4 anche il 16 deve stare in campana. Comunque poco automobilistico e IMHO forse costoso per quel che è. ,,,,,,,,,,,,,,
Celerio,https://forum.quattroruote.it/threads/celerio.102144/,2017-01-21 00:00:00,ZenoneZ,,"Il problema che ha una linea molto ma molto meno gradevole e retrò della ""precedente"" splash... ",,,,,,,,,,,,,,
Nuova 991 GT3RS-Part two,http://www.porschemania.it/discus/messages/492693/747245.html?1442389269,2015-09-08 18:56:00,greysky,,Forse sono rimasto indietro perch\xe9 non mi collego mai ma mi sembra che qui si dica che il Doppio scarico centrale che gi\xe0 da un po\x92 fa parte della GT3 sia presente anche su tutti i rinnovati modelli 991 mk2. In realt\xe0 a me sembra configurando un po\x92 sul sito Porsche che a parte appunto le GT3 tutte le altre 991 MK2 siano ancora come prima con doppi scarichi laterali per le S e singoli per le Lisce. La novit\xe0 \xe8 che puoi solo se vuoi mettere il doppio scarico centrale su tutti i modelli scegliendo l\x92optional \x93Impianto di scarico sportivo\x94.,,,,,,,,,,,,,,
Preparatori zona Milano,http://www.porschemania.it/discus/messages/502416/196940.html?1345235936,2006-08-31 20:30:00,hattori,,Avete fatto preparare il vostro Porsche ? Da chi ? e cosa ( motore assetto elettronica ) ? Esperienze giudizi ecc.,,,,,,,,,,,,,,
Suggerimento Forester - Levorg,https://forum.quattroruote.it/threads/suggerimento-forester-levorg.120501/page-22,2019-03-01 00:00:00,U2511,"""I sensori non assicurano nulla... prova di QR in cui il vetro automatico transitava una carota... anche la Volvo andava con un solo impulso solo quello del guidatore... io trovo scomodo che se metto la sicurezza per non farci giocare i bambini non li comando neanche io. Semmai. O che non entri la chiusura automatica ai 30 km/h o che chiudendo per evitare borseggi ai semafori poi non si riesca più ad aprire neanche dall'interno... ma sono quisquilie e pinzillacchere... i difetti sono ben altri.""",Spiace contraddirti io li ho testati con il braccio su tutte le sette auto che abbiamo avuto con questa sicurezza e funzionano benissimo anzi nel dubbio ( un banale rallentamento nella corsa del cristallo ) il sistema blocca ed abbassa subito il finestrino per cui devi ri-registrarlo ( il più sofisticato era quello della E46 con una guarnizione pressostato tutti gli altri sono stati e sono a frizione ) . L'autolock è utile comodo e sicuro e non è affatto vero che non la si apra più nemmeno dall'interno. No Max sono cose inammissibili non oggi ma da 15-20 anni e sono tra le concause delle scarse vendite. Non le concause più importanti certo ma vengono notate ed alla fine solo pochi masochisti appassionati insisitono con questo marchio esotico. Almeno gli interni sono stati migliorati ( ma stendiamo un velo pietoso sul baule per come l'hanno conciato nel my2019 ) . Certo so bene che i mezzi hanno dettagli importanti costosi perché ben fatti ma pochi sanno apprezzarli. ,,,,,,,,,,,,,,
Maserati Quattroporte 2013,https://www.autopareri.com/forums/topic/49425-maserati-quattroporte-2013?&page=40#comments,2012-11-08 16:24:08,-jag-,,"Io ho solamente riportato il raffronto di autoblog.nl e precedentemente ho scritto la mia personalissima opinione su questa vettura senza alcun fine speculativo che sia chiaro. Detto questo ho i miei forti dubbi su design e qualità ( anche percepita ) e sono solo miei e fino a che non troverò qualcosa che mi convinca del contrario resterò della stessa opinione. Ci sono alcune cadute di stile ( qualcuno le ha difinite ""industria automobilistica del ventunesimo secolo"" ) che secondo me su una vettura del genere rivolta ad una specifica clientela fin troppo esigente e con prezzi che schizzeranno dai 100000 Euro in su ( la Quattroporte attuale parte da 117000... ) potranno incidere negativamente sulle vendite ed aggiungo che a questi livelli ciò che fa' la differenza sono proprio i particolari. Sarò felicissimo di essere smentito ma per adesso sono convinto di questo. ",,,,,,,,,,,,,,
Legacy bi-fuel per diventare &#34;Subarista&#34;?,https://forum.quattroruote.it/threads/legacy-bi-fuel-per-diventare-34-subarista-34.101848/,2016-01-26 00:00:00,SUBmARine U-14,,Ho comprato diverse auto usate e -tocchiamo ferro- grossi problemi non ne ho avuti. Adesso ho una Subaru Diesel ma non avrei motivo di dubitare di una Subaru gpl. In bocca al lupo per l'acquisto ,,,,,,,,,,,,,,
Nuova Kia Rio 2011,https://forum.quattroruote.it/threads/nuova-kia-rio-2011.53302/,2011-07-18 00:00:00,prisencolinensiainciusol,,non male ma di solito il modello hyundai successivo è pure meglio... ,,,,,,,,,,,,,,
RAV4 2019 che peccato !,https://forum.quattroruote.it/threads/rav4-2019-che-peccato.120340/,2019-01-17 00:00:00,Utente_3025725675,,Per guidare la tecnologia automobilistica più interessante del momento bisogna rinunciare all'integrazione del proprio smartphone sul bellissimo schermo di bordo Mirrorlink non è chiaramente quello che cerca l'utente di una vettura di questa gamma. Spero che le tanto annunciate integrazioni con Car Play e Android Auto possano presto diventare realtà altrimenti il primato tecnologico di Toyota sarà solo parziale ,,,,,,,,,,,,,,
Fiat Bravo (Topic Ufficiale - 2007),https://www.autopareri.com/forums/topic/23380-fiat-bravo-topic-ufficiale-2007?&page=80#comments,2007-04-17 15:38:00,LucioFire,,"io penso che sia molto utile...in strade di campagna dove non ci sono ""paletti""ne la mpioni ne guardrail vedrai che ti servono ! ",,,,,,,,,,,,,,
Online il sito dell'ecobonus per auto elettriche,https://www.forumelettrico.it/forum/online-il-sito-dell-ecobonus-t4943-90.html?sid=053f872f8b7b19de0856815c966834f2&sid=053f872f8b7b19de0856815c966834f2,2019-04-05 14:12:00,andreapepp,"""ANSAAuto: si sblocca l'ecobonushttp://www.ansa.it/sito/notizie/topnews ... c121c.html""",Finalmente ! ,,,,,,,,,,,,,,
Scénic XMod - Topic Ufficiale,https://forum.quattroruote.it/threads/sc%C3%A9nic-xmod-topic-ufficiale.14456/page-258,2011-01-05 00:00:00,Nuotatore83,,ATTENZIONE ATTENZIONE stamane myrenault recitava: TRASPORTO LA TUA AUTO E' ARRIVATA IN ITALIA La tua auto è arrivata in Italia ! In questo momento si trova in uno dei nostri centri di sdoganamento e distribuzione in attesa di essere inviata alla tua Concessionaria. 03 gennaio 2011 ! ! ! ! ! ! ! ditemi dov'è che me la vado a prendere io ! ! ! ! ! ,,,,,,,,,,,,,,
