Titolo,URL,Timestamp,User,(Testo Citato),TESTO,Costruttore,Modello,Brand,Interni,Esterni,Meccanica,Prestazioni,Consumi/Autonomia,Motore,Elettrico,Fuoristrada,Elettronica di Bordo,Manutenzione,Assistenza/Concessionari
Mazda cx 5 awd skyactive 2200 150 cv,https://forum.quattroruote.it/threads/mazda-cx-5-awd-skyactive-2200-150-cv.102145/page-2,2016-02-22 00:00:00,melego73,"""Sono passate 3 settimane dall'apertura del 3d e il primo resta l'unico messaggio dell'autore. Nell'attesa di essere smentit finora questo ha tutte le caratteristiche del trollaggio!!!""",Puo' essere che tu abbia ragione ma perché proprio con Mazda ? Inoltre a me non arrivano le notifiche di quando viene inserita una risposta entro io a controllare se mi ricordo e se ho tempo. Puo' avere lo stesso inconveniente anche questo utente. ,,,,,,,,,,,,,,
Incompetenza Bmw Italia!!!!!,https://www.bmwpassion.com/forum/threads/incompetenza-bmw-italia.94732/,2008-05-07 00:00:00,serie1mania,,Sono allibito ! ! ! ! ! ! ! scusate se apro un topic quasi simile a quello di ieri ma mi devio sfogare ! ! ! ! ieri ritiro la mia 123d e noto che l'olio che hanno messo è sbagliato dato che è lo 0-30 e non il 10-60...faccio notare e mi dicono che va bene così....ok stamattina chiamo bmw italia e cosa mi dicono non si preoccupi se il nostro conce le ha messo quell'olio vuol dire che è quello giusto e comunque se succede qualcosa vedo che la sua auto è ancora in garanziaallora alla mia domanda perchè ( qui grazie a pietrostone ) c'è una circolare interna che dice che per il 123d deve essere usato un olio specifico mi rispondde che essendo una circolare interna non può commentare e comunque loro cioè bmw italia non hanno le specifichge esatte degli oli da usare ma devo andare in conce ! ! ! ! allibito chiamo il conce e all'accettazione non risponde nessuno il responsabile zero così come il capo officina....al 4 tentativo chiamo il magazzini chiedendo uil tipo di olio che deveva essere usato per il 123d e mi dicono che guarda caso è il 10-60...raccontata la mia avventura mi chiede il numero dui telefono e tempo 5 minuti mi chiama il capo officina dicendomi di non usare la macchina e andare subito da loro che ricambiano l'olio...non capisco perchè ieri andava bene e oggi no ! ! ! ! scandaloso scandaloso non oso pensare a quei poveracci che non controllano le fatture ed eventuali errori che potrebbereo portare a rotture che poi guarda caso ricadrebbero sui clienti facendo sfigurare anche bmw...dopo questa avventura sono sempre più convinto che le nostre macchine sono sempre più in mano a incompetenti e anche molte rotture non sono da inputare a mamma bmw ma anche alla manutenzione e al pressapochismo di molti maccanici ( se così si possono definire ) bmw.non sò se esiste già una sezione o una iniziativa del genere ma visto che non siamo in pochi potremmo vedere di scrivere tutti insieme una lettera per informare bmw italia ma sopratutto la casa madre in germania in che modo siamo trattati e l'incapacità dei loro meccanici in italia. magari se siamo in un po' ne terranno un po' in considerazione e non cestineranno subito la nostra lettera ,,,,,,,,,,,,,,
Fx e neve,https://forum.quattroruote.it/threads/fx-e-neve.53856/page-2,2011-07-28 00:00:00,reFORESTERation,"L'Outback l'ho provata l'anno scorso sulla neve ed è un'auto inarrestabil se abitassi in montagna non esiterei a prenderla. Esteticament specie l'ultimo modell non mi piac era meglio il penultimo. L'Fx è semplicemente uno spettacol e poi come guida è a livelli delle migliori berlin a quanto leggo in giro. Ed è questo che mi interess oltre ad altri particolari come la poca diffusion il fatto che è giappo e non tetttesc ecc. L'unica perplessità sta nella possibilità di andare a sciare senza avere problem sono disposto anche ad andare piano...... non credo avresti più problemi di un ford galaxy o di un'astra sw...o di una normale clsse E mercedes..... basta andare cauti.... ha dei limiti fisic e vanno rispettati. sulla neve ci sono andati anche con la ferrari FF..... ""L'Outback l'ho provata l'anno scorso sulla neve ed è un'auto inarrestabil se abitassi in montagna non esiterei a prenderla. Esteticament specie l'ultimo modell non mi piac era meglio il penultimo. L'Fx è semplicemente uno spettacol e poi come guida è a livelli delle migliori berlin a quanto leggo in giro. Ed è questo che mi interess oltre ad altri particolari come la poca diffusion il fatto che è giappo e non tetttesc ecc. L'unica perplessità sta nella possibilità di andare a sciare senza avere problem sono disposto anche ad andare piano...""",vero..verissimo specie con le scarpe adatte ( e buone ) un momento..newsuper..infinity= nissan nissan= renò..aaaaaaaaaaaahhhhhh..ma te non sei di parte ! ! ! ! ,,,,,,,,,,,,,,
Ma è  vero che .....,http://www.porschemania.it/discus/messages/10548/760757.html?1450260034,2015-12-05 15:19:00,sdm,,Dopo questa analisi ora se dovessi scegliere tra una 997 MKI e una 997 MKII non avrei dubbi riguardo al motore. Anche tutto il resto \xe8 superiore.,,,,,,,,,,,,,,
"Guida ""anti ibrida""",https://forum.quattroruote.it/threads/guida-anti-ibrida.118999/,2018-10-21 00:00:00,Andrea-808,,"Buonasera a tutti mi sono appena registrato e volevo chiedere delle informazioni utili premetto che ho già cercato nei vai forum ma non mi è stato ancora chiaro quello che cercavo L'anno prossimo ( e ancora presto ma sono curioso ahah ) devo comprare una nuova auto e mi ispira l'ibrido toyota per vari motivi principalmente nell'auto cerco AFFIDABILITA cosa che si poteva esigere nei vecchi diesel che ormai divenuti ""moderni"" e scesa parecchio secondo me senza offesa per i diesel che amo ma purtroppo se si punta ad arrivare a 250000km con un diesel moderno a mio parere è difficile arrivare senza tante noie e non parlo solo del dpf.. Comunque guardavo l'auris non so ancora la versione e tutto ma pensavo alla prossima che credo uscirà l'anno prossimo sui mercati guardando i forum l'affidabilita e ottima grazie anche alla famosa frase ""quello che non c'è non si rompe"" e anche i consumi ma sempre guardando in giro i consumi sono ottimi solo se si guida nel modo giusto ed è qua che mi pongo il problema: Il mio stile di guida secondo me non é adatto ad un ibrido solo per lavoro faccio 80km al giorno principalmente in tangenziale ma a causa del traffico ho andature che vanno da un 110 ad un 70 all'ora e qui ci sta l'ibrido sicuramente ma quando non vado a lavoro ho una guida non dico sportiva ma molto allegra mi piace schiacciare e andare veloce sopratutto in extraurbano e non e difficile che mi trovi anche ai 110/120 in autostrada invece che la uso occasionalmente vado ai 130/140 costanti però premetto che la guida e comunque fluida odio le frenate all'ultimo e le accelerazioni inutili tipo sorpassi che ti fanno guadagnare forse 5 secondi nel tragitto detto questo volevo sapere magari da chi ha provato o ha il mio stile i consumi come sono di certo non mi aspetto i famosi 25 km al litro che da quel che ho letto si possono raggiungere ma tipo si riesce a fare un 16/17 con un litro ? E l'affidabilità rimane comunque tale ? So che questo ibrido non e adatto ad uno stile così ma comunque mi ispira sul fato dei consumi sicuramente un diesel fa meglio ma non mi pongo troppo il problema mi basta che non faccia rogne ( parlando nel limite ovviamente ) Ah ultima cosa una volta massimo 2 all'anno devo fare un viaggio che che dire lungo e poco Devo andare all'est Europa e di solo andata faccio 1700km di cui 1000 in autostrada il resto e diviso tra extraurbano montagne sorpassi ecc.. il viaggio dura circa 24 ore secondo voi resiste ? Ah dimenticavo faccio circa 35000km annui Siccome sono nuovo mi scuso in anticipo se ho fatto qualche errore e se c'era qualche topic simile al mio ma ripeto che ho cercato ma senza risposte esigenti per quello che cerco ",,,,,,,,,,,,,,
I futuri benzina Alfa Romeo: TBi & V6 (Riassunto a Pag.1),https://www.autopareri.com/forums/topic/23873-i-futuri-benzina-alfa-romeo-tbi-v6-riassunto-a-pag1?&page=160#comments,2009-01-16 10:55:55,dallas,,Rimane sempre l'incertezza sulla precisione di questi banchi a rulli.... la prova del motore va fatta in sala prova motori senza trasmissione e con il freno direttamente sul volano ! ,,,,,,,,,,,,,,
Hyundai i20 Coupé 2015,https://www.autopareri.com/forums/topic/57059-hyundai-i20-coup%C3%A9-2015?&page=3#comments,2015-03-18 15:02:00,Touareg 2.5,,Da quanto ho letto forse proprio nel thread della 5 porte anche nei vari conce Hyundai ci son state parecchie lamentele interne sui listini di questa nuova generazione di i20. Sposto nel forum di appartenenza. ,,,,,,,,,,,,,,
Nuovo Logo Alfa Romeo?,https://www.autopareri.com/forums/topic/23958-nuovo-logo-alfa-romeo,2007-06-20 19:35:56,Regazzoni,,Essenzialmente non riesco a capire come ci possa stare di traverso la scritta Alfa Romeo senza diventare piccolissima e anche come pensano di far diventare orizzontale la croce e soprattutto il biscione. Il tutto presumo in un cerchio: insomma quello descritto è geometricamente ai limiti del configurabile. ,,,,,,,,,,,,,,
Alfa Romeo 155 GTA Stradale,https://forum.quattroruote.it/threads/alfa-romeo-155-gta-stradale.121426/,2019-02-24 00:00:00,mani in alto,,Stando a quanto detto nel video il motore é quello della delta così come parte della trasmissione e delle sospensioni ( a controllo elettronico tra l'altro ) . La 155 q4 era invece un'altra roba una TA vestita a festa ma esclusa la linea generale in comune c'é ben poco. ,,,,,,,,,,,,,,
Porsche Taycan ecosistema a zero emissioni: camion elettrici per la logistica - HDmotori.it,http://www.hdmotori.it/2018/12/17/porsche-taycan-elettrica-camion-elettrico-logistic/,2018-12-17 04:39:00,Gpat. (Mi8+Ryzen),,Versus ? Saranno praticamente la stessa auto con 2 marchi diversi,,,,,,,,,,,,,,
[News]Ford Focus II restyling,https://www.bmwpassion.com/forum/threads/news-ford-focus-ii-restyling.48951/,2004-12-01 00:00:00,farnci1,,motorauthority ,,,,,,,,,,,,,,
Pregi e difetti bmw 518d 105 kw,https://www.bmwpassion.com/forum/threads/pregi-e-difetti-bmw-518d-105-kw.339422/,2018-12-17 00:00:00,Freddi,,Buonasera a tutti ho comprato da qualche giorno una serie 5 518d 143cv 105 kw qualche consiglio utile o problemi che si possono verificare ? Visto che ho lasciato una wolswagen Passat con 863000 km senza mai aver capito niente attendo vostre notizie grazie ,,,,,,,,,,,,,,
CAMRY: perché non è commercializzata in Italia?,https://forum.quattroruote.it/threads/camry-perch%C3%A9-non-%C3%A8-commercializzata-in-italia.117219/page-4,2018-07-14 00:00:00,XPrience74,"""Ti dir prima avevo voglia di tornare a casa per poter guidare la mia mot ora ho anche voglia di guidare la mia macchina. In questi mesi da quando l'ho acquistat vado volentieri a fare passi con la macchin ma a me piace guidare e sia in moto che in macchina molte volte il rientra a casa da 5km diventano facilmente 100km. in Brev SI la mia ibrida mi rilassa parecchio. PS: Abito in montagna.""","Ad apprendere dalla rete non fai parte della minoranza... E pensare che molti attribuiscono a tale soluzione propulsiva ( specie by Toyota ) noia e ""basso profilo"" ( * ) ... Certo non bisogna avere troppi ""pruriti"" alla guida nonché nei termini più comuni per così dire... Ergo: il famoso ""piacere di guida"" può avere più facce/interpretazioni ( vedi gusti/aspettative personali ) ... ( * ) Che costruttori quali proprio Hyundai/Kia hanno cercato di ""rimediare""... anche se con qualche compromesso aggiungo io dovendo ricorrere ad un vero e proprio cambio con tutto ciò che questo comporta... ",,,,,,,,,,,,,,
Cruze: restyling e SW?,https://forum.quattroruote.it/threads/cruze-restyling-e-sw.61290/,2012-02-03 00:00:00,mommotti,,Mmmh interessante. Ma smargia ha avuto ulteriori news sulla monovolume segmento c sorellina dell'orlando di cui parlammo un annetto fà ? Scusate l'off topic ma mi sembrava eccessivo riaprire per l'ennesima volta un thread su questo. ,,,,,,,,,,,,,,
Alfa Romeo - 3.0 M-Jet V6,https://www.autopareri.com/forums/topic/22754-alfa-romeo-30-m-jet-v6?&page=18#comments,2007-06-25 11:18:11,ItalianDriver,,.................. ,,,,,,,,,,,,,,
BOXSTER 987 - 2004  Consigli per l'acquisto,http://www.porschemania.it/discus/messages/502415/671647.html?1385374460,2013-11-12 23:44:00,chemist1,,"Il cambio a 6 marce ( invece del 5 rapporti della 2.7 standard ) \xe8 un plus non indifferente e ti permette in uscita di curva di avere un rapporto sempre ideale per farle riprendere i giri. I sedili sportivi sono un altro optional molto valido trattengono benissimo e non sono scomodi anzi ! Anche i cerchi da 18"" ( al posto dei 17"" ) sono esteticamente molto pi\xf9 belli e rendono la guida pi\xf9 precisa e reattiva avendo anche pneumatici con spalla pi\xf9 stretta Tagliandi siamo sugli 800 ( in CP ) euro se non ci sono altri problemi o candele da cambiare ecc consumi pi\xf9 che onesti ( 12 in autostrada e 8 in citt\xe0 con la 3.2 ) gomme si pu\xf2 risparmiare con acquisti on line ( 123gomme gommadiretto ecc ) i km basta farsi leggere le ore motore in cp o in Bosh service. Toglilma moquette sia del vano bagagli anteriore e posteriore e guarda se i lamierati sono ben accoppiati frizione cambio ecc. Ti consiglio di farla visionare in Porsche cos\xec da toglierti ogni dubbio ed eventualmente scalare dalla cifra richiesta i costi di ripristino. Luca",,,,,,,,,,,,,,
mi piacerebbe...,https://forum.quattroruote.it/threads/mi-piacerebbe.97016/,2015-06-19 00:00:00,pi_greco,,... dopo aver letto la classifica di motore dell'anno... ... un boxer diesel 6 cilindri da 3 litri con in ogni bancata il guppo termico bmw con due sistemi di aspirazione e scarico indipendenti... ... il resto va bene com'è magari giocherei un po' di più con assetto e gestione delle ruote in 4WS... ,,,,,,,,,,,,,,
Consegna Cayenne Diesel,http://www.porschemania.it/discus/messages/22971/546901.html?1447078532,2011-02-16 21:14:00,matozzo,,Ciao Anto' e a tutti gli amici \xe8 vero \xe8 un po di giorni che non mi faccio sentire ed il motivo \xe8 che sono in lutto nulla di traumatico \xe8 solo il fatto che dovro aspettare un po di piu' per la cayenne. E' successo che il giorno prima che mi consegnassero la macchina durante un giro di prova la macchina \xe8 stata incidentata la concessionaria mi ha mandato le foto della macchina e per me \xe8 stato come avere un pugno allo stomaco la riparavano e mi hanno proposto anche uno sconto ma io ho rifiutato. Mi hanno contattato proprio oggi dicendomi che in settimana entrante mi confermeranno la nuova macchina e la consegna sar\xe0 entro la met\xe0 del mese di marzo. Ditemi voi come posso stare. Un benvenuto a bd70 si io ho fatto con un broker di Roma e devo dire che ho avuto un buon trattamento le consegne sono sicuramente piu' veloci delle concessionarie ufficiali ma anche li bisogna aspettare 2 - 3 mesi tutto dipende dalla disponibilit\xe0 in Germania e per la Cay anche li cominciano ad esserci dei problemi di consegna in quanto le richieste sono oltre a quelle previste dalla Porsche.,,,,,,,,,,,,,,
Mazda MX-5 2015,https://www.autopareri.com/forums/topic/56165-mazda-mx-5-2015?&page=58#comments,2014-10-26 09:48:41,alederme,,Esattamente Poi in Germania se non porti la 2000. I crucchen si offenden Ø loro kamminen con le macchine mica come gli italienisch che stanno in coda Ahahahah scusate ma conosco troppi tedeschi ,,,,,,,,,,,,,,
Alfa Romeo GTV: impressioni di chi le possiede/ possedute,https://www.autopareri.com/forums/topic/42422-alfa-romeo-gtv-impressioni-di-chi-le-possiede-possedute,2011-03-23 21:27:45,oldcar80,,Ciao a tutti. Vi chiedo se sia possibile inserire una nuova discussione che abbia come oggetto le impressioni sulla GTV dell'Alfa Romeo. Sono intenzionato ad acquistarne una usata e vorrei sapere da chi le conosce già cosa ne pensa: vantaggi/svantaggi Grazie a Tutti ,,,,,,,,,,,,,,
BMW Serie 7 2019,https://www.autopareri.com/forums/topic/66569-bmw-serie-7-2019?&page=2#comments,2019-01-09 16:20:21,4200blu,,sta perfetto insieme per una chi porta scarpe di Sant'Elpidio al Mare cosi.....😂😂 ,,,,,,,,,,,,,,
Kia Venga 2009,https://www.autopareri.com/forums/topic/34679-kia-venga-2009?&page=18#comments,2014-09-26 07:32:19,bibiscia,,Concordo in tutto NO KIA VENGA NO RETE KIA meditate oltre al motore che non va mi sono stati sostituiti gli ammortizzatori posteriori ma la tenuta è scarsissima da poco poi ho i semiassi che scricchiolano specialmente nelle partenze in salita. Guardate che ho fatto decine di ricoveri nelle officine ma per loro è tutto a posto se poi non ci credete vi invito a provare la mia Kia Venga sono a Firenze ma se volete mi sposto verso di voi sempre che la macchina ce la faccia ad arrivare capirete che qualsiasi altra auto va sicuramente meglio della Kia Venga. se volete provarla scrivetemi a obecor@tin.it ,,,,,,,,,,,,,,
Problema Panda...e cortesia Fiat!,https://www.autopareri.com/forums/topic/26077-problema-pandae-cortesia-fiat,2007-11-20 09:29:34,Coaster,,"Da una settimana ho notato che la mia Panda ha un problema...la frizione slitta in quarta e quinta quando il motore entra in coppia.. sensazione davvero sgradevolissima quella di vedere la lancetta dei contagiri schizzare e la macchina non prende velocità nei sorpassi poi è una goduria... Quindi ieri sera parto e vado al Conce del mio paese. Morale della favola..frizione bruciata e quindi da sostituire ! Vabbè a parte i sudori freddi quello che mi ha stupito di più in assoluto è stato il trattamento che ho ricevuto. Premetto che sono abituato all'assistenza VW degli stronzi di prima classe ma ieri sera sono entrato e ho detto all'hostess che avevo un problema..gentilissima mi ha accompagnato in officina mi ha affidato al meccanico..il quale nonostante l'officina fosse già chiusa è subito salito in Panda e ha fatto una prova di venti minuti ( ! ! ! ) per ""togliersi ogni dubbio""...ha provato accelerazioni riprese scalate tutto il possibile...tornato in officina altri buoni 20 minuti a spiegarmi che era strano il fatto che slittasse solo in quarta e quinta a parlarmi di un sacco di cose meccaniche che adesso non riporto.. siamo rimasti che gli porto l'auto la settimana prossima ha detto che non importa che arrivi tardi da lavoro che lui se l'avviso per tempo mi aspetta che l'intervento sarà coperto da garanzia e che avrò l'auto sostitutiva per il tempo necessario ( essendo 4x4 ha detto che ci vogliono 2-3 giorni che è un pò più complesso ) ...dopo aver detto che purtroppo non ci sono più le frizioni di una volta e che comunque ci sono stati già alcuni casi simili ci mancava solo che mi invitasse a cena. Io non so magari questi sono gli standard normali per gli altri Marchi. Per me abituato al teutonico menefreghismo di chi mi aggiusta la Polo è stato davvero abbastanza sorprendente specie per il fatto che è la mia ""prima volta"" con l'assistenza Fiat e dopo tutto il male che se ne dice io mi permetto di essere soddisfatto. Certo magari da Torino fanno sempre a tempo ad incasinare la faccenda...però nel frattempo le cose mi stanno bene così... ! Amen ! ",,,,,,,,,,,,,,
Acquisto auto usata,https://www.autopareri.com/forums/topic/23643-acquisto-auto-usata?&page=3#comments,2007-06-15 11:52:53,Cool Night,,Potresti anche iniziare a sputtanarli scrivendo qui di che concessionario si tratta se consentito ,,,,,,,,,,,,,,
Durata twinair,https://forum.quattroruote.it/threads/durata-twinair.114865/,2018-02-15 00:00:00,ps5cfw@live.it,"'Purtroppo la panda 4*4 diesel costa troppo per me e non ho mai amato i TD. So che sono motori affidabili però mi butterò sul twinair (che è un bel motore da guidare tra l'altro) o lascio perdere la Fiat Panda e torno su Suzuki Spero di non pentirmi della scelta Fiat che sto per fare....il mio obiettivo sarebbe farci un 200.000 km come ho fatto con qualsiasi altro motore. Che problemi ha il tuo twinair con oltre 180.000? Ho paura di comprare un ""bidone""....'",è un motore downsized all'estremo e turbocompresso per non essere una bara. Aspettati tutti i problemi del downsizing e pure la turbina che è relativamente debole. ,,,,,,,,,,,,,,
Jeep Renegade vs Hyundai Tucson,https://forum.quattroruote.it/threads/jeep-renegade-vs-hyundai-tucson.104848/,2016-10-21 00:00:00,aamyyy,,Renegade ,,,,,,,,,,,,,,
M6 Cabrio o V8 Vantage,https://www.bmwpassion.com/forum/threads/m6-cabrio-o-v8-vantage.51414/page-4,2007-05-13 00:00:00,Masamune,"""Devo vedere quale prend se decido per l'N400 ha già un suo super assettino mica male...""","paragonato a quello della ///M6 va da sè che è meno prestazionaleperò mi sembra ovvio che il ""pacchetto"" migliore tra le due auto lo offra l'Aston Martine non starei a pensare all'età che hai se prendi l'///M6 tra 4 anni ciucciata una svalutazione del 60% ti fai comunque l'Aston:wink: ",,,,,,,,,,,,,,
SEAT IBIZA SC 1.2 TDI. IN AGGIORNAMENTO: Guasto sistema ricircolo gas 384 euro!,https://forum.quattroruote.it/threads/seat-ibiza-sc-1-2-tdi-in-aggiornamento-guasto-sistema-ricircolo-gas-384-euro.38088/page-31,2013-09-06 00:00:00,gabrielelucio,"Salve a tutti! Ieri sono rimasto a piedi con l'Ibiza... verosimilmente batteria scarica.. la cosa strana è che l'auto non ha neanche tre anni e la sera viene sempre messa in garage... Ieri sera è venuto un tecnico seat per farla ripartire in quanto il tutto fortunatamente è accaduto quando la stavo prendendo dal garage. E' ripartita subito e l'ha portata in officina per verificare.. Oggi mi è stato detto che stanno facendo un test di assorbimento della corrent perché sembra che la batteria sia a posto... probabilmente c'è un problema di dissipazione di energia.. per telefono mi hanno detto che hanno effettuato un aggiornamento (non so a cosa però).. stasera alle 15 devo richiamare per sentire a che punto sono... Speriamo ben perché l'auto non è più in garanzia.. :S... E' successo un paio di settimane fa a un mio amic Ibiza di 4 ann che sia un difetto ricorrente? ""Salve a tutti! Ieri sono rimasto a piedi con l'Ibiza... verosimilmente batteria scarica.. la cosa strana è che l'auto non ha neanche tre anni e la sera viene sempre messa in garage... Ieri sera è venuto un tecnico seat per farla ripartire in quanto il tutto fortunatamente è accaduto quando la stavo prendendo dal garage. E' ripartita subito e l'ha portata in officina per verificare.. Oggi mi è stato detto che stanno facendo un test di assorbimento della corrent perché sembra che la batteria sia a posto... probabilmente c'è un problema di dissipazione di energia.. per telefono mi hanno detto che hanno effettuato un aggiornamento (non so a cosa però).. stasera alle 15 devo richiamare per sentire a che punto sono... Speriamo ben perché l'auto non è più in garanzia.. :S""",Può darsi.. Stasera vi farò sapere.. ,,,,,,,,,,,,,,
Nuova Fiat punto cabrio e nuova fiat uno!!,https://www.bmwpassion.com/forum/threads/nuova-fiat-punto-cabrio-e-nuova-fiat-uno.13281/,2005-06-15 00:00:00,gianluca_bmw,,mentre cercavo qualche sfondo ho trovato queste ! ! La Punto Cabrioe la nuova Fiat uno ! ! ! ! ! Vi piacciono a mè la uno no ! ! La punto non è brutissima.... ,,,,,,,,,,,,,,
Smart abusiva con cavo inserito all'Enel X ma disconnessa,https://www.forumelettrico.it/forum/smart-abusiva-con-cavo-inserito-all-enel-x-ma-disconnessa-t5549-70.html?sid=afbb8b79ce719d4905a913f84b3a8c80&sid=afbb8b79ce719d4905a913f84b3a8c80,"12/05/2019, 8:46",Fabio 66,,Ciao e se lasci l’auto in ricarica e poi si completa e finisce cosa devi fare ? Probabilmente è successo proprio quello .Chiedo scusa per la domanda banale ma potrebbe servirmi in futuro Grazie,,,,,,,,,,,,,,
KIA: EcoDynamics+ Il diesel con sistema 48V,https://www.autopareri.com/forums/topic/65148-kia-ecodynamics-il-diesel-con-sistema-48v,2018-05-15 12:12:29,J-Gian,,Quindi è il solito alternatore a cinghia reversibile e potenziato abbinato all'impianto a 48 V ,,,,,,,,,,,,,,
Renault Twingo 2014,https://www.autopareri.com/forums/topic/54333-renault-twingo-2014?&page=46#comments,2014-07-10 14:07:17,indeciso88,,credete che con un simile precedente una soluzione simile possa essere adottata anche sulla twingo ? Smart Fortwo gpl prova su strada: consumi e prestazioni | Focus Motori ,,,,,,,,,,,,,,
Museo Alfa Romeo: finalmente il TAR ha respinto il vergognoso ricorso contro il vincolo.,https://forum.quattroruote.it/threads/museo-alfa-romeo-finalmente-il-tar-ha-respinto-il-vergognoso-ricorso-contro-il-vincolo.49441/page-23,2011-06-24 00:00:00,alexmed,'Parecchio amaro. A te?',Mi è venuta su l'acidità dallo stomaco e mi son quasi bruciato la gola... ,,,,,,,,,,,,,,
Volkswagen EOS Restyling (Topic Ufficiale - 2010),https://www.autopareri.com/forums/topic/40118-volkswagen-eos-restyling-topic-ufficiale-2010?&page=4#comments,2011-02-07 22:13:13,J-Gian,,"Il tetto nero è una bella trovata lo si nota meno e diventa tollerabile anche da chiusa. Da prendere con i fari a led ""rosario"" quella con le alogene la trovo meno caratterizzata della pre-restyling. ",,,,,,,,,,,,,,
domani panda!!!!!!!!!!!!!!!!!!!,https://forum.quattroruote.it/threads/domani-panda.26053/page-2,2010-03-17 00:00:00,kanarino,"'sorgente sinto dvd con schermo integrato jvc da 3.5"" a 1 di fronte anteriore a 2 vie impact hr 66.38 più un sub usblaster da 30...ampli x le casse tec spl 100.4 e impact xtreme 3.5kw x il sub....però ora vedo se mettere 2 coassiali sulla cappeliera e se scendere un po di watt x l'ampli del sub....'",Azz....allora facciamo sul serio....beh direi che già va benone...altimenti rischi che se alzi troppo il volume ti parte la vernice del tetto Sandrì ,,,,,,,,,,,,,,
