Titolo,URL,Timestamp,User,(Testo Citato),TESTO,Costruttore,Modello,Brand,Interni,Esterni,Meccanica,Prestazioni,Consumi/Autonomia,Motore,Elettrico,Fuoristrada,Elettronica di Bordo,Manutenzione,Assistenza/Concessionari
Audi Prima Scelta Plus,https://forum.quattroruote.it/threads/audi-prima-scelta-plus.109884/,2017-04-11 00:00:00,cybermancio,,"Ciao a tutti sono un nuovo utente e voglio portarvi a conoscenza di un fatto increscioso che mi è da poco capitato. Ho acquistato di recente un'Audi A3 Sportback 1.6 usufruendo del programma Audi Prima Scelta Plus. L'auto aveva circa 10.000 km era stata immatricolata circa 8 mesi prima. Il prezzo di acquisto mi sembrava un pelino alto ma considerando il programma ( garanzia 4 anni assicurazione incendio furto per un anno etc.etc. ) e le certezze ""sbandierate"" anche dalla pubblicità AUDI su tutti i media non ho avuto grandi esitazioni e anche se con quella cifra avrei potuto acquistare anche altre auto pari segmento nuove sono stato conquistato dal programma. Per cui mi sono presentato al Concessionario Ufficiale di zona che mi ha appunto proposto l'auto e l'ho acquistata. Dopo circa 20 giorni mi sono accorto che lavando l'auto e sopratutto nelle giornate piovose entravano abbondanti quantità d'acqua dal portellone posteriore. Senza indugiare troppo ho richiamato il venditore il quale mi ha invitato a portare l'auto presso la propria carrozzeria interna e con mio stupore solo dopo circa un minuto ( smontando la plastica di rivestimento interno del portellone posteriore ) hanno scoperto che l'auto aveva probabilmente avuto un incidente con molta probabilità un tamponamento. ( Circa 2.500 euro di danni valutati ) . Tutto questo ovviamente si riferiva a qualcosa che disconoscevo al momento dell'acquisto e con mia ASSOLUTA INCREDULITA' disconosceva pure lo stesso rivenditore o così continuava a ripetermi. Ma siccome AUDI ha incentrato tutta la sua campagna di promozione e vendita sul suo usato garantito proprio su questi 110 controlli che le fanno affermare ""Audi conosce ogni singolo dettaglio di ciascuna vettura. Era lì quando è stata pensata disegnata costruita e anche quando è stata venduta. Pertanto possiamo garantirle con assoluta certezza le attuali condizioni di ogni Audi usata"" cosa dovrei pensare ? ? ? ? Devo dire che il rivenditore ha prima riparato l'auto e poi si è proposto di restituire la somma pagata o di sostituirmi la vettura con un'altra usata di pari caratteristiche ma se non mi fossi accorto io del problema così semplicemente avrei mai potuto conoscere le reali condizioni di quest'auto ? Mi chiedo quali sono i controlli che veramente vengono effettuati su queste AUTO oggetto del programma AUDI PRIMA SCELTA PLUS ? ? ? E' tutta e solo una operazione commerciale e di marketing ? La storia poi è andata avanti ...ma per il momento soprassiedo in attesa di vostri commenti. Grazie ",,,,,,,,,,,,,,
tesla,https://forum.quattroruote.it/threads/tesla.71981/page-3,2017-05-25 00:00:00,Lukay,'A livello urbanistico è attiva da decenni una norma (per lungo tempo disattes da qui il disastro che conosciamo....) per la quale deve essere dedicata alla sosta dei veicoli una superficie del lotto pari ad una percentuale minima della superficie (o del volume) edificato. Idem in fase di ristrutturazion con la possibilità di monetizzare tali superfici qualora non sia possibile ricavarl fondi destinati alla creazione di parcheggi pubblici. Se nelle nostre periferie avessero seguito le norm il problema del parcheggio privato sarebbe limitato ai soli centri storici.',Ma la norma è riferita solo ai luoghi pubblici ( supermercati discoteche ecc. ) o anche ai condomini ? ,,,,,,,,,,,,,,
Acquisto nuova Captur diesel. Bene o male?,https://forum.quattroruote.it/threads/acquisto-nuova-captur-diesel-bene-o-male.118928/,2018-10-16 00:00:00,NEWsuper5,'Voi cosa consigliate di fare??',Inizia con il verificare se le auto a servizio di persone disabili devono sottostare ai blocchi alla circolazione nella tua zona. Di divieto alle auto diesel si è parlato ma non so se siano già previste leggi o norme regionali. ,,,,,,,,,,,,,,
Idea: Concessionari convezionati,https://www.bmwpassion.com/forum/threads/idea-concessionari-convezionati.104512/,2008-04-26 00:00:00,sidella,,"Ciao visto che qui molta gente chiede info per concessionari migliori prezzi per tagliandi ecc ecc ecc.Mi è venuta un'ideona: possiamo convenzionarci con i meccanici.In poche parole mettiamo caso che ci siano 100 proprietari di BMW di Milano che vanno a 30/40 meccanici diversi per circa 5 interventi all'anno con preventivi/tempi/pezzi diversi magari per le stesse attività.Si potrebbe concentrarsi su 5/10 meccanici e stipulare con loro un accordo verbale o scritto che tutti i 100 proprietari se hanno bisogno di qualsiasi intervento di andare da loro e in cambio avere un prezzo minore e tempi diversi.Ogni anno si potrebbe andare dal meccanico che offre più garanzie.Magari se si fa una tessera o qualcosa del genere in modo che altre persone non si spacciano per questo sito.Secondo il mio punto di vista ci sarebbero molti vantaggi perchè noi risparmiamo invece i meccanici sanno che hanno un parco auto sicuro.Si stimola il mercato tra di loro perchè se un meccanico non offre garanzie si va da un altro e lui perde tot € all'anno per varie mansioni: tagliando controlli vari pezzi ecc.Se invece ognuno si presenta singolarmente il meccanico lo vede come uno qualsiasi insomma se viene da me bene altrimenti ci sarà un altro.Diciamo che sarebbe come se fosse un ""gruppo d'acquisto"" ma invece di comprare qualcosa chiediamo servizi migliori e a minore prezzo.Spero di essermi spiegato Ve gusta l'idea ? ",,,,,,,,,,,,,,
La percorrenza delle nostre MAZDA: Aggiornamento in progress,https://forum.quattroruote.it/threads/la-percorrenza-delle-nostre-mazda-aggiornamento-in-progress.109730/page-3,2018-02-13 00:00:00,elancia75,"""Io sulla mia ho fatto ormai 12 tagliandi ogni 30k a parte il salass non ho ancora problemi relativi all'olio. Dipende anche dall'olio che si usa.""",Certamente. ,,,,,,,,,,,,,,
Renault Captur 2013,https://www.autopareri.com/forums/topic/53994-renault-captur-2013?&page=118#comments,2013-11-19 18:35:12,aci851,,Ma lo start stop come funziona ? È regolabile la soglia della velocita alla quale la macchina si spegne quando metto a folle e tolgo la frizione ? Ad es mi pare che la 2008 si spenga già a 15 km/h ,,,,,,,,,,,,,,
Subaru Impreza 2017,https://www.autopareri.com/forums/topic/60888-subaru-impreza-2017?&page=3#comments,2016-03-25 08:28:20,Pandino,,Gli indicatori di direzione sembrano non centrare nulla col resto della fanaleria ,,,,,,,,,,,,,,
ORDINATA!!,https://www.autopareri.com/forums/topic/4063-ordinata?&page=4#comments,2004-01-13 16:12:24,Touareg,,la prendo bianca cosi' ecco gli interni credo sia nera la pelle.. ,,,,,,,,,,,,,,
Aiutatemi a capire.. C-max 1.000 99cv,https://forum.quattroruote.it/threads/aiutatemi-a-capire-c-max-1-000-99cv.113412/,2017-11-22 00:00:00,NEWsuper5,'Faccio notare per esempio che ci sono un bel pò di Giulietta 4 da 170cv con oltre 150k chilometri che vanno benissimo....o i Tiguan 4 ecc...',La C-Max con il motore mille 3 cilindri Ecoboost è in vendita da 5 anni. Eventuali problemi gravi sarebbero già venuti fuori da tempo. ,,,,,,,,,,,,,,
problema bronzine 1.5 dci risolto?,https://forum.quattroruote.it/threads/problema-bronzine-1-5-dci-risolto.94546/,2015-03-03 00:00:00,manuel46,'Spero quindi che sia come ha detto Andrew...se qualcun altro può dirmi qualcosa a riguardo si faccia avanti ',E' giusto quello che ha detto Andrew.... ,,,,,,,,,,,,,,
Mitsubishi ASX (Topic Ufficiale - 2009),https://www.autopareri.com/forums/topic/36140-mitsubishi-asx-topic-ufficiale-2009?&page=20#comments,2010-08-23 09:25:07,VW-Jag,,"Una volta caricata la foto su imageshack devi prendere il link alla voce ""collegamento diretto"". Ecco un esempio: http://img412.imageshack.us/img412/7584/8b31e6d4.jpg ",,,,,,,,,,,,,,
mercedes a180d vs bmw 1 series vs a3 sportback,https://forum.quattroruote.it/threads/mercedes-a180d-vs-bmw-1-series-vs-a3-sportback.122295/page-4,2019-04-24 00:00:00,whosmanu,"'I primi (205/55/17"") non darebbero problemi (ma i pneumatici di ricambio sono più costosi dei 205/5516"" i secondi (225/45/17"") personalmente li sconsiglio per fondi dissestati. Tra l'altr sempre per i fondi dissestati sconsiglio gli assetti sportivi. Pensa che un paio di mesi f quando per un breve momento ho valutato anche la A3SB 1.5 Tfsi tra i possibili acquist avevo fatto inserire nel preventivo l'assetto rialzato (+15 mm) mantenendo i cerchi da 205/55/16 proprio perché anche io ho qualche problemino di fondo stradale.'",beh quindi finché non si supera i 17” e non si ha un assetto sportivo non si va in qualche modo ad intaccare la guida e le sospensioni della macchina anche in strade dissestate giusto ? ,,,,,,,,,,,,,,
Serie 5....tornera' ad essere bella da guidare come sa essere questa??,https://forum.quattroruote.it/threads/serie-5-tornera-ad-essere-bella-da-guidare-come-sa-essere-questa.120153/page-5,2019-01-09 00:00:00,Barack,'Oltre alle considerazioni di cui sopr penso che incidano le logiche software improntate ai bassi consum che tendono a tenere le marce più lunghe possibili (però in rilascio entra la funzione cut-of e quindi a consumo zero ... boh)',Aggiungo come nelle discese di montagna che ho visto auto specie SUV con i freni premuti per tutta la discesa non voglio sapere quanto durano le pastiglie. ,,,,,,,,,,,,,,
Cercasi consigli per il RING,http://www.porschemania.it/discus/messages/815/790155.html?1494498726,2017-05-10 12:18:00,gunball,Per pernottare avete consigl meglio prenotare da casa o si trova senza problemi? Si gira col casco o si puo' fare senza? ,Eccomi... ti consiglio di prenotare soprattutto se arrivi la sera. Io ho dormito e noleggiato da Paolo Costantini: italianissimo gentilissimo e convenzionato con PiMania ha 3/4 camere. https://www.ring-speed-motorsport.com/italiano/ Il casco non \xe8 obbligatorio ma io non ci girerei senza.,,,,,,,,,,,,,,
Nuova Audi TT 2.0TFSI coupè / roadster,https://www.bmwpassion.com/forum/threads/nuova-audi-tt-2-0tfsi-coup%C3%A8-roadster.48250/page-2,,brown81,'...Magari ci piazzano il 2.0TDI biturbo da 204 c non sarebbe male',sarebbe la quadratura del cerchio.... cmq il diesel sul TT dovrebbe arrivare per fine anno.... quindi a breve dovrebbe sapersi qualcosa ,,,,,,,,,,,,,,
BMW X4 2014,https://www.autopareri.com/forums/topic/54579-bmw-x4-2014?&page=10#comments,2015-01-25 16:41:05,Cosimo,,infatti quindi le rate cominciano a diventare meno convenienti. Per un x4 2.0d mediamente accessoriato ( niente di che nemmeno la pelle ) l’equivalente bmw del NLT ti chiede poco meno di 1000 euri al mese. Visto il preventivo ,,,,,,,,,,,,,,
Ma Ghidella era così bravo?,https://www.autopareri.com/forums/topic/13011-ma-ghidella-era-cos%C3%AC-bravo?&page=3#comments,2010-09-11 16:51:08,albe101,,All'epoca di pensava ad un poli di lusso costituito da Alfa-Lancia e Saab. Solo che Saab andò sotto GM e i dirigenti fiat ( si parla di fine anni 80 quindi credo ancora gestione ghidella ) non investirono più nel progetto ma anzi pensarono di condividere i pianali e venne fuori 155/dedra/tempra etc... Ghidella spingeva per creare una piattaforma che potesse essere usata da più modelli ( che idee all'avanguardia eh... ) . Solo che nn aveva considerato l'aspetto tecnico. Ossia una 155 con meccanica tempra non fece furore...E pensare che per recuperare credibilità ( parlo della 155 ) l'aggiornarono un'infinità di volte circa 30 ? ? . ,,,,,,,,,,,,,,
Terribile dilemma,http://www.porschemania.it/discus/messages/502416/303360.html?1193059772,2007-10-11 16:11:00,c911,,simone m ( simo911 ) x il tuo commento NO COMMENT ! ! ,,,,,,,,,,,,,,
Caro Tagliando ...ma quanto mi costi,https://www.bmwpassion.com/forum/threads/caro-tagliando-ma-quanto-mi-costi.35375/,2004-12-26 00:00:00,resunoiz,,"Ho appena ritirato la mia BMW ( 330 xd touring ) dal secondo tagliando ispettivo degli 80.000 Km.Sono rimasto di gesso .Ho speso 1.010 euro ( ho ottenuto uno sconto del 10 % forse sono rimasti sorpresi dal mio momentaneo smarrimento ) .Rispetto a quanto mi avevano indicato 500-600 ( comprensivo del cambio delle cinghie ) euro ho speso quasi il doppio.La sintesi del lavoro è la seguente comprensiva anche di manodopera:- cambio filtri / liquidi /olii ( 340 € + iva ) - cambio pastiglie dei freni ant ( 135 € + iva ) - cambio pastiglie dei freni pos ( 140 € + iva ) - le cinghie ( 83 € + iva ) - pulizia radiatore acqua ( ? ? ) ( 60 € + iva ) - sost. mascherina -griglia di plastica anteriore persa ( 40 € ) - spazzola lunotto ( 20 € + iva ) - liquido cleaner x diesel ( 14 € +iva ) - prova su strada ( 17 € + iva ) Ma anche altri hanno speso indicativamente queste cifre ? Visto che la mia BMW è fuori garanzia volevo sapere se qualcuno aveva trovato una officina non di ""marca"" ( BOLOGNA ) con soddisfazioni per trattamento e competenze....GrazieJader ",,,,,,,,,,,,,,
Alfa Romeo Giulia Quadrifoglio 2016,https://www.autopareri.com/forums/topic/58587-alfa-romeo-giulia-quadrifoglio-2016?&page=874#comments,2016-04-21 09:29:31,Walker,,Vuoi vedere che allora le coppe ruota... ,,,,,,,,,,,,,,
Incendio Dacia Sandero Stepway 1.6 gpl,https://forum.quattroruote.it/threads/incendio-dacia-sandero-stepway-1-6-gpl.63398/,2012-03-22 00:00:00,fabiologgia,'Volevo segnalare il comportamento scandaloso della Renault susseguente a quello che mi è capitato. Riepilogando. Ho acquistato una Dacia Sandero Stepway 1.6 gpl agli inizi del 2011 dopo vari ritardi da parte del concessionari l?auto viene immatricolata il 2/12/2011 e ritirata dal sottoscritto il 10/12/2011. Dopo soli 8 giorn il 18/12/201 il veicolo viene danneggiato in modo irreparabile da un incendio ch durante la marci si sviluppa all?interno del cofano motore sul lato destro in corrispondenza del passegger e che poi interessa anche le parti esterne del veicolo stesso. Considerando che l?auto è stata anche (e per fortun aggiungerei) assicurata contro incendio e furt invio subito la segnalazione dell?accaduto alla Renault ed all?assicurazione. Quest?ultima avvia subito la pratica per il rimborso del dann interpellando lei stessa la Renault per accertarsi sulle responsabilità dell?accaduto. E veniamo alla Renault. Dalla data dell?incendi ormai quindi da tre mes la casa francese ha inviato solo e-mail per richiedere documentazione dell?episodio e quando ho provato a ricontattarli per avere chiarimenti ho avuto a che fare solo con gli operatori del call-center che poco sapevano della questione. In sostanza la Renault non si è sentita in dovere di contattarmi né per cercare di spiegare cosa possa essere successo quel giorno nè quanto meno per sincerarsi sull?incolumità dei passeggeri presenti. E infine qualche giorno fa hanno mandato (quella che per loro è) una e-mail conclusiva con la quale riversano tutto sulla compagnia assicuratrice alla quale dovrei chiedere il risarcimento del dann senza tener conto della perdita di denaro che subirei e senza soprattutto prendere in considerazione la garanzia di copertura e la sostituzione diretta del mezzo. Mi conviene adire le vie giudiziarie contro la Renault per mancato rispetto delle garanzie legali e richiedere anche i danni che ho subito? Gradirei qualche consiglio in merito. Grazie.',La tua auto è andata a fuoco dopo pochissimi giorni quindi è decisamente probabile che la causa di ciò sia un difetto dell'auto ed in questo caso ne deve rispondere per forza chi te l'ha venduta. Sicuramente ti conviene minacciare le vie legali e se non ottieni soddisfazione adirle senza indugio. Ovviamente ciò vale se tu hai ordinato l'auto già con l'impianto GPL montato in fabbrica e NON se l'impianto è stato montato after-market anche se prima dell'immatricolazione e della consegna. In quest'ultimo caso bisognerebbe anche cercare eventuali difetti di installazione dell'impianto a GPL per addebitarli all'installatore ( non ne sarebbe responsabile Renault ) . Saluti ,,,,,,,,,,,,,,
Porsche 911 Carrera e Carrera S 2012,https://www.autopareri.com/forums/topic/44205-porsche-911-carrera-e-carrera-s-2012?&page=4#comments,2011-08-19 10:25:07,nicogiraldi,,"attenzione ad un particolare le proporzioni. Io ho avuto la fortuna di vederla dal vivo e vi assicuro che rispetto ad una 997 cambia vermaente tanto anche come ""percezione"". Parlo di passo/larghezza ( data anche dall'altezza forse ribassata del profilo tetto ) soprattuto. ",,,,,,,,,,,,,,
Preordini Volkswagen ID a partire da 8 Maggio 2019,https://www.forumelettrico.it/forum/preordini-volkswagen-id-a-partire-da-8-maggio-2019-t5050-40.html?sid=2eee683ecf849a39d8056e7cf69646d6&sid=2eee683ecf849a39d8056e7cf69646d6,2019-05-12 11:47:00,marcober,,"ma alla fine..sti preordini..li hanno raccolti ? la M3 aveva fatto il ""pieno"" in poche ore..qui non si dice nulla ? aria di flop ? ",,,,,,,,,,,,,,
honda civic 1.6 i dtec e jazz 1.5 i vtec,https://forum.quattroruote.it/threads/honda-civic-1-6-i-dtec-e-jazz-1-5-i-vtec.114558/page-2,2018-01-29 00:00:00,rosmarc,,... andati per Honda ! ,,,,,,,,,,,,,,
Renault Clio III Facelift (Topic Ufficiale - 2008),https://www.autopareri.com/forums/topic/32353-renault-clio-iii-facelift-topic-ufficiale-2008?&page=24#comments,2009-09-22 16:52:02,spadino29,,E' vero hai ragione ci sono 300€ di troppo.. ,,,,,,,,,,,,,,
Chiusura Lancia nel mercato europeo (tranne Italia),https://www.autopareri.com/forums/topic/63136-chiusura-lancia-nel-mercato-europeo-tranne-italia?&page=30#comments,2017-05-18 18:24:52,vince-991,,Negli USA ho visto una Audi con i buchi fatti dalla ruggine passante fin sotto il finestrino. Non sto esagerando. Li in Ohio usano enormi quantità di sale per tenere le strade libere dal ghiaccio in inverno ,,,,,,,,,,,,,,
Fiat Panda 2011,https://www.autopareri.com/forums/topic/44317-fiat-panda-2011?&page=186#comments,2015-05-07 21:03:42,Touareg 2.5,,Il listino su fiatpress è ancora fermo al 13 di Gennaio e nel sito non è ancora presente. Circa la prenotazione invece non so dirti. ,,,,,,,,,,,,,,
Resistenza termica nelle gomme. Cosa ne pensate?,https://www.autopareri.com/forums/topic/6046-resistenza-termica-nelle-gomme-cosa-ne-pensate?&page=7#comments,2005-07-12 02:35:03,barbablu,,x curiosità posso chiederti quanti anni hai ? ,,,,,,,,,,,,,,
997 gt3,https://www.bmwpassion.com/forum/threads/997-gt3.32944/,2005-11-11 00:00:00,996GT3,'ormai devi cambiare in nik... sei indietro... ',http://www.youtube.com/watch ? v=_qd5fAfpubQa parte il video..ma quanto sesso fa 'sta macchina ? ? ? ? ! ! ! ! la piu'bella 997 ,,,,,,,,,,,,,,
Un saluto (amaro) a tutti,https://forum.quattroruote.it/threads/un-saluto-amaro-a-tutti.121309/page-3,2019-02-20 00:00:00,bumper morgan,"'e wessis....alla fine la scusa è sempre una questione di ""bussola""...'",La bussola non è una scusa è realtà.......cmq stiano lí e vengano qui solo a fare le ferie. E basta. Meglio poveri ma liberi ,,,,,,,,,,,,,,
2016 baleno,https://forum.quattroruote.it/threads/2016-baleno.100283/page-5,2016-08-24 00:00:00,giuliox13,,mi sa che non hai speranze... è un problema di tutte già fatto notare dalle recensioni... ,,,,,,,,,,,,,,
Contento del Rav4 hybrid...però...,https://forum.quattroruote.it/threads/contento-del-rav4-hybrid-per%C3%B2.115193/,2018-03-01 00:00:00,paulein118,,io lo attivo solo dentro ai trafori quindi non ho esperienza di questo tipo. La fortuna di non percorrere urbano ,,,,,,,,,,,,,,
Mondiale F.1 - GP del Brasile 2018,https://forum.quattroruote.it/threads/mondiale-f-1-gp-del-brasile-2018.119252/page-9,2018-11-12 00:00:00,danilorse,'Si può essere ma non era competitiva come la Red Bull la ferrai secondo me. Leggevo dello scarico altro che perdita d’ olio sulle parti calde era proprio fallato.',Sicuramente ieri la Red Bull era la macchina piu' forte con la miglior messa a punto ( Verstappen mi pare abbia fatto 36giri con le supersoft della qualifica ) e la miglior strategia gomme a differenza di quanto si era pensato sabato. Raikkonen per contro ha avuto una gara regolare senza problemi a parte il fatto che la scelta Soft e Medie non si e' rilevata la migliore mentre Vettel ha avuto un problema ad un non meglio identificato sensore del differenziale che ha compromesso in parte l'equilibrio della sua vettura. ,,,,,,,,,,,,,,
Fiat 5oo Circle Club: l'utilitaria per milionari,https://www.bmwpassion.com/forum/threads/fiat-5oo-circle-club-lutilitaria-per-milionari.56013/,2007-03-05 00:00:00,zeus70,,FIAT 5oo Circle Club utilitaria per milionariLei è bella agile e preziosa ha rivestimenti in pelle e verniciatura in verde british ha solo un difetto: bisogna essere sufficientemente ricchi per averla.E’ la nuova e lussuosissima Fiat 500 Circle Club presentata oggi a Milano e strettamente rivolta ai 170 soci di un esclusivo club per milionari il Circle Club un gruppo italiano che fornisce ai suoi membri beni di lusso per un periodo di tempo limitato. «Abbiamo scelto proprio la Fiat 500» - spiega il presidente del club Riccardo Schmid - «perché rappresenta la storia dell’Italia degli ultimi cinquant’anni e perché e un’automobile giovane divertente e di tendenza». Il costo dell’automobile è di 30 mila euro quasi il triplo del valore di mercato e i modelli disponibili sono una trentina. Rivolto a uomini dell’alta finanza a top manager politici e sportivi il circolo dei milionari è nato tre anni fa e per entrarvi è prevista una quota di iscrizione annuale di 20mila euro. Pagando l’iscrizione i soci ricevono una card da 1000 punti con la quale possono affittare per un periodo limitato di tempo automobili aerei barche elicotteri. ,,,,,,,,,,,,,,
Così Audi tratta i propri clienti!,https://forum.quattroruote.it/threads/cos%C3%AC-audi-tratta-i-propri-clienti.115969/,2018-04-13 00:00:00,drusus,"""Nuovo o lavato con perlana 12.000 per un motore non si possono sentire. L'auto ha sei anni e 100.000 k e il motore ha un cilindro che non v non è esploso. La sostituzione del motore dev'essere un'operazione conveniente in relazione sia al costo necessario per ripristinare il motore vecchio che all'età e valore dell'auto. In questo caso IMHO né il prezzo pieno né quello scontato appaiono congru e doveva essere per prima l'officina (a maggior ragione se il guasto è imputabile a un problema congenito del progetto) a proporre un motore di rotazione se il loro è così caro.""",Corretto ragionamento che ti può fare ripeto un meccanico generico. Una concessionaria per di più krukka e con tanto di anelli non lo farà mai potessero spremerebbero sangue anche da una pietra.. ,,,,,,,,,,,,,,
Cosa comprare con circa 30000 euro,https://www.bmwpassion.com/forum/threads/cosa-comprare-con-circa-30000-euro.18237/page-2,2003-05-23 00:00:00,El Nino,'riguardo alla A sarà meglio rifinit ma IMHO dentro è troppo vecchia come disegno di plancia/cruscotto... preferisc x quanto più giocattolos di gran lungo la serie1 ',x un 320cd ci vogliono troppi soldi con i giusti accessori ( si parla di 40000 euro ) e poi sta ormai uscendo dai listini avessi avuto un budget più alto avrei aspettato x il nuovo coupé ma non posso e di prenderla nuda e cruda non se ne parla ,,,,,,,,,,,,,,
cento milioni (lira più lira meno),https://forum.quattroruote.it/threads/cento-milioni-lira-pi%C3%B9-lira-meno.67135/,2012-07-09 00:00:00,zero c.,Che ne pensate? http://www.quattroruote.it/notizie/auto-novita/jeep-grand-cherokee-limited-tech-speciale-in-esclusiva-per-l-italia?comeFrom=forum_QRT... avevi mai visto una jeep con motore VM?? 'Che ne pensate? http://www.quattroruote.it/notizie/auto-novita/jeep-grand-cherokee-limited-tech-speciale-in-esclusiva-per-l-italia?comeFrom=forum_QRT',coi diesel Vm mecedes renò ? certo che sì... vedrai poi il wagoner col milletre multiget che favola ,,,,,,,,,,,,,,
Chi sono? Mi presento,https://forum.quattroruote.it/threads/chi-sono-mi-presento.13/page-28,2010-07-04 00:00:00,mode64,,Salve ancora a tutti. Solo per segnalare che ho rifatto l'iscrizione al Club e al Forum per utilizzare quello che era il mio nickname nel Forum precedente. ,,,,,,,,,,,,,,
Resoconto  Outback 2.0 my 2017 dopo 3500 km.,https://forum.quattroruote.it/threads/resoconto-outback-2-0-my-2017-dopo-3500-km.112280/page-3,2017-10-06 00:00:00,pi_greco,'Bracco e Scoffera sono tosti Tomarlo... Cirone...',passo della scoglina... ,,,,,,,,,,,,,,
un salto in altri forum: che nostalgia,https://www.autopareri.com/forums/topic/15173-un-salto-in-altri-forum-che-nostalgia?&page=2#comments,2005-09-05 20:26:33,Net Flier,,"chiti ruppe con l'alfa romeo durante il periodo nero delle ultime f1 anni 80..da li venne ""assunto"" dalla subaru per creare un nuovo motore.. ",,,,,,,,,,,,,,
Mondiale F.1 - GP di Ungheria,https://forum.quattroruote.it/threads/mondiale-f-1-gp-di-ungheria.117609/page-15,2018-07-30 00:00:00,A-80,'Girava molto più veloce degli avversari. La Mercedes non era cosi lenta. Poi forse Vettel ha preso un po di paura per i troppi errori e non osa tanto.',Si l ho detta in modo scherzoso . Ma ricciardo i sorpassi li sa fare comunque ,,,,,,,,,,,,,,
Importazione auto dalla russia,https://www.bmwpassion.com/forum/threads/importazione-auto-dalla-russia.39619/,2007-02-19 00:00:00,luigi83,,Qualcuno sa per caso come si procede per importare un'auto dalla russia ? Supponiamo che uno sia interessato alla Toyota Camry venduta in USA e in europa solamente in Russia come deve procedere ? Altra cosa: Perchè nel sito Toyota russia ci sono i prezzi in $ ? http://www.toyota.ru/cars/new_cars/camry/pricelist.asp ,,,,,,,,,,,,,,
toyota yaris ibrida,https://forum.quattroruote.it/threads/toyota-yaris-ibrida.121040/,2019-02-08 00:00:00,gsgroit@yahoo.it,,X il discorso km ? ,,,,,,,,,,,,,,
