Titolo,URL,Timestamp,User,(Testo Citato),TESTO,Costruttore,Modello,Brand,Interni,Esterni,Meccanica,Prestazioni,Consumi/Autonomia,Motore,Elettrico,Fuoristrada,Elettronica di Bordo,Manutenzione,Assistenza/Concessionari
[USA] Jeep Commander (Foto Ufficiali),https://www.autopareri.com/forums/topic/28674-usa-jeep-commander-foto-ufficiali,2005-03-28 14:07:10,Granturismo,,che brutta ! ( foto presa da C&amp D a NY ) ,,,,,,,,,,,,,,
le foto delle nostre Alfa,https://forum.quattroruote.it/threads/le-foto-delle-nostre-alfa.11173/page-7,2010-07-21 00:00:00,autofede2009,,il rosso giulietta proprio non mi piace... è quasi un arancio/corallo... secondo me non era granchè neanche sulla vecchia... questo è invece bello... il rosso 8c immagino costi di più... ,,,,,,,,,,,,,,
TAGLIANDI: il topic definitivo contro i furbetti del quartierino....,https://forum.quattroruote.it/threads/tagliandi-il-topic-definitivo-contro-i-furbetti-del-quartierino.21301/page-7,2010-09-27 00:00:00,miche72,,grazie mille ad entrambi o entrampi o endrambi o fa lo stesso tanto si capisce che sto ringraziando voi ,,,,,,,,,,,,,,
Renault Laguna (Topic Ufficiale - 2007),https://www.autopareri.com/forums/topic/19338-renault-laguna-topic-ufficiale-2007?&page=60#comments,2008-01-06 19:08:34,nucarote,,L'ho vista esposta a dicembre insieme alla Clio SW non male la fiancata ( ma comunqune inferiore alla Laguna II ) da prendere rigorosamente nera o grigio scura. PS. La Renò gli interni belli li ha sempre fatti. ,,,,,,,,,,,,,,
Alfa Romeo 8C Spider (Topic Ufficiale - 2007),https://www.autopareri.com/forums/topic/22899-alfa-romeo-8c-spider-topic-ufficiale-2007?&page=50#comments,2008-11-25 16:31:11,Sonata_Arctica,,Ma... non sono dei ladrocini allucinanti quei prezzi ? ,,,,,,,,,,,,,,
Tagliandi M3 Zona Verona/Mantova,https://www.bmwpassion.com/forum/threads/tagliandi-m3-zona-verona-mantova.17972/,,Paky,'mmmmm... io la mia non la daro mai piu in mano a nessuno dei tre...pensa che per cambiarmi il gallegiante benza han tirato giu il retrotreno..(che non serve) e mel han rimontato con la post dx fuori convergenza di mezzo cm...',Secondo voi quale concessionario mi consigliate per i tagliandi M3 tra Fimauto Verona Motors e Tullo Pezzo ? Prezzi preparazione serieta'.... E' la prima volta che ho BMW quindi aspetto vostri consigli ed esperienze. Ciao a tutti. Alessandro ,,,,,,,,,,,,,,
E intanto Lexus se la dorme...,https://forum.quattroruote.it/threads/e-intanto-lexus-se-la-dorme.38494/,2010-10-07 00:00:00,sov,,certo che il diesel va bene per far numeri di vendita vista la mentalità del cliente medio ma... provenendo da un diesel ( come il sottoscritto ) e arrivando all'ibrido lexus io ho trovato la stessa differenza che c'è tra un trattore agricolo e una barca a vela per di più ( io vivo in montagna ) con un suv da 22 quintali diesel qui da noi si fanno circa 7 5 km/l mentre con un suv ibrido ( nella fattispecie l'rx ) faccio tranquillamente gli 11 km/l e in più vuoi mettere il lusso del silenzio ? ? ? ,,,,,,,,,,,,,,
Addio Outback BD...,https://forum.quattroruote.it/threads/addio-outback-bd.113925/,2017-12-22 00:00:00,Wolfox79,,Subaru deve concentrarsi sull'Ibrido e mozzi pneumatici per disconnettere completamente le 4 ruote motrici ( solo 2wd ) consumi miglioreranno e i clienti arriveranno. Pure le Lexus Ibride hanno prestazioni Ridicoli ma consumi eccezionali e per questo vendono ancora bene ma ad una clientela ristretta perché vetture di lusso. ,,,,,,,,,,,,,,
Qashqai 1.5 dci 2007 fusa bronzina 87000km,https://forum.quattroruote.it/threads/qashqai-1-5-dci-2007-fusa-bronzina-87000km.30366/page-2,2010-09-12 00:00:00,gino0803,,Vi segnalo questo link di facebook dove potete lasciare i vostri commenti sui mtori fusi dei qq a causa delle bronzine: http://www.facebook.com/home.php ? # ! /search/ ? flt=1&q=Nissan%20Qashqai%20se%20lo%20conosci%20lo%20eviti&o=65 oppure effettuare la ricerca con le seguenti parole chiave: Nissan Qashqai se lo conosci lo eviti ,,,,,,,,,,,,,,
Estensione garanzia Honda...conviene?!?,https://forum.quattroruote.it/threads/estensione-garanzia-honda-conviene.26850/page-2,2012-09-04 00:00:00,totonnino,"Allora io l'ho avuta nelle ultime tre aut Accord compresa. ...... Sai dirmi se la stipula della copertura è con Honda o con Europe Assistance? ""Allora io l'ho avuta nelle ultime tre aut Accord compresa. ...""",Non ho la macchina con me posso provare a vedere cosa c'è scritto. Ma credo che sia con Honda come dal link che ho allegato prima. Solo che vale se sono stati rispettati gli intervalli di manutenzione ( ovviamente ) e se fatta entro i primi due anni è trasmissibile ai nuovi acquirenti dell'auto se fatta durante il terzo anno è legata al proprietario dell'auto. Ma questo lo puoi leggere nel link. Inoltre puoi sentire il n.ro verde se ti da spiegazioni o il tuo concessionario che poi ti seguirebbe in garanzia ( e loro giocano molto sul fatto di aiutarti o respingere le tue richieste ) . Ciao ,,,,,,,,,,,,,,
Autoradio Jeep Compass 2011,https://forum.quattroruote.it/threads/autoradio-jeep-compass-2011.58277/page-5,2014-12-06 00:00:00,abimar,,ciao a tutti ...possiedo una jeep compass 2012... e ho avuto a 40.000 km il primo problema alla pompa dell'acqua... adesso 43.000 km autoradio con navigatore... dalla sera al mattino ..praticamente morto... cosa ne dite... portata dal tecnico... fusibili ok tutto ok.. ma non si accende più... vorrei sapere vostre notizie ... grazie ciao a tutti ,,,,,,,,,,,,,,
2016 baleno,https://forum.quattroruote.it/threads/2016-baleno.100283/page-18,2018-05-18 00:00:00,MORFEO 74,"""Sono in procinto di acquistare la baleno allestimento top... Sono solo indeciso tra la versione a benzina o ibrida. Il costo di circa 600 euro per sostituire la batteria ogni circa 5 anni non è poco. Tuttavia mi hanno detto che posso anche poi non sostituirla e l'auto continua a benzina. Voi cosa ne pensate? Mio utilizzo circa 11.000 km all'anno e 50% urbano 40 %extraurbano 10 %autostrada""",Visto i km percorsi da te senza dubbio quella non ibrida. Ora la batteria costa 600 euro ma tra 4/5 anni è molto probabile che costerà di più. Anche perché di solito i prezzi dei ricambi col passare degli anni aumentano e non diminuiscono. Con la non ibrida ti tieni in tasca mille euro. Poi vedi tu. ,,,,,,,,,,,,,,
SUV 7 posti,https://forum.quattroruote.it/threads/suv-7-posti.106223/,2016-09-22 00:00:00,pi_greco,,L'erede della tricheca... ,,,,,,,,,,,,,,
Nuova Audi Q7 - i miei primi 10.000 km,https://forum.quattroruote.it/threads/nuova-audi-q7-i-miei-primi-10-000-km.113371/,2018-01-23 00:00:00,Pete72,"""Cia scusa la risposta in ritardo. Ti dico la mia: sul motore sinceramente non so se siano indispensabili i 272 c io l'ho scelto essenzialmente perché non volevo la trazione Ultra ma la vera Quattro.""",Ho parlato con lo concessionaria Vicentini di Verona mi è stato detto che per quanto riguarda Q7 la trazione Quattro montato sul 218 e sul 272 è assolutamente la stessa la denominazione Ultra è riferita al motore - al downgrade di potenza e agli affinamenti apportati per abbassare consumi ed emissioni - ma non alla trazione Quattro come invece in altri modelli del gruppo. Insomma dovrebbe essere la vera Quattro con differenziale autobloccante e ripartizione 60 posteriore e 40 anteriore la stesso che ho avuto su A6 fino a due anni fa. Per fortuna. ,,,,,,,,,,,,,,
Colonnine EVAD Fast Enel Smart Grid Lab Milano MI Via Raffaele Rubattino 84,https://www.forumelettrico.it/forum/colonnine-fast-ac-sede-enel-milano-est-via-rubattino-56-t4354-10.html?sid=2864069072e084c62bf4f4897e2cf55d&sid=2864069072e084c62bf4f4897e2cf55d,2019-05-09 21:30:00,selidori,,Cercando altro ho trovato foto di INTERNI della Enel Smart Grid Lab ! https://www.google.com/maps/uv ? hl=it&pb ... TBVtqe_na#Spaziale ! ,,,,,,,,,,,,,,
Brera vs Cayman e...,https://www.autopareri.com/forums/topic/13928-brera-vs-cayman-e,2005-07-01 09:01:20,TonyH,,Mi spiace per Brera...ma a Cayman il motore centrale dà una marcia in più in termini di piacere e efficacia di guida... ,,,,,,,,,,,,,,
Nuova Impreza,https://forum.quattroruote.it/threads/nuova-impreza.105872/page-3,2016-12-30 00:00:00,SUBmARine U-14,,http://www.subaru-global.com/models/impreza5/index.html ,,,,,,,,,,,,,,
Nuova bimba Mk1,http://www.porschemania.it/discus/messages/502416/503833.html?1274460672,2010-04-19 09:28:00,cosmi,,E allora lo tieni 'sto terminale in acciaio ? Mettiti in contatto che ti mando mia moglie a prenderlo... nel senso che abita a Pd e passerebbe lei... riccardomec70 at yahoo.it,,,,,,,,,,,,,,
GT3,http://www.porschemania.it/discus/messages/492693/385442.html?1212066008,2008-05-27 12:04:00,doctor_knife,,Complimenti piacerebbe anche a me cambiare la mia con un GT3 in allestimento Club Sport ma ho il problema della rampa dei box .Leggo che tocchi ovunque. C'e' qualcuno che puo' darmi gli angoli d'attacco ( credo che si definiscono cosi' ) sull'anteriore e posteriore del GT3 ? Non vorrei ritrovarmi a non poter piu' usare il box sotto casa. grazie,,,,,,,,,,,,,,
Lancia Ypsilon II Facelift (Topic Ufficiale - 2007),https://www.autopareri.com/forums/topic/26465-lancia-ypsilon-ii-facelift-topic-ufficiale-2007?&page=14#comments,2011-10-07 11:45:56,Alain,,1.2 69 cv ,,,,,,,,,,,,,,
C3: raccolta problemi e difetti,https://www.autopareri.com/forums/topic/25848-c3-raccolta-problemi-e-difetti,2007-09-24 00:11:21,Navarre75,,Nessuno ne sa nulla davvero ? ,,,,,,,,,,,,,,
Aiuto...mi hanno.rubato.la Skoda Octavia sw G-tec.,https://forum.quattroruote.it/threads/aiuto-mi-hanno-rubato-la-skoda-octavia-sw-g-tec.121581/page-6,2019-03-16 00:00:00,ienetta.72@gmail.com,,Sicuramente è una questione di priorità come hai detto tu ma chi subisce il furto si sente frustrato e arrabbiato. Come se non bastasse ci si mette pure l' assicurazione che pare voglia ridare solo la stima di quattroruote ( 14.500 ) meno il 30 % . Alla fine una macchina pagata a Luglio 21.000 viene risarcita per meno della metà ...furto nel furto.. ,,,,,,,,,,,,,,
Salvatela o vendetela,https://forum.quattroruote.it/threads/salvatela-o-vendetela.119957/page-8,2018-12-30 00:00:00,arizona77,'Appunt se non cerano di Mezzo 30 anni di Vuoto l America avrebbe dato sicuramente l onere che merita. Le 10600 Giulia vendute in america in 11 mesi valcono almeno 50000 in Itali ma come si puo vedere gli italiani evadano...chiedendo continuitá e modell .Certo giusto piu modell per morire prima e pochi modelli per morire lo stesso! Sempre per lo stesso motivo si muore.....',Con 177 concessionarie anche dopo 30 anni di oblio si doveva fare di piu'. Della prima vali il 3% ,,,,,,,,,,,,,,
Povera Cayenne...Quanti pregiudizi...Che amarezza.,http://www.porschemania.it/discus/messages/22971/495210.html?1308841919,2010-02-11 23:22:00,caymax,,Ma chi e' sto opinionista ? del c...o. ! ,,,,,,,,,,,,,,
la batcaverna 635csi &co,https://www.bmwpassion.com/forum/threads/la-batcaverna-635csi-co.85405/page-77,2004-03-25 00:00:00,batmobile,'scusa non ho capito che macchina e motore è? thanks:wink:',io son sempre qui incantato a leggervi... ,,,,,,,,,,,,,,
Opel ADAM 2012,https://www.autopareri.com/forums/topic/47966-opel-adam-2012?&page=6#comments,2012-07-11 14:51:39,AleRPM,,prendete il peggio di una Fiat 500 e il peggio delle due serie della Ford ka metteteci un pizzico del peggio di A1 mescolate bene e ecco a voi la Opel Adam. ,,,,,,,,,,,,,,
Creatività fotografica,http://www.porschemania.it/discus/messages/815/428680.html?1283792757,2009-01-04 14:05:00,admin,,Pippo ti ho mandato un messaggio privato con i codici per l'accesso,,,,,,,,,,,,,,
la batcaverna 635csi &co,https://www.bmwpassion.com/forum/threads/la-batcaverna-635csi-co.85405/page-322,2004-03-25 00:00:00,batmobile,"""E' tua questa Ale ?? """,io invece bat lo vedrei bene con questa discretissima e30 cabrio:http://www.subito.it/auto/bmw-m3-e30-koenig-specials-foggia-41283054.htm ,,,,,,,,,,,,,,
Autoabruzzo grosso dubbio,https://www.bmwpassion.com/forum/threads/autoabruzzo-grosso-dubbio.68242/,2006-04-02 00:00:00,MrAsp,,"E' un po' lunga lo so ma veramente non so a che santo votarmi ! grazie mille a chi se la vorrà leggere ! Il giorno 25/03/08 porto la 320i presso Autoabruzzo a Pescara dato che schiacciando la frizione proviene rumore dalla zona della frizione stessa. Parlo con l'accettatore e dico che sicuramente si tratta del cuscinetto reggispinta lui mi rassicura e mi dice che avrebbero smontato la frizione per verificare se effettivamente fosse quello il problema e se fosse conveniente cambiare tutta la frizione e che mi avrebbero richiamato il giorno seguente per accordarci riguardo il da farsi. Mi confermano la cifra di un precedente preventivo di 600Euro comprendente frizione nuova cuscinetto e altre piccolezze necessarie.Arrivato a giovedì 27 e non avendo notizie telefono io mi dicono che la macchina la stanno smontando mi richiameranno tra circa un'ora. Mi richiamano dopo 20 mins e sempre il solito accettatore mi conferma che il cuscinetto è rovinato come anche il piatto della frizione e che quindi conviene cambiare tutto. A malincuore accetto e chiedo che mi venga controllato anche il giunto in gomma subito dietro l'uscita del cambio e sostituito un paraolio del cambio che perde qualche gocciolina tanto con tutto già smontato mi confermano che queste operazioni non comporteranno spese aggiuntive di manodopera. Mi richiameranno il giorno seguente per farmi sapere.Il giorno seguente telefonano a mio padre intestatario dell'auto benchè io avessi lasciato loro il mio numero di cellulare comunicando che il giunto in gomma è rotto va cambiato e che c'è da cambiare anche la guarnizione del coperchio punterie che trasuda olio.Mio padre non sapendo cosa fare conferma il lavoro per un prezzo di circa 800 euro tutto compreso e mi avverte telefonicamente.Appresa la notizia mi reco subito in concessionaria infatti la guarnizione del coperchio punterie per me può restare al suo posto non voglio che la cambino e soprattutto voglio vederci chiaro riguardo questo giunto visto che prima di arrivare lì la macchina non aveva problemi imputabili al giunto stesso.In officina il solito accettatore abbassa il tiro: il giunto non è rotto è solo indurito e già che ci siamo conviene cambiarlo tanto non comporta molta manodopera sostituirlo. Accetto anche questo a malincuore.La guarnizione del coperchio punterie invece la blocco quella non si tocca.Bene l'accettatore mi conferma che così risparmierò circa 100 euro sul preventivo telefonico fatto a mio padre. Siamo quindi intorno ai 700 euro.Non mi dà però niente in mano io ho solo il foglio che loro mi hanno fatto quando ho consegnato la macchina il primo giorno.Ci sentiremo durante la prossima settimana.Io Lunedì 31 sono partito chiedo gentilmente a mio padre di informarsi lui per la macchina e di andarla a ritirare quando pronta.Passa tutta la settimana nessuno telefona di conseguenza arrivati a lunedì scorso è mio padre a chiamarli: non hanno fatto ancora nulla i pezzi di ricambio non sono ancora arrivati.Oggi telefonano a mio padre la macchina è pronta per un totale di 803Euro.Già qui le cose non tornano.Mio padre va a ritirare la macchina e sulla fattura non c'è traccia della voce ""kit frizione senza amianto"" sono stati sostituiti solo il cuscinetto reggispinta e altre piccole parti della frizione insieme alla pompa ricevente del comando frizione.Giunto in gomma e paraolii varii sono stati invece cambiati.L'ormai famoso accettatore fa il prezzo e comunica che solo di manodopera sarebbero 725 euro perchè la macchina è vecchia e per smontarla ci hanno messo molto ma siccome capisce che la cifra è impegnativa ci fa uno sconto: solo 489Euro di manodopera più i pezzi. Totale 785 euro ( si mi hanno scontato anche i 15 euro di lavaggio vettura non richiesto ) .Mio padre purtroppo paga e torna a casa con la macchina che peraltro segna problemi ai freni ( spia rossa liquido freni accesa ) e ha l'antenna della radio che non torna più a posto ( è di quelle vecchie telescopiche ) ovviamente prima di consegnare a loro l'auto tutto andava alla perfezione.Ora cosa mi consigliate di fare ? Non hanno fatto una cosa che avevamo assieme deciso di fare ( cambio frizione completa ) e ne hanno fatte altre mai preventivate. E soprattutto non mi hanno avvisato di questi cambiamenti.Non riesco poi a concepire come si sia fatto ad arrivare a 725 euro di manodopera a fronte dei 200 preventivati per la sostituzione della frizione completa.Non so veramente cosa fare tantopiù che non sono a casa e non ci tornerò prima di 2 settimane.Domani mattina telefonerò in conce e farò un po' di casino ma veramente mi servirebbe qualche consiglio visto che sono alla mia prima esperienza diretta con questi ""signori"" ! Grazie a tutti ! ",,,,,,,,,,,,,,
Maserati GranTurismo MC Stradale (Topic Ufficiale - 2010),https://www.autopareri.com/forums/topic/39858-maserati-granturismo-mc-stradale-topic-ufficiale-2010?&page=5#comments,2011-06-08 09:47:37,Matteo B.,,CHIAMATOO ? ( cit.Lurch ) guardacaso domenica ho beccato una manche del trofeo Maserati su nuvolari e me la sono guardata fino a che sono stato possessore del telecomando...la macchina è grossa c'è poco da fare e in pista si nota.... però è un bel mezzo un'auto veramente piacevole per il complesso prestazioni /linea usabilità ecc... io la MC la lascerei li mi sistemerei bene una S.... ,,,,,,,,,,,,,,
Renault Captur 2013,https://www.autopareri.com/forums/topic/53994-renault-captur-2013?&page=115#comments,2013-11-18 20:56:07,Cappy,,Ciao Capturisti io sono proprietaria di una new megane da tre anni e sto valutando di passare alla captur. Sono parecchio indecisa però.. mi hanno fatto una buona valutazione della mia 12000 00 la captur viene 21500 ( energy r link diesel 90 cv ) con cerchi diamantati pack camera e carrozzeria bicolor ( parigi ) .. Voi cosa ne pensate ? ,,,,,,,,,,,,,,
Buona settimana dal 21/08 al 27/08,https://forum.quattroruote.it/threads/buona-settimana-dal-21-08-al-27-08.111923/,2017-08-25 00:00:00,renato415,,Baffone era ora che tornassi a lavorare lazarun...io una settimana e basta... ,,,,,,,,,,,,,,
Online il sito dell'ecobonus per auto elettriche,https://www.forumelettrico.it/forum/online-il-sito-dell-ecobonus-t4943-160.html?sid=053f872f8b7b19de0856815c966834f2&sid=053f872f8b7b19de0856815c966834f2,"10/04/2019, 7:37",borgiaz,,Il dubbio che viene leggendo le varie risposte é che l'incentivo 'integri' per così dire il prezzo finale che però rimane lo stesso ( diciamo 50.000 dei quali poniamo 6000 ce li mette lo Stato ) . A questo punto l'Iva calcolata sul totale rimarrebbe sempre il 22% a carico dell'acquirente. Bisognerebbe chiarire questa interpretazione col Mise.,,,,,,,,,,,,,,
Di Gennaro auto (info generali),https://www.bmwpassion.com/forum/threads/di-gennaro-auto-info-generali.109706/,2008-11-22 00:00:00,Satta,,Ragazzi non sapevo proprio dove inserire questo topic quindi se i mod pensano che vada spostato lo facciano pure nella sezione più consona.Volevo sapere se qualcuno ha avuto esperienze dirette o indirette con questo conce della zona milanese.Chiedo perchè dovrò andare tra pochi giorni a visionare un'auto da loro perciò volevo sapere se dovrò fare tutto cercando ogni minimo particolare dell'eventuale fregatura o se comunque ha la fama di conce serio e quindi posso sperare di non rimanere fregato ( ciò non toglie che terrò ugualmente gli occhi aperti ) .Grazie in anticipo:wink: ,,,,,,,,,,,,,,
Chevrolet Volt 2009,https://www.autopareri.com/forums/topic/30339-chevrolet-volt-2009?&page=16#comments,2010-10-14 19:32:21,Cosimo,,in pratica tutto sto casino di definizioni è per usufruire dei 7500 dollaroni... giusto ? ,,,,,,,,,,,,,,
Presentazione,http://www.porschemania.it/discus/messages/502416/801758.html?1487140478,2017-01-25 00:17:00,darkness,,Anche se la prenoti oggi le consegne sono settembre io ho optato per la boxster,,,,,,,,,,,,,,
Legge di stabilità..ecco perché Renzi si definisce rottamatore,https://www.bmwpassion.com/forum/threads/legge-di-stabilit%C3%A0-ecco-perch%C3%A9-renzi-si-definisce-rottamatore.243850/page-46,,iceoair,"'Peccato che in qualsiasi paese di diritto positivo le leggi di rango superiore prevalgono sempre su quelle di rango inferiore... e nel caso in questione le Leggi Regionali sono sempre e comunque di rango inferiore alle leggi statati oltre al fatto ch come la Corte Costituzionale ha chiarito in modo cristallin la tassa di circolazione è un tassa statale e quind a norma della nostra carta costituzional le regioni si attaccano. ""In sintesi devo pagare bollo pieno e scordarmi dell'agevolazione anche se la regione veneto mi ha iscritto la vettura tra quelle esenti per vetustà ventennale ed iscritta ASI!!???""",Legge di stabilità..ecco perché Renzi si definisce rottamatoreOppure potrebbe essere che ci mette il bollo direttamente in bolletta Enel ? ,,,,,,,,,,,,,,
Infoteiment in auto,https://www.autopareri.com/forums/topic/63246-infoteiment-in-auto,2018-01-29 22:40:12,Vadocomeundiavolo,,Pensa e Apple CarPlay nella mia auto c’è e non lo uso perchè non mi piace. Mi basta il telefono via bt. ,,,,,,,,,,,,,,
Ferrari 550 GT1,https://www.bmwpassion.com/forum/threads/ferrari-550-gt1.11137/,2004-04-20 00:00:00,Davide,,Presso un'università... http://somemightsay.altervista.org/ferrari@ing/ferrari.html ,,,,,,,,,,,,,,
Alfa Romeo Giulia 2016,https://www.autopareri.com/forums/topic/60616-alfa-romeo-giulia-2016?&page=1257#comments,2017-06-01 12:47:25,Andrew_87,,l'opt 4TU dovrebbe essere disponibile anche sul 2.2 180cv ,,,,,,,,,,,,,,
Golf non vende,https://forum.quattroruote.it/threads/golf-non-vende.120514/page-2,2019-01-27 00:00:00,Aksis,"""Pensa che è l'oggetto del desiderio di almeno metà persone che cercano un suvvetto""",Sarà ma io quì a Milano di T-Roc ne vedo pochissime delle mosche bianche. ,,,,,,,,,,,,,,
Petizione - Junior VS MiTo,https://www.autopareri.com/forums/topic/27702-petizione-junior-vs-mito?&page=8#comments,2008-03-20 12:23:08,Tommitel,,Per sottolineare la contrapposizione a Mini si poteva usare il nome Mega... ,,,,,,,,,,,,,,
Per chi ama la TP,https://www.autopareri.com/forums/topic/7996-per-chi-ama-la-tp?&page=3#comments,2004-07-16 15:49:38,bialbero,,perfettamente d'accordo un'Alfa Romeo è d'obbligo per dirla tutta una 147 come l'attuale non guasta affatto anzi ma proseguendo sull'attuale strada un gradino più in alto però ci posizionerei un qualcosa di molto più raffinato una 156 è fin troppo modesta per le credenziali Alfa un tempo tra la 33 e la 75 tecnicamente parlando era come parlare un'altra lingua lo stesso non succede oggi insomma inoltre le sportive coupè e spider non è necessario siano sempre e comunque delle TA l'attuale GT potrebbe pure starci ma a livelli di prezzo un po più coerenti costa francamente troppo in relazione a quello che offre la sostituta delle GTV dovrebbe invece essere a TP una TP degna erede delle migliori TP Alfa sopra queste libero sfogo alla supersportive e la 8C in questo caso tanto di cappello... ,,,,,,,,,,,,,,
Porsche Cayenne Coupé: foto e info ufficiali del SUV sportivo - HDmotori.it,http://www.hdmotori.it/2019/03/21/porsche-cayenne-coupe-foto-info-motori-uscita/,2019-03-23 07:40:00,Aristarco,,A parte che il listino della.macan parte da circa 61 e quello della Cayenne da circa 78 in ambito automotive il segmento viene individuato anche in base alle dimensioni e come puoi ben capire il Cayenne é un segmento superiore poi sinceramente il tuo parere personale non conta perché questo é un fatto,,,,,,,,,,,,,,
Incentivo per rottamare uno scooter L1 per un L3,https://www.forumelettrico.it/forum/incentivo-per-rottamare-uno-scooter-l1-per-un-l3-t4787-20.html?sid=1c3a99d7530745a920dbc9d08b29704a&sid=1c3a99d7530745a920dbc9d08b29704a,"13/03/2019, 9:44",Adri66,,Se utile a qualcuno pare che la CORTE DI CONTI si debba pronunciare sul tema in questione entro metà marzo:https://www.dueruote.it/news/attualita/ ... iano-.html,,,,,,,,,,,,,,
Mondiale F.1 2018 - GP del Canada,https://forum.quattroruote.it/threads/mondiale-f-1-2018-gp-del-canada.116850/page-13,2018-06-12 00:00:00,pilota54,'Mi stupisco che tu che calchi la pista possa dare tale giustificazione ad un pilota pagato fiori di milioni all´anno. Hai sbagliato una qualific una gar o la moglie non te l´ha data da 1 mese...ma quando la luce diventa verde sale l´adrenalina e dai tutto....o almeno cosi deve essere. Altriment se non hai più birra....quella é la porta. INGIUSTIFICABILE.',Ogni opinione è ben accetta. Io ho detto che ha fatto forse la peggior gara della sua ventennale carriera e ho provato a cercare qualche motivazione perchè di solito quando uno sportivo ha una tale debacle qualche motivazione dovrebbe/potrebbe esserci. Poi ognuno è libero di fare le critiche che vuole ci mancherebbe. ,,,,,,,,,,,,,,
