Titolo,URL,Timestamp,User,(Testo Citato),TESTO,Costruttore,Modello,Brand,Interni,Esterni,Meccanica,Prestazioni,Consumi/Autonomia,Motore,Elettrico,Fuoristrada,Elettronica di Bordo,Manutenzione,Assistenza/Concessionari
Alfa Romeo Stelvio 2017,https://www.autopareri.com/forums/topic/62477-alfa-romeo-stelvio-2017?&page=406#comments,2018-02-16 18:25:24,lukka1982,,Come cambiano decisamente in meglio in full silver rispetto ai neri diamantati ! Ci voleva comunque un 20” dal design più elegante rispetto a quelli di lancio. Avrei preferito però un design tipo il 18” di serie sulle Executive. ma c’è un link al catalogo Mopar ? ,,,,,,,,,,,,,,
Camar novara a voi l'ardua sentenza...,https://www.bmwpassion.com/forum/threads/camar-novara-a-voi-lardua-sentenza.151676/,2010-05-04 00:00:00,ZX-10R,,eccolo e cosa mai potevo scrivere ? ? ? ? io mi sono trovato male.... e voi ? fatemi sapere ! ! ! ! e fatelo sapere a chi si vuole migliorare..... se vuole..... ,,,,,,,,,,,,,,
Alfa Romeo Giulietta (Topic Ufficiale - 2009),https://www.autopareri.com/forums/topic/36127-alfa-romeo-giulietta-topic-ufficiale-2009?&page=952#comments,2010-07-05 14:29:22,Alfista-Mito,,In effetti quello mi manca: ho provato il 1.3 90cv 1.3 75 1.6 120 1.9 120 2.4 210 e 2.0 170. ,,,,,,,,,,,,,,
Alfa Romeo Giulia 2016,https://www.autopareri.com/forums/topic/60616-alfa-romeo-giulia-2016?&page=812#comments,2016-06-24 18:29:16,super pax,,Buon compleanno Alfa Romeo. ,,,,,,,,,,,,,,
Costi vivi Cayman 981 2.7,http://www.porschemania.it/discus/messages/502416/784804.html?1470257687,2016-07-07 08:44:00,giuliobonbon,,Ah quindi si pu\xf2 aggiungere lo scarico sportivo anche in un secondo momento ? ma presso un meccanico o il CP ? grazie mille per i consigli ,,,,,,,,,,,,,,
Nuova Kia Rio 2011,https://forum.quattroruote.it/threads/nuova-kia-rio-2011.53302/page-120,2012-04-30 00:00:00,mapo18,,a okok ! così hai ragione ! ,,,,,,,,,,,,,,
Nuova Suzuki Swift,https://forum.quattroruote.it/threads/nuova-suzuki-swift.109819/page-46,2019-04-14 00:00:00,jhn00,'Conta il prezzo concordato e per cui hai firmato un contratto.',Attenzione non potrebbe essere così scontato. Nelle proposte di acquisto c è quasi sempre una clausola dove l acquirente si impegna oltre a pagare l importo concordato anche l eventuale aumento di listino entro una determinata percentuale. Per 200 euro non credo tuttavia che ci siano problemi... ,,,,,,,,,,,,,,
La mia batmobile e altre 2 csl su automobilismo d'epoca,https://www.bmwpassion.com/forum/threads/la-mia-batmobile-e-altre-2-csl-su-automobilismo-depoca.93398/page-8,2004-03-25 00:00:00,batmobile,'va bene...vada per il lavaincer poi....scusa bat...ma io son duro come un ciocco di legno in invern mi è venuta la brillante ide non so quanto brillante...ma se io quando ho finito di pulire tutto amod gli dessi una bella spruzzata con quei prodotti che utilizzano i lavaggi quando ti lavano il motore? n sa perchè (a prt che me ne strafrego) però se mi vede qualcuno sotto la macchina con il lavaincera e me con la spugn mi fanno rinchiudere...n a parte scherz il lavaincera va be gli douna bella passata e via...ok...ciao',Ti chiudono via comunque non badano alla chimica in uso...Lavaincera i prodotti degli autolavaggi sono sgrassanti che hai già usato:wink: ,,,,,,,,,,,,,,
Sblocco connettore CCS a fine ricarica come CHAdeMO,https://www.forumelettrico.it/forum/topic5559.html?sid=9b3d6660a00250109c0902db2fb0b90b,2019-05-06 21:50:00,pIONiere,,Con CCS e' la macchina che blocca e sblocca il connettore ( comanda la macchina ) con Chademo e' il connettore stesso che si blocca/sblocca ( controllato dalla colonnina ) .,,,,,,,,,,,,,,
Renault - 1.6 dCi 160 CV Bi-Turbo,https://www.autopareri.com/forums/topic/54409-renault-16-dci-160-cv-bi-turbo?&page=4#comments,2014-02-21 09:59:09,Ario_,,160Cv da un 1.2 BENZINA ci stanno tutti IMO. un turbo benzina con 100Cv/l non è tirato un turbo diesel con 100Cv/l sì. Detto questo mi trovo concorde con J-Gian al netto di questioni ( per ora non risolvibili ) di affidabilità: ,,,,,,,,,,,,,,
Perchè non caricare in modo1?,https://www.forumelettrico.it/forum/perche-non-caricare-in-modo1-t1437-10.html?sid=b7393f2be9df5cce21de58934b284756&sid=b7393f2be9df5cce21de58934b284756,"30/05/2018, 8:45",selidori,"""P.S. Per le ricariche veloci?Imparate da Tesla: niente cav niente EV niente tessere... E' tutto nella colonnina.""","Solo per chiarire... il ""niente EVR"" non l'ha inventato tesla.Di fatto non so cosa intendi se il modo4 ( ovvero la carica DC ) quella che troviamo nei supercharger appunto non è stata un'idea di tesla.Nel caso invece intendi modo3 ( quindi cavo stupido ed infrastruttura intelligente quindi la cosiddetta colonnina ) è appunto di questo che stiamo parlando e Tesla fa esattamente quanto fanno tutte le altre auto: non caricano in modo1 ( neppure a casa propria ) e vogliono un cavo dedicato con elettronica ( se manca la colonnina/wallbox ) .Se invece parli di tessere per l'autenticazione... quella è una scelta meramente commerciale ci sono anche nel mondo NON-TESLA infrastrutture senza tessere che ti attacchi e vai. Se vuoi l'autenticazione 'trasparente' all'utente... e be' grazie Tesla si è fatta il suo standard per le sue colonnine e le sue auto che va solo da lei e solo per lei qualsiasi costruttore potrebbe farlo ( colonnine Nissan ( come quelle di Milano Roma Ikea o le varie concessionarie ) che vanno solo con Nissan colonnine Kia che vanno solo con kia colonnine VW che vanno solo con VW... ) ma siamo sicuri che questo modello sia da prendere da esempio ? Vogliamo moltiplicare l'infrastruttura diminuendone le possibilità di utilizzo ? ",,,,,,,,,,,,,,
Svalutazione vetture Ferrari,https://www.autopareri.com/forums/topic/43167-svalutazione-vetture-ferrari?&page=4#comments,2011-05-30 15:18:31,Steso,,"Quindi una F40 ora vale il doppio del prezzo di acquisto ( 350 milioni di lire circa ) a fronte pero' di una tiratura limitata ( ? ) a 1337 esemplari per la erede della GTO con una speculazione sul mercato parallelo a circa 2 miliardi. Una automobile credo paragonabile oggi per nicchia alla 599 GTO. Ma cosa accada' nel tempo ad una ""semplice"" 458 non a tiratura limitata ? Chi mi può dare i dati di produzione delle nuove rosse ? Grazie ",,,,,,,,,,,,,,
NON ACQUISTATE COME ME una Subaru BIFUEL!!!,https://forum.quattroruote.it/threads/non-acquistate-come-me-una-subaru-bifuel.23250/page-6,2010-04-22 00:00:00,matteomatte1,"70linus ha scritto: dopo un'anno e mezzo l'ho permutata.... che hai preso?... Dopo un giro estenuante dai concessionari di cui il 70% non la prendevano in permut il 29% mi offrivano cifre da alzarsi subito e andarsen tipo 7000 eur alla peugeot oltre a permutarmi la mia e darmi una cifra adeguata ho preso la 5008 diesel che tra l'altro mi è piciuta subito "" 70linus ha scritto: dopo un'anno e mezzo l'ho permutata.... che hai preso? ""dopo un'anno e mezzo l'ho permutata.""",bhè insomma hai fatto un bell'upgrade... ,,,,,,,,,,,,,,
Raduno auto elettriche EV Team Rally di Imola 19/5/19,https://www.forumelettrico.it/forum/topic5550.html?sid=9b3d6660a00250109c0902db2fb0b90b,2019-05-05 21:34:00,CristianZOE,,"Screenshot_20190507_080523.jpg ( 288.07 KiB ) Visto 171 volte RADUNO AD IMOLA DI AUTO ELETTRICHE DOM. 19 MAGGIO 9:00 ritrovo davanti allo showroom tazzari 9:30 consegna pass ZTLEnzo e Dino Ferrari International RacetrackPiazza Ayrton Senna da Silva 2 – Interno 440026 Imola ( BO ) Italy10:00 parata per le vie del centro10:30 esposizione in piazza Gramsci10:45 stand EVolution team ""Com'è viaggiare in elettrico ? ""12:30 ingresso all'autodromo ""Enzo e Dino Ferrari""13:00 ristorante con prezzo convenzionatoHo bisogno delle targhe per richiedere il pass. Chi partecipa ma non ha il permesso è soggetto a sanzione.Vi chiedo la cortesia di inviarmi per privato targa e proprietario/modello auto.Il pass sarà consegnato al ritrovo da tazzari. <img alt=""Screenshot_20190507_080523.jpg"" class=""postimage"" onclick=""viewableArea ( this ) "" src=""./download/file.php ? id=13864&amp sid=6b73509e3e6a9459dedcd71094b5ac12""/>",,,,,,,,,,,,,,
Kuga  consumi?,https://forum.quattroruote.it/threads/kuga-consumi.110952/,2017-06-17 00:00:00,ABC12,,Al personale delle officine Ford ,,,,,,,,,,,,,,
F.lli Gori _ Grosseto semplicemente scandalosi,https://www.bmwpassion.com/forum/threads/f-lli-gori-_-grosseto-semplicemente-scandalosi.95854/,2005-04-01 00:00:00,Tonio330cd,'da chi ti rivolgi?? io pensavo di passare da anzio a sentire...',Vi invito a leggere la discussione http://www.bmwpassion.com/forum/showthread.php ? t=148651 dove definisco tutta la vicenda fino all'ultimo atto che peraltro e purtroppo non conclude definitivamente la vicenda.leggere la discussione sopraindicata spero che vi possa mettere in guardia sulle persone alle quali state portando i vostri soldi.poichè voglio andare in fondo anche per vie legali a quanto mi è successo e ho abbastanza dettagliatamente riportato nella discussione di cui sopra avrei bisogno di alcune indicazioni riferite alla garanzia bmw di 4 anni ( quella nella quale rientro fino al 29 di marzo ) : a ) ogni volta che viene effettuato un intervento in garanzia devo avere un qualcosa che attesta quello che mi è stato sostituito e perchè ? b ) su quei pezzi sostituiti c'è garanzia ? c ) la macchina sostitutiva è un mio diritto o una cortesia che mi viene fatta ? ? ? d ) un concessionario bmw-mini se nel salone si riempie di altre macchine tipo porsche e ferrari è normale ? ? ? mi spiego io sono concessionario esclusivo di un marchio per la mia zona e nella mia esposizione non posso mettere altre macchine da caffè di altri marchi. vale lo stesso per loro ? queste sono le prime domande che mi sono venute le risposte mi serviranno per articolare il mio reclamo scritto a bmw italia. grazie dell'aiuto per ora ,,,,,,,,,,,,,,
Ciao appassionati !,https://www.bmwpassion.com/forum/threads/ciao-appassionati.339759/,2005-01-31 00:00:00,Mauretto,,Ciao a tutti Come da regolamento mi presento nella miglior community per BMW .Claudio BMW E36 320i Leggermente modificata ...Buona continuazione e nel frattempo mi fiondo a sistemare il profilo ! ,,,,,,,,,,,,,,
la batcaverna 635csi &co,https://www.bmwpassion.com/forum/threads/la-batcaverna-635csi-co.85405/page-317,2005-06-11 00:00:00,PuccioE39,"""Sulle Ferrari hai ripercussioni sulle quotazioni dell' usato......il grigi in gener ha preso piede per la praticità !! :wink:""","Ohhhhhhhh finalmente t' E///Mmizzi ! ! ! Sul prezzo........se é in quelle condizioni non credo scenda di 3.000€.....ma tentar non nuoce ! ! Cerchi del Csl immediatamente poi ! ! ! /emoticons/wink@2x.png 2x"" width=""20"" height=""20"" /> ",,,,,,,,,,,,,,
Scénic XMod - Topic Ufficiale,https://forum.quattroruote.it/threads/sc%C3%A9nic-xmod-topic-ufficiale.14456/page-15,2009-12-19 00:00:00,cb499,"""Grazie per avermi risposto...dunque sarò comunque più preciso: ho ordinato una 1.5 dci luxe ed l'opz in oggetto mi è costato ? 19 00...""",Si è giusto così su la luxe con questa cifra hai anche la telecamera.Ciao[/quote] Ieri sono tornato dal concessionario e mi ha detto che la telecamera posteriore intesa come videocamera non c'è...Io gli ho detto che l'ho vista su questo forum in delle foto ma lui mi ha negato l'esistenza Come posso assicurarmi su questa cosa secondo voi ? Grazie ! ! ,,,,,,,,,,,,,,
scoop 159GTA,https://www.bmwpassion.com/forum/threads/scoop-159gta.29597/page-3,2004-09-13 00:00:00,Emiliano,'Si ormai dice ke si comprerebbe la Brera/Spider solo x andarci a figa e farci la passeggiatina sul lungomare o alla Domenica!!!',Si ormai dice ke si comprerebbe la Brera/Spider solo x andarci a figa e farci la passeggiatina sul lungomare o alla Domenica ! ! ! ,,,,,,,,,,,,,,
F.1 - Test Abu Dhabi 27-28 novembre 2018,https://forum.quattroruote.it/threads/f-1-test-abu-dhabi-27-28-novembre-2018.119595/,2018-11-28 00:00:00,Ax-80,'Problema idraulico per Raikkonen nella fase finale dei test. ',Sempre sfortunato comunque ,,,,,,,,,,,,,,
E dopo un Audi A3?,https://forum.quattroruote.it/threads/e-dopo-un-audi-a3.116146/page-4,2018-06-13 00:00:00,giuliogiulio,"""C'è poco feeling quindi """,io proprio non riesco a farmelo andare giù...pur riconoscendo una superiorità rispetto agli automatici classici stile jap per intenderci. ,,,,,,,,,,,,,,
Fiat Freemont - Problemi  riscontrati e soluzioni,https://www.autopareri.com/forums/topic/44615-fiat-freemont-problemi-riscontrati-e-soluzioni?&page=102#comments,2012-08-24 20:04:16,Roan,,Ciao Il mio Urban 140 con monitor da 4 3 si comporta alla stessa maniera del tuo per quanto riguarda il bt invece legge perfettamente qualsiasi chiavetta USB ora ne sto usando una da 16 gb. ,,,,,,,,,,,,,,
Audi A5,https://www.bmwpassion.com/forum/threads/audi-a5.28760/,2004-12-28 00:00:00,DjMarvel,,Coupè su base prossima A4: ,,,,,,,,,,,,,,
Trazione Integrale (4WD o AWD): le varie tipologie,https://www.autopareri.com/forums/topic/41189-trazione-integrale-4wd-o-awd-le-varie-tipologie?&page=18#comments,2012-01-26 14:32:45,Duncan,,Non vorrei sbagliarmi ma mi pare che la differenza di velocità con cui affronta i birilli sia un po' diversa se si capisse cosa dice... Ps.s: mi son riguardato il video e forse mi ero sbagliato rimane da capire quello che dice dopo la prova da la pagella ed alla subaru da 3 mrecedes 0 BMW ed Audi nel mezzo. ,,,,,,,,,,,,,,
Avvistate due Croma a Milano,https://www.autopareri.com/forums/topic/13726-avvistate-due-croma-a-milano?&page=6#comments,2005-06-27 06:50:41,RossoConero,,Bè mica ho detto che è brutta ...anzi l' avevo presa nera ( nero elena ) prorpio perchè mi piaceva molto. Il problema come ti ha fatto notare qualcuno è che d' estate si trasformava in un vero e proprio forno ...micidiale ! Inoltre la mia Lybra era bella e splendente per poche ore appena lavata poi sembrava sempre sporca e trascurata... E per concludere il minimo graffietto risaltava come una ferita..... resta il fatto che avessi potuto riprendere una Lybra il nero era ancora uno dei colori che mi piaceva di più........ ,,,,,,,,,,,,,,
Fiat 500S 1.2,https://www.autopareri.com/forums/topic/54675-fiat-500s-12,2014-03-18 20:29:44,Wilhem275,,Ma chi è il povero disgraziato che deve fare da accompagnatore a questi giretti ? ,,,,,,,,,,,,,,
Gemballa GTR 650,https://www.bmwpassion.com/forum/threads/gemballa-gtr-650.18678/page-2,2005-11-11 00:00:00,996GT3,'mi sembra d ricordare su base s2... cmq ricordo ke dicevano ke era un punto d partenza x portare la lotus nel campionato fia GT.. il lavoro passò x le mani d barney hatt...capoprogettista lotus....x un esemplare pressochè uniko... nn ricordo se fosse omologato x la strada',io visto ke qui si parla d porsche by gemballa...parlavo della exige by hethel.... nn sò se ne hai mai sentito parlare... motore:v6 d 56 gradi 2998cc testata d alluminio dohc per bancata 400cv a 7750rpm 398nm a 6500 rpm peso 850kg rapporto peso/potenza 2.1 kg/cv .... le fù dedicato un articolo anke su un numero d evo d un annetto fà...quello cbìn la mc12 in copertina mi sembra... nulla toglie che questa porsche è molto suggestiva ,,,,,,,,,,,,,,
La percorrenza delle nostre MAZDA: Aggiornamento in progress,https://forum.quattroruote.it/threads/la-percorrenza-delle-nostre-mazda-aggiornamento-in-progress.109730/,2017-04-04 00:00:00,jpizzo,,Proseguo io. Mazda 6 del 2007 ( ma la uso dal 2009 ) 2.0 CD Excellence 143CV km 152.000 Problemi rilevati: - una serratura sostituita - tendalino sostituito in garanzia - 2 webasto bruciati ( il primo sostituito in garanzia il secondo mai riparato ) . - fari anteriori opacizzati ( tornati nuovi con 80€ dal carrozziere ) . Nelle mattine fredde e umide mi si accende la spia airbag per qualche minuto. Boh. Consumo medio 5.5 l/100km La macchina va esattamente come nuova non presenta segni di usura visibili ho fatto sostituire le rondelle iniettori al cambio cinghia e rigenera ogni 250-300 km. Visto quello che mi è costata direi per ora soddisfatto. ,,,,,,,,,,,,,,
Ford Tourneo Connect 2013,https://www.autopareri.com/forums/topic/48586-ford-tourneo-connect-2013?&page=3#comments,2013-07-03 16:05:15,Puntor89,,Ops hai ragione chiedo scusa per la domanda scema.. ,,,,,,,,,,,,,,
Ho ritirato il Mitsu,https://www.bmwpassion.com/forum/threads/ho-ritirato-il-mitsu.15827/,2004-12-28 00:00:00,DjMarvel,Garzò ha scritto: Cercavo anche delle molle per abbassarla e anche li praticamente niente.... Ma perchè hai preso un SUV se vuoi abbassarlo?... Ottima domanda... ' Garzò ha scritto: Cercavo anche delle molle per abbassarla e anche li praticamente niente.... Ma perchè hai preso un SUV se vuoi abbassarlo? 'Cercavo anche delle molle per abbassarla e anche li praticamente niente.',"Bene come annunciato ho comprato l'Outlander 2.0 16 V Turbo nero. Appena possibile posterò le foto con i 19""...davvero niente male. Comunque sono un pò incazzato perchè pensavo di pomparla leggermente ( centralina+scarico+filtro ) giusto per farle toccare i 250 CV ma in internet non si trova niente a parte al rimappa della Digital. Cercavo anche delle molle per abbassarla e anche li praticamente niente. Me la date una mano nella ricerca ? ",,,,,,,,,,,,,,
Alfa Romeo Marchio premium ma solo ora?,https://forum.quattroruote.it/threads/alfa-romeo-marchio-premium-ma-solo-ora.109274/page-3,2017-03-31 00:00:00,arizona77,"'Purtroppo delle ""scellerate"" scelte (IMHO) operate in passato dall' ex gruppo Fiat su Alfa Romeo sono stati scritti e detti fiumi di parol purtroppo la storia non si fa con i ""se"" o con i ""ma ed i risultati ""altalenanti"" del marchio sono cosa nota. Per assurdo Alfa e' passata da un estremo all'altr dalla F1 da un lato all'Arna dall'altro. Abbastanza per distruggere o almeno destinare all'oblio chi non avess come Alf una tradizione radicata e un nome ancora famoso in tutto il mondo. Adesso deve essere cambiato qualcosa verament con la gestione FCA. Meglio tardi che mai. Dico questo perche' facevo caso a questo particolare prima che mi ci e' caduto l'occhio addosso: Vedi l'allegato 2777 E' il gancio dell'aletta parasole lato guida della Giulia. Mai visto un particolare cosi' su vetture del gruppo Fia notare la molla di trattenuta in acciaio e il rinforzo intermedio del gancio per evitare che si spezzi. Lo si poteva fare monolitico tutto in materiale plastico ma la scelta e' stata divers l' effetto di ""ricercatezza"" e' garantito. Magari lo fanno anche altri marchi storicamente ""premium ma che in casa FCA qualcuno abbia avuto questa sensibilita' o e' stato cosi' abilmente scaltro da farlo deliberare senza che nessuno (= controllo budget) se ne accorgess oppure veramente siamo al cospetto di una vera e propria ""rivoluzione copernicana"". Che sarebbe anche ora per la nostra industria automobilistic almeno a livello di percezione e di orgoglio nazional sappiamo tutti bene ormai che parliamo di aziende multinazional se ne e' gia' parlato su altri thread.'",Combinazione la piastrina con relativo beccuccio ( frizione difettosa a parte ) e' l' unica cosa che mi si e' rotta in 7 anni sul Q5. Dieci Eurini montata e via Eccellente pensata quel nuovo modello di gancio ,,,,,,,,,,,,,,
Ferrari LaFerrari 2013,https://www.autopareri.com/forums/topic/50881-ferrari-laferrari-2013?&page=10#comments,2013-03-05 11:12:05,andyp,,ma è lei ? ? ? murtacci che bellaaaaaaaaaaaaaaaaaaaaaaaaaaaaaaaaaaa....cioè se è cosi la mclaren a confronto è un brufolo pieno di puss.. ,,,,,,,,,,,,,,
Lotec Sirius  -1197CV-,https://www.bmwpassion.com/forum/threads/lotec-sirius-1197cv.26815/,2005-05-11 00:00:00,Head,ma è nuova la macchina? .... sembra vecchissima ....... Per quello che sapevo io il progetto è del 199 o giù di l per questo esteticamente e come interni non è che sia granchè!!!!!!! :wink: 'ma è nuova la macchina? .... sembra vecchissima ....',Per gli incontentabili.... 780.000 Dindini.... :wink: ,,,,,,,,,,,,,,
Kia Picanto Facelift 2015,https://www.autopareri.com/forums/topic/57249-kia-picanto-facelift-2015?&page=2#comments,2015-01-08 11:46:12,Touareg 2.5,,Probabilmente sarà una comparazione tra il loro 1.0 e i frullini dei tre marchi. ,,,,,,,,,,,,,,
Il cambio tct verrà accantonato con la prossima Giulietta?,https://www.autopareri.com/forums/topic/62771-il-cambio-tct-verr%C3%A0-accantonato-con-la-prossima-giulietta?&page=6#comments,2017-05-02 04:32:49,fxtech,,- non mi ha ancora dato problemi 25k km e 4 anni ( mani sulle palle ) - nessun costo è a secco e credo che entro i 150k km non ci sia manutenzione di nessun tipo - qui ci spendo qualche parola: 1 ) con il volante sterzato tende a non scalare marcia quindi in uscita da una rotonda se accelleri la coppia viene tagliata fino a quando le ruote non sono completamente sterzate. 1.1 ) se esci da un passo carraio e magari sterzi e accelleri per levarti di fretta dalle palle percepisci quanto al punto 1 ( a me capita di dover uscire e attraversare due corsie ad alto corrimento per immettermi in una di esse ) 2 ) non ho le palette al volante per suggerire la scalata verso il basso e accellerare devo iniziare un kick down e poi rilasciare dopo la scalata. Se avessi le palette forse basterebbe un colpetto sul - 2.1 ) in D invece il cambio è iper reattivo pare di guidare un motore elettrico la vettura reagisce ad ogni pressione sull' accelleratore 3 ) se arrivi al semaforo e devi decellerare dopo aver frenato rilascialo un attimo e poi premi di nuovo in questo modo il cambio buttera giu una o due marcie per fare freno motore -perfetto sia in n che in d ,,,,,,,,,,,,,,
Audi A5,https://www.bmwpassion.com/forum/threads/audi-a5.28760/,2004-08-23 00:00:00,mamo,"""sicuramente non le mettono l'haldex ihihihih""",Coupè su base prossima A4: ,,,,,,,,,,,,,,
La nascita delle BMW Touring,https://www.bmwpassion.com/forum/threads/la-nascita-delle-bmw-touring.73759/,2006-10-03 00:00:00,lorenzo 61,,Mi sembra non sia mai stato postato ( in caso contrario mi scuso ) --------------------------------------------------------------La nascita delle BMW Touring...ovvero l’arte di arrangiarsiE’ davvero una storia curiosa quella che racconta come la BMW abbia deciso più di venti anni fa di produrre un modello station wagon. L’idea di allestire una Serie 3 familiare fu di un intraprendente dipendente della BMW Max Reisbock specialista di Monaco di Baviera in carrozzerie del reparto costruzione prototipi che si era trovato di fronte a un problema: la BMW che possedeva era diventata insufficiente per le esigenze di trasporto della sua famiglia composta da quattro persone. Per stipare i bagagli e il passeggino ci voleva una familiare. Che però la BMW non aveva in produzione né mai la aveva avuta. Reisbock che non intendeva affatto rivolgersi a un’altra marca acquistò perciò una berlina 323 aziendale e cominciò a studiare come modificarla in una station wagon. Il garage di casa fu rapidamente attrezzato in un laboratorio-officina.L’abile Reisbock arretrò dapprima il montante posteriore quindi completò il padiglione prolungando il tetto e ricavando così l’ampio bagagliaio. Impiegò circa 500 ore per la trasformazione della 323 in familiare. Ultimato il lavoro il super carrozziere fece vedere il risultato al suo capo reparto anche per chiedergli un aiuto per ottenere l’omologazione stradale e dunque poter circolare con l'originale Serie 3 station wagon. Prima di dare il proprio consenso tuttavia il superiore di Reisbock informò i massimi dirigenti BMW. Accade allora che un giorno alle sette del mattino il presidente del consiglio di amministrazione Eberhard von Kuenheim per oltre tre decenni leggendario dirigente della Bayerische Motoren Werke e tra i grandi artefici del successo dell’azienda chiese di vedere il “prototipo” di Reisbock. Dopo averlo osservato von Kuenheim esclamò compiaciuto: “Questa vettura va assolutamente prodotta”. Il dirigente aveva subito intravisto in quella realizzazione artigianale la nascita di un nuovo filone per la BMW: una tipologia di vettura fino a quel momento adatta per il trasporto cosiddetto commerciale come erano appunto le familiari poteva assumere anche una personalità sportiva e diventare un’auto di prestigio. Quando due anni più tardi la BMW presentò la prima station wagon della sua storia sviluppata appunto sulla Serie 3 e denominata Touring il modello si discostava davvero poco dal “prototipo” di Reisbock: il portellone posteriore per esempio era stato leggermente abbassato tra i gruppi ottici. Fu immediatamente una vettura di successo. L’abile specialista in carrozzerie fu naturalmente promosso a un incarico di maggiore responsabilità.[su “Auto” di Luglio 2005] ,,,,,,,,,,,,,,
la batcaverna 635csi &co,https://www.bmwpassion.com/forum/threads/la-batcaverna-635csi-co.85405/page-265,2008-04-29 00:00:00,Guest 002,,di bella non è bella ma stupendama quando vedo quei filtri quei volanti mi sa di auto posseduta da persone che non l'han risparmiata...può esser anche sbagliato ma ho sta fissa ,,,,,,,,,,,,,,
CAYENNE S & NEVE,http://www.porschemania.it/discus/messages/22971/540497.html?1295982491,2011-01-25 16:09:00,black_cat,,Attenzione a considerare gomma stretta = migliore su neve... In Islanda che di neve ne sanno qualcosina pi\xf9 di noi girano con i fuoristrada messi cos\xec come me la spiegate questa ? :- ) ,,,,,,,,,,,,,,
Alfa Romeo Giulia 2016,https://www.autopareri.com/forums/topic/60616-alfa-romeo-giulia-2016?&page=1081#comments,2016-12-13 09:21:35,TheAlfaRomeo,,No no la zona rossa iniziava proprio a 7000. Ad ogni modo lo so che questo è turbo. Ma anche gli altri motori che raggiungono certi regimi erano o sono aspirati. ☏ SM-G920F ☏ ,,,,,,,,,,,,,,
Mesto rientro,http://www.porschemania.it/discus/messages/22971/381636.html?1210958993,2008-05-14 18:31:00,matteo986,,Fap 928 gts ? ....ma scusate di cosa stiamo parlando ? ,,,,,,,,,,,,,,
