Titolo,URL,Timestamp,User,(Testo Citato),TESTO,Costruttore,Modello,Brand,Interni,Esterni,Meccanica,Prestazioni,Consumi/Autonomia,Motore,Elettrico,Fuoristrada,Elettronica di Bordo,Manutenzione,Assistenza/Concessionari
Scelta Audi A6 Avant,https://forum.quattroruote.it/threads/scelta-audi-a6-avant.105035/page-2,2016-07-03 00:00:00,Bombazza95,"""Provocantibu in effetti sto riflettendo anche sull'opzione di prendere un usato fresco tipo il tuo per poi passare fra due anni ad un nuovo modell in questo modo limiterei la svalutazione che nei primi due anni di vita si sa è davvero elevatissima. Al momento possiedo una bmw 320d 184c quindi per quanto riguarda prestazione e sportività...beh...sono abituato bene quindi anche questo aspetto non dovrò trascurarlo. Questa mattina ho scoperto (per mia ignoranza) che sta uscendo il nuovo volvo V9 che devo dire sembra davvero molto interessant ho qualche dubbio sul posteriore ma sinceramente non mi dispiac certamente l'esborso sarebbe superiore e soprattutto all'inzio dubito proprio che riuscirei a trovare qualche configurazione che mi permetta di rientrare nel mio budget (se non prendendo una configurazione entry level)...a questo punto preferisco dirottare verso un modello magari inferiore ma sicuramente ben accessoriato. Al momento l'orientamento è sicuramente verso una A6 magari usata (per il discorso che facevamo prima) però un usato fresco ben accessoriato non si trova a meno di 38/40k....a quel punto con pochi k in più ho trovato nuovo un 204cv full bianca km0 a 49k...quindi il dubbio rimane...l'ideale sarebbe trovare un modello recente con pochi km e pagarlo sotto i 30k...credo che inizierò a farmi qualche giro nei concessionari audi di Milano ed hinterland.... Rispondendo a Gallongi invec dico che hai ragion sicuramente è un compromesso quello che sto cercand c'è da dire che spesso l'acquisto di un auto è una questione di pancia...ed alle volte poco razionale :lol: se dovessi guardare solo ed esclusivamente la praticità per le mie esigenz allora dovrei prendere un monovolume o qualche altro modello che sicuramente non mi trasmetterebbe emozioni......non so se mi spiego Mi sembra di essere in sala parto pronto a far nascere tre gemelli (e sono un uomo )""","Ciao...visto che scendi da una 3 er secondo me ti conviene stare su auto con motore e trazione ""dalla parte giusta""....a meno di non andare su V6 e trazione quattro. Parlando di compromessi e restando in ambito 4 cilindri e TP perché non provi a cercare una XF Sportbrake 2.2 ? Hai 200 cv senza accollarti le spese di un 3 litri ed il grosso della svalutazione è già fatto . ",,,,,,,,,,,,,,
Nuovo CRV in arrivo - consigli,https://forum.quattroruote.it/threads/nuovo-crv-in-arrivo-consigli.104507/,2016-06-02 00:00:00,no_smog,,Unico consiglio: attieniti scrupolosamente agli intervalli di manutenzione e fai in modo che la persona che ci metterà le mani ne capisca. La tua Honda vivrà a lungo. ,,,,,,,,,,,,,,
nuova GLB,https://forum.quattroruote.it/threads/nuova-glb.122198/,2019-04-17 00:00:00,ilChiccoShow,,È orènda ! Ma almeno sarà ben fatta ( magra consolazione ) ricorda la Renegade purtroppo sì... ,,,,,,,,,,,,,,
356 Speedster da restaurare,http://www.porschemania.it/discus/messages/10550/664043.html?1379590945,2013-09-16 16:34:00,2l84ad8,,"Andrea 220k finita. Il problema ( onestamente parlando ) \xe8 che non ci capisco un'acca davanti a questi gioielli... mi vien quasi da ridere se penso a chi guarda il profilo delle viti ( ... ) ... ma capisco pure che per i perfezionisti ci siano i dettagli da far quadrare. Mi parlavano di numerazione particolare relativa si ""500"" pezzi fatti. Poi solo per capire questi ""giocattolini qua"" si possono mai usare o si viaggia cul ""pepearkiulo"" per la paura di rovinarla/furto ? Grazie ancora. Ciao $imone",,,,,,,,,,,,,,
la batcaverna 635csi &co,https://www.bmwpassion.com/forum/threads/la-batcaverna-635csi-co.85405/page-145,2008-06-15 00:00:00,Vinx87,,Piacerà a puccio ! ,,,,,,,,,,,,,,
Jeremy Clarkson E l'Alfa Romeo,https://www.autopareri.com/forums/topic/26971-jeremy-clarkson-e-lalfa-romeo?&page=2#comments,2008-01-28 10:51:19,duetto80,,Il punto debole di 145 è il telaio. Con i TS una certa brillantezza c'è cosa completamente assente sui Boxer. 145 è stata la prima Alfa C ha soffrire di un notevole aumento di peso. Si è passati dai poco più di 800 kg di 33 ( che persi i carburatori non era più lei ) ai circa 1250 di 145 che con il tappo catalitico seppellì il boxer. Con i TS le cose migliorarono ma il telaio rimase quello che era. Sulla linea non concordo tra le Alfa berline inizio anni 90 ( 155-145-146 ) è l'unica che dice qualcosa di nuovo ( parere mio ovvio ) . Personalmete di quel periodo buio la considero l'unica Alfa che vale la pena di conservare come testimone. L'ultima serie ( my 99 ) finalmente raggiuge un livello di finitura adeguato ( dopo 5 anni ! ! ! ! ! ! ) e con i fascioni in tinta migliora. ,,,,,,,,,,,,,,
swift boosterjet shvs sospensioni in velocità,https://forum.quattroruote.it/threads/swift-boosterjet-shvs-sospensioni-in-velocit%C3%A0.122486/,5 Maggio 2019 alle 21:25,amicable,,Nella speranza che qualcuno ti risponda magari fai una recensione della macchina qui te ne saremmo tutti molto grati. Ciao ,,,,,,,,,,,,,,
25 anni di 911 pista&rally,http://www.porschemania.it/discus/messages/815/431427.html?1233943489,2009-01-25 12:55:00,francof,,Torno a razzo sul bianco e nero ( non ho scelta... ) le foto originali erano bruttine e con Photoshop ho fatto quello che ho potuto comunque posto due foto della 935 JLP-4 di John Paul Jr.che ha corso le gare IMSA 1982: brutta ma morire ma perlomeno ha il pregio di avere contribuito a far vincere al pilota il titolo IMSA di quell'anno...mazza quanto \xe8 brutta... ! Certo che se si considera che la ( lontana ) base di partenza di questa macchina era la 911... saluti da Franco.,,,,,,,,,,,,,,
Mondiale F.1 - GP del Bahrain,https://forum.quattroruote.it/threads/mondiale-f-1-gp-del-bahrain.115798/page-6,2018-04-06 00:00:00,Gilles82A,'Non per nulla quando le cose vanno bene tutti (anche Federer per dire) ringraziano famigli mogli e chi comunque li sostiene. Sono uomin non robot............',concordo al 100% credo sia una cosa che possiamo avvertire anche noi nelle nostre vite ,,,,,,,,,,,,,,
Nissan Micra Facelift 2013,https://www.autopareri.com/forums/topic/51849-nissan-micra-facelift-2013,2013-06-03 13:33:32,Touareg 2.5,,Messaggio Aggiornato al 05/08/2015 es.autoblog - autoblog.it Press Release : Nissan Prezzi: ----- Nissan ha presentato il facelift europeo per la Micra diverso da quello attuato qualche mese fa sulla sua versione asiatica. Di certo qualche dubbio di troppo sul paraurti anteriore ma in generale da l'idea di essere un attimo meno low cost. Spero in interni non imbarazzanti come quelli da me riscontrati in concessionaria. ,,,,,,,,,,,,,,
Peugeot 308,https://www.bmwpassion.com/forum/threads/peugeot-308.41862/,2006-07-23 00:00:00,Ccino,,,,,,,,,,,,,,,,
Alfa Romeo 4C 2013,https://www.autopareri.com/forums/topic/56324-alfa-romeo-4c-2013?&page=386#comments,2013-06-11 06:36:49,Matteo B.,,"ahahahahahaha...schiattattate Alfisti talìb...gente con la polo Maserati che assembla ""le auto che andrebbero costruite solo alla Mecca di Milano NW e da persone di provata fede""... il maseratume© e i ferrarume© ormai vi ha sottomesso.... ",,,,,,,,,,,,,,
Servizio a dir poco scadente in concessionaria BMW,https://www.bmwpassion.com/forum/threads/servizio-a-dir-poco-scadente-in-concessionaria-bmw.172012/,2011-10-25 00:00:00,erz,,Salve a tutti vorrei chiedere a qualcuno di voi se vi è mai capitato questo bel servizio che ha fatto a me la mia concessionaria bmw venerdi mattina porto l'auto in concessionaria per l'aggiornamento del cambio e la sostituzione di un tubo dell'olio del cambio mi dicono che il pomeriggio alle ore 17 l'auto è pronta quando arrivo li a riprendere l'auto trovo una bella sorpresa il meccanico che stava lavorando sulla mia auto dopo aver finito l'aggiornamento al cambio che si deve fare a motore acceso per un paglio di ore è andato a cambiare il tubo dell'olio e mentre cambiava questo tuba è andato a sbattere a 2 tubi dell'acqua che sono scoppiati e quindi li hanno ordinati nuovi.la cosa bella è che da venerdi a oggi io sto ancora a piedi non mi hanno datto neanche un auto e mi vogliono fare pagare anche una percentuale sui danni che ha fatto il loro meccanico è proprio uno schifo servizio......... ,,,,,,,,,,,,,,
Assistenza KIA: alla larga!!,https://forum.quattroruote.it/threads/kia-italia-veniamo-ci-incontro.117025/,2018-05-04 00:00:00,Nicola21081967,,Sintetizzo: 23/04 entra in officina Kia Carens 52.000 km. quindi ancora in garanzia dichiaro che la macchina perde potenza mentre sono in fase di accellerazione loro verificano e confermano il problena. Oggi 04/05 non hanno ancora risolto. io avanzo richiesta di venirmi incontro nelle spese che sto affrontando che sono 55.00 € al giorno macchina sostitutiva per uso lavoro ( Taxi ) ........La loro risposta é stata questa: Buongiorno Sig. Vitrani desideriamo informarla che le nostre condizioni di garanzia non prevedono alcuna forma di risarcimento per un’evenienza di questo genere. Nello specifico ci permettiamo di ricordarle che il cliente al momento dell’acquisto si impegna ad accettare tutte le clausole contrattuali riportate nel “Libretto di Garanzia e Manutenzione” che disciplinano i rapporti tra il cliente stesso ed il Costruttore con particolare riferimento al capitolo “voci non coperte da garanzia”. A pagg. 6/7 potrà facilmente verificare che le condizioni di garanzia non prevedono alcuna forma di rimborso per il “… mancato utilizzo del veicolo …” o per le “… perdite economiche o altri danni indiretti ….” nonché per i “… mancati guadagni ed ogni altra spesa o richiesta danni…”. Il fatto occorso – pur comprendendone il momentaneo disagio - riteniamo possa far parte dei fatti imprevedibili inerenti allo svolgimento di ogni attività autonoma o imprenditoriale ( leggasi rischio d’impresa ) . Conclusivamente la nostra società non avendo oltretutto preso parte al rapporto negoziale intercorso tra lei e la concessionaria è tenuta a rispondere unicamente nei limiti della garanzia contrattuale di buon funzionamento beninteso laddove ne ricorrano i presupposti per la sua applicazione rimanendo pertanto esclusa qualsiasi altra forma di rimborso. Ne deduco che potrebbero passare anche 2/3 mesi per ripararla tanto il contratto che firmiamo in fase d'acquisto non ci tutela in nessin modo ! .... A Voi le conclusioni.... ,,,,,,,,,,,,,,
Decisament OT ma cvd,https://forum.quattroruote.it/threads/decisament-ot-ma-cvd.94123/,2015-02-13 00:00:00,JigenD,'.....qui se non scrivono 2 ex..... Melego e il sottoscritto..... Son 10 gg che non si muove foglia ',si vede che non abbiamo nulla da segnalare...almeno fino a quando mazda italia non ce ne combinerà un'altra delle sue ,,,,,,,,,,,,,,
Scénic XMod - Topic Ufficiale,https://forum.quattroruote.it/threads/sc%C3%A9nic-xmod-topic-ufficiale.14456/page-150,2010-09-06 00:00:00,FSA,,E se semplicemente il portaocchiali fosse stato progettato per contenere gli occhiali da vista di chi ha l'obbligo di lenti alla guida ? In fondo l'aspetto sicurezza ha un'importanza enormemente maggiore. Ora che ci penso anche nel bellissimo portaocchiali a scomparsa della Serie E Mercedes ci stanno solamente occhiali da vista: adesso vado a controllare sul forum Mercedes se qualcuno s'è lamentato a questo proposito ! ,,,,,,,,,,,,,,
Chrysler -  V6 Phoenix/Pentastar,https://www.autopareri.com/forums/topic/32229-chrysler-v6-phoenixpentastar?&page=6#comments,2009-04-15 11:21:51,simonepietro,,Da congress com ,,,,,,,,,,,,,,
Finanziamento clio o contanti?,https://forum.quattroruote.it/threads/finanziamento-clio-o-contanti.115197/,2018-03-06 00:00:00,Madmazz,'è stato più volte dimostrat anche da inchieste delle riviste specializzat che non è sempre così.',"Si ma si deve avere un fratello commercialista non è che tutti noi abbiamo tempo e soprattutto le competenze per ""decifrare"" se un finanziamento convenga o meno... Non ultimo: io parto sempre da un presupposto nessuno ci regale niente quindi se tu mi proponi un qualcosa lo fai perchè conviene a te non a me. ",,,,,,,,,,,,,,
decadenza best 4 e tagliandi,https://www.bmwpassion.com/forum/threads/decadenza-best-4-e-tagliandi.167543/page-4,2011-11-20 00:00:00,istrice,"'E' vero che ogni conc. e' un'azienda privata ed agisce autonomament ma BMW Italia dovrebbe lei stessa proporre i tagliandi a prezzo fisso a secondo dei vari chilometraggi.Sarebbe piu' serio e trasparente.E' questo che mi urt il prezzo ""variabile"" da luogo a luog piu' ancora che i55 0 70 € all'ora della manodopera.Saluti Il Luca'",Certo che bisogna essere al limite dei delinquenti per far pagare un c...o di tagliando 500 euro.Bmw...ma come tutte le case automobilistiche di un certo livello....sono imbarazzanti.55 euro all'ora di manodopera ? ma manco gli strozzini prendono cosi tanto.Imbarazzante davvero e sicuramente se non si faranno tutti i tagliandi in bmw la best 4 decaderà....nonostante la legge dica il contrario.Perchè siamo in Italia....e qui la legge viene sempre dopo il profitto. ,,,,,,,,,,,,,,
Maserati Ghibli 2017,https://www.autopareri.com/forums/topic/65911-maserati-ghibli-2017?&page=27#comments,2018-03-26 12:23:04,Matteo B.,,Terzo Mondo. e vogliamo parlare di globalizzazione digitale export società moderna. invece di usare gente veramente in gamba coi Big Data ( che il Fisco italiano ha eccome in mano ) fanno la merda medioevale come con Troisi e Benigni ,,,,,,,,,,,,,,
Fiat Punto EVO (Topic Ufficiale - 2009),https://www.autopareri.com/forums/topic/34839-fiat-punto-evo-topic-ufficiale-2009?&page=22#comments,2009-09-02 18:32:29,DreamCar,,Cos'è la nuova frontiera dell'assunzione senza impegno ? ,,,,,,,,,,,,,,
Volvo S40/V50 restyling - foto ufficiali,https://www.bmwpassion.com/forum/threads/volvo-s40-v50-restyling-foto-ufficiali.39436/,2003-05-23 00:00:00,El Nino,,Migliorano davanti peggiorano dietro sopratutto la berlina.I vecchi fanali posteriori erano meglio.Interni invariati.La C30 NON subirà restyling ,,,,,,,,,,,,,,
quale zafira scegliere?????,https://forum.quattroruote.it/threads/quale-zafira-scegliere.108407/page-2,2017-03-18 00:00:00,ml14,,CHiedo scusa se qualcuno dovesse sentirsi offeso ma la domanda del topic per uno che la pensa come me è un rigore a porta vuota. Risposta: NESSUNA. ,,,,,,,,,,,,,,
Alfa Romeo Stelvio,https://forum.quattroruote.it/threads/alfa-romeo-stelvio.103307/page-2,2016-06-01 00:00:00,Maxetto883,'Con la speranza che anche la Giulia possa essere proposta fra un annetto con lo stesso V6 diesel perchè avercelo solo sul SUV e non su una sportiva come la Giulia è un peccato non da poco viste le qualità stradali superiori di una berlina rispetto ad un SUV. Sarà anche questo interamente in lega di alluminio?',Io me lo aspetto in alluminio. Lo hanno fatto per il 4 cilindri perchè non farlo per il V6 ? Del resto sarebbe molto utile anche per Maserati avere il diesel in alluminio. ,,,,,,,,,,,,,,
Volkswagen Golf VI (Topic Ufficiale - 2008),https://www.autopareri.com/forums/topic/29826-volkswagen-golf-vi-topic-ufficiale-2008?&page=124#comments,2012-05-02 12:29:05,mmaaxx,,In germania la 1.2 TSI 86CV è sempre esistita ,,,,,,,,,,,,,,
Citroën C3 Picasso (Topic Ufficiale - 2008),https://www.autopareri.com/forums/topic/29433-citro%C3%ABn-c3-picasso-topic-ufficiale-2008,2008-07-07 21:09:20,nucarote,,Non stenterei a crederlo dato che probabilmente il giroporta e forme delle portiere saranno molto simili a questa che non è molto orginale anche se rimane comunque molto Citroen. Però la plancia è simpatica. ,,,,,,,,,,,,,,
Alfa Romeo Mito 1.4 Turbo GPL - Prime impressioni,https://www.autopareri.com/forums/topic/37144-alfa-romeo-mito-14-turbo-gpl-prime-impressioni?&page=3#comments,2010-05-17 21:29:21,TWIN SPARK,,sono giunto a 3600km.... globalmente sono molto soddisfatto dell'auto... devo dire che consumicchia abbastanza...faccio circa 330-350km cn 25 euro di gpl però faccio x il 90% di urbano e nn ho proprio il piede leggero. il motore è bello progressivo e brillante...la differnza benzina gpl se esiste è davvero minima ( forse questa è la cosa più sorprendente ) . l'assetto cn i 18'' è una tavola un vero go-kart...la macchina vira davvero piatta una goduria...è facile e intuitiva anche al limite... molto invasivi invece sono i controlli...forse anche troppo. ottimi i freni meno il cambio...forse la cosa meno riuscità dell'auto... questione DNA: i 3 settaggi sn a mio avviso molto simili tra loro...l'unica cosa che si nota bene è la durezza dello sterzo in D l'erogazione direi che è molto simile in tutti e 3 i settaggi...idem x il resto. per ora mi posso dire molto soddisfatto...voto 8 ,,,,,,,,,,,,,,
Niente da fare nonostante la New leon Seat in Italia non sfonda...,https://forum.quattroruote.it/threads/niente-da-fare-nonostante-la-new-leon-seat-in-italia-non-sfonda.84966/,2014-01-03 00:00:00,topomillo,,i dati di fine anno pur trattandosi sicuramente di un anno nero per molti dicono che Seat è sempre in calo... detto questo per me è tutto scritto. se attendi 3 anni per fare quello che tutti fanno... ( suv tipo tiguan ) .... se non rinnovi la gamma velocemente come fatto per altri modelli del gruppo.... se limiti volutamente le scelte dei potenziali clienti di leon e Ibiza per non rischiare di infastidire golf e polo.-... i risultati poi negativi arrivano sicuro. saluti ,,,,,,,,,,,,,,
Volvo S80 Facelift 2013,https://www.autopareri.com/forums/topic/50692-volvo-s80-facelift-2013?&page=2#comments,2013-02-27 09:50:22,Yakamoz,,La S80 è sempre stata associata a un certo understatement come del resto tutte le grosse berline Volvo mentre le SW erano senz'altro più popolari e sportive. Resta comunque un'auto di classe a parer mio e con un comfort eccellente. Meravigliosi gli interni in radica. ,,,,,,,,,,,,,,
Giulia vs Octavia?,https://forum.quattroruote.it/threads/giulia-vs-octavia.113561/,2017-11-30 00:00:00,mani in alto,,Ma scusate avesse almeno perso ma ha vinto di gran lunga. Comunque non mi sembra il caso di farsi perdere il sonno per così poco dopotutto si tratta solo di una comparativa e pure con esito positivo. I problemi sono ben altri e minacciare di uscire dal forum in cui penso ti trovi bene per una simile bazzecola lo trovo esagerato. ,,,,,,,,,,,,,,
la batcaverna 635csi &co,https://www.bmwpassion.com/forum/threads/la-batcaverna-635csi-co.85405/page-235,2004-05-06 00:00:00,chent,'...Tu Al tra una 635csi ed una M5 E3 potendone acquistare solo un quale sceglieresti?',E' già praticamente mia ! è la che aspetta me ! .... prima gli devo trovare un tetto... come ti dicevo ! Se lascio per strada anche questa mi fanno pagari ICI doppia ! ! almeno ora dorme al coperto...Sono andato a vedermela anche venerdì scorso.... ,,,,,,,,,,,,,,
Alfa Romeo - 3.0 M-Jet V6,https://www.autopareri.com/forums/topic/22754-alfa-romeo-30-m-jet-v6?&page=26#comments,2007-07-24 18:42:08,Scott,,"VM pronto ? Si il loro prototipo costruito sulle loro specifiche e che eroga forse 190cv. Il 3.0 Alfa purtroppo ha bisogno ancora di qualche tempo per essere definito ""pronto"". ",,,,,,,,,,,,,,
Scénic XMod - Topic Ufficiale,https://forum.quattroruote.it/threads/sc%C3%A9nic-xmod-topic-ufficiale.14456/page-151,2010-09-08 00:00:00,andyonos,"""Ciao a tutt sono nuovo di questo foru ho ordinato in data 31/08 la mia nuova x-mod luxe 1.5 dci 110 c bianco ghiaccio con tetto panoramic sensori anterior vetri scuri e ruota di scorta. E' inutile dirvi che non vedo l'ora che arrivi e volevo invece chiedere un'informazione: non ho ben capito come funziona il sistema bluetooth per il telefonin si connette tramite navigatore? Si può interagire con la rubrica del telefono e leggere i messaggi in arrivo sullo schermo del tom tom? Grazie in anticipo e saluti a tutti.""",Complimenti per l'acquisto. Il sistema vivavoce non è collegato al navigatore bensì alla radio. Tutte le varie informazioni le leggi sul cruscotto lato dx del display. Puoi interagine con la rubrica del telefono e gestire una rubrica della xmod. Ovviamente il tutto dipende dalla compatibilità del tuo telefonino ma se è recente non dovrebbero esserci problemi. I comandi sono al volante o meglio dietro al volante. Non credo possa leggere i messaggi ( a me non lo fa ) ,,,,,,,,,,,,,,
Alfa Romeo Stelvio,https://forum.quattroruote.it/threads/alfa-romeo-stelvio.103307/page-36,2017-03-12 00:00:00,?angelo0,"""Ma qui siamo larghi di idee e pieni di inziative http://espresso.repubblica.it/attua...omobiles-un-operaio-si-urina-addosso-1.295154 Ecco una validissima lternativa.... Un bel 1.000 Eurini da investire in pannoloni per gli operai piu' anziani.... ( I giovani che si organizzino megli almeno finche' la Natura glielo consente ancora )""",lascia perdere cé sempre qualcuno che va fuori binario ,,,,,,,,,,,,,,
Citroën C3 2016,https://www.autopareri.com/forums/topic/61528-citro%C3%ABn-c3-2016?&page=28#comments,2016-09-30 08:07:20,gpat,,Su Facebook gira l'annuncio pubblicitario per comprare su internet la mirabolante Facebook Edition al modico prezzo di 15900€ per 129 esemplari... Bisogna registrarsi al sito e se non si fa neanche si riesce a capire cosa c'è nell'allestimento e qual è la motorizzazione ( BlueHDI 75 ) ... se riescono a vendere 129 auto in questo modo mi ci metto pure io a farlo. ,,,,,,,,,,,,,,
UFFICIALE: Alfa Romeo 8c,https://www.bmwpassion.com/forum/threads/ufficiale-alfa-romeo-8c.28656/page-14,2004-02-11 00:00:00,RALLYMAN,"'Non hai idea di che cagata mostruosa sia il cambio Transaxle... bilancia meglio i pes ma i levereggi superlunghi e il cambio in posizione sono la cosa più terribile che possa esistere. Ho un'amico Alfista e ho avuto modo di provare praticamente tutte le soluzioni Transaxle (Alfa 75 e derivate) e non posso che dire ""che vaccata"" il cambio è lung poco preciso e gratta inesorabilmente nelle marce basse (roba da mettere la terza con la doppietta altrimenti gratt su macchine di 35'000Km...)'",Già infatti è una Fiat...Scherzo ! Molto bella davvero.Ma dico ci voleva tanto a tirarla fuori prima ? ? ? ,,,,,,,,,,,,,,
Nuova GS 450h bollo?,https://forum.quattroruote.it/threads/nuova-gs-450h-bollo.70486/,2012-10-21 00:00:00,tzio,'Qualcuno mi sa chiarire quanto paga di bollo e superbollo o super tassa. Praticamente cosa costa in tasse?',Vedo che dalla IS250 vuoi fare il salto di qualità ! Bravo ! provo a calcolare e ti dico. ciao ,,,,,,,,,,,,,,
Porsche 911 Carrera e Carrera S 2012,https://www.autopareri.com/forums/topic/44205-porsche-911-carrera-e-carrera-s-2012?&page=15#comments,2013-06-04 21:33:45,lukka1982,,Esteticamente bellissima imho ottima reintrerpretazione dei Fuchs e dettaglio vintage al posteriore fichissimo ! ! ! Rispetto alla 911 40th Anniversary è però poca cosa ( a livello di contenuti implementati ) ... ,,,,,,,,,,,,,,
Honda Jazz 2015,https://www.autopareri.com/forums/topic/52278-honda-jazz-2015?&page=28#comments,2017-03-22 16:23:13,skizzo_85,,in rete ufficiale se è un tagliando vero quindi con cambio olio e tutti i filtri 300 euro è la normalità... purtroppo se la macchina è in garanzia sei quasi obbligata a farlo li dopodichè io farei ciao con la manina e vado da un meccanico ( serio ) ma generico. ,,,,,,,,,,,,,,
Concessionaria Autobavaria Conegliano maleducazione incredibile,https://www.bmwpassion.com/forum/threads/concessionaria-autobavaria-conegliano-maleducazione-incredibile.95058/page-3,2009-04-24 00:00:00,Felis,,Per fortuna che era Battiston in crisi ( secondo un illustrissimo utente -poi sparito- che voleva querelarmi ) ,,,,,,,,,,,,,,
Alfa Romeo 159 2005,https://www.autopareri.com/forums/topic/13571-alfa-romeo-159-2005?&page=392#comments,2005-07-01 06:49:46,Wilhem275,,Per favore tutti quanti... parlate di 940 e 169 nei topic appositi non disperdiamo le informazioni... ,,,,,,,,,,,,,,
Fiat Freemont 2011,https://www.autopareri.com/forums/topic/41568-fiat-freemont-2011?&page=269#comments,2012-05-22 12:30:17,ilpaco75,,Domanda per tutti: qualcuno ha capito come aggiornare le mappe del navigatore ? io abito in una piazza relativamente nuova e non risulta su garmin mentre sul TomTom che ho su Iphone c'è... Grazie PS x M_a_x a me il venditore ha sconsigliato di ordinarla perchè ci avrebbe messo 5-6 mesi ad arrivare.. e infatti ho optato per una vettura già in stock. Certo che per Fiat avere in pratica solo un modello del segmento da vendere e consegnarlo dopo 5-6 mesi dall'ordine.. Comunque conta circa 70-90 giorni per produrla 30 giorni per portarla qua e altri cira 20-30 per sdoganarla montare i paraurti e fare le varie messe a punto... son circa 6 mesi purtroppo.. ,,,,,,,,,,,,,,
Lancia Delta Facelift (Topic Ufficiale - 2011),https://www.autopareri.com/forums/topic/27109-lancia-delta-facelift-topic-ufficiale-2011?&page=127#comments,2008-03-01 18:38:13,Betha23,,Stesso blu della Bravo....... mi sembra il blu notturno........ ,,,,,,,,,,,,,,
Ford Focus 1.6 tdci 90 cv: la cinghia distribuzione,https://forum.quattroruote.it/threads/ford-focus-1-6-tdci-90-cv-la-cinghia-distribuzione.23340/page-6,2014-08-31 00:00:00,folez,,ciao a tutti sono un nuovo iscritto anch'io come molti devo cambiare la cinghia alla mia focus 1.6 90cv 97000km all'attivo il mio meccanico mi ha detto posso arrivare anche a 100 110000 voi cosa mi consigliate. Grazie ciao 8 ) ,,,,,,,,,,,,,,
Provocazione per gli esterofili...,https://www.autopareri.com/forums/topic/12512-provocazione-per-gli-esterofili?&page=5#comments,2005-04-17 10:18:56,126/131,,josef c'è da dire che hai ragione e ci troviamo abbastanza d'accordo soprattutto col cx..l'unica cosa è che io preferisco le mercedes che le audi ( sono solo gusti ) ... ,,,,,,,,,,,,,,
