Titolo,URL,Timestamp,User,(Testo Citato),TESTO,Costruttore,Modello,Brand,Interni,Esterni,Meccanica,Prestazioni,Consumi/Autonomia,Motore,Elettrico,Fuoristrada,Elettronica di Bordo,Manutenzione,Assistenza/Concessionari
Kia Sportage - Ordini e tempi di consegna,https://www.autopareri.com/forums/topic/41594-kia-sportage-ordini-e-tempi-di-consegna?&page=22#comments,2011-02-23 15:40:37,Wishlist,,Buon pomeriggio a tutti credo d'essere stato fortunato New Sportage 1.7 CRDi Class 2WD Black Pearl con Navi contratto firmato il 19/11/2010 e consegna prevista per fine marzo.... venerdì 18 febbraio ricevo una chiamata dalla concessionaria ( zona sud Milano ) ... è arrivata l'auto ! ! ! ! Colto totalmente alla sprovvista mi organizzo e mi fiondo a saldare martedì 22 febbraio. Se tutto va bene entro sabato dovrei ritirarla...sono troppo ottimista ? ? ? ,,,,,,,,,,,,,,
Consiglio acquisto gt 2000 veloce,https://forum.quattroruote.it/threads/consiglio-acquisto-gt-2000-veloce.119972/,2018-12-21 00:00:00,FAUST50,,Pare veramente tenuta molto bene e restaurata alla grande. ,,,,,,,,,,,,,,
Centralina Mazda 2 1.3 benzina 86cv,https://forum.quattroruote.it/threads/centralina-mazda-2-1-3-benzina-86cv.83183/,2013-11-12 00:00:00,melego73,,di filtri non c'e' molta scelta c'e' il BMC o il K&N che sono assolutamente analoghi se non identici. Ma fanno solo piu' rumore e ottieni poco o niente. L'unico vantaggio e' che lo lavi e non lo cambi piu'. ,,,,,,,,,,,,,,
la batcaverna 635csi &co,https://www.bmwpassion.com/forum/threads/la-batcaverna-635csi-co.85405/page-289,2012-02-03 00:00:00,edoardo z,,come no ? ,,,,,,,,,,,,,,
Ho comprato l' Opel ADAM !!,https://forum.quattroruote.it/threads/ho-comprato-l-opel-adam.77467/,2013-04-30 00:00:00,MiticoFish,,[/quote] Bella non c'è che dire... ma con tutti quegli optional quanto l'hai pagata ? [/quote] non mi va di scrivere il prezzo preciso tra i 17 e i 19 ,,,,,,,,,,,,,,
Problemino nuova kit frizione...,https://forum.quattroruote.it/threads/problemino-nuova-kit-frizione.117270/,2018-07-01 00:00:00,alessio2894@gmail.com,,Come da titolo ho fatto fare la frizione della mia Peugeot 206 1.4 hdi anno 2006 solo che ora quando parto avendo la marcia in prima la macchina e come se strappa e fa una forte vibrazione tanto da sentirsi anche da fuori dell abitacolo volevo porre la domanda se è normale se magari ce bisogno che la frizione si assesti.... ,,,,,,,,,,,,,,
Finalmente novità e con nome Italiano. TIVOLI,https://forum.quattroruote.it/threads/finalmente-novit%C3%A0-e-con-nome-italiano-tivoli.92491/page-2,2015-06-05 00:00:00,mommotti,"topomillo ha scritto: mommotti ha scritto: Il benzina dev'essere un polmone pazzesco......e il diesel chissà!! Immagino e spero stiano lavorando a qualcos'altro sul fronte benzina... io penso invece che in molti troppi sbagliano motore...e non solo su questa macchina ma in generale.. a molte persone ho consigliato suv medi...con i classici 1600cc-1700 cc a benz apsirati. zero problem motori solid poche vibrazion zero problemi di centraline e fap... se si percorrono i classici 10000 km anno il tdi è uno spreco senza senso... confermo arriva il gpl e tdi.... Certo con quel chilometraggio il diesel è senza senso. Ma nel caso un bel benzina turbo low pressure è altra cosa.... costano di più... "" topomillo ha scritto: mommotti ha scritto: Il benzina dev'essere un polmone pazzesco......e il diesel chissà!! Immagino e spero stiano lavorando a qualcos'altro sul fronte benzina... io penso invece che in molti troppi sbagliano motore...e non solo su questa macchina ma in generale.. a molte persone ho consigliato suv medi...con i classici 1600cc-1700 cc a benz apsirati. zero problem motori solid poche vibrazion zero problemi di centraline e fap... se si percorrono i classici 10000 km anno il tdi è uno spreco senza senso... confermo arriva il gpl e tdi.... Certo con quel chilometraggio il diesel è senza senso. Ma nel caso un bel benzina turbo low pressure è altra cosa. "" mommotti ha scritto: Il benzina dev'essere un polmone pazzesco......e il diesel chissà!! Immagino e spero stiano lavorando a qualcos'altro sul fronte benzina... io penso invece che in molti troppi sbagliano motore...e non solo su questa macchina ma in generale.. a molte persone ho consigliato suv medi...con i classici 1600cc-1700 cc a benz apsirati. zero problem motori solid poche vibrazion zero problemi di centraline e fap... se si percorrono i classici 10000 km anno il tdi è uno spreco senza senso... confermo arriva il gpl e tdi. ""Il benzina dev'essere un polmone pazzesco......e il diesel chissà!! Immagino e spero stiano lavorando a qualcos'altro sul fronte benzina""",Chi non paga non gode ! ( nuovo proverbio lo brevetto ) . :lol: ,,,,,,,,,,,,,,
Scoprendo la Venga...,https://forum.quattroruote.it/threads/scoprendo-la-venga.40137/,2010-11-02 00:00:00,matto80,,Bè se fosse così Kia questa se la poteva pure risparmiare visto che in generale l'auto è ben fatta. Diciamo che però sicuramente il fatto che non sia silenziosissima non è dovuto solo al fatto che manca quel pannello ma anche che non sia molto insonorizzata la parte interna della plancia. Ora vedo se trovo il link dove lo vendono su internet sennò vedo di farmelo fai-da-me. ,,,,,,,,,,,,,,
Finalmente tomplayer funziona su carminat tom tom,https://forum.quattroruote.it/threads/finalmente-tomplayer-funziona-su-carminat-tom-tom.47842/page-7,2014-03-11 00:00:00,xxlucianoxx,,Salve ragazzi io ho una clio con carminat e telecomando bluetooth e siccomeil vecchio proprietario aveva usato tomplayer ora non funziona più il telecomando bluetooth quando si inserisce la scheda del navi.. esiste un rimedio l problema perchè usando tomplayer funziona tutto mentre col navi non funge il telecomando. Grazie ! ,,,,,,,,,,,,,,
CHEVROLET CRUZE che ne dite?,https://forum.quattroruote.it/threads/chevrolet-cruze-che-ne-dite.2101/page-20,2013-11-02 00:00:00,donadelg,,Non sono tutte così la mia diesel 163cv 6m manuale con più o meno lo stesso chilometraggio è stata in officina solo per i tagliandi. L'esemplare sfortunato ci può essere per ogni casa automobilistica e capisco il tuo disappunto visto che l'hai pagata con soldi buoni ma l'unico modo di venirne fuori è pressare la concessionaria e Chevrolet Italia a trovare una soluzione ai problemi. ,,,,,,,,,,,,,,
salve!,https://www.bmwpassion.com/forum/threads/salve.330463/,2018-06-28 00:00:00,nikrm89,,salve a tutti finalmente sono contento di potermi fare un accont su questo forum. sono di roma e ho da poco preso una 120d f20 nera busines st8 usata dal vircuito BPS ,,,,,,,,,,,,,,
Mondiale F.1 - GP degli Stati Uniti,https://forum.quattroruote.it/threads/mondiale-f-1-gp-degli-stati-uniti.118909/page-6,2018-10-20 00:00:00,pilota54,,Chinchero intervista Arrivabene: https://it.motorsport.com/f1/news/a...ro-mercedes-non-siamo-squadra-sbando/3197611/ ,,,,,,,,,,,,,,
TRENT'ANNI DI 190,https://forum.quattroruote.it/threads/trentanni-di-190.71572/page-4,2012-12-26 00:00:00,fabiologgia,"""Effettivamente la ragazza poteva essere in preda al dilemma :!: Fra un amore serio e da matrimonio e un eros avventuroso anche se con un'aria leggermente ...venditore di datteri :lol: All'epoca degli hippies e del beat ma anche in quella degli yuppies il dilemma si faceva serio e per fortun molte potevano avere la tentazione anche se momentanea di salire sia sull'A112 abarth che sulla Mercedes Benz...in attesa di avere le idee più chiare concedendo anche ai non figli di papà la loro chance .""",Bellissima quella del venditore di datteri ! E comunque la tua conclusione è sacrosanta e dimostra che le auto sono cambiate...... le ragazze no ! Saluti ,,,,,,,,,,,,,,
Lancia Delta Facelift (Topic Ufficiale - 2011),https://www.autopareri.com/forums/topic/27109-lancia-delta-facelift-topic-ufficiale-2011?&page=931#comments,2013-02-25 10:17:15,Merak,,Ma perchè tirare fuori i 18' della Bravo ? Avevano già questi pronti corenti con quelli della Ypsilon.. ,,,,,,,,,,,,,,
Ford Fiesta (Topic Ufficiale - 2008),https://www.autopareri.com/forums/topic/28421-ford-fiesta-topic-ufficiale-2008?&page=92#comments,2009-09-22 13:30:37,Soke86,,Ciao a tutti ! alla fine mi sono orientata sulla fiesta 1.4 gpl...sabato la vado ad ordinare ! ! ! ^_____^ scelta giusta ? ? ,,,,,,,,,,,,,,
Mi presento,https://www.bmwpassion.com/forum/threads/mi-presento.332560/,2005-01-31 00:00:00,Mauretto,,Buon giorno a tutti mi presentoSono Roberto risiedo a Brindisi ma sono in giro per il nostro bel paese la mia auto è una 320D touring del 2005 e insieme abbiamo fatto un bel pò di strada.Saluti..... ,,,,,,,,,,,,,,
Fiat Panda Novità al 31/07/2018,https://forum.quattroruote.it/threads/fiat-panda-novit%C3%A0-al-31-07-2018.118045/,2018-11-08 00:00:00,danilorse,'Panda in offerta a 7000 eur dove sta la fregatura? E soprattutto in strada quanto ci costerà effettivamente? https://dpromo.fiat.it/panda?campai...MI3ZH0tPPE3gIVB5ztCh0SpAxcEAAYASAAEgKDovD_BwE https://www.drivek.it/fiat/panda/1-2-69cv-e6-pop-1000059041/ Ma invece di fare prezzi civetta (Importo Totale Dovuto € 8.63 9 anzichè 8.500) che poi sul posto cambieranno in modo sostanzios non sarebbe meglio una maggiore trasparenza e chiarezza?',7.000€ e' il prezzo con finanziamento altrimenti l'offerta e' a 8.500€ che sono sempre 2.900€ in meno del listino ( si parla della 1.2 Pop ) . Fanno tutti cosi'. Bisogna poi vedere se in concessionaria sono disponibili le versioni base altrimenti si sale di allestimento e prezzo. ,,,,,,,,,,,,,,
sito interessante casistica guasti più noti,https://www.bmwpassion.com/forum/threads/sito-interessante-casistica-guasti-pi%C3%B9-noti.43767/,2005-06-11 00:00:00,PuccioE39,,"dopo averlo aperto cliccate su ""schede guasti""guardacaso è riportato anche il caso dell'aletta sul collettore di aspirazione della 320d 150cv.. http://www.gruppostima.it/ ",,,,,,,,,,,,,,
Lancia Ypsilon 2011,https://www.autopareri.com/forums/topic/41885-lancia-ypsilon-2011?&page=140#comments,2011-06-17 12:41:53,MotorPassion,,è voluto infatti le linee esterne si ispirano alla Ardea e per mantenere l'effetto retrò per quello che riguarda gli interni si ispirano alla Ypsilon degli anni '90 con relativa tecnologia: ricircolo azionabile con levetta volante regolabile solo in altezza ( i progettisti in realtà per rispettare il puro stile retrò volevano il volante fisso ) assenza degli appoggia testa posteriori finestrini posteriori manuali ... :mrgreen: ,,,,,,,,,,,,,,
Ferrari 430 Scuderia (Topic Ufficiale - 2007),https://www.autopareri.com/forums/topic/28567-ferrari-430-scuderia-topic-ufficiale-2007?&page=4#comments,2007-07-18 23:08:38,luc@,,Il fascione è la griglia challange già disponibile sulle 430 normali. ,,,,,,,,,,,,,,
MX-5 da 184 cv,https://forum.quattroruote.it/threads/mx-5-da-184-cv.117030/page-3,2018-09-09 00:00:00,pilota54,"'Rispetto alla ""base"" 1.5 questa versione da 184 CV scava un solco important immagino che ci siano differenze anche in termini di assetto notevoli (oltre al differenziale autobloccante che già c'era sulla 2.0 da 160 CV). Speriamo che la provino per raccontarci qualcosa in più!'",Eccoti accontentato ! Prezzi da 31.500 euro. Ora ci si attande la risposta dell'Abarth. In USA hanno già aumentato la potenza vedremo in Europa..... https://www.quattroruote.it/news/pr...el_year_2019_al_volante_della_2_0_184_cv.html ,,,,,,,,,,,,,,
Yaris Hybrid,https://forum.quattroruote.it/threads/yaris-hybrid.110365/page-4,2017-06-16 00:00:00,etienne1,,Io ho la Yaris diesel di 10 anni fa e devo dire che è un ottimo motore e ha una bella ripresa. Adesso sto aspettando che mi arrivi la nuova yaris presa di nuovo a gasolio visto che non abito in città e poi conosco bene questo motore e sono soddisfatto ,,,,,,,,,,,,,,
Affidabilità mazda,https://forum.quattroruote.it/threads/affidabilit%C3%A0-mazda.3566/page-9,2012-12-06 00:00:00,X-man8,,Certo che non ti capisco melego. Da quello che hai scritto fino a qualche post fa sembra che la tua Mazda sia la peggiore auto in circolazione poi piano piano hai puntualizzato e ne esce che il solo problema è il motore che è ruvido sotto i 2000 giri ( ma quello di altri utenti va bene anche in quelle condizioni ) adesso sembra che sia colpa dello scarico che hai modificato... ma allora sta macchina non è poi così male... anzi è una super-macchina ! Evviva la ( le ) Mazda ! ,,,,,,,,,,,,,,
Questa ingombrante ruota di scorta. Cosa ne pensate?,https://www.autopareri.com/forums/topic/14281-questa-ingombrante-ruota-di-scorta-cosa-ne-pensate,2005-07-16 02:17:05,frallog,,Beh si anche li' a patto che non distrugga l'aereodinamica del frontale ( la parte frontale e' importante perche' essa e' altamente deportante ) . Comunque si tratta di una soluzione pensata solo per il caso dei carichi eccezionali ! Ciao anche a te egregio Toni Regards Francesco 8 ) ) ) ,,,,,,,,,,,,,,
Lancia Delta Facelift (Topic Ufficiale - 2011),https://www.autopareri.com/forums/topic/27109-lancia-delta-facelift-topic-ufficiale-2011?&page=111#comments,2008-02-20 15:20:33,calatrava,,Beh...in tal senso hai ragione ,,,,,,,,,,,,,,
BMW AUTOABRUZZI PESCARA un disastro,https://www.bmwpassion.com/forum/threads/bmw-autoabruzzi-pescara-un-disastro.152075/,2011-02-09 00:00:00,WISCONSIN,,"Salve a tutti vi racconto qui le mie disavventure con l'autoabruzzi di pescara. Premesso che sono proprietario di una 740 d e di una 645 ci coupè nonchè sono stato proprietario di altre decine di bmw dal 99 ad oggi e premesso che ho avuto esperienze anche con officine in altre regioni d'italia quello che mi è successo con loro francamente è riprovevole:La mia 7er non và non si capisce cosa stia accadendo. Vivo a Montesilvano da un pò quindi mi reco in officina per un controllo. Un capofficina mi indica il tecnico con cui parlare camice bianco e computer alla mano diagnosi e.......nulla tutto ok la macchina è a posto. Non soddisfatto della risposta in quanto la macchina la conosco troppo bene e per me non và ma il tecnico mi dice testualmente"" ma lei ne vuol sapere più di noi che ci lavoriamo tutti i giorni con queste auto ? ? ? "" bah salgo in macchina e vado via.....500 mt e fumatona bianca. Torno indietro pian piano rientro in officina e la sentenza è turbina bancata destra rotta. ma come 5 minuti prima era tutto ok....lascio la macchina e chiedo comunque un preventivo mi chiamano dopo 3 giorni e mi comunicano il prezzo 3723 00 euri per una turbina.......azzzzzzzzz.Mi riprendo la macchina e mi reco da un meccanico privato a teramo mi è stato vivamente raccomandato e con 1800 euri cambio la turbina faccio il tagliando e le pasticche ant e post della mia 7 er. che dire meno della metà ed il triplo dei lavori.Dopo un pò di tempo il cambio fa le bizze in rilascio e con 7 quasi ferma il cambio da qualche strattone. Nuova visita alla autoabruzzi. Sentenza il cambio ha dei problemi la deve lasciare per controlli ulteriori. la lascio di nuovo e dopo altri 2 giorni mi mandano il preventivo per mail risultato ? ? ? sostituzione completa del cambio per soli 9300 00 eurini e che sono per una 7er. Vado in officina parlo col capofficina che mi dice"" signore mio la macchina ha 123000 km quindi è normale che il cambio si possa rompere ! ! ! ! ! ! "" Rompere ! ! ! ! ! ! ma come solo 123000 km ed il cambio si rompe ! ! ! ! 100000 euri di macchina ed il cambio è da sostituire ? ? ? ? mah....non convinto mi riprendo il mio giocattolone e lo riporto dal meccanico di Teramo esce in prova torna smonta il filtro olio delcambio automatico cambia l'olio ed il filtro controlla la centralina elettronica con suo computer e.......magicamente la 7er torna come prima anzi meglio di prima.Ma le sorprese non sono ancora finite dopo un paio di giorni mi chiama l'autoabruzzi per darmi delle comunicazioni ma devo recarmi in conce vabbè dico io vengo e.....udite udite....mi presentano una fattura di 675 00 euri per:controllo cambio automaticoreset centraline e nuovo software centraline cambiiosostituzione olio e filtro cambio automatico ( ma quando ) materiali vari di consumo mano d'opera etc etc675 00 euri che non gli do ovviamente ed anzi gli dico fatemi scrivere dal vostro legale......autoabruzzi sparita ed ora i miei gioiellini li faccio sistemare quando serve proprio dal meccanico di Teramo che ne sa una più del diavolo su queste macchine ma non mi ha mai voluto dire i suoi segreti.....e bravo Lucio il meccanico ",,,,,,,,,,,,,,
Salvatela o vendetela,https://forum.quattroruote.it/threads/salvatela-o-vendetela.119957/page-47,2019-02-04 00:00:00,?angelo0,"""Germania mercato da alfa unico ormai gira e rigira si è capito è l'italia... Però ci sarebbe un modo per invertire la logica tendenza di non vendere alfa in germani anzi sarebbe unico modo per far fare numeri decenti e avere una vera gamma di alfa... E la produzione non penso proprio la farebbero in Germania... Purtroppo ormai la cosa non avverrà più.""","Io dico che tu il tedesco Il Tedesco"" non lo conosci. Se ti dicessi che nel Baden Baden i vecchi Tedeschi gli parli di Fiat e gli chiedi a chi appartiene il marchio di rispondono che é un marchio tedesco…. Ricordo che nel 1973 ho letto una Nota sul Frankfurt Allgemeine zeitung dove diceva che la Fiat lasciava la Germania per amore di patria.... in un certo senso era vero la Fiat si ristrinceva dentro le mura italiane. Personalmente oggi Credo che i nostri poilitici ci hanno messo lo zambino. Cmq di certo é stato uno sbaglio Secondo me avrebbero dovuti allargarsi di piu in Germania.Cmq non é di questo che vogliamo parlare. Io sono piu che sicuro che la Germania sia un mercato per Alfa se tutto vada avanti con prodotto Giulia Stelvio e le future Alfe per la triade sarebbe una avversaria valida dove lo stesso tedesco quei Tedeschi che sono stufi dei prezzi alti che Ha la triade. Per non pensare gli amanti Alfa Romeo che non sono pochi. La Cosa che la farebbe accettare di piu e proprio il fatto che questa venisse costruita in Germania che significano posti di Lavoro. n Nessun tedesco dofrebbe giustificare perché ha comprato straniero quando si hanno macchine valide tedesche con i vicini di casa. Proprio il vicino di casa di fronte a me mi ha dato una prova quando ha visto la Stelvio davanti casa.Mi ha raccondato che nel 2009 voleva comprarsi una 159 SW gli piaceva molto ma il parlarne con amici e letto di cose negative ( Pesante consuma troppo ecc ) ha lasciato perdere per prendersi poi la BMW sopratutto per la TP. Anche a me quando si parla di macchine la prima parola é tu che hai una Fiat o una Alfa Romeo. ​ ",,,,,,,,,,,,,,
Nuova Kia Rio 2011,https://forum.quattroruote.it/threads/nuova-kia-rio-2011.53302/page-112,2012-04-17 00:00:00,akula90,"""Il problema dicono che e' stato il colore bianc assurdo secondo me ho preso la versione lx in attesa che arrivi al piu' presto (speriamo) x akula90. i venditori delle concessionarie prendono delle provvigioni sulle auto ordinat o meglio vendut poi le attese anche se sono lunghe a loro gli interessa poc così facendo non hanno capito che si mettono in cattiva luc io ho trovato diverse lacune....ma non voglio infangare o tantomeno far capire che sono contr la macchina lo presa e me la tengo con i suoi pregi e difetti....cmq se fossi in te farei 2 cose important 1) una bella lettera di protesta alla kia italia. 2) una lettera dal tuo avvocato con l'annullamento del contratto o quantomeno devono risarcirti in qualche modo dei danni subiti nn avendo rispettato il contratto( la legge prevede un massimo di mesi 4 se nn sbaglio. cmq la kia dovrà sopportsrmi per ben 7 lunghi anni e chiederò i miei diritti sfruttando al massimo la garanzia.""",Ti premetto che il concessionario mi aveva detto che se voglio l'auto subito entro una settimana gli dovevo saldare subito la differenza nonostante avergli dato un auto come anticipo la chiama ( procedura d'urgenza ) cioe' pagare un auto senza vederla e dopo 7 mesi una vergogna il problema che se io faccio la disdetta del contratto credo di fargli soltanto un favore in quanto ha guadagnato sulla vettura da me consegnata e mi tornerebbe soltanto il valore dell'auto ciao ! ! ! ! ! ,,,,,,,,,,,,,,
Vasca da bagno,https://www.autopareri.com/forums/topic/24674-vasca-da-bagno?&page=2#comments,2007-08-30 11:19:08,duetto80,,Si ma qua si tratta di allagamento non di infiltrazioni. Scusa se insisto Net i finestrini confermi che erano TUTTI PERFETTAMENTE chiusi non è che il portellone era appoggiato e non chiuso ? ? ? ? Quando l'hai lavata non ti è mai capitato di trovare pesciolini all'interno ? ? ,,,,,,,,,,,,,,
Consiglio Acquisto:Renault Laguna 4Control 2.0 150cv,https://forum.quattroruote.it/threads/consiglio-acquisto-renault-laguna-4control-2-0-150cv.50637/page-4,2011-08-22 00:00:00,manuel46,"""Probabilmente il vero problema è il mio stile di guida.... non necessariamente perchè schiacci cerco tante volte di passeggiare....Altrettante sono le volte che invece vado di fretta e quindi mi muovo velocemente con sorpassi e infilate qua e l stile scooter!!! Ti premetto che provengo da una Stilo 115cv....leggera e veloce! Prima di acquistare la mia attuale auto l'ho provat ma non è come possederl alla fine ti accorgi di certi limiti. Ripet era lo spazio che cercav in una wagon o monovolum una volta comprata per e guidandol non mi son sentito tanto soddisfatto delle sue doti dinamich nel misto stretto veloce si sente molto la sua mol non puoi fare granch poi sui consum mi sono fatto un viaggio di 5000 km (bello) alla media di 1 andando sui 120 !!!! Qui allora ho cominciato a pensare di cambiare aut soprattutto oggi che questo gasolio sale sale e non scende mai...Perciò ho chiesto l'informazione sull'effettivo consumo della Lagun ( visto il suo minor peso e altezza dovrebbe essere inferiore e se il divario tra i consumi può ammortizzare negli anni l'acquisto di un'altra aut sempre usata. Mi interessa in particolare la 150 c se parliamo della tua 18 poi portata a 21 per forza di cose il consumo non può essere interessante per me.......Che mi dici? La Laguna 150 può far meglio dei miei 1 7? Saluti""",Credo che a 120kmh costanti i 13-14 li porto a casa io con una megane sw 1.6 a benzina 115cv euro4......la tua stilo mi sembra bevesse parecchio credo che un turbodiesel recente a 120 costanti dovrebbe fare almeno i 17.......correggetemi se dico una stronzata comunque è un po' che non faccio autostrada con la mia ma a 130 di tachimetro il cdb mi indica che sto sui 8lx100km..... ,,,,,,,,,,,,,,
Autobavaria San Fior TV,https://www.bmwpassion.com/forum/threads/autobavaria-san-fior-tv.78834/page-2,2006-12-20 00:00:00,Sgranfius,"""Insomma l'unico concorrente e pur finalment serio se ne va...monopolio o oligopolio... ma è giusto e corretto?Che si deve fare per far confront andare in altre regioni o città lontane? mah....""",Calmi calmi...gentili nel vendere...maleducati nel service......Il giro di interessi e sbattimenti è diverso.... ,,,,,,,,,,,,,,
Peso/Coppia della 599GTB,https://www.autopareri.com/forums/topic/19008-pesocoppia-della-599gtb,2006-02-26 10:36:11,F40 LeMans,,"credo abbia solo la modalità ""race mode"".. ",,,,,,,,,,,,,,
