Titolo,URL,Timestamp,User,(Testo Citato),TESTO,Costruttore,Modello,Brand,Interni,Esterni,Meccanica,Prestazioni,Consumi/Autonomia,Motore,Elettrico,Fuoristrada,Elettronica di Bordo,Manutenzione,Assistenza/Concessionari
è scesa una lacrimuccia,https://forum.quattroruote.it/threads/%C3%A8-scesa-una-lacrimuccia.81904/page-3,2013-10-10 00:00:00,|pantone|,'non so se il tuo caso ossa essere preso ad esempi mi sembra tu abbia avuto il classico e sempre più raro colpo di...reni. se non trovi chi vuole esattamente la tua aut dai conce ogni modello non vale niente per principio. 'comunque quando mi riferivo ai benzina non pensavo tanto ai costi quanto alle grane in meno che non sto neanche ad elencare.',"se la si da dentro ovviamente te la svalutano. Però oggi come oggi con autoscout e simili si può vendere un'auto privatamente senza grandi sforzi. ed è in questi casi che se si ha un modello ""raro"" si ha più possibilità di piazzarlo bene. io ci ho messo 2 mesi e a fronte di 30/40 xc70 D5 di 2.5t ce n'erano solo 2: la mia e quella di un concessionario e tutti quelli che mi hanno contattato erano andate a vederle entrambe ( e non vi dico i commenti su quella del concessionario ) . ovvio che in queste condizioni puoi spuntare prezzi migliori. concordo con te. io sono tornato al diesel e pur essendo un motore moderno l'unica cosa che riesco ad apprezzare rispetto al benzina è il consumo. Per il resto ( erogazione silenziosità vibrazioni ecc ) mi sento di essere sceso di uno scalino. ",,,,,,,,,,,,,,
Progetto Rete Italia mandati concessionari tutti subjudice,https://www.autopareri.com/forums/topic/43734-progetto-rete-italia-mandati-concessionari-tutti-subjudice,2011-07-01 09:06:24,maxtor,,Quoto dalle mie parti sono in via di completamento i lavori di ristrutturazione di un edificio da adibire a concessionaria Lancia ( si intravede il logo sotto il velo che copre l'insegna ) e che fino a 7-8 anni fa ospitava un conce Fiat. Chissà se sarà l'unico marchio o verrà integrato a Jeep in fondo la struttura gli spazi per ambedue i marchi li avrebbe. ,,,,,,,,,,,,,,
MINI 2014,https://www.autopareri.com/forums/topic/53515-mini-2014?&page=10#comments,2013-11-18 18:14:23,RiRino,,Nuova Mini - Le foto e le informazioni ufficiali - Quattroruote Alla fine le dimensioni sono cresciute ma non di tantissimo temevo peggio ( a conferma che il peggioramento estetico non riguarda le dimensioni esterne ) bene quindi il bagagliaglio e l'abitabilità dietro migliorata ( anche se i sedili mi sembrano molto infossati ) - - - - - - - - - - AGGIUNTA al messaggio già esistente - - - - - - - - - - ,,,,,,,,,,,,,,
Motore Boxer,https://www.autopareri.com/forums/topic/65555-motore-boxer,2018-08-09 06:40:45,jeby,,Ma la 600 era una Isetta/250 allungata e col retrotreno rivisto ? L'effetto è quello di una Fiat 600 Multipla goffa ,,,,,,,,,,,,,,
Ecco la Boxster 718 a 4 cilindri,https://forum.quattroruote.it/threads/ecco-la-boxster-718-a-4-cilindri.102011/page-2,2016-05-21 00:00:00,Mastertanto,"'Scusa amico Maste ma ti contraddici tu stesso: ""Su autoscout non si compra nulla...............ci puoi trovar e ci trov di tutt dal privato più corretto al commerciante più losco."" Appunt autoscout è un microcosmo dell'usat dove ci trovi quello che trovi dappertutt il bello e il brutto. Semmai hai la possibilità di sapere cosa vendono anche a Vattelappesc mentre se non ci fosse (e se non ci fossero e-ba subit ecc.) sapresti cosa si vende solo nella tua città o provincia. Quindi a mio avviso è un sistema per trovare un'auto più confacente ai tuoi desider data la vasta gamma di scelta possibile. Poi sta a te andare a verificare se è un bidone o men ma questo vale anche se vai a vedere la macchina che si vende dietro l'angolo del tuo isolato............. Scusate il parziale OT. Chiaramente chi vuole la nuova 718 4 cilindri per ora può comprarla solo nuova. Ovviamente se Bergat la comprerà ce lo farà sapere e ci farà sapere anche le sue impressioni di guida...... '","Trattavasi ovviamente di commento alla frase ""comprare da loro"" che lascerebbe intendere un qualche coinvolgimento che chiaramente non esiste di Autoscout - come di altri siti web simili - nelle transazioni di acquisto/vendita. Tutto qui è un'ovvietà e niente di più.... il nostro amico Bergat è evidentemente scettico sulle auto usate : ora se è vero che con l'usato può capitare di prendere fregature è anche vero che proprio con alcune ""supercar"" - forse il termine è un po' improprio diciamo potenti sportive va - si potevano trovare ottime occasioni particolarmente con auto il cui alto consumo spaventa l'utente medio ( che spesso è parecchio sprovveduto... ) per cui la richiesta è bassa ed i prezzi scendono : un esempio perfetto è la mia M6 assolutamente inavvicinabile da nuova ( quando la presi io il listino era sui 123.000 ? l'attuale modello sovralimentato V8 costa 135.000 ? ... :shock: ) quanto svalutata da usata anche se seminuova. E posso dire per esperienza diretta oltre che per ragionamento e senza tema di smentite che il consumo è davvero una voce secondaria nel bilancio complessivo della gestione di una sportiva di grande potenza : nonostante che io non la usi neppure poi così poco ( ho fatto 47.000 km in quasi 5 anni ) e nonostante la M6 beva - ma lo sapevo bene sia chiaro - veramente molto come la Ferrari F12 Berlinetta per capirci. Quello che attualmente è oltre i limiti della sopportazione è il superbollo penalizzante per la categoria ai limiti del soffocamento poi ci possono essere tutte le perplessità sulle eventuali spese per riparazioni specie quelle imprevedibili ma il consumo no non conta così tanto è uno spauracchio solo per gli ingenui. Per questo il consumo e naturalmente anche per altre ragioni il prezzo dell'usato può scendere anche molto anche se in modo molto difforme tra un'auto e l'altra - le Porsche sono forse quelle che tengono meglio il prezzo in assoluto specie le 911 le cui versioni 993 poi costano un vero sproposito se si pensa che sono auto con vent'anni sulle spalle... ma anche le 997 costano sempre molto lo so bene io che avrei voluto una Carrera S serie 997 - e consentire così un acquisto anche a chi non può permettersi il nuovo. Personalmente considero quindi l'usato una mezza manna dal cielo altrimenti certi giocattoli - anche le M3 - sarebbero stati irraggiungibili. Poi può capitare e capita il guasto costoso ( alla M6 che era soggetta a scaricamento troppo precoce della batteria ho dovuto da poco cambiare oltre alla stessa batteria e cablaggi l'alternatore... ma sono cose che possono succedere ) ma l'unico sistema per proteggersi da questo genere di spese sarebbe di.... spendere molto di più : prendendo auto sempre nuove e cambiandole a fine garanzia. Con costi è evidente stellari.... Mi scuso per la divagazione forse un poco OT ma è l'entusiasmo e spero di leggere le impressioni di guida dell'amico Bergat circa la nuova 718 Boxster. Alle quali spero di poter aggiungere le mie tra qualche mese sulla nuova 911 Carrera S con motore 3.0 litri sovralimentato che un amico - sorprendendomi alquanto lui che ha cambiato un sacco di auto ma sempre usate - ha ordinato due mesi fa : nientemeno - mi ha dato retta - che con cambio manuale ( a 7 rapporti mai visto io sinora un manuale così ) che è ormai una vera e rara ""chicca"" da appassionati. Lucio ",,,,,,,,,,,,,,
1.0 TGI 90 cv,https://forum.quattroruote.it/threads/1-0-tgi-90-cv.113966/,2018-01-29 00:00:00,mafalda,,"Polo presa da 10gg trendline con fendinebbia techpack e eletricpack. avrei voluto i cerchi in lega ma manca il nullaosta dellla casa per le vetture uscite coi cerchi normali. forse tra qualche settimana. fatti circa 300 km. Spaziosa ben fatta qualche ""taglio"" qua e la ( no maniglie della socera e no tasche dietro i sedili ) . abitacolo grande bagagliaio pure nonostante il bombolone tolga qualcosa. motore con un po' di turbolag ma ci sta va gestito ma nulla di insormontabile. prese le misure la ripresa è buona e progressiva fatti un paio di sorpassi senza grossi problemi da 60 kmh in IV. il consumo di metano sembra davvero contenuto ma ancora no ho potuto fare un test ""completo"". impianto multimediale ""composition colour"" di questi tempi non fa gridare al miracolo però fa il suo: oltre FM/AM lettura media tramite USB SD e via BT. no CD opzionabile ma oramai pace messo tutto su chiavetta. buona l'integrazione col telefono vivavoce buono senza dover ripetere tutto 10 volte urlando. ottimo l'assorbimento delle asperità buona insonorizzazione assetto turistico ma non cedevole. Difetti ? i rapporti del cambio sono davvero molto lunghi e spaziati in città a volte non si sa se usare la II o addirittura la I ! a questo si aggiunge la totale assenza totale di freno motore da un po' fastidio. usare un 6m con le prime tre marce più ravvicinate tra loro no eh ? ",,,,,,,,,,,,,,
Kia Sportage - Accessori after-market,https://www.autopareri.com/forums/topic/42308-kia-sportage-accessori-after-market?&page=23#comments,2011-04-08 07:47:14,tapioca76,,Tipografo ? ! ? ! ? Nooo lui se non lo trova in giro mi sa che me lo fa produrre da qualche ditta direttamente qui in Italia......... Su questo dormo sonni tranquilli ! E' semplicemente Impressionante ! ! ! ! :lol: Che dici santi secondo te sono diversi i fari della versione Americana ? ,,,,,,,,,,,,,,
consiglio per nuova auto,https://forum.quattroruote.it/threads/consiglio-per-nuova-auto.116636/,2018-05-20 00:00:00,paulein118,,è vero che il 100-130 della C-hr non sarà un fulmine ma ricordiamoci che viene da una corsa 1.3 mj quindi non è abituato a chissà che prestazioni. Una cosa che consiglio assolutamente è di provarla magari poi scopri che non ti piace. Io l'ho provata dopo aver firmato giusto per curiosità e avrei voluto morire.....però ora guai chi me la tocca ! eheheh Ma era colpa delle batterie scariche che la facevano sembrare un chiodo ,,,,,,,,,,,,,,
Censimento.,https://forum.quattroruote.it/threads/censimento.87/,2009-04-01 00:00:00,Memento_Audi_Semper,,Continuo io. Lexus GS 300 Acquistata a settembre 2008 presso il concessionario di Verona ,,,,,,,,,,,,,,
Fiat SUV.....,https://www.bmwpassion.com/forum/threads/fiat-suv.17354/page-2,2004-07-18 00:00:00,Melo,,non vorrei darti una delusione...ma è una delle auto più vendute.Ampiamente sopra le stime ! ,,,,,,,,,,,,,,
conferma 8c spider ?,https://www.autopareri.com/forums/topic/20904-conferma-8c-spider?&page=3#comments,2006-12-08 21:21:45,J-Gian,,Sì infatti come dev'essere un'Alfa ! Ma Ax parlava della Diva che è si TP ma con motore trasversale posteriore... Configurazione non propriamente Alfa Romeo. Appunto: :mrgreen: :mrgreen: ,,,,,,,,,,,,,,
articolo sospetto..,https://www.autopareri.com/forums/topic/23804-articolo-sospetto,2007-06-11 14:27:25,F40 LeMans,,"Auto toccava i 200 km/h in 11""59 in 378 metri. Qual'è il vostro parere ? 12 secondi o 369 metri per il test di Quattroruote ? ",,,,,,,,,,,,,,
Perchè non caricare in modo1?,https://www.forumelettrico.it/forum/perche-non-caricare-in-modo1-t1437-20.html?sid=b7393f2be9df5cce21de58934b284756&sid=b7393f2be9df5cce21de58934b284756,2018-05-30 10:24:00,selidori,"'gamalauda ha scritto:io in tanti anni ho visto cose che prima erano considerate sicur ed improvvisamente per via di una normativa sono diventate pericoloseCredo che questo sia il progresso: è normale che mano a mano che la scienza si perfezion che vi sono più stud più test ecc si scoprono cose che possono far propendere per diverse strade.Mia nonna novantatreenn qualche anno fa mi disse più o meno (in dialetto reggian che traduco ) ""la gente ha sempre fumato in passat ma non è mai morto nessuno di tumore"". Alludeva ai suoi temp dove non si sapeva che facessero così male e la gente moriva e non sapeva manco perch oppure prima che potesse presentarsi il tumore da fumo.I tempi però ora sono cambiat e si sanno tante cose in più grazie a numerosi stud per cui bisogna cercare di optare per scelte divers quando possibile. 'io in tanti anni ho visto cose che prima erano considerate sicur ed improvvisamente per via di una normativa sono diventate pericolose'",In effetti questo è uno dei paradossi dell'umanità.100 anni fa non c'erano malattie come l'Alzaimer il parkinson la demenza senile l'osteoporosi la prostata... Ma non perchè si mangiava sano e bene ma perchè l'età media era sui 50 anni quando ( anche allora ) quelle malattie da terza età non si erano ancora manifestate.,,,,,,,,,,,,,,
Renault Mégane 2016,https://www.autopareri.com/forums/topic/59249-renault-m%C3%A9gane-2016?&page=24#comments,2016-03-21 08:10:54,fois.giampiero,,Sto aspettando l'ok del finanziamento che credo non dovrebbe essere lontano... ho ordinato una bose 1.6 dci quasi full ... tempi di consegna tra fine maggio e inizio giugno ,,,,,,,,,,,,,,
Audi A2 VW Lupo,https://www.bmwpassion.com/forum/threads/audi-a2-vw-lupo.34929/,2006-12-11 00:00:00,tetsuo,,"Modello Emissioni di CO2 ( g/Km ) 1 ) Audi A2 1.2 TDI 862 ) Volkswagen Lupo 1.2 TDI 3L 88da ""Libero auto e motori"" http://canali.libero.it/motori/im/a2_165_IT_12036_1.html...per quale motivo queste due vetture non sono più in produzione ? ? ? e non è una domanda retorica ma una richiesta a chi di auto se ne intende da uno che ne capisce piuttosto poco ( a tal punto da vantarsi dei suoi P6000... ) ",,,,,,,,,,,,,,
Sconto disabili Kia una presa in giro,https://forum.quattroruote.it/threads/sconto-disabili-kia-una-presa-in-giro.117753/page-2,2018-10-09 00:00:00,edoardosavoia,'Guarda il prezzo finale e basta.',Quoto ,,,,,,,,,,,,,,
Benzina o diesel dubbio amletico,https://forum.quattroruote.it/threads/benzina-o-diesel-dubbio-amletico.114294/page-3,2018-03-07 00:00:00,melego73,,"Ma il problema non e' tanto il discorso ""diesel"" in se ma dell'uso che ne fa e la relativa manutenzione. Io ho mollato il diesel pur facendo tra i 15 e i 20000km l'anno e non tornerei indietro. Spendo piu' in benzina ma spendo meno in manutenzione e assicurazione quindi alla fine dei conti siamo li. Inoltre non ho mai problemi di filtri DPF egr iniettori pompe nafta gelata candelette geometrie varibili. niente di niente Guida molto fluida e silenziosa con motore sempre pronto senza turbo lag del diesel. ",,,,,,,,,,,,,,
Mitsubishi ASX (Topic Ufficiale - 2009),https://www.autopareri.com/forums/topic/36140-mitsubishi-asx-topic-ufficiale-2009?&page=164#comments,2010-11-08 17:53:16,cross,,E' quello che temo anche io. ASX mi piace ma temo poi di trovarmi troppo stretto e pentirmi dell'acquisto. Ho già preso un appartamento troppo piccolo forse sono segnato da questa esperienza ! ,,,,,,,,,,,,,,
Giulietta multiair: momentanea perdita di potenza - pressione turbina bassa,https://forum.quattroruote.it/threads/giulietta-multiair-momentanea-perdita-di-potenza-pressione-turbina-bassa.112707/,2017-10-10 00:00:00,piegaiferri,,"Buongiorno a tutti vorrei chiedere il vostro parere / consiglio su un problema che sto riscontrando sulla mia Giulietta 1.4 multiair 170cv manuale. Ho notato che poco dopo raggiunta la temperatura di esercizio talvolta ( non sempre ) la macchina fatica a salire di giri inizia a seghettare/strattonare anche se limitatamente la pressione della turbina non sale anche schiacciando l'acceleratore completamente. Scalando di marcia i giri salgono ma la pressione delle turbina rimane sembre bassa e la macchina non tira come dovrebbe. Dopo alcuni secondi la situazione si blocca di colpo la macchina riprende ad andare perfettamente senza alcun problema / rumore o strattonamento. Ho percorso diverse centinaia di km senza alcun problema. Sottolineo inoltre che nel quadro non si accende alcuna spia di avaria motore o simili. Ipotizzo nella mia ignoranza si possa trattare della valvola pop off che a freddo dopo qualche ora di fermo fatica a lavorare come dovrebbe o comunque ha un'inerzia o qualcosa di simile in quanto tale comportamento si verifica solo ""a freddo"" ( chiaramente porto il motore sopra i 2500 solo dopo aver raggiunto la temperature di esercizio ) . Una volta presentatosi il problema dopo lo ""sblocco"" la macchina risulta perfetta per centinaia di k sino al successivo spegnimento raffreddamento e riavvio. Aggiungo inoltre che non c'è aumento della fumosità la rumorosità è solo leggermente più alta per via dei ridotti strattonamenti poco percepibili. Qualcuno di voi ha già avuto un problema simile ? Grazie Saluti ",,,,,,,,,,,,,,
Mondiale F.1 2019 - parliamone,https://forum.quattroruote.it/threads/mondiale-f-1-2019-parliamone.119664/page-15,2019-01-11 00:00:00,gbortolo,,Speriamo non faccia la fine di Capito che lasciata l'armata VW finì malissimo con Dennis & Co. Certo che se la McL ritornasse in forma il prossimo anno sarebbe l'ennesimo smacco per il povero Fernando ,,,,,,,,,,,,,,
Nuova Giulietta?,https://forum.quattroruote.it/threads/nuova-giulietta.109082/page-32,2017-06-07 00:00:00,pilota54,'http://www.pneurama.com/it/rivista_articolo.php/I-NUOVI-MOTORI-PER-UN-MONDO-CHE-CAMBIA?ID=29173',"Mah il passo più interessante mi sembra questo: ""Notiamo che di questi motori è prevista anche la versione turbo a 4 valvole per cilindro che potrebbe sviluppare circa 120 e 160 cavalli e allestimenti speciali per la Alfa Romeo."" Lo dico perchè i motori Firefly diciamo ""base"" interamente in alluminio con variatore di fase + catena e ad alta compressione ma aspirati con il monoalbero in testa le 2 valvole per cilindro saranno anche efficienti e risparmiosi ma non certo entusiasmanti quanto ad ""architettura motoristica"". Se invece faranno le versioni bialbero 4 valvole e turbo la musica cambia considerando che le altre caratteristiche sono certamente tecnologicamente avanzate compreso il mega rapporto di compressione. Per quanto riguarda l'arrivo sul mercato della nuova Giulietta ora si parla di 2019 per il Suv e 2020 per la hatchback insomma lunga durata per questo topic.......... ",,,,,,,,,,,,,,
GT3 & RS  voglia di PISTA  il 1°MAGGIO ??,http://www.porschemania.it/discus/messages/492693/645798.html?1369498217,2013-04-04 20:26:00,leon59,,"te stai zitto cipeciop ...a proposito riesci a stare zitto nel senso di non divulgare le ultime novit\xe0 del ""machoraduno"" fino a quando non viene lanciato il programma ufficiale ? ! ",,,,,,,,,,,,,,
Renault Captur 2013,https://www.autopareri.com/forums/topic/53994-renault-captur-2013?&page=249#comments,2014-03-12 18:12:16,aci851,,Poi mi spieghino perche nel mio serbatoio quando sono a secco entrano a mala pena 36 litri di carburante.... Se il serbatoio è davvero di 45 litri i conti non tornano ! ,,,,,,,,,,,,,,
Nuova Kia Rio 2011,https://forum.quattroruote.it/threads/nuova-kia-rio-2011.53302/page-129,2012-05-30 00:00:00,Tony8693,,ragazzi si riscontrano molti problemi nel trovare il modello di fusibili della nostra kia rio...non li trovo nemmeno su internet...io ho bruciato uno e sostituito con uno diverso dello stesso amperaggio ma ho decisamente paura... : ? : ! : : ! : : ! : : ! : : ! : ,,,,,,,,,,,,,,
Mercedes Classe E facelift,https://www.bmwpassion.com/forum/threads/mercedes-classe-e-facelift.21700/,2003-05-23 00:00:00,El Nino,,,,,,,,,,,,,,,,
Honda non vende,https://forum.quattroruote.it/threads/honda-non-vende.111493/page-10,2017-08-04 00:00:00,elancia75,"""Toyota ha puntato tutto sull'ibrido e lo sta facendo alla grande promuovendo il suo prodotto da tanti anni peccato solo per il CVT che guido tutti i giorni sulla Yaris che in ambito montano fa abbastanza pena.""",Sì però se vuoi un ibrido superiore al 1.8 con 136cv devi prenderti o la IS o la NX o superiori.. E' tempo che aspetto curioso la nuova Lexus CT chissà se la doteranno di un cambio più sportivo e qualcosa di più brillante del 1.8 Prius-Auris ,,,,,,,,,,,,,,
la batcaverna 635csi &co,https://www.bmwpassion.com/forum/threads/la-batcaverna-635csi-co.85405/page-168,2008-12-29 00:00:00,dema80,'stasera escono nuove fot della 5 finita:wink:',:wink:Ale e come siamo messi con la nostra gara chilomerica ? 535 vs 520 ! io sono arrivato a 255.000km senza aprire il propulsore ! e va alla grandissima ancora ! ,,,,,,,,,,,,,,
Colonnina EVAD Fast Falconara Marittima AN Via Umberto Terzi 22 Castelferretti,https://www.forumelettrico.it/forum/colonnina-evad-fast-falconara-marittima-an-via-umberto-terzi-t4179-20.html?sid=5765fdbd0d25aec593244f988887d92f&sid=5765fdbd0d25aec593244f988887d92f,2019-03-26 17:28:00,fly,,Evviva ! ! ! ,,,,,,,,,,,,,,
VISTE A PADOVA,http://www.porschemania.it/discus/messages/815/712074.html?1414402647,2014-10-24 11:38:00,mbracing,,"Apro questa discussione con un ""pezzo unico"" ( per fortuna ) visto a Padova che dimostra come non c'\xe8 limite all'ingegno ( o alla follia ) umana. ",,,,,,,,,,,,,,
Hyundai i30 N - i30 N Fastback,https://forum.quattroruote.it/threads/hyundai-i30-n-i30-n-fastback.111294/page-5,2018-01-25 00:00:00,pilota54,,A me piace anche questa ( che però deriva dalla i20 coupè ) . Peccato che non la possa guidare io.................... Per la cronaca trattasi dello shakedown del Rally di Monte-Carlo 2018. ,,,,,,,,,,,,,,
Chi è passato da S40/V50 a S60/V60?,https://forum.quattroruote.it/threads/chi-%C3%A8-passato-da-s40-v50-a-s60-v60.51191/page-2,2014-03-06 00:00:00,AndreaFlanaghan,,Bel ferro - ) E' dura con assetto e cerchi da 18 ? ,,,,,,,,,,,,,,
BoosterJet & GPL,https://forum.quattroruote.it/threads/boosterjet-gpl.115794/,2018-04-07 00:00:00,bestchicco,,Comunque ogni modifica anche su motori ad iniezione indiretta sarebbe utilizzata a pretesto per invalidare la garanzia. Sarebbe il produttore dell'impianto che si sobbarcherebbe la garanzia per la modifica e relative conseguenze. Per il 1.0 sembra che qualche produttore ci sia che abbia impianti adatti per il 1.4 non ho trovato nulla. ,,,,,,,,,,,,,,
Ciampil'inno e la quattroporte,https://www.autopareri.com/forums/topic/15705-ciampilinno-e-la-quattroporte?&page=8#comments,2005-10-01 04:55:41,Stefano73,,Concordo anche se non aprezzo berlusconi fa benissimo a comportarsi così poi penso che alla fine la maggioranza delle persone che rappresenta coi suoi voti si sentono più vicini a lui se va in giro con audi che con un auto italiana. Cmq l'anno prossimo vedremo prodi in giro con croma e che magari regalerà una ennesima fabbrica inutile a fiat così saremmo tutti contenti. ,,,,,,,,,,,,,,
Esiste un Real.OEM per Smart?,https://www.bmwpassion.com/forum/threads/esiste-un-real-oem-per-smart.49480/,2005-05-11 00:00:00,Head,'Ti confermo che il mio amico ha ancora il cd...se ti serve Per il discorso turbina devo controllare il modello/codice è comunque per benzina...ti faccio sapere al più presto tutti i dettagli.',O un elenco dei pezzi di ricambio ? Mi servono alcune cose e senza codici.... ,,,,,,,,,,,,,,
Costi tagliandi Kia Venga?????,https://forum.quattroruote.it/threads/costi-tagliandi-kia-venga.46980/page-5,2012-05-25 00:00:00,fabrymiloty,,Oggi ho tagliandato la Venga 1 4 ex Benzina per la seconda volta. ? 120 00 presso un'officina che effettua tagliandi multimarca ( officine APOSTO ) . Prezzo più che nella norma per cambio olio ( usano lo shell ) cambio filtro olio filtro abitacolo controlli vari e manopera. La concessionaria ufficiale meno di 220 00 ? non faceva il controllo. ,,,,,,,,,,,,,,
la batcaverna 635csi &co,https://www.bmwpassion.com/forum/threads/la-batcaverna-635csi-co.85405/page-267,2008-04-29 00:00:00,Guest 002,,cabrio o coupe' ? ,,,,,,,,,,,,,,
997 GT3,https://www.bmwpassion.com/forum/threads/997-gt3.17097/,2004-08-23 00:00:00,mamo,,http://www.fastdrive.org/forum_viewtopic.php ? 26.5308 Direi che la 430 sia superiore in tutto a parità di prezzo non credo ci sarà la fila dai concessionari Porsche ,,,,,,,,,,,,,,
Lamborghini Huracán LP 610-4 2014,https://www.autopareri.com/forums/topic/53807-lamborghini-hurac%C3%A1n-lp-610-4-2014?&page=15#comments,2013-12-26 14:59:08,X82,,Sbagli versione della Gallardo. L'ultima sembra voler peggiorare l'ottimo lavoro svolto sulla 2°serie ,,,,,,,,,,,,,,
2016 baleno,https://forum.quattroruote.it/threads/2016-baleno.100283/page-31,2018-12-20 00:00:00,amicable,,Cinghia accessori o dei servizi ? ,,,,,,,,,,,,,,
Diesel per Infiniti,https://forum.quattroruote.it/threads/diesel-per-infiniti.21796/page-7,2010-09-15 00:00:00,aborotto,,Aspetto ancora un po di giorni....fatti 500 km.......una vettura spettacolare. Ps..nessuno si è accorto che ha i doppi vetri ? ,,,,,,,,,,,,,,
Omaggio alla 996....,http://www.porschemania.it/discus/messages/10548/610621.html?1478593214,2012-05-26 12:49:00,danielterry,,continua.... cerchi gt2: cerchio specifico per la gt2 ripreso poi come optional per le altre versioni stock sono in lega leggera monoblocco. curiosit\xe0 : come per le gt3 anche sulle turbo e le gt2 non \xe8 prevista la ruota di scorta ma il solito kit di autoriparazione provvisoria ( bomboletta schiuma compressore 12v e manometro ) .... continua...,,,,,,,,,,,,,,
Ennesimo consiglio,http://www.porschemania.it/discus/messages/22971/523538.html?1288546808,2010-10-20 09:10:00,karlo1200s,,Se fosse la stessa macchina la differenza di un buon 20% non sarebbe poca...,,,,,,,,,,,,,,
E piu' importante la coppia o la potenza?,https://www.autopareri.com/forums/topic/27710-e-piu-importante-la-coppia-o-la-potenza?&page=4#comments,2008-03-14 10:55:50,J-Gian,,Non a caso sui turbocompressi le cose vanno un po meglio... Effetto elastico del Lag a parte... La differenza tra le curve di coppia non si nota più di tanto ( anche se i motori più recenti hanno maggior coppia ai bassi giri... ) perché quella di fatto è un grafico della forza ( indirettamente dell'accelerazione ) per avere idea della reattività dovresti visualizzare la derivata di quest'ultima. ,,,,,,,,,,,,,,
Attenti a Land Rover - Leggete la mia storia,https://forum.quattroruote.it/threads/attenti-a-land-rover-leggete-la-mia-storia.28130/,2010-04-19 00:00:00,leolito,,Segnalazione inviata grazie. ,,,,,,,,,,,,,,
