Titolo,URL,Timestamp,User,(Testo Citato),TESTO,Costruttore,Modello,Brand,Interni,Esterni,Meccanica,Prestazioni,Consumi/Autonomia,Motore,Elettrico,Fuoristrada,Elettronica di Bordo,Manutenzione,Assistenza/Concessionari
Fiat 500 M.Y. 2014,https://www.autopareri.com/forums/topic/26165-fiat-500-my-2014?&page=26#comments,2007-07-04 23:16:21,Alexievic 81,,Eccola: http://it.youtube.com/watch ? v=ZIstcCzloJA Almeno è quella che mandano da stasera credo che però presto ne faranno una dedicata esclusivamente alla 500. In ogni caso è splendida ! ,,,,,,,,,,,,,,
Antinquinamento controllare: fregatura in arrivo?,https://forum.quattroruote.it/threads/antinquinamento-controllare-fregatura-in-arrivo.89748/page-7,2018-01-04 00:00:00,Flash Gordon,,"Ciao a tutti amici del forum in merito al cablaggio iniettori ho deciso di controllare personalmente e con piacere desidero condividere la mia impressione. Ennesima accensione della spia inquinamento controllare. Considerando che la mia megane 3 ha superato i 200000 km e si avvia verso i 9 anni di vita dopo avere ormai risolto l'anomalia rischio rottura motore dovuta ( almeno nel mio caso ) ai tubi gasolio che vanno alla pompa deteriorati. Pulita egr pulito debimetro e sensore pressione turbo. Posso dire che l'unica anomalia rimasta è proprio lei ""antinquinamento controllare"". Ho deciso di verificare queste ""spinette"" ben nascoste dal coperchio nero che reca fiera la scritta ""dci 110 Renault"". Essendo auto acquistata nuova e non avendo mai accettato la sostituzione degli iniettori ritengo di essere il primo a tirare via questa copertura in plastica. Come da diagnosi gli iniettori perennemente inquisiti sono il 2 e il 3 sporadicamente il 4 quindi inizio e stacco il connettore del cilindro 2 che con mia enorme sorpresa presenta una colorazione grigiastra malgrado sia costruito in materia plastica nera. Polvere sottile che si è annidata negli anni e con i km. L'unico connettore estratto che internamente era pulito è il numero 1. Se entra la polvere entra aria e l'umidità in essa contenuta ciò a mio modesto giudizio pregiudica la qualità della connessione facilitando la formazione di ossido e/o comunque il deposito di sporcizia che a lungo andare inevitabilmente deteriora la capacità dei conduttori. Ho pulito con abbondante spray per componenti elettronici sia le spinette che gli iniettori i quali internamente presentavano lo stesso inpolveramento delle spinette. Asciugato con un leggero soffio di aria e ricollegato il tutto. Ripulito il coperchio punterie che presentava la stessa polvere e richiuso il tutto. Vedremo nei prossimi mesi se l'anomalia si ripresenta. Anche se non ho ancora la piena certezza i presupposti ci sono tutti. La guarnizione delle spinette non isola correttamente la parte interna dei contatti e potrebbe essere la causa di anomalie a seguito di una connessione elettrica precaria. Tra qualche mese sarà mia premura darvi ulteriori aggiornamenti. Vedremo se l'anomalia antinquinamento si ripresenta. Inserisco qualche immagine per rendere meglio l'idea di quanto ho scritto. Onestamente non pensavo di trovarli in questo stato. Mi viene da pensare che la sostituzione del cablaggio ha più senso se la spinetta è modificata rispetto l'originale. <img alt=""IMG_20180104_211821.jpg"" class=""bbCodeImage LbImage"" src=""https://forum.quattroruote.it/attachments/img_20180104_211821-jpg.5934/""/> <img alt=""IMG_20180104_211554.jpg"" class=""bbCodeImage LbImage"" src=""https://forum.quattroruote.it/attachments/img_20180104_211554-jpg.5935/""/> <img alt=""IMG_20180104_212112.jpg"" class=""bbCodeImage LbImage"" src=""https://forum.quattroruote.it/attachments/img_20180104_212112-jpg.5936/""/>",,,,,,,,,,,,,,
Ford Focus 1.6 tdci 90 cv: la cinghia distribuzione,https://forum.quattroruote.it/threads/ford-focus-1-6-tdci-90-cv-la-cinghia-distribuzione.23340/page-4,2010-04-09 00:00:00,Eldinero,,Ecco è proprio per questi motivi che ho sempre saputo che quando si fa la distribuzione si deve cambiare la pompa dell'acqua. Quando si fa la distribuzione oltre a cambiare la Cinghia il tendicinghia e la pompa dell'acqua non bisogna cambiare nient'altro ? ,,,,,,,,,,,,,,
Tiepida reazione per il disegno della GT Coupe a Ginevra ?,https://www.autopareri.com/forums/topic/27-tiepida-reazione-per-il-disegno-della-gt-coupe-a-ginevra,2003-03-09 15:37:37,Imothep,,Ciao Taurus dove posso trovare alcune immagine della 1900 Sprint Bertone ? Ti ringrazio Imothep ,,,,,,,,,,,,,,
Cambio gomme Fiat Panda 2° serie.,https://forum.quattroruote.it/threads/cambio-gomme-fiat-panda-2%C2%B0-serie.119061/,2018-10-26 00:00:00,momonedusa,,Le gomme sono quelle che danno aderenza non dico marchio top ma non prenderei mai marchio sconosciuto... E 20€ di assicurazione su gomme così economiche boh non so se vale la pena. Sicuramente non il gonfiaggio con azoto un gommista che lo propone su certe gomme mi ispira poco... ,,,,,,,,,,,,,,
Consiglio.... Quattroporte o Panamera,https://forum.quattroruote.it/threads/consiglio-quattroporte-o-panamera.18986/,2010-12-03 00:00:00,MotoriFumanti,,Quattroporte e Panamera: due scelte molto difficili. Io sarei per la Quattroporte ma anche la Panamera non è da meno. ,,,,,,,,,,,,,,
Scénic XMod - Topic Ufficiale,https://forum.quattroruote.it/threads/sc%C3%A9nic-xmod-topic-ufficiale.14456/page-113,2010-06-03 00:00:00,ak72,xmenx ha scritto: ragazzi mi serve un aiuto....... kit sicurezza mobilità 7 00... Scus per curiosità: cosè questo optional?... se non sbaglio è la cassetta pronto soccors con quello che costa non la prendo ' xmenx ha scritto: ragazzi mi serve un aiuto....... kit sicurezza mobilità 7 00... Scus per curiosità: cosè questo optional? 'ragazzi mi serve un aiuto....... kit sicurezza mobilità 7 00',Grazie e concordo con te :lol: ,,,,,,,,,,,,,,
Abarth 124 rally RGT,https://forum.quattroruote.it/threads/abarth-124-rally-rgt.106123/page-34,2018-11-15 00:00:00,pilota54,,"Primi test sulle strade del ""Rallye du Var"" per le 3 Abarth 124 rally della Milano Racing che parteciperanno alla gara. Per ora sono 4 le Abarth iscritte. <img alt=""[​IMG]"" class=""bbCodeImage LbImage"" data-url=""https://scontent.fcia1-1.fna.fbcdn.net/v/t1.0-9/46451109_2145073775804090_2077521912103174144_n.jpg ? _nc_cat=103&amp _nc_ht=scontent.fcia1-1.fna&amp oh=ef9bb6d4410a4e03ffae5b1fd24bbf73&amp oe=5C784830"" src=""https://scontent.fcia1-1.fna.fbcdn.net/v/t1.0-9/46451109_2145073775804090_2077521912103174144_n.jpg ? _nc_cat=103&amp _nc_ht=scontent.fcia1-1.fna&amp oh=ef9bb6d4410a4e03ffae5b1fd24bbf73&amp oe=5C784830""/>",,,,,,,,,,,,,,
UFFICIALE: Alfa Romeo 8c,https://www.bmwpassion.com/forum/threads/ufficiale-alfa-romeo-8c.28656/page-11,2004-08-23 00:00:00,mamo,,"anche questo video conferma quanto bella è al minuto 1 e 23 secondi c'è qualcosa che per gli alfisti può definirsi ""novità"".... ..... anzi diciamola tutto dimostra di non essere per niente sicura ",,,,,,,,,,,,,,
Renault Clio III Sport,https://www.bmwpassion.com/forum/threads/renault-clio-iii-sport.10181/page-2,2004-02-11 00:00:00,RALLYMAN,'cosa te ne fai di tutta quella potenza se poi hai una Trazione anteriore? è come leccare la figa con le mutande ',Bella ! ! ! ,,,,,,,,,,,,,,
AR 147 e AR 156 sono piu' sportive di AR 159?,https://www.autopareri.com/forums/topic/22271-ar-147-e-ar-156-sono-piu-sportive-di-ar-159?&page=3#comments,2007-02-21 14:50:43,stev66,,Boni...non facciamo partire polemiche personali.... OT conoscete un'altra marca di auto che fa passare i forumisti ai materassi dopo pochi post ? ? ? : ) : ) ,,,,,,,,,,,,,,
Jeep Renegade 2014,https://www.autopareri.com/forums/topic/56342-jeep-renegade-2014?&page=73#comments,2014-03-12 22:00:29,led zeppelin,,ultimamente i thread Jeep mi sembrano sempre più la versione 4wd di quelli Alfa ,,,,,,,,,,,,,,
la batcaverna 635csi &co,https://www.bmwpassion.com/forum/threads/la-batcaverna-635csi-co.85405/page-303,2012-02-03 00:00:00,edoardo z,,No problem è una zona di chiaccherata a tema delle mie e vostre auto volute o possedute purchè old:wink: ,,,,,,,,,,,,,,
Prova Opel Corsa 1.4 Turbo S line 150 CV,https://www.autopareri.com/forums/topic/61044-prova-opel-corsa-14-turbo-s-line-150-cv,2016-04-12 21:22:34,Zampi,,No i rapporti sono perfetti.. non sono ne troppo lunghi ne troppo corti.. infatti l'ho messo nei pro. la 6 è anche lei di potenza ed è sfruttabile.. Gli innesti sono molto contrastati ma perchè il cambio è nuovo si sta ammorbidendo... pero per dare un giudizio vorrei aspettare qualche altro km.. esempio la 1 e la 2 inizialmente se si forzava gratava adesso non più.. Il cambio non mi piace perchè la corsa del cambio è lunga dalla 1 alla 2 ci saranno più di 15 cm di escursione. il 1.4 monta il cambio M32 che è lo stesso cambio dell'OPC. il 1.0 monta il cambio M22. ,,,,,,,,,,,,,,
Mercedes CLK 63 AMG Black Series (Foto Ufficiali a Pag.2),https://www.autopareri.com/forums/topic/22727-mercedes-clk-63-amg-black-series-foto-ufficiali-a-pag2,2007-03-23 19:07:38,poppy84,,CLK 63 Black Series...ma posso sbagliarmi. ,,,,,,,,,,,,,,
Renault Clio R.S. 2012,https://www.autopareri.com/forums/topic/48899-renault-clio-rs-2012?&page=14#comments,2013-05-10 09:00:05,Touareg 2.5,,Prezzo : ,,,,,,,,,,,,,,
Impreza RB320 (Richard Burns Edition),https://www.bmwpassion.com/forum/threads/impreza-rb320-richard-burns-edition.31750/,2006-04-02 00:00:00,sovrasterzo85,,"Ci sono vari modi per non dimenticare una persona scomparsa. Per un grande campione dei rally venuto a mancare prematuramente come Richard Burns nessuna frase o commemorazione è più adatta di questa: Subaru Impreza RB320 ovvero una edizione speciale della vettura con la quale l'asso inglese ha conquistato il titolo nel 2001. 320 sono i cavalli erogati dal propulsore turbocompresso che permettono alla Impreza RB uno 0-100 in 4 8 secondi contro i 5 4 della versione ""originale"" STi. La personalizzazione estetica prevede una aggressiva colorazione nera abbinata a griglie cromate per la mascherina anteriore. Scuri anche i cerchi mentre sopra il cofano troneggia una vistosa presa d'aria. Siamo certi che lassù qualcuno ha una voglia matta di fare due traversi con questa ""bestia nera""...http://www.infomotori.com/a_911_IT_18648_1.html ",,,,,,,,,,,,,,
Spot Fiat Panda 100hp,https://www.autopareri.com/forums/topic/23153-spot-fiat-panda-100hp,2007-04-22 18:33:42,lucaf1,,L'avete vista ? Che dite ? Io la trovo molto originale e cmq è più uno spot alla gamma Panda che alla sola 100hp ,,,,,,,,,,,,,,
Audi A1 2011,https://www.autopareri.com/forums/topic/37039-audi-a1-2011?&page=16#comments,2010-02-10 14:39:36,ACS,,"Che temperasupposte che sei :D Ma chiccasssssssosenefuitte ? Perchè a 40 anni ( ma anche a 25 lo si faceva su altro ) mi devo mettere a preoccuparmi di ""fognare"" una utilitaria de luxe per farla andare come voglio con tutti i rischi del caso quando il mercato POTREBBE offrirmente una già pronta ? Con tanto di garanzie varie etc etc ? Se devo mettermi a modificare l'auto deve essere qualcosa che deve valerne la pena quindi non certo un elettrodomestico del genere. Voglio l'assetto ""cattivo"" lo ESIGO dalla casa costruttice. Infatti c'è chi lo da e chi invece lo toglie ",,,,,,,,,,,,,,
Alfa Romeo 159 2005,https://www.autopareri.com/forums/topic/13571-alfa-romeo-159-2005?&page=244#comments,2005-05-24 14:46:53,simonepietro,,stessa frequenza d'onda ? ,,,,,,,,,,,,,,
affidabiltà Renault,https://www.autopareri.com/forums/topic/24261-affidabilt%C3%A0-renault?&page=3#comments,2007-07-16 19:45:26,Net Flier,,la nostra prima e unica renault nuova ruppe il motore a 4.170..era un kangoo 1.2 prima serie la laguna prima serie invece ha funzionato egregiamente tranne qualche intoppo con il clima automatico e la testata andata a 120.000 e rotti ( ma era in area di rottura e si sarebbe rotta sicuramente prima o poi ) ,,,,,,,,,,,,,,
cinghia distribuzione punto 1.2 8v.A quanti chilomentri??e i materiali?,https://www.autopareri.com/forums/topic/26265-cinghia-distribuzione-punto-12-8va-quanti-chilomentrie-i-materiali?&page=2#comments,2007-12-04 20:32:37,Popy,,Ciao vincenzo se leggi attentamente il libretto di uso e manutenzione della punto in un angolino delle tabelle di manutenzione trovi scritto: cambio cinghia distribuzione ogni 120.000 km oppure ogni 4 anni. Il tuo mecca è un pò ladro. Considera che la mia punto ha 74.000km e 6 anni e tra poco cambierò la cinghia solo per questione di tempo 6 anni e la gomma si rovina anche con il tempo. Per quanto riguarda i danni al motore penso che abbia detto un altra fesseria: il nostro è un motore fire 8v molto vicino al mitico 1.0 quindi in caso di rottura della cinghia il motore si spegnerebbe semplicemente l'ho chiesto anche in questo forum e anche se con qualche dubbio mi hanno confermata la cosa. Io cambierei la cinghia e il tendicinghia a 150.000km oppure dopo 5/6 anni. ,,,,,,,,,,,,,,
Alfa Romeo 4C 2013,https://www.autopareri.com/forums/topic/56324-alfa-romeo-4c-2013?&page=868#comments,2014-06-30 10:23:58,alfa156ts,,Confermo....LE bianca niente male. Ma non è in vendita......per ora. ,,,,,,,,,,,,,,
La comodità si paga!... ma ladri si nasce!!!,https://www.bmwpassion.com/forum/threads/la-comodit%C3%A0-si-paga-ma-ladri-si-nasce.18335/,2005-04-23 00:00:00,crickcrack13,,Salve a tutti possiedo una BMW X3 e tanto per rendere partecipe anche altri di come siano a mio avviso a dir poco costosissimi i costi di manodopera delle conc. BMW vi voglio raccontare brevemente questa storia ! Un bel giorno decido di installare sulla mia auto il navigatore professional con schermo 16:9 in pratica chiedo un preventivo in concessionaria ed il prezzo è a dir poco folle ! Come tutti gli accessori bmw d'altronde quasi 5000 euro ! Visto che io non faccio l'avvocato il notaio o mestieri dove si guadagna 10.000 -15.000 euro mese mi sono messo a cercare su ebay tutto il necessario. Purtroppo tutto non si trova o almeno all'epoca non l'ho trovato ma sono riuscito a comprare il monitor ed il lettore dvd risparmiando almeno il 50% mi mancava la radio ed il cavo che in concessionaria pago 96€ il cavo e 600€ per la radio. A questo punto arriva il problema il cavo che collega la radio al lettore dvd deve andare dalla plancia al bagagliaio e anche se io sono discretamente bravo a smontare e rimontare non me la sono sentita di rischiare visto anche che l'auto è in garanzia. Gli lascio l'auto e vado a ritirarla due giorni dopo. Mi avvicino alla cassa e con moltissima calma pago per la sola manodopera per il passaggio di un cavo la bellezza di 496 € ho la fattura ! ! ! Praticamente una giornata intera di manodopera da quanto mi hanno detto ! Ora da quel giorno chiunque mi dice che la manodopera bmw non è molto costosa io cosa dovrei rispondere ? Cose da pazzi ! ! ! Questa conc. lavora a più di 60euro/ora ! Lascio a voi ogni tipo di commento ! Ciao a Tutti ,,,,,,,,,,,,,,
Finalmente ho provato la Y MJ!!,https://www.autopareri.com/forums/topic/4142-finalmente-ho-provato-la-y-mj,2004-01-16 15:52:22,Betha23,,per la cronaca io in quella succursale ci sono diciamo..........NATO ! Adesso che è del gruppo Rosati Lancia ci vado spesso ho visto quella che dici tu verde.......... ma anche al Fiat Center fino a poco tempo fa c'era una Avorio con il tetto ed era spettacolare ! ! ! Per il colore e i cerchi lo so che fa motlo pubblicità però gli altri colori non mi soddisfano il rosso si rovina il blu fa auto della polizia il verde manco morto il nero la fa sembrare una Topolino il grigio fa macchina da vecchio ! Solo l'Avorio mi convince davvero soprattutto se abbinato con la pelle cognac ! Per chi ha intenzione di comprare uan Ypsilon non MJ li inviti ad andare a provarla ( domani e domenica fanno un porte a perte a Roma ) cambierà idea radicalmente sono appena sceso dalla mia 1.2 8v e mi pareva di stare su una panda 30 ! :cry: ,,,,,,,,,,,,,,
Dacia sandero dci normale o stepway?,https://forum.quattroruote.it/threads/dacia-sandero-dci-normale-o-stepway.46993/,2011-08-27 00:00:00,fabiologgia,"""scusate una cos non è una provocazione ma... che senso ha la stepway? :shock: perchè pagare quei soldi in più se la Sandero normale è già altina e va bene per essere strapazzata susgli sterrati? (se non sbaglio l' unica differenza tangibile è l' altezza) ??? grazie""",Semplice la Stepway è molto più carina e diversamente accessoriata. E poi è l'unica disponibile col motore da 90 CV. Mi pare che di differenze ce ne siano parecchie ! Saluti ,,,,,,,,,,,,,,
Forlimpopoli Largo Paolucci Dè Calboli 4,https://www.forumelettrico.it/forum/topic5178.html?sid=9b3d6660a00250109c0902db2fb0b90b,2019-03-30 14:29:00,gianni.ga,,Ci vorrebbe un forlivese per un sopralluogo.,,,,,,,,,,,,,,
la batcaverna 635csi &co,https://www.bmwpassion.com/forum/threads/la-batcaverna-635csi-co.85405/page-332,2008-12-14 00:00:00,menego,'il rifacimento con cambio colore è possibil ma richiede un lavoro imperial sventrare tutto a 0.metallo nudo ovunque. lo far se lo merit ma non è urgente',Sei il solito... incontentabile ,,,,,,,,,,,,,,
V40 D2 DELUSO DAI CONSUMI,https://forum.quattroruote.it/threads/v40-d2-deluso-dai-consumi.95529/,2015-04-15 00:00:00,albo89,"non e' che imbrogliano... e' che fanno il test sul banco prova a rull ad una determinata pressione e temperatura; inoltre adottano uno stile di guida che chiunque definirebbe ""da nonnetto ossia esageratamente tranquillo.... Con la batteria carica al 100% e con la maggior capacità possibile tra gli allestimenti previsti così l'alternatore non assorbe energia nel brevissimo ciclo di omologazione (e sono 2-4 cv solo lì); con la vettura preriscaldata a 28-30 gradi costanti in box termico prima della prova (così il propulsore consuma meno all'avviamento); con ""rampe"" di accelerazione tali che se le ripeti al semaforo ti asfaltano perfino le biciclette; con tutti gli utilizzatori elettrici spenti; sfruttando al centesimo i coefficienti di massa/c/sx per collocarsi nello scaglione mgliore ai fini della taratura del banco a rulli (un po' come fanno i pugili per rientrare in una categoria di peso inferiore); montando i pneumatici più stretti e più scorrevoli possibili tra quelli omologat ed ovviamente gonfiandoli alla massima pressione di esercizio; etc etc etc N non imbroglian ci mancherebbe ... ""interpretano"" :twisted: le norme di omologazione 'non e' che imbrogliano... e' che fanno il test sul banco prova a rull ad una determinata pressione e temperatura; inoltre adottano uno stile di guida che chiunque definirebbe ""da nonnetto ossia esageratamente tranquillo.'",:lol: :lol: :lol: e' esattamente come per i regolamenti di F1 :twisted: ,,,,,,,,,,,,,,
passat W8 ?,https://www.bmwpassion.com/forum/threads/passat-w8.42894/page-2,2007-02-02 00:00:00,ilmarzo,,Guarda che il W8 ha un buon rendimento alla fine è semplicemente il 6.0 W12 con 4 cilindri in meno.La cilindrata unitaria è identica. ,,,,,,,,,,,,,,
Fiat 500 M.Y. 2014,https://www.autopareri.com/forums/topic/26165-fiat-500-my-2014?&page=336#comments,2010-10-15 14:41:49,TonyH,,Tutto sommato con l'uscita del bicilindrico il 75cv diventava un motore senza un perchè. Costa uguale va di meno consuma pochissimo di meno e dà un sacco di rogne col DPF. ,,,,,,,,,,,,,,
Mondiale F.1 - GP della Russia,https://forum.quattroruote.it/threads/mondiale-f-1-gp-della-russia.118571/page-2,2018-09-26 00:00:00,danilorse,"""In teoria la Ferrari va forte sulle piste con lunghi rettiline poi c'è la gestione gara...(Monza?) A Budapest sono state le qualifiche a vanificare la prestazione della Ferrari a Singapore non c'era verso di vincere. Vedremo""",In teoria sui lunghi rettilinei dovrebbe essere favorita la Mercedes che grazie ai 10cm di passo in piu' puo' sfruttare al meglio il fondo piatto con relativi estrattori e proprio in gara a Monza ha avuto una miglior gestione gomme in gara. Quest'anno pero' e' molto difficile fare previsioni perche' i 2 top team sono praticamente alla pari e abbiamo visto piu' volte ribaltarsi gli equilibri durante il week end. ,,,,,,,,,,,,,,
Volkswagen Lupo Club,https://www.autopareri.com/forums/topic/8296-volkswagen-lupo-club,2004-08-01 10:55:21,frekino,,Grande iniziativa ho segnalato il link su G5C dove c'è anche un'intera sezione dedicata alla Lupo ( ben poco popolata.....del resto è un forum dedicato alla golf ) . Magari riuscite a trovare altri lupisti..... http://www.g5c.com/forum/viewtopic.php ? p=24685#24685 Spero di aver fatto cosa gradita. :wink: In bocca al lupo ! ! ! ,,,,,,,,,,,,,,
Prospettive passate e future per Lancia,https://www.autopareri.com/forums/topic/59430-prospettive-passate-e-future-per-lancia?&page=33#comments,2016-04-03 20:04:15,Abarth03,,Eh...domanda più che legittima. Spesso me lo domando anch'io secondo alcuni si tratta di cosiddetto click-baiting cioè articoli acchiappaclick messi on line per avere la maggior visibilità possibile. Per questo dico che è conveniente prendere sempre tutto col beneficio d'inventario ,,,,,,,,,,,,,,
Mondiale F.1 - GP degli Stati Uniti,https://forum.quattroruote.it/threads/mondiale-f-1-gp-degli-stati-uniti.118909/page-15,2018-10-22 00:00:00,pilota54,'Che Kimi abbia vinto e fatto una bellissima gara ne sono felicissimo anchi anzi speravo che ci riuscisse prima della partenz ma devi ammettere che Hanno rischiato moltissimo da non farlo vincer e ció sarebbe bastato che Hamilton non avesse tirato da subito per evitare il blisterin visto che era in condizioni buonissime proprio perché Kimi doveva fare il suo cambio e fin qui la strategia MB era perfetta. Che la Ferrari in questa gara era fortissima si é Visto in partenza e come ho scritto nei primi pos senza la collisione di Vettel sono sicuro che ci serebba stata la doppietta.',Rimango della mia opinione Angelo per una volta la Mercedes è stata nettamente battuta dalla Ferrari anche sulla strategia. Forse è la prima volta che è accaduto quest'anno ma è stato così strategia Mercedes-spazzatura ieri. Basta rivedere la faccia ( distrutta ) di Toto Wolff quando Kimi ha tagliato il traguardo da vincitore con Hamilton nemmeno 2° ma addirittura 3° dietro anche a una Red Bull non so da quanto tempo non succedeva................ C'è da aggiungere che la Ferrari è stata più forte anche nella gestione gomme e anche questo non accadeva da tempo. Sembrava di essere tornati alle prime gare. ,,,,,,,,,,,,,,
Turbo 2003: quanto vale?,http://www.porschemania.it/discus/messages/22971/620895.html?1347005725,2012-09-05 23:52:00,peppe4916,,appena acquistata cay turbo del 2003 full optional a 14000 ivata gommata etc etc etc con ben 8 proprietari alle spalle appena gasata con impianto gpl della bigas e va che \xe8 una meraviglia eliminati catalizzatori instalato marmitte artigianali filtri brc e mappatura centralina....\xe8 diventata una bomba,,,,,,,,,,,,,,
[dubbi] Grand Vitara Diesel 1.9 evo 5p,https://forum.quattroruote.it/threads/dubbi-grand-vitara-diesel-1-9-evo-5p.82140/,2013-10-07 00:00:00,neuropoli,,Ciao Luca te la consiglio vivamente ! Io sono già alla seconda GV 5p. Prima ne avevo una come la tua nell'allestimento top comprata usata ora da 2 mesi ne ho un'altra ( nuova ) sempre nell'allestimento top ma 2.4 benzina automatica. Posso dirti che sono letteralmente entusiasta di quest'auto. In città si guida benissimo l'unica cosa che bisogna far attenzione é la larghezza della vettura perché se non si é abituati a guidare vetture larghe si rischia di toccare gli specchietti. Sulla neve non la ferma nessuno ( gommati bene però ) come nel fuoristrada leggero. Sono contento che ci sia ancora gente che apprezza o é interessata a quest'auto malgrado sia di concezione 2006. Secondo me tanti la sottovalutano e sbagliano ! A tutt'oggi di veri fuoristrada ce ne sono pochi... e quei pochi costano parecchio. La GV é ancora una delle più economiche. Saluti Antonio ,,,,,,,,,,,,,,
Serie 5 X3: che mi dite?,https://forum.quattroruote.it/threads/serie-5-x3-che-mi-dite.116831/page-7,2018-06-09 00:00:00,PalmerEldrich,,Comunque grazie Ari per darmi retta ,,,,,,,,,,,,,,
Leon 5F ammortizzatori anteriori con perdite d'olio,https://forum.quattroruote.it/threads/leon-5f-ammortizzatori-anteriori-con-perdite-dolio.95709/,2015-04-21 00:00:00,topomillo,,:lol: :lol: :lol: ,,,,,,,,,,,,,,
L  incompresa....,http://www.porschemania.it/discus/messages/10548/848801.html?1553773463,2019-01-03 16:31:00,maxfil60,,Gianluca corretto il codice C27 corrisponde al mercato spagnolo e la 996 \xe8 spagnola da sempre e la tengo li. Alessandro il colore degli interni non \xe8 beige \xe8 pi\xf9 scuro ma non ti saprei dire esattamente quale sia. Ricordo tabacco ma sono passati tanti anni e potrei sbagliarmi. Non ci dovrebbe essere il corrispondente codice sull'adesivo ? Questa 996 ha i cerchi di serie da 17 che a mio parere stanno molto bene poi trovo la sua linea molto bella e pulita solo il muso \xe8 fin troppo gentile. Poco agressivo. Ho reso l'idea ? ,,,,,,,,,,,,,,
