Titolo,URL,Timestamp,User,(Testo Citato),TESTO,Costruttore,Modello,Brand,Interni,Esterni,Meccanica,Prestazioni,Consumi/Autonomia,Motore,Elettrico,Fuoristrada,Elettronica di Bordo,Manutenzione,Assistenza/Concessionari
Honda Jazz 1.3 consigli,https://forum.quattroruote.it/threads/honda-jazz-1-3-consigli.107042/page-16,2016-12-12 00:00:00,amadeus10,,A questo punto della discussione in cui c'è chi vede questa cosa come una caratteristica e lo apprezza e chi un quasi difetto e non gli piace ( per quanto mi riguarda ne sono avveduto dai vostri messaggi e dalle varie prove su strada che ho visto su youtube ma non posso dare un giudizio dopo due brevi test drive in quanto da non esperto sapro capire solo dopo che me la consegnano e la guiderò per un pò ) chiedo a: Albelilly: esistevano allo stato attuale ( da quando mi sono messo a cercare io quindi un mese non dico ai tuoi tempi in cui hai avuto la fortuna di avere la jazz 1.4 e successivamente la hyundai i20 ) alternative valide sugli aspirati ? Io l'ho presa perchè non ne ho viste ( e per le ovvie caratteristiche positive ) Jazzaro: perchè hai ordinato una jazz ( cosi mi sembra di aver capito ) nonostante sei ben più consapevole di me e anche non apprezzi questa caratteristica ? Se io fossi stato al tuo posto ( cioè con la certezza di come sarà e la certezza che non mi piacerà ) nonostante gli altri pregi che sappiamo ( spazio affidabilità sicurezza ecc ) forse sarei andato su un turbo essendo comunque una caratteristica importante o comunque che tu sai che è importante e che non ti piace. Scusate le domande dirette ma sono volte solo a capire e senza assolutamente nessun intento polemico anche perchè a me servono solo informazioni e confronto con chi ne sa molto piu di me ( quindi praticamente tutti voi ) ,,,,,,,,,,,,,,
New Classe S Brabus: 730CV,https://www.bmwpassion.com/forum/threads/new-classe-s-brabus-730cv.15439/,2003-05-23 00:00:00,El Nino,,BRABUS S V12 S Biturbo 6233 cc 730 hp a 5100 giri 1100 Nm a 2100 giri Accelerazione 0-100 km/h: 4 s 0-200 km/h: 11.9s Velocità max: 340 km/h ,,,,,,,,,,,,,,
ho tradito: la mia 147 è dall'installatore GPL,https://www.autopareri.com/forums/topic/10325-ho-tradito-la-mia-147-%C3%A8-dallinstallatore-gpl?&page=2#comments,2004-12-23 13:52:43,luxan,,Per quel poco di strada che sono riuscito a fare ( visto che mi avevano lasciato pochissimo gas nel serbatoio ) devo dire che l'unica sensazione che ho avuto è che a gpl il motore è un filo meno rapido a prendere giri. Ah il suono è diverso.... soprattutto al minimo. Meno lineare e poi alternato.... insomma un po' più diesel ahimè... Per finire in bellezza cmq ieri sera mi hanno dato una bella chiavata di almeno 20cm sul portellone... sotto il Biscione. CHe incazzatura ! ,,,,,,,,,,,,,,
Arrivate le Nexen!,https://forum.quattroruote.it/threads/arrivate-le-nexen.121254/page-2,2019-02-16 00:00:00,bumper morgan,"'Diciamo che tra una gomma ritenuta buona e una ottima la differenza è trascurabile anche per un ""intenditore"". Ma sarebbe meglio dire tra una ottima e una eccellente. Come ha detto Zinzanbr la puoi verificare in pista e di solito non supera i 2 decimi al km. Tra una scarsa e una buona/ottima invece la differenza è maggiore. Ricordo che molti anni f quando mio figlio aveva una Fiat Punto 2a serie (circa nel 2001 il gommista mi consigliò gomme di una sottomarca di non ricordo quale marca e me le montò. Provai poi la macchina con quelle gomme e non mi convinse come tenuta di strad che appariva significativamente peggiorata. Dissi a mio figlio di stare attent soprattutto sul bagnato. Ebbene dopo qualche giorn sul bagnat in una curva a destra a 90° (che mi disse fatta molto piano) in citt sband invase la corsia opposta e si scontrò con una moto. Per fortuna il tutto avvenne a bassissima velocità e i danni furono solo materiali e di scarsa entità. Finì che buttai quelle gomme e le sostituii con pneumatici di marca (e non andai più da quel gommista....). Questo per dire che ci sono gomme e gomme. Quando scelsi le Nexen (gomme che sono anche di 1° equipaggiamento per la Porsche Cayenn tanto per dire trovai su internet gomme che costavano molto men cifre ridicol ma di marche completamente sconosciut quindi mi sono guardato bene dal prenderle in considerazione.'",ottima risposta....aggiungo solo che anch’io diffido di marche sconosciute o che costano poco ( in genere la sconosciuta é a buon prezzo e spesso é cinesi ) ma di marche come Nexen o Kuhmo mi fido anche se non saranno pari a Pirelli o Conti. ,,,,,,,,,,,,,,
[USA] Subaru WRX 2014,https://www.autopareri.com/forums/topic/53455-usa-subaru-wrx-2014,2013-11-11 20:55:04,Ospite,,Speriamo di no sembra un'auto cinese. ,,,,,,,,,,,,,,
BMW X1 2015,https://www.autopareri.com/forums/topic/58544-bmw-x1-2015?&page=7#comments,2015-06-03 12:24:30,Dannatio,,Sai che è vero ? un mio amico nel Vicentino è passato da 535D Touring ( E61 ) nera met. cerchio alu etc..etc... alla stessa in versione recente bianca ( F11 ) con cerchio spietato nero. ,,,,,,,,,,,,,,
147 1.9 150cv VS skoda octavia 2.0 170cv,https://www.bmwpassion.com/forum/threads/147-1-9-150cv-vs-skoda-octavia-2-0-170cv.38783/page-2,2004-11-22 00:00:00,Roger84,"""David e una Octavia 2.0 TDI DSG Elegance SW con pacchetto sportiv bixen tetto apribile e sedili in stoffa/pelle? Scontata la danno via a 23K€ Se sei abituato a guidare vetture tedesch il passaggio alla Skoda è innavertibil dato che è a tutti gli effetti tedesca. Alfa lascia perder vedendo come stanno uscendo le ultime 147 da metà 200 mi verrebbe da andare a Pomigliano con una bomba nucleare per radere al suolo quella fabbrica di sfaticati. Ho convinto un mio amico dopo anni di VW a prendersi una 147 JTDm BlackLine 120CV con DPF. Bellissima. Ma quando ti ritrovi: -sedili con cuciture sfilacciate -scricchiolii a go go (la mia faceva solo una vibrazione al quadro strument risolta con un feltrino) -spoiler posteriore con goccie di vernicie -cielo con macchie che non vengono più via ...e sopratutto un concessionario che per lui E' TUTTO NORMALE (! ti viene voglia di prendere a calci i signori Alfa di Pomigliano assieme a quelli della concessionaria. Marchionne aveva ragione: con Alfa c'è parecchio da lavorare. Ma io dico: un modello a fine carriera dovrebbe essere perfetto. Perchè ca@@o l'annata 2001-2002 risulta la migliore tutt'ora? Le Bravo costruita a 40Km di distanza da Pomigliano SONO PERFETTE! Mah! A per la cronaca il mio amico è per mano di avvocat ha svenduto la macchina e sta aspettando per fine giugno una Golf 2.0TDI Sportline""",Mma dipende x cosa ti serve Davide e cosa cerchi ! Come prezzi siamo lì come motore ovviamente il tdi 170cv Audi/vw è superiore al collaudato ma vecchio 150cv Fiat anche se ne eroga circa 160....:wink: La 147 secondo me è + giovanile e con il Q2 e un assetto decente dovrebbe essere divertente da guidare ma anche la RS ha un bell'assetto xciò....in questi casi ti direi di provarle entrambe e di scegliere ! ! ! ,,,,,,,,,,,,,,
Configuratore Scala pezzo elevato.,https://forum.quattroruote.it/threads/configuratore-scala-pezzo-elevato.121988/,2019-04-04 00:00:00,gbortolo,"""Farei anche il confronto con l'octavi ovviamente non ho dettagli degli allestiment ma la differenza mi sembra pochina... La berlina Octavia 1.6 TDI SCR 115 CV Ambition (quindi allestimento non bas qualcosina in meno probabile lo abbia sul fronte tecnologico) a listino è 24.49 praticamente uguale.""",E' anche possibile che l'Octavia in phase-out possa costare uguale al modello inferiore al lancio ovvero che sia premessa ad un ulteriore rialzo del listino al lancio della Octavia IV. Va detto che anche discutere di pianali B/C/D almeno per VW mi pare diventato aleatorio da quando hanno introdotto il MQB ovvero una struttura modulare per cui variano larghezze e lunghezze ma la piattaforma è la medesima. Soprattutto a livello di componente elettronica. Quindi anziche dire che è il pianale Polo allungato ( che è un Golf accorciato e ristretto ) si potrebbe dire che è il semplicemente il pianale Golf ristretto. Almeno così mi par di aver capito. ,,,,,,,,,,,,,,
Ho visto una Civic X....,https://forum.quattroruote.it/threads/ho-visto-una-civic-x.110431/page-22,2017-07-20 00:00:00,elancia75,'Non volevo essere offensivo e mi scus però rimane il fatto che la tr poi magari i numeri diranno anche che mi sbagli dentro a me è parsa più piccola di una golf per dir nonostante la lunghezz solo questo.',A me invece sembra più larga avvolgente ed ergonomica di Golf ... come d'altra parte l'attuale Civic. Dietro però Golf ha più luce ( luminosità ) . Civic attuale ha divano basso e questo migliora l'abitabilità posteriore sicuramente in altezza ed in parte anche come distanza dai sedili. ,,,,,,,,,,,,,,
Impressione statica Classe S e CLS,https://www.autopareri.com/forums/topic/15431-impressione-statica-classe-s-e-cls,2005-09-15 05:04:59,Roby,,"Poichè lavoro di fronte a un grande concessionario Mercedes oggi sono stato a dare un occhiata alla nuova classe S.Non hanno ancora fatto la presentazione ufficiale ma la macchina era lì in bella mostra. Si avvicina il momento di sostituire una delle auto dell'azienda e la scelta potrebbe ricadere su un'altra classe E una S ( modello uscente ) o forse anche una S nuova. Esternamente la macchina è molto bella. I parafanghi pronunciati si notano molto meno che in foto e dal vivo sembrano meglio integrati nella linea. la prima cosa che salta all'occhio è che non sembra assolutamente una macchina di 5 metri ! un gran macchinone sì ma le proporzioni generali sono quelle di una E. La classe S attuale ( uscente ) aveva una linea molto filante ma si percepiva il fatto che fosse sensibilmente più lunga di una E. all'interno si ritrova la cura a cui il cliente SonderKlasse è abituato. Bella la pelle perfetti i dettagli. Onestamente la consolle centrale fa abbastanza BMW ma ci faremo l'abitudine.Per quanto riguarda la funzionalità del mouse ( simil I drive ) bisognerebbe provarlo. Posteriormente ( quello che mi interessa di più ) molto belli i sedili ma in fatto di spazio la differenza con una classe E è appena apprezzabile. Non che sia piccola ma da 5 metri di vettura ti immagini di poterti sdraiare.....la versione a passo lungo sarebbe quella adatta. I venditori non sono ancora informati e ""formati"" circa le caratteristiche del modello poichè devono ancora seguire il corso e il prezzo del 320 Cdi non è stato ancora ufficializzato. Ho lasciato contatti vi farò sapere. ma quella di cui mi sono ulteriormente innamorato è la CLS ! ! Bellissima sia fuori che dentro. Il posto guida è perfetto ( il sottoscritto è alto 193cm ) si guida quasi distesi posizione volante e pedaliera ineccepibile. In effetti ci si ""sente un pò gli arredi addosso"" nel senso che non c'è una gran sensazione di spazio ma d'altronde siamo su una coupè. In più aveva anche il tetto apribile quindi il tetto si abbassa di un buon cinque centimetri il colore scuro degli interni e i vetri piccoli facevano il resto. Dietro l'accessibilità non è comodissima ma una volta seduti si sta davvero comodi. I finestrini si abbassano di qualche millimetro appena si apre la maniglia come sulla Porsche per uscire dalla guarnizione. Ero con mio fratello è mio padre ( alti come me ) e ci siamo seduti tutti dentro. Non si devono assumere posizioni costrette anche se non c'è la libertà di movimento di una berlina bisogna un pò calarsi nei sedili che anche dietro sono singoli. In definitiva davvero bella elegante e sportiva senza essere eccessiva. Forse però non sarebbe la macchina più adatta per il nostro lavoro anche se è quella che mi piace di più. Quando avrò maggiori notizie le posterò. saluti ",,,,,,,,,,,,,,
FORD CMAX 100 CV ECOBOOST,https://forum.quattroruote.it/threads/ford-cmax-100-cv-ecoboost.108896/page-2,2017-03-28 00:00:00,FRANGIUS,,Quindi purtroppo ho capito che non c'è nessuno almeno tra gli utenti di questo forum che possiede una C Max come la mia e quindi non mi può aiutare circa le mie 2 richieste.Dovrò rivolgermi direttamente alla Ford competente. ,,,,,,,,,,,,,,
predisposizione RTI Volvo,https://www.autopareri.com/forums/topic/52352-predisposizione-rti-volvo,2013-07-22 20:24:56,Gynt,,Ciao a tutti ! Volevo sapere un po più nei dettagli a cosa serve la predisposizione RTI su volvo ? ( V40 ) Ho capito che serve per degli aggiornamenti ma non ho capito di che aggiornamenti si tratta se solo del navigatore o anche della centralina e altre cose. Nell'attesa ringrazio tutti per le risposte ,,,,,,,,,,,,,,
Alfa Romeo 4C spider,https://forum.quattroruote.it/threads/alfa-romeo-4c-spider.96939/page-4,2016-06-28 00:00:00,pilota54,,Interessante test in pista a Vairano.... http://www.quattroruote.it/news/prove_su_strada/2016/06/28/alfa_romeo_4c_in_pista_con_la_1_750_tbi_spider.html Tempo: 1.19.21 4 decimi più della 4C coupè e oltre 2 secondi meglio della Lotus Elise S ( 220 cv ) . ,,,,,,,,,,,,,,
Mondiale F.1 - GP del Belgio 2018,https://forum.quattroruote.it/threads/mondiale-f-1-gp-del-belgio-2018.118009/page-10,2018-08-26 00:00:00,?angelo0,'eheheheh super gara può darsi che la Ferrari avesse ancora un po di margine vista la prestazione senza sbavature di Vettel. Spero solo che in vista di Monza non abbiano spremuto troppo il motore... quanto mi piacerebbe esser lì',Sono sicuro che non Hanno spremuto il Massimo ma ne anche in MB dopo che Hamilton ha capito che non c'era niente da fare ha risparmiato il motore. Gli undici S+di distacco sono un poco bugiardi spero che il Team non ci dorma sopra e per Monza fa si che i 5 S di vantaggio restino anche li. Per Monza se il Team non fa i soliti sbagli dovrebbe esserci un altra Vittoria Ferrari.Hai visto oggi in MB e ritornato il problema ruote Ferrari non ha solo la migliore PU ma ha anche la macchina piu equilibrata Grande telaio. Certo se debbo essere sincero piacerebbe anche a me scendere a Monza ma se mio figlio é Libero e sará daccordo magari una passeggiata la facciamo... ,,,,,,,,,,,,,,
Alfa Romeo Giulietta (Topic Ufficiale - 2009),https://www.autopareri.com/forums/topic/36127-alfa-romeo-giulietta-topic-ufficiale-2009?&page=1128#comments,2010-11-18 15:44:07,stev66,,A saperlo prima....c'era un'affarone per te altro che Giulietta ! ! ! ! L'asino Hermann congedato con disonore Fa discutere la decisione della Bundeswehr: l'animale dopo anni di fronte è stato ceduto ad un mercato a 100 dollari. L'asino Hermann congedato con disonore - Corriere della Sera ,,,,,,,,,,,,,,
In attesa di quella giusta dal mio importatore di fiducia...,http://www.porschemania.it/discus/messages/771175/843054.html?1544023662,2018-09-27 15:27:00,bibbo1979,,Ciao e benvenuto. Invece di rimappare ( illegale ) prendi il 3.0 benzina hai 2 cilindri e tanto divertimento in pi\xf9 rispetto al 2.0,,,,,,,,,,,,,,
Leon motorizzazione 2.0 tdi euro 6 crlb,https://forum.quattroruote.it/threads/leon-motorizzazione-2-0-tdi-euro-6-crlb.96829/,2015-06-13 00:00:00,topomillo,"Arriva o è arrivata o non arriva? Letto su altri forum ""barbari"" che tale motore si differenzia non poco dall'attuale euro ma a listino non lo vedo. A parte la coppia 340 nm anzichè 32 anche la fasatura differente mi sembra. Chi sa qualcosa? L'onnisciente Topomillo??? :lol:... curiosa la cosa! effettivamente la leon x-perience 2.0 tdi 150 cv omologata euro 6 riporta una coppia massima di 340 NM anzichè 320 come nelle versioni euro 5 a 2 ruote motrici. 'Arriva o è arrivata o non arriva? Letto su altri forum ""barbari"" che tale motore si differenzia non poco dall'attuale euro ma a listino non lo vedo. A parte la coppia 340 nm anzichè 32 anche la fasatura differente mi sembra. Chi sa qualcosa? L'onnisciente Topomillo??? :lol:'",Provata la 4x4 e la coppia maggiore si sente ,,,,,,,,,,,,,,
nuovo motore a benzina senza candele hyundai,https://forum.quattroruote.it/threads/nuovo-motore-a-benzina-senza-candele-hyundai.83486/,2013-11-18 00:00:00,lazzaridario49,,Avete appreso la novita' hyunday del motore benzina gdci senza candele ha una resa superiore e funziona come un diesel e non ha il fap valvola egr senza tanta manutenzione un 1 8cc eroga a soli 4500g/1^ 180hp e un consumo inferiore del 25% di un motore a benza speriamo che arrivi il piu presto possibile in italia.. se riescono anticipare il motore ad idrogeno che e' gia pronto....sarebbe il plusultra ma visto che le sette sorelle non le gusta la cosa...dobbiamo attendere... ! ! ! ,,,,,,,,,,,,,,
Jaguar XF 3.0 Diesel (240 cv),https://forum.quattroruote.it/threads/jaguar-xf-3-0-diesel-240-cv.35931/,2011-06-10 00:00:00,belpietro,,sono a 4300 km circa. presa ai primi di maggio. per quello che posso dire con così poca esperienza sono molto soddisfatto. ,,,,,,,,,,,,,,
Una S8 corre tranquilla a 300 km/h,https://www.autopareri.com/forums/topic/23024-una-s8-corre-tranquilla-a-300-kmh,2007-04-13 16:35:08,lukka1982,,Beh con le autostrade che ci ritroviamo... direi per fortuna ! ! ! ,,,,,,,,,,,,,,
RAV 4 AWD e differenze nei controlli del paddle spiegatemi un po',https://forum.quattroruote.it/threads/rav-4-awd-e-differenze-nei-controlli-del-paddle-spiegatemi-un-po.122460/,4 Maggio 2019 alle 11:23,Pino Josi,,"il web è pieno di video della nuova RAV 4 AWD quello che ho notato è che l'auto viene consegnata in differenti configurazioni a seconda del paese mi riferisco al paddle e alle opzioni presenti nei pulsanti AWD Ad esempio stati uniti ma anche est europa ecc si trova DAC ( cioè l'aiuto alla discesa ) il pulsante SNOW ed altro come chiaramente appare in questa foto: mentre le ""nostre"" hanno solo il pulsante EV ( trazione solo elettrica ) ed il pulsante TRAIL che per quello che ho capito è una sorta di simulazione dell'autobloccante ecco qui: potreste spiegarmi queste differenze ? ma soprattutto quale delle due vetture è meglio dal punto di vista della trazione e dell'aggiornamento dell'elettronica ? <img alt=""[​IMG]"" class=""bbCodeImage LbImage"" data-url=""https://i.ibb.co/Wx4fDLT/01.jpg"" src=""https://i.ibb.co/Wx4fDLT/01.jpg""/> <img alt=""[​IMG]"" class=""bbCodeImage LbImage"" data-url=""https://i.ibb.co/ZWxHXZ8/02.jpg"" src=""https://i.ibb.co/ZWxHXZ8/02.jpg""/>",,,,,,,,,,,,,,
Nuovo logo Lancia,https://www.autopareri.com/forums/topic/22392-nuovo-logo-lancia?&page=19#comments,2007-03-08 23:09:39,Outlaw,,Poi con tutto quel blu a me ricorda il logo Fiat appena cassato. Spero che colgano le critiche e da qui a luglio ne approfittino per lasciar cadere nel dimenticatoio questa pessima idea che hanno avuto. ,,,,,,,,,,,,,,
Talisman Sporter 1.6 dCi Initiale Paris. Primi 20.000 km.,https://forum.quattroruote.it/threads/talisman-sporter-1-6-dci-initiale-paris-primi-20-000-km.109063/page-17,2017-12-26 00:00:00,nicolagerini1979@gmail.com,,Ottimo.... Anche perché opterei sulle tante offerte km0 col cambio automatico. Sui 20.000 euro ,,,,,,,,,,,,,,
Incompetenza Bmw Italia!!!!!,https://www.bmwpassion.com/forum/threads/incompetenza-bmw-italia.94732/page-2,2008-09-22 00:00:00,lemone123d,"""a questo punto mi sorge un dubbio...oltre all'olio dovrò ricambiare pure il filtro dell'olio oppure quello posso tenerlo?domanda stupida ma il dubbio ce l'ho...""",vedrai come cambia quando torni al tws....in effetti anche il mio conce il tws lo tiene in confezioni da 1 kg ,,,,,,,,,,,,,,
consumo olio,https://www.autopareri.com/forums/topic/7233-consumo-olio,2004-06-11 07:54:52,duetto80,,"Non avevo capito pensavo che tu l'avessi ritirata a gennaio con 8000 km Comunque 1/2 kg per 8000 km non mi sembra troppo teniamo presente che nei primi 10.000 il consumo può essere superiore alla norma. Perchè andare dal conce : : Vai da un ricambista compra 1kg di olio ( controlla il tipo sull'etichetta posta nel vano motore o sul battente della portira guidatore ) e fai ""da te"" il rabbocco. ATTENZIONE: non superare MAI il limite MAX. ( cosa che molti conce fanno ) . Paraolio candele e catalizzatore potrebbero icaXXXarsi ",,,,,,,,,,,,,,
Museo Alfa Romeo: finalmente il TAR ha respinto il vergognoso ricorso contro il vincolo.,https://forum.quattroruote.it/threads/museo-alfa-romeo-finalmente-il-tar-ha-respinto-il-vergognoso-ricorso-contro-il-vincolo.49441/page-208,2013-07-31 00:00:00,giampi47,,+++ Attached files /attachments/1648803=28290-DSCF6769 - da 4R- Ott.Nov. 1970-foto 5.JPG ,,,,,,,,,,,,,,
Meglio i Concessionari ufficiali o saloni multimarche?,https://www.bmwpassion.com/forum/threads/meglio-i-concessionari-ufficiali-o-saloni-multimarche.345630/,2007-03-27 00:00:00,Ale_72,'Che poi bisognerebbe capire come un auto possa costare meno da un multimarche visto che c’è un passaggio ulteriore rispetto al concessionario ufficiale ...per me i multimarche nn dovrebbero esistere',"Ciao a tutti apro questo post ""generico"" in cui mi piacerebbe sapere cosa pensate del confronto ma anche e perchè no dare consigli e opinioni sia su concessionarie Bmw che multiimarche nelle varie aree geografiche.Sono sempre stato un fanatico dei saloni dei brand con la ferrea convinzione che la cosa migliore fosse acquistare Bmw in Bmw Audi in Audi ecc... Inoltre nell'immaginario collettivo e a ragione delle esperienze di molti i multimarche erano quelli che scalavano i km che vendevano le macchine incidentate ecc....I tempi sono cambiati e per fortuna oggigiorno è un po più difficile ( ma non impossibile ) fare i furbetti. Certamente acquistare un auto in Bmw ti da una sensazione diversa e parlo di esperienza d'acquisto ti senti ""spesso ma non sempre"" più coccolato hai una garanzia di 2 a volte 4 anni e soprattutto sai che in caso di ""fregature"" mamma Bmw può intervenire . Il salone multimarche ( oggi ce ne sono di seri e importanti ) generalmente hanno prezzi un po' più accessibili spesso la valutazione dell'usato è un po' più favorevole ma la garanzia spesso è un po' incompleta i finanziamenti un po meno convenienti e hai sempre ( parlo per me ) quel maledetto dubbio che qualcosa potrebbe andare storto. E altrettanto vero che qualcuno si è trovato male anche in Bmw e non solo con l'usato ma anche proprio con la garanzia...e quindi ? Cosa è giusto fare ? Cosa ne pensate ? Io ho da poco ( come qualcuno sa ) ho firmato per un usato in un salone multimarche l'auto mi è piaciuta ho controllato tutto quello che potevo della storia dell'auto e mi sembra ok il titolare si è dimostrato preparato e disponibile...prezzo e valutazione usato onesti circa 3000 € in meno che in bmw...garanzia un po a cazzum..speriamo di non averne bisogno...insomma ho fatto qualcosa contrario al mio modo di essere...Aspetto le vostre opinioni.. dove avete acquistato la vostra Bmw ? Come vi siete trovati ? ",,,,,,,,,,,,,,
Audi A1 2011,https://www.autopareri.com/forums/topic/37039-audi-a1-2011?&page=108#comments,2010-12-15 23:29:36,J-Gian,,Oh... Se ste cose interessano... Poi non so quanto vada meglio di una Polo e quali altre qualità possa avere... In ogni caso penso che il grosso mercato viva principalmente con quelle 3 cose che hai indicato... ,,,,,,,,,,,,,,
Nissan Skyline GT-R concept,https://www.bmwpassion.com/forum/threads/nissan-skyline-gt-r-concept.16190/,2005-08-17 00:00:00,piccinino,,Torna uno dei 6 cilindri jap più incazzato al mondo... ,,,,,,,,,,,,,,
Mercedes Classe A200 CDI del 2006 che cambio monta?,https://forum.quattroruote.it/threads/mercedes-classe-a200-cdi-del-2006-che-cambio-monta.103609/page-3,2016-04-15 00:00:00,sheva850,,Perfetto direi ora ho un quadro più chiaro sono felice che tu abbia compreso il senso della mia domanda. Grazie ! ,,,,,,,,,,,,,,
Museo Alfa Romeo: finalmente il TAR ha respinto il vergognoso ricorso contro il vincolo.,https://forum.quattroruote.it/threads/museo-alfa-romeo-finalmente-il-tar-ha-respinto-il-vergognoso-ricorso-contro-il-vincolo.49441/page-248,2014-03-23 00:00:00,giampi47,,Corretta sequenza foto ------ 8082 --- 8084 --- 8085 --- Attached files /attachments/1780795=35020-DSCF8082.JPG /attachments/1780795=35021-DSCF8084.JPG /attachments/1780795=35019-DSCF8085.JPG ,,,,,,,,,,,,,,
Volkswagen Up! 2011,https://www.autopareri.com/forums/topic/44234-volkswagen-up-2011?&page=23#comments,2011-09-13 16:22:07,marcopolo,,Una discreta macchinetta non brutta ma continuo a guardarla e a domandarmi perchè hanno voluto creare tutta questa attesa negli ultimi anni. Che ha di speciale ? ? ,,,,,,,,,,,,,,
Lancia Ypsilon - La storia infinita........,https://www.autopareri.com/forums/topic/2744-lancia-ypsilon-la-storia-infinita,2003-10-28 10:39:37,Blu Pitti,,fatti coraggio che quando t'arriva sarai l'uomo + felice di questa terra.... T'invidio assai.... Buona YPSILON ! ! ! ,,,,,,,,,,,,,,
Disposizione meccanica da segmento D in su,https://www.autopareri.com/forums/topic/35739-disposizione-meccanica-da-segmento-d-in-su?&page=3#comments,2009-11-02 12:51:32,_hainz,,E' vero che parliamo a livello ideale però il pianale e la meccanica di GT-R costa uno sfracello e non lo si condivide con nessun'altra ( oltre ai problemi di peso come hai giustamente riportato tu ) oltre al fatto che difficilmente ci sarà gente disposta a comprarti una berlina con 250dm-300^3 di bagagliaio. Secondo me è quasi impossibile avere un pianale unico per TA/TI e TP/TI bisogna scegliere o bisogna farne due cosa che con le dimensioni e le vendite di Fiat-Chrysler è possibile ( tant'è che 300c e GranCherokee hanno due pianali differenti ) . ,,,,,,,,,,,,,,
