Titolo,URL,Timestamp,User,(Testo Citato),TESTO,Costruttore,Modello,Brand,Interni,Esterni,Meccanica,Prestazioni,Consumi/Autonomia,Motore,Elettrico,Fuoristrada,Elettronica di Bordo,Manutenzione,Assistenza/Concessionari
DACIA GPL NUOVA Quando cambio le marce e schiaccio la frizione sale su di giri,https://forum.quattroruote.it/threads/dacia-gpl-nuova-quando-cambio-le-marce-e-schiaccio-la-frizione-sale-su-di-giri.119650/,2019-03-06 00:00:00,Utente_2455367868,,Egregio sig. ........ riscontriamo con la presente la Sua comunicazione desiderando rappresentarLe quanto segue. Con riferimento alla gestione del minimo del motore da Lei considerato “accelerato” Le significhiamo che questo rientra nel normale range di funzionamento del veicolo in argomento e trattasi di una strategia dei sistemi di iniezione di ultima generazione. Tale innalzamento dei giri permette di agevolare l’avvio del veicolo durante le fasi si stacco della frizione consentendo di spostare più agevolmente la massa dello stesso con riduzione dei consumi di carburante in aggiunta di avere una temperatura costante del catalizzatore per migliorare il trattamento degli inquinanti. Per una migliore precisazione di quanto sopra esposto tale funzionamento del veicolo non è altro che una caratteristica dovuta alla logica di gestione della centralina motore ( Engine Control Unit ) del veicolo la quale per salvaguardare il catalizzatore e abbattere le emissioni nocive in talune situazioni aumenta sensibilmente il numero dei giri motore. In relazione a quanto sopra evidenziato è da ritenersi del tutto normale questa caratteristica di funzionamento del motore che senz’altro non pregiudica la sicurezza e l’affidabilità della Sua Dacia. Pertanto Le confermiamo che il veicolo Dacia ( xxxxxxxxxxxxxxxxxxxxxxxxxxxx ) non è affetto da alcun vizio costruttivo. Cionondimeno La informiamo di aver inoltrato le Sue considerazioni ai reparti di competenza per le opportune valutazioni del caso al fine di offrire prodotti sempre più in linea con quelle che sono le aspettative della ns Spettabile Clientela. Confidando di aver fornito tutti i chiarimenti del caso l’occasione ci è gradita per porgerLe i nostri migliori saluti. Questa è una delle mail di risposta avuta dall'assistenza clienti dacia in pratica non ti dicono nulla sto pensando seriamente di cambiare autovettura ma cambiando completamente marca ,,,,,,,,,,,,,,
AY UN CARRO ALEMAN EN SANTIAGO!,http://www.porschemania.it/discus/messages/10550/838849.html?1531474636,2018-07-11 09:23:00,nic65,,Ho appena acquistato una copia del libro di Mario,,,,,,,,,,,,,,
Consumi Audi Q3 2.0 TDI 150CV,https://forum.quattroruote.it/threads/consumi-audi-q3-2-0-tdi-150cv.103221/page-6,2016-04-04 00:00:00,gallongi,,E ci correvano pure con le 2cv ,,,,,,,,,,,,,,
Problemi Porsche Cayenne S,https://forum.quattroruote.it/threads/problemi-porsche-cayenne-s.80848/,2013-08-24 00:00:00,Christian95,,Da circa 2 anni nella mia Porsche Cayenne S ( anno 2006 ) si fulminano le luci di svolta e a volte anche gli anabbaglianti. E' normale che ogni 10 volte si fulminino ? Inoltre negli ultimi giorni si accende la spia del malfunzionamento del controllo di trazione per poi spegnersi se percorro un po' di chilometri cosa può essere secondo voi ? Premetto che l' officina autorizzata Porsche non è riuscita a darmi una risposta concreta ! ,,,,,,,,,,,,,,
Finalmente è arrivata!!!!!!!,https://www.autopareri.com/forums/topic/6083-finalmente-%C3%A8-arrivata?&page=3#comments,2004-04-17 11:24:06,Betha23,,Ops l'ultima parole è BENE non MALE. :wink: ,,,,,,,,,,,,,,
Consigli su bmw 320d usata,https://forum.quattroruote.it/threads/consigli-su-bmw-320d-usata.120017/,2018-12-27 00:00:00,albe23@outlook.it,,Ciao a tutti e buone feste.. Al momento possiedo una golf 6 ma per delle necessità vorrei passare a una segmento D usata. L' auto che più mi aggrada è la serie 3 sempre piaciuta... Faccio circa 25.0000 km l' anno in prevalenza extraurbano ( montagna ) come budget non vorrei passare i 20.000 euro. Ho adocchiato vicino alla mia zona questa: https://www.autoscout24.it/annunci/...32ccf7c-1677-ad4c-e053-e350040ab61f ? cldtidx=6 I miei dubbi sono sul motore da 184 cv se differenzia molto da quello successivo da 190 non in termini di prestazioni quanto di affidabilità.. E se la manutenzione rispetto alla golf che ho ( 2.0 tdi ) costa molto di più. Già messo in conto bollo e assicurazione.Aspetto opinioni. Grazie ! ,,,,,,,,,,,,,,
Chi ha fatto tantissimi KM con le proprie Renault?,https://forum.quattroruote.it/threads/chi-ha-fatto-tantissimi-km-con-le-proprie-renault.3119/page-7,2010-05-27 00:00:00,manuel46,,Beh ma quelli non sono inconvenienti è normale manutenzione credo che oltre i 100.000km difficilmente si hanno ancora ammortizzatori efficaci.......poi certo dipende dall'uso che se ne fa dell'auto ! ,,,,,,,,,,,,,,
Moderazione forum Fiat,https://forum.quattroruote.it/threads/moderazione-forum-fiat.2574/page-4,2009-10-27 00:00:00,conan2001,""" vorrei ricordare che se una polemica va avanti certamente non lo fa se la porta avanti uno solo. non so se l'admin se ne è accorto m qualsiasi io cosa scriv ci sono certi personaggi che intervengono sempre e sempre con argomenti contrari. solo per partito preso. cosa devo fare? tacere? e perchè non tacciono loro? sarò tutto quello che volete ma mica avrò sempre torto? e poi finchè uno continua a dirmi che non so quotare vuol dire che non ha altri argomenti per ribattere. si fosse preso la briga di insegnarmelo avrebbe fatto più bella figura.... a me che tu non sia capace di quotare non me ne può fregare di meno. quando scrivi delle boiate io ti rispondo con fatti e dati molto precisi (e senza offender al contrario tuo...) che puntualmente smascherano la tua malafede e ai quali tu non hai puntualmente nessun tipo di argomento per avvalorare la tua tesi.e allora fai la vittim il perseguitat quello che ce l'hanno tutti con lui.... che il clown di turno si chiami ton bepi o nane poco importa. io non parto per partito pres ci mancherebb mica mi hai fatto nulla di male.solo che hai intrapreso una battaglia personale contro fiat (e anche questo a me non me ne può fregare di meno.. però sono libero di correggere ogni tua affermazione 'inesatta e il fatto che tu non hai argomenti per ribattere ai miei la dice lunga...il fatto che sia contro fia ripet a me non nimporta null io mica ci mangio con fia e se in possesso di informazioni tali da permetterlo ti risponderei allo stesso modo che parlassi di renault (e non renò... for bmw ecc... ""vorrei ricordare che se una polemica va avanti certamente non lo fa se la porta avanti uno solo. non so se l'admin se ne è accorto m qualsiasi io cosa scriv ci sono certi personaggi che intervengono sempre e sempre con argomenti contrari. solo per partito preso. cosa devo fare? tacere? e perchè non tacciono loro? sarò tutto quello che volete ma mica avrò sempre torto? e poi finchè uno continua a dirmi che non so quotare vuol dire che non ha altri argomenti per ribattere. si fosse preso la briga di insegnarmelo avrebbe fatto più bella figura.""",per fortuna non parli per partito preso.... spiegami perchè il clown di turno non si può chiamare salvo gennaro o gaspare ? ,,,,,,,,,,,,,,
Ford Fiesta Mk5 - Vuoti di potenza etc.,https://forum.quattroruote.it/threads/ford-fiesta-mk5-vuoti-di-potenza-etc.116400/,2018-05-06 00:00:00,Mr.Markus88,,"Salve è ormai 1 mesetto che la mia Ford Fiesta Mk5 1.6 90cv 119.000km presenta questi problemi: Accellerazione in generale diminuita In accellerazione vuoti di potenza intorno ai 2000giri Fumate nere ai giri alti Ultima ma non ultima ieri in autostrada tirandola un po' EAC fail su cruscotto lampeggiante con accellerazione più che dimezzata finchè non ho spento il motore per 10/15 min ed è tornato ""tutto a posto"" idee e consigli su dove cominciare a guardare ? Grazie ",,,,,,,,,,,,,,
Problemi incredibili Focus II 1.6 TDci 90CV,https://forum.quattroruote.it/threads/problemi-incredibili-focus-ii-1-6-tdci-90cv.7405/page-2,2009-08-04 00:00:00,rema07_99,"pandaquattroperquattro ha scritto: rema07_99 ha scritto: pandaquattroperquattro ha scritto: Skurgaz ha scritto: Se posso dare il mio parer un cambio non dovrebbe cedere prima dei 500.000km così come i differenziali. Le uniche parti che sono da sostituire sui 100.000 km potrebbero essere la frizion i dischi freno e la guarnizione della testata. Per la turbin se fatta bene dovrebbe durare almeno 200.000km. Mi spiace per quello che ti è success ma ovviamente non te lo possono passare in garanzia.... Ma hai perfettamente ragion quando scrivi ""dovrebbe"". Purtroppo molte volte non è cos e in ogni marchio si hanno tantissimi casi di auto che hanno problemi che in teoria non dovrebbero avere. Cambi e turbine che cedono prima dei centomila sono all'ordine del giorno. Sarebbe bello per noi consumatori che un cambio durasse come scrivi tu 500mila chimetr anche se probabilmente cederebbereo prima tutte le altre parti del veicolo!!!... ma chi sei Lapo Elkan per caso? :lol: :lol: :lol: :lol:... Cioè? :?:... cioè sembra che vuoi portare l'acqua al mulino dei costruttori invece di difendere il consumatore. In fondo se tutti sono pecoroni e acquistano l'auto solo perchè è fighetta anche se di cartone i costruttori ci marceranno sempre più in questa direzione. Ma poi dico non conosci Lapo Elkan? ma dove vivi?... ** A parte che conosco come conosci tu Lapo Elkan (cioè non di person ma solo per ciò che combina non avevo capito il tuo argutissimo paragone: sarei Lapo perchè a tuo dire difendo i costruttori di automobil nel caso specifico Ford? No car fino ad ora non mi è mai capitato di difendere un Costruttore automobilistic ma nel difendere un acquirente di un veicolo non si può cercare di aver ragione affermando che un veicolo deve arrivare a 500.000 chilomentri o quantomeno a 250.000 senza alcun difetto. Non è sostenibil nelle leggi della probabilit tale evenienza è puramente utopica o di minima rilevanza. Capitano auto cos ma è difficile sostenere che tutte lo possano/debbano essere. In ogni cas se ritieni di poter argomentare in giudizio la tua tesi e se sei abilitato al patrocini perchè non assumi tu le difese dell'utente che ha aperto il post lamentandosi dei ""problemi incredibili"" alla sua auto di centomilachilometri (rottura di due ingranaggi del cambi senza sapere come usa il cambio...). ' pandaquattroperquattro ha scritto: rema07_99 ha scritto: pandaquattroperquattro ha scritto: Skurgaz ha scritto: Se posso dare il mio parer un cambio non dovrebbe cedere prima dei 500.000km così come i differenziali. Le uniche parti che sono da sostituire sui 100.000 km potrebbero essere la frizion i dischi freno e la guarnizione della testata. Per la turbin se fatta bene dovrebbe durare almeno 200.000km. Mi spiace per quello che ti è success ma ovviamente non te lo possono passare in garanzia.... Ma hai perfettamente ragion quando scrivi ""dovrebbe"". Purtroppo molte volte non è cos e in ogni marchio si hanno tantissimi casi di auto che hanno problemi che in teoria non dovrebbero avere. Cambi e turbine che cedono prima dei centomila sono all'ordine del giorno. Sarebbe bello per noi consumatori che un cambio durasse come scrivi tu 500mila chimetr anche se probabilmente cederebbereo prima tutte le altre parti del veicolo!!!... ma chi sei Lapo Elkan per caso? :lol: :lol: :lol: :lol:... Cioè? :?:... cioè sembra che vuoi portare l'acqua al mulino dei costruttori invece di difendere il consumatore. In fondo se tutti sono pecoroni e acquistano l'auto solo perchè è fighetta anche se di cartone i costruttori ci marceranno sempre più in questa direzione. Ma poi dico non conosci Lapo Elkan? ma dove vivi? ' rema07_99 ha scritto: pandaquattroperquattro ha scritto: Skurgaz ha scritto: Se posso dare il mio parer un cambio non dovrebbe cedere prima dei 500.000km così come i differenziali. Le uniche parti che sono da sostituire sui 100.000 km potrebbero essere la frizion i dischi freno e la guarnizione della testata. Per la turbin se fatta bene dovrebbe durare almeno 200.000km. Mi spiace per quello che ti è success ma ovviamente non te lo possono passare in garanzia.... Ma hai perfettamente ragion quando scrivi ""dovrebbe"". Purtroppo molte volte non è cos e in ogni marchio si hanno tantissimi casi di auto che hanno problemi che in teoria non dovrebbero avere. Cambi e turbine che cedono prima dei centomila sono all'ordine del giorno. Sarebbe bello per noi consumatori che un cambio durasse come scrivi tu 500mila chimetr anche se probabilmente cederebbereo prima tutte le altre parti del veicolo!!!... ma chi sei Lapo Elkan per caso? :lol: :lol: :lol: :lol:... Cioè? :?: ' pandaquattroperquattro ha scritto: Skurgaz ha scritto: Se posso dare il mio parer un cambio non dovrebbe cedere prima dei 500.000km così come i differenziali. Le uniche parti che sono da sostituire sui 100.000 km potrebbero essere la frizion i dischi freno e la guarnizione della testata. Per la turbin se fatta bene dovrebbe durare almeno 200.000km. Mi spiace per quello che ti è success ma ovviamente non te lo possono passare in garanzia.... Ma hai perfettamente ragion quando scrivi ""dovrebbe"". Purtroppo molte volte non è cos e in ogni marchio si hanno tantissimi casi di auto che hanno problemi che in teoria non dovrebbero avere. Cambi e turbine che cedono prima dei centomila sono all'ordine del giorno. Sarebbe bello per noi consumatori che un cambio durasse come scrivi tu 500mila chimetr anche se probabilmente cederebbereo prima tutte le altre parti del veicolo!!!... ma chi sei Lapo Elkan per caso? :lol: :lol: :lol: :lol: ' Skurgaz ha scritto: Se posso dare il mio parer un cambio non dovrebbe cedere prima dei 500.000km così come i differenziali. Le uniche parti che sono da sostituire sui 100.000 km potrebbero essere la frizion i dischi freno e la guarnizione della testata. Per la turbin se fatta bene dovrebbe durare almeno 200.000km. Mi spiace per quello che ti è success ma ovviamente non te lo possono passare in garanzia.... Ma hai perfettamente ragion quando scrivi ""dovrebbe"". Purtroppo molte volte non è cos e in ogni marchio si hanno tantissimi casi di auto che hanno problemi che in teoria non dovrebbero avere. Cambi e turbine che cedono prima dei centomila sono all'ordine del giorno. Sarebbe bello per noi consumatori che un cambio durasse come scrivi tu 500mila chimetr anche se probabilmente cederebbereo prima tutte le altre parti del veicolo!!! 'Se posso dare il mio parer un cambio non dovrebbe cedere prima dei 500.000km così come i differenziali. Le uniche parti che sono da sostituire sui 100.000 km potrebbero essere la frizion i dischi freno e la guarnizione della testata. Per la turbin se fatta bene dovrebbe durare almeno 200.000km. Mi spiace per quello che ti è success ma ovviamente non te lo possono passare in garanzia.'",e no ! non puoi cambiare le carte in tavola ! finora si è parlato di un normale utilizzo dell'autovettura e quindi anche del cambio. Dato che esistono in giro garanzie anche di 7 anni e dato che in molti modelli l'affidabilità meccanica delle auto è arrivata a chilometraggi prossimi ai 300.000 km il punto è semplicemente di dar seguito a questi progetti affidabili e boicottare quelli inaffidabili. Ma se noi consumatori che siamo gli arbitri del mercato in fase di acquisto difendiamo pure i costruttori che fanno cilecca allora non ci siamo. Per questo ti ho scambiato per un Lapo o un Ford ( ? ? ) anche se dubito a priori che loro non abbiano di meglio da utilizzare il loro tempo per spassarsela. Quindi sostieni anche tu la lotta per una maggiore affidabilità delle parti meccaniche. A volte può essere solo poche decine di euro di lega acciaiosa in più che vogliono risparmiare i costruttori. ,,,,,,,,,,,,,,
altre conferme per la cx3,https://forum.quattroruote.it/threads/altre-conferme-per-la-cx3.72507/,2012-12-07 00:00:00,mommotti,"mommotti ha scritto: Guardate quà: http://www.autoexpress.co.uk/mazda/61612/mazda-cx-3-way Carin 1.6 diesel (fiat?? 1.3 turbo forse a benza.....in commercio seconda metà del 2014.... Gia' il restyling della Mokka :shock: :?:... Non confonderti come solito. Bella rivista auto express...la cx5 ha un 2000 diesel Ma ci son almeno le donne nude su? "" mommotti ha scritto: Guardate quà: http://www.autoexpress.co.uk/mazda/61612/mazda-cx-3-way Carin 1.6 diesel (fiat?? 1.3 turbo forse a benza.....in commercio seconda metà del 2014.... Gia' il restyling della Mokka :shock: :?: 'Guardate quà: http://www.autoexpress.co.uk/mazda/61612/mazda-cx-3-way Carin 1.6 diesel (fiat?? 1.3 turbo forse a benza.....in commercio seconda metà del 2014.'",Uhm ci sarà il render pure di quelle ,,,,,,,,,,,,,,
Ciao a tutti!,https://www.forumelettrico.it/forum/topic5561.html?sid=9b3d6660a00250109c0902db2fb0b90b,2019-05-06 22:47:00,Erikv,,Ciao a tutti ! Mi presento sono Erik dalla provincia di Reggio Emilia ho saputo del vostro forum dalla fiera di Poviglio dell'anno scorso bellissima iniziativa ! Parlando di ecologia e un po' di me sono proprietario di una Nissan Leaf Spring Cloud MY18 appena presa e di una Citroen C-Zero bianca. A casa produco energia da fotovoltaico con accumulo in Tesla Powerwall 2. Sono un ingegnere meccanico quindi metto a disposizione del forum le mie competenze tecniche ! ,,,,,,,,,,,,,,
Mazda 3 Hatchback e Sedan 2019,https://www.autopareri.com/forums/topic/66385-mazda-3-hatchback-e-sedan-2019?&page=38#comments,2019-01-27 10:51:29,savio.79,,Tante lodi in questo pezzo: https://www.autoblog.com/2019/01/27/2019-mazda3-first-drive-review-87hy65/ ,,,,,,,,,,,,,,
Ritardo immagine segalatore distanza nuova Cayenne,http://www.porschemania.it/discus/messages/22971/568087.html?1308987933,2011-06-24 16:19:00,alfi,,"...si Tiziano infatti lo fa anche dopo parecchio che si e' avviato il motore...perche' la schermata principale e' la radio ( difficilmente metto la funzione del satellite mappa perche'ogni volta che spengo il quadro e lo riaccendo si resetta l'immagine e non mantiene la memoria della funzione scelta in precedenza e mi mette la schermata con la finestra ""conferma"" ) e solo quando entra in funzione il sensore parcheggio che ovviamente si apre l'immagine sul monitor...ma sempre qualche secondo dopo che sto' facendo manovra...spero che non sia un mio fissarmi magari e' normale cosi.",,,,,,,,,,,,,,
Nuova Subaru Forester 2019,https://forum.quattroruote.it/threads/nuova-subaru-forester-2019.119820/page-2,2019-01-05 00:00:00,U2511,,Vedo purtroppo che le nuove Forester my 2019 Euro 6D-Temp sono omologate per 172 gr CO2/km ( 172 la versione Premium la Free arriva comunque a 168 ) mentre le versioni 2018 Euro 6B si fermavano a 150 ( parlo sempre del 2.0i 150 cv ) ,,,,,,,,,,,,,,
Salve a tutti vorrei un consiglio su una Smart,https://forum.quattroruote.it/threads/salve-a-tutti-vorrei-un-consiglio-su-una-smart.116727/,2018-05-24 00:00:00,Nomis,,Ciao premesso che le Smart non fanno per me e quindi non mi pronuncio in merito io ti consiglierei di aprire un unico post nella zona franca di questo Forum in cui riportare tutti i modelli che stai valutando ...... secondo me hai più possibilità di ricevere risposte esaustive e coerenti piuttosto che aprire n-post per le n-marche di ogni auto .... auguri ..... ,,,,,,,,,,,,,,
FCA - 2.2 JTDm Alfa Romeo,https://www.autopareri.com/forums/topic/61228-fca-22-jtdm-alfa-romeo?&page=4#comments,2016-05-13 19:40:52,Beckervdo,,Bene...Euro6 RDC 15 5:1 ( solo mazda scende a 14 5:1 ) e niente ADBlue ( SCR ) Ottimo lavorano moltissimo in EGR e grazie al basso RDC fanno a meno dell'SCR. Ottimo Alfa. Per ora sono in tre: AlfaRomeo Volvo e Mazda. ,,,,,,,,,,,,,,
aspettando la 500.. pareri e consigli,https://www.autopareri.com/forums/topic/25540-aspettando-la-500-pareri-e-consigli?&page=2#comments,2007-10-21 19:29:27,Betha23,,"Scusa ma tu hai scritto ""solo dal 1° settembre 2009 le case potranno omologare Euro5"" che è sbagliato ! Solo quando passerà il decreto potranno omologare euro5 ....... ossia massimo entro il 2 luglio ! ",,,,,,,,,,,,,,
Q2 Elettronico/ASR vs Q2 Meccanico,https://www.autopareri.com/forums/topic/27532-q2-elettronicoasr-vs-q2-meccanico?&page=20#comments,2009-01-24 20:17:03,EC2277,,Appunto slightly less effective at the limit ovvero leggermente meno efficiente al limite. Quanto meno ? Non lo hanno specificato percui prima trova dei dati attendibili che ti consentano di quantificare di quanto è meno efficiente il Q2 elettronico e poi fasciati la testa sempre che sia veramente necessario. ,,,,,,,,,,,,,,
Qual'èsecondo voil'olio motore migliore?,https://forum.quattroruote.it/threads/qual%C3%A8-secondo-voi-lolio-motore-migliore.75148/page-4,2013-02-22 00:00:00,ucre,"alexmed ha scritto: Non so quale sia l'olio miglior ma io son affezionato a Castrol. Nell'Alfa metto il Castrol Edge Sport 10W-60 Nella ClasseA metto il Castrol Magnatec 5W-40 Uso questi oli ormai da 4 anni e mi sembra tutto ok.... quanto paghi l'edge sport 10w60???? lo vorrei provare sulla mia moto al posto dell'eni racing 10w60 che uso attualmente. la mia moto ha cambio e frizioni separat gli oli per auto vanno bene... L'ultima volta che l'ho pres marzo 201 era 16.90 euro al litro. Se compri su internet trovi anche i fusti d mi par 5 litri e lo paghi meno. "" alexmed ha scritto: Non so quale sia l'olio miglior ma io son affezionato a Castrol. Nell'Alfa metto il Castrol Edge Sport 10W-60 Nella ClasseA metto il Castrol Magnatec 5W-40 Uso questi oli ormai da 4 anni e mi sembra tutto ok.... quanto paghi l'edge sport 10w60???? lo vorrei provare sulla mia moto al posto dell'eni racing 10w60 che uso attualmente. la mia moto ha cambio e frizioni separat gli oli per auto vanno bene ""Non so quale sia l'olio miglior ma io son affezionato a Castrol. Nell'Alfa metto il Castrol Edge Sport 10W-60 Nella ClasseA metto il Castrol Magnatec 5W-40 Uso questi oli ormai da 4 anni e mi sembra tutto ok.""",ottimo prezzo. l'eni me o fanno pagare 15.50 li litro oramai. quasi quasi... grazie dell'informazione ,,,,,,,,,,,,,,
