Titolo,URL,Timestamp,User,(Testo Citato),TESTO,Costruttore,Modello,Brand,Interni,Esterni,Meccanica,Prestazioni,Consumi/Autonomia,Motore,Elettrico,Fuoristrada,Elettronica di Bordo,Manutenzione,Assistenza/Concessionari
Consiglio per acquisto chr ibrida,https://forum.quattroruote.it/threads/consiglio-per-acquisto-chr-ibrida.120930/,2019-02-03 00:00:00,Wolfox79,,Il percorso Bergamo Milano l'ho fatto pure io con una IS300h e la media e sui 18 a 130kmh ma non viaggio per risparmiare guido e basta. Credo che la scelta migliore sia la Auris/Corolla la CHR la compri solo per l'estetica perché un SUV non consumerà mai meno di una vettura normale. Ma a parte tutto questo confronto alla mia sembra strano che faccia i 13/15. Oppure questo e un dato Pieno-Pieno ? Da quella parte io sono sui 16 ma non risparmio qualche tirata qui e là. Se vuoi la CHR prendi il modello con le gomme più strette ,,,,,,,,,,,,,,
Tagliandi... che dire... e che fare?,https://forum.quattroruote.it/threads/tagliandi-che-dire-e-che-fare.95810/,2015-04-25 00:00:00,renatom,,Dipende molto dalla concessionaria. Ho avuto per 10 anni una Mazda 3 I serie. Finché ho fatto i tagliandi in concessionaria mi fatturavano prezzi Ford. Alcuni ricambi hanno però prezzi semplicemente folli. Ho farlo 230.000 km e non ho mai cambiato le pastiglie. ,,,,,,,,,,,,,,
Consiglio CRV,https://forum.quattroruote.it/threads/consiglio-crv.105722/page-2,2016-08-29 00:00:00,arrma81,,Si..ho appena scaricato e visto che è proprio come diceva il concessionario. Ci penso un altro pochino e a settembre decido il da farsi. Mi studio anche in cosa consiste questo pacchetto convenienza.. Ma tra lifestyle e elegance ? Vale la pena spendere questo 2000 euro in più ? ,,,,,,,,,,,,,,
Renault arkana,https://forum.quattroruote.it/threads/renault-arkana.118083/,2018-08-17 00:00:00,NEWsuper5,,Non so come siano riusciti ( la rivista ) a stiracchiare così la Megane grandcoupè... Per me sempre se sarà messo in commercio sarà abbastanza diverso. ,,,,,,,,,,,,,,
Jaguar F-Type Project 7 2014,https://www.autopareri.com/forums/topic/55591-jaguar-f-type-project-7-2014,2014-06-24 10:58:48,J-Gian,,Avrei mai detto... Serie limitata immagino ? ,,,,,,,,,,,,,,
Acquisto 156 3.2 GTA,https://forum.quattroruote.it/threads/acquisto-156-3-2-gta.110030/,2017-04-19 00:00:00,ilVecchioBianco,,Ciao a tutti come da titolo... consigli per l'acquisto per quanto riguarda la meccanica elettronica ecc.. ovviamente in genere le GTA usate che si trovano sono sugli 80-90mila km. di certo non è economica come consumi ma per il resto ? ,,,,,,,,,,,,,,
Renault Laguna (Topic Ufficiale - 2007),https://www.autopareri.com/forums/topic/19338-renault-laguna-topic-ufficiale-2007?&page=70#comments,2009-03-12 15:19:13,Markpd,,Salve a tutti ! Mi sono iscritto al forum apposta per farvi una domanda ! Essendo agente di commercio ci sono particolari scontistiche da parte di tutte le case in particolare per la Laguna sono decisamente favorevoli praticamente con 18500 euro mi hanno proposto la berlina techno+fari xeno+vernice met. che dite ? Sto cercando una berlina 2 volumi e la scelta non è molta in alternativa si scende di un segmento ma già per la Megane non si va sotto i 19000 euro ,,,,,,,,,,,,,,
sempre polemica..ma perché?,https://www.bmwpassion.com/forum/threads/sempre-polemica-ma-perch%C3%A9.37997/page-5,2003-05-23 00:00:00,El Nino,'Si va b ma nn penso ke tutti quelli ke avevano la E21 si sono sempre girati!!',Mica tanto con il bagnato/umido con l'E21 dovevi andarci piano ,,,,,,,,,,,,,,
Colore per Audi RS4 Avant,https://www.bmwpassion.com/forum/threads/colore-per-audi-rs4-avant.23518/,2004-04-20 00:00:00,Davide,,Ragazzi datemi una mano per il colore sono in piena sega mentale. Allora io ho fatto una prima scrematura e i restanti sono: Grigio Daytona Perla: Blu Mugello Perla:Blu Spirit Perla: grazie..... ,,,,,,,,,,,,,,
Lancia festeggiata al Concorso di Pebble Beach-Usa,https://www.autopareri.com/forums/topic/29639-lancia-festeggiata-al-concorso-di-pebble-beach-usa,2008-07-21 07:49:08,Lanciaboxer,,Da Italiaspeed 19.07.2008 PEBBLE BEACH ANNOUNCE LANCIA MODELS TO BE HONOURED NEXT MONTH Lancia the Italian auto manufacturer known for its elegant originality and innovative spirit will be celebrated as a featured marque at the 2008 Pebble Beach Concours d’Elegance on Sunday Aug. 17th with 17 unique models from its history. Lancia the Italian auto manufacturer known for its elegant originality and innovative spirit will be celebrated as a featured marque at the 2008 Pebble Beach Concours d’Elegance on Sunday Aug. 17. Seventeen significant Lancia vehicles will be on display ranging from a rarely seen 1953 Lancia Aurelia B20 Rally Car to one of the oldest Lancias on record a 1908 12 hp Alpha. Lancia will be highlighted at the Concours along with Lamborghini and the centennial of General Motors. “The Lancia history is quite remarkable ” says Sandra Kasky Button Chairman of the Pebble Beach Concours. “Lancia emerged as one of the most progressive spirited car companies at the turn of the 20th century producing their first car exactly 100 years ago. Their racing heritage includes wins in Formula One rallying and sports cars.” In addition to producing the first narrow-angle V-4 and V-6 production engines Lancia is recognized for numerous additional engineering advances that outdistanced other pre-war auto manufacturers. Founded in Turin Italy by Vincenzo Lancia the first Lancia a 12 hp Alpha debuted in 1908 and an example will be brought to the Concours by Milano Italy car collector Corrado Lopresto a 2005 Pebble Beach winner. “Big majestic and not very sporty the Alpha’s attraction is quality and reliability with advanced comfort ” says Lopresto whose ’08 Alpha is one of just 108 that were built. The Lancia Lambda which debuted in 1922 sporting a groundbreaking single-body frame and independent front suspension will be represented at the Concours. Other notable Lancias coming to Pebble Beach include: the D24 one of Lancia’s most innovative vehicles and the subject of the poster for the 2008 Pebble Beach Tour d’Elegance presented by Rolex a 1953 Lancia Aurelia B20 coupe – one of six designed for competition ( it won the 1953 Liège-Rome-Liège Rally ) and the original Lancia Stratos HF Prototype Bertone Coupe which made its world debut at the 1971 Turin Auto Show. “It’s truly a remarkable achievement for Lancia to be a featured marque at this year’s Concours ” says Francesco Gandolfi Pebble Beach Concours Chief Class Judge. “This is the first time since I became involved in collectible cars in 1971 that I’ve seen Lancia being honored at a major event…and I don’t know when and if I will see the same again.” italiaspeed.com © 2008 Interfuture Media/Italiaspeed ,,,,,,,,,,,,,,
QR prova VITARA: da supplemento SUV e XOVER novembre e prova video,https://forum.quattroruote.it/threads/qr-prova-vitara-da-supplemento-suv-e-xover-novembre-e-prova-video.100162/,2015-11-10 00:00:00,tommo84,'... segue ... Ho una critica da fare per quanti riguarda sia la prova video che quella del fascicolo: entrambi i giornalisti (i tester sono due divers cred quello del video è una donn quello del fascicol se è la persona inquadrata di spalle in una foto è un uomo) parlano di un prezzo relativamente elevato (circa 30mila nel video ma sappiamo tutti che quello è il prezzo della versione V TOP mentre una COOL come la mia dà tutto quello che serve con 25100 di listino - 26100 su strada compreso vernice pregiat ipt e minipassaggio permuta Non capisco il motivo di una rappresentazione dei fatti un pò tirata per i capelli: hai visto mai che dà fastidio a qualcuno scoprire che si può avere un 4*4 compatto con un diesel 6 senza spendere i 28700 - 29000 che occorrono per una Renegade o 500 per parlare delle best seller della categoria ? ** Vedremo ... ** PInus',una renegade 4x4 con motore 2.0 lo porti a casa a ben meno di 28700. idem per 500x. ,,,,,,,,,,,,,,
Ford Focus Station Wagon 2010 (Topic Ufficiale),https://www.autopareri.com/forums/topic/37324-ford-focus-station-wagon-2010-topic-ufficiale?&page=7#comments,2012-03-23 09:04:06,bazbaz,,grazie. In effetti sul sito ford italia parlano di un solo giallo ma ho chiesto ad un concessionario e mi ha detto che da quest'anno non è più ordinabile... è veramente bella nelle foto che mi hai indicato... ,,,,,,,,,,,,,,
Ritirata,https://www.autopareri.com/forums/topic/22937-ritirata?&page=4#comments,2007-04-05 18:59:11,Bender,,Auguri Lorenzo ... molto carina la tua Punto. Aspettiamo qualche altra foto all'aperto appena c'è bel tempo e magari una bella preview visto che di km ne hai ancora pochi ,,,,,,,,,,,,,,
Prospetto percorrenza delle Ns. Skoda,https://forum.quattroruote.it/threads/prospetto-percorrenza-delle-ns-skoda.11785/page-10,2009-11-11 00:00:00,bronzo1960,,Octavia Wagon 1.9 Tdi 105cv DSG 04/09 50.600 Km ,,,,,,,,,,,,,,
320d vs 330d consumi,https://forum.quattroruote.it/threads/320d-vs-330d-consumi.107747/page-2,2016-12-30 00:00:00,SUBmARine U-14,,Cosa hai preso ? ,,,,,,,,,,,,,,
Legge di stabilità..ecco perché Renzi si definisce rottamatore,https://www.bmwpassion.com/forum/threads/legge-di-stabilit%C3%A0-ecco-perch%C3%A9-renzi-si-definisce-rottamatore.243850/page-5,2009-05-27 00:00:00,Vinz,,si bel discorso eticamente ineccepibile...ma nel frattempo ? abbandoni un'attività sportiva o continui a pagare migliaia di euro per colpa di una legge palesemente sbagliata e ingiusta in attesa che FORSE al pari di altre centinaia di leggi idiote venga corretta magari tra 50 anni ? come dicevo è troppo facile giudicare e fare i moralisti quando le tasche rapinate sono quelle degli altri. ,,,,,,,,,,,,,,
Fiat 124 Spider 2016,https://www.autopareri.com/forums/topic/59843-fiat-124-spider-2016?&page=60#comments,2015-11-27 19:24:01,shadow_line,,Vorrei almeno un cambio con paddles al volante ,,,,,,,,,,,,,,
Scénic XMod - Topic Ufficiale,https://forum.quattroruote.it/threads/sc%C3%A9nic-xmod-topic-ufficiale.14456/page-118,2010-06-11 00:00:00,antoniolib75,,Ciao a tutti ho una scenic XMod 1.5dynamic davvero una bella macchina pero da un po di tempo alcuni rumori : - Il motore intorno al 1500 giri avverto un leggero rumore dal cruscotto - Il pedale del freno fa gioco fra dx e sx ( mi dicono che sia normale ) - E quando freno troppo e ho il finestrino aperto sento un fischiettio penso che provenga dai freni. Comunque prossimamente la porto in renault volevo sapere se qualcuno ha i miei stessi problemi ? ? Comunque tutto sommata è un bella macchina e nel suo segmento e ottima qualità/prezzo ,,,,,,,,,,,,,,
Speed day Monza,https://www.bmwpassion.com/forum/threads/speed-day-monza.20122/,2003-12-30 00:00:00,siscobmw,,Stica... qualcuno conosce il tizio in questione ? ? http://www.hostfiles.org/files/20060122071103_speed_day_035.jpg ho dovuto prendere una bacinella x le bave ,,,,,,,,,,,,,,
"Iniziativa ""ANDIAMO DA QUATTRORUOTE""",https://www.autopareri.com/forums/topic/6129-iniziativa-andiamo-da-quattroruote?&page=8#comments,2004-04-26 14:50:28,markvr,,"Allora: raduno davanti ai cancelli di quattroruote alle 11 panico perchè eravamo solo in tre poi per fortuna si è aggiunto qualcun altro. Auto presenti: due phedra ( una grigio scuro e una blu lancia ) una ypsilon argento multijet e una fulvia montecarlo ( che ci ha salvato la faccia ) . Purtroppo mancava la Thesis di cavaliere ( deve essere uno spettacolo ) che si è presentato diciamo cosi' con un'auto sostitutiva ! Pazienza alla prossima. Poi siamo saliti in redazione e abbiamo chiaccherato con il direttore: 1 in questo momento alla Lancia non ci sono le risorse necessarie per portare avanti nuovi modelli in pratica non ci sono i soldi ! 2 Lybra: non si è ancora deciso se sospendere la produzione a fine anno o proseguire ancora un po' 3 la sostituta della libra è stata stoppata 4 ad oggi dopo la Thesis il nulla 5 la Fulvia avrebbe richiesto un piccolo rischio perchè i margini erano risicati e non si farà 6 al momento sono tutti concentrati sul lancio della Musa 7 la ypsilon va molto bene sia come numeri di vendita sia come ""qualità"" delle vendite ( nel senso che vengono venduti allestimenti costosi ) Questo per quanto riguarda al gamma un po' desolante vero ? Lo sviluppo di modelli futuri é legato alla quantit° di soldi che riuscir° a portare la gamma attuale nelle casse di lancia ",,,,,,,,,,,,,,
Livello liquido refrigerante,https://forum.quattroruote.it/threads/livello-liquido-refrigerante.98188/page-2,2018-01-03 00:00:00,giuspo77,,Grazie per la risposta @Flash Gordon. Spero anch'Io che sia condensa... Avevo comprato il liquido G13 dopo il primo rabbocco di settembre ma adesso non lo userò più e lascerò che sia l'officina a farlo ( anche se spero cmq di non ricapitarci per questa o altra questione... ) . ,,,,,,,,,,,,,,
Peugeot 5008 Facelift 2013,https://www.autopareri.com/forums/topic/52668-peugeot-5008-facelift-2013,2013-08-26 09:40:51,ROCKY77,,concordo inoltre c'è anche la qualità. provare ( ne ho usate davvero tante ) per credere ! ,,,,,,,,,,,,,,
mercedes a180d vs bmw 1 series vs a3 sportback,https://forum.quattroruote.it/threads/mercedes-a180d-vs-bmw-1-series-vs-a3-sportback.122295/page-3,2019-04-24 00:00:00,whosmanu,"""Vabbè ma queste cose le puoi avere su tutte. Devo dire che su A3 la connessione via Usb si paga a part mentre su Polo è di serie In ogni cas a parte il viva voce b/t che è davvero un must per la sicurezz non è che l'assenza delle altre dotazioni citate sia così grav se il prezzo è buono.""",si ma ho visto che per esempio bmw e audi lasciano meno spazio ad accessori di serie rendendo quasi tutto esclusivamente ad optional e facendoli pagare caro al contrario di mercedes che offre più accessori di serie e meno optional anch’essi molto cari. la mito la pagai l’anno scorso 5000 euro assicurazione bollo e passaggio esclusi 44mila km con solo qualche piccola riga e imperfezione alla carrozzeria ma sin dai primi mesi ho avuto problemi con batteria gomme centralina per arrivare quindi ad una cifra di almeno 6500 euro escluse le varie assicurazione ecc sopracitate cosa che con il noleggio a lungo termine si va ad eliminare essendo in quasi tutti i casi inclusi nel canone mensile ,,,,,,,,,,,,,,
Dacia Sandero tende ad andare a destra,https://forum.quattroruote.it/threads/dacia-sandero-tende-ad-andare-a-destra.115118/,2018-04-11 00:00:00,dario.quaglio,,ciao ho lo stesso problema e in più il volante che non torna al centro dopo le curve a destra. La concessionaria dove ho acquistato l'auto non vuole saperne di riconoscere il problema e la garanzia hanno fatto la convergenza per due volte ma senza risultato eppure l'auto è stata vista da più meccanici e gommisti che concordano che è un grosso problema. Mi fai sapere se hai risolto ? grazie ,,,,,,,,,,,,,,
la batcaverna 635csi &co,https://www.bmwpassion.com/forum/threads/la-batcaverna-635csi-co.85405/page-68,2009-04-09 00:00:00,fabio320d,,,,,,,,,,,,,,,,
Jeep Grand Cherokee Facelift 2013 [GC SRT],https://www.autopareri.com/forums/topic/50236-jeep-grand-cherokee-facelift-2013-gc-srt?&page=3#comments,2013-01-14 10:48:16,Gabbro,,Questo nuovo Grand Cherokee ha le borse sotto gli occhi. ,,,,,,,,,,,,,,
E' possibile che...,https://www.autopareri.com/forums/topic/19049-e-possibile-che,2006-03-03 18:20:23,geo,,Bè sì la larghezza dei pneumatici è superiore però il diametro dovrebbe essere lo stesso è la spalla che diminuisce. Come ti stai trovando con i cerchi TI ? Leggevo da qualke parte che nn sono molto resistenti tendono a piegarsi prendendo grosse buche. ,,,,,,,,,,,,,,
Curiosità nel mondo ŠKODA,https://forum.quattroruote.it/threads/curiosit%C3%A0-nel-mondo-%C5%A0koda.107590/page-3,2017-06-02 00:00:00,lukkinen,'Bruttissimo...!!!! A mio modesto parere... Non lo monterei mai lì dietro.... Porterebbe uno sbalzo al posteriore secondo me notevol ne risentirebbe la guid nonché la carrozzeria e il telaio in caso di tamponamento..!!',beh la guida ne risente anche con le bici sul tetto sono molto più sicure dietro perché in caso di tamponamento frontale non si strappano via dal tetto e non rischiano di ferire altri. Magari chi segue intimorito potrebbe accidentalmente mantenere una distanza di sicurezza. ,,,,,,,,,,,,,,
Ford Focus - Chiusure e luci automatiche,https://forum.quattroruote.it/threads/ford-focus-chiusure-e-luci-automatiche.113526/,2017-11-28 00:00:00,Scaldabagno_interno,,Ok Grazie per il consiglio. ,,,,,,,,,,,,,,
[Ufficiale]Toyota è la n°1!,https://www.bmwpassion.com/forum/threads/ufficiale-toyota-%C3%A8-la-n%C2%B01.40383/,2004-08-23 00:00:00,mamo,,"Lo dicevano le previsioni lo dicevano i numeri e adesso lo confermano apertamente anche loro: “siamo il primo produttore del mondo”. Il sorpasso di Toyota sulla General Motors è ufficialmente avvenuto con 2.348.000 automobili vendute nel primo trimestre 2007 contro le 2.260.000 della GM.I fattori determinanti per questo successo sono numerosi: si va dal continuo miglioramento della competitività dei prodotti sul piano tecnico e dell’appeal stilistico - fermo restando una qualità da anni ai vertici del mercato - alla continua ricerca verso sistemi di propulsione alternativa per una mobilità più sostenibile che ha contribuito non poco a promuovere l’immagine del brand giapponese in tutto il mondo. Così non c’è paese che non ha visto crescere la quota di mercato di Toyota a cominciare dagli Stati Uniti che hanno segnato nell’ultimo anno un’incredibile +13% a scapito di General Motor in primis. Ovviamente.La parola d’ordine è comunque “piedi per terra”. Paul Nolasco portavoce Toyota ha commentato la notizia così: ""il nostro obiettivo non è mai stato quello di vendere più auto nel mondo Semplicemente vogliamo la massima qualità. I risultati commerciali sono una conseguenza”. Parole che la dicono lunga sulla filosofia del Gruppo Giapponese…omniauto.it ",,,,,,,,,,,,,,
Volkswagen Scirocco 2008 (Topic Ufficiale),https://www.autopareri.com/forums/topic/31221-volkswagen-scirocco-2008-topic-ufficiale?&page=5#comments,2008-11-19 10:13:58,Stefano73,,Vista ieri la prima scirocco su strada c'è da dire che ha un impronta personale sia davanti che dietro senza avere spoporzioni particolari come un altra auto...un pò più corta anch'essa appena lanciata: ) . Però come frontale scirocco su strada è ancor più anonima che in vista statica ci vorrebbe già un restyling in stile ultima golf.......che in strada se scura da lontana facile confonderla con l'ante-restyling anche stesso parabrezza ? ,,,,,,,,,,,,,,
Kia Sportage (Topic Ufficiale - 2010),https://www.autopareri.com/forums/topic/36943-kia-sportage-topic-ufficiale-2010?&page=411#comments,2011-04-01 16:31:00,santibailor,,Le ultime notizie erano che per evitare che si finiscano le scorte si invitavano i clienti a cambiare colore tramite incentivi ( sconto o optional gratuito ) l'unica cosa a sfavore del cliente è che deve recedere il contratto fatto in precedenza e aprirne un altro perchè da sistema non si può modificare dopo che lo si è inserito. Stanno studiando ma ancora non hanno deciso se aumentare il prezzo di listino tra il 5%/10% per chi volesse mantenere oppure ordinare il metallizzato questo per disincentivare la scelta di tale colorazione ,,,,,,,,,,,,,,
Automobile - Com'è fatta? Come funziona? Domande di tecniche varie [RIASSUNTO 1° Messaggio],https://www.autopareri.com/forums/topic/44423-automobile-com%C3%A8-fatta-come-funziona-domande-di-tecniche-varie-riassunto-1%C2%B0-messaggio?&page=2#comments,2011-09-10 15:27:11,Sifizzirro,,"Che vuol dire ? EDIT: altra domanda Quali sono ( sinteticamente e semplicisticamente ) pregi e difetti dell'iniezione diretta ? E quelli dell'iniezione indiretta ? Perché Ferrari Toyota/Lexus e Audi in alcuni motori usano tutti e due i tipi di iniezione ? ------------------------ PS Sarebbe fantastico man mano che la discussione cresce citofonare a The Summarizer e fare una sorta di ABC o di mini-wiki della tecnica dell'automobile Ora mi direte ""Sì bon se hai una domanda di tecnica qui fuori è pieno di gente che ne parla non rompere il cozzo e cercatelo su Google oppure comprati un libro"" Da appassionato/curioso ma semi-ignorante in materia vi dico che spesso su Google o Wikipedia si trovano mille spiegazioni troppo tecniche o troppo complicate oppure troppo lunghe ! E poi bisogna fare una ricerca per ogni singola cosa e tra i virtuosismi da ingegnere ""so tutto io pivello"" e lo sbatti di sfondare di click il logo di Google uno si stufa presto Qui su AP si potrebbe fare qualcosa che solo voi sapete fare unire l'utile al dilettevole il difficile e il facile il semplice e il complesso la sintesi e l'analisi la critica e il commento ecc. ecc. Che ne dite ? Pretendo troppo vero ? ",,,,,,,,,,,,,,
Nuovo audista,https://forum.quattroruote.it/threads/nuovo-audista.109127/page-2,2017-03-09 00:00:00,paulein118,,sarebbe ? na belinata alla haldex ? ,,,,,,,,,,,,,,
Smart abusiva con cavo inserito all'Enel X ma disconnessa,https://www.forumelettrico.it/forum/smart-abusiva-con-cavo-inserito-all-enel-x-ma-disconnessa-t5549-70.html?sid=afbb8b79ce719d4905a913f84b3a8c80&sid=afbb8b79ce719d4905a913f84b3a8c80,"12/05/2019, 9:04",marco,'Ciao e se lasci l’auto in ricarica e poi si completa e finisce cosa devi fare ? 'Probabilmente è successo proprio quello',Devi spostare l'auto... senza perderci la testa se passa qualche minuti in standby ma neanche lasciarla li per oreNo perché il connettore era sbloccato: a ricarica terminata perché auto è carica il connettore rimane bloccato ( o perlomeno dovrebbe per questo gli abbiamo lasciato il beneficio del dubbio... sa mai che ci fosse stato un malfunzionamento ma è improbabile ) ,,,,,,,,,,,,,,
Volkswagen Touran 2015,https://www.autopareri.com/forums/topic/57682-volkswagen-touran-2015?&page=5#comments,2015-03-02 13:11:35,stev66,,vale per tutti i thread ma ribadisco: ogni affermazione andrebbe motivata. io potrei dire per esempio che Multipla al suo apparire era generalmente superiore alla concorrenza per lo sfruttamento dello spazio interno versus dimensioni esterne e per la struttura space frame più leggera di quella tradizionale a pianale e carrozzeria. Ed inferiore per interni e motorizzazioni a benzina. o Golf IV era superiore alle concorrenti per dimensioni e qualità apparente ed inferiore per qualità dinamiche ( che portò all'adozione dell'ESP di serie nonché di cerchi e pneumatici più grossi della media. ) Affermazioni che possono essere discusse ovviamente ma motivate. Grazie ,,,,,,,,,,,,,,
la batcaverna 635csi &co,https://www.bmwpassion.com/forum/threads/la-batcaverna-635csi-co.85405/page-236,2008-04-20 00:00:00,THE GAME,,la is monta come la M3 e30 solo la ventola elettrica che è quella che si tutte le altre bmw c'è per il clima infatti nelle nazioni calde veniva riaggiunta la ventola normale.La viscoventola mangia qualche cv quando entra in azione e anche in non azione un minimo assorbe ma io non la toglierei in quanto la gestione elettrica dell'impianto della tua non è prevista per il superlavoro e il controllo di temp di funzionamento dell'elettroventola non è a termostato ma a radiatore falsando molto la correttezza d'intervento.Poi si puo' togliere in inverno ma d'estate io la metterei anche sulle is..E occhio che se cede la ventola elettrica fondi senza se e ma se invece va a ramengo la viscostatica ancora ti salvie se anche visco ed elettrica sono ko tenendo il mkotore accelerato te la cavi o avvolgendo una calza da donna tra ventola e frizionela blocchi per un rientro d'emergenza. ( già sperimentato.. con morosa dell'epoca rientrata a casa con 1 calza sì ed una no.. e per di più nuove.Per perdonarmi ha voluto un riscatto tipo signorina Silvani con Fantozzi dopo il rist giapponese.. ,,,,,,,,,,,,,,
