Titolo,URL,Timestamp,User,(Testo Citato),TESTO,Costruttore,Modello,Brand,Interni,Esterni,Meccanica,Prestazioni,Consumi/Autonomia,Motore,Elettrico,Fuoristrada,Elettronica di Bordo,Manutenzione,Assistenza/Concessionari
Sua Maestà Aston Martin,https://www.bmwpassion.com/forum/threads/sua-maest%C3%A0-aston-martin.49061/,2004-08-23 00:00:00,mamo,'Mam non ci vedi? ',La Regina è ovviamente a Francoforte.Ecco qualche foto...http://www.autoblog.it/post/10135/francoforte-2007-aston-martin-v8-vantage-n400--http://www.autoblog.it/post/10138/francoforte-2007-aston-martin-db9-le-mans--http://www.autoblog.it/galleria/francoforte-2007-aston-martin-dbs/ ,,,,,,,,,,,,,,
Volvo C70 (Topic Ufficiale - 2005),https://www.autopareri.com/forums/topic/13281-volvo-c70-topic-ufficiale-2005?&page=4#comments,2005-07-14 09:33:09,carrera4,,questo credo sia uno shop http://www.channel4.com/4car/gallery/spy-shots-2004/F/ford-focus-convertible/focus-variants.html da un auto ricavarono tutte le varianti ! ,,,,,,,,,,,,,,
se l'Alfa fosse indipendente...,https://www.autopareri.com/forums/topic/14745-se-lalfa-fosse-indipendente?&page=17#comments,2005-08-15 21:47:20,il FUSI,,Mi sa....... ,,,,,,,,,,,,,,
Consiglio gomme online,https://forum.quattroruote.it/threads/consiglio-gomme-online.89063/,2014-06-26 00:00:00,maurochimenton,,ciao combinazione sono della mia città ci sono stato personalmente e nella loro sede non hanno un solo pneumatico perchè sono dei mediatori cioè comprano e spediscono senza vedere la merce comunque la cosa funziona io ho comprato 2 treni per la ix35 e per la punto tutti invernali e orientali ho speso poco e vanno bene controlla solo le caratteristiche del pneum. da te scelto ci sono delle tabelle comparative di rumorosità e tenuta sui vari fondi. spero di essere stato utile ciao ,,,,,,,,,,,,,,
Account ufficiale Ford Italia. Saluti.,https://forum.quattroruote.it/threads/account-ufficiale-ford-italia-saluti.50372/page-3,2011-05-14 00:00:00,vrom,"""Pero' nei loro foru i clienti non ne parlano molt contrariamente invece a quello che succede nel forum for dov nella maggioranza dei casi riportati dai client non si parla altro che di auto difettose e con problemi""",tanto per gradire: http://forum.quattroruote.it/posts/list/54405.page http://forum.quattroruote.it/posts/list/54365.page http://forum.quattroruote.it/posts/list/43185.page http://forum.quattroruote.it/posts/list/53135.page http://forum.quattroruote.it/posts/list/54342.page ,,,,,,,,,,,,,,
Preventivi Mazda CX5,https://forum.quattroruote.it/threads/preventivi-mazda-cx5.62333/page-3,2012-03-31 00:00:00,nchiar,"""Che noia... Vuoi i numeri? http://carscoop.blogspot.it/2012/01/us-diesel-car-sales-grow-by-staggering.html I diesel hanno il 3% del mercato in america. http://www.buyingadvice.com/auto-buying-tips/automatic-vs-manualtransmission/ L'84% dei veicoli americani monta il cambio automatico. Erg venderlo non ha senso! Aggiungo pure che i cambi automatici solitamente sono associati alle sportive e non ai suv così come il diesel che è una soluzione di ripiego per le famigliari.""",,,,,,,,,,,,,,,
Forester - Prova statica impressioni curiosità,https://forum.quattroruote.it/threads/forester-prova-statica-impressioni-curiosit%C3%A0.118588/page-16,2018-12-07 00:00:00,John_Congos,,sono passato ieri da un concessionario S. e mi hanno detto che se anche dovesse passare la tassa se lo accollano loro ( suppongo a che tipo di contratto o scontistica viene pattuito un acquisto ) ,,,,,,,,,,,,,,
BMW 700 Coupè,https://www.bmwpassion.com/forum/threads/bmw-700-coup%C3%A8.112006/page-3,2006-10-03 00:00:00,lorenzo 61,'Hai sostituito almeno oli filtro e liquido refrigerante prima di avviarla?non è bene far girare liquidi vecchi nel motore!:wink:',la macchina è del 1964 lorenzo 61 aveva ragione. comunque ho messo l'annuncio anche su altri siti. ciao raga ! ! ! ! ,,,,,,,,,,,,,,
Fiat Grande Punto Sport StarJet: Ordinata!,https://www.autopareri.com/forums/topic/23043-fiat-grande-punto-sport-starjet-ordinata,2007-04-15 11:20:19,SaiKiSono,,congratulazioni.....il colore mi piace molto... ,,,,,,,,,,,,,,
Basta mi sono stancato: passo in Alfa,https://www.bmwpassion.com/forum/threads/basta-mi-sono-stancato-passo-in-alfa.26339/page-2,2004-07-04 00:00:00,hell,Mi era parso di capire che cercavi Km. ho trovato questa dalle tue parti : http://www.autoscout24.it/ita/newcardetail.asp?ts=4379312&id=49081202... Grazie della dritta hell!! :wink: L'avevo vista pure io ma ahimè le liquidà sull'acuisto si dovrebbero avere verso fine anno e indi fino ad allora mi limito a raccogliere il maggior numero di opnioni ed informazioni al riguardo. 'Mi era parso di capire che cercavi Km. ho trovato questa dalle tue parti : http://www.autoscout24.it/ita/newcardetail.asp?ts=4379312&id=49081202',Marco....... te possino ! ! ! ! ,,,,,,,,,,,,,,
Porsche i risultati del progetto FastCharge: ricarica ultra rapida fino a 450 kW - HDmotori.it,http://www.hdmotori.it/2018/12/13/porsche-fastcharge-ricarica-450-kw-potenza-info/,2018-12-14 10:19:00,Bauscia,,Sisi in bicicletta vai ovunque infatti a milano per non morire i ciclisti stanno tutti sopra al marciapiede.A milano in bici stai talmente sereno che la gente si assicura pure quella.,,,,,,,,,,,,,,
Problema commutazione gpl,https://forum.quattroruote.it/threads/problema-commutazione-gpl.93835/,2015-02-02 00:00:00,albert56,,penso che ci sia il filtro dopo il polmone pieno prova a cambiarlo ,,,,,,,,,,,,,,
Marchionne: Ora il rilancio dell'Alfa Romeo!,https://www.autopareri.com/forums/topic/17248-marchionne-ora-il-rilancio-dellalfa-romeo,2005-12-04 18:51:16,il FUSI,,Oh il primo della Fiat che dice quello che VA DETTO. E speriamo che lo pensi anche. ,,,,,,,,,,,,,,
Renault Mégane Coupè (Topic Ufficiale - 2008),https://www.autopareri.com/forums/topic/30725-renault-m%C3%A9gane-coup%C3%A8-topic-ufficiale-2008?&page=2#comments,2008-10-02 13:27:10,Coaster,,"trovo molto brutto l'inserto argentato nel frontale e il culone così ""tanto"" fiancata nella norma tetto troppo spiovente..e già mi immagino che goduria in manovra con quest'auto.. ",,,,,,,,,,,,,,
consiglio per  acquisti: Range Rover Sport,https://forum.quattroruote.it/threads/consiglio-per-acquisti-range-rover-sport.14817/,2009-10-19 00:00:00,leolito,,"Settimana scorsa ero in conce ( ammo sterzo Wrangler ""scoppiato"" ) e parlando con la forza vendita mi hanno menzionato non arrivera' prima della fine della prox estate se non verso fine anno. Tardi molto .. quello attuale e' agli sgoccioli ( anche se valido imho ) . ",,,,,,,,,,,,,,
Dossier Sportive Qr....vari tempi a confronto!!!,https://www.bmwpassion.com/forum/threads/dossier-sportive-qr-vari-tempi-a-confronto.26968/,2005-02-01 00:00:00,b0sh,"infatti il tempo della maserati ha dell'incredibile...nn sò come sia possibile ma la spider gransport va + forte d 1.4 sec rispetto alla coupè gransport...... E che notoriamente son chiod che notoriamente sono più lente delle M3. Quella pista e Quattroruote hanno un'attendibilità prossima a 0. Dai... il 330d 184CV fece il solito tempo dell'Elise S1: neanche nelle prossime 10 vite! ""infatti il tempo della maserati ha dell'incredibile...nn sò come sia possibile ma la spider gransport va + forte d 1.4 sec rispetto alla coupè gransport...""",Ho comprato come da topic il giornale in questione e sono saltati fuori dei tempi interessanti: la sorpresa in positivo è la Maserati Gransport Spyder mentre quella in negativo è la RS4 ! ! ! :wink: Bel tempo della Z4 M soprattutto a fronte di un peso nn proprio piuma come alcuni si potrebbero aspettare ovvero 1550kg ! ! ! :exclaim: Qui sotto i vari tempi: Maserati GranSport Spyder 1.21.370 BMW Z4 M roadster 1.22.585 Porsche Cayman S 1.23.448 Mercedes SLK 55 AMG 1.23.819 Porsche Boxster S 1.24.230 Chrysler Crossfire 1.24.978 Nissan 350Z 300cv 1.25.612 La RS4 a parte ke di motore ha fatto il km da fermo in 24sec ( Z4 M 24.1sec ) ma il tempo è molto negativo: Mitsubischi Lancer Evo IX 1.21.806 Subaru Impreza STI 1.22.390 BMW M3 SMG II 1.22.599 Audi RS4 1.24.043 A voi i commenti ! ! ! :wink: ,,,,,,,,,,,,,,
dr 4,https://forum.quattroruote.it/threads/dr-4.113265/page-2,2018-01-23 00:00:00,NEWsuper5,"""Secondo il C-NCAP ha 5 stell quindi è possibile che un 3 o 4 stelle le prenderebbe anche all'euroNCAP... Googolando in rete sembrerebbe che abbiano tenuto conto degli standard europei durante la progettazione (esiste anche un Jac Design Center a Torino!) .. Il dubbio resta sugli airbag: 4 o 6?""",Ciò può valere per la DR4 ma i modelli precedenti ancora regolarmente in commercio ? ,,,,,,,,,,,,,,
Audi A3 Sportback tfsi 150cv o Golf gti Performance ?,https://forum.quattroruote.it/threads/audi-a3-sportback-tfsi-150cv-o-golf-gti-performance.120080/page-7,2019-01-10 00:00:00,Ax-80,'Voglio esser sincer a me piacevano entrambe ero più propenso verso Aud poi siccome ad ogni preventivo mi facevano il gioco delle tre cart a me che son prestigiatore e manipolator ho deciso per BM dove ho trovato un venditore che invece si è dimostrato serio e risolutivo. Mica tutti son così ...',Beh tutto fa. E direi che al venditore va un plauso che si è accattivato il cliente in senso assoluto . Svolto egregiamente il suo lavoro. ,,,,,,,,,,,,,,
Lancia Ypsilon 2011,https://www.autopareri.com/forums/topic/41885-lancia-ypsilon-2011?&page=109#comments,2011-05-24 20:47:22,Feder,,Un breve video dove si vede tutto: interni esterni e l'auto in movimento ,,,,,,,,,,,,,,
Autoradio originale con lettore mp3,https://forum.quattroruote.it/threads/autoradio-originale-con-lettore-mp3.116777/,2018-05-29 00:00:00,paolocabri,'Grazie. Ho guardato. Ma lo deve montare un eletrauto?',No. E' sufficiente montarlo ed inserire il codice ,,,,,,,,,,,,,,
Prova Renault Mégane Sporter 1.5 dci 110 cv Intens,https://www.autopareri.com/forums/topic/62427-prova-renault-m%C3%A9gane-sporter-15-dci-110-cv-intens,2018-01-14 13:31:01,Gabriz4,,Il 1.5 Renault è sempre una garanzia ,,,,,,,,,,,,,,
Presentazione sono un nuovo possessore di boxster 2.5 986,http://www.porschemania.it/discus/messages/502415/851694.html?1550000573,2019-02-12 14:58:00,miro911,,Ribadisco : Capite il soggetto ! ! ,,,,,,,,,,,,,,
Ciao a tutti!,https://www.bmwpassion.com/forum/threads/ciao-a-tutti.336068/,2016-02-19 00:00:00,wewwo,"'Ciao ragazzi del foru vi ho letto qualche volta in passato ed oggi sono qui ad iscrivermi per avere da voi lumi su una decisione che dovrei prendere! Premesso che ho una Jeep BU del 2016 4x4 che devo dire risulta molto comoda per le mie abitudini. Tuttavia sto valutando di affiancarle una ""vecchia"" Bmw e8 120 con all'attivo 150mila KM. L'affiancamento non comporterebbe nessuna spesa (non devo acquistare l'aut ma ce l'ho già in famiglia ma sono indeciso se fare questa scelta oppure rivendere questa e87 e comprare un'utilitaria (che sarebbe più adatta allo scopo). Ditemi voi se posso continuare ad usare questo post per dettagliare meglio i miei dubbi oppure c'è una sezione ad hoc! Grazie a tutti!'","Ciao ragazzi del forum vi ho letto qualche volta in passato ed oggi sono qui ad iscrivermi per avere da voi lumi su una decisione che dovrei prendere ! Premesso che ho una Jeep BU del 2016 4x4 che devo dire risulta molto comoda per le mie abitudini.Tuttavia sto valutando di affiancarle una ""vecchia"" Bmw e87 120d con all'attivo 150mila KM.L'affiancamento non comporterebbe nessuna spesa ( non devo acquistare l'auto ma ce l'ho già in famiglia ) ma sono indeciso se fare questa scelta oppure rivendere questa e87 e comprare un'utilitaria ( che sarebbe più adatta allo scopo ) .Ditemi voi se posso continuare ad usare questo post per dettagliare meglio i miei dubbi oppure c'è una sezione ad hoc ! Grazie a tutti ! ",,,,,,,,,,,,,,
Renault Laguna e Laguna SporTour M.Y. 2013,https://www.autopareri.com/forums/topic/51391-renault-laguna-e-laguna-sportour-my-2013,2013-04-15 21:05:24,kla6630,,"Io la trovo ""vecchierrima"" e anonima non mi piace insomma.. Dato che c'erano avrebbero potuto almeno adattare il frontale al nuovo stile.. ",,,,,,,,,,,,,,
incredibile ma vero!!!,https://www.bmwpassion.com/forum/threads/incredibile-ma-vero.25189/,2004-11-22 00:00:00,Roger84,'tante scuse tutte insieme nn le avevo mai viste... nn è + facile dire...in quel test è andata meglio la quattroporte..??',http://www.autotitre.com/forum/up/f6b7ced015.jpg ,,,,,,,,,,,,,,
Legge di stabilità..ecco perché Renzi si definisce rottamatore,https://www.bmwpassion.com/forum/threads/legge-di-stabilit%C3%A0-ecco-perch%C3%A9-renzi-si-definisce-rottamatore.243850/page-6,2008-01-16 00:00:00,giannimpower,,Ma essere in Europa a cosa ci serve ? perché tutte queste tasse sulle auto tra bolli passaggi di proprietà assicurazione carburante..e in cambio di cosa ? Ma per piacere..e il bello che si lamenta chi paga 50 60 euro per l'inutile imu sulla casa..e io devo pagare 400 euro di bollo per una macchina che ne vale si e no mille e per farci 5000 km all'anno.. ? Ma su quale principio ? Maaa ,,,,,,,,,,,,,,
Mitsubishi ASX (Topic Ufficiale - 2009),https://www.autopareri.com/forums/topic/36140-mitsubishi-asx-topic-ufficiale-2009?&page=61#comments,2010-09-21 20:47:09,Sik,,Ciao. Mi potresti precisare a che velocità procedevi ( durante la rigenerazione ) e quanto è durato il processo ? ,,,,,,,,,,,,,,
BMW M6 2012 - Prj. F12/F13/F14,https://www.autopareri.com/forums/topic/46303-bmw-m6-2012-prj-f12f13f14?&page=4#comments,2012-12-12 13:42:22,francomilano,,un INCUBO ! ,,,,,,,,,,,,,,
Alfa Romeo Giulietta (Topic Ufficiale - 2009),https://www.autopareri.com/forums/topic/36127-alfa-romeo-giulietta-topic-ufficiale-2009?&page=1294#comments,2012-12-03 11:45:45,CoreVD,,Concordo. Anche io quando acquistai la mia Volvo si parlava del resty imminente... Adesso sono circa 10 anni che il modello non viene restylizzato ,,,,,,,,,,,,,,
NUOVA IGNIS,https://forum.quattroruote.it/threads/nuova-ignis.108121/page-24,2017-12-11 00:00:00,pilistation,,tanto la gente ha già il cervello spento quando usa il retronebbia con auto alle spalle e lì non c'è nessun automatismo se non quello di essere un idiota ,,,,,,,,,,,,,,
Consigli per l'acquisto di Octavia Gtec Wagon 14,https://forum.quattroruote.it/threads/consigli-per-lacquisto-di-octavia-gtec-wagon-1-4.113041/,2017-10-30 00:00:00,miki15,,Octavia a metano monta il 1.4TSI da 110 cv ora se non erro c'è anche il 1.0 comunque un amico ha il golf nè è entusiasto sia per i consumi che per le prestazioni a parte questo l'unica cosa per toglierti i tuoi dubbi è di andarla a provare la sto valutando anchio solo che qui non ci sono concessionarie ,,,,,,,,,,,,,,
Avvistamento,https://www.bmwpassion.com/forum/threads/avvistamento.17130/,2004-04-20 00:00:00,teo 121121,,Avvistata questa mattina Porsche Cayman gialla. Bella Bella mi piace ,,,,,,,,,,,,,,
Museo Alfa Romeo: finalmente il TAR ha respinto il vergognoso ricorso contro il vincolo.,https://forum.quattroruote.it/threads/museo-alfa-romeo-finalmente-il-tar-ha-respinto-il-vergognoso-ricorso-contro-il-vincolo.49441/page-127,2012-03-26 00:00:00,GenLee,"Maxetto ha scritto: giampi47 ha scritto: Mi viene pero' spontaneo significarVi che manifestare quel poco di mia conoscenz prima o poi avra' un termine e quindi............addio loquacita' ....(speriamo tardi) ... Caro giampi voglio ancora una volta sottolineare che io non ho niente contro i tuoi post così esaurienti e tecnic infatti ho dett e non solo i che messi in un 3d apposito sarebbero più valorizzati. Io ritengo che i tuoi pur validissimi interventi vengano sfruttati per mantenere in alto questo threra solo questo aspetto trovo non molto bello.... Giampi sfruttato? E da ch se posso chiedere? Ma come ti permett Maxetto? Lo hai detto alla moderazion me lo hai scritto in privat adesso lo dici a Giamp sono settimane che andate da Erode a Pilato per sostenere questa campagna di accuse ed insinuazioni indegn ma non avete vergogna? ( lo s domanda stupida ). Ma guarda che noi non siamo mica te e 15 che avete bisogno di fare giochetti ed intessere dialoghi a du per sloga monosillabi e monostellin per tenere sù i thread che vi interessano. Ma quanto dev'essere tollerata ancora questa polemica permanent con queste insinuazioni?... Non più tollerata. Ricominciamo a parlare di museo e del suo contenut ringraziando ancora una volta Giampi per tutti i suoi contribut e per la sua pazienza e tolleranza verso tutti. "" Maxetto ha scritto: giampi47 ha scritto: Mi viene pero' spontaneo significarVi che manifestare quel poco di mia conoscenz prima o poi avra' un termine e quindi............addio loquacita' ....(speriamo tardi) ... Caro giampi voglio ancora una volta sottolineare che io non ho niente contro i tuoi post così esaurienti e tecnic infatti ho dett e non solo i che messi in un 3d apposito sarebbero più valorizzati. Io ritengo che i tuoi pur validissimi interventi vengano sfruttati per mantenere in alto questo threra solo questo aspetto trovo non molto bello.... Giampi sfruttato? E da ch se posso chiedere? Ma come ti permett Maxetto? Lo hai detto alla moderazion me lo hai scritto in privat adesso lo dici a Giamp sono settimane che andate da Erode a Pilato per sostenere questa campagna di accuse ed insinuazioni indegn ma non avete vergogna? ( lo s domanda stupida ). Ma guarda che noi non siamo mica te e 15 che avete bisogno di fare giochetti ed intessere dialoghi a du per sloga monosillabi e monostellin per tenere sù i thread che vi interessano. Ma quanto dev'essere tollerata ancora questa polemica permanent con queste insinuazioni? "" giampi47 ha scritto: Mi viene pero' spontaneo significarVi che manifestare quel poco di mia conoscenz prima o poi avra' un termine e quindi............addio loquacita' ....(speriamo tardi) ... Caro giampi voglio ancora una volta sottolineare che io non ho niente contro i tuoi post così esaurienti e tecnic infatti ho dett e non solo i che messi in un 3d apposito sarebbero più valorizzati. Io ritengo che i tuoi pur validissimi interventi vengano sfruttati per mantenere in alto questo threra solo questo aspetto trovo non molto bello. ""Mi viene pero' spontaneo significarVi che manifestare quel poco di mia conoscenz prima o poi avra' un termine e quindi............addio loquacita' ....(speriamo tardi) ""","Gli interventi di giampi sono senza obra di dubbio di arricchimento e di ""elevazione"" di questa discussione. Possiamo solo ringraziarlo. Nello stesso tempo credo che ognuno possa esprimere la propria opinione qualunque essa sia. ",,,,,,,,,,,,,,
Colonnina EVAD Fast Collegno Ikea.,https://www.forumelettrico.it/forum/topic5130.html?sid=9b3d6660a00250109c0902db2fb0b90b,2019-04-23 12:42:00,marcober,,la 158esima..ultimamente pioggia di Fast in Piemonte19XM32T7CB3W000180 Disponibile - Accesso liberoPiazza Svezia 1 - IKEACOLLEGNOTipi di preseCCS DisponibileCHAdeMO DisponibileType 2 43kW DisponibilePotenza massima 95kW,,,,,,,,,,,,,,
Alfa Romeo 4C 2013,https://www.autopareri.com/forums/topic/56324-alfa-romeo-4c-2013?&page=147#comments,2013-03-04 18:02:16,accul,,bella bella bella si cavolo bella ,,,,,,,,,,,,,,
"Solito ""assaggio"" a Maranello : un giretto sulla 488 GTB",https://forum.quattroruote.it/threads/solito-assaggio-a-maranello-un-giretto-sulla-488-gtb.112085/,2017-09-09 00:00:00,Mastertanto,"""Se posso porre una domanda a Mastertanto...esteticamente come ti è parsa? Le particolarità rispetto alla 458 sotto questo aspetto come le aperture laterali per raffreddare il motore o i doppi scarichi invece dei tre della precedente sono secondo te azzeccate? Per il resto complimenti per la recensione mi interessa sempre leggere le impressioni degli altri in questo caso poi ti sei soffermato su un' aspetto che finora è stato poco trattato come la somiglianza con la 458 quindi ancora meglio.""","Esteticamente è una 458 modificata : se sia meglio o peggio è più questione di gusto personale.... per me si equivalgono mi piacciono le fiancate con grossi sfoghi d'aria della 488 ma mi piace anche la coda della 458 meno ""lineare"" ma forse più riuscita. Quello che proprio non mi piace - mi fa quasi ribrezzo a dirla tutta - sono i cerchi ruota neri che entrambe avevano e che evidentemente sono ora di gran moda : ma a me fanno un po' schifo. Ma insomma queste sono cose per chi se la compra non per chi ci fa un giretto una tantum.... Infine quella provata ( la 488 ) aveva il tetto in carbonio che mi sa tanto essere uno degli optional in carbonio offerti dalla Ferrari : a prezzi oltre il mostruoso so che qualche pezzo in carbonio ed il listino di una 488 schizza subito a 250.000 e passa euro... cose note comunque si sa com'è il mercato del lusso. . ",,,,,,,,,,,,,,
Ibiza FR 1.2 tsi,https://forum.quattroruote.it/threads/ibiza-fr-1-2-tsi.84852/,2014-01-02 00:00:00,gringoxx,'oggi ho fatto visita al concessionari beh.... sorpresa negativa... nel 2014 il 105 cv non verrà più propost sarà sostituito dal 86 cv !!! che dire... Ci sono commenti da parte vostra per questa motorizzazioni? mio padre ha una fabia con questa motorizzazion va molto ben desideravo più potenza però... riprogrammo la centralina?',peccato ! se è veramente così penso sia una scelta commerciale date le poche vendite in italia della FR tsi. Hai contattato Seat italia per confermare tale informazione ? anche perchè se mettessero il 1.4 aspirato da 86cv sulla fr sulla style che mettono ? bah ! perchè in spagna o in germania o molti altri paesi europei dove seat viene apprezzata ed i numeri di vendita sono importanti o dove il mercato dell'auto si è ripreso il tsi sulla fr viene proposto sul 1.2 da 105cv passando al 1.4 da 140cv manuale al 1.4 da 150cv dsg. Se non fosse più ordinabile in italia potresti ricorrere all'importazione da qualche altro paese UE tramite qualche salonista. La garanzia vale comunque in tutta europa. Saluti ,,,,,,,,,,,,,,
Maserati Quattroporte ; la nuova generazione,https://forum.quattroruote.it/threads/maserati-quattroporte-la-nuova-generazione.38014/,2011-03-23 00:00:00,pilota54,,"Per ora circolano prototipi con carrozzeria dell'attuale Quattroporte. Io penso che la forma non cambierà di molto sarà modernizzata ma una forma vincente difficilmente viene rivoluzionata. La vettura sarà presentata a Francoforte 2011 e commercializzata nel 2012. Poi nel 2012 con commercializzazione presumibile dal 2013 saranno presentati il SUV e la ""segmento E premium"". ",,,,,,,,,,,,,,
prestazioni thesis insufficenti,https://www.autopareri.com/forums/topic/1767-prestazioni-thesis-insufficenti,2003-09-05 11:11:13,Artemis,,Vorrei essere ancora completamente d'accordo con te come in precedenza. Però bisogna considerare che il discorso sull'economia non cade mai. La thesis è un'auto venduta già in perdita. venderne di più significherebbe perderci di più. Spendere ulteriormente per un cambio automatico serio potrebbe essere oltremodo deleterio. Penso che fiat debba farsi un bel prospetto sulle auto da dotare del suddetto cambio. Sicuramente la Large e la sua consorella Lancia. Sicuramente la 158 e 168. Deve riucire a dotarne il maggior numero possibile di auto in modo che l'operazione risulti più redditizia possibile. Inoltre considera che tutte le versioni sportive di queste auto andrebbero dotate di un robotizzato dato che un epicicloidale sarebbe perlomeno ridicolo. Fiat deve anche sviluppare i robotizzati per grandi coppie. Va bene che un robotizzato è un normale cambio manuale a cui cambia solo il gruppo di attuatori. però è anche vero che la messa a punto è sempre lunga e difficoltosa per un cambio del genere. E' inutile. Per espandere bene il suo mercato anche all'estero ed in america Fiat dovrà affrontare di petto il discorso cambi che la vede tuttora ad un livello completamente insufficiente. Sicuramente l'acquisto di un costoso e sofisticato cambio automatico non si può muovere solo per la Thesis. ciao ciao ! ,,,,,,,,,,,,,,
Kia Picanto 2011,https://www.autopareri.com/forums/topic/41268-kia-picanto-2011?&page=6#comments,2011-08-24 09:56:10,superkappa125,,Tutta sballata di proporzioni dai fari alle ruote. ,,,,,,,,,,,,,,
Buona settimana dal 20/08 al 26/08,https://forum.quattroruote.it/threads/buona-settimana-dal-20-08-al-26-08.118036/page-2,2018-08-26 00:00:00,miranda453,,buongiorno. ,,,,,,,,,,,,,,
NUOVA VOLVO XC90,https://forum.quattroruote.it/threads/nuova-volvo-xc90.97203/page-6,2015-11-05 00:00:00,smargia2002,"""Dopo una lunga indecision confront prov informazioni etc etc. tra la nuova Audi Q7 e la nuova Volvo XC90 finalmente ho scelto... Ho ordinato la XC90 che ha vinto sul filo... Tra le varie cose mi ha convinto l'impegno della Volvo in tema di sicurezz quindi la sua filosofia complessiva in fatto di sicurezz la linea esterna come anche gli interni comodissimi e pù rispondenti ai miei gust una certa voglia di essere senza apparire troppo... Che ne dit ho fatto bene? 8)""",Complimenti. Goditela e quando arrivapistacileimpresdioni. aMastati inizia con qualche info supplementare: versione c colore allestimento motorizzazione accessori prezzo sconti etc. ,,,,,,,,,,,,,,
Peugeot 208 GTi 2013,https://www.autopareri.com/forums/topic/48536-peugeot-208-gti-2013?&page=6#comments,2014-06-26 08:13:57,Touareg 2.5,,In Peugeot si sono fissati con sto bicolore Di certo il teaser non era proprio un teaser in quanto la vettura non ha il muso rosso ma nero ( a meno che non ci siano due versioni ) . Aggiornato il primo messaggio con le foto ufficiali. ,,,,,,,,,,,,,,
Info yaris ibrida,https://forum.quattroruote.it/threads/info-yaris-ibrida.109024/page-2,2017-03-21 00:00:00,ziland,,Ammetto di essermi espresso in modo troppo generico usarla come un auto normale intendo senza strafare ma neanche andare in elettrico non bisogna avere paura di accendere il termico e avere un' andatura regolare e moderata in base al traffico senza per questo fare da tappo. Poi va bèh è dalle 3 che sono alzato può darsi che non mi sono spiegato bene ancora... in tal caso mi arrendo ma sono sempre le solite raccomandazioni che si fanno. Saluti ,,,,,,,,,,,,,,
