Titolo,URL,Timestamp,User,(Testo Citato),TESTO,Costruttore,Modello,Brand,Interni,Esterni,Meccanica,Prestazioni,Consumi/Autonomia,Motore,Elettrico,Fuoristrada,Elettronica di Bordo,Manutenzione,Assistenza/Concessionari
Fiat Doblò Facelift 2015,https://www.autopareri.com/forums/topic/59594-fiat-dobl%C3%B2-facelift-2015?&page=5#comments,2014-12-13 09:03:07,boygrunge,,peccato non mettano l'automatico anche sul 2.0MJ probabilmente potrebbe essere comodo per chi fa tanta strada e ha allo stesso tempo bisogno di più di 90CV. ,,,,,,,,,,,,,,
Volkswagen Touareg R50,https://www.bmwpassion.com/forum/threads/volkswagen-touareg-r50.50704/,2007-06-08 00:00:00,antom,,Per ora è destinato solamente al mercato Australiano si tratta di un kit estetico/assetto riservato al 5.0 V10 TDI ,,,,,,,,,,,,,,
Museo Alfa Romeo: finalmente il TAR ha respinto il vergognoso ricorso contro il vincolo.,https://forum.quattroruote.it/threads/museo-alfa-romeo-finalmente-il-tar-ha-respinto-il-vergognoso-ricorso-contro-il-vincolo.49441/page-2,2011-04-15 00:00:00,Fancar_,,Oggi sono passato ad Arese..... ed ho visto gli stabilimenti Alfa Romeo ! È impressionante l'estensione di queste aree ormai abbandonate in disuso o vendute. In una delle entrate si vede ancora l'enorme stemma Alfa Romeo ormai sbiadito. Ai cancelli una persona mi ha spiegato che oltre a quello che si vede fuori terra gli stabilimenti di Arese hanno anche sotterranei con un'estensione immensa. Fa veramente impressione vedere tutto quel patrimonio.... quelle proprietà recintate.... ridotte cosi. Chi critica gli alfisti nostalgici dovrebbe fare un giretto da quelle parti per capire che cosa in passato la nostra classe dirigente è stata in grado di distruggere. ,,,,,,,,,,,,,,
Infomazioni tagliandi Honda HRV,https://forum.quattroruote.it/threads/infomazioni-tagliandi-honda-hrv.114480/,2018-01-23 00:00:00,edoardosavoia,,ammesso che rispetto al tagliando della Note quello dell'HR-V ti costi 100 euro in più ( con le tue percorrenze circa 1 tagliando ogni 11 mesi ) la sua incidenza sarà minore rispetto all'aumento di consumo dato dal passare da un'auto più filante ad una meno ( maggior superficie frontale di un SUV/Crossover ) . Ovviamente su un SUV considera che anche gli pneumatici costeranno qualcosina in più rispetto alla Note. ,,,,,,,,,,,,,,
Audi A4 e A4 Avant 2016,https://www.autopareri.com/forums/topic/58750-audi-a4-e-a4-avant-2016?&page=3#comments,2015-06-29 08:09:16,Passat,,Il 3.0 v6 Diesel 218cv secondo Audi fa 24 a litro in media fantastico...corro a comprarlo ! Unica novità interessante mi sembra l'introduzione della versione g tron per il resto si faticherà ( come sempre ) a distinguerla dalle altre Audi quando ce la si ritroverà davanti. ,,,,,,,,,,,,,,
gomme invernali o 4 stagioni,https://forum.quattroruote.it/threads/gomme-invernali-o-4-stagioni.72582/page-2,2012-12-09 00:00:00,miki15,'@miki15: quali Kleber ? Quadraxer ? Se sono le Quadraxe quanto le hai pagate ? Il mio gommista me le offriva montate a 400 Euro ca. tutto incluso. Poi ho scelto le Quatrac 3.',"le ho pag. 550 "" 225/45/17 Attached files /attachments/1476194=19555-Kleber-Quadraxer.jpg ",,,,,,,,,,,,,,
CAMBIO AUTOMATICO OUTBACK,https://forum.quattroruote.it/threads/cambio-automatico-outback.110739/,2017-06-01 00:00:00,Pier4466,,Salve sono proprietario di una Outback bifuel del 2005 acquistata usata. Dall'estate scorsa all'aumentare della temperatura esterna si ripete un problema a cui finora nessuno ha saputo dare spiegazioni. Dopo qualche km di salita la quarta marcia non entra arrivato in terza con il selettore in qualsiasi posizione non passa alla marcia successiva. Qualcuno ha consigli ? ,,,,,,,,,,,,,,
Tendina oscurante inutile per tetto panoramico Tesla Model 3,https://www.forumelettrico.it/forum/topic5488.html?sid=9b3d6660a00250109c0902db2fb0b90b,2019-05-01 16:40:00,pasquale.castelgrande,,In pratica più il sole picchia più la protezione UV fa il suo effetto ed il tettuccio in vetro si scurisce...,,,,,,,,,,,,,,
Nuova Fiat Punto,https://www.bmwpassion.com/forum/threads/nuova-fiat-punto.10909/page-10,2003-09-02 00:00:00,FaGiO,' ',"no no intendo proprio tutta la mezzaluna... mi sembra ""appoggiata li""... avrei preferito una cosa più omogenea con la plancia ",,,,,,,,,,,,,,
Consiglio sull'acquisto di un audi A4 avant usata,https://forum.quattroruote.it/threads/consiglio-sullacquisto-di-un-audi-a4-avant-usata.108423/,2017-03-02 00:00:00,ftalien77,,"Io ho quasi regalato a mio suocero la mia Passat 2.0tdi di 150mila km. Avessi detto che ne aveva 50mila ci si poteva credere. Le VAG tengono benissimo nel tempo basta cambiare un devio o una cuffia del cambio e non capisci quanta strada hanno fatto. Personalmente 12mila euro e più per una qualunque auto con 150mila km fossero pure veri non li darei nemmeno se fosse di mio cugino. E' già in fascia ""iniziano i guai"" ed i guai costano. ",,,,,,,,,,,,,,
Ritorno della NSX in EU,https://forum.quattroruote.it/threads/ritorno-della-nsx-in-eu.102717/page-7,2016-03-22 00:00:00,rosmarc,,altro articoletto su metodi produzione NSX http://www.autoevolution.com/news/how-the-2017-acura-nsx-is-made-105719.html ,,,,,,,,,,,,,,
Fiat Panda 2011,https://www.autopareri.com/forums/topic/44317-fiat-panda-2011?&page=169#comments,2014-04-01 09:09:45,nicogiraldi,,pesce d'aprile ? ,,,,,,,,,,,,,,
Antipasto di Civic X (USDM),https://forum.quattroruote.it/threads/antipasto-di-civic-x-usdm.95343/page-10,2016-02-10 00:00:00,rosmarc,,"ok ok... come diceva il ""poeta"" pensiamo positivo ! 8 ) ",,,,,,,,,,,,,,
Blue&Me - Blue&Me Nav - Instant Nav (Consigli Utili pag.1),https://www.autopareri.com/forums/topic/29013-blueme-blueme-nav-instant-nav-consigli-utili-pag1?&page=26#comments,2013-03-29 10:06:59,fonzino1,,Mi sa che su Bravo non c'è la regolazione volume del microfono: ho controllato il manuale e non ne parla... ,,,,,,,,,,,,,,
Considerazioni sul circuito dell'E-Prix di Roma 2019,https://www.forumelettrico.it/forum/e-prix-roma-il-circuito-t5303-20.html?sid=10a4e6427c416324461726eb004fd4f2&sid=10a4e6427c416324461726eb004fd4f2,2019-04-19 22:50:00,luctun,"'Insisto col dire che non capisco cosa vi lamentate: ma veramente pensate che possa avere un senso (ecologico) una manifestazione (commerciale) sportiva?Semmai mi sembra più sensata quest di osservazione/lamentela:Luca Cassioli ha scritto:Sapete che in tutta l'area del circuito non sono riuscito a trovare UN libr un opuscol una rivista o un volantino che spiegasse le auto elettriche?!? Cosa son come funzionan quanto costan cosa fann se le vendon dove le vendon quanto costan quanto duran come si ricarican dove si ricarican .... La Formula E non era nata per promuovere e far conoscere le auto elettriche?!?Persino nel negozio di oggettistica varia dell'E-Villag dove vendevano di tutt dai calzini alle magliette ai peluche.... non c'era UNA cosa dove ci fosse scritto ""ELETTRICO"". Cos tanto per far vedere agli amici che sono andato a vedere una ""fiera di auto elettriche"".???????????????? (function( id) { var j fjs = d.getElementsByTagName(s)[0]; if (d.getElementById(id)) return; js = d.createElement(s); js.id = id; js.src = ""//connect.facebook.net/en_GB/all.js#xfbml=1""; fjs.parentNode.insertBefore(j fjs); }(documen 'script 'facebook-jssdk')); Post https://www.facebook.com/selidori/posts ... 3105563:14 'Sapete che in tutta l'area del circuito non sono riuscito a trovare UN libr un opuscol una rivista o un volantino che spiegasse le auto elettriche?!? Cosa son come funzionan quanto costan cosa fann se le vendon dove le vendon quanto costan quanto duran come si ricarican dove si ricarican .... La Formula E non era nata per promuovere e far conoscere le auto elettriche?!?Persino nel negozio di oggettistica varia dell'E-Villag dove vendevano di tutt dai calzini alle magliette ai peluche.... non c'era UNA cosa dove ci fosse scritto ""ELETTRICO"". Cos tanto per far vedere agli amici che sono andato a vedere una ""fiera di auto elettriche"".????????????????'",Non voglio offendere nessuno ma non capire e condividere questo ragionamentofa solo sembrare degli illusi utopisti. E ciò non fa bene alla percezione che si ha della mobilità elettrica,,,,,,,,,,,,,,
Tempi di consegna infiniti Panda,https://forum.quattroruote.it/threads/tempi-di-consegna-infiniti-panda.117171/,2018-06-27 00:00:00,giuliogiulio,,fine 2016. In ogni caso per la gestione del ritardo io mi ero rivolto al concessionario direttamente e senza usare il customer care. Prova a farti dare una vettura di cortesia. La Panda col bicilindrico MA è estremamente divertente e brillante. Ti troverai benissimo. Posso chiederti che macchina sostituirà ? ,,,,,,,,,,,,,,
Buona settimana dal 18/9 al 24/9,https://forum.quattroruote.it/threads/buona-settimana-dal-18-9-al-24-9.112328/page-2,2017-09-22 00:00:00,Serpinik,,Ciao combriccola ! Buona serata ,,,,,,,,,,,,,,
La Prius V4 e suo tanto chriticato design,https://forum.quattroruote.it/threads/la-prius-v4-e-suo-tanto-chriticato-design.112553/page-3,2017-10-02 00:00:00,Streamliner,"""Io ho una mia regola personale sul estetic quando una vettura mi piace subito sto molto attento perché probabilmente con la stessa velocità mi stancher quando invece comincio ad apprezzarla dopo alcune visioni allora vuol dire che è quella che fa per m ed è successo con questa Prius. Mi spiego questo probabilmente con il fatto che una vettura che piace subito ha delle linee che sono quelle consolidate del momento nel mercato automobilistic mentre una vettura come la Prius ha delle linee che vanno oltre è che durano nel tempo. Per fare un esempi la classe A mi aveva entusiasmato sia in foto che la prima volta che l'ho vista nel salon già alle seconda volta aveva un non so che di già visto e mi annoiava.""",Succede spesso anche con la musica ) ,,,,,,,,,,,,,,
Mondiale F.1 2019 - GP del Bahrain,https://forum.quattroruote.it/threads/mondiale-f-1-2019-gp-del-bahrain.121875/page-2,2019-03-25 00:00:00,mani in alto,'Mi raccomando non ti mettere alla guida domenica',Appunto birretta per la moto3 poi la moto2 motogp e per finire la F1 fanno una bella carica alcolica. Va a finire che al traguardo passeranno quattro Ferrari anziché due. ,,,,,,,,,,,,,,
"Info su motore non ""matching""",http://www.porschemania.it/discus/messages/10550/772638.html?1458675636,2016-03-11 13:58:00,baronevero,,"...quindi ci\xf2 che viene scritto all'inizio di questo tread NON \xe8 corretto non lo pu\xf2 essere proprio ! mi preoccupa un restauro ""conservativo"" di 15 aa f\xe0....",,,,,,,,,,,,,,
PROBLEMI RAFFREDDAMENTO CAYENNE..,http://www.porschemania.it/discus/messages/22971/276554.html?1470950221,2007-07-12 11:50:00,federico_,,"La porsche non vuole fare la correntezza perche sostengono che non riescono a risalire alla manutenzione effettuata prima del mio acquisto. La vettura era intestata a Porsche AG per uso aziendale ed \xe8 stata ritirata da me ( con fattura ) alla concessionaria porsche di Colonia. Cosa mi vogliono raccontare che la Porsche di stoccarda ha portato la macchina in manutenzione alla FIAT ? Mi sembra che la teoria: ""UTILIZZO E MANUTENZIONE NON PERFETTI POSSONO PORTARE ALL'INSORGERE DI ALCUNI PROBLEMI "" non sia applicabile per il mio caso.",,,,,,,,,,,,,,
Museo Alfa Romeo: finalmente il TAR ha respinto il vergognoso ricorso contro il vincolo.,https://forum.quattroruote.it/threads/museo-alfa-romeo-finalmente-il-tar-ha-respinto-il-vergognoso-ricorso-contro-il-vincolo.49441/page-156,2012-10-29 00:00:00,fpaol68,"Venerdì si è svolta ad Arese l'assemblea pubblica per discutere dell'area ex Alfa e teoricamente per apprendere quali sono i nuovi proprietari delle aree. Qualcuno sa qualcosa? Essendo pubblica c'era anche la stamp non trovate assordante questo silenzio?... In effetti non si è saputo nulla. Delle due l'una: o non si deve saper oppure l'enfasi mediatica per questo incontro era ingiustificata. ""Venerdì si è svolta ad Arese l'assemblea pubblica per discutere dell'area ex Alfa e teoricamente per apprendere quali sono i nuovi proprietari delle aree. Qualcuno sa qualcosa? Essendo pubblica c'era anche la stamp non trovate assordante questo silenzio?""","Probabilmente la seconda. Sul sito quiarese.it c'è il resoconto dell'incontro. A parte una gran quantità di chiacchere l'unico passo interessante che riguarda anche il museo è questo: ""Entrando nel vivo sulla discussione dell ? area ex Alfa Romeo secondo Luciano Venturini presidente dell ? associazione bisognerebbe agire prevedendo tre aspetti sostanziali: la funzione formativa quella innovativa e quella produttiva. ? La nostra idea ? ha detto Venturini ? è di realizzare un laboratorio per l'economia della conoscenza che abbiamo battezzato Città dell'Innovazione e dello Sviluppo Sostenibile ( CISS ) . Si tratta di un polo per l'eccellenza dell'Innovazione che è fondamentale per la crescita di lungo periodo. ? La funzione formativa del progetto CISS dovrebbe prevedere l'allocazione di un quarto dell'area per la realizzazione di un'area espositiva a contenuto scientifico tecnologico che parta dal museo dell'Alfa Romeo. In quest ? area andrebbero previste collaborazioni con enti esterni come il Museo della Scienza e della Tecnologia e le università con una concentrazione delle strutture di ricerca. La funzione produttiva dovrebbe vedere invece insediamenti multi-settoriali con alcuni settori privilegiati come quello dell'automobile delle apparecchiature bio-medicali delle nanotecnologie. In questo contesto è stata ospitata la società MadeInDreams società che opera come consulente nell ? ambito del design automobilistico. ? Abbiamo in mente un'iniziativa che abbiamo definito Design di Origine Protetta ? ha spiegato Federico Giuliano CEO e socio fondatore. ? Noi riapriremmo il museo mettendolo a norma e ristruttureremmo l'area che era della mensa utilizzandola per la ristorazione e l ? ospitalità. Le tre aree del cento direzionale potrebbero diventare un polo comprendente un centro di formazione l'archivio storico una zona di uffici e una zona dedicata ai convegni. ? Questo è il link: http://www.quiarese.it/index.php/cronaca/cronaca/1563-adp-un-treno-in-corsa-ormai-vicino-a-destinazione.html ",,,,,,,,,,,,,,
c2 e cambio pneumatici. Aiutatemi a capire...,https://forum.quattroruote.it/threads/c2-e-cambio-pneumatici-aiutatemi-a-capire.108912/,2017-02-20 00:00:00,paolaok@email.it,,4 pneumatici michelin saver+ 175/65 r14 82T. Preventivi comprensivi di iva e cambio di valvola: 275€ 300€ 352€ Che faccio ? mi accontento dei 275€ ? o secondo voi posso trovare di meglio... ,,,,,,,,,,,,,,
Curiosità: anche la vecchia Y aveva il bicolore,https://www.autopareri.com/forums/topic/9938-curiosit%C3%A0-anche-la-vecchia-y-aveva-il-bicolore,2004-11-24 08:29:19,viva l'italia,,cmq a me con quei colori sembra da gay ! Pero' che cerchi ! ! ! ,,,,,,,,,,,,,,
Consumi Mini cooper,https://forum.quattroruote.it/threads/consumi-mini-cooper.103984/,2016-10-27 00:00:00,elix84,,ma la tua cooper la vede mai la quinta e la sesta marcia ? ,,,,,,,,,,,,,,
ANTIFURTO PER 356,http://www.porschemania.it/discus/messages/10550/1464.html?1027356671,2002-07-17 21:38:00,ulisse,,A Giuliano e Luca cosi' come a tutti gli specialisti 356 di Porschemania chiedo quale antifurto sia consigliabile utilizzare su questi modelli. Visto le quotazioni di queste vetture mi sembra importante proteggerle. Forse ne avete gia' parlato e per evitare ripetizioni ho controllato nell'archivio. Purtroppo non sono riuscito a trovarlo quindi vi chiedo una consulenza.,,,,,,,,,,,,,,
Maserati Ghibli 2013,https://www.autopareri.com/forums/topic/51327-maserati-ghibli-2013?&page=117#comments,2013-06-25 16:37:59,Puntor89,,"Che rombo ragazzi... Noto solo ora l'orologio piazzato li in mezzo quasi appoggiato potevano integrarlo un po' di più.. per il resto è veramente una ""dream -car"" ",,,,,,,,,,,,,,
Spia Esp e Abs improvvisamente accese,https://forum.quattroruote.it/threads/spia-esp-e-abs-improvvisamente-accese.120187/,2019-01-08 00:00:00,NEWsuper5,,ESP: electronic stability program nome commerciale del sistema ESC. Mentre EPS è la sigla del polistirene... Nel caso della tua auto però potrebbe essere fuori uso anche il ripartitore di frenata elettronico ( meccanico nella Clio ) e questo potrebbe crearti possibili sbandate in frenata. Inoltre stai andando in zone dove le strade con fondo viscido non mancheranno e finire in cunetta è questione di attimi. Non mi sentirei affatto tranquillo. Fossimo in estate e con strade ben asciutte sarebbe un discorso diverso. ,,,,,,,,,,,,,,
volvo c30,https://www.bmwpassion.com/forum/threads/volvo-c30.31806/page-2,2004-07-18 00:00:00,Melo,,Perchè hai messo due volte l'http ! :- ) ,,,,,,,,,,,,,,
LANCER 1.8 MIVEC DI-D 4WD...,https://forum.quattroruote.it/threads/lancer-1-8-mivec-di-d-4wd.35444/page-2,2011-01-12 00:00:00,jaja00yaya,"senza offesa i motivi per i quli la lancer non ha fatto successo sono ben altri... sicuro non la mancanza di motori... nessuno di coloro che ha una lancer si lamenta dei motori... ero già adeguati quelli era il resto che non convince. e non importaranno piu in italia la lancer salvo imprevisticambi di rotta.... topomollo cosa intendi per ""è il resto che non convince""? No perche le uniche critiche che ci sono sul ns. sito della lancer (lanceritalia) sono proprio sul motore 8 benzina che è lento ai bassi e tira una favola dopo i 4000 giri e consuma abbastanza qundi obbligo di gp per il resto ci ha convinto tutto 'senza offesa i motivi per i quli la lancer non ha fatto successo sono ben altri... sicuro non la mancanza di motori... nessuno di coloro che ha una lancer si lamenta dei motori... ero già adeguati quelli era il resto che non convince. e non importaranno piu in italia la lancer salvo imprevisticambi di rotta.'",Da amante delle jappo devo dire che il problema principale delle lancer secondo me è l'aspetto esteriore. I modelli sportivissimi -e preclusi a pochi fortunati che possono fare un utilizzo limitato del mezzo e che scelgono un'auto eccezionale- erano belli fino alla evo IX ma in generale i modelli base sono sempre stati poco amati dal pubblico. Se a ciò aggiungi che non è un'auto nè molto pubblicizzata tramite i media nè che si vede facilmente in giro molti neppure sanno che esiste. ( Esempio: sarà che è un mezzo eccezionale nell'ambito mistubishi ma il pajero è un cult per gli sciatori e se vai in montagna ne vedi a centinaia così che ti viene la voglia di farci un pensierino se hai in mente un mezzo di quel tipo: io credo di lancer di averne viste 3 in vita mia di cui 2 evo e una station ) . Infine con il nuovo modello credo che le opportunità di piacere siano terminate: addirittura la Evo X incredibile per prestazioni all'occhio di molti risulta orribile.. i modelli standard neanche a parlarne. ,,,,,,,,,,,,,,
Porsche addio alle versioni diesel,https://forum.quattroruote.it/threads/porsche-addio-alle-versioni-diesel.118611/page-2,2018-10-01 00:00:00,pi_greco,'Ma su mezzi di quel tipo il costo del rifornimento è realmente una frazione trascurabile del TCO. Comprendo assolutamente i pochi che sul Q7 sceglievano il V8 diesel (che ha un suo perché) che non i molti che andavano di V6 diesel sulle Porsche.',Concordo sulla dicotomia Q7V8 vs Cayenne V6 che però poi ripaga con una piacere di guida differente in ogni caso non mandatorio su un SUV grande e diesel. Concordo sulla frazione residuale del costo del combustibile per autotrazione su auto di quella fatta. Ma per l'utente medio l'esborsio quotidiano alla pompa incide molto dal punto di vista psicologico e non da piacere come lo spendere per possedere il mezzo agognato. ,,,,,,,,,,,,,,
Tempi di consegna Kodiaq,https://forum.quattroruote.it/threads/tempi-di-consegna-kodiaq.111799/page-6,2017-10-23 00:00:00,lukkinen,"""E così dall'inquinamento passiamo all'economia. Passi da un investimento ad una spesa corrente e l'italiano come le aziende investe in strumenti ma riduce il personale. Ma è come per il diese lo compra perché consuma meno anche se spende 4k€ in più per comprarlo e poi fa 9'000 km l'anno (senza considerare l'eccesso dell'amico che dopo un anno è forse a 4'000 ma forse meno).""",Bortolo col bene che ti voglio .....non ho capito nulla mi traduci ? ,,,,,,,,,,,,,,
EX,https://forum.quattroruote.it/threads/ex.11564/page-2,2010-03-05 00:00:00,salva59,'a fine mese porterò la mia EX 37 presso la concessionaria fassina di milano per il I° tagliando; qualcuno di voi ha lo ha già fatto e quanto gli è costato? grazie',"390 ? tanto mi è costato il I° tagliando della EX oggi pomeriggio previo appuntamento ho portato l'auto presso la concessionaria fassina di milano. Personale molto disponibile pronti ad ascoltare eventuali osservazioni o dubbi. oltre a cambiare i vari filtri e rabbocchi di vario tipo hanno anche ""igienizzato"" limpianto di climatizzazione. tenedo conto che il libretto di manitenzione prevede poche verifiche o ispezioni al I° tagliando l'importo fatturatomi dal capofficina a me sembra un tantino caro rispetto al lavoro svolto o sbaglio. ",,,,,,,,,,,,,,
vorrei acquistare ix20 o golf plus,https://forum.quattroruote.it/threads/vorrei-acquistare-ix20-o-golf-plus.45929/,2011-02-15 00:00:00,crust28,,Bravo ottima scelta ! Deciso diesel alla fine ? Non hai provato anche il benzina ? La prova di 4R dice che con il 1.4 benz. l'auto è perfetta.... In ogni caso attendiamo report.... - ) Per lo sconto prova a contattare anche solo telefonicamente e/o via mail altre concessionarie nel raggio di 150-200 km da casa tua... se ne trovi una che ti fa uno sconto interessante fatti mandare un preventivo via mail ( spesso lo fanno ) e portalo dalla tua concessionaria per farti abbassare il prezzo se non cedono sali in auto e vai a ordinare dall'altro venditore ,,,,,,,,,,,,,,
info,https://forum.quattroruote.it/threads/info.67465/,2012-07-17 00:00:00,MAXSUPEREROE,,Salve sono possessore di una jeep patriot e lamento un rumore di ferraglia proveniente da sotto il pianale ogni volta che percorro strade dissestate o anche con il pavé. A qualcuno è capitata una roba del genere ? Come l'avete risolta ? ,,,,,,,,,,,,,,
Vendite Infiniti,https://forum.quattroruote.it/threads/vendite-infiniti.46302/page-2,2011-04-06 00:00:00,laponite,"'Visto il ""top"" di gamma che vuole avere Infiniti secondo me i diesel di riferimento sono il 3000 biturbo BM il 3000 da 265 cv mercede il 3000 del Cayenn ecc ... Non prenderei a riferimento i 2000 diesel. Confrontare i 2000 c.c. tedeschi al 3000 c.c. infiniti è di fatto ammettere la inferiorità infiniti rispetto ai migliori diesel tedesch che appunto sono ben altri rispetto agli ""economici 2000"". Io non ho provato il diesel infiniti. Quello che posso valutare sono le prestazioni: mentre nei motori a benzina il 3700 Infiniti rivaleggia con il 3000 biturbo benzina bmw e con i V6 Porsch la FX con il 3000 diesel perde molto rispetto alla X5-X6 3000 biturbo diesel e perde anche dal Cayenne. Prova a vedere il confronto di prestazioni tra la X3 3000 biturbo diesel e la Ex 3000 diesel ..... Ora se si parte dal presupposto che infiniti si per natura un marchio sportiv ad alte prestazion il diesel ne esce non benissimo. Se vediamo infiniti come una marca di medie pretazion da paragonare ai motori 2000 tedeschi allora ok ..... ma davvero questa vuole essere la collocazione di Infiniti ????'","Ciao facip scusa ma perché paragoni la X3 biturbodiesel con la EX 3.000d ? I motori ""35d"" ( ed ora ""40d"" ) di BMW sono un po' fuori dal coro secondo me... Vediamoli come motori ad altissime prestazioni ma pur sempre di nicchia anche perché portano il prezzo dell'auto che li utilizza molto in su. La X3 biturbo diesel parlo della vecchia serie ha fatto numeri limitati così come la Serie 3 ( eccetto forse la coupé ) . Altrimenti guardando solo a chi ha il diesel 3 litri più potente si dovrebbe comprare BMW e basta è un po' la storia del chi ce l'ha più grosso... Alla fine in strada le X3 si vedono col 3 litri ""standard"" e forse molte più col 2 litri quindi paragoniamo la EX ( ma anche la FX ) a X3/X5/X6 con il motore da 235cv diventato poi 245cv e presto 258cv ma non con 286/300cv che mi ripeto va' visto un po' come il motore di nicchia. A questo punto non credo che il motore Infiniti ( Renault ) sia molto peggio anzi vanta anche una coppia maggiore poi se una Touareg fa 0-100 in 7""8 e la FX in 8""3 chissenefrega... nell'uso quotidiano in mezzo al traffico ci nota la differenza ? Il top di gamma come tu dici Infiniti lo raggiunge offrendo auto molto ben fatte e full optional che confrontate con le concorrenti PARIEQUIPAGGIATE finiscono per costare 20.000 ? in più ( avevo provato a configurare per curiosità una X6 30d con tutto quello che ha la mia FX ) che non rimangono mai ferme per strada ( SPERO :lol: ) e con una linea spettacolare. BMW continuerà a svettare per la potenza ma resta alla fine una principale vetrina e fonte di attrazione commerciale un po' come mettere in salone l'M3 poi ne vendono una ogni 3/400 Serie 3 ""normali"". ",,,,,,,,,,,,,,
[Mai Nate] Suv Alfa Romeo - SUV ELASIS,https://www.autopareri.com/forums/topic/36115-mai-nate-suv-alfa-romeo-suv-elasis?&page=4#comments,2009-12-02 10:35:54,Cosimo,,vedo ora.. mamma mia.. questa se non sbaglio però era la zozzeria che girava all'elasis.. da cosa ne so ne stavano attrezzando uno diverso.. digiamo meno caccoso... ,,,,,,,,,,,,,,
Tempi di consegna BIBLICI..cosa mi consigliate di fare ?,https://forum.quattroruote.it/threads/tempi-di-consegna-biblici-cosa-mi-consigliate-di-fare.116100/page-4,2018-07-23 00:00:00,bergat,,Subentrare... si ma poi con gli stessi accessori colore e motore ? la vedo difficile. Comunque aspettare è la miglior cosa. ,,,,,,,,,,,,,,
