Titolo,URL,Timestamp,User,(Testo Citato),TESTO,Costruttore,Modello,Brand,Interni,Esterni,Meccanica,Prestazioni,Consumi/Autonomia,Motore,Elettrico,Fuoristrada,Elettronica di Bordo,Manutenzione,Assistenza/Concessionari
affidabilità e costi FREELANDER 2,https://forum.quattroruote.it/threads/affidabilit%C3%A0-e-costi-freelander-2.40925/,2010-11-16 00:00:00,ghiro6969,,Per quanto riguarda il vecchio Free 2 in tre anni e 72.000 km con utilizzo 20% città 50% extraurbano e 30% autostrada ( fuoristrada poco a parte qualche strada bianca in Toscana ) ho avuto le seguenti esperienze: - DPF mai avuto nessuna segnalazione - riscaldatore elettrico sostituito in garanzia - ventola impianto riscaldamento sostituito in garanzia - plastica interna porta destra deformata sostituito in garanzia - fischio anomalo turbo sostituito in garanzia. Questi sono stati i problemi che ho avuto ampiamente compensati dalle grandi soddisfazioni avute in tutte lo occasioni di guida. Grande comodità nei lunghi viaggi in autostrada prontezza nel misto e senza parole sulla neve. Consumi medi: 14 km/l con i cerchi originali da 16 e 12 5/13 con i cerchi da 18. Costo tagliandi media di 400 Euro Per quanto riguarda il nuovo Free 2 2011 td 150 cv mod. S balcit blue. Opt. sens park ant+post ruota scorta dim normali. Motore: migliorato ulteriormente nella coppia molto fluido e già a 1750 giri ti da il massimo di tiro possibile. Come il precedente è inutile andare oltre il 3.000 giri perchè la mappatura è fatta apposta per cambiare molto prima. Nei sorpassi ad 80/90 in quinta o sesta basta sfiorare l'acceleratore e si passa senza sforzo. Inutile dire che questo motore ha delle potenzialità molto superiori ma purtroppo per restare entro i limiti Euro 5 è stato molto strozzato... Guida sterzo sospensioni cambio: nulla da dire il Free si conferma un salotto molto morbido il cambio e le sospensioni assorbono le buche alla grande ( anche con la pressione a 2.5/2.6 atmosfere ) . Sterzo morbido e diretto nel misto è una goduria impostare le curve. Adesso finalmente con il cruise controll mi sono divertito a rilassarmi e godermi ancor di più la guida. Consumi: in guida mista per ora mi segna 6.7 quindi quasi 15 km con un litro. Quando entra il sistema star and stop le prime volte prendi paura perchè non sei pronto ma poi ti abitui. Sfiorando la frizione si rimette in moto in una frazione di secondo che dire fantastico ! . Comfort e finiture: il comfort di guida nel complesso è ulteriormente migliorato anche se con il vecchio free già eri al top. In marcia ad 80/90 si nota che i db sono ulteriormente diminuiti ed il rumore del motore è un lontano ricordo. Anche con i finestrini abbassati la musica cambia mentre prima quando entrava il turbo si sentiva il classico fischio adesso la nuova geometria variabile emettere un sommesso ronzio quasi impercettibile. Nota positiva sono le finiture che presentano plastiche più morbide e ad occhio più solide. Finalmente quando prendi la maniglia per chiudere/aprire le porte provi una sensazione di solidità/classe superiore. Infatti hanno rivestito le maniglie interne delle porte con uno strato di mezzo centimetro di gomma molto morbida. Anche il tessuto dei sedili mi sembra meglio disegnato e di qualità superiore ai precedenti. ,,,,,,,,,,,,,,
Quale Stelvio acquistare?,https://forum.quattroruote.it/threads/quale-stelvio-acquistare.117465/page-11,2018-09-06 00:00:00,danilorse,"""Pensavo che la Stelvio fosse un po più leggera sono solo 129 kg in meno per l'Alf non tantissimi""",130kg non sono certo pochi e considera che in condizioni di prova non trovi nessun Suv premium di questo segmento sotto le 2 tonnellate. ,,,,,,,,,,,,,,
Jaguar F-PACE tachimetro sballatissimo,https://forum.quattroruote.it/threads/jaguar-f-pace-tachimetro-sballatissimo.120267/,2019-01-12 00:00:00,gibi1963,,Utilizzo una Jaguar F-PACE 240CV noleggio a lungo termine Leasys 5 anni 100.000 km totali consegnatami all’inizio di Marzo 2018. Subito dopo aver ritirato l’auto ho notato che il tachimetro indicava una velocità visibilmente superiore a quella reale. Ho quindi verificato cronometrando il km con cruise control impostato su varie velocità fisse riscontrando i seguenti valori: tachimetro 50 effettivi 44 tachimetro 140 effettivi 130 A seconda delle diverse velocità lo scarto medio è superiore al 7%. Chiamo Leasys informandoli della cosa è evidente che essendo un noleggio a lungo termine con 100.000 km da contratto se si considera uno scarto medio del 7% significa che restituendo l’auto a fine noleggio con 100.000 km di tachimetro in realtà i km fatti saranno solamente 93.000. Leasys prenota un controllo presso la concessionaria xxxxxxxxxxxxxxxxx Lascio l’auto il 2/7/2018 e la ritirerò il 10/7/2018 Xxxxxxxxxxxxxx si limita a interrogare la diagnostica dell’auto non trovando alcun malfunzionamento. Naturalmente l’auto non è stata provata su strada cronometrando oppure con riscontri GPS. Dubito fortemente che la diagnostica di bordo sia programmata per riscontrare uno scarto sul tachimetro più probabilmente si limita a diagnosticarne il funzionamento ( SI/NO ) . Faccio notare la cosa ma mi viene risposto che non è previsto un controllo di quel tipo. Chiedo allora di avere un documento da Casa Madre che dica che lo scarto a mio sfavore esiste come da me dettagliatamente provato per poter discutere la cosa con Leasys ma mi viene risposto che Jaguar Italia non può prendere in considerazione la cosa. Non trovo assolutamente corretto un comportamento di questo tipo da parte di Casa Madre. Se l’auto fosse stata di mia proprietà non avrei avuto nessun tipo di problema ma trattandosi di noleggio a lungo termine la cosa è assolutamente differente…… dovrò pagare per i km in più a fine noleggio ( in realtà mai percorsi ) . Chiedo ai possessori di JAGUAR F-PACE di verificare sulla loro auto l'esistenza o meno dello stesso problema. ,,,,,,,,,,,,,,
Vista e provata alfa 159,https://www.bmwpassion.com/forum/threads/vista-e-provata-alfa-159.15376/page-28,2004-12-12 00:00:00,Twin Spark,,onore alla 159 2.4 jtd pesa solo 1860 kg con 200 cv fa 8.6 sec ( cammina come un 320d touring ) e poco + dei 200 distribuzione pesi 68 - 32 cavolo questa si che è meccanica raffinata ! ,,,,,,,,,,,,,,
Renegade 1.6,https://forum.quattroruote.it/threads/renegade-1-6.109431/page-2,2017-03-20 00:00:00,renexx,'Ovviamente nuova e 4x4 ha un attimino di valore o presunto tale percui da rifletterci ( tenendo presente che compr suv ben più grandi e integrali con meno tipo qashqai o kadjar o Forester per dirne tre così) ..economicamente parlando hai fatto la scelta giusta anche perché la rivendi quando vuoi',Penso sinceramente che terrà bene il mercato almeno ci spero... ,,,,,,,,,,,,,,
FOTO GT3,http://www.porschemania.it/discus/messages/492693/503562.html?1450769486,"venerdì 02 ottobre 2015 - 08:17:   \t <BR>elaborazione di Techart... <BR> <BR>JOHNNY STAI INVECCHIANDO! L&#39;HAI GIA&#39; SEGNALATA QUESTA FOTO!<!--/Text--><hr noshade size=0><!--field:signature-->DANKE HERR HANS MEZGER!<!--/field-->\n</td></tr>\n<!--/Post: 1373354-->\n<!--Post: 1373371--><!--Time: 1448632132-->\n<!--p:--><tr bgcolor=""#000000""><td valign=top width=200><a name=""POST1373371""><a href=""#MT""><img src=""http://www.porschemania.it/discus/icons/mark_top.gif"" height=12 width=12 border=0 alt=""Inizio pagina""></a><a href=""#POST1373354""><img src=""http://www.porschemania.it/discus/icons/mark_up.gif"" height=12 width=12 border=0 alt=""Messaggio precedente""></a><a href=""#POST1373385""><img src=""http://www.porschemania.it/discus/icons/mark_down.gif"" height=12 width=12 border=0 alt=""Messaggio seguente""></a><a href=""#MB""><img src=""http://www.porschemania.it/discus/icons/mark_bottom.gif"" height=12 width=12 border=0 alt=""Fine pagina""></a>&nbsp;<a href=""http://www.porschemania.it/cgi-bin/discus/show.cgi?tpc=492693&post=1373371#POST1373371"" onClick=""alert(\'se selezioni questo link con il tasto destro del mouse (o il tasto unico tenendo premuto il tasto CTRL) e scegli di copiare l\xb4abbreviazione nel tuo messaggio, puoi facilmente creare un link a questo messaggio.\'); return false;""><img src=""http://www.porschemania.it/discus/icons/tree_m.gif"" height=12 width=12 border=0 alt=""Copia il link di questa pagina""></a><br><br><font face=""Verdana, Arial, Helvetica"" size=""2""><b><!--email--><a href=""http://www.porschemania.it/cgi-bin/discus/board-profile.cgi?action=view_profile&profile=vis-users"" target=""_blank""><!--/email--><!--name-->vittorio &#40;vis&#41;<!--/name--></b></a>\n</a><br><font size=1><!--field:status--><!--use: 4--><!--/field-->Utente registrato <br>Username: <!--field:uname-->vis<!--/field--><br><br>Messaggio numero: <!--field:posts-->100<!--/field--><br>Registrato: <!--field:registered-->04-2015<!--/field--><br><!--field:ip_address--><!--/field--></font></font></td><td valign=top><font face=""Verdana, Arial, Helvetica"" size=""2""><table width=100% border=0 cellspacing=0 cellpadding=0><tr><td align=left><font face=""Verdana, Arial, Helvetica"" size=""2""><font size=""1"">Inviato il venerdì 27 novembre 2015 - 14:48",johnny_cecotto,,Bella schifezza.,,,,,,,,,,,,,,
Brera GTA ?,https://www.bmwpassion.com/forum/threads/brera-gta.15532/page-3,2004-12-12 00:00:00,Twin Spark,,http://www.autoblog.it/uploads/brera.mpg ,,,,,,,,,,,,,,
A Torino non si &#34;Venga&#34;,https://forum.quattroruote.it/threads/a-torino-non-si-34-venga-34.22396/page-2,2010-03-05 00:00:00,andmosc,,parlando di dettagli cosa mi dici dell'impianto audio e del vivavoce bluetooth ? Andrea ,,,,,,,,,,,,,,
la batcaverna 635csi &co,https://www.bmwpassion.com/forum/threads/la-batcaverna-635csi-co.85405/page-46,2005-01-07 00:00:00,Geno,'a dire la verit n ma penso che per ora restauro quelle che ho ferme in box:wink:',Quando ho fatto l'engine swap ti avviso ,,,,,,,,,,,,,,
Ma quanto dura una batteria?,https://forum.quattroruote.it/threads/ma-quanto-dura-una-batteria.34226/page-3,2015-05-19 00:00:00,xdelta15,xdelta15 ha scritto: Sulla mia Yaris del 2001 ho ancora quella original 9 anni.. è una Panasonic/Matsushita... Anche la mia Panasonic dopo 6 anni e mezzo funziona ancora.... Batteria originale ancora alsuo post quasi 14 anni... ' xdelta15 ha scritto: Sulla mia Yaris del 2001 ho ancora quella original 9 anni.. è una Panasonic/Matsushita... Anche la mia Panasonic dopo 6 anni e mezzo funziona ancora. 'Sulla mia Yaris del 2001 ho ancora quella original 9 anni.. è una Panasonic/Matsushita',Batteria morta all'improvviso ieri sostituita con Tudor. Durata 14 anni e un mese..... ,,,,,,,,,,,,,,
Presentazione alla stampa Lexus IS,https://www.bmwpassion.com/forum/threads/presentazione-alla-stampa-lexus-is.9104/page-7,2004-04-20 00:00:00,Davide,,riSTICA ! ,,,,,,,,,,,,,,
Lo strano caso dei montanti colorati!,https://www.autopareri.com/forums/topic/23120-lo-strano-caso-dei-montanti-colorati?&page=7#comments,2007-04-23 17:57:31,alethink,,Tò fatto in un secondo... nella prima si vede abbastanza l'effetto furgoncino di cui parlavo. ,,,,,,,,,,,,,,
Abarth 124 rally RGT,https://forum.quattroruote.it/threads/abarth-124-rally-rgt.106123/page-15,2017-12-24 00:00:00,pilota54,,"Un'interessante intervista ad Andrea Nucita il pilota che insieme a Fabrizio Andolfi ha ottenuto i migliori risultati in Italia con la vettura dello scorpione. Il pilota non svela i programmi 2018 ma lascia intendere che proseguirà il percorso intrapreso con Abarth sul fimnale di stagione. L'intervista è dell'1/12 quindi immediatamente prima del rally di Monza dove Nucita e la sua 124 rally hanno dominato il gruppo RGT. http://motorsport.motorionline.com/...24-rally-pronti-a-dare-spettacolo-intervista/ ""................Non svelo nulla sul mio 2018 ma mi piace il percorso intrapreso con Abarth e spero di portarlo avanti."" Speriamo che il Natale porti un bel regalo sotto l’albero allora. ""Lo sta già portando. Manca meno di un mese e siamo qui al Monza Rally a divertirci cosa chiedere di più se non il calore degli appassionati ! "" ",,,,,,,,,,,,,,
Jaguar F-Type Convertible M.Y. 2015,https://www.autopareri.com/forums/topic/48781-jaguar-f-type-convertible-my-2015?&page=34#comments,2014-11-20 12:27:31,alederme,,"ci stavo dando una guardata sul configuratore inglese gia' aggiornato sembra che la piccolina 340cv vada a prendere gli scarichi sportivi di serie prima non era cosi' non so se questa cosa sara' applicata anche sui modelli italici me lo auguro. Ø un gran model year cambia tanto e tutto in meglio io la manuale la prenderei davvero in considerazione basta che in concessionaria non si scandalizzino come fanno in porsche: ""ma no ! ma lasci stare manuale non la vuole nessuno"" cass pago la prendo come piace a me mica come piace al venditore ",,,,,,,,,,,,,,
Così negli U.S.A. trattano i loro clienti...,https://www.bmwpassion.com/forum/threads/cos%C3%AC-negli-u-s-a-trattano-i-loro-clienti.127620/,2010-02-16 00:00:00,Bettino,,"Così negli Stati Uniti la B.M.W. considera la propria preziosa clientela. Un bel giorno il proprietario di una 335i riceve via posta un pacchettino... lo apre...[/URL][/IMG] Caro Steven xxxx sono passati due anni dall'acquisto della tua B.M.W....[/URL][/IMG] apriamo la scatola...[/URL][/IMG][/URL][/IMG] e troviamo: una signora penna ( ""a fine writing instrument"" ) con il corpo realizzato in fibra di carbonio prodotto con ...e che speriamo possa esserle utile...Per piacere esprimete una valutazione comparativa tra il trattamento ricevuto dal nostro amico bmw-ista statunitense e quello ricevuto da voi personalmente...in concessionaria e /o in assistenza... Grazie ! ",,,,,,,,,,,,,,
Colonnine Fast Esselunga Milano MI Viale Famagosta 56,https://www.forumelettrico.it/forum/colonnine-fast-esselunga-milano-mi-viale-famagosta-56-t4263-10.html?sid=b0e691a42686ee7bf8010cc0139686ad&sid=b0e691a42686ee7bf8010cc0139686ad,2018-12-13 19:08:00,selidori,,"Interessante.Dal sito ESSELUGNA ho trovato un mare di documentazione tecnica su tutto della nuova sede di cui parliamo.Ci sono anche i disegni autocad le caratteristiche di tutti gli impianti.C'e' una marea di roba veramente tantissima ho guardato un po' di documenti ma non ho trovato le parti che parlano di noi ( ci deve essere visto che è documentato praticamente ogni filo d'erba ) ma sarebbe bello vedere come e perchè di quelle scelte.La cartella è dinamica e sembra tanto che a breve sparirà quindi conviene consultarlo e scaricarlo il prima possibile:https://www.esselunga.it/cms/bandi-gare ... -iris.html screenshot-www.esselunga.it-2018.12.13-19-09-16.png ( 635.59 KiB ) Visto 475 volte NOTA:nella cartella stampa purtroppo non dicono fra le dotazioni del punto vendita la presenza di colonnine:https://www.esselunga.it/cms/area-stamp ... gosta.htmlsegno che non lo reputano ancora mediaticamente interessante ( e che noi non potremo sapere se ci sono colonnine da queste cartelle stampa ) . Ancora una volta il marketing toppa ( ed è strano -da parte di esselunga- almeno che la tecnica sia proprio quello di non dire niente per far sembrare la cosa -quando si scoprirà- come naturale e che c'e' da sempre nel DNA Esselunga ) .<img alt=""screenshot-www.esselunga.it-2018.12.13-19-09-16.png"" class=""postimage"" onclick=""viewableArea ( this ) "" src=""./download/file.php ? id=10440&amp sid=b0e691a42686ee7bf8010cc0139686ad""/>",,,,,,,,,,,,,,
Prima volta in un officina Porsche... e vi dò una dritta !!,http://www.porschemania.it/discus/messages/22971/542988.html?1331198693,2011-01-28 16:07:00,robzo,,...non vorrei essere o.t. ma scusa Silvano e il problema che ti strattona a gpl quindi non l'hai risolto ? Mi sembravi uno dei maggiori fautori diciamo ideologicamente del gpl ma in sostanza qualche problema lo da a quanto pare.,,,,,,,,,,,,,,
Alfa Romeo Giulia Quadrifoglio 2016,https://www.autopareri.com/forums/topic/58587-alfa-romeo-giulia-quadrifoglio-2016?&page=252#comments,2015-07-31 14:36:23,zfc,,Cavolo come vorrei vederla di presenza . Intanto non mi posso muovere per ora ,,,,,,,,,,,,,,
tempi di consegna reali suzuki swift 1.0 hybrid s,https://forum.quattroruote.it/threads/tempi-di-consegna-reali-suzuki-swift-1-0-hybrid-s.115774/page-4,2018-07-23 00:00:00,raphel,,Azzzz lo sapevo io…scrivo subito al concessionario e se non basta lo chiamo oggi pomeriggio…vedo di farmeli verniciare…grazie per la dritta ! ,,,,,,,,,,,,,,
Nuova Smart 42!,https://www.bmwpassion.com/forum/threads/nuova-smart-42.31084/,2005-05-11 00:00:00,Head,,,,,,,,,,,,,,,,
Astra h 1.6 16v z16xep cosmo,https://forum.quattroruote.it/threads/astra-h-1-6-16v-z16xep-cosmo.116180/,2018-04-21 00:00:00,fulvio testa,,Rettifica motore arrivo in officina con un battito di punterie rumorose e un consumo eccessivo olio motore da un 10w40 sono passato a un 5w30. Un olio più fluido. Non ho fumosità allo scarico non ho perdite di liquido di raffreddamento trafilamento tra cilindri non ho la guarnizione della testata che perde olio. Sono a 147.000 Km la rettifica della testata ci può stare la rettifica di tutto il monoblocco mi sembra eccessivo. Il consumo di olio motore può imputarsi ad un olio troppo fluido ... ma per voi il monoblocco per forza bisogna rettificarlo ? ,,,,,,,,,,,,,,
Lamborghini Aventador LP 700-4 2011,https://www.autopareri.com/forums/topic/42097-lamborghini-aventador-lp-700-4-2011?&page=16#comments,2012-07-31 17:14:25,Uomo dell'Ovest,,"Poi per quel poco che interessa agli acquirenti ci saranno risvolti interessanti nei paesi dove si paga in bollo o altre tasse in base alla co2 ! Anche perchè il ciclo omologativo credo proprio riesca a farlo totalmente anche a ""soli"" 6 cilindri ",,,,,,,,,,,,,,
Fiat 500 M.Y. 2014,https://www.autopareri.com/forums/topic/26165-fiat-500-my-2014?&page=280#comments,2008-12-01 17:25:43,Quo.Lore,,"Una curiosità : ecco una pubblicità della 500 per le strade di Ginevra. Altre foto in qualità dignitosa qui Sors-moi d’ici ! *** Athos99 le blog photo artistique et d'information sur Genève Il messaggio dice ""Tirami fuori da qui ! "" Ne hanno pure parlato nei giornali di questo manifesto... in effetti le 500 sono in scala 1:1. Ognuna pesa 80 kg. Il manifesto tra il prezzo della struttura della realizazione e dell'affito del ""muro"" avrebbe costato sui 36'000CHF cioè più di 20'000€. marketingune pub suspend cinq voitures a un pan d8217immeuble aux acacias - Archives de la Tribune de Geneve Bel colpo di Fiat... ! La pubblicità è pure stata amplificata grazie all'articolo nel quotidiano. Sono andato oggi al Fiat Center. O dovrei chiamarlo il Fiat 500 Center... In effetti in vetrina ci sono una marea di 500 il che conferma che la Fiat in Svizzera punta tutto su di essa. Anche perché la gente non sembra interessarsi al resto della gamma. Poi nello spazio riservato alle auto in attesa di consegna al cliente innumerevole le 500... ",,,,,,,,,,,,,,
Povera brera...è un poco appesantita,https://www.bmwpassion.com/forum/threads/povera-brera-%C3%A8-un-poco-appesantita.41560/page-2,2004-08-23 00:00:00,mamo,'cavolo...10 km è davvero tanto... Be concordo con chi definisce bruciata la Brera... Ad oggi non è la concorrente di nessuna della coupé tedesch indietro come prestazion come pes come consumi. Ha prestazioni e consumi ben peggiori di una TT da 225cv...mah...',cavolo...10 km è davvero tanto...Beh concordo con chi definisce bruciata la Brera...Ad oggi non è la concorrente di nessuna della coupé tedesche indietro come prestazioni come peso come consumi.Ha prestazioni e consumi ben peggiori di una TT da 225cv...mah... ,,,,,,,,,,,,,,
dimissioni,https://forum.quattroruote.it/threads/dimissioni.107545/,2016-12-12 00:00:00,A-80,,"Per ri-correttezza ho provveduto alla disiscrizione del profilo "" gallongi"" cosicché anche se vedete che risulto ancora moderatore ( in attesa della modifica da par della redazione ) non posso più accedere con quel profilo e di fatto non posso fare nulla . Ora sono appunto A-80 piacere ",,,,,,,,,,,,,,
La Manovella - n. di ottobre,http://www.porschemania.it/discus/messages/10548/844306.html?1542878117,2018-10-24 16:50:00,ric968,Roland ti voglio ben non fraintendermi,Gigi dove l'hai visto Roland.... ? ? ,,,,,,,,,,,,,,
Durata jtd 105 su 156,https://www.autopareri.com/forums/topic/17722-durata-jtd-105-su-156?&page=4#comments,2006-01-11 14:32:09,bialbero,,i motori Fiat sono degli ottimi motori nulla da dire un amico ha percorso con la sua Tempra 1.9 TD circa 380.000 km le uniche cose che cadevano a pezzi erano tutte le plastiche degli arredi interni. ,,,,,,,,,,,,,,
punto abarth 94:che fina ha fatto?,https://www.autopareri.com/forums/topic/22223-punto-abarth-94che-fina-ha-fatto?&page=2#comments,2007-02-19 22:10:34,Regazzoni,,"Credo fosse una cosa semi-ufficiale. Ricordo distintamente una foto di un prototipo che usciva dal classico ""cancello"" Fiat di torino. ",,,,,,,,,,,,,,
Citroën C4 Facelift (Topic Ufficiale - 2008),https://www.autopareri.com/forums/topic/30661-citro%C3%ABn-c4-facelift-topic-ufficiale-2008,2008-07-07 11:04:29,Stefano73,,"o della C5 o anche una evo della bocca della c4 picasso con sto paraurto più ""normale"" l'auto ci guadagna ",,,,,,,,,,,,,,
Cambio 7 Marce,https://www.autopareri.com/forums/topic/11614-cambio-7-marce?&page=2#comments,2005-02-27 11:20:57,Autodelta85,,certo defiant...preferisco molto di + il V8 della Vette C6 a sto V8 asfittico della MB.... E è un motore completamente in alluminio che tiene però fede alle caratteristiche di un propulsore d'oltreoceano di tanti anni fa: -coppioso -con un gorgolio tipico dei motori made in USA -aste e bilancieri lo so che molti storgono il naso davanti alle aste e bilancieri ( giustamente ) ma bisogna anche capire la mentalità americana di mantenere le tradizioni e non buttarle nel cesso come facciamo noi.........stesso discorvo x il V8 HEMI Dodge...le camere emisferiche l'alfa le usava negli anni '50.....ma non hanno ripudiato quella cosa anzi l'hano protata avanti con onore.. E' lo stesso concetto della Ducati che va avanti da ormai 30 anni con un motore a L ancora raffreddato ad aria su certi modelli....insomma è tradizione è marketing ! ! se lo fanno le ucati le porsche non vedo perchè non possono farlo gli americani ,,,,,,,,,,,,,,
Alfa Romeo Giulia 2.2 Turbodiesel 150 CV - Le impressioni degli utenti,https://www.autopareri.com/forums/topic/61392-alfa-romeo-giulia-22-turbodiesel-150-cv-le-impressioni-degli-utenti?&page=8#comments,2016-06-06 17:23:28,Sailor,,Tu ovviamente vai a fare i traversi con una berlina diesel da 150cv vero ? Ma poi dico .. Scrivere in un italiano comprensibile è così difficile ? ( Non dico grammaticamente corretto ma comprensibile ! ! ) Prendetevi un minuto in più per rileggervi quello che avete scritto invece di ( avevo scritto ''defecare'' lo rimetto perchè rende meglio ) testi illeggibili ,,,,,,,,,,,,,,
Porsche Carrera Cup Italia: virtuale con gli eSports chi vince corre in 911 GT3 - HDmotori.it,http://www.hdmotori.it/2019/03/22/porsche-carrera-cup-italia-esports-qualifiche/,2019-03-22 01:20:00,Luigi Melita,,mi sembrava di aver dimenticato qualcosa...ma non ricordavo cosa : ) Aggiunto Assetto Corsa. Thanks,,,,,,,,,,,,,,
Fiat Freemont 2011,https://www.autopareri.com/forums/topic/41568-fiat-freemont-2011?&page=220#comments,2012-02-28 07:29:42,pegasuss,,penso cosi possa funzionare... tu vuoi recuperare piu spazio possibile vero ? comunque basta che provi a ficcarci le due basi isofix... io purtroppo ho scoperto che il mio seggiolino non ha la base isofix dopo che comprata questa macchina sono andato a richiederlo... e non ti dico che incazzatura mi sono preso... mi toccherà prenderne uno da fissare in macchina con la basetta iso da lasciare fisso... altri soldi... ,,,,,,,,,,,,,,
BMW Serie 1 3 Porte 2012 - Prj. F21,https://www.autopareri.com/forums/topic/47311-bmw-serie-1-3-porte-2012-prj-f21?&page=5#comments,2012-05-16 08:25:20,AndreaB,,Esteticamente ridicola..... ,,,,,,,,,,,,,,
usato saab,https://www.bmwpassion.com/forum/threads/usato-saab.47618/,2005-04-07 00:00:00,Phil,,ciao a tuttiun amico ha visto una saab 9-3 di un privato 2.2 tdi 140cv settembre 2 2003 55.000 km ( un po pochini secondo me ma visto che è un privato... ) da tagliandare che potrebbe portarsi a casa con 13000 euro.sapede qualcosa di questa auto ? come prezzo visto i nuovi motori potrebbe anche esserci. come vanno ? grazie milleciao ,,,,,,,,,,,,,,
Ma un 1.4 tjet 100cv?,https://www.autopareri.com/forums/topic/26032-ma-un-14-tjet-100cv,2007-11-15 13:20:21,Danyxx82,,Come ho detto per il motore da 100cv circa le soluzioni sono 2: 1.4 aspirato UNIAIR da 100/105cv e 150Nm di coppia ( questo motore arriverà sulla Junior ) 1.2T da 100/110cv e 150/160Nm di coppia non ci sarà NESSUN 1.4T da 100cv ! ! ,,,,,,,,,,,,,,
BMW Serie 5 - il furto dei navigatori,https://forum.quattroruote.it/threads/bmw-serie-5-il-furto-dei-navigatori.105529/page-4,2017-11-15 00:00:00,Dadao,,non c'è proprio la serratura. inoltre la cosa che non mi è opiaciuta è che rompendo il vetro se si apre dalla maniglia interna la portiera si apre tranquillamente non sfriziona a vuoto. incredibile ,,,,,,,,,,,,,,
Preventivo con prezzo gonfiato?,https://forum.quattroruote.it/threads/preventivo-con-prezzo-gonfiato.111894/,2017-08-21 00:00:00,fiorenzo.n,,"Anche se fosse stato aggiunto qualche centinaia di euro hanno fatto uno sconto quasi del 26% dubito si riesca a chiedere di più su auto nuova è un po' modo di fare di tutte le case ""aggiustare"" i preventivi in modo da far vedere sconti più alti. In ogni caso ormai è tardi per trattare se hai gia dato la caparra e firmato il contratto ! ",,,,,,,,,,,,,,
