Titolo,URL,Timestamp,User,(Testo Citato),TESTO,Costruttore,Modello,Brand,Interni,Esterni,Meccanica,Prestazioni,Consumi/Autonomia,Motore,Elettrico,Fuoristrada,Elettronica di Bordo,Manutenzione,Assistenza/Concessionari
PORSCHE 959,https://forum.quattroruote.it/threads/porsche-959.105828/,2016-08-30 00:00:00,Lukay,'Volevo segnalare questo interessante articol seppur di una rivista concorrente http://www.automobilismo.it/porsche-959-prova-test-auto-25835',Auto eccezionale ! A mio personale parere una vera svolta nel mondo automobilistico al pari della quasi coetanea Lamborghini LM002 ! ,,,,,,,,,,,,,,
Punto 1.3 multijet,https://www.autopareri.com/forums/topic/14697-punto-13-multijet,2005-08-06 01:29:30,etilico,,perchè dovrebbero cambiarlo se resta in produzione solo un anno ? credo che sarà sempre lo stesso ,,,,,,,,,,,,,,
Fiat 124 Spider 2016,https://www.autopareri.com/forums/topic/59843-fiat-124-spider-2016?&page=128#comments,2016-07-04 10:22:32,matbard,,Provata ! ,,,,,,,,,,,,,,
159 provata da un utente medio proveniente da 156,https://www.autopareri.com/forums/topic/17334-159-provata-da-un-utente-medio-proveniente-da-156?&page=3#comments,2005-12-08 18:47:57,bialbero,,dovresti provarla la classe C...non parleresti cosi stanne certo ,,,,,,,,,,,,,,
Parere Grande Punto,https://www.bmwpassion.com/forum/threads/parere-grande-punto.32709/page-6,2006-07-12 00:00:00,fasolini6,"""Domani ho un'appuntamento per provare la C4 2.0 HDi automatica 6m e la 1.6 HDi CMP-6 (robotizzato)""",e questaquestaquestaquestao questa ? ,,,,,,,,,,,,,,
Audi A3 2012,https://www.autopareri.com/forums/topic/46464-audi-a3-2012?&page=20#comments,2012-03-08 14:05:29,Giò,,assolutamente banale mi sembra una banalizzazione del già brutto design delle bmw di bangle. Se alfetta non fosse della fiat ne venderebbero miliardi ,,,,,,,,,,,,,,
Sondaggi e questionari vari sulla mobilità elettrica,https://www.forumelettrico.it/forum/topic5433.html?sid=9b3d6660a00250109c0902db2fb0b90b,2017-04-30 11:47:00,Daniell,,Grazie ad entrambi ! Mi fa piacere Marco era uno dei miei obiettivi.E crepi il lupo ! ,,,,,,,,,,,,,,
Daniele Bandiera e l'Alfa,https://www.autopareri.com/forums/topic/11890-daniele-bandiera-e-lalfa?&page=24#comments,2005-03-17 09:39:07,bialbero,,"ne sono convinto ecco perchè in generale uso il termine ""cala braghe"" ci si adagia senza spirito critico...spero cominceremo a vedere un qualcosa a TP prima o poi il premium essendo un ottimo pianale penso venga utilizzato su più fronti... ",,,,,,,,,,,,,,
Kit Preconsegna,https://www.bmwpassion.com/forum/threads/kit-preconsegna.71896/,2008-04-10 00:00:00,lordDIESEL,,Sul preventivo del 118d da Ceccato Motors ( PD ) oltre al prezzo del 118d 5 porte base 27550€ mi vedo aggiungere ( optional a parte ) IPT 181 00 euroPrestazioni supplementari:Kit Preconsegna 709 euroCosa sarebbe di preciso il kit preconsegna ? Ho chiesto e mi è stato risposto ''trasporto'' se non sbaglio anche l'immatricolazione ? Nonostante tutto mi è stato appllicato uno sconto poco superiore al 12% ,,,,,,,,,,,,,,
range rover 3.0 TD va &#34;in protezione&#34; poi ritorna normale ....???,https://forum.quattroruote.it/threads/range-rover-3-0-td-va-34-in-protezione-34-poi-ritorna-normale.18571/,2009-12-09 00:00:00,nostromo100,,Potrebbe essere la valvola Egr intasta ( visto anche il chilometraggio.. ) . ma solo il tester può dare una risposta definitiva. ,,,,,,,,,,,,,,
Perché 159,https://www.autopareri.com/forums/topic/11695-perch%C3%A9-159?&page=6#comments,2005-03-03 14:27:52,bialbero,,molto di più che con le pezze al sedere...tant'e che dopo alcuni mesi è fallita e mi hanno mandato a casa...e con me la Golf e la 164 TS a gas... ,,,,,,,,,,,,,,
Online il sito dell'ecobonus per auto elettriche,https://www.forumelettrico.it/forum/online-il-sito-dell-ecobonus-t4943-190.html?sid=053f872f8b7b19de0856815c966834f2&sid=053f872f8b7b19de0856815c966834f2,2019-04-10 17:47:00,Paul The Rock,,Comunque che magari con tutte queste richieste di chiarimenti che capiscano che magari serve una comunicazione chiara ? Dubito perché se per loro a livello legale è già chiara così... Ma sperare che ci ripensino è concesso.,,,,,,,,,,,,,,
"OK non è BMW. ma è ""una nonnetta"" anche lei....",https://www.bmwpassion.com/forum/threads/ok-non-%C3%A8-bmw-ma-%C3%A8-una-nonnetta-anche-lei.83852/page-3,2006-02-26 00:00:00,beckervdo,"""Hei...un fratello!!!! Anche io ho una 24 la mia e' del 197 anno ella sicurezza stradale negli US e' una edizione speciale si chiama ANNIVERSAR ha delle taghette oro con la scritt anche sullo sterz specchi elettric claclson bitonal aria condizionat paraurti a stantuff compressore per le sopenzioni posteriori e inverter etc etc....pensa che roba...ha credo 98cv e pesa oltre le 2 tons abbondant ha anche un accessorio che viene denominato tipo sbrina carrozzeria ma non abbiamo mai capito a che serve di preciso......va come un orologi la mia pero' ha il cofano motore e la code della versione cope' americana della 244.....appena torno al garage posto una foto.....interni velluto blu e esterno bianco!""",Allora se non ricordo male una 127 nell'82 costava 4500000 lire sparo 13000000 ? ,,,,,,,,,,,,,,
la batcaverna 635csi &co,https://www.bmwpassion.com/forum/threads/la-batcaverna-635csi-co.85405/page-330,2004-03-25 00:00:00,batmobile,"'x bat...essendo un appassionato audio... soprassiedo sulla fila di tweeter e midrange.....su quella che stai restaurando..però se ero a piedi...la serie 7 era mia....il destino è sempre così... 'se l'avessi messa a gas ti avremmo evirato /emoticons/biggrin@2x.png 2x"" width=""20"" height=""20"" /> 'Esatto a bollone pieno.. La e28 non è mi ma di un cliente.. Un ragazzo con un motorino gli è entrato nella portiera Dx.. La settimana scorsa mi ero messo a fare i montanti e la prima portiera passegger tra oggi e doman minigonne e portiera posteriore.. C'è ancora un pò di lavoro.. /emoticons/biggrin@2x.png 2x"" width=""20"" height=""20"" /> 'Come sta messo?? non starebbe male vicino la sorellina.'","Si può dire: ""CHE FIGATA"" ? ? ",,,,,,,,,,,,,,
Volvo V40 2012,https://www.autopareri.com/forums/topic/46463-volvo-v40-2012?&page=4#comments,2012-02-22 17:11:14,Albertw,,Veder questa mi ha fatto rivalutare di colpo la Delta... ,,,,,,,,,,,,,,
E se cambiassi idea sul nuovo CRV?,https://forum.quattroruote.it/threads/e-se-cambiassi-idea-sul-nuovo-crv.119616/,2018-11-29 00:00:00,albelilly,'MI sa che il dual pump sia stato abbandonato dalla quarta serie in poi (anche se si chiama sempre realtime).',dici ? Non ne sono sicuro in quanto non mi sono più interessato ad ogni modo sempre sistema on demand è. ,,,,,,,,,,,,,,
Grande indecisione,https://forum.quattroruote.it/threads/grande-indecisione.5229/,2009-06-10 00:00:00,fissato,,anch'io all'inizio ero molto indeciso tra freelander e rav ( secondo me i migliori suv in commercio ) alla fine ho preso Rav perchè più compatta ed economica e ne sono molto soddisfatto. ,,,,,,,,,,,,,,
Tolto il velo alla nuova Hyundai i30!!! Anche SW,https://forum.quattroruote.it/threads/tolto-il-velo-alla-nuova-hyundai-i30-anche-sw.55308/page-4,2012-08-13 00:00:00,frank822,,ciao a tutti bella questa sw. Ma qualcuno di voi sa che automatico monti sul diesel ? è a doppia frizione come sulla i40 ? ? sarebbe bello.... ciao ,,,,,,,,,,,,,,
Di due farne una (318ci e46),https://forum.quattroruote.it/threads/di-due-farne-una-318ci-e46.115059/,2018-02-23 00:00:00,arizona77,,"E la parte "" burocratica "" ? ",,,,,,,,,,,,,,
Lancia negli Usa......,https://www.autopareri.com/forums/topic/5905-lancia-negli-usa?&page=2#comments,2004-04-02 11:46:21,Artemis,,"Ti sei confuso Lanciaboxer... blueyes aveva detto Sign non Avatar... E ""quella più lontana"" è esattamente la Lancia Rally 037. Per inciso una beta e una gamma coupè le so distinguere :D ciao ciao ! ",,,,,,,,,,,,,,
Manometro alfa159jtd 120cv,https://forum.quattroruote.it/threads/manometro-alfa159jtd-120cv.120504/,2019-01-27 00:00:00,Dyno14,,Allora può essere il sensore di pressione della turbina da sostituire ,,,,,,,,,,,,,,
Grande Punto 1.2 troppo poco?,https://www.autopareri.com/forums/topic/30498-grande-punto-12-troppo-poco?&page=3#comments,2008-09-19 19:03:03,Dj Ikos,,Ragazzi alla fine ho preso oggi una Grande Punto 1.3 MultiJet 75Cv Dynamic con 21'000Km del 06/2007 al prezzo di 9900€ La ho provata prima di acquistarla al concessionario e la ho trovata ottima un ottimo motore non sprizza potenza ma ottimo soprattutto da i 2000 giri ai 4000 poi quando la prenderò ovviamente vedrò un po' meglio Ringrazio tutti per gli ottimi consigli che mi avete dato ! Grazie mille ! ,,,,,,,,,,,,,,
Sospensioni autolivellanti Subaru Forester 2009 che fare?,https://forum.quattroruote.it/threads/sospensioni-autolivellanti-subaru-forester-2009-che-fare.113182/page-2,2019-02-23 00:00:00,SUBmARine U-14,,Quanto costano originali ? ,,,,,,,,,,,,,,
Online il sito dell'ecobonus per auto elettriche,https://www.forumelettrico.it/forum/online-il-sito-dell-ecobonus-t4943-100.html?sid=053f872f8b7b19de0856815c966834f2&sid=053f872f8b7b19de0856815c966834f2,2019-04-05 16:42:00,Paul The Rock,'premettendo che non voglio la Kona e non tifo Hyunda dico solo che le altre marche si intascano lo sconto IV la Hyundai ora lo restituisce. Aspetto con ansia ID NE nuova ZOE e e-20 ma quando arrivano!?!?!?!?',e-208 in autunno se non erro... le altre due non hanno ancora dato date precise se non erro.,,,,,,,,,,,,,,
Bentley continental gt,https://www.bmwpassion.com/forum/threads/bentley-continental-gt.55370/,2003-05-23 00:00:00,El Nino,"""l'unica cosa che mi lascia perplesso è: ma per tutto quel che cost non potevano fargli un'interno più personalizzato? dentro sembra a metà strada fra una phaeton e un touareg..""",Ciao ragazzi ! Più volte in direzione Parma-Piacenza-Milano e in senso contrario mi capita con una certa frequenza di lasciarmi piacevolmente sorpassare da continental gt e gtc auto dotate di un fascino irresistibile ! L'incredibile fusione di linee classiche amalgamate con i canoni tradizionali sapientemente aggiornati ne fanno un gioiello di autoChe giudizio avete su questa vettura ? Quali altre gran turismo potrebbero essere all'altezza e di conseguenza valide alternative ? Questa vettura può essere fruibile anche da un target giovane ? ,,,,,,,,,,,,,,
Cambio 914,http://www.porschemania.it/discus/messages/634/493694.html?1278677018,2010-06-14 09:54:00,balza,,"Effettivamente non \xe8 molto agevole sedersi ma una volta ""infilati"" ti assicuro che \xe8 un piacere essere alla guida ! in che senso meno complicata della 928 ? ",,,,,,,,,,,,,,
Petizione - Junior VS MiTo,https://www.autopareri.com/forums/topic/27702-petizione-junior-vs-mito?&page=8#comments,2008-03-20 13:07:06,Cool Night,,Penso nessuno pure io se avessero scritto dall'inizio mito invece di Mi.To non ci avrei fatto caso. E sarebbe stato meglio secondo me. ,,,,,,,,,,,,,,
Alfa Romeo 4C 2013,https://www.autopareri.com/forums/topic/56324-alfa-romeo-4c-2013?&page=12#comments,2013-02-12 11:03:58,ricky1750,,"Vabbe' al massimo farselo colorare se ti piace non credo sia un gran problema. eeeehhhh... ancora troppo manca a Ginevra... poi ci sara' la produzione.. poi ci saranno gli spy della versione ""Stradale"" che ci sara' non ci sara' ""e' mio cuggino che conosce il collaudatore e sabato pomeriggio hanno fatto bricolage con l'alettone prestato dai meccanici Ferrrrrrrrrrari"" ",,,,,,,,,,,,,,
Fiat Freemont 2011,https://www.autopareri.com/forums/topic/41568-fiat-freemont-2011?&page=265#comments,2012-05-14 13:18:53,Teknos,,Quindi quando per esempio le province di Como e Varese chiedono le gomme invernali obbligatorie vanno bene anche le M+S ? Io sapevo diversamente...ma sarei contento di essere smentito. Ma a livello di mescola ed efficienza non ci sono dubbi: le invernali sono meglio. ,,,,,,,,,,,,,,
WTCR 2019 - parliamone,https://forum.quattroruote.it/threads/wtcr-2019-parliamone.120339/page-2,2019-03-21 00:00:00,Guastatore1986,'S sono su Facebook.',Almeno l'hai potuta vedere anche tu. ,,,,,,,,,,,,,,
SONDAGGIO: CONCESSIONARI IN - CONCESSIONARI OUT,https://www.bmwpassion.com/forum/threads/sondaggio-concessionari-in-concessionari-out.21503/page-19,2010-02-01 00:00:00,MICHAEL2010,,spam ? ,,,,,,,,,,,,,,
Blue&Me - Blue&Me Nav - Instant Nav (Consigli Utili pag.1),https://www.autopareri.com/forums/topic/29013-blueme-blueme-nav-instant-nav-consigli-utili-pag1?&page=3#comments,2008-07-22 13:01:22,F . P i ë c h,,capisco bene il discorso... è che mi rode non poterlo avere ! ,,,,,,,,,,,,,,
Maranello Village,https://www.autopareri.com/forums/topic/20690-maranello-village,2006-11-25 10:44:43,EC2277,,Preferirei vivere sotto un ponte. ,,,,,,,,,,,,,,
FPT - 2.0 MultiJet (Riassunto a Pag.1),https://www.autopareri.com/forums/topic/27178-fpt-20-multijet-riassunto-a-pag1?&page=2#comments,2008-02-12 19:03:13,jeby,,tempistica ? ,,,,,,,,,,,,,,
Mazda 3 Sedan 2013 (Foto Ufficiali - Not For Italy),https://www.autopareri.com/forums/topic/52156-mazda-3-sedan-2013-foto-ufficiali-not-for-italy?&page=7#comments,2013-07-05 10:03:17,Teknos,,Si confermo che è davvero molto piacevole e anche meglio della ( già bella ) hacthback unica paura le dimensioni...speriamo rimanga entro i 460cm. - - - - - - - - - - AGGIUNTA al messaggio già esistente - - - - - - - - - - ,,,,,,,,,,,,,,
New Audi A2: arriva nel 2008,https://www.bmwpassion.com/forum/threads/new-audi-a2-arriva-nel-2008.22367/,2005-12-27 00:00:00,alelocate,,"[da www.quattroruote.it] ( 10/03/2006 ) Dopo le numerose indiscrezioni l'Audi ha annunciato che nel 2008 verrà presentata l'erede della ""A2"" una nuova vettura che avrà però caratteristiche totalmente differenti rispetto a quelle del modello d'origine. ""Non possiamo ancora anticipare nulla di preciso - ha spiegato il presidente Martin Winterkorn - ma è chiaro che nella nostra gamma troveremo spazio per una vettura che vada a posizionarsi sotto la 'A3'. L'obiettivo è contrastare un modello di successo come la Mini"". La prossima ""A2"" dovrebbe basarsi sul pianale della Volkswagen ""Polo"" e potrebbe assomigliare molto alla concept car ""Shooting Brake"" esposta all'ultimo Salone di Tokyo. ""Darà più emozioni e sarà più sportiveggiante"" ha concluso Winterkorn. La produzione della ""A2"" iniziata nel 2000 è terminata a metà del 2005 e dopo il picco di oltre 50.000 unità vendute in Europa occidentale nel 2001 le consegne sono man mano diminuite fino a circa 22 mila nel 2004. ",,,,,,,,,,,,,,
sconti e cerchi,https://www.autopareri.com/forums/topic/22003-sconti-e-cerchi,2007-02-09 11:16:34,INTERNO ROSSO,,ho saputo che è un circuito chiuso lancia 11-12% è lo sconto agenti. ,,,,,,,,,,,,,,
Dubbio protezioni in acciaio legato,http://www.porschemania.it/discus/messages/22971/750769.html?1442474005,2015-09-12 13:43:00,milans,,"I vari SUV coreani e giapponesi hanno la ""protezione"" in plastica compresi nel prezzo. Sul nero e blu scuro stanno bene. Al primo momento avevo prenotato il Macan nero con le protezioni. Resomene conto che di protezione non avevano nulla cambiando il colore per Agata ho eliminato anche le protezioni. Sono descritte male in modo non corretto dalla P.",,,,,,,,,,,,,,
Fiat Doblò Malibu,https://www.autopareri.com/forums/topic/21652-fiat-dobl%C3%B2-malibu,2007-01-19 18:43:05,Touareg 2.5,,... Sembra un tuning aftermarket malriuscito ,,,,,,,,,,,,,,
Prova in pista di 4R,https://www.autopareri.com/forums/topic/10483-prova-in-pista-di-4r?&page=4#comments,2004-12-23 08:23:06,350z,,su 4r ,,,,,,,,,,,,,,
CHEVROLET CRUZE che ne dite?,https://forum.quattroruote.it/threads/chevrolet-cruze-che-ne-dite.2101/page-14,2010-02-18 00:00:00,Ligos,"mauros979 ha scritto: Ragazz ma che prefi pessimi. Ho letto un utente che diceva tempo fa che una macchina era stata valutata ottima e si fermava 2 metri prima della Cruze. Se 2 metri in più posso far parlare di pessimi fren non sapre fatto sta che la mia frena e anche bene Senza contare che ci sarebbe tanto altro da dire sull'argoment del tipo ""se mantengo la distanza di sicurezza non corro rischi oppure ""la maggior parte delle volte con i freni si rallent in casi molto molto molto remoti cè la necessità di inchiodare la maccina ecc... Comunqu fidatev se ne guidate una e provate a frenar tutto vi sembrerà tranne che potrebbe avere freni lunghi ... Non voglio fare il polemic ma 2 metri sono tantissimi. Possono equivalere a mettere sotto una persona o no. A parte questo fatt queta cruze mi piace un sacco. Aspetto di vedere i prezzi della diesel 120 cv e poi faccio un salto in concessionaria.... Non voglio fare il polemico neanche io. Mi piacerebbe saper per a che velocità va la macchina quando si misura la frenata? Perch se la velocità è di 90-120 k dubito che 2 metri in più possano ""evitare di investire"" una person perch o la persona in questione sta attraversando in curv a pied una corsia di autostrad oppure l'autista percorre a velocità folli una zona abitata. In entrambi i casi la macchina non ha responsabilità. Se invece i 2 metri sono misurati inchiodando la macchina ad una velocità di 50 k allora la faccenda cambia. Bada bene per so anche io che è meglio frenare 2 metri prima che 2 metri dopo. Quello che voglio dire è semplicemente che non trovo questo fattor nella valutazione complessiva della vettur come un elemento tanto ""grave/importante"" da farci un titolo di un articolo che descrive questa vettura. ' mauros979 ha scritto: Ragazz ma che prefi pessimi. Ho letto un utente che diceva tempo fa che una macchina era stata valutata ottima e si fermava 2 metri prima della Cruze. Se 2 metri in più posso far parlare di pessimi fren non sapre fatto sta che la mia frena e anche bene Senza contare che ci sarebbe tanto altro da dire sull'argoment del tipo ""se mantengo la distanza di sicurezza non corro rischi oppure ""la maggior parte delle volte con i freni si rallent in casi molto molto molto remoti cè la necessità di inchiodare la maccina ecc... Comunqu fidatev se ne guidate una e provate a frenar tutto vi sembrerà tranne che potrebbe avere freni lunghi ... Non voglio fare il polemic ma 2 metri sono tantissimi. Possono equivalere a mettere sotto una persona o no. A parte questo fatt queta cruze mi piace un sacco. Aspetto di vedere i prezzi della diesel 120 cv e poi faccio un salto in concessionaria. 'Ragazz ma che prefi pessimi. Ho letto un utente che diceva tempo fa che una macchina era stata valutata ottima e si fermava 2 metri prima della Cruze. Se 2 metri in più posso far parlare di pessimi fren non sapre fatto sta che la mia frena e anche bene Senza contare che ci sarebbe tanto altro da dire sull'argoment del tipo ""se mantengo la distanza di sicurezza non corro rischi oppure ""la maggior parte delle volte con i freni si rallent in casi molto molto molto remoti cè la necessità di inchiodare la maccina ecc... Comunqu fidatev se ne guidate una e provate a frenar tutto vi sembrerà tranne che potrebbe avere freni lunghi '",ma neanche io. Però due metri sono e restano tanti. Altrimenti ance io posso dire che l'esp non serve a una cippa visto che in 15 anni di patente non ne ho mai sentito il bisogno. ,,,,,,,,,,,,,,
Volvo XC90 2015,https://www.autopareri.com/forums/topic/55370-volvo-xc90-2015?&page=19#comments,2014-08-30 09:32:00,FaGiO,,STUPENDA. ( e io odio i SUV ) . ,,,,,,,,,,,,,,
50° ANNO DELLA CARRERA,http://www.porschemania.it/discus/messages/10550/124562.html?1128443837,2005-09-28 14:23:00,peterdrive,,Per chi vuole venire ( per partecipare troppo tardi ) la base del Raduno e all'Hotel Europa 3 Km. da Colmar: vedi sito di Beppe. Da Milano circa 500 Km.,,,,,,,,,,,,,,
Mondiale F.1 2019 - GP della Cina,https://forum.quattroruote.it/threads/mondiale-f-1-2019-gp-della-cina.122057/page-10,2019-04-14 00:00:00,pilota54,"""Vettel lo ha detto via radio da onboard ! E Pilota ha poi parlato di mappa 5 o forse quindi la scelta conservativa c'è stata. Non lo dico io. Per m andava fatta su una sola macchina e all'altra gli si dava il 100% per la pole. Ma oramai le scelte sono sempre pluri e mai sul singolo. Solo Wolff può permettersi di farlo: guardate il pit in sincrono con lo stesso med. gruppo""","Vettel nel Q3 ha detto una frase ambigua ( ""Ce l'avevamo sappiamo perchè l'abbiamo persa"" ) che è stata ""interpretata"" da alcuni media ma non chiarita dal pilota stesso. Anche la mappatura un gradino sotto il max. era una illazione sulla scorta della sua frase. Ma alla luce della gara il suo team radio ""evapora"" come acqua bollita.......... ",,,,,,,,,,,,,,
Ai 200mila km la catena?,https://forum.quattroruote.it/threads/ai-200mila-km-la-catena.98221/,2015-08-21 00:00:00,alexmed,,Che dite ? Mi manca poco più di mille km ad arrivare ai 200mila sulla ClasseA W168 A190 benzina. Penso che farò sostituire i dischi e pastiglie freni controllare perché da un po' non riesco più a fare il pieno ( mi si ferma quando manca un quarto ) cambiare la cinghia servizi. Il mio dubbio poi è... sostituire la catena e tendicatena ? Oppure si controlla ? Non si tocca mai ? Cosa mi suggerite ? L'auto è del 1999. ,,,,,,,,,,,,,,
Scelta Musa usata ma che motorizzazione?,https://forum.quattroruote.it/threads/scelta-musa-usata-ma-che-motorizzazione.109227/,2017-03-08 00:00:00,pi_greco,'Cosa intendi? che assetto ha?',estremamente confortevole in città ma non per prendere in scioltezza rotatorie e curve tantomeno per cercare di uscire di curva con trazione... in città la adoro tra le colline andando piano idem alla prima curva con un po' di brio mi ricorda che è una punto con carrozzeria alta... niente di male ma cercare prestazioni su quel mezzo è inopportuno... IMHO... ,,,,,,,,,,,,,,
Mondiale F.1 - GP dell'Azerbaijan,https://forum.quattroruote.it/threads/mondiale-f-1-gp-dellazerbaijan.116225/page-12,2018-04-30 00:00:00,mani in alto,,Alonso non so come abbia fatto a tornare ai box con sole due ruote da una parte la macchina é tutta appoggiata sul fondo ed é quasi impossibile da direzionare. Se poi si aggiunge che per quanto andasse piano stava comunque oltre i 100 si capisce bene di che pasta é fatto credo che nessun altro lo farebbe. ,,,,,,,,,,,,,,
Consigli per sportiva usata,https://forum.quattroruote.it/threads/consigli-per-sportiva-usata.111976/,2017-08-27 00:00:00,Mastertanto,""".... però non ho mai capito la così tanta mancanza di fiducia verso i privati visto che comunque dal salonista/concessionario l'auto sempre da un privato proviene e che quindi può manifestare dopo un po' dall'acquisto gli stessi problem e grazie del discorso garanzia che mi hai fatto perchè non ne sapevo nulla.""",Dal rivenditore l'auto non sempre proviene da un privato può anche essere di una società. Quanto alla mancanza di fiducia verso i privati beh per capire la cosa forse bisognerebbe chiedere ai sociologhi..... La mia idea è che si tratti di una certa ingenuità da parte di chi onesto pensa che tutti facciano onestamente il proprio lavoro : cosa che - nonostante tutto - vale per la maggior parte ma non proprio per tutti..... E' difficile sostenere che siano del tutto onesti una parte almeno dei vari rivenditori / salonisti nonché i venditori di questi ri-venditori che sono addestrati a mentire parzialmente alla clientela sottolineando i controlli tecnici a loro dire eseguiti ( una sfilza e come no ? ) e la conseguente garanzia : che viene presentata non già come un obbligo di legge quale è ma come il risultato appunto di questi controlli. Neppure si trattasse di auto nuove..... Sfruttano insomma la diffusa ingenuità esistente verso il diritto : pensa solo a questo riguardo che la Apple la prestigiosa e ricchissima Apple pur con i prezzi molto pesanti che pratica fino a ieri si rifiutava di riconoscere la garanzia di legge di 2 anni chiedendo un pagamento per l'estensione al 2° anno : e la gente pagava...... . ,,,,,,,,,,,,,,
Chi ha fatto tantissimi KM con le proprie Renault?,https://forum.quattroruote.it/threads/chi-ha-fatto-tantissimi-km-con-le-proprie-renault.3119/page-16,2018-04-23 00:00:00,viccio76,,Modus 1.5 dCi Saint Tropez di fine 2006 ho da poco scavallato i 200.000 Km a parte la frizione a 170.000 Km circa non mi ha mai dato problemi ma fra pochi mesi arriva la nuova Scenic e la mia povera Modus temo verrà rottamata :' ( . ,,,,,,,,,,,,,,
Strano rumore alla PCM,http://www.porschemania.it/discus/messages/22971/370382.html?1207772980,2008-04-07 18:22:00,ferry2k,,Grazie Diego quindi il mio \xe8 un PCM2 con cd integrato ? domanda ho letto nel forum che \xe8 possibile montare un multimedia per gestire la PCM con TV DVD IPOD ecc... qualcuno ne sa di piu ? ,,,,,,,,,,,,,,
Curiosità:fino a che data é prevista la produzione di Lybra?,https://www.autopareri.com/forums/topic/3771-curiosit%C3%A0fino-a-che-data-%C3%A9-prevista-la-produzione-di-lybra?&page=3#comments,2003-12-24 12:41:18,fabvio,,ma guarda..... io sono il primo a dire che su lybra un certo mistero esiste... o meglio sulle medie lancia + in generale forse eri assente .... ma per tre o quattro giorni io ho spremuto taurus per tirargli fuori qualcosa.... secondo lui la versione è sempre la stessa...... ossia che la lybra sarà sostituita il 11/2005 con una large lancia a 2 volumi sullo stile della granturismo carcerano... anche se a dirti il vero l'impressione che mi ha dato e che lui certe notizie su lancia non ne ha proprio comunque se mi conoscessi sapresti bene che io parlo sempre per arrivare al sodo evitando chiacchiericcio..... non è tanto un discorso di offendere..... quanto di fornire ai forumisti indicazioni precise sulla serietà o meno di chi si professa super informato e poi và incontro a gaffe pazzesche..... secondo frik ad esempio alla fine del 2005 non è solo la lybra a finire..... ma sarebbe tutta la lancia ad essere cancellata ! ! ! ! spero tu mi abbia compreso ,,,,,,,,,,,,,,
