Titolo,URL,Timestamp,User,(Testo Citato),TESTO,Costruttore,Modello,Brand,Interni,Esterni,Meccanica,Prestazioni,Consumi/Autonomia,Motore,Elettrico,Fuoristrada,Elettronica di Bordo,Manutenzione,Assistenza/Concessionari
Antidoto contro una puntura di scorpione...,https://www.autopareri.com/forums/topic/53832-antidoto-contro-una-puntura-di-scorpione?&page=11#comments,2014-01-04 18:26:51,TonyH,,"al primo giro avevo letto ""GimmoCupio"".... ",,,,,,,,,,,,,,
Conviene acquistare Giulietta?,https://forum.quattroruote.it/threads/conviene-acquistare-giulietta.118658/,2018-09-30 00:00:00,?angelo0,'Ma la B-tech é già uscita? Se si quanto costa più o meno?',In Germania parte da 26500€ con il look della veloce incluso cio che ho scritto sopra. Ma fino a marzo ci saranno le km 0 quindi puoi farti un po i Conti di quanto ti possa costare piu di oggi… Tradotto: Anche la compatta Alfa Romeo Giulietta si presenta come un modello speciale B-Tech. Rotolano su cerchi in lega da 18 pollici e hanno come gli altri due dettagli della carrozzeria in nero anche un interno nero e vetri oscurati nella parte posteriore. Il sistema di infotainment Alpine ha DAB e Bluetooth e può anche integrare lo smartphone tramite Apple CarPlay e Android Auto. Una equipaggiata con pacchetto Veloce e infotainment Giulietta Super con costi di 120 hp secondo la lista 27.250 euro l'edizione speciale B-Tech è disponibile da 26.500 euro. ,,,,,,,,,,,,,,
Chevrolet Captiva (Topic Ufficiale - 2005),https://www.autopareri.com/forums/topic/17048-chevrolet-captiva-topic-ufficiale-2005,2006-01-15 18:46:49,Touareg 2.5,,Il grigrio non le dona ! ,,,,,,,,,,,,,,
X3 F25 lati positivi lati negativi pregi e difetti,https://forum.quattroruote.it/threads/x3-f25-lati-positivi-lati-negativi-pregi-e-difetti.114778/,2018-02-09 00:00:00,zeusbimba,,Forse hai sbagliato con il cerchio differenziato allora.... ,,,,,,,,,,,,,,
"Il ""Club dei 4000""",http://www.porschemania.it/discus/messages/815/228071.html?1406838340,2007-02-12 15:51:00,ciccetto61,,"Tony il punto che tu chiami ""Munnizza"" lo conosco gi\xe0 in quanto vado praticamente sempre l\xe0. Posteggio l'auto a Valderice e poi proseguo a piedi fino al punto da te descrito. Tuttavia ricordo che una volta ( mio padre quell'anno correva con una Porsche rsr ) una amica di Alcamo mi diede un passaggio e attraverso una stradina riuscimmo praticamente ad arrivare quasi all'arrivo. Sono passati almeno 25 anni e onestamente non ricordo pi\xf9 quella scorciatoia. Vorr\xe0 dire che riandr\xf2 alla ""Munnizza"" anche perch\xe8 onestamente il punto di vista non \xe8 davvero male. Naturalmente andr\xf2 con l'utilitaria ( ford focus ) .Ciao e grazie.",,,,,,,,,,,,,,
Suzuki jimny 2018,https://forum.quattroruote.it/threads/suzuki-jimny-2018.112081/page-7,2018-06-19 00:00:00,A-80,"""Se guardi megli tutte le nervature della fiancata e le sporgenze sono quelle del Samura così come il gocciolatoio (che era scomparso nel Jimny parabrezza piatto e di ridotte dimension calandra non verniciata che ingloba i far cofano a coperchio che comprende i parafanghi (nella G sono esterni al cofano) e potrei continuare.... L'unico punto in comune con la G sono forse i passaruota con bordo superiore orizzontale anzichè a raggio costante. Quasi nulla in comun invec con il Jimny serie precedent un pò come se si volesse dimenticarlo. Dalle fot io preferisco di gran lunga il Jimny che sta uscendo di scena. Ci vorrà un bel pò per cambiare opinione e attendo di vederlo dal vivo. Questo mi pare esteticamente un grande passo indietro.""",Quoto tutto tranne che rinneghino l attuale. Qui è stato un gran successo e nei posti giusti da me per esempio è quotatissima e richiesta ,,,,,,,,,,,,,,
Renault Captur 2013,https://www.autopareri.com/forums/topic/53994-renault-captur-2013?&page=162#comments,2013-12-05 15:03:31,merlino08,,ciao visto che anche tu hai il medianav sei riuscito ad aggiornare le mappe ? ,,,,,,,,,,,,,,
Volkswagen Up! 2011,https://www.autopareri.com/forums/topic/44234-volkswagen-up-2011?&page=51#comments,2012-01-13 13:06:37,Cosimo,,un mio conoscente aveva una 500 sporting da 80 e passa cavalli.. non ci stavi dietro ma era una vera bara. Che versione era ? ,,,,,,,,,,,,,,
tagliando mazda 6sw,https://forum.quattroruote.it/threads/tagliando-mazda-6sw.58852/,2011-11-30 00:00:00,arizona77,,ma non hai il libretto ? Comunque l' olio e' il costo piu' elevato della manutenzione ordinaria ,,,,,,,,,,,,,,
Alfa Romeo Giulietta (Topic Ufficiale - 2009),https://www.autopareri.com/forums/topic/36127-alfa-romeo-giulietta-topic-ufficiale-2009?&page=719#comments,2010-05-09 19:43:37,Teknos,,Vabbè qui si parlava di Rosso Alfa... quegl'amaranti hanno un altro effetto... ,,,,,,,,,,,,,,
Consumi reali Volvo V40 con nuovo motore D4 da 190 cv,https://forum.quattroruote.it/threads/consumi-reali-volvo-v40-con-nuovo-motore-d4-da-190-cv.90181/,2014-10-09 00:00:00,albo89,'Ho letto una prova in inglese in cui dicono che la percorrenza di 21 a litro è realistica per la 190 cv....non sarebbe male!',considera anche che magari il giorno che te la trovi sotto al sedere... 190cv.. non andrai sempre a filo di gas per fare i 17/19.. o meglio: se hai l'autocontrollo per farlo ben venga per te ! io anche potrei fare i 17/18 con la giulietta ( 2.0 jtdm 170cv ) ma nella realta non mi schiodo dai 14... troppo facile farsi tirare dal pedale destro in ogni caso se la prendi gran macchina.. motore d4 e kit R design.. e' la macchina che vorrei se avessi da sostituirla ora ,,,,,,,,,,,,,,
Nuova prova Brera 3.2 JTS,https://www.bmwpassion.com/forum/threads/nuova-prova-brera-3-2-jts.28691/page-2,2004-07-13 00:00:00,Vegeta330,""" nn posso nn quotarti.. l'alfista sfanalatore preferisce d gran lunga un + scarno gtv v6 tb... resta il fatto ke esteticamente la brera è da urlo..imho""",Si il posteriore è da urloMA QUANTO CAXXO E' GROSSO ? ! ,,,,,,,,,,,,,,
Mitica Thema 8.32,https://www.bmwpassion.com/forum/threads/mitica-thema-8-32.10762/,2007-04-30 00:00:00,salex,,Per gli appassionati ho trovato una chicca sulla Thema 8.32 Mi serve anche come test per provare la bontà ( banda disponibilità ) di questo Host-ProviderThema 8.32 ,,,,,,,,,,,,,,
UN ADDIO.... o meglio spero un arrivederci,http://www.porschemania.it/discus/messages/634/252779.html?1178099631,2007-04-30 22:56:00,spike,,Guarda che noi siamo sempre qui ! Se ti si pole aiutare lo si f\xe0 volentieri ! E anche se nn hai pi\xf9 una porz. vale lo spirito no ? ! ,,,,,,,,,,,,,,
Affidabilità mazda,https://forum.quattroruote.it/threads/affidabilit%C3%A0-mazda.3566/page-2,2009-05-26 00:00:00,dpicone256,,motore 143 cv ,,,,,,,,,,,,,,
Finalmente le foto gt3 giuseppe....,http://www.porschemania.it/discus/messages/492693/573770.html?1312457381,2011-08-02 22:34:00,fabio_986,probabilmente mai pista,"e dov'\xe8 la novit\xe0 TUTTE le GT3 sono ""mai pista""",,,,,,,,,,,,,,
Comprare Dacia: realmente vantaggioso?,https://forum.quattroruote.it/threads/comprare-dacia-realmente-vantaggioso.75286/page-5,2013-07-11 00:00:00,SkyYeti,"""E questo rende più sicura l'aut o tu al suo interno? Non credo.""","Sono contento di ciò che ho comprato e di quanto ho risparmiato ( Fra sconto e altro ) . Sicuramente il concessionario ha fatto il suo guadagno vendendomi la macchina e probabilmente per farmi quel prezzo che mi ha fatto ci stava molto dentro . Da una parte ha goduto il cliente risparmiando 6500 Euro ( e poi ti dico che sono quasi 7500 euro ) e sicuramente ha guadagnato anche lui . Su questo non ci piove. Ci abbiamo guadagnato entrambi e alla fine è il risultato che conta. Sicuramente non sono neanche carino e coccoloso ( meno male ) se no probabilmente con un ammicco mi portavo a casa una Evoque. ... Chissà .. potrei provarci. 8 ) Tornando ad un fattore più terra terra :"" Ma se vi mettono un Duster a 21.500 Euro e uno Yeti a 23.000 Euro con più sicurezze dimostrabili entrambi immacolati nel chilometraggio ( ovvero 0 e per di più da targare ) o altra auto 4x4 a 1.500 euro di più del vostro Duster .. voi continuereste a comprare Dacia ? No ma la legna si porta assai bene e non rimpiange il vecchio fiorino ",,,,,,,,,,,,,,
Mitsubishi ASX 1.6 benzina,https://forum.quattroruote.it/threads/mitsubishi-asx-1-6-benzina.40417/,2010-12-28 00:00:00,mark_nm,,sono andato anch'io a vederla e non ne sono ancora convinto. Ho notato la poca visibilità in generale rispetto alla mia multipla che invece offre ampie vetrate da ogni lato. Pensavo che sul percorso auostradale facesse motlo di più abituato io a 18/20 km litro. Comunque continuo a leggervi non si sa mai che possa cambiare idea. ,,,,,,,,,,,,,,
pubblicità in tv 159,https://www.autopareri.com/forums/topic/15493-pubblicit%C3%A0-in-tv-159?&page=7#comments,2005-09-19 20:47:05,Bracco,,Una BMW ? ,,,,,,,,,,,,,,
Il punto sulla situazione Alfa romeo,https://www.autopareri.com/forums/topic/22169-il-punto-sulla-situazione-alfa-romeo?&page=5#comments,2007-02-17 09:53:36,il FUSI,,Ma per favore........... il suono della 164 FL è migliore solo al suono OSCENO e PERNACCHIOSO della 164 TS prima serie che pareva avere il sound di una Fiat 124. Il vero SOUND del TS ce l'ha solo la 75. ,,,,,,,,,,,,,,
E' utile l'ESP? A cosa serve l'ESP? Come funziona l'ESP? - VIDEO nel 1° messaggio,https://www.autopareri.com/forums/topic/25565-e-utile-lesp-a-cosa-serve-lesp-come-funziona-lesp-video-nel-1%C2%B0-messaggio?&page=21#comments,2009-05-20 16:21:35,TonyH,,Bisognerebbe prendere anche in considerazione gli incidenti a veicolo isolato per vedere l'incidenza o meno di un dispositivo quale l'ESP Perchè prendere tutti i morti non ha senso. Che finalità statistica ha considerare anche chi è morto in moto-bicicletta-a piedi ? ,,,,,,,,,,,,,,
Connected Drive Services: (quando) si pagano?,https://forum.quattroruote.it/threads/connected-drive-services-quando-si-pagano.118825/,2018-10-15 00:00:00,Cometa Rossa,,Quando ho preso la mia 3er ( l'anno scorso ) mi hanno detto che i primi tre anni sono gratuiti poi si pagano 600 per ulteriori 3 anni di servizio ,,,,,,,,,,,,,,
Fiat Bravo (Topic Ufficiale - 2007),https://www.autopareri.com/forums/topic/23380-fiat-bravo-topic-ufficiale-2007?&page=110#comments,2007-09-19 10:06:50,scorpioncino,,No purtroppo non ancora consegna prevista nei primi 10 giorni di ottobre ,,,,,,,,,,,,,,
Porsche 911 RSR: un prototipo anticipa il passaggio al motore turbo | RUMOR - HDmotori.it,http://www.hdmotori.it/2018/09/20/porsche-911-rsr-2019-turbo-wec-le-mans/,2018-09-20 01:51:00,makeka94,,Si vabbè ma vuoi mettere con i 90cavalli della mie fiesta td ? ,,,,,,,,,,,,,,
Seat Leon ST 2.0 Tdi 150cv 4Drive Xperience 2017 restyling,https://forum.quattroruote.it/threads/seat-leon-st-2-0-tdi-150cv-4drive-xperience-2017-restyling.116102/page-2,2018-08-21 00:00:00,F1lippo,,quando avevo la Leon 150 diesel superati i 35.000 km mi si è presentato lo stesso tuo problema un mese prima di darla via in permuta per la Cupra. Si accendeva il simbolo della spirale quando il motore superava i 3.200/3.500 giri mandando in protezione il motore. Spegnevo e riaccendevo il quadro e il problema spariva per un paio di giorni. Ho provato a farla vedere al mio meccanico ma non ho risolto nulla. ,,,,,,,,,,,,,,
Mercato Europa 04/07,https://www.bmwpassion.com/forum/threads/mercato-europa-04-07.41710/,2007-03-21 00:00:00,mik320d,,Mercato in calo del 0.6%.Tonfo clamoroso della Hyundai boom continuo della Dacia che sale per la prima volta al 22° posto. Con una gamma di due modelli va ad insidiare la Chevrolet.Audi ha superato la BMW Total Europe ( EU + EFTA Countries ) All brands 1.291.634 -0 61. Volkswagen 136.345 -1 82. Renault 107.965 -12 73. Opel/Vauxhall 105.134 -4 04. Ford 99.165 +1 85. Peugeot 95.726 +4 26. Fiat 84.003 +10 77. Citroen 76.316 -1 88. Toyota 72.488 +1 89. Mercedes 57.580 -1 3 10. Audi 57.124 +7 811. Bmw 52.041 -1 312. Skoda 39.099 +3 613. Seat 29.064 -10 814. Nissan 25.474 -11 115. Honda 25.404 +12 916. Suzuki 22.482 +6 217. Volvo 22.012 +9 118. Hyundai 21.791 -20 519. Mazda 17.739 -8 520. Kia 16.917 -0 321. Chevrolet 15.518 -8 122. Dacia 13.250 +13 0 ,,,,,,,,,,,,,,
Jaguar I-Pace in panne con spia di guasto alla batteria,https://www.forumelettrico.it/forum/topic4990.html?sid=9b3d6660a00250109c0902db2fb0b90b,2019-03-06 19:05:00,Deen,,Ottima assistenza immagino che saranno curiosi anche loro di sapere cos’è successo investigheranno come si deve... ,,,,,,,,,,,,,,
Museo Alfa Romeo: finalmente il TAR ha respinto il vergognoso ricorso contro il vincolo.,https://forum.quattroruote.it/threads/museo-alfa-romeo-finalmente-il-tar-ha-respinto-il-vergognoso-ricorso-contro-il-vincolo.49441/page-118,2012-02-28 00:00:00,Maxetto,"' valvonauta_distratto ha scritto: Ringraziano nuovamente Giampi per il notevole numero di notizie continuo a dire che l'unica soluzione è togliere la caramella al bambino capriccioso... il museo deve essere affidato al ministero dei beni culturali che lo gestirà insieme alla regione lombardia. La fiat non ci starà nemmeno pensando al museo. Ha la panda.... Ummm .. io starei un pò attento a dire queste cos sul Museo. Proviamo a guardare tutta la faccenda dal punto di vista USA: è lì che M ha intenzione di rilanciare AlfaRome perchè c'è ancora radicato nel Dna il gusto di avere sotto al cofano un motore ""grande"" e magari montato su un'auto europe che da sempre sono apprezzatissime. Anche Honda si è praticamente sganciata dall'Europ mantenendo il minimo indispensabile (rispetto la gamma degli anni '80-'90) e proiettando sul mercato americano tutta la sua migliore attuale produzione. Il Muse una volta rilanciato il prodotto AR oltreOcean potrebbe tornare molto utile all'Azienda .. e mi fermo qu visto che la riga successiva farebbe davvero male a parecchi. Spero solo di sbagliarmi alla grandissima ""Ringraziano nuovamente Giampi per il notevole numero di notizie continuo a dire che l'unica soluzione è togliere la caramella al bambino capriccioso... il museo deve essere affidato al ministero dei beni culturali che lo gestirà insieme alla regione lombardia. La fiat non ci starà nemmeno pensando al museo. Ha la panda.""",Provo a continuare il tuo rigo ? Il museo si trasferisce in USA. Beh si potrebbero conciliare la visita al museo e agli States. :lol: ,,,,,,,,,,,,,,
il range rover e il range rover evoque sono lo stesso modello?,https://forum.quattroruote.it/threads/il-range-rover-e-il-range-rover-evoque-sono-lo-stesso-modello.91393/,2014-10-12 00:00:00,fulcrum2500,,quindi in definitiva è lo stesso modello si o no ? ,,,,,,,,,,,,,,
Ford al Salone di Ginevra 2008,https://www.autopareri.com/forums/topic/27567-ford-al-salone-di-ginevra-2008,2008-03-04 20:48:39,j,,da OmniAuto.it Le novità del Salone: Ford Fiesta Ford Focus CC Ford Mondeo S-Max &amp Galaxy 2.2 TDCi Titanium S ,,,,,,,,,,,,,,
Nuova Kia Rio 2011,https://forum.quattroruote.it/threads/nuova-kia-rio-2011.53302/page-58,2012-02-17 00:00:00,Guidarepilotare,,Ciao.. Commentino del venerdì sera ! Certo che di compatte con quattro freni a disco in giro se ne vedono poche ! ! ! Sapere che la Nostra Rio è una di quelle fa davvero piacere ! ! ! ,,,,,,,,,,,,,,
Museo Alfa Romeo: finalmente il TAR ha respinto il vergognoso ricorso contro il vincolo.,https://forum.quattroruote.it/threads/museo-alfa-romeo-finalmente-il-tar-ha-respinto-il-vergognoso-ricorso-contro-il-vincolo.49441/page-49,2011-09-19 00:00:00,giampi47,,Ed ancora Attached files /attachments/1109469=5566-FOTO 10 -La GIULIA TZ-1- su 4R Speciale del 1963 ma non ancora definitiva.JPG /attachments/1109469=5565-FOTO 11 -ALFA Giulia 1600 TZ-1 di serie mod.definitivo-anno 1963-64.JPG /attachments/1109469=5567-FOTO 7 - In attesa versione definitiva Giulia TZ-1 -Foto 2.JPG ,,,,,,,,,,,,,,
Problema finanziamento Ford Focus ST-Line,https://forum.quattroruote.it/threads/problema-finanziamento-ford-focus-st-line.122131/,2019-04-17 00:00:00,ludo7881,,"Generalmente nei contratti che prevedono un finanziamento c'è la dicitura ""salvo buon esito richiesta di finanziamento"". Per cui credo che riavrai il tuo anticipo. Detto ciò mi auguro tu non abbia ordinato la vettura con accessori strani perché adesso il concessionario se la ritroverà ( per sua colpa ) sul groppone. ",,,,,,,,,,,,,,
Fiat Tipo 2016,https://www.autopareri.com/forums/topic/58449-fiat-tipo-2016?&page=304#comments,2016-10-29 18:03:20,AlessioAlfa,,Temo di non aver capito la tua risposta ,,,,,,,,,,,,,,
Scénic XMod - Topic Ufficiale,https://forum.quattroruote.it/threads/sc%C3%A9nic-xmod-topic-ufficiale.14456/page-270,2011-01-14 00:00:00,TEXI,,8 gennaio 2011 Nel corso del 2011 verranno presentati i restyling di Twingo Koléos e Scénic. Tutte in comune avranno un nuovo frontale ispirato a quello del prototipo DeZir. ecco le foto http://www.alvolante.it/news/renault_restyling_twingo_scenic-387161044 ,,,,,,,,,,,,,,
Brabus Bullit V12 biturbo 720CV,https://www.bmwpassion.com/forum/threads/brabus-bullit-v12-biturbo-720cv.48890/,2007-02-19 00:00:00,luigi83,,The Ultimate Wolf in Sheep’s Clothing with V12 Biturbo Engine 730 PS ( 720 hp ) / 537 kW 1 320 Nm ( 974 lb-ft ) of Torque and a Top Speed of More than 360 km/h ( 224 mph ) Over the past three decades BRABUS has perfected the art of transplanting large and extremely powerful engines into the bodies of small cars. That path led to numerous world records and entries into the Guinness Book of World Records. The BRABUS BULLIT built in small-series production based on the new Mercedes C-Class sedan celebrates its world debut at the IAA 2007 as the ultimate wolf in sheep’s clothing.At the heart of this supercar BRABUS ( Brabus-Allee D-46240 Bottrop phone + 49 / ( 0 ) 2041 / 777-0 fax + 49 / ( 0 ) 2041 / 777 111 Internet www.brabus.com ) placed the BRABUS SV12 S Biturbo displacement engine. It was originally designed for the world’s fastest sedan the BRABUS ROCKET. The implantation of the 6.3-liter ( 385 cu. in. ) engine into the confines of the W 204 series body is yet more proof for the superiority of BRABUS know-how.The BRABUS SV12 S Biturbo engine is produced entirely in-house in the state-of-the-art BRABUS engine building shop. Displacement of the twelve-cylinder three-valve engine is increased with the help of a larger cylinder bore special pistons and piston rods. The conversion further includes re-machining the cylinder heads and fitting them with special camshafts.The BRABUS engine specialists further developed an entirely new turbocharging system with two larger chargers and more efficient intercoolers. The BRABUS SV12 S Biturbo displacement engine also breathes more feely thanks to metal catalysts with low back pressure and a stainless-steel high-performance exhaust system custom-tailored for the C-Class body.New engine electronics ensure the perfect combination of maximum power yield and running smoothness. The use of custom mapping and the on-board diagnostics system result in low exhaust emissions that meet stringent Euro IV limits. The BRABUS BULLIT features state-of-the-art traction and stability control systems such as ABS ASR and ESP.The turbocharged twelve-cylinder engine – lubricated like all BRABUS high-performance engines with ARAL Synthetic motor oil – delivers 730 PS ( 720 hp ) / 537 kW of superlative power and 1 320 Nm ( 974 lb-ft ) of superlative peak torque. The latter is limited electronically in-car to 1 100 Nm ( 811 lb-ft ) .Power is transferred to the rear wheels via a massively modified five-speed automatic transmission and a BRABUS rear locking differential with a locking rate of up to 40 percent. It is available with two different final drive ratios.The performance figures for the BRABUS BULLIT place it into pole position in its class: The car sprints from 0 – 100 km/h ( 62 mph ) in just 3.9 seconds reaches 200 km/h ( 124 mph ) after just 10.49 seconds and shatters the 300-km/h ( 186 mph ) barrier after a mere 24.5 seconds. Top speed is more than 360 km/h ( 224 mph ) . There are only a very few super sports cars in the world that can hope to match these numbers.Such performance places special demands on aerodynamic properties suspension and brakes. The sedan body was optimized for runs beyond 300 km/h ( 186 mph ) in the wind tunnel.The BRABUS BULLIT front apron was designed to provide maximum cooling air supply for radiators and front brakes while at the same time minimizing aerodynamic lift. For a perfect aerodynamic balance the four-door features a three-piece rear spoiler and a rear apron with integrated diffuser. Front and rear spoilers are manufactured from especially lightweight yet high-strength carbon fiber baked in an autoclave.A special aluminum hood with ventilation slots is more than just a visual cue it also contributes to the thermal health of all components under the hood.BRABUS rocker panels smooth the airstream along the sides and with their integrated entrance lights make entering and exiting the vehicle safer under low-light conditions.The slightly understated sporty appearance of the supercar is further characterized by aluminum fender flares front and back seamlessly molded to the stock body. They add six centimeters ( 2.36 inches ) to the width of the C-Class body. They also make room for especially wide BRABUS wheels and YOKOHAMA ADVAN high-performance tires. The BULLIT runs on size 9.5Jx19 BRABUS Monoblock S light-alloy wheels and size 265/30 ZR 19 tires on the steering axle. The rear axle features 10Jx19 wheels with size 285/30 ZR 19 tires. The suspension too was custom-developed to account for the power and the weight of the twin-turbo V12 engine. The sporty yet comfortable height-adjustable BRABUS coil-over suspension features ten selectable settings each for bound and rebound and ensures safe handling in all driving situations. Sport sway bars reduce body roll during fast cornering to a minimum. The BRABUS high-performance brake system can handle even the most extreme stress. It features 12-piston aluminum fixed calipers on the front axle that grip vented and grooved 380 x 37 millimeter ( 15 x 1.46 inches ) brake discs. The rear axle stops with 360 x 28 millimeter ( 14.2 x 1.1 inches ) discs and six-piston aluminum fixed calipers. This BRABUS automobile also offers exclusive individuality in the interior: The standard equipment package includes a fully leather interior hand-crafted in the company-own upholstery shop from the finest Mastik and Nubuk leathers. The custom BULLIT seats offer a perfect combination of comfort and lateral support. Their carbon-fiber rear covers lend the interior an especially sporty feel. This look is complemented by carbon-fiber components on dashboard center console and door panels as well as by the ergonomically shaped sport steering wheel and aluminum pedals and shifter. The BRABUS BULLIT is built on demand starting at 348 000 Euros MSRP.BRABUS BULLIT –Technical Data Body4-door sedan based on Mercedes-Benz C-Class W 204 seriesSteel unibody widened with BRABUS fender flares by 60 mm ( 2.36 inches ) . BRABUS aluminum hood with ventilation slots.BRABUS BULLIT aerodynamic-enhancement kit with BULLIT front and rear bumper manufactured from carbon fiber baked in an autoclave. Rocker panels with integrated entrance lights three-piece rear spoiler.Measurements:Length 4.590 mm 180.7 in.Width 1.830 mm 72.0 in.Height 1.402 mm 55.2 in.Curb weight 1.850 kg 4 079 lbs.EngineBRABUS SV 12 S Biturbo displacement engine based on Mercedes 600 V12-cylinder 3-valve light-alloy engine with twin turbochargersDisplacement 6 233 cm³ ( 380 cu. in. ) Compression ratio 9.0 : 1Rated power 730 PS ( 720 hp ) / 537 kW at 5 100 rpmPeak torque 1 320 Nm ( 974 lb-ft ) from 2 100 rpm ( electronically limited to 1 100 Nm – 811 lb-ft ) Fuel: Super plus ( 98 octane ) Motor oil: ARALBRABUS SV 12 S Biturbo engine conversion consisting of:Displacement increase to 6.3 liters with special crankshaft with longer stroke enlarged cylinder bore with corresponding larger pistons. Both cylinder heads feature flow-optimized ports and special camshafts. Two high-performance turbochargers with special exhaust manifolds more efficient intercooling system and BRABUS stainless-steel high-performance exhaust system with low-back-pressure metal catalysts. Newly programmed mapping for engine electronics and on-board diagnostics.Drivetrain Rear-Wheel DriveReinforced five-speed automatic transmissionGear ratios:1st gear 3.592nd gear 2.193rd gear 1.414th gear 1.005th gear 0.83BRABUS locking rear differential with 40 percent locking rateFinal drive either 2.65 : 1 ( top speed 315 km/h – 196 mph ) or 2.24 : 1 ( top speed 350 km/h – 217 mph – electronically limited ) .SuspensionIndependent suspension front and rear with height-adjustable BRABUS coil-over suspension.Front axle:Three-link anti-dive geometry. Height-adjustable BRABUS struts with coil springs and gas-pressure shocks featuring ten settings each for bound and rebound BRABUS sport sway bar.Rear axle:Five-link anti-dive and anti-squat geometry. Height-adjustable BRABUS struts with coil springs and gas-pressure shocks featuring ten settings each for bound and rebound BRABUS sport sway bar.Wheels:BRABUS Monoblock S light-alloy wheels with YOKOHAMA ADVAN high-performance tires.Front: 9.5J x 19 H2 with 265/30 ZR 19Rear: 10.0J x 19 H2 with 285/30 ZR 19Brake System Dual-circuit brakes with Brake Assist and BRABUS high-performance brake system. Front: BRABUS 12-piston fixed aluminum calipers with vented and grooved 380 x 37 mm ( 15 x 1.46 in. ) steel brake discs.Rear: BRABUS six-piston fixed aluminum calipers with vented and grooved 360 x 28 mm ( 14.2 x 1.1 in. ) steel brake discs.Performance0 - 100 km/h ( 62 mph ) : 3.9 sec0 - 200 km/h ( 124 mph ) : 10.49 sec0 - 300 km/h ( 186 mph ) : 24.5 secTop speed: more than 360 km/h ( 224 mph ) ,,,,,,,,,,,,,,
Pareri su SLK,https://forum.quattroruote.it/threads/pareri-su-slk.97128/,2017-05-20 00:00:00,giovannino333,,Ciao Alla fine quale hai preso ? ,,,,,,,,,,,,,,
