Titolo,URL,Timestamp,User,(Testo Citato),TESTO,Costruttore,Modello,Brand,Interni,Esterni,Meccanica,Prestazioni,Consumi/Autonomia,Motore,Elettrico,Fuoristrada,Elettronica di Bordo,Manutenzione,Assistenza/Concessionari
159 gta,https://www.bmwpassion.com/forum/threads/159-gta.13255/page-5,2003-06-02 00:00:00,Gabri343,"Amante-Audi ha scritto: Andras ha scritto: Mpower3246 ha scritto: Twin Spark ha scritto: ke vuoi ke t dica...nn mi fa d fare 1000 pagine d topic... aspetteremo e vedremo..... Credi veramente che una GTA possa mai infastidire una M3 ? Lascia perdere va... Se uno sceglie l'Alfa lo fa perchè costa meno...parliamoci chiaro... Se Alfa mette un paio di girelle ad un 2 V6 e la TI come prestazioni (non cavalleri prestazioni) sarà in linea all'attuale ///M3 E4 unici problemi 1) va a competere con 2 girelle su un 2 contro un 2 aspirato 2) se.....se......se.....se.....se.....se.....se: io lo dirò fino allo sfinimento: l'Alfa Romeo di oggi NON merita la passione dei ragazzi che vivono per lei: è comodo e facile far leva su persone appassionate che più le deludi più rinfocoli la loro passione.........con BMW è divers passione e perfezione (impossibile da raggiungere ma comeunque il traguardo è quello) procedono di pari pass se cominciano a scazzare i modelli a Monaco non c'è passione che teng le vendite finiscono nel cesso. 3) ricordiamo sempre che mentre è certo che l'///M3 E90 avrà il V8 aspirato da 4 litri e 400cv (abbondanti) ancora NON si sa quale sarà la configurazione definitiva della 159GTA. Ciauz ... E resta sempre che la RS4 di cavalli ne avrà 420 aspirati alla faccia vostra e la 159 GTA resta cmq una bella macchina e se siamo tutti un minimo obbiettivi non si puo' dire di no! Anche a prestazioni non dovrebbe essere male quindi fanculo i pregiudizi e w i gusti personali delle persone... A me non me ne sbatte un ca**o se su 6 prove di accelerazione le vince tutte e 6 la M a me piace la Rs4 e se c'ho i soldi mi prendo quella perchè M3 è si bell ma a me un trazione posteriore mi trasmette meno sicurezza di un integrale che cmq li ho provati tutti e due e non potete dire di n sulla pioggia e sulla neve il TP è penalizzato. E zitti. Perchè se non fosse per il controllo della trazion 3/4 di quelli col mercede ferrar bmw ecc... starebbero 15min a fare cerchietti per terra prima di partire... e concludo dicendo che non so cosa centra questo con l'argomento del topic e sinceramente non capisco perchè in ogni sacrosanto tread si finisce a parlare che la M3 è meglio di questo o di quello... a momenti è meglio la M3 della Veyron...... Ciccio non siamo su Inaudit sei il benvenuto tra noi a patto che vai a dire di star zitto a qualche quaterna d'anelli e non a qualche doppia elica. E se ti rode che Audi non sa dove si comincia per fare un 2 aspirato con 343cv prenditela con quei rincoglioniti di Ingolstadt. Saluti... E se ti rode che BMW non sa da dove si comincia per fare un 2.7 biturbo da 380cv prenditela con quei bovari dei bavaresi ^^ Ovviamente detto in toni scherzosi (se non si nota ho pure ricalcato la struttura della tua frase) "" Amante-Audi ha scritto: Andras ha scritto: Mpower3246 ha scritto: Twin Spark ha scritto: ke vuoi ke t dica...nn mi fa d fare 1000 pagine d topic... aspetteremo e vedremo..... Credi veramente che una GTA possa mai infastidire una M3 ? Lascia perdere va... Se uno sceglie l'Alfa lo fa perchè costa meno...parliamoci chiaro... Se Alfa mette un paio di girelle ad un 2 V6 e la TI come prestazioni (non cavalleri prestazioni) sarà in linea all'attuale ///M3 E4 unici problemi 1) va a competere con 2 girelle su un 2 contro un 2 aspirato 2) se.....se......se.....se.....se.....se.....se: io lo dirò fino allo sfinimento: l'Alfa Romeo di oggi NON merita la passione dei ragazzi che vivono per lei: è comodo e facile far leva su persone appassionate che più le deludi più rinfocoli la loro passione.........con BMW è divers passione e perfezione (impossibile da raggiungere ma comeunque il traguardo è quello) procedono di pari pass se cominciano a scazzare i modelli a Monaco non c'è passione che teng le vendite finiscono nel cesso. 3) ricordiamo sempre che mentre è certo che l'///M3 E90 avrà il V8 aspirato da 4 litri e 400cv (abbondanti) ancora NON si sa quale sarà la configurazione definitiva della 159GTA. Ciauz ... E resta sempre che la RS4 di cavalli ne avrà 420 aspirati alla faccia vostra e la 159 GTA resta cmq una bella macchina e se siamo tutti un minimo obbiettivi non si puo' dire di no! Anche a prestazioni non dovrebbe essere male quindi fanculo i pregiudizi e w i gusti personali delle persone... A me non me ne sbatte un ca**o se su 6 prove di accelerazione le vince tutte e 6 la M a me piace la Rs4 e se c'ho i soldi mi prendo quella perchè M3 è si bell ma a me un trazione posteriore mi trasmette meno sicurezza di un integrale che cmq li ho provati tutti e due e non potete dire di n sulla pioggia e sulla neve il TP è penalizzato. E zitti. Perchè se non fosse per il controllo della trazion 3/4 di quelli col mercede ferrar bmw ecc... starebbero 15min a fare cerchietti per terra prima di partire... e concludo dicendo che non so cosa centra questo con l'argomento del topic e sinceramente non capisco perchè in ogni sacrosanto tread si finisce a parlare che la M3 è meglio di questo o di quello... a momenti è meglio la M3 della Veyron...... Ciccio non siamo su Inaudit sei il benvenuto tra noi a patto che vai a dire di star zitto a qualche quaterna d'anelli e non a qualche doppia elica. E se ti rode che Audi non sa dove si comincia per fare un 2 aspirato con 343cv prenditela con quei rincoglioniti di Ingolstadt. Saluti "" Andras ha scritto: Mpower3246 ha scritto: Twin Spark ha scritto: ke vuoi ke t dica...nn mi fa d fare 1000 pagine d topic... aspetteremo e vedremo..... Credi veramente che una GTA possa mai infastidire una M3 ? Lascia perdere va... Se uno sceglie l'Alfa lo fa perchè costa meno...parliamoci chiaro... Se Alfa mette un paio di girelle ad un 2 V6 e la TI come prestazioni (non cavalleri prestazioni) sarà in linea all'attuale ///M3 E4 unici problemi 1) va a competere con 2 girelle su un 2 contro un 2 aspirato 2) se.....se......se.....se.....se.....se.....se: io lo dirò fino allo sfinimento: l'Alfa Romeo di oggi NON merita la passione dei ragazzi che vivono per lei: è comodo e facile far leva su persone appassionate che più le deludi più rinfocoli la loro passione.........con BMW è divers passione e perfezione (impossibile da raggiungere ma comeunque il traguardo è quello) procedono di pari pass se cominciano a scazzare i modelli a Monaco non c'è passione che teng le vendite finiscono nel cesso. 3) ricordiamo sempre che mentre è certo che l'///M3 E90 avrà il V8 aspirato da 4 litri e 400cv (abbondanti) ancora NON si sa quale sarà la configurazione definitiva della 159GTA. Ciauz ... E resta sempre che la RS4 di cavalli ne avrà 420 aspirati alla faccia vostra e la 159 GTA resta cmq una bella macchina e se siamo tutti un minimo obbiettivi non si puo' dire di no! Anche a prestazioni non dovrebbe essere male quindi fanculo i pregiudizi e w i gusti personali delle persone... A me non me ne sbatte un ca**o se su 6 prove di accelerazione le vince tutte e 6 la M a me piace la Rs4 e se c'ho i soldi mi prendo quella perchè M3 è si bell ma a me un trazione posteriore mi trasmette meno sicurezza di un integrale che cmq li ho provati tutti e due e non potete dire di n sulla pioggia e sulla neve il TP è penalizzato. E zitti. Perchè se non fosse per il controllo della trazion 3/4 di quelli col mercede ferrar bmw ecc... starebbero 15min a fare cerchietti per terra prima di partire... e concludo dicendo che non so cosa centra questo con l'argomento del topic e sinceramente non capisco perchè in ogni sacrosanto tread si finisce a parlare che la M3 è meglio di questo o di quello... a momenti è meglio la M3 della Veyron... "" Mpower3246 ha scritto: Twin Spark ha scritto: ke vuoi ke t dica...nn mi fa d fare 1000 pagine d topic... aspetteremo e vedremo..... Credi veramente che una GTA possa mai infastidire una M3 ? Lascia perdere va... Se uno sceglie l'Alfa lo fa perchè costa meno...parliamoci chiaro... Se Alfa mette un paio di girelle ad un 2 V6 e la TI come prestazioni (non cavalleri prestazioni) sarà in linea all'attuale ///M3 E4 unici problemi 1) va a competere con 2 girelle su un 2 contro un 2 aspirato 2) se.....se......se.....se.....se.....se.....se: io lo dirò fino allo sfinimento: l'Alfa Romeo di oggi NON merita la passione dei ragazzi che vivono per lei: è comodo e facile far leva su persone appassionate che più le deludi più rinfocoli la loro passione.........con BMW è divers passione e perfezione (impossibile da raggiungere ma comeunque il traguardo è quello) procedono di pari pass se cominciano a scazzare i modelli a Monaco non c'è passione che teng le vendite finiscono nel cesso. 3) ricordiamo sempre che mentre è certo che l'///M3 E90 avrà il V8 aspirato da 4 litri e 400cv (abbondanti) ancora NON si sa quale sarà la configurazione definitiva della 159GTA. Ciauz "" Twin Spark ha scritto: ke vuoi ke t dica...nn mi fa d fare 1000 pagine d topic... aspetteremo e vedremo..... Credi veramente che una GTA possa mai infastidire una M3 ? Lascia perdere va... Se uno sceglie l'Alfa lo fa perchè costa meno...parliamoci chiaro 'ke vuoi ke t dica...nn mi fa d fare 1000 pagine d topic... aspetteremo e vedremo..'",Io ho in mente solo 2 macchine che associo a fighetto : VW Golf V e Mini... poi nessuno mi spari... Bmw è l'Alfa dei tempi d'oro... Ora quello che ci resta sono miti a cui appoggiarci... Io per fortuma mi ci siedo sopra... ,,,,,,,,,,,,,,
Kia Sportage (Topic Ufficiale - 2010),https://www.autopareri.com/forums/topic/36943-kia-sportage-topic-ufficiale-2010?&page=158#comments,2011-02-05 21:26:29,mauro34r6,,le mie sono bene alliniate non c'è differenza tra lato sx e dx. per cuanto riguarda il consumo si ho' provato a resettarlo ma mi marca sempre 7 0/7 1 il tuo ? che motore monta la tua ? ,,,,,,,,,,,,,,
Questionario Alfa Romeo: Essere Alfisti,https://www.autopareri.com/forums/topic/63189-questionario-alfa-romeo-essere-alfisti,2017-05-24 08:49:11,maragiu91,,Grazie per le vostre risposte al questionario e per i commenti che avete lasciato ! ! ! ! Mi saranno sicuramente utili e sicuramente citerò qualcuno dei vostri commenti nella mia tesi Continuate a rispondere al questionario e a commentare ! ! Buona giornata a tutti ! ! ! ,,,,,,,,,,,,,,
Smart abusiva con cavo inserito all'Enel X ma disconnessa,https://www.forumelettrico.it/forum/smart-abusiva-con-cavo-inserito-all-enel-x-ma-disconnessa-t5549-40.html?sid=afbb8b79ce719d4905a913f84b3a8c80&sid=afbb8b79ce719d4905a913f84b3a8c80,2019-05-06 18:59:00,marco,'io con la Smart',Ma giusto per tornare a tema se con la tua Smart ricarichi ad una colonnina accelerata Enel cosa succede quando la ricarica termina ? La presa sulla colonnina si libera oppure rimane bloccata fino a quando non ripassi la card o app ? Attenzione che la tua risposta potrebbe scagionare questo pseudo abusivo ,,,,,,,,,,,,,,
Veicolo a guida autonoma investe e uccide un pedone.  Uber sospende i test,https://www.autopareri.com/forums/topic/64729-veicolo-a-guida-autonoma-investe-e-uccide-un-pedone-uber-sospende-i-test?&page=5#comments,2018-03-21 10:21:31,indeciso88,,Oh qualcuno mi ha capito allora ,,,,,,,,,,,,,,
Borgognoni - Roma: OK!,https://www.bmwpassion.com/forum/threads/borgognoni-roma-ok.72125/,2007-10-26 00:00:00,kino79,,Ciao a tutti ieri ho portato la mia Z4 a fare il primo OilService da Borgognoni e ne sono rimasto molto soddisfatto.Da 5 anni a questa parte ho provato un bel po' di officine bmw-mini ( soprattutto a causa della Mini che ho avuto ) sia a Roma che fuori e devo dire che non sono mai stato trattato come avrei desiderato.Da Borgognoni ho fissato facilmente l'appuntamento sia per la consegna che per il ritiro dell'auto in fase di consegna la persona all'accettazione è stata molto disponibile ed ha annotato tutte le cosette che volevo fossero controllate ( tra 1 mese mi scade la garanzia ufficiale ! ) infine ho richiesto ed ottenuto di anticipare la consegna al primo pomeriggio il tutto con cortesia e professionalità e senza attese inutili. Capisco che si è trattato di un semplice oil service e che tutto questo dovrebbe rientrare nella normalità ma finora non mi era mai successo ! Risultato:portata l'auto alle 9.00 ritirata alle 15.00.lavori effettuati:Oil Service dei 25000kmsostituzione liquido freniimpostazioni chiave ( chiusura autom. portiere in marcia ) p.s. la persona all'accettazione e che gestisce tutto si chiama Diego ed oltre ad essere gentile non lesina consigli ! ciao a tutti ! ,,,,,,,,,,,,,,
Mondiale F.1 - GP degli Stati Uniti,https://forum.quattroruote.it/threads/mondiale-f-1-gp-degli-stati-uniti.118909/page-4,2018-10-19 00:00:00,pilota54,"""ma perchè la storia è molto montata dagli organi si stamp la Ferrari ha preso atto che per la federazione quell'intervento non è illegale le vetture di F1 nel corso della stagione presentano moltissime modifiche alcune passano altre non passan è sempre stato cos pensare che il motorsport abbia un regolamento che gestisca tutte le modifiche è impossibil anche perchè vorrebbe dire che chi partecipa alla stesura sia il miglior ingegnere presente sulla piazza e sia in costante aggiornamento e anzi sappia prevedere le modifiche future.""","Non la farei così semplice Paolo. In F.1 ci sono stati spesso dei ""furbi"" che poi sono stati pescati in fallo e puniti ( ma non sempre v. per es. 1983 o 2009.... ) . Ci sono stati anche episodi riprorevoli di ""spionaggio"" o meglio di plagio dopo furto di dati ( Mc Laren 2007 quando furono tolti tutti i punti del Mondiale Costruttori ) . Se uno lascia passare tutto gli altri se ne approfittano. A volte è giusto protestare. Io ( nel mio super-piccolo ) certe volte ho scoperto che correvo contro ""aerei"" vetture completamente fuori regola preparate da meccanici senza scrupoli veri truffatori del Motorsport. Penso che ci debbano essere più controlli e che la Ferrari debba avere più voce in capitolo presso la FIA. ",,,,,,,,,,,,,,
Ciao,https://www.bmwpassion.com/forum/threads/ciao.11154/page-2,2004-02-11 00:00:00,RALLYMAN,Davide lo sa bene ke è lu lo incoccia dagli I il coglionaccio nn ha speranze... ma tu .... vieni sul forum quando c'è alinghi????? xkè durante gli altri giorni nn ci sei mai....... 'Davide lo sa bene ke è lu lo incoccia dagli I il coglionaccio nn ha speranze',si grande capo...ha avuto il coraggio di ripostarla e mi è venuto subito il dubbio...infatti l'ho scritto subito e lui l'ha per magia cancellata dal suo post... ma il vice-sceriffo ha riscovato il vecchio post di alinghi con quella foto... ,,,,,,,,,,,,,,
YPSILON 1.2 5P BZ GOLD 69CV  EURO 6 NON HA RIPRESA IN SALITA. SI FERMA,https://forum.quattroruote.it/threads/ypsilon-1-2-5p-bz-gold-69cv-euro-6-non-ha-ripresa-in-salita-si-ferma.95399/page-4,2015-04-13 00:00:00,domi2204,,Strano in famiglia abbiamo una Y 1.2 gold Euro 6 abitiamo a 600 metri di quota la stradina di accesso a casa è più che ripida anzi è proprio di pendenza notevole eppure non riscontro il difetto citato sicuro che l'auto sia a posto ? cambiare officina a volte risolve. Personalmente ho avuto più fire attualmente guido una punto 2012 1.4 ed è vero che il fire migliora con il tempo ma anche da nuovo pur essendo più legato sale ovunque. ,,,,,,,,,,,,,,
Porsche Taycan: negli USA 3 anni di ricariche rapide incluse fino a 350 kW - HDmotori.it,http://www.hdmotori.it/2019/01/29/porsche-taycan-3-anni-ricariche-incluse-usa-350-kw/,2019-01-29 10:52:00,an-cic,,tutte le auto per il mercato europeo devono avere la presa europea standard le colonnine invece possono avere attacco proprietario se sono per uso esclusivo.,,,,,,,,,,,,,,
La mia prima Golf: consigli per gli acquisti e confronto preventivi,https://forum.quattroruote.it/threads/la-mia-prima-golf-consigli-per-gli-acquisti-e-confronto-preventivi.121413/page-2,2019-02-24 00:00:00,suppasandro,,è tornato ordinabile l'atlantic blue metallizzato...che era stato accantonato per far spazio al giallo kurkuma a sua volta smantellato per rifar posto al predecessore....tassativo ordinarla atlantic blue o al limite rosso tornado....gli altri colori non hanno senso....nero bianco e grigio....pare un film con fernandel e gino cervi ,,,,,,,,,,,,,,
Vibrazioni..e ancora vibrazioni...,https://forum.quattroruote.it/threads/vibrazioni-e-ancora-vibrazioni.32463/page-2,2010-09-20 00:00:00,MattiaTTS,"'Cia ti posso dire che avevolo stesso problema e ho risolto portandola da un gommisto munito di una macchina speciale per equlibrare le gomme la HUNTE macchina che costa sui 24.00 00 euro...riporto una mia risposta in una discusione in latro forum ""Gomme Michelin pilot da 18"" 245 assetto normale Maggio 200 si manifestava dai 120 ai 140 poi continuo fino a 170..... C'è da dire che con il treno originale l'auto era perfett le problematiche sono uscite dopo il cambio gomm quindi sono certo che dipende dai gommist se la gomma non è montata perfetta sul cerchio ai voglia metter pesi vibrerà sempr ecco che ci vuole stà benedetta macchina della Hunter che fà un lavoro di fino e tutto torna normale.Invece se a qualcuno succede ad auto nuova allora possono essere problemi meccanici(braccetti vari anche se il tecnico mi ha detto che in alcuni casi A5 il problema anche dopo la sostituxzione si è ripresentato. ""se cerchi nel web ...vibrazione avantreno...dovresti trovare tutto.Io sono nel veneto e ho due indirizzi di questi gommist purtroppo visto il costo della HUNTER c'è l'hanno in pochi...'",ciao e grazie per la risposta ma purtroppo ho già fatto questa prova senza nessun risultato... con 4 treni di gomme diversi vibra sempre anche dopo la bilanciatura dinamica... ,,,,,,,,,,,,,,
la batcaverna 635csi &co,https://www.bmwpassion.com/forum/threads/la-batcaverna-635csi-co.85405/page-166,2008-04-09 00:00:00,Stefano890,'Peccato.. speriamo vada in buone mani Tornando alla 535 ad adesso è senza scritta posterioree e senza spoiler ant M la scritta non so se metterl lo spoiler dipende se ne trovo uno sand dato che il suo è mort nuovo costa 900 neur senza tapp che non sono fornibil e quindi.... bo che fare?',esagerato..:wink: ,,,,,,,,,,,,,,
Scénic XMod - Topic Ufficiale,https://forum.quattroruote.it/threads/sc%C3%A9nic-xmod-topic-ufficiale.14456/page-74,2010-03-09 00:00:00,mymau,,ah... per quelli che stanno aspettando la consegna... Questa mattina in tangenziale a Milano una bisarca carica di Xmod multicolori... ,,,,,,,,,,,,,,
Giulia Veloce 2000 benzina 280 CV,https://forum.quattroruote.it/threads/giulia-veloce-2000-benzina-280-cv.106836/page-5,2016-11-26 00:00:00,omniae,"'Quind non vendiamo il lardo perche' ci sono dei "" porcellini "" che non si accontentano di farsene 2 fettin ma "" s ja lass se magneno 'na mezza schina ""'",Arguto. La morale della storia e' proprio questa. Dare un dito per certi equivale a prendersi tutto il braccio. ,,,,,,,,,,,,,,
Ritirata....alleluia!,https://www.autopareri.com/forums/topic/28547-ritirataalleluia?&page=16#comments,2009-05-29 16:18:14,luc@,,Comunque vediamo se ti dura più di 24.000 km questa nuova turbina. ,,,,,,,,,,,,,,
Distribuzione pesi Alfa Romeo Giulia..qualcosa non quadra!,https://forum.quattroruote.it/threads/distribuzione-pesi-alfa-romeo-giulia-qualcosa-non-quadra.113425/page-2,2017-11-22 00:00:00,?angelo0,'Il mercato darà le risposte concret real gira un pò sulle strade e vedi quali auto sono casualmente preferite dagli italiani !',E si hai ragione caro ragioniere...ti ricordo che da trentanni non si fanno auto tra qualche anno ne riparliamo ,,,,,,,,,,,,,,
Scénic XMod - Topic Ufficiale,https://forum.quattroruote.it/threads/sc%C3%A9nic-xmod-topic-ufficiale.14456/page-233,2010-12-11 00:00:00,DAGO_80,,solo con gli xenon ! ,,,,,,,,,,,,,,
Primi 1300 Km con la nuova Passat biTDI,https://forum.quattroruote.it/threads/primi-1300-km-con-la-nuova-passat-bitdi.93990/,2015-02-09 00:00:00,st79,,Ciao anche io sono in attesa della biturbo ordinata a fine Gennaio e in produzione proprio la prossima settimana ( evidentemente non ne vendono tante ) ,,,,,,,,,,,,,,
Mitsubishi ASX - Problemi - Strappi motore,https://www.autopareri.com/forums/topic/40399-mitsubishi-asx-problemi-strappi-motore?&page=10#comments,2010-11-07 17:38:01,asx,,E dopo circa 800 km ho scoperto gli strappi anch'io ! Finora avevo utilizzato l'ASX solo in città ed autostrada e gli strappi non si erano mai presentati. Oggi viaggiando su una strada extraurbana in V a 80 km/h ca a 1800 giri ho avvertito per la prima volta i famosi strappi. Comunque temevo fossero più evidenti non sono stati particolarmente fastidiosi. Proprio per questo non andrò subito a fare l'aggioramento ma aspetterò il controllo dei 3000km. In quella occasione ho intenzione di far disattivare lo stop&amp start. Qualcuno sa se è possibile farlo ? ,,,,,,,,,,,,,,
A3 sportback 1.6 110cv S tronic,https://forum.quattroruote.it/threads/a3-sportback-1-6-110cv-s-tronic.108201/,2017-02-08 00:00:00,dani2581,,"Potrebbe essere benissimo qualcosa che riguardi il volano-frizione.. quella del lavaggio degli iniettori mi sa di solita scusa dell'officina per ""traccheggiare"" e magari aspettare che scada la garanzia.. quindi se fossi in te mi sbrigherei e insisterei a fargli controllare la trasmissione-frizione visto poi quanto sia famosa nella fattispecie la sua affidabilità. Certo che poi usare internet ed i forum anche per prendere informazioni magari prima di comprare un'auto usata poi no eh ? ",,,,,,,,,,,,,,
Mazda 2  2015,https://www.autopareri.com/forums/topic/55773-mazda-2-2015?&page=36#comments,2015-02-08 08:43:22,Walker,,Messaggi sul 2.2 Mazda e su Mazda 3 e annessi spostati qui: http://www.autopareri.com/forum/mazda/61610-mazda-3-2013-a.html ,,,,,,,,,,,,,,
Scénic XMod - Topic Ufficiale,https://forum.quattroruote.it/threads/sc%C3%A9nic-xmod-topic-ufficiale.14456/page-43,2010-02-11 00:00:00,logicsilver,Dovrebbe arrivare doman a detta del concessionario. X-Mod 1.4 TCE Luxe nera... poi mi lamenterò dei 6km/l :shock: Saluti a tutti... Siccome domani dovrebbe arrivare anche la mi mi dici di che città sei ?io sono di Torino 'Dovrebbe arrivare doman a detta del concessionario. X-Mod 1.4 TCE Luxe nera... poi mi lamenterò dei 6km/l :shock: Saluti a tutti',Modena domani per puro caso passerò dal conc... ,,,,,,,,,,,,,,
Opel Corsa OPC 2015,https://www.autopareri.com/forums/topic/57457-opel-corsa-opc-2015?&page=3#comments,2015-02-04 17:26:34,crabble,,"Anche no.. non ha ne autobloccante ne 18"" ne 207cv ne i freni Brembo da 330mm. ",,,,,,,,,,,,,,
la batcaverna 635csi &co,https://www.bmwpassion.com/forum/threads/la-batcaverna-635csi-co.85405/page-135,2009-10-08 00:00:00,Steve67,,accrocchio ,,,,,,,,,,,,,,
Al volante della Corolla 2.0 Hybrid Touring Sports,https://forum.quattroruote.it/threads/al-volante-della-corolla-2-0-hybrid-touring-sports.119336/page-21,2018-12-13 00:00:00,smargia2002,'Scus non avevo visto gli ultimi post perchè il sistema porta alle ultime discussioni lette. Dett quest permettimi di dissentire in quanto il mio intervento innanzitutto non è offensiv ma si tratta di una constatazion peraltro espressa dopo numeros pacat interventi nei quali i moderatori potevano anche cogliere qualche suggerimento. Non mi pare assolutamente che questi comportamenti qui da parte di alcuni siano una novit o no ?',Constato che ben due interventi da parte di colleghi non abbiano portato alcun risultato. E' vero: questi comportamenti in questa room non sono una novità ma guarda caso certe degenerazioni avvengono solo in questa room. Già in passato sono state prese decisioni drastiche che almeno in parte avevano portato ad un rasserenamento generale. Non costringeteci a riproporle di nuovo ( per essere chiari parlo di: chiusura i topic al minimo accenno di off topic cancellazione degli interventi palesemente fuori luogo e banning a tutti quelli che non rispettano il regolamento ) perché sapete com'è non è che intendiamo passare le Feste a monitorare una sola room. ,,,,,,,,,,,,,,
TSI or not ???,https://forum.quattroruote.it/threads/tsi-or-not.115102/,2018-02-27 00:00:00,A-80,'Mi pare che nel 2017 abbiano montato il 1.0 3 cilindr su Ibiz forse il VAG di cui parli ha saltato il giro....',Si nel 2017 esatto. 1.0 da 75 95 115 cv ,,,,,,,,,,,,,,
