Titolo,URL,Timestamp,User,(Testo Citato),TESTO,Costruttore,Modello,Brand,Interni,Esterni,Meccanica,Prestazioni,Consumi/Autonomia,Motore,Elettrico,Fuoristrada,Elettronica di Bordo,Manutenzione,Assistenza/Concessionari
Incentivo per rottamare uno scooter L1 per un L3,https://www.forumelettrico.it/forum/incentivo-per-rottamare-uno-scooter-l1-per-un-l3-t4787-10.html?sid=1c3a99d7530745a920dbc9d08b29704a&sid=1c3a99d7530745a920dbc9d08b29704a,2019-03-11 15:19:00,Adri66,,"Stamattina mi sono armato di ""santa pazienza"" ed ho spedito una ""istanza di interpello ordinario in merito alla LEGGE 30 DICEMBRE 2018 n.145 comma 1057"" via PEC alla AGENZIA delle ENTRATE proponendo la soluzione interpretativa seguente:PER L’ACQUISTO DI UN VEICOLO ELETTRICO NUOVO APPARTENENTE ALLE CATEGORIE L1 E L3 SI POSSA CONSEGNARE INDISTINTAMENTE PER LA ROTTAMAZIONE UN VEICOLO DELLE MEDESIME CATEGORIE L1 E L3 DI TIPO EURO 0 1 o 2Ora vediamo se/quando mi rispondono sebbene in assenza di un riscontro nei tempi previsti valga la formula del SILENZIO-ASSENSOhttps://www.agenziaentrate.gov.it/wps/content/Nsilib/Nsi/Schede/Istanze/Scheda+Interpello/Tipologie+di+interpello_/Interpello+ordinario_/ ? page=istanzecomunicazionicitt",,,,,,,,,,,,,,
Alfa Romeo Stelvio,https://forum.quattroruote.it/threads/alfa-romeo-stelvio.103307/page-15,2016-11-22 00:00:00,arizona77,,"A completamento. Per me gli interni sono ancora piu' importanti della carrozza in se'. Quelli li ho sottocchio di continuo.... quella passati i primi innamoramenti passa in "" secondo "" piano ",,,,,,,,,,,,,,
Civic 1.6 i-dtec consumi e considerazioni varie,https://forum.quattroruote.it/threads/civic-1-6-i-dtec-consumi-e-considerazioni-varie.102848/,2016-03-09 00:00:00,Barack,,Ciao ! Anch'io ho una Civic motorizzata come la tua ma lifestyle. Sono molto contento dell'auto e di tutte le sue qualità. In merito ai consumi ti posso dire che io ho medie più o meno analoghe alle tue ma devo dire non sono un economy runner anzi :twisted: di contro ti dico che quando non ho fretta e guido tranquillo i 20 kml li vedo con facilità e in più di un'occasione ho misurato questo dato da pieno a pieno. In autostrada la macchina va benissimo pochi fruscii e infonde una sicurezza tale da trovarsi senza accorgersene a velocità ben superiori a quelle di codice. La mia adesso ha 8500km. In merito al tagliando ti posso dire che questa cosa l'avevo notata con la frv 2.2 accompagnata da una diversa regolazione anche dello stacco della frizione. Ti dirò dopo il tagliando della mia ! ,,,,,,,,,,,,,,
spie errori dopo aver staccato la batteria e alza cristalli che non funziona,https://www.bmwpassion.com/forum/threads/spie-errori-dopo-aver-staccato-la-batteria-e-alza-cristalli-che-non-funziona.338813/,2016-02-19 00:00:00,wewwo,,ciao ragazzi mi servirebbe una mano oggi dovevo smontare l airbag al mio serie1 stacco il negativo dalla batteria smonto l airbag faccio un lavoretto al volante e ri monto tutto attacco la batteria accendo l auto e mi fa tantissime spie di errore e sopratutto non mi funzionano gli alzacristalli dalla pulsantiera lato guida anteriore. Qualcuno sa cosa puó essere ? ,,,,,,,,,,,,,,
Fiat Punto 2012,https://www.autopareri.com/forums/topic/50416-fiat-punto-2012?&page=74#comments,2012-01-19 10:52:27,RiRino,,Cmq se la evo la si prende non in allestimento base con i cerchi in lega non è proprio male....ultimamente mi capita di vederne una bianca ( che certamente non è il colore migliore sulla evo ) con le fasce dei paraurti in grigio chiaro ( quelle piano black sono meglio ) cerchi in lega certo la linea è un pò troppo carica ma si lascia guardare a differenza delle versioni base con le coppe di plastica caso mai bianche imho inguardabili... ,,,,,,,,,,,,,,
Piccola storia del tracollo Alfa Romeo,https://forum.quattroruote.it/threads/piccola-storia-del-tracollo-alfa-romeo.120374/page-6,2019-03-01 00:00:00,?angelo0,"""essere paragonati a Porsche e' ambizios ma stimolante a Mazd avvilente....Vedi tu""",Perché ti senti avvilito che le due da te preferite Audi e BMW siano stati allo stesso modo paragonate con la Mazda... ,,,,,,,,,,,,,,
MINI ONE D 55KW 2005 pedale frizione rimane giù.,https://forum.quattroruote.it/threads/mini-one-d-55kw-2005-pedale-frizione-rimane-gi%C3%B9.53782/,2011-07-25 00:00:00,jackari,,il tuo 2.4 la frizione non ce l'ha ? ? :lol: ,,,,,,,,,,,,,,
Che auto è questa?,https://www.bmwpassion.com/forum/threads/che-auto-%C3%A8-questa.12396/,2004-07-01 00:00:00,Micky,'alfa romeo sz zagat una meraviglia ',Oggi al supermarket ho incontrato questa specie di alfa strana...... Ma di cosa si tratta esattamente ? ? ? ? ,,,,,,,,,,,,,,
Nissan Micra 2017,https://www.autopareri.com/forums/topic/62010-nissan-micra-2017,2016-09-29 09:50:43,calatrava,,Un pò Astra un pò Infiniti un pò tante altre cose.....Mal di mare........... ,,,,,,,,,,,,,,
Mark Levinson? Scarso il giudizio di Quattroruote,https://forum.quattroruote.it/threads/mark-levinson-scarso-il-giudizio-di-quattroruote.103143/page-2,2016-03-25 00:00:00,scipione1,,Perché l'algoritmo dietro alla compressione mp3 è del tipo lossy cioè per comprimere la musica tralascia volutamente determinate informazioni ( di solito quelle frequenze non udibili dall'orecchio umano ) e così una volta eliminate queste informazioni non è poi possibile ripristinarle. Un po' come fare il riassunto dei Promessi Sposi come faceva il Bignami: la sostanza c'è sempre ma si perdono passaggi interessanti come la descrizione della peste etc. Ricordo il Bignami di Storia che nella guerra dei cent'anni saltava passaggi interi con la frase dopo alterne vicende... ,,,,,,,,,,,,,,
Alfa Romeo 4C 2013,https://www.autopareri.com/forums/topic/56324-alfa-romeo-4c-2013?&page=590#comments,2013-09-27 14:44:21,Matteo B.,,si quello che fa i porno ,,,,,,,,,,,,,,
Forester 2016,https://forum.quattroruote.it/threads/forester-2016.101541/page-6,2016-06-04 00:00:00,Heniadir,'è il costo dei tagliandi Subaru ad essere uno scoglio importante.',Importante ? Forse per te che stai impestando ogni 3D con il costo dei tagliandi se proprio sei ossessionato apri un 3D specifico no inoltre sul forester e' spuntato un 3D sui tagliandi vai e scatenati. ,,,,,,,,,,,,,,
villa d'este cernobbio,https://www.bmwpassion.com/forum/threads/villa-deste-cernobbio.127607/,2008-09-04 00:00:00,gae81,,"si avvicina villa d'este il concorso di eleganza bmw.. qualcuno di voi ""leggendari"" ha la possibilità di avere biglietti per poterci andare ? ? abito a 5 minuti ma entrare a villa d'este è impossibile.. sono bene accetti anche ingressi per la domenica a villa erba ! ! grazie ! ! ",,,,,,,,,,,,,,
Abarth 124 GT 2018,https://www.autopareri.com/forums/topic/64621-abarth-124-gt-2018?&page=4#comments,2018-03-03 10:23:32,gianmy86,,Mai visto. Nemmeno credevo esistesse. Solo qualche sparuta Roadster-coupè che mi piace meno. Così molto meglio. ,,,,,,,,,,,,,,
Sondaggi e questionari vari sulla mobilità elettrica,https://www.forumelettrico.it/forum/voglio-capire-come-funziona-la-mobilita-elettrica-t5433-30.html?sid=8b8d4eb4641d5d32a257dae81f149e26&sid=8b8d4eb4641d5d32a257dae81f149e26,2019-01-09 11:31:00,KITT,"'Ciao Annamari Io purtroppo non posseggo una stazione di ricarica fissa ma un caricatore portatile (che onestamente non può essere definita ""colonnine per la ricarica"") che però svolge la stessa funzione e può addirittura trasformarsi in ""colonnina"" se montata da un elettricista che rilascia DICO.La differenza è sottil ma c'e quindi non so esattamente cosa chiedete.Nel caso in cui siate dunque a corto di intervistati e decideste di aprire le fil dimmelo che compilo il form (per ora non vi faccio perdere tempo con candidature inutili).Le altre caratteristiche le posseggo.NOTA: quando scade l'iniziativa?Perchè se è entro 6 mes magari la colonnina ce l'ho. Utile specificare la data anche per chi leggerà questo messaggio in futuro.'",Ciao Selidori dal momento che non escludiamo la possibilità di allargare il nostro campo di ricerca in virtù della disponibilità da te dimostrata ci piacerebbe capire meglio da cosa è stata guidata la tua scelta di acquistare un caricatore portatile anzichè dotarti di una box station/colonnina e presso che tipo di rivenditore hai acquistato il dispositivo di ricarica.Hai scelto il caricatore indipendentemente dal gestore di energia elettrica che avevi in casa ? Ovviamente senza impegno ci piacerebbe solo riuscire ad includerti nella ricerca.Grazie in anticipo ,,,,,,,,,,,,,,
Alfa Romeo Giulia Quadrifoglio 2016,https://www.autopareri.com/forums/topic/58587-alfa-romeo-giulia-quadrifoglio-2016?&page=552#comments,2015-11-04 19:03:21,pennellotref,,"Dico la mia..... L'uditorio tutto è a conoscenza di due fatti incontrovertibili in quanto accertati da dichiarazioni ufficiali: modifiche nella successione dei modelli Alfa Romeo in uscita causa mercato cinese cagionevole di salute con particolare riferimento a quello delle importazioni annuncio ufficiale di circa un mese fa da parte dell'organizzatore del salone di LA che quello Alfa sarà il marchio d'onore del salone medesimo che vedrà il brand italiano al centro di una serie di iniziative nella settimana prima del via della manifestazione e che culminerà con la presentazione di un modello inedito. Ora.........Delle due l'una: o nel giro di pochi giorni ( il salone parte il 18 corrente mese se non erro ) arriverà notizia che non se ne fa nulla oppure Ciferri ( o le famigerate fonti ) sono inaffidabili almeno limitatamente al caso della Quadrifoglio che logica vuole sarà il modello in attesa di presentazione a LA. Oppure Ciferri la sa lunga e Alfa presenterà un ""misteriosissimo"" concept.....Oppure Ciferri la sa ancora più lunga e in Alfa sono dei pazzi scatenati da internare prima di subito perchè presenteranno un modello che sarà poi commercializzato in USA non prima di un anno ipotizzando che essendo l'articolo apparso su Autonews Europe la nuova deadline del Ciferri si riferisca al lancio in Europa.........You never know....... ",,,,,,,,,,,,,,
Ypsilon: Sport e 1.3 90cv dopo il 2005?,https://www.autopareri.com/forums/topic/11908-ypsilon-sport-e-13-90cv-dopo-il-2005?&page=5#comments,2005-04-04 14:27:43,blueyes,,fraziona' ogni auto che dici che ti vuoi fare poi la tolgono dalla produzione...portassi un po sfiga ? ? ? Comprate la Y10 e non nominarne altre per adesso va...fai il piacere.... e non nominare la 3+1 per nessuna ragione al mondo che e' l'unica cosa che ci e' rimasta.... ,,,,,,,,,,,,,,
Primi 50000km con la mia MX-5 !!!,https://www.autopareri.com/forums/topic/31685-primi-50000km-con-la-mia-mx-5,2008-12-14 11:07:31,luc@,,"Comunque macchina davvero affascinante. Ribadisco però il mio dubbio sulla validità delle motorizzazioni soprattutto per i consumi. Hai problemi con la capote ? Infiltrazioni ? Rumorosità ? Bisogna usare prodotti specifici per mantenerla ""in forma"" ? ",,,,,,,,,,,,,,
Sondaggio precedenti BMW possedute,https://www.bmwpassion.com/forum/threads/sondaggio-precedenti-bmw-possedute.92467/page-2,2007-01-08 00:00:00,bigorrah,,Chissà dov'è finita adesso magari è a Savona ce n'era una in vendita targa MI poco tempo fa:wink: ,,,,,,,,,,,,,,
mercedes classe c,https://www.bmwpassion.com/forum/threads/mercedes-classe-c.29076/,2005-08-20 00:00:00,albycol,,non sembra male..............:wink:http://www.worldcarfans.com/spyphot...cedes/spy-photos-mercedes-c-class-old-and-new ,,,,,,,,,,,,,,
2019 Corolla (hybrid),https://forum.quattroruote.it/threads/2019-corolla-hybrid.121074/page-7,2019-03-25 00:00:00,paulein118,,Eh 30 effettivi lanciati così possono creare aspettative errate ,,,,,,,,,,,,,,
Un po' di auto un po' di me,https://forum.quattroruote.it/threads/un-po-di-auto-un-po-di-me.112437/,2017-09-27 00:00:00,Lainz77,,Anche se l'auto di famiglia è un'altra senz'altro capiterà che ci carichi i bambini per il grande che ha 5 anni un rialzino può essere sufficiente ma il piccolo ( 9 mesi ) usa il seggiolino. Per questo anche se visto qualche video sembra che gli spazi posteriori di Aygo&sisters siano accessibili sono cmq ristretti e forse un po' di volume extra non sarebbe male. Finora non ho visto una superiorità della Panda in termini di capienza se confrontata con Celerio o i10.. che sono i modelli su cui ho trovato le offerte più interessanti. Ho avuto 1.2 come auto sostitutiva e sono d'accordo: il motore è asfittico. Per quanto riguarda la twinair non ho trovato offerte interessanti non sono disposto a spendere di più per avere quel motore. Essendo un'auto di supporto che guiderà mia moglie la priorità è il rapporto tra prezzo di acquisto e manutenzione e aspettativa di vita: un motore tranquillo va bene e credo che come affidabilità si possa puntare più sul 1.2 che non sul twinair. ,,,,,,,,,,,,,,
Kia Picanto 2011,https://www.autopareri.com/forums/topic/41268-kia-picanto-2011?&page=6#comments,2011-08-24 11:01:39,LucioFire,,ragazzi..ma una sorta di copyright sul design o accessori non c'è ? Perchè quei cerchi mi sembrano terribilmente simili a quelli alfa.. ( stessa cosa per la dr con quelli della punto ) ,,,,,,,,,,,,,,
Museo Alfa Romeo: finalmente il TAR ha respinto il vergognoso ricorso contro il vincolo.,https://forum.quattroruote.it/threads/museo-alfa-romeo-finalmente-il-tar-ha-respinto-il-vergognoso-ricorso-contro-il-vincolo.49441/page-264,2014-07-29 00:00:00,752000ts,"""Ecco l'unico video che ho trovato in rete sulla 2000 sportiva. E'un video in francese http://www.youtube.com/watch?v=9f0IZ4XXyjM""",Bellissimo filmato e bellissima auto ! ! Grazie ,,,,,,,,,,,,,,
Ciao a tutti!,https://www.bmwpassion.com/forum/threads/ciao-a-tutti.340756/,2019-01-15 00:00:00,marcogang96,,Ciao a tutti ! Da poco più di un anno sono un felice possessore di un BMW Serie 1 ho trovato il vostro forum che tratta argomenti interessanti e qyubdu ho deciso poco fa di registrarmi : ) ,,,,,,,,,,,,,,
Suzuki Swift sport 2018,https://forum.quattroruote.it/threads/suzuki-swift-sport-2018.111543/,2017-12-19 00:00:00,pilota54,,"Benvenuto tra noi ""Uomo di ghiaccio"" ( in sostanza la traduzione del nomignolo di Kimi Raikkonen................. ) . Interessante il tuo contributo alla discussione. In pratica il rapporto peso-potenza è sostanzialmente lo stesso della Fiat 124 spider anche se ovviamente sono 2 vetture completamente diverse. Non capisco da cosa derivino i ( ben ) 10 cm in più rispetto alla versione base. Mah. ",,,,,,,,,,,,,,
A3 cabrio,https://www.bmwpassion.com/forum/threads/a3-cabrio.32833/,2006-04-02 00:00:00,sovrasterzo85,,http://www.germancarblog.com/2006/12/audi-a3-cabrio-more-details-and-new.html ,,,,,,,,,,,,,,
"preparatore ""Modena""",https://www.autopareri.com/forums/topic/18922-preparatore-modena?&page=3#comments,2006-03-06 10:21:07,blasf,,dopo la mini ha preso un serie5 in germania ma l'ha già venduta perchè dice che è da vecchio e ora ha già trovato un Z4 ma deve ancora decidere ,,,,,,,,,,,,,,
Colonnina EVAD Fast Municipio Sant'Ilario d'Enza RE Piazzale Eugenio Curiel,https://www.forumelettrico.it/forum/colonnina-enel-fast-a-sant-ilario-d-enza-re-t1540-60.html?sid=b3fb5fad0ffc96dad262d5690582cd95&sid=b3fb5fad0ffc96dad262d5690582cd95,2017-10-18 12:06:00,marco,,Ci vuole un volontario che faccia un appostamento notturno e vedere cosa combinano e chi...,,,,,,,,,,,,,,
IX35 bagagliaio?,https://forum.quattroruote.it/threads/ix35-bagagliaio.34867/,2010-08-09 00:00:00,mommotti,,2 passeggini mi sembra azzardato salvo che siano di quelli compatti che si usano d'estate..... ,,,,,,,,,,,,,,
ahahahahah ALFA GT ahahahahah,https://www.bmwpassion.com/forum/threads/ahahahahah-alfa-gt-ahahahahah.14928/,2004-12-28 00:00:00,DjMarvel,,Oggi sono andato in concessionaria Fiat con mio fratello a provare la nuova punto....aspettando il nostro turno vado a fare un giro tra l'ustato..........cosa ci trovo: Cèrano 4 Lancia lybra sw 2 cinquecento 2 y e poi..... 8 ALFA GT ben otto alfa GT usate....la Gt è uscita da poco.......si capisce che non vale niente ! ,,,,,,,,,,,,,,
Presentazione Alfa Sauber F1,https://forum.quattroruote.it/threads/presentazione-alfa-sauber-f1.115012/,2018-02-21 00:00:00,BufaloBic,"'Sono meno...entusiasta dell'iniziativa perché i costi della F1 si...scaricano sui prezzi di vendita di Giuli Stelvi futura Giulietta ecc... Insomm meglio spendere per sviluppo Giulia coup SUV ""C"" ecc...'",Invece è un'ottima iniziativa. Non i costi ma il futuro dei futuri modelli è legato fra le altre cose anche alla Formula1 ,,,,,,,,,,,,,,
Alfa Romeo 159 1.9 JTS: Test Drive,https://www.autopareri.com/forums/topic/15726-alfa-romeo-159-19-jts-test-drive?&page=16#comments,2005-10-02 01:00:45,ACS,,la polemica è sempre dietro l'angolo ma non mi piacciono quelle sterili e fine a se stesse che non tengono in considerazione tutti i dati... Io non sopporto fiat il loro modo di intendere l'auto etc etc il loro aver voluto di proposito annichilire Alfa Romeo subito dopo l'acquisizione la loro miopia di mercato e la loro arroganza senza tempo nei confronti della clientela.... ...ma visto che il convento è così amministrato e che qualche sforzo in + rispetto agli ultimi 20 anni ultimamente si evince è inutile ad ogni post riesumare il dna di certe scelte xlo+ obbligate da fattori poco industriali e molto finanziari. Allora discorriamo su xkè si è arrivati al punto in cui non si aveva scelta. Cmq non ho sotterrato del tutto l'ascia di guerra ed il wampum... sono vigile sulla collina ,,,,,,,,,,,,,,
Fiat Freemont - Problemi  riscontrati e soluzioni,https://www.autopareri.com/forums/topic/44615-fiat-freemont-problemi-riscontrati-e-soluzioni?&page=137#comments,2015-04-24 21:24:35,pegasuss,,Lavoro fatto sul serraggio bulloni mozzo ruota ! Ora è una piuma ! Stretto con silicone ! Grazie per la dritta... Speriamo il lavoro tenga per un bel po' ,,,,,,,,,,,,,,
IX35 bagagliaio?,https://forum.quattroruote.it/threads/ix35-bagagliaio.34867/,2010-08-25 00:00:00,Rapix74,,mio padre ha l'X35 e ti posso garantire che ha un gran bel bagagliaio se togli la ruota di scorta ed il pianale di copertura c'entra tranquillamente anche una lavatrice quindi secondo me due passeggini messi magari uno sull'altro ci stanno.Sse poi abbatti un sedile ha molto più spazio. Vai tranquillo è molto spaziosa comoda carina e non consuma neanche tanto. Siamo tutti molto soddisfatti. ,,,,,,,,,,,,,,
"Grande Punto 1.3 M-Jet 90 CV Emotion ""J-Gian Edition"" - Riassunto Manutenzione nel 1° Messaggio",https://www.autopareri.com/forums/topic/17976-grande-punto-13-m-jet-90-cv-emotion-j-gian-edition-riassunto-manutenzione-nel-1%C2%B0-messaggio?&page=25#comments,2014-11-02 03:09:24,J-Gian,,"Di recente ho provveduto pure io a montare un parente del tuo ovvero il Pioneer MVH-X560BT che nella pratica si differenzia per non avere il lettore CD ( tanto non lo uso ) e per avere aux ed USB posteriore. Microfono su montante sinistro e cavetto aux + USB che escono nella vaschetta fronte cambio. Mi ci trovo molto bene anche perché suona decisamente meglio dell'originale oltre ad avere la praticità di BT per il vivavoce e per lo streaming audio dal cellulare. Tra l'altro avendo il mio telefono l'NFC ho attaccato ( e scritto opportunamente ) un TAG NFC adesivo sul retro del frontalino per cui mi basta appoggiare sopra il cellulare e mi attiva in automatico il profilo ""Automobile"" con BT e livello suonerie opportuno... Comodo Di scomodo c'è invece il fatto di dover togliere spesso il frontalino ed il fatto che non ho i comandi al volante... Ma quelli non funzionavano già da mo' Il colore invece si può scegliere quindi l'ambra o il rosso ben si addicono. ",,,,,,,,,,,,,,
Abarth  Grande Punto EsseEsse (Topic Ufficiale - 2007),https://www.autopareri.com/forums/topic/28764-abarth-grande-punto-esseesse-topic-ufficiale-2007?&page=35#comments,2007-09-21 08:45:20,ItalianDriver,,Comunque la coppia di 272Nm e da capogiro... Quasi 200Nm/l per un piccolo 1.4 anzi 1368cc ! ! ! ,,,,,,,,,,,,,,
Karoq 1.0 TSI Ambition,https://forum.quattroruote.it/threads/karoq-1-0-tsi-ambition.118669/,2018-10-01 00:00:00,ivanpg,,@gattostanco mi sa che ti ho letto in FB. ,,,,,,,,,,,,,,
Gomme tubless e diffusori posteriori. Cosa ne pensate?,https://www.autopareri.com/forums/topic/14999-gomme-tubless-e-diffusori-posteriori-cosa-ne-pensate,2005-08-26 23:32:06,frallog,,Le vetture di oggi hanno una buona deportanza anteriore. Il problema invece e' tutto della deportanza posteriore. La vecchia lancia Y e la nuova Renault Clio introducono a concetti di estrattore posteriore per vetture di grande serie. Allora io dico che si dovrebbe eliminare la ruota di scorta ( naturalmente in favore delle tubless ) ed alzare il fondo scocca posteriore con un bell'estrattore. E via con tanta deportanza anche nel posteriore. Opinioni in merito sono gradite. Regards Francesco 8 ) ) ) ,,,,,,,,,,,,,,
Campionato kart,https://www.bmwpassion.com/forum/threads/campionato-kart.139552/page-11,2008-09-18 00:00:00,doppiag,,quoto ! vogliamo il training di guida ! ! ! ,,,,,,,,,,,,,,
Fiat Grande Punto (Topic Ufficiale 2006),https://www.autopareri.com/forums/topic/20567-fiat-grande-punto-topic-ufficiale-2006?&page=16#comments,2007-10-01 18:12:50,ykdg1984,,Non lo sapevo... Ottima notizia... per il momento non ho visto nessuna GP con i logo rossi ,,,,,,,,,,,,,,
NAVIGATORE SI O NAVIGATORE NO????,http://www.porschemania.it/discus/messages/22971/339212.html?1229419686,2007-12-15 18:14:00,spacecake,,"E' come avere un handicappato a bordo ! Questa frase \xe8 proprio fuori luogo... si poteva scrivere che hai un deficiente un ubriaco che straparla una qualsiasi altra cosa ma non questa. E' offensiva perch\xe8 si usa una parola che in questo caso inserita in questo thread e contesto vuol dire ""che non \xe8 inteligente"" che ""funziona male"" una specie di offesa... Ma invece si umilia una categoria di persone che hanno una sensibilit\xe0 una vita difficile molti problemi. Che non hanno niente a che fare con un oggetto che deve indicarti una strada una curva un numero civico o un centro commerciale. Scusate per il mio intervento.",,,,,,,,,,,,,,
Kia Cee'd,https://www.bmwpassion.com/forum/threads/kia-ceed.34481/page-2,2004-09-13 00:00:00,Emiliano,"""N questa rimpiazza la (mai esistita nel nostro mercat ma che nel resto d'europa vende) Cerat in pratica è come una Golf/Focus. E' una segmento C (tra le più grandi). La Getz è una segmento B piccola ed è Hyundai non Kia""",dalle foto non è male e la garanzia di 5anni+2 è interessante... ,,,,,,,,,,,,,,
Spese eccessive olio motore tagliando honda cr-v Iii serie,https://forum.quattroruote.it/threads/spese-eccessive-olio-motore-tagliando-honda-cr-v-iii-serie.115290/,2018-03-06 00:00:00,Mafrada,,Mi hanno detto che è un olio molto buono e il prezzo è giustificato. Sinceramente al momento non avevo fatto verifiche di prezzo avevo in mano le fatture dei due tagliandi precedenti che segnalano prezzi inferiori a meno della metà ma non hanno voluto sentire ragioni. Tramite Honda che si è interessata inizialmente alla mia segnalazione hanno ribadito la correttezza dell'importo addebitato mentre Honda mi ha confermato che il prezzo non è in linea con i loro std. Cmq non mollo è una presa in giro. ,,,,,,,,,,,,,,
Fiat 500C M.Y. 2014,https://www.autopareri.com/forums/topic/32509-fiat-500c-my-2014?&page=33#comments,2009-05-28 17:09:33,sarge,,Giusto ma se metti una molla più morbida la ruota sotto carico affonda di più scaricando di più quella sul lato opposto e l'irrigidimento portato dalla barra contrasta la torsione dell'asse riducendo il grip sul lato scarico... Es le superturismo di alcuni anni fa....quando andavano in appoggio si sollevavano completamente nel lato interno ) ,,,,,,,,,,,,,,
per 4600 euro di riparazione un favore si poteva fare?,https://www.bmwpassion.com/forum/threads/per-4600-euro-di-riparazione-un-favore-si-poteva-fare.98765/page-2,2008-04-25 00:00:00,borazzz,,"mi dispiace per lui ma ti devo quotare...come si puo far fare dei lavori ""importanti"" sulla macchina senza chiedere un preventivo ? sei te che lo devi chiedere mica loro che te lo devono dare...io il preventivo lo chiedo su tutto dal tagliando all'inversione delle gomme...dirlo prima no eh...come mai non hai fatto la delega di pagamento alla concessionaria ? evitavi di dover pagare te prima... ",,,,,,,,,,,,,,
Siti di Ricambi BMW: dove acquistare,https://www.bmwpassion.com/forum/threads/siti-di-ricambi-bmw-dove-acquistare.298228/,2011-10-04 00:00:00,fabietto82,'Non so cosa devo fare.',Ragazzi mi sapete dire se esiste un sito dove acquistare i ricambi originali per le nostre amate ? Mi scoccio ogni volta a fare 100 km tra andata e ritorno per ogni cosa ! Grazie ,,,,,,,,,,,,,,
nuova ibiza,https://forum.quattroruote.it/threads/nuova-ibiza.108500/,2017-02-06 00:00:00,f.pier,,Un buon 4 cilindri 16 v aspirato sembrerebbe finita l'assurdità di motoretti micro turbo con tre cilindri ,,,,,,,,,,,,,,
