Titolo,URL,Timestamp,User,(Testo Citato),TESTO,Costruttore,Modello,Brand,Interni,Esterni,Meccanica,Prestazioni,Consumi/Autonomia,Motore,Elettrico,Fuoristrada,Elettronica di Bordo,Manutenzione,Assistenza/Concessionari
Mazda MX-5 2015,https://www.autopareri.com/forums/topic/56165-mazda-mx-5-2015?&page=160#comments,2015-12-15 19:10:25,superkappa125,,A pari allestimento qualcosa in meno. La 2.0 é in allestimento Sport con Blistein e differenziale. ,,,,,,,,,,,,,,
Honda Civic Facelift (Topic Ufficiale - 2008),https://www.autopareri.com/forums/topic/30746-honda-civic-facelift-topic-ufficiale-2008,2008-10-10 17:44:17,Dodicicilindri,,Brutta non è la preferisco decisamente a certe vetture jap totalmente anonime. Le forme così stravaganti però effettivamente possono stancare presto. C'è da dire che non essendo comunissima è una scelta originale. ,,,,,,,,,,,,,,
JIMNY EVOLUTION 2015,https://forum.quattroruote.it/threads/jimny-evolution-2015.93914/,2015-04-04 00:00:00,xdelta15,'Le Jimny sono prodotte in Giappone (Iwata) e sono costruite in maniera impeccabile.',Le Jimny che arrivano in Italia sono prodotte a Linares in Spagna dalla Santana Motors. Magari si potessero avere quelle giapponesi... http://en.wikipedia.org/wiki/Suzuki_Jimny ,,,,,,,,,,,,,,
Scénic XMod - Topic Ufficiale,https://forum.quattroruote.it/threads/sc%C3%A9nic-xmod-topic-ufficiale.14456/page-19,2010-01-13 00:00:00,Phantom65,,"Un saluto a tutti sono un nuovo iscritto nonchè nuovo possessore di una Xmod 1.5 DCI 110CV Lux. L'ho acquistata a fine ottobre... arrivata al concessionario a fine novembre e tenuta bloccata per immatricolarla con l'anno nuovo. Alla macchina già accessoriatissima ho fatto aggiungere la porta USB alla radio la telecamera di parcheggio posteriore e la ruota di scorta. Colore grigio eclisse. Ho reso una Megane Grandtour 1.9DCI di quasi 5 anni e me l'hanno scontata 10500 Euro. Viaggiamo molto specialmente viaggi romagna/sicilia dato che mia moglie è palermitana e proprio lei stanca di auto ""stese"" ( venivamo da due megane SW consecutive ) ha voluto il monovolume. Ho scelto il 1500 perchè girando per concessionari ho visto la difficoltà a ritirare il 1900... me lo hanno detto in tanti e non solo concessionari renault... le cilindrate piccole si rivendono meglio in questo momento... le grosse non le vuole nessuno ( boh ? ) Dopo le prime impressioni di guida devo dire che questo 1500 è molto scattante e a parte un vuoto di motore a 1000 giri che la grandtour 1900 non aveva appena ci si avvicina ai 1500 giri lo scatto diventa prepotente. Diciamo che il motore che avevo precedente era più costante più elastico prendevo tranquillamente le curve da quasi fermo in terza e riprendevo senza problemi.... con il 1500 se quasi ti fermi la seconda è d'obbligo. Ho letto velocemente le 19 pagine di messaggi che avete lasciato in questo topic... e non mi trovo d'accordo in generale con chi dice che il motore è rumoroso.... io venvo da due auto diesel... la megane SW del 2000 era un trattore... montava il 1900 DTI da 100 CV e nell'abitacolo in autostrada il rumore era fastidioso. La grandtour del 2005 silenziosissima... un salto di qualità enorme rispetto alla SW precedente. Questa Xmod 1500 direi che rimane sullo stesso livello... il motore non si sente.... l'altro ieri ho fatto qualche km in autostrada... l'ho spinta facilmente fino ai 140 e l'unica cosa che sentivo ( rigorosamente a radio spenta ) era il fruscio dell'aria. La cosa che per ora mi sta deludendo molto sono i consumi.... non ho ancora fatto verifiche vere... ma se il computerino ha ragione questa auto consuma molto di più della mia ex Megane Grandtour.... e invece dai dati ufficiali Renault dovrebbe consumare di meno.... per ora sono molto distante dai 5 litri per 100km che più o meno vengono previsti quasi in ogni situazione.... spero solo che una volta slegato il motore il consumo si riduca sensibilmente. Verifiche più attendibili ai prossimi pieni. Ho visto che a inizio topic qualcuno ha chiesto se sui cerchi da 17 si possono montare le catene... non ho più trovato messaggi in proposito.... è una cosa che mi sono chiesto anch'io vedendo il poco spazio che c'è intorno alla ruota. Ho però letto di uno di voi che in omaggio ha avuto un set di catene Koenig omaggio dalla Renault... e quindi mi verrebbe da pensare che si possa fare. Una domanda agli smanettoni del navigatore. La prima cosa che ho fatto appena arrivato a casa è stato quello di cercare di duplicare la SD in maniera da tenere nel cassetto l'originale in un cassetto e la copia in auto ai 60 gradi estivi e i meno 10 invernali. Non c'è stato modo... ho provato di tutto.. compreso programmi quasi da hacker per la clonazione delle SD.... ho provato con il semplice backup e ripristina backup del tom tom HOME ma nulla... quando la inserisco nello slot dell'auto mi dice che non può utilizzare quella carta. Ho scritto direttamente alla TOMTOM... penso sia mio diritto avere una copia di sicurezza.... una copia tra l'altro che non servirebbe a nessun'altro... siamo ben lungi dalla pirateria informatica... la mia SD non la può montare uno che acquista un navigatore Standalone o quelli di altre auto... mi pare di aver capito che ogni sd e carta è attivata su quell'auto e solo su quella. Per ora nessuna risposta dalla TOMTOM.... qualcuno di voi ha avuto la stessa idea e l'ha risolta ? Sempre sul TOMTOM.. ho letto sempre qui che per 60 gg gli aggiornamenti della cartina stradale è gratuito.. poi sarà a pagamento..... stessa cosa vale per il software ? quando usciranno aggiornamenti... miglioramenti... bisognerà pagarli o quelli saranno gratuiti ? Grazie a tutti per le info che condividete... appena ho altre impressioni le posterò sicuramente Ciao Luca ",,,,,,,,,,,,,,
Problema sensori pressione gomme nuova Ignis,https://forum.quattroruote.it/threads/problema-sensori-pressione-gomme-nuova-ignis.112351/,2017-09-26 00:00:00,thedriver,,Grazie ! Però 0.3 bar di differenza tra i 2 assi ! Provo un innata simpatia per questa macchinina.. Anzi mi piace proprio ! ! ,,,,,,,,,,,,,,
Maserati Levante 2016,https://www.autopareri.com/forums/topic/60515-maserati-levante-2016?&page=16#comments,2016-02-20 12:37:01,fois.giampiero,,Mi aspettavo di meglio ma non è malvagia ... promossa con la sufficienza la macan la trovo molto più bella ,,,,,,,,,,,,,,
Cosa controllare alla consegna C-Zero Full Electric Seduction,https://www.forumelettrico.it/forum/c-zero-full-electric-seduction-in-arrivo-nuova-vari-dubbi-t5538-20.html?sid=cf320c818113fa0ab266acd3baa36de1&sid=cf320c818113fa0ab266acd3baa36de1,2019-05-06 16:46:00,frank,'certo..pero dicevo..che se domani passa ad auto trifase..e compra nuovo cavo trifase..quello monofase da 32 è piu vendibile di uno d 1 che accontenta pochi potenziali utenti..',Non dimenticare che stiamo parlando di tipo 1 lato auto. in quali auto puoi pensare di usarla in futuro ? ,,,,,,,,,,,,,,
Problema A5 sportback s-line 2016,https://forum.quattroruote.it/threads/problema-a5-sportback-s-line-2016.117531/,2018-07-20 00:00:00,SirPatrick,"'Ciao a tutt mi chiamo Luc ho comprato nell'Agosto del 2016 da concessionario ufficiale un'Audi A5 Sportback s-line nuova. Purtroppo dall'arrivo della primavera/estate di quest'anno la mia aut a nemmeno due anni di vit ha iniziato a mostrare un problema alquanto fastidioso per il confort di guida. Da quando ho acceso il clim tenuto in modalità ""auto (automatico) nell'utilizzare l'auto sento dei rumori continui assimilabili a dei ""ciocchi"" che vengono emessi in maniera più o meno continuata dal cruscott sia dopo l'uscita dell'auto dal garage al mattin ma specialmente quando utilizzo l'auto dopo tempo che è stata parcheggiata con esposizione al sole e questo accade sia se transito su una sconnessione stradal sia quando viaggio su tratti lineari. Questi rumori rendono la guida particolarmente stressante (pure con la radio accesa) al posto di renderla confortevol e ritengo che non sia un aspetto normale in un'auto nuov per altro avente pochi chilometri (circa 13.000 km). Mi sono recato più volte presso la concessionaria dove ho comprato l'aut ma purtroppo nessuno è stato in grado di risolvere questo problem o nessuno l'ha mai considerato seriament mi hanno risposto che può essere dovuto a dilatazioni termiche del cruscotto per alta temperatura/aria fredda o ad invecchiamento progressivo delle plastiche del cruscotto o dei tub e che quindi potrebbe essere un aspetto normale secondo leggi fisiche. Dopo due anni? Mi sembra assurdo... Ho fatto anche il tagliando ""service"" pochi giorni f ho ritirato l'auto e continua a mostrare lo stesso problema. Conosco persone che possiedono Audi e questo problema non ce l'hann tutta l'estate scorsa giustamente non me l'ha fatt io ritengo che sia un fatto tutt'altro che normale quello che sta accadendo. L'esperienza di guida con Audi dovrebbe essere confortevol invece la mia si sta rivelando stressante e la cosa sinceramente mi infastidisce. Qualcuno di voi ha/ha avuto lo stesso problema? Che soluzione avete trovato? Grazie a tutti per l'aiuto.'","Tranquillo che ogni difetto della tua Audi per loro è normale. Anche la mia aveva la condensa nei fari ( xeno ) e altri difettucci sempre considerati ""normali"" dal capo officina. Stanco di essere preso in giro l'ho venduta e ho cambiato marca. In bocca al lupo per tutto. ",,,,,,,,,,,,,,
C-HR 18 Hybrid,https://forum.quattroruote.it/threads/c-hr-1-8-hybrid.117661/page-3,2018-07-28 00:00:00,paulein118,,Se gira in città in effetti non si gode molto la dinamica ,,,,,,,,,,,,,,
Chi indovina?,https://www.bmwpassion.com/forum/threads/chi-indovina.15131/,2004-04-20 00:00:00,Davide,"""Ho avvistato un tuo collega moro con pizzetto su una specie di 612 cammuffat l'altra mattina alle 6.50 a Marzaglia.""",Oggi sulla nuova Estense indovinate un po' le macchine sono 4 ,,,,,,,,,,,,,,
Primo W-E con la RS,http://www.porschemania.it/discus/messages/492693/778671.html?1462899188,2016-05-10 01:27:00,mausone46,In teoria puoi targare e s-targare la macchina a ogni stagione e pagare solo per il periodo primavera-estate. ,in Germania per evitare code primaverili e autunnali alla motorizzazione nel 1998 hanno inventato le targhe stagionali che ognuno puo richiedere a scelta io uso le 03-11 cioe' 01 Marzo fino al 30 Novembre c'e' anche il vantaggio che nel periodo invernale la copertura assicurativa continua ma ad un prezzo bassissimo serve piu che altro per furto e vandalismo ma l'auto deve restare d'obbligo in un garage non riesco a credere che ancora in Svizzera fate sta trafila ( Messaggio modificato da mausone46 il 10 maggio 2016 ) ,,,,,,,,,,,,,,
Forester 2016,https://forum.quattroruote.it/threads/forester-2016.101541/page-7,2016-06-20 00:00:00,hardhu,'Forse defender e land cruiser li fanno passare',Secondo me un Defender sul ghiaccio non va meglio di un Forester...anzi. ,,,,,,,,,,,,,,
Fiat Tipo Hatchback 2016,https://www.autopareri.com/forums/topic/60615-fiat-tipo-hatchback-2016?&page=66#comments,2016-09-03 08:00:14,nogravity,,novità sul metano ? ,,,,,,,,,,,,,,
La 997? E' un'opera d'arte,https://www.bmwpassion.com/forum/threads/la-997-e-unopera-darte.48286/,2005-06-23 00:00:00,csl,,http://www.autoblog.it/post/9949/il-triste-destino-di-una-porsche-997A suo modo lo è ,,,,,,,,,,,,,,
147 m-jet 120cv  a KMO 1000 euro + di Gpunto!!,https://www.autopareri.com/forums/topic/15869-147-m-jet-120cv-a-kmo-1000-euro-di-gpunto,2005-10-02 18:34:32,il FUSI,,Miiiiiiiii di già le 120 ? ? ? ? ? ? ? ? ? ? ? ? ? ,,,,,,,,,,,,,,
Museo Alfa Romeo: finalmente il TAR ha respinto il vergognoso ricorso contro il vincolo.,https://forum.quattroruote.it/threads/museo-alfa-romeo-finalmente-il-tar-ha-respinto-il-vergognoso-ricorso-contro-il-vincolo.49441/page-146,2012-06-22 00:00:00,giampi47,"Le caratteristiche tecniche e le prestazioni erano le medesime della GIULIA 1600 SPRINT-GT e quindi con motore da 106 Cv. DIN pari a 121 - 122 Cv.SAE Il prezzo di listino nel 1965 era di Lit. 2.395.000 - Il ""grande"" Storico Sig. Fus ci dice che : --Nel 1964 furono costruite 106 vetture con guida a Sinistra --Nel 1965 "" "" "" "" "" "" 548 "" "" "" "" "" --Nel 1966 "" "" "" "" "" "" 247 "" "" "" "" "" --Nel 1965 "" "" "" "" "" "" 54 "" con guida a Destra --Nel 1966 "" "" "" "" "" "" 45 "" "" "" "" "" TOT.= Vetture 1.000- Probabilmente in quegli anni la vettura intesa come "" scoperta a 4 posti "" non era appetibile come la classica ""spider"" a 2 posti secchi e pertant almeno sul mercato nostran non ebbe quel favore da parte della clientela Italiana e quella divulgazione che ebbe invece presso altri mercati. Nell' anno 1966 fu presentata la SPIDER 1600 DUETTO e tutti sappiamo quale roboante successo essa ebbe nell' arco degli anni. Bisogna comunque dire che qualche estimatore importante essa lo ebbe: Il Principe Ranieri di Monaco ( di cui alla foto 2681). Sequenza foto = 2681 --- 4275 --- 4276... Gentilissimo Giampi! C'è da dire che era una gran bella vettura. Quindi rimase solo due-tre anni in produzione? Saluti :thumbup: 'Le caratteristiche tecniche e le prestazioni erano le medesime della GIULIA 1600 SPRINT-GT e quindi con motore da 106 Cv. DIN pari a 121 - 122 Cv.SAE Il prezzo di listino nel 1965 era di Lit. 2.395.000 - Il ""grande"" Storico Sig. Fus ci dice che : --Nel 1964 furono costruite 106 vetture con guida a Sinistra --Nel 1965 "" "" "" "" "" "" 548 "" "" "" "" "" --Nel 1966 "" "" "" "" "" "" 247 "" "" "" "" "" --Nel 1965 "" "" "" "" "" "" 54 "" con guida a Destra --Nel 1966 "" "" "" "" "" "" 45 "" "" "" "" "" TOT.= Vetture 1.000- Probabilmente in quegli anni la vettura intesa come "" scoperta a 4 posti "" non era appetibile come la classica ""spider"" a 2 posti secchi e pertant almeno sul mercato nostran non ebbe quel favore da parte della clientela Italiana e quella divulgazione che ebbe invece presso altri mercati. Nell' anno 1966 fu presentata la SPIDER 1600 DUETTO e tutti sappiamo quale roboante successo essa ebbe nell' arco degli anni. Bisogna comunque dire che qualche estimatore importante essa lo ebbe: Il Principe Ranieri di Monaco ( di cui alla foto 2681). Sequenza foto = 2681 --- 4275 --- 4276'",Ciao. Effettivamente era una vettura che si notava. Poi quando la vedevi scoperta..........aveva un certo fascino. Io ricordo di avere visto una delle primissime Giulia GTC di colore Celeste chiarissimo - quasi bianco - di proprieta' di un giovanotto sui 30 anni ( nel 1965 o 1966 ) in una localita' di montagna - d' estate-. Poi ne vidi altra colore Rosso in sede ALFA a Milano-Via Grosotto- di un cliente che la porto' per un tagliando. Poi ( in quegli anni ) non mi capito' piu' di vederne altre . Come gia' detto ebbe piu' estimatori all' estero che da noi. E la produzione .....sì si limito' per soli 3 anni -stando a quanto asserisce il Sig. Fusi - storico dell' Alfa. Ciao. :thumbup: ,,,,,,,,,,,,,,
la batcaverna 635csi &co,https://www.bmwpassion.com/forum/threads/la-batcaverna-635csi-co.85405/page-130,2007-10-14 00:00:00,drifting-doctor,'i cerchi li ho visti domenica su una E3 se accettate lo spam vi faccio vedere una foto!:wink: (chiedo perchè so che a Bat non piacerà...)','zzo ridi ? ! ,,,,,,,,,,,,,,
Civic Type R 2017,https://forum.quattroruote.it/threads/civic-type-r-2017.110133/page-20,2017-09-09 00:00:00,Streamliner,"'Non credo avverrà mai... molto più ""semplice"" che Honda in un prossimo futuro proponga una evoluzione del sistema IMA con potenza del propulsore elettrico maggiorata. Montare 2 motori elettrici direttamente sulle ruote posteriori di una Civic la renderebbe completamente ""altro"".'","La renderebbe forse... Una Prelude Auto che ai tempi fu apprezzata dagli appassionati e si distinse per le soluzioni molto innovative come la première praticamente assoluta delle quattro ruote sterzanti. Forse potremmo aspettarci anche un modello del genere anche se commercialmente parlando il momento per le coupé purtroppo non è esaltante. Speriamo che la nuova Supra e altri arrivi riportano un po' di vitalità nel settore. Comunque non credo che anche per la Civic sia ""mai""... Siamo davvero in un momento di transizione e le auto saranno sempre piú elettrificate... Secondo me si aprirà la strada a soluzioni interessanti sulle sportive piú prestazionali che verosimilmente adotteranno anche schemi e soluzioni per ora riservati a super e hypercar. Com'é normale dal punto di vista dell'evoluzione tecnologica... ",,,,,,,,,,,,,,
Suzuki jimny 2018,https://forum.quattroruote.it/threads/suzuki-jimny-2018.112081/,2017-09-02 00:00:00,A-80,,Si il Jimny è specialistico e non credevo mantenesse il telaio a longheroni. Diventerà un unicum salvo vedere il wrangler venturo ( 2018 ) che parrebbe simile all'attuale ,,,,,,,,,,,,,,
Mi Presento con la mia ragazzaccia..,http://www.porschemania.it/discus/messages/502415/597278.html?1328815079,2012-02-08 15:17:00,tunerdavide_13,,gli scarichi SUPER SPRINT che hai montato sono quelli omologati o racing........io con quelli racing mi trovo benissimo sia come sound che come prestazioni c'\xe8 molta differenza con l'originale.,,,,,,,,,,,,,,
Abarth 500 2008 (Topic Ufficiale),https://www.autopareri.com/forums/topic/27296-abarth-500-2008-topic-ufficiale?&page=32#comments,2008-05-18 21:36:24,superkappa125,,Spero davvero però voglio prima vederla dal vivo anche se sono sicuro che sarà così ! ,,,,,,,,,,,,,,
Mondiale F.1 - GP d'Australia 2018,https://forum.quattroruote.it/threads/mondiale-f-1-gp-daustralia-2018.115435/page-6,2018-03-18 00:00:00,automoto3,,"Il TP rappresenta una fascia di alta altissima società... forse non è lì per puro caso forse al Marchio può anche andar bene questo ruolo di eterno secondo di perenne rincorsa al podio e pure a MB gli torna a favore l'avere come avversario un autentico mito dell'automobilismo. Potrebbero aver concordato le rispettive parti e relativi guadagni sia come sponsor e sia come partecipanti in F1 ( e Ferrari ne prende anche di più con il fatto di essere Scuderia storica ) con il risultante reciproco beneficio di mantenere alto il livello di vendite dei rispettivi modelli stradali ... ecco che un tipetto come Arrivabene - che magari a noi risulta goffo e inadeguato - per questo ruolo e per la clientela cui si rapporta il Cavallino diventa di colpo persona graditissima ! Alonso ? Lui forse aveva capito tutto ( anche se il suo Sponsor non lo rendeva certo una verginella ) e non riusciva a sopportare questo clima falso o non era riuscito a cucirsi un suo ruolo di ultra costosa ""comparsa"" in questo film anche perché lui la comparsa ... non la saprà mai fare ! ! ",,,,,,,,,,,,,,
I futuri benzina Alfa Romeo: TBi & V6 (Riassunto a Pag.1),https://www.autopareri.com/forums/topic/23873-i-futuri-benzina-alfa-romeo-tbi-v6-riassunto-a-pag1?&page=126#comments,2008-09-01 14:02:17,TonyH,,Mai dire mai i V6 in poco più di 4 metri ce li infilavano già 15 anni fa....... ,,,,,,,,,,,,,,
Audi A3 3.2 quattro,https://www.bmwpassion.com/forum/threads/audi-a3-3-2-quattro.14909/,2004-06-10 00:00:00,DESHI BASARA,El Nino ha scritto: Da 23-24000€... solo ... Ha mercato una compatta 3.2 a trazione integrale da 250CV? La gente vuole solo i tiddia e spende 30000€ per un 2003. ' El Nino ha scritto: Da 23-24000€... solo 'Da 23-24000€',Quanto chiedono per un'A3 3.2 quattro usata ? Non trovo quotazioni da nessuna parte ,,,,,,,,,,,,,,
Alfa Romeo Giulietta M.Y. 2016,https://www.autopareri.com/forums/topic/60562-alfa-romeo-giulietta-my-2016?&page=63#comments,2017-09-20 13:51:00,saven,,Peccato... ed io che speravo di uscire dal conce con qualche soldo in più... comunque configurando una GPL mi viene più o meno 21000 scontata... non me la posso permettere ora... posso rimanere sereno ! ,,,,,,,,,,,,,,
Problemi con il sistema di navigazione,http://www.porschemania.it/discus/messages/22971/483541.html?1330621181,2010-09-14 19:14:00,docomand,,Grazie Silvano.. con le tue indicazioni precise ho risolto il problema del navigatore ( unico inconveniente le viti che non \xe8 possibile svitare con un comune cacciavite a stella ma ho risolto subito prendendo quello apposito.. ) ed ho trovato anche la presa accendisigari sotto il vano portaoggetti.. che non sapevo nemmeno che esistesse.. Questo forum \xe8 una vera salvezza.. ! ! :- ) ,,,,,,,,,,,,,,
Scénic XMod - Topic Ufficiale,https://forum.quattroruote.it/threads/sc%C3%A9nic-xmod-topic-ufficiale.14456/page-273,2011-01-17 00:00:00,FSA,"""Buongiorno a tutt questo fine settimana ho potuto finalmente fare qualche km con la mia nuovissima xmo sono ancora all'inizio intendiamoc solo 300 k ma per il momento sono contentissimo della mia scelt volevo chiedere a cho la possiede da un po ho letto che per i primi 1500 km è consigliato non superare i 2500 gir serve per caso per fari abituare il motore a spingere anche sotto quella soglia o altro?altra cos per l'assistenza alla partenza in salita devo inserire il freno di stazionamento?""",Gli accorgimenti principali sono quelli di non strapazzare il motore a freddo e una volta che sarà riscaldato a dovere viaggiare tentando di variare il regime il più possibile senza però portarlo a giri troppo alti ( magari non superando i 2500 che indicavi tu ) . Sono proprio le variazioni di marcia che permettono di ottenere un migliore accoppiamento delle parti in movimento. ,,,,,,,,,,,,,,
[Mai Nate] Alfa Romeo,https://www.autopareri.com/forums/topic/30865-mai-nate-alfa-romeo?&page=11#comments,2008-11-18 23:11:37,PaoloGTC,,Intendi 5 anni dopo la nascita di 90 ? Allora la macchina in questione sarebbe di proprietà Alfa sul serio cioè non di un privato che ha montato i cerchi perchè la foto se non sbaglio viene da un GM non troppo lontano dalla nascita di 90... i cerchi quindi non erano ancora in vendita se sono nati 5 anni dopo. Non è una foto dell'89 o 90 per dire... Aggiungo perchè incuriosito sono andato a rivedere. L'Alfa 90 in questione apparve su GM del luglio 1986. ,,,,,,,,,,,,,,
Nissan Qashqai 2014,https://www.autopareri.com/forums/topic/53377-nissan-qashqai-2014?&page=9#comments,2014-02-01 23:42:19,luca90,,No cambio classico con il 1.6 130cv e 4 ruote motrici. ,,,,,,,,,,,,,,
Dove producono la ypsilon?,https://www.autopareri.com/forums/topic/15690-dove-producono-la-ypsilon,2005-09-26 04:19:05,mrathlon900,,Melfi ( credo ) ,,,,,,,,,,,,,,
slr mclaren brabus,https://www.bmwpassion.com/forum/threads/slr-mclaren-brabus.10981/,2004-06-20 00:00:00,Raoul,'come va la enzo gabri..???? ',http://autoblog.it/post/slr-mclaren-brabus che mostro ! ,,,,,,,,,,,,,,
Costi tagliandi Kia Venga?????,https://forum.quattroruote.it/threads/costi-tagliandi-kia-venga.46980/page-3,2011-04-20 00:00:00,gabrj73,,scusate a quanti km bisogna fare il primo tagliando ? la mia e' la fullsky 1400 diesel ,,,,,,,,,,,,,,
Quattro Audi,https://www.bmwpassion.com/forum/threads/quattro-audi.27952/,2004-11-18 00:00:00,El_Nano,,La trazione Quattro Audi è 50-50 oppure è sbilanciata a favore del posteriore ? ,,,,,,,,,,,,,,
Tuning e rimappature: miti e leggende,https://www.autopareri.com/forums/topic/63102-tuning-e-rimappature-miti-e-leggende?&page=2#comments,2017-05-01 12:18:36,Nicola_P,,Probabilmente perchè hanno studiato un sistema di deroghe ben controllato. Sanno che se regolarizzano il tutto facendo degli accurati controlli solo poche persone lo fanno sganciando dei bei quattrini e non 300€ da Beppi il rimapparo. Sarebbe possibile tutto ciò in Italia ? Non sappiamo manco fare le revisioni figurati. ,,,,,,,,,,,,,,
Censimento.,https://forum.quattroruote.it/threads/censimento.87/page-2,2009-04-18 00:00:00,Allerg,,Rx 400h ottobre 2005 perfetta.Non rimarrai assolutamente deluso. ,,,,,,,,,,,,,,
Bentley Continental GT 2018,https://www.autopareri.com/forums/topic/63633-bentley-continental-gt-2018?&page=5#comments,2017-08-30 12:47:31,Beckervdo,,più questa: ,,,,,,,,,,,,,,
5 stelle euroncap per Croma,https://www.autopareri.com/forums/topic/16423-5-stelle-euroncap-per-croma,2005-10-25 20:01:58,Prestige,,meglio il mio :lol::lol::lol: ,,,,,,,,,,,,,,
Ciao a tutti!,https://www.forumelettrico.it/forum/topic5574.html?sid=9b3d6660a00250109c0902db2fb0b90b,2019-05-09 23:05:00,marco,,Ciao butta e benvenuto nel forum. Per qualsiasi domanda o dubbio non esitare a chiedere ma fallo sempre nella sezione più corretta del forum usando un titolo chiaro ed affrontando un solo singolo argomento per discussione. Grazie per la comprensione,,,,,,,,,,,,,,
Porsche Taycan: negli USA 3 anni di ricariche rapide incluse fino a 350 kW - HDmotori.it,http://www.hdmotori.it/2019/01/29/porsche-taycan-3-anni-ricariche-incluse-usa-350-kw/,2019-01-29 10:17:00,CAIO MARIOZ,,Ci vuole la concorrenza ma finora VAG non ha tirato fuori nulla nonostante i proclami per il 2018 fatti negli anni precedenti pure Audi e-Tron non si è ancora vista,,,,,,,,,,,,,,
Buona settimana dal 2/10 al 8/10,https://forum.quattroruote.it/threads/buona-settimana-dal-2-10-al-8-10.112570/page-2,2017-10-08 00:00:00,Serpinik,,Ciao combriccola ! Spero che abbiate passato una buona domenica per me tutto ok a parte il travaso di bile per la Ferrari ,,,,,,,,,,,,,,
599 GTB-Test di Best Motoring,https://www.autopareri.com/forums/topic/23293-599-gtb-test-di-best-motoring?&page=9#comments,2007-05-07 09:52:51,Marco Switar,,No la differenza a quanto riportano i test è davvero minima. Anche Evo dice che si tratta di sfumature dato che adesso entrambi i modelli montano le semislick. Ad Hockenhei come avrai letto rifila poco più di mezzo secondo alla normale ( e così stacca un sensazionale 1.11.1 ) ma al Nurburgring il tempo è lo stesso ( ma secondo la casa 3 secondi in meno rispetto alla normale può farli ) . Differenze comunque piccolissime anche in accelerazione. A Monza a mio parere più di un secondo non può togliere. ,,,,,,,,,,,,,,
