Titolo,URL,Timestamp,User,(Testo Citato),TESTO,Costruttore,Modello,Brand,Interni,Esterni,Meccanica,Prestazioni,Consumi/Autonomia,Motore,Elettrico,Fuoristrada,Elettronica di Bordo,Manutenzione,Assistenza/Concessionari
Bugatti Veyron - i dati sul consumo !!!!!,https://www.bmwpassion.com/forum/threads/bugatti-veyron-i-dati-sul-consumo.54659/,2005-06-23 00:00:00,csl,,Per pura casualità ho trovato questo annunciohttp://www.autoscout24.it/NewMarketDetails.aspx ? id=115583463a parte il prezzo che tutti conoscono ho trovato i dati sul consumo e altre curiosità... da paura BUGATTI VEYRON 16.4 È LA PIÙ POTENTE COSTOSA E VELOCE AUTOVETTURA DI SERIE PRODOTTA NEL MONDO CON UNA VELOCITÀ MASSIMA DI 407 KM/H. HA RAGGIUNTO LA PIENA PRODUZIONE NEL SETTEMBRE 2005. PRENDE IL NOME DAL PILOTA PIERRE VEYRON CHE VINSE LA 24 ORE DI LE MANS NEL 1939 CORRENDO CON UNA BUGATTI. QUESTO MOTORE POSSIEDE QUATTRO TURBOCOMPRESSORI ED È IN GRADO DI PRODURRE 1001 CAVALLI DI POTENZA ( IN REALTÀ I CAVALLI SONO CIRCA 1040 MA PER MOTIVI DI MARKETING SI DICE CHE SIANO 1001 ) . LA VEYRON PASSA DA 0 A 100 KM/H IN 2 5 SECONDI. RAGGIUNGE SEMPRE DA FERMA I 200 E I 300 KM/H RISPETTIVAMENTE IN 7 3 E 16 7 SECONDI. DA NOTARE CHE LA VEYRON PASSA DA 0 A 200 MPH IN MENO TEMPO DI QUANTO NE IMPIEGHI LA MCLAREN F1 PER PASSARE DA 120 A 200 MPH: QUESTO RENDE LA VEYRON L'AUTO STRADALE CON LA MIGLIORE ACCELERAZIONE DELLA STORIA. INOLTRE CONSUMA PIÙ CARBURANTE DI QUALSIASI ALTRA AUTO: UTILIZZA INFATTI 40 4 L/100 KM ( 2 475 KM/L ) IN CITTÀ E 24 1 L/100 KM ( 4 149 KM/L ) IN CIRCUITO MISTO. ALLA MASSIMA ACCELERAZIONE CONSUMA OLTRE 125 L/100 KM ( 0 8 KM/L ) : ALLA MASSIMA VELOCITÀ IL SERBATOIO DELLA VEYRON ( 100 L ) VERREBBE SVUOTATO IN APPENA 12 MINUTI E MEZZO DATA LA SUA VELOCITÀ MASSIMA IN TALE TEMPO SAREBBE IN GRADO DI PERCORRERE OLTRE 80 KM. ,,,,,,,,,,,,,,
Vag - 1.6 TDI,https://www.autopareri.com/forums/topic/32040-vag-16-tdi,2009-01-11 15:34:35,simonepietro,,Messaggio Aggiornato il 27/08/2009 da WARDS. ,,,,,,,,,,,,,,
File mp3 e cavo iPhone/iPod su Cay Turbo con PCM2,http://www.porschemania.it/discus/messages/22971/508993.html?1329925946,2010-05-17 21:32:00,lord_brummel,,Lo so che l'argomento era stato trattato ma speravo esistessero soluzioni pi\xf9 spartane tipo un semplice cavo...:- ) ) Mi ressegno..:- ) ) Ma con il Dimension Gateway utilizzerei anche i coma di al volante ? ? cio\xe8: posso visualizzare tracce e palylist sul display del PCM e sul cruscotto ? La macchina ha ovviamente il telefono ( ho provato oggi con la mia sim e finge davvero benissimo sia per parlare che per mandare/ricevere sms ) Con questo sistema avrei lo stesso risultato ? ? vale a dire posso usare il telefono col volante visualizzando i dati sul display ed il cruscotto ? ? ? Un idea di spesa ? ? ? Funge anche con 2 telefoni contemporaneamente ( iPhone e Blackberry 8900 ) ? ? Per usare l'iPhone cx ascoltare la musica devo cmq collegarlo fisicamente col cavo che immagino faccia parte del Kit in questione ? ? Per intanto grazie mille ( Messaggio modificato da lord_brummel il 17 maggio 2010 ) ,,,,,,,,,,,,,,
SONDAGGIO: CONCESSIONARI IN - CONCESSIONARI OUT,https://www.bmwpassion.com/forum/threads/sondaggio-concessionari-in-concessionari-out.21503/page-6,2007-03-01 00:00:00,PAOLO 335i Coupè Attiva,"""Io mi sono trovato bene da Carzeta a Milano per l'acquisto di un nuovo....va beh che non avevo usato da rendere ......vedremo in futuro con l'assistenza ...... Sperando di essere stato utile specie ai milanes saluto tutti !!""",ho trovato questo post molto interessante ma non avendo la voglia di leggere tutte le pagine che certamente aumenteranno vorrei proporre un'idea..... ci vorrebbe qualcuno che si prendesse la briga di aggiornare la prima pagina dividendo magari l'italia x regione.magari cosi:VENETO : verona - fimauto di s.martino - e poi si descrive vicenza - blabla di lonigo - .........SICILIA : palermo- ..........che ne dite ? ? ? ? altrimenti un post che poi si sviluppera' in decine di pagine diventera' completamente inutilecosi quelli che fanno i furbi imparano.......mica siamo polli da spennare ! ! ! ! ,,,,,,,,,,,,,,
Alfa Romeo - 3.0 M-Jet V6,https://www.autopareri.com/forums/topic/22754-alfa-romeo-30-m-jet-v6?&page=59#comments,2009-06-17 19:05:30,Zyx,,ora c'è una data per la commercializzazione di questo motore ? ? ? ,,,,,,,,,,,,,,
Alfa Romeo MiTo (Topic Ufficiale - 2008),https://www.autopareri.com/forums/topic/27704-alfa-romeo-mito-topic-ufficiale-2008?&page=705#comments,2008-07-14 18:58:35,ACS,,Andata TONI mi sa che mi servirà un favorello ci sentiamo tra uan decina di gg 8 ) ,,,,,,,,,,,,,,
Fiat 500X MY 2017,https://www.autopareri.com/forums/topic/62380-fiat-500x-my-2017?&page=145#comments,2015-01-23 13:22:35,mjdj147,,Magari potresti prendere 2 piccioni con una fava se mettono il t-jet 120cv gpl ,,,,,,,,,,,,,,
Ho SSSrotolato e . GT3 sia!,http://www.porschemania.it/discus/messages/492693/727215.html?1446485765,2015-02-10 14:43:00,yeti911,,ottimo acquisto bellissima a me il parassi nero piace parecchio mentre il baffo rigorosamente nero. In merito al sound ho visto che Sharkwerks propone il bypass solo del silenziatore centrale lasciando le pance qualcuno lo conosce l'ha provato/sentito ? Pare che il sound sia bellissimo meglio del cup e soprattutto non esclude le due modalit\xe0 di sonorit\xe0. Ovviamente il cup da un vantaggio in termini di peso perch\xe8 elimina le pance...,,,,,,,,,,,,,,
Mercedes-Benz G63 AMG 6x6 2013,https://www.autopareri.com/forums/topic/50829-mercedes-benz-g63-amg-6x6-2013?&page=5#comments,2013-03-02 11:42:39,Martin Venator,,Chissà se sul cassone dietro si può montare una mitragliatrice ? ,,,,,,,,,,,,,,
Pressione pneumatici BMW X1,https://forum.quattroruote.it/threads/pressione-pneumatici-bmw-x1.113594/,2017-12-02 00:00:00,Luke973,,Salve a tutti mi sono appena iscritto al forum e esordisco subito con una domanda..... Ho messo le gomme 4 stagioni sulla mia X1 ( xdrive ) . Me le hanno montate co pressione 2.5 tutte e 4. Curiosando su internet vedo che è suggerita i a pressione di 2.2 davanti e 2.6 dietro..... perché le posteriori dovrebbero essere più gonfie ? ? ? ? Ora controllero cosa dice il libretto..... Qualcuno ha una spiegazione ? Grazie un saluto a tutti ! ,,,,,,,,,,,,,,
Kia Sportage - Problemi riscontrati,https://www.autopareri.com/forums/topic/42134-kia-sportage-problemi-riscontrati?&page=93#comments,2011-10-04 15:24:02,mause 80,,se scorri tutta la pagina la trovi scritta e diceva di rivolgersi al concessionario in pi dice anche che c'e l'aggiornamento per il navigatore ora vedo se la trovo e ti dico il giorno esatto eccomi qui ! ! ! ! dice di contattare la propria concessionaria e di chiedere informazioni riguardo la circolare inviata da kia il 29/09/2011 la circolare e' KFE11-E970-SL spero per te che sia vero in bocca al lupo ,,,,,,,,,,,,,,
Anche Porsche abbraccerà l'elettrico!,https://forum.quattroruote.it/threads/anche-porsche-abbraccer%C3%A0-lelettrico.116683/,2018-10-19 00:00:00,bumper morgan,,Taycan http://motori.ilgiornale.it/porsche-taycan-incontro-ad-alta-tensione/ ,,,,,,,,,,,,,,
Alfa Romeo 4C 2013,https://www.autopareri.com/forums/topic/56324-alfa-romeo-4c-2013?&page=940#comments,2014-11-24 11:46:17,pennellotref,,"Considera che a Los Angeles Haraldo ed il ""culturista canadese"" hanno detto che la scorsa settimana hanno intimato ai concessionari americani di sospendere le prese d'ordine al momento a tempo indefinito causa liste d'attesa di dimensioni ""cosmiche"" . Credo che Maglione è ora che prenda seriamente in considerazione un ulteriore integrazione dell'investimento per la produzione della scocca che è il collo di bottiglia di tutto il processo perchè 18-24 mesi d'attesa sono intollerabili..............mica è la Ferrari c@zzo ! . Se poi consideriamo che sono in arrivo la spider e la Quadrifoglio.......... ",,,,,,,,,,,,,,
Mi presento,https://www.bmwpassion.com/forum/threads/mi-presento.342944/,2019-03-03 00:00:00,Zubo76,,Salve ho una bmw 220i msport del 2016 cambio manuale.Ci ho messo tanto a trovare una 20i manuale visto che nuova da giugno quando ho deciso di comprarla ( volevo comprare la serie 1 ) non lo facevano più.Sono per il cambio manuale. ,,,,,,,,,,,,,,
Soluzioni e innovazioni tecniche,https://forum.quattroruote.it/threads/soluzioni-e-innovazioni-tecniche.116506/,2018-06-01 00:00:00,mani in alto,"""Considerazione sul mistero della batteria Ferrari e sui BlaBla di questi ultimi giorn la FI l'Hardware aggiunt i sensor ecc ecc. I vincoli del Regolamento riguardano moltissimo il K e i 120 kW. Per quanto riguarda Batteri CE e soprattutto le limitazioni sono meno rigide e - forse - un po confuse. In pratic potrebbe essere possibile costruire e montare H con un doppio avvolgimento attivo.""",Ora come ora per noi esterni é dura capire cosa e come sia stato cercato dalla FIA sulla vettura Ferrari. Presumo si stesse cercando un eccesso di corrente fuori regolamento sui motogeneratori e verso le batterie solo che siccome l'mgu-h ha dei limiti piuttosto vaghi non si é trovato un punto per cui la PU di maranello era illegale. ,,,,,,,,,,,,,,
NUOVO COMPASS,https://forum.quattroruote.it/threads/nuovo-compass.111247/page-2,2017-11-21 00:00:00,andreaf5227,,Una Giulietta.... ,,,,,,,,,,,,,,
[Introvabile] Mitsubishi LANCER EVO 9 -NUOVA-,https://www.bmwpassion.com/forum/threads/introvabile-mitsubishi-lancer-evo-9-nuova.50585/,2005-09-22 00:00:00,Cristiano120dRm,,"Ciao a tutti ! Come da oggetto porto alla luce un fatto alquanto ""triste"" appena successo.Dopo mesi e mesi di decisioni ripensamenti peripezie varie un mio carissimo amico compagno di mille avventure ha finalmente venduto la sua auto ""particolare"" e quindi liberi da impegni lo scorso sabato siamo andati presso Bepi Koelliker ( Mitsubishi Milano ) per ordinare una Lancer EVO 9 nuova.Il venditore alquanto imbarazzato ci comunica che le vetture in questione sono esaurite ( nonostante prima dell'estate durante un sopralluogo ci avesse assicurato enorme disponibilità ) in quanto ne avevano una scorta di 20pezzi che nei mesi di agosto e settembre sono stati tutti ""incredibilmente"" venduti.L'ultima era lì in vetrina già venduta.Mi sono rivolto ad altri concessionari Mitsubishi della provincia ed effettivamente dopo qualche telefonata tutti mi hanno confermato la cosa.Ora premettendo che questo mio amico non ha nessuna intenzione di acquistare la EVO 10 ( in uscita per fine anno ) per svariati motivi sareste in grado di indicarmi dove trovare una Lancer EVO 9 nuova o km. 0 ? Ci sarebbe anche il vincolo del colore ( rossa ) ma su questo forse riusciamo a sorvolare...Ho cercato su autoscout24 e in giro per internet ma tanti promettono il mondo e poi sotto richiesta specifica non hanno nulla. ( Pagamento tutto e subito quindi non abbiate timore ad indicarmi amici o conoscenti in quanto non complichiamo la vita a nessuno con pratiche di finanziamento o leasing vari ) .Grazie a chiunque sappia darmi una dritta DavideG. ",,,,,,,,,,,,,,
Avvistamenti Ferrari,https://www.autopareri.com/forums/topic/13560-avvistamenti-ferrari?&page=11#comments,2008-11-22 11:40:10,SaiKiSono,,a me sembrano bianche le striscie ,,,,,,,,,,,,,,
Una Thesis da 300.000 Km,https://www.autopareri.com/forums/topic/14058-una-thesis-da-300000-km?&page=2#comments,2005-07-07 11:01:55,Betha23,,Speriamo col rest della thesis.......... anche se io credo molto in un colpo di scena con comparsa di 3.6 e 2.8 Cadillac da 258 e 220cv...... ,,,,,,,,,,,,,,
New RIO?,https://forum.quattroruote.it/threads/new-rio.56494/page-5,2011-11-04 00:00:00,freddie1960,,C'è la prova sul sito della Rio 1.1 ,,,,,,,,,,,,,,
Kia Rio,https://forum.quattroruote.it/threads/che-meraviglia-di-kia.108266/,2017-01-19 00:00:00,xander71,,Stupenda ,,,,,,,,,,,,,,
I Prossimi Modelli Alfa Romeo (Solito Loop...),https://www.autopareri.com/forums/topic/27745-i-prossimi-modelli-alfa-romeo-solito-loop?&page=85#comments,2008-07-06 12:34:05,PANDA,,Pur essendo un grande nostalgico della vecchia filosofia AR transaxle accarezzo l'idea di un remake di 156. Piccola leggera super tecnologica TA. Una nuova filosofia che elimina il superfluo che punta alla leggerezza e surroga con raffinatezze digitali le meccaniche complesse e pesanti di un tempo. Viva 944 TA Hi-tech ,,,,,,,,,,,,,,
Autobloccante Q2,https://www.bmwpassion.com/forum/threads/autobloccante-q2.31379/,2006-06-09 00:00:00,gimax,,ebbene sì.............................anche Alfa Romeo monta un autobloccante torsen.....................Speriamo che finalmente Bmw si svegli ! http://www.autoblog.it/post/5900/alfa-147-q2-e-gt-q2 ,,,,,,,,,,,,,,
provata A5 3.0tdi quattro,https://www.bmwpassion.com/forum/threads/provata-a5-3-0tdi-quattro.48749/page-2,2006-06-09 00:00:00,gimax,'in effetti con la E92 viaggi bene in con la A5 viaggi in 2 perché i posti dietro sembrano disegnati su un pannello.... assurdo',forse come dici tu è meno gustosa vicino al limite forse più facile.................ma tremendamente efficace e a prescindere dal motore che imho spinge di più rispetto al 3.0d ( è molto più emozionale :wink: ) dà l'impressione che il limite della macchina sia superiore rispetto alla e9X ( non so la X-drive quella non l'ho mai provata ) il consiglio che vi dò è quella di provarla..........................e poi di giudicarla i vecchi pregiudizi su Audi ...................potrebbero dissolversi in pochi km :wink: ,,,,,,,,,,,,,,
Jaguar XJ Facelift (Topic Ufficiale - 2006),https://www.autopareri.com/forums/topic/20837-jaguar-xj-facelift-topic-ufficiale-2006,2007-01-25 13:17:28,Touareg 2.5,,WCF ,,,,,,,,,,,,,,
Quali saranno i prossimi motori di Thesis?,https://www.autopareri.com/forums/topic/2529-quali-saranno-i-prossimi-motori-di-thesis,2003-11-02 15:14:57,Lanciaboxer,,"Ciao Frick e benvenuto... tu l'hai provata la famosa Thesis 4.2 ? ? Come si comporta in termini di sottosterzo con ( immagino ) un peso e potenza non indifferenti per una TA ? Ho letto alcuni giudizi di guida sulla Volkswagen Phaeton a trazione anteriore ccche dovrebbe avere pesi e massa paragonabili a thesis e i giudizi erano assolutamente negativi ( ovviamente non parlo di cio che scrivono i giornali ma di alcuni ""amici"" molto eseprti del settore che sanno ben valutare le auto ) .... Insomma Thesis 4.2 è nella stessa situazione ? ? Poi che cavolo è sta storia che nel gruppo Fiat non si riescono a fare cambi che non reggono a quei livelli di un diesel da 200cv ? E infine ho ( purtroppo ) letto che Thesis ha spazi di frenata un po lunghi ( pesa troppo ) .. ci si sta lavorando a questo ? ... Magari allegerendola ? ",,,,,,,,,,,,,,
Legge di stabilità..ecco perché Renzi si definisce rottamatore,https://www.bmwpassion.com/forum/threads/legge-di-stabilit%C3%A0-ecco-perch%C3%A9-renzi-si-definisce-rottamatore.243850/,2007-01-03 00:00:00,redi-one,,Ragazzi forse qualcuno lo sa già qualcun'altro ci rimarrà male come ci son rimasto io..Ma sembra che la nuova legge di stabilità porterà una novità o meglio per tutti coloro che come me possiedo un auto iscritta asi o qualche anno fa l'hanno acquistata e conservata e mantenuta nell.attesa che compia 20 anni per poterla iscrivere asi e godere di qualche meritato beneficio fiscale ebbene..sembra che Renzi voglia far pagare il bollo normalmente a tutte le auto asi che hanno anche dai 20 anni in su.. sino ai 30 anni di età..fate voi le vostre conclusioni ma soprattutto fate girare la voce di questa proposta assurda e scellerata..altro che raccolta firme per abolizione del super bollo..qua si tratta di un vasto parco di auto che hanno fatto la storia che rischiano di sparire o meglio d'essere rottamate..per tanto chiamate ai vostri club divulgate la notizia in qualsiasi modo e speriamo solo che l.asi faccia sentire la sua voce per una volta tanto che c'è ne veramente bisogno.. ,,,,,,,,,,,,,,
Museo Alfa Romeo: finalmente il TAR ha respinto il vergognoso ricorso contro il vincolo.,https://forum.quattroruote.it/threads/museo-alfa-romeo-finalmente-il-tar-ha-respinto-il-vergognoso-ricorso-contro-il-vincolo.49441/page-63,2011-10-14 00:00:00,75TURBO/TP,"giampi47 ha scritto: Ancora un saluto a MEROSI ed a 75 e mi scuso se interferisco nei mess. dedicati agli aerei postati dall' amico 75 ma ho trovato 3 foto che vi desidero postare . Grazie. Ciao. ... Ma quale interferenza non aspettavo altr quel periodo mi interessa particolarmente sopratutto le imprese di Italo Balbo. ... I mezzi di Balbo montavano motori Alfa? "" giampi47 ha scritto: Ancora un saluto a MEROSI ed a 75 e mi scuso se interferisco nei mess. dedicati agli aerei postati dall' amico 75 ma ho trovato 3 foto che vi desidero postare . Grazie. Ciao. ... Ma quale interferenza non aspettavo altr quel periodo mi interessa particolarmente sopratutto le imprese di Italo Balbo. ""Ancora un saluto a MEROSI ed a 75 e mi scuso se interferisco nei mess. dedicati agli aerei postati dall' amico 75 ma ho trovato 3 foto che vi desidero postare . Grazie. Ciao. """,Ti ha gia' risposto fpaol il preferito da Italo Balbo fu l'S55 Savoia Marchetti che montava due motori Isotta Fraschini da 880cv ciascuno con questo idrovolante fece varie trasvolate oceaniche. Attached files /attachments/1133779=6531-Balbo-sigarette.jpg /attachments/1133779=6533-Balmo-arrivo.jpg /attachments/1133779=6532-Balmo-Chicago.jpg ,,,,,,,,,,,,,,
Specchi retrovisori riscaldati... poco.,https://forum.quattroruote.it/threads/specchi-retrovisori-riscaldati-poco.114003/page-2,2017-12-29 00:00:00,gnpb,'Il riscaldamento degli specchi esterni funziona solo a motore acceso e fino ad una temperatura esterna di +20°C.',Mah sicuramente sulle altre 2 non erano più rapidi del lunotto ma nemmeno così lenti e al tatto sono belli caldi addirittura da fermo con fuori vicino allo zero fanno fumo. Sull'octavia non li ho mai visti fumare ma comunque il vetro è bello caldo. Da libretto ( Octavia 2011 ) : Io mi ricordavo temperature più basse e anche un tempo limite ma sul libretto dell'app c'è scritto così devo vedere il cartaceo. Se disattivi lo s&s non dovrebbe esserci motivo per il quale debbano essere spenti contro la tua volontà temperature esterne e timer permettendo ma almeno sotto i 10° e 20' di funzionamento continuo li devono fare ovviamente a motore acceso. ,,,,,,,,,,,,,,
Cambio Porsche- Consigli Cercasi,http://www.porschemania.it/discus/messages/502415/277391.html?1185266221,2007-07-22 07:32:00,rss,,ma s\xec che esisteva poi siccome si rompeva prima ancora di essere commercializzata hanno fatto la 3.4 che durava un po' di pi\xf9 ovviamente scherzo sia su 3.2 che su 3.4 che le pi\xf9 funzionano benissimo senza problemi anche dopo 100.000 km,,,,,,,,,,,,,,
Scénic XMod - Topic Ufficiale,https://forum.quattroruote.it/threads/sc%C3%A9nic-xmod-topic-ufficiale.14456/page-89,2010-03-31 00:00:00,daviducc072,massimo.grossi ha scritto: Quale è il particolare che ti fa sapere che è una Luxe a prima vista? E fra Confort e Dynamique?... i cerchi... credo...... I cerchi della nera sono come i miei ed ho una Dynamique. ' massimo.grossi ha scritto: Quale è il particolare che ti fa sapere che è una Luxe a prima vista? E fra Confort e Dynamique?... i cerchi... credo... 'Quale è il particolare che ti fa sapere che è una Luxe a prima vista? E fra Confort e Dynamique?',Mi riferivo all'unica scenic con il frontale girata sulla bisarca ! La luxe ha di serie i cerchi Shara ,,,,,,,,,,,,,,
Volkswagen Up! 2011,https://www.autopareri.com/forums/topic/44234-volkswagen-up-2011?&page=73#comments,2012-01-24 14:43:02,LucioFire,,Semplicemente Fiat non ha messo l'esp di serie per risparmiare...come Vw non ha messo il doppi oalzacristallo la memoria meccanica dei sedili ( cosa che per come la vedo io mi farebbe smoccolare ogni volta ) e le bocchette centrali. Piccolo appunto...la memoria meccanica dei sedili ce l'aveva pure la Uno base base. E la stessa uno ( versione trend...senz anemmeno orologio e accendisigari ) aveva le bocchette anteriori che mandavano solo aria proveniente da fuori ( quindi non riscaldata ) .La cosa era estremamente spiacevole quando era più freddo.E creo lo sarà pure su questa Up ! ,,,,,,,,,,,,,,
Alfa Romeo MiTo (Topic Ufficiale - 2008),https://www.autopareri.com/forums/topic/27704-alfa-romeo-mito-topic-ufficiale-2008?&page=217#comments,2008-04-03 10:32:53,Meg85...,,"allora manda un msg privato alla dirigenze di autop...con titolo ""zona bianca-heritage-peino fiore-offset negativo..."" e spiega perchè dovrebbero scegliere proprio te... ! ...il resto sono pure formalità...al limite ci vediamo direttamente a balocco io dovrei proprio essere selezionato visto il mio curriculm...:lol::b35 ",,,,,,,,,,,,,,
Sarà MAI possibile?,https://forum.quattroruote.it/threads/sar%C3%A0-mai-possibile.106762/page-2,2016-10-27 00:00:00,Suby01,"'Ieri sera ho dovuto fare una frenata a ""vita persa"" per un mio errore di valutazione ottimistica per un sorpasso. La faccio breve mi sono trovato su asfalto liscio e nuovo a passare da 140km/h a 0 nel minor tempo possibile col piede sul freno da rischiare l'integrità del supporto del pedale. A parte la frenat ma al momento in cui mi sono arrestato ho senti un piccolo ""urto"" provenire dal retrotren all'inizio ho pensato ad un tamponament ma dietro non c'era nessun sono sceso e non c'era nessun oggetto a terra. Potrebbe mica essere successo che si sia sollevato il retrotreno in frenata e poi arrestandomi si sia riappoggiato a terra? Altrimenti cosa potrebbe essere?'",impossibile... per arrivare alla massima estensione degli ammo posteriori avrebbe dovuto alzarsi di 30 cm come minimo ,,,,,,,,,,,,,,
Alfa Romeo 159 M.Y. 2011 [Sedan Wagon],https://www.autopareri.com/forums/topic/38285-alfa-romeo-159-my-2011-sedan-wagon?&page=118#comments,2009-11-04 15:41:02,_hainz,,La Toyosubaru ? ? ,,,,,,,,,,,,,,
Che brutta esperienza in BMW,https://www.bmwpassion.com/forum/threads/che-brutta-esperienza-in-bmw.127483/,2009-02-26 00:00:00,SenzaUnaBMW,"'Be in realtà se causano o incorrono in un incidente non credo siano propriamente soltanto cavoli loro. Per esserl infatt dovrebbero uscire su strada (per testare una vettura) esclusivamente con l'esposizione della targa ""PROVA la quale ha una propria e specifica assicurazione; inoltre l'autista dev'essere il legale rappresentante o un suo dipendente munito di SPECIFICA delega scritta a timbro e firma del legale rappresentante. Diversamente l'assicurazione valida ai fini dell'eventuale rimborso e risarcimento è il contraente/titolare della vettur con le ovvie conseguenze che noi tutti conosciamo bene. Nel tuo caso temo non sia andata così. '",Oggi ritiravo la mia auto per sostituzione differenziale + placca volante il primo in garanzia il secondo a carico mio ( 58€ ) chiamo si l'auto è prontaarrivo al conce e manca la placca beh aspetto che la facciano.passa un'ora per un pezzo di plastica.arriva il momento della ricevuta la signorina mi fa sono 2800€ ma no vede che è garanzia e non trovava il foglio di accettazione finalmente lo trova e mi fa si ma ci deve 400€. allorché comincio ad incaxxarmi seriamente. un'altro dipendente spiega che a bmw va addebitato con un certo prezzo insomma per fatti loro perdo un'altra ora con sta cretina che mi voleva fregare 400€.vado in auto e noto con mio grande stupore 9 km di autonomia. io l'avevo consegnata ieri pomeriggio con mezzo pieno.guardo i km della scheda 90136. km sul quadro 90167.ben 30km in più e in questi 30km hanno consumato mezzo pieno quindi se la son fatta a 200. climatizzatore spostato sedile spostato e grasso in alcuni punti.all'inizio l'accettatore mi aveva detto che la macchina è una bomba e che sono andati a 210. pensavo fosse una battuta e avevo sorriso. invece guardando 9 km di autonomia lancetta a 0 ho fatto 2+2 questi si son fatti il giretto spremendomi la macchina.tra l'altro il mio libretto dice che non bisogna mai andare sotto i 50km di autonomia potrebbero esserci danni al motore.allorché mi imbufalisco e chiedo spiegazioni mi dicono che hanno dovuto provarla. si il differenziale mi faceva rumore a 50 in città e loro si son fatti 30km a 200.ditemi voi se avrei dovuto fare uno show o no. dentro di me ero e sono incaxxatissimo se mi fossi sfogato avrebbero dovuto chiamare i carabinieri. ,,,,,,,,,,,,,,
Jaguar XE (2015),https://forum.quattroruote.it/threads/jaguar-xe-2015.96281/,2015-05-26 00:00:00,falcodellastrada,,Io ho avuto modo di vederla al motor show in versione rossa e con il pacchetto sportivo....... Moooolto bella. Diciamo che internamente non mi sembrava molto spartan forse concordo sul fatto che questa era piena zeppa di optional e di rifinitura in legno nero di acero quindi appagava molto gli occhi rispetto a quelle un po' base. Questo forse potrebbe essere un lato negativo se cominci a giocare con gli optional il costo sale. Però io la ritengo una valida alternativa alle solite tedesce..... Inoltre ho sentito parlare molto bene del 180cv Diesel abbinato all'8 marce. Ora grossa incognita cui mai ora qualcuno potrà darci una risposta imminente: affidabilità di questo nuovo motore cambio ed elettronica Speriamo almeno che con la scontistica ci vengano incontro anche se dubito perchè nelle concessionarie continuano ancora a palesare le origini inglesi cosa ormai lontana migliaia di km ( vedi land rover con evolute e disco very ) ,,,,,,,,,,,,,,
Prius4 finalmente arrivata e diario di bordo,https://forum.quattroruote.it/threads/prius4-finalmente-arrivata-e-diario-di-bordo.112301/page-6,2017-10-12 00:00:00,paulein118,,la IS tanta roba ,,,,,,,,,,,,,,
